adID,adText,adSpend,adLP,adImpress,adClicks,adCreation,groups,adLocation_cleaned,adStates,adDate,State
487,Join our rally atFree the patriots stand for liberty and our rights,4364.22,,3335.0,171.0,04/12/16 01 :59:17 AM PDT,Veterans Day or Patriotism,Atlanta Georgia,Georgia,2016-04-12,Georgia
515,Join our rally atFree the patriots stand for liberty and our rights,837.8,,636.0,41.0,04/14/16 04:15:55 AM PDT,Veterans Day or Patriotism,Atlanta Georgia,Georgia,2016-04-14,Georgia
532,Join our rally atFree the patriots stand for liberty and our rights,0.0,,,0.0,04/14/16 04:15:52 AM PDT,Veterans Day or Patriotism,Atlanta Georgia,Georgia,2016-04-14,Georgia
113,,196.27,https://www.facebook.com/blackmattersus/,1468.0,144.0,07/14/15 06:14:06 AM PDT,Black Matters  s                                      Black Matters,Baltimore Maryland Missouri Cleveland Ohio,Maryland Missouri Ohio,2015-07-14,Maryland
113,,196.27,https://www.facebook.com/blackmattersus/,1468.0,144.0,07/14/15 06:14:06 AM PDT,Black Matters  s                                      Black Matters,Baltimore Maryland Missouri Cleveland Ohio,Maryland Missouri Ohio,2015-07-14,Missouri
113,,196.27,https://www.facebook.com/blackmattersus/,1468.0,144.0,07/14/15 06:14:06 AM PDT,Black Matters  s                                      Black Matters,Baltimore Maryland Missouri Cleveland Ohio,Maryland Missouri Ohio,2015-07-14,Ohio
311,,5.47,https://www.facebook.com/blackmattersus/,8.0,1.0,02/12/16 07:00:28 AM PST,Black Matters  s                                      Black Matters,New York,New York,2016-02-12,New York
318,,253.53,https://www.facebook.com/Black-Matters-1579673598947501/,1331.0,90.0,07/16/15 02:22:53 AM PDT,Black Matters  s                                      Black Matters,Baltimore Maryland Missouri Cleveland Ohio,Maryland Missouri Ohio,2015-07-16,Maryland
318,,253.53,https://www.facebook.com/Black-Matters-1579673598947501/,1331.0,90.0,07/16/15 02:22:53 AM PDT,Black Matters  s                                      Black Matters,Baltimore Maryland Missouri Cleveland Ohio,Maryland Missouri Ohio,2015-07-16,Missouri
318,,253.53,https://www.facebook.com/Black-Matters-1579673598947501/,1331.0,90.0,07/16/15 02:22:53 AM PDT,Black Matters  s                                      Black Matters,Baltimore Maryland Missouri Cleveland Ohio,Maryland Missouri Ohio,2015-07-16,Ohio
486,Join our rally atFree the patriots stand for liberty and our rights,821.33,,560.0,39.0,04/14/16 04:15:57 AM PDT,Veterans Day or Patriotism,Atlanta Georgia,Georgia,2016-04-14,Georgia
496,Stand for the people not the government Join our rally at Georgia,173.93,,132.0,7.0,04/13/16 03:24:00 AM PDT,Independence or Patriotism,Atlanta Georgia,Georgia,2016-04-13,Georgia
1239,,5000.0,https://www.facebook.com/blacktivists/,9778.0,1179.0,02/18/16 05:33:23 AM PST,BlackNewscom or HuffPost Black Voices                                        African American US,New York,New York,2016-02-18,New York
1678,,2500.0,https://www.facebook.com/MuslimAmerica/,4869.0,330.0,03/11/16 07:26:06 AM PST,Islamism Glossary of Islam Sharia or Hijra Islam,New York,New York,2016-03-11,New York
1238,"Be a blactivist Join the We all know that black communities and Natives have always been plagued
by an array of issues that we have to deal on a daily basis Watching
Americas reaction to racism is very telling Last year police brutality and
racism have made it t the forefront Hundreds of unarmed black men and
women died at the hands of police officers
We are tired to feel neglected and ignored We all have had enough And now
we need to come together be honest and get the governments attention
We do not expect you to solve generations of inequality and oppression
overnight We do however expect you to come and to address the issues
and put forward a plan to make change",0.0,https://www.facebook.com/blacktivists/,0.0,0.0,02/18/16 05:30:07 AM PST,Black Tea Patriots Black Knowledge BlackNewscom BEING                                   BLACK or HuffPost Black Voices,New York,New York,2016-02-18,New York
3362,Dont miss the opportunity to train with our coach You will enjoy it for sure Its free Organized on a donation basis Free Selfdefense classes in Tampa FL,0.0,,0.0,0.0,03/21 /17 08:20: 13 AM PDT,Mixed martial arts Martial arts The Womens                                   Self Defense Institute PERSOL  HOME DEFENSE Selfdefense Self                                   defense United States Personal Defense Right of selfdefense Self                                   Defense Family or Active Self Protection                                       Martin Luther King Jr PanAfricanism                                   Black Power African American Black history Black Panther Party African                                   American culture AfricanAmerican Civil Rights Movement  Black                                   History Month AfricanAmerican history Angela Davis Malcolm X or Black                                   Color,New York,New York,,New York
5,WHERE is your VOICE,3714.15,https://www.facebook.com/GovSpending-1651761351759857/,29786.0,201.0,06/15/16 03:39:52 AM PDT,Understanding racial segregation in the united                                          states American Black Film Festival Cop Block or HuffPost Black Voices                                             African American US Field of study AfricanAmerican history                                          Politics Likely to engage with political content liberal,Georgia,Georgia,2016-06-15,Georgia
32,Heritage not hate yall Our flag has nothing to do with racism The FederalGovernment shouldnt be able to dictate what we can and cannot do Gofollow Confederate pageon lnstagram south united if you are proud of oursouthern heritage God bless Dixie Confederate pageon lnstagram Noracism no hate The south will rise againSouth United GovSpending,3.0,https://www.instagram.com/south_united/,12727.0,375.0,08/18/16 08:31 :16 AM PDT,Confederate Flag Flags of the Confederate                                          States of America confederate states america United Daughters of the                                          Confederacy Confederate States of America Sons of Confederate Veterans                                          Confederate States Army Robert E Lee Southern United States or Redneck                                          Social Club,Alabama Arkansas Florida Georgia Louisiana Mississippi North Carolina South Tennessee Texas Virginia,Alabama Arkansas Florida Georgia Louisiana Mississippi North Carolina Tennessee Texas Virginia,2016-08-18,Alabama
32,Heritage not hate yall Our flag has nothing to do with racism The FederalGovernment shouldnt be able to dictate what we can and cannot do Gofollow Confederate pageon lnstagram south united if you are proud of oursouthern heritage God bless Dixie Confederate pageon lnstagram Noracism no hate The south will rise againSouth United GovSpending,3.0,https://www.instagram.com/south_united/,12727.0,375.0,08/18/16 08:31 :16 AM PDT,Confederate Flag Flags of the Confederate                                          States of America confederate states america United Daughters of the                                          Confederacy Confederate States of America Sons of Confederate Veterans                                          Confederate States Army Robert E Lee Southern United States or Redneck                                          Social Club,Alabama Arkansas Florida Georgia Louisiana Mississippi North Carolina South Tennessee Texas Virginia,Alabama Arkansas Florida Georgia Louisiana Mississippi North Carolina Tennessee Texas Virginia,2016-08-18,Arkansas
32,Heritage not hate yall Our flag has nothing to do with racism The FederalGovernment shouldnt be able to dictate what we can and cannot do Gofollow Confederate pageon lnstagram south united if you are proud of oursouthern heritage God bless Dixie Confederate pageon lnstagram Noracism no hate The south will rise againSouth United GovSpending,3.0,https://www.instagram.com/south_united/,12727.0,375.0,08/18/16 08:31 :16 AM PDT,Confederate Flag Flags of the Confederate                                          States of America confederate states america United Daughters of the                                          Confederacy Confederate States of America Sons of Confederate Veterans                                          Confederate States Army Robert E Lee Southern United States or Redneck                                          Social Club,Alabama Arkansas Florida Georgia Louisiana Mississippi North Carolina South Tennessee Texas Virginia,Alabama Arkansas Florida Georgia Louisiana Mississippi North Carolina Tennessee Texas Virginia,2016-08-18,Florida
32,Heritage not hate yall Our flag has nothing to do with racism The FederalGovernment shouldnt be able to dictate what we can and cannot do Gofollow Confederate pageon lnstagram south united if you are proud of oursouthern heritage God bless Dixie Confederate pageon lnstagram Noracism no hate The south will rise againSouth United GovSpending,3.0,https://www.instagram.com/south_united/,12727.0,375.0,08/18/16 08:31 :16 AM PDT,Confederate Flag Flags of the Confederate                                          States of America confederate states america United Daughters of the                                          Confederacy Confederate States of America Sons of Confederate Veterans                                          Confederate States Army Robert E Lee Southern United States or Redneck                                          Social Club,Alabama Arkansas Florida Georgia Louisiana Mississippi North Carolina South Tennessee Texas Virginia,Alabama Arkansas Florida Georgia Louisiana Mississippi North Carolina Tennessee Texas Virginia,2016-08-18,Georgia
32,Heritage not hate yall Our flag has nothing to do with racism The FederalGovernment shouldnt be able to dictate what we can and cannot do Gofollow Confederate pageon lnstagram south united if you are proud of oursouthern heritage God bless Dixie Confederate pageon lnstagram Noracism no hate The south will rise againSouth United GovSpending,3.0,https://www.instagram.com/south_united/,12727.0,375.0,08/18/16 08:31 :16 AM PDT,Confederate Flag Flags of the Confederate                                          States of America confederate states america United Daughters of the                                          Confederacy Confederate States of America Sons of Confederate Veterans                                          Confederate States Army Robert E Lee Southern United States or Redneck                                          Social Club,Alabama Arkansas Florida Georgia Louisiana Mississippi North Carolina South Tennessee Texas Virginia,Alabama Arkansas Florida Georgia Louisiana Mississippi North Carolina Tennessee Texas Virginia,2016-08-18,Louisiana
32,Heritage not hate yall Our flag has nothing to do with racism The FederalGovernment shouldnt be able to dictate what we can and cannot do Gofollow Confederate pageon lnstagram south united if you are proud of oursouthern heritage God bless Dixie Confederate pageon lnstagram Noracism no hate The south will rise againSouth United GovSpending,3.0,https://www.instagram.com/south_united/,12727.0,375.0,08/18/16 08:31 :16 AM PDT,Confederate Flag Flags of the Confederate                                          States of America confederate states america United Daughters of the                                          Confederacy Confederate States of America Sons of Confederate Veterans                                          Confederate States Army Robert E Lee Southern United States or Redneck                                          Social Club,Alabama Arkansas Florida Georgia Louisiana Mississippi North Carolina South Tennessee Texas Virginia,Alabama Arkansas Florida Georgia Louisiana Mississippi North Carolina Tennessee Texas Virginia,2016-08-18,Mississippi
32,Heritage not hate yall Our flag has nothing to do with racism The FederalGovernment shouldnt be able to dictate what we can and cannot do Gofollow Confederate pageon lnstagram south united if you are proud of oursouthern heritage God bless Dixie Confederate pageon lnstagram Noracism no hate The south will rise againSouth United GovSpending,3.0,https://www.instagram.com/south_united/,12727.0,375.0,08/18/16 08:31 :16 AM PDT,Confederate Flag Flags of the Confederate                                          States of America confederate states america United Daughters of the                                          Confederacy Confederate States of America Sons of Confederate Veterans                                          Confederate States Army Robert E Lee Southern United States or Redneck                                          Social Club,Alabama Arkansas Florida Georgia Louisiana Mississippi North Carolina South Tennessee Texas Virginia,Alabama Arkansas Florida Georgia Louisiana Mississippi North Carolina Tennessee Texas Virginia,2016-08-18,North Carolina
32,Heritage not hate yall Our flag has nothing to do with racism The FederalGovernment shouldnt be able to dictate what we can and cannot do Gofollow Confederate pageon lnstagram south united if you are proud of oursouthern heritage God bless Dixie Confederate pageon lnstagram Noracism no hate The south will rise againSouth United GovSpending,3.0,https://www.instagram.com/south_united/,12727.0,375.0,08/18/16 08:31 :16 AM PDT,Confederate Flag Flags of the Confederate                                          States of America confederate states america United Daughters of the                                          Confederacy Confederate States of America Sons of Confederate Veterans                                          Confederate States Army Robert E Lee Southern United States or Redneck                                          Social Club,Alabama Arkansas Florida Georgia Louisiana Mississippi North Carolina South Tennessee Texas Virginia,Alabama Arkansas Florida Georgia Louisiana Mississippi North Carolina Tennessee Texas Virginia,2016-08-18,Tennessee
32,Heritage not hate yall Our flag has nothing to do with racism The FederalGovernment shouldnt be able to dictate what we can and cannot do Gofollow Confederate pageon lnstagram south united if you are proud of oursouthern heritage God bless Dixie Confederate pageon lnstagram Noracism no hate The south will rise againSouth United GovSpending,3.0,https://www.instagram.com/south_united/,12727.0,375.0,08/18/16 08:31 :16 AM PDT,Confederate Flag Flags of the Confederate                                          States of America confederate states america United Daughters of the                                          Confederacy Confederate States of America Sons of Confederate Veterans                                          Confederate States Army Robert E Lee Southern United States or Redneck                                          Social Club,Alabama Arkansas Florida Georgia Louisiana Mississippi North Carolina South Tennessee Texas Virginia,Alabama Arkansas Florida Georgia Louisiana Mississippi North Carolina Tennessee Texas Virginia,2016-08-18,Texas
32,Heritage not hate yall Our flag has nothing to do with racism The FederalGovernment shouldnt be able to dictate what we can and cannot do Gofollow Confederate pageon lnstagram south united if you are proud of oursouthern heritage God bless Dixie Confederate pageon lnstagram Noracism no hate The south will rise againSouth United GovSpending,3.0,https://www.instagram.com/south_united/,12727.0,375.0,08/18/16 08:31 :16 AM PDT,Confederate Flag Flags of the Confederate                                          States of America confederate states america United Daughters of the                                          Confederacy Confederate States of America Sons of Confederate Veterans                                          Confederate States Army Robert E Lee Southern United States or Redneck                                          Social Club,Alabama Arkansas Florida Georgia Louisiana Mississippi North Carolina South Tennessee Texas Virginia,Alabama Arkansas Florida Georgia Louisiana Mississippi North Carolina Tennessee Texas Virginia,2016-08-18,Virginia
42,If we ever forget that we are One Nation Under God then we will be a nationgone under Ronald Reagan,6015.85,https://www.facebook.com/Bat-240131319678646/,22608.0,266.0,06/15/16 04:02:09 AM PDT,Politics US politics conservative US politics very                                          conservative or Likely to engage with political content conservative,Ohio Tennessee Virginia,Ohio Tennessee Virginia,2016-06-15,Ohio
42,If we ever forget that we are One Nation Under God then we will be a nationgone under Ronald Reagan,6015.85,https://www.facebook.com/Bat-240131319678646/,22608.0,266.0,06/15/16 04:02:09 AM PDT,Politics US politics conservative US politics very                                          conservative or Likely to engage with political content conservative,Ohio Tennessee Virginia,Ohio Tennessee Virginia,2016-06-15,Tennessee
42,If we ever forget that we are One Nation Under God then we will be a nationgone under Ronald Reagan,6015.85,https://www.facebook.com/Bat-240131319678646/,22608.0,266.0,06/15/16 04:02:09 AM PDT,Politics US politics conservative US politics very                                          conservative or Likely to engage with political content conservative,Ohio Tennessee Virginia,Ohio Tennessee Virginia,2016-06-15,Virginia
272,Chicago researchers believe a few minutes of meditation may be a solution todealing with stress problems for black students Researchers at the EriksonInstitute in Chicago are carrying out a yearstudy to determine whethersitting down for few minutes with legs crossed each other a New StudyMeditation May Help Black Students Cope With Stress I Black Matters BlackMatters,90.73,https://www.facebook.com/Black-Matters-1579673598947501/,90.0,6.0,05/23/16 08:06:37 AM PDT,,Detroit Michigan,Michigan,2016-05-23,Michigan
374,Join us because we care Black matters,44.87,https://www.facebook.com/Black-Matters-1579673598947501/,137.0,0.0,06/10/15 02:59:53 AM PDT,people who like Black Matters,Baltimore Maryland Missouri,Maryland Missouri,2015-06-10,Maryland
374,Join us because we care Black matters,44.87,https://www.facebook.com/Black-Matters-1579673598947501/,137.0,0.0,06/10/15 02:59:53 AM PDT,people who like Black Matters,Baltimore Maryland Missouri,Maryland Missouri,2015-06-10,Missouri
418,Whats life of black American today How equal are weHave you ever been hurt by aggressive police officers because of your raceWhats your storyTake an action and tell us your story and we post it on Black Matters Wedont want our community to continue struggling with racism and policeaggression We want to fight back and to show how strong we are,0.0,https://www.facebook.com/Black-Matters-1579673598947501/,0.0,0.0,07/08/15 07:23:45 AM PDT,Black Matters  s                                            Black Matters,Baltimore Maryland Missouri Cleveland Ohio,Maryland Missouri Ohio,2015-07-08,Maryland
418,Whats life of black American today How equal are weHave you ever been hurt by aggressive police officers because of your raceWhats your storyTake an action and tell us your story and we post it on Black Matters Wedont want our community to continue struggling with racism and policeaggression We want to fight back and to show how strong we are,0.0,https://www.facebook.com/Black-Matters-1579673598947501/,0.0,0.0,07/08/15 07:23:45 AM PDT,Black Matters  s                                            Black Matters,Baltimore Maryland Missouri Cleveland Ohio,Maryland Missouri Ohio,2015-07-08,Missouri
418,Whats life of black American today How equal are weHave you ever been hurt by aggressive police officers because of your raceWhats your storyTake an action and tell us your story and we post it on Black Matters Wedont want our community to continue struggling with racism and policeaggression We want to fight back and to show how strong we are,0.0,https://www.facebook.com/Black-Matters-1579673598947501/,0.0,0.0,07/08/15 07:23:45 AM PDT,Black Matters  s                                            Black Matters,Baltimore Maryland Missouri Cleveland Ohio,Maryland Missouri Ohio,2015-07-08,Ohio
441,Its time for THE PEOPLE to stand for Constitutional rights Join,24.95,,15.0,0.0,04/13/16 03:23:03 AM PDT,Independence or Patriotism,Atlanta Georgia,Georgia,2016-04-13,Georgia
462,Join the Crusade against Federal tyranny Protect the Constitution,48.63,,60.0,1.0,04/13/16 03:24:25 AM PDT,Independence or Patriotism,Atlanta Georgia,Georgia,2016-04-13,Georgia
463,Join the Crusade against Federal tyranny Protect the Constitution,11.24,,14.0,0.0,04/13/16 03:24:30 AM PDT,Independence or Patriotism,Atlanta Georgia,Georgia,2016-04-13,Georgia
467,America has always been hinged on hardworking people If you remove jobsyoull remove our country from the world map The state of Pennsylvaniarose owing to multiple enterprises mining coal producing steel and creatingthe need for other jobs groceries doctors dentists insurance gas vehiclesmechanics and the list goes on As far as Mr Trump pursues the goal ofcreating more jobs and supports the working class He said he would putminers back to work We could help Mr Trump win Pennsylvania which is abattleground state Wed like to organize a rally Miners for Trump inPennsylvaniaHave something against coal industries Please note then that burning coal isnot more harmful than lumber Alternative energy is only possible whensubsidized by government for it is not lucrative You cannot leave tens ofthousands of people without a job just because of lobbyists interestsThe current list of locations is being elaborated Suggested cities are EriePittsburg Scranton Harrisburg Allentown and PhillyConfirmed locationsMarconi Plaza Philadelphia Miners for Trump Unity day in Pennsylvania,2.96,https://www.facebook.com/events/312522819127036/,2.0,0.0,09/22/16 05:01:05 AM PDT,,New York,New York,2016-09-22,New York
468,America has always been hinged on hardworking people If you remove jobsyoull remove our country from the world map The state of Pennsylvaniarose owing to multiple enterprises mining coal producing steel and creatingthe need for other jobs groceries doctors dentists insurance gas vehiclesmechanics and the list goes on As far as Mr Trump pursues the goal ofcreating more jobs and supports the working class He said he would putminers back to work We could help Mr Trump win Pennsylvania which is abattleground state Wed like to organize a rally Miners for Trump inPennsylvaniaHave something against coal industries Please note then that burning coal isnot more harmful than lumber Alternative energy is only possible whensubsidized by government for it is not lucrative You cannot leave tens ofthousands of people without a job just because of lobbyists interestsThe current list of locations is being elaborated Suggested cities are EriePittsburg Scranton Harrisburg Allentown and PhillyConfirmed locationsMarconi Plaza Philadelphia Miners for Trump Unity day in Pennsylvania,0.0,https://www.facebook.com/events/312522819127036/,0.0,0.0,09/22/16 05:09:05 AM PDT,Donald Trump for President   Coal                                           Miner,Pennsylvania,Pennsylvania,2016-09-22,Pennsylvania
469,America has always been hinged on hardworking people If you remove jobsyoull remove our country from the world map The state of Pennsylvaniarose owing to multiple enterprises mining coal producing steel and creatingthe need for other jobs groceries doctors dentists insurance gas vehiclesmechanics and the list goes on As far as Mr Trump pursues the goal ofcreating more jobs and supports the working class He said he would putminers back to work We could help Mr Trump win Pennsylvania which is abattleground state Wed like to organize a rally Miners for Trump inPennsylvaniaHave something against coal industries Please note then that burning coal isnot more harmful than lumber Alternative energy is only possible whensubsidized by government for it is not lucrative You cannot leave tens ofthousands of people without a job just because of lobbyists interestsThe current list of locations is being elaborated Suggested cities are EriePittsburg Scranton Harrisburg Allentown and PhillyConfirmed locationsMarconi Plaza Philadelphia Miners for Trump Unity day in Pennsylvania,876.44,https://www.facebook.com/events/312522819127036/,1225.0,77.0,09/22/16 05:13:54 AM PDT,Donald Trump for President   Coal                                           Miner,Allen Erie Harrisburg Philadelphia Pittsburg Scranton Pennsylvania,Pennsylvania,2016-09-22,Pennsylvania
470,America has always been hinged on hardworking people If you remove jobsyoull remove our country from the world map The state of Pennsylvaniarose owing to multiple enterprises mining coal producing steel and creatingthe need for other jobs groceries doctors dentists insurance gas vehiclesmechanics and the list goes on As far as Mr Trump pursues the goal ofcreating more jobs and supports the working class He said he would putminers back to work We could help Mr Trump win Pennsylvania which is abattleground state Wed like to organize a rally Miners for Trump inPennsylvaniaHave something against coal industries Please note then that burning coal isnot more harmful than lumber Alternative energy is only possible whensubsidized by government for it is not lucrative You cannot leave tens ofthousands of people without a job just because of lobbyists interestsThe current list of locations is being elaborated Suggested cities are EriePittsburg Scranton Harrisburg Allentown and PhillyConfirmed locationsMarconi Plaza Philadelphia Miners for Trump Unity day in Pennsylvania,7120.6,https://www.facebook.com/events/312522819127036/,7282.0,457.0,09/23/16 02:42:16 AM PDT,Donald Trump Manufacturing Donald Trump                                          for President or conservative daily   Coal Miner,Philadelphia Pittsburg Pennsylvania,Pennsylvania,2016-09-23,Pennsylvania
472,Donald John Trump was elected the th president of the United States onTuesday Today some massive crowds of libtards marched in NYC againstelection of Donald TrumpCome to Trump Tower th Aveon Saturday to show Mr Trump thereactually ARE people in NY who voted for him Support Trump in NYC,0.0,https://www.facebook.com/events/365162297165103/,0.0,0.0,11/10/16 04:41:38 AM PST,,New York,New York,2016-11-10,New York
473,Donald John Trump was elected the th president of the United States onTuesday Today some massive crowds of libtards marched in NYC againstelection of Donald TrumpCome to Trump Tower th Aveon Saturday to show Mr Trump thereactually ARE people in NY who voted for him Support Trump in NYC,0.0,https://www.facebook.com/events/365162297165103/,0.0,0.0,11/10/16 04:44:36 AM PST,,New York,New York,2016-11-10,New York
474,Donald John Trump was elected the th president of the United States onTuesday Today some massive crowds of libtards marched in NYC againstelection of Donald TrumpCome to Trump Tower th Aveon Saturday to show Mr Trump thereactually ARE people in NY who voted for him Support Trump in NYC,0.6,https://www.facebook.com/events/365162297165103/,1.0,0.0,11/10/16 04:50:28 AM PST,,New York,New York,2016-11-10,New York
475,Donald John Trump was elected the th president of the United States onTuesday Today some massive crowds of libtards marched in NYC againstelection of Donald TrumpCome to Trump Tower th Aveon Saturday to show Mr Trump thereactually ARE people in NY who voted for him Support Trump in NYC,1999.4,https://www.facebook.com/events/365162297165103/,4171.0,551.0,11/10/16 05:00:07 AM PST,people who like Being Patriotic,New York,New York,2016-11-10,New York
476,We insist over and over again Black Lives Matter is a radical hate group andits violent actions must be stopped And were glad to know that our policeofficials are on our side on that issue,500.0,https://www.facebook.com/Being-Patriotic-1601685693432389/,3001.0,204.0,07/14/16 01:35:03 AM PDT,Donald Trump Donald Trump for President or Donald Trump Jr,New York,New York,2016-07-14,New York
483,Its time for THE PEOPLE to stand for Constitutional rights Join II,84.01,,60.0,3.0,04/13/16 03:22:57 AM PDT,Independence or Patriotism,Atlanta Georgia,Georgia,2016-04-13,Georgia
493,Stand for the people not the Government Join the rally in Atlanta,148.73,,94.0,4.0,04/13/16 03:24:03 AM PDT,Independence or Patriotism,Atlanta Georgia,Georgia,2016-04-13,Georgia
501,Stop federal overreach Stand for the patriots in a protest rally in AtlantaGA,108.14,,78.0,3.0,04/13/16 03:23:39 AM PDT,Independence or Patriotism,Atlanta Georgia,Georgia,2016-04-13,Georgia
533,Stop federal overreach Stand for the patriots in a protest rally in AtlantaGA,4.41,,6.0,0.0,04/13/16 03:23:45 AM PDT,Independence or Patriotism,Atlanta Georgia,Georgia,2016-04-13,Georgia
535,Join the Crusade against Federal tyranny Protect the ConstitutionAtlanta,88.55,,88.0,6.0,04/13/16 03:24:29 AM PDT,Independence or Patriotism,Atlanta Georgia,Georgia,2016-04-13,Georgia
536,Its time for THE PEOPLE to stand for Constitutional rights Join II,2.23,,4.0,0.0,04/13/16 03:23:02 AM PDT,Independence or Patriotism,Atlanta Georgia,Georgia,2016-04-13,Georgia
564,Westboro baptist church is planning to stand against tolerance in educationsystem near LG God Hs Bigots Rally,670.15,https://www.facebook.com/events/533144703560571/,1495.0,73.0,05/11 /16 07: 19:33 AM PDT,LGBT rights by country or territory Lesbian community LGBT                                          community or Samesex marriage,Kansas,Kansas,,Kansas
566,Westboro baptist church is planning to stand against tolerance in educationsystem near LG Westboro Baptist Church counter protest,3319.9,https://www.facebook.com/events/533144703560571/,,318.0,05/16/16 07:50:43 AM PDT,Rainbow flag LGBT movement LGBT rights                                          by country or territory Gay Rights Lesbian community LGBT community                                          LGBT Equality Samesex marriage in the United States Samesex marriage                                          or LGBT social movements,Kansas,Kansas,2016-05-16,Kansas
567,Westboro baptist church is planning to stand against tolerance in educationsystem near LG Westboro Baptist Church counter protest,5069.71,https://www.facebook.com/events/533144703560571/,9372.0,373.0,05/18/16 12:13:06 AM PDT,LGBT community,Kansas,Kansas,2016-05-18,Kansas
594,Is here anyone from Glendale Arizona WE NEED YOU HELP US to protectthe memory of the victims of hateLast week on Friday May Kieu and Dorothy Dutiel both yearoldsophomores at Independence High School in Glendale each died of a singlegunshot wound aboutam just outside the schools cafeteria The girlswere a couple Police are calling it a murdersuicide This heartbreakingincident is all over the news and the comments are disgusting Homophobesuse the incident as a proof that love is a sinThis is just ignorance Two children died and people are grieving How wouldyou feel if strangers came to your neighborhood or your school to push theiragenda These people are just aggravating the situation and traumatizingother KIDSIf you live in Glendale Arizona please come and support us todayNth AveGlendale AZLETS STAND UP AGAINST BIGOTRY If youare not from Glendale please SHARE this post Let people know we supportthemPS please send us photos from the event,856.29,https://www.facebook.com/Igbtun/,4189.0,679.0,02/18/16 06:40:45 AM PST,Bisexuality Lesbian community LGBT culture LGBT community                                          Transgenderism or Human Sexuality,Glendale Arizona,Arizona,2016-02-18,Arizona
630,HUMAN RIGHTS PHOTO CHALLENGEDespite our race religion gender age education sexual orientation andbeliefs we are all HUMANSIn the midst of the presidential race all what politicians dream about ismoney They keep giving empty promises in order to win votes And this isour friendly reminder for the candidates we are the ones who elect them Wedont deserve having problems with employment marriage child birth etcWe all deserve the right to be acceptedGo for it Clicking the like button is not enoughIf you want to attract the candidates attention to the fight for human rights dothe followingTake a picture with Campaign HUMAN RIGHTS logo state requiredPost it in comments within a weekShare with your friendsFor the first placesecond placethird place,7.8,https://www .facebook.com/LGBT-United-839497 472793277 I,14.0,2.0,03/22/16 07: 19:51 AM PDT,LGBT United  s                                            LGBT United,Glendale Arizona,Arizona,2016-03-22,Arizona
631,Is here anyone from Glendale Arizona WE NEED YOU HELP US to protectthe memory of the victims of hateLast week on Friday May Kieu and Dorothy Dutiel both yearoldsophomores at Independence High School in Glendale each died of a singlegunshot wound aboutam just outside the schools cafeteria The girlswere a couple Police are calling it a murdersuicide This heartbreakingincident is all over the news and the comments are disgusting Homophobesuse the incident as a proof that homo love is a sinThis is just ignorance Two children died and people are grieving How wouldyou feel if strangers came to your neighborhood or your school to push theiragenda These assholes are just aggravating the situation and traumatizingother KIDSIf you live in Glendale Arizona please come and support us todayNth AveGlendale AZLETS STAND UP AGAINST BIGOTRY If youare not from Glendale please SHARE this post Let people know we supportthemPS please send us photos from the event,0.0,https://www.facebook.com/Igbtun/,0.0,0.0,02/18/16 05:41:28 AM PST,Bisexuality Lesbian community LGBT culture LGBT community                                          Transgenderism or Human Sexuality,Glendale Arizona,Arizona,2016-02-18,Arizona
632,Is here anyone from Glendale Arizona WE NEED YOU HELP US to protectthe memory of the victims of hateLast week on Friday May Kieu and Dorothy Dutiel both yearoldsophomores at Independence High School in Glendale each died of a singlegunshot wound aboutam just outside the schools cafeteria The girlswere a couple Police are calling it a murdersuicide This heartbreakingincident is all over the news and the comments are disgusting Homophobesuse the incident as a proof that homo love is a sinThis is just ignorance Two children died and people are grieving How wouldyou feel if strangers came to your neighborhood or your school to push theiragenda These assholes are just aggravating the situation and traumatizingother KIDSIf you live in Glendale Arizona please come and support us todayNth Ave Glendale AZLETS STAND UP AGAINST BIGOTRY If youare not from Glendale please SHARE this post Let people know we supportthemPS please send us photos from the event,0.0,https://www.facebook.com/lgbtun/,0.0,0.0,02/18/16 05:42:24 AM PST,Bisexuality Lesbian community LGBT culture                                          LGBT community Transgenderism or Human Sexuality,Glendale Arizona,Arizona,2016-02-18,Arizona
700,After what happened in Dallas ordinary Texans did not remain indifferentSeveral men armed with AR went to the Splendora Police Department andstood guarding the building Yall should do the same thingwe must protectour cops We wont let some gangsters attack the people who keep oursecurityIf this is a war against policewere joining this war on the cops side,500.0,https://www.facebook.com/Heart-of-Texas-761114847343674/,5401.0,1501.0,07/14/16 12:54:34 AM PDT,people who like Heart of Texas,Texas,Texas,2016-07-14,Texas
724,Fellow Texans Its time to say a strong NO to the establishment robbers It isunacceptable for us to see them ruin all weve been building for decades Forcenturies The establishment thinks they can treat us like stupid sheep butthey are wrong We wont put up with this anymore The corrupt media doesnot talk about the crimes committed by Killary Rotten Clinton neither does itmention the leaked emails but it would rather keep on kicking around someoutdated tapes featuring Trump Even Republicans are now offering her avictory by renouncing their nominee What is this if not treason No no noWe are free citizens of Texas and weve had enough of this cheap show onthe screen Were ready to prove our commitment to liberty low taxes andgun rights If Trump wins there will be a possibility to secede peacefully butnot without tension What will happen if Hitlery becomes President Highertaxes to feed undocumented aliens More refugees mosques and terroristattacks Banned guns Continuing economic depression Lets remind themwhat Texas is made of and show that were ready to SECEDEUse our page to team up with other locals Invite your friends and familyspread the word and lets make this effort together Get Ready to Secede,3200.0,https://www.facebook.com/events/1828560880690663/,16168.0,2342.0,10/26/16 04:07:29 AM PDT,,Texas,Texas,2016-10-26,Texas
725,Fellow Texans Its time to say a strong NO to the establishment robbers It isunacceptable for us to see them ruin all weve been building for decades Forcenturies The establishment thinks they can treat us like stupid sheep butthey are wrong We wont put up with this anymore The corrupt media doesnot talk about the crimes committed by Killary Rotten Clinton neither does itmention the leaked emails but it would rather keep on kicking around someoutdated tapes featuring Trump Even Republicans are now offering her avictory by renouncing their nominee What is this if not treason No no noWe are free citizens of Texas and weve had enough of this cheap show onthe screen Were ready to prove our commitment to liberty low taxes andgun rights If Trump wins there will be a possibility to secede peacefully butnot without tension What will happen if Hitlery becomes President Highertaxes to feed undocumented aliens More refugees mosques and terroristattacks Banned guns Continuing economic depression Lets remind themwhat Texas is made of and show that were ready to SECEDEUse our page to team up with other locals Invite your friends and familyspread the word and lets make this effort together Get Ready to Secede,4386.32,https://www.facebook.com/events/1828560880690663/,17334.0,1807.0,11 /02/16 05: 16:25 AM PDT,people who are going to Get Ready to                                          Secede,Abilene Amarillo Austin Beaumont Bryan Conroe Corpus Christi Dallas Fort Worth Houston Lubbock Odessa San Angelo Antonio Temple Texas City Tyler Waco,Texas,,Texas
726,Fellow Texans Its time to say a strong NO to the establishment robbers It isunacceptable for us to see them ruin all weve been building for decades Forcenturies The establishment thinks they can treat us like stupid sheep butthey are wrong We wont put up with this anymore The corrupt media doesnot talk about the crimes committed by Killary Rotten Clinton neither does itmention the leaked emails but it would rather keep on kicking around someoutdated tapes featuring Trump Even Republicans are now offering her avictory by renouncing their nominee What is this if not treason No no noWe are free citizens of Texas and weve had enough of this cheap show onthe screen Were ready to prove our commitment to liberty low taxes andgun rights If Trump wins there will be a possibility to secede peacefully butnot without tension What will happen if Hitlery becomes President Highertaxes to feed undocumented aliens More refugees mosques and terroristattacks Banned guns Continuing economic depression Lets remind themwhat Texas is made of and show that were ready to SECEDEUse our page to team up with other locals Invite your friends and familyspread the word and lets make this effort together Get Ready to Secede,627.68,https://www.facebook.com/events/1828560880690663/,2897.0,225.0,11/03/16 07:56:02 AM PDT,people who are going to Get Ready to                                          Secede,Abilene Amarillo Austin Beaumont Bryan Conroe Corpus Christi Dallas Fort Worth Houston Lubbock Odessa San Angelo Antonio Temple Texas City Tyler Waco,Texas,2016-11-03,Texas
1091,Go well beyond profiling,0.0,https://www.facebook.com/Blacktivist-12837154 7 505950/,,,05/11/16 05:07:07 AM PDT,Multicultural Affinity African American US,Baltimore Maryland,Maryland,2016-05-11,Maryland
1236,White people do not want to be killed and terrorized by police neither doblacks This is called injustice,0.74,https://www.facebook.com/Blacktivist-128371547505950/,3.0,0.0,05/11/16 05:00:55 AM PDT,Multicultural Affinity African American US,Baltimore Maryland,Maryland,2016-05-11,Maryland
1251,Americalnstotus,0.0,https://instagram.com/black_america_news,0.0,0.0,10/09/15 05: 50:41 AM PDT,Politics or Politics and social issues,Washington Columbia,Washington Columbia,2015-10-09,Washington D.C.
1252,Americalnstotus,0.0,https://instagram.com/black_america_news,,,10/09/15 08:04:33 AM PDT,Politics or Politics and social issues,Washington Columbia,Washington Columbia,2015-10-09,Washington D.C.
1261,If you dont want refugees stop creating them Hands off SyriaPlease come out to support us on June rd in front of Trump Tower in NewYork We must stop this madness Some believed Trump would withdraw theUS from useless and bloody military campaigns But what we see is only theenhancement of hostility We dont need wars no more We want peace Itstime for politicians to take care of the US residents instead of fating them aswell as other nationals to deathWere organizing a peaceful gathering to draw public attention to the abovementioned terrible problem Our President and Congress must listen to thosewho granted them powerus the people If you also think that there shouldonly be peace come with us and lets make it happenStop war Stop killing the innocent Make peace not war Make peace notwar,2105.19,https://www.facebook.com/events/239129926564203/,5456.0,256.0,05/26/17 02:05:30 AM PDT,people who like United Muslims of America   Civil and political rights Human rights                                          Anarchism Nonviolence Stop the War Coalition Antifascism Pacifism                                          Peace movement The Anarchy World peace Antiwar movement Feminism                                          PeaceOnEarth or Be a Peacekeeper  The World Peacekeepers Movement                                            Politics Likely to engage with political content liberal,New York,New York,2017-05-26,New York
1429,Stop police terror with us Joinneed to unite,8449.32,,,294.0,04/12/16 03:08:57 AM PDT,,San Francisco California,California,2016-04-12,California
1621,Who is ready to do the same in any public place during the weekendsWe really need to stop Islamophobia and the fear of Muslims and changethat false image about us its everybodys duty,500.0,https://www.facebook.com/MuslimAmerica/,1640.0,213.0,03/17/16 04:22:59 AM PDT,United Muslims of America Friends of                                          connections   United Muslims of                                          America,New York,New York,2016-03-17,New York
1623,The time has come to understand one simple thing we the American muslimsare as American Support Hillary Save American Muslims,3981.07,https://www.facebook.com/events/1170988439609888/,1849.0,94.0,06/24/16 03:28:02 AM PDT,Hillary Clinton or Muslim Brotherhood,Washington Columbia Clinton,Washington Columbia,2016-06-24,Washington D.C.
1637,The safety freedom and dignity of all people must be safeguarded Terrorismand antiMus Safe Space for Muslim Neighborhood,5004.3,https://www.facebook.com/events/1092180614203742/,3072.0,107.0,08/10/16 03:06:37 AM PDT,Muslims Are Not Terrorists Islam ism or Muslim                                          Brotherhood,Washington Columbia,Washington Columbia,2016-08-10,Washington D.C.
1638,The safety freedom and dignity of all people must be safeguarded Terrorismand antiMus Safe Space for Muslim Neighborhood,12918.43,https://www.facebook.com/events/1092180614203742/,7267.0,427.0,08/15/16 07:24:16 AM PDT,people who like United Muslims of America,Washington Columbia,Washington Columbia,2016-08-15,Washington D.C.
1639,The safety freedom and dignity of all people must be safeguarded Terrorismand antiMus Safe Space for Muslim Neighborhood,17081.05,https://www.facebook.com/events/1092180614203742/,23858.0,865.0,08/23/16 04:43:48 AM PDT,Islam Islamism Proud to be A Muslim or                                           Muslim Brotherhood,Washington Columbia,Washington Columbia,2016-08-23,Washington D.C.
1692,Say no to genocide in america Join our protest that will be held in front of theHeadquarters of the United Nations in New York city on FebruaryThe race is not to the swift nor does the battle to the strong but time andchance happen to them all as long as black community is not completelyirradicated from the land of america we the little remaining will continue tovoice our griverances out and strive our way through until we attain freedomand justice black americans are brutalised everyday and the oppressors goscot free we have no advocate but we assure white america that oneswe have lives our voices are our tool for survival,5729.7,https://www.facebook.com/Blackluive-1725227467722991/,57249.0,38.0,02/09/16 12:13:19 AM PST,,New York,New York,2016-02-09,New York
1693,We are looking for brave people who are ready to help our movement whoare creative and active if you are one of such people just let us knowComment below or DM,5505.22,https://www.facebook.com/Blackluive-1725227 467722991 I,,1.0,05/05/16 08:21 :51 AM PDT,Police brutality in the United States or Stop                                          Police Brutality Multicultural Affinity African American US,Michigan,Michigan,2016-05-05,Michigan
1695,I didnt believe the media SO I BECAME ONE Follow,4.942,https://www.facebook.com/B lack Iuive-1725227467722991/,36601.0,920.0,07/11/16 02:41:37 AM PDT,Black Power Fight the Power Black Panther                                           Party Slavery by Another Name Malcolm X or Cop Block,Louisiana Minnesota,Louisiana Minnesota,2016-07-11,Louisiana
1695,I didnt believe the media SO I BECAME ONE Follow,4.942,https://www.facebook.com/B lack Iuive-1725227467722991/,36601.0,920.0,07/11/16 02:41:37 AM PDT,Black Power Fight the Power Black Panther                                           Party Slavery by Another Name Malcolm X or Cop Block,Louisiana Minnesota,Louisiana Minnesota,2016-07-11,Minnesota
1700,Ops seems like someone screwed upSalute our brave and smart cops who mistake mans member for a deadlyweapon Follow US and stay WOKE,5590.68,https://www.facebook.com/AmericanCops-1667165370195771/,36585.0,765.0,07/12/16 07:44:02 AM PDT,Black Power Fight the Power Black Panther                                          Party Slavery by Another Name Malcolm X or Cop Block,Chicago Illinois Baton Rouge Louisiana Baltimore Maryland Cleveland Ohio,Illinois Louisiana Maryland Ohio,2016-07-12,Illinois
1700,Ops seems like someone screwed upSalute our brave and smart cops who mistake mans member for a deadlyweapon Follow US and stay WOKE,5590.68,https://www.facebook.com/AmericanCops-1667165370195771/,36585.0,765.0,07/12/16 07:44:02 AM PDT,Black Power Fight the Power Black Panther                                          Party Slavery by Another Name Malcolm X or Cop Block,Chicago Illinois Baton Rouge Louisiana Baltimore Maryland Cleveland Ohio,Illinois Louisiana Maryland Ohio,2016-07-12,Louisiana
1700,Ops seems like someone screwed upSalute our brave and smart cops who mistake mans member for a deadlyweapon Follow US and stay WOKE,5590.68,https://www.facebook.com/AmericanCops-1667165370195771/,36585.0,765.0,07/12/16 07:44:02 AM PDT,Black Power Fight the Power Black Panther                                          Party Slavery by Another Name Malcolm X or Cop Block,Chicago Illinois Baton Rouge Louisiana Baltimore Maryland Cleveland Ohio,Illinois Louisiana Maryland Ohio,2016-07-12,Maryland
1700,Ops seems like someone screwed upSalute our brave and smart cops who mistake mans member for a deadlyweapon Follow US and stay WOKE,5590.68,https://www.facebook.com/AmericanCops-1667165370195771/,36585.0,765.0,07/12/16 07:44:02 AM PDT,Black Power Fight the Power Black Panther                                          Party Slavery by Another Name Malcolm X or Cop Block,Chicago Illinois Baton Rouge Louisiana Baltimore Maryland Cleveland Ohio,Illinois Louisiana Maryland Ohio,2016-07-12,Ohio
1707,Either We Together or We Aint,1512.73,https://www.facebook.com/Funnylnst-489676547881868/,8863.0,2.0,05/17/16 04:05:42 AM PDT,,Atlanta Georgia New Mexico Ohio South Carolina,Georgia New Mexico Ohio South Carolina,2016-05-17,Georgia
1707,Either We Together or We Aint,1512.73,https://www.facebook.com/Funnylnst-489676547881868/,8863.0,2.0,05/17/16 04:05:42 AM PDT,,Atlanta Georgia New Mexico Ohio South Carolina,Georgia New Mexico Ohio South Carolina,2016-05-17,New Mexico
1707,Either We Together or We Aint,1512.73,https://www.facebook.com/Funnylnst-489676547881868/,8863.0,2.0,05/17/16 04:05:42 AM PDT,,Atlanta Georgia New Mexico Ohio South Carolina,Georgia New Mexico Ohio South Carolina,2016-05-17,Ohio
1707,Either We Together or We Aint,1512.73,https://www.facebook.com/Funnylnst-489676547881868/,8863.0,2.0,05/17/16 04:05:42 AM PDT,,Atlanta Georgia New Mexico Ohio South Carolina,Georgia New Mexico Ohio South Carolina,2016-05-17,South Carolina
1809,years later No changes Hundreds of Americans have helddemonstrations in San Francisco to protest police fatal shooting ofMarioWoods last month Click to Learn More Cop Block Us AmericanCops,6915.75,https://www.instagram.com/cop_block—us/,31506.0,149.0,03/11/16 05:53:42 AM PST,,San Francisco California,California,2016-03-11,California
1877,Black lives do matter We want justice or else Follow us to know the truth Goto our website to stay abreast of the latest black news in America link in thebio,2222.46,https://www.facebook.com/Yoyoyoyoyoy-1729293847304592/,10114.0,9.0,05/20/16 04:41:47 AM PDT,Malcolm X Martin Luther King Jr Black                                          church Louis Farrakhan Black Panther Party The Honorable Minister Louis                                          Farrakhan or National Black Police Association United Kingdom Field of                                          study AfricanAmerican history,New York,New York,2016-05-20,New York
1892,Defend southern heritage Follow instagram south united and get last newshistory articles and even more Click Learn more South United Yoyoyoyoyo,0.0,https://instagram.com/south_united/,,,11/18/15 04:55:24 AM PST,Texas Secession or Southern United States,Oklahoma Texas,Oklahoma Texas,2015-11-18,Oklahoma
1892,Defend southern heritage Follow instagram south united and get last newshistory articles and even more Click Learn more South United Yoyoyoyoyo,0.0,https://instagram.com/south_united/,,,11/18/15 04:55:24 AM PST,Texas Secession or Southern United States,Oklahoma Texas,Oklahoma Texas,2015-11-18,Texas
1893,Defend southern heritage Follow instagram south united and get last newshistory articles and even more Click Learn more South United Yoyoyoyoyo,957.06,https://instagram.com/south_united/,6856.0,5.0,11/18/15 04:55:49 AM PST,Texas Secession or Southern United States,Oklahoma Texas,Oklahoma Texas,2015-11-18,Oklahoma
1893,Defend southern heritage Follow instagram south united and get last newshistory articles and even more Click Learn more South United Yoyoyoyoyo,957.06,https://instagram.com/south_united/,6856.0,5.0,11/18/15 04:55:49 AM PST,Texas Secession or Southern United States,Oklahoma Texas,Oklahoma Texas,2015-11-18,Texas
1905,Christmas is coming Were sure that you wont be able to find a betterpresent than a gun Dont believe us Just try once and youll understandwhat were talking about Gun power selfconfidence freedom Tea PartyNewsTeapartypat,114.89,https://www.instagram.com/tea_party_news/,336.0,2.0,12/15/15 08:32:06 AM PST,,Texas,Texas,2015-12-15,Texas
1906,Christmas is coming Were sure that you wont be able to find a betterpresent than a gun Dont believe us Just try once and youll understandwhat were talking about Gun power selfconfidence freedom Tea PartyNewsTeapartypat,0.0,https://www.instagram.com/tea—party_news/,0.0,0.0,12/18/15 03:25:39 AM PST,,Texas,Texas,2015-12-18,Texas
1907,Christmas is coming Were sure that you wont be able to find a betterpresent than a gun Dont believe usJust try once and youll understand whatwere talking about Gun power selfconfidence freedom Tea Party NewsTeapartypat,3245.41,https://www.instagram.com/tea—party_news/,23781.0,78.0,12/18/15 03:27:24 AM PST,,Texas,Texas,2015-12-18,Texas
1919,This is the community which unites all the muslims who live in the US We allare children of the Middle East Its time to uniteVoice Muslim Inst,8.0,https://www.instagram.com/muslim_voice/,,,05/12/16 03:36:43 AM PDT,Islam Quran Hasan ibn Ali Muhammad                                          Muhammad alBaqir Islam in the United States Ahl alBayt Haram Sunnah                                          Glossary of Islam Hadith Hajj Sharia Allah Muslim American Society or As                                          salamu alaykum,Minnesota,Minnesota,2016-05-12,Minnesota
1920,This is the community which unites all the muslims who live in the US We allare children of the Middle East Its time to uniteVoice Muslim Inst,3.0,https://www.instagram.com/muslim_voice/,20364.0,420.0,06/24/16 02:05:09 AM PDT,Islam Islam in the United States Muslim                                          Students Association Current events Religion or Muslim American Society,Minnesota,Minnesota,2016-06-24,Minnesota
1927,Stand with BlacklivesMatter movement All recent news the media will nevershow Blackvoice Baltimore News,29.41,https://www.instagram.com/baltimore.blackvoice/,1073.0,1.0,12/31/15 01 :02:36 AM PST,,Baltimore Maryland,Maryland,2015-12-31,Maryland
1928,THANK YOU to all those who risked their life for the sake of our country ClickLearn More Baltimore News Balt,4049.93,https://www.instagram.com/baItimore.blackvoice/,29879.0,67.0,01/06/16 04:26:59 AM PST,AfricanAmerican culture,Baltimore Maryland,Maryland,2016-01-06,Maryland
1946,Truth is on the side of the oppressedMalcolm X,12.209,https://www.facebook.com/Proudblacks-954167134618867/,61971.0,924.0,06/15/16 02:35:52 AM PDT,Black Power or Black Panther Party,New York,New York,2016-06-15,New York
1951,New YorkFebMeet at Dag Hammarskjold Plaza onstreet,27500.0,https://www.facebook.com/Proudblacks-954167134618867/,26514.0,0.0,02/18/16 05:03:07 AM PST,HispanicTV   African American US,Connecticut Delaware Maine Maryland Massachusetts Missouri Virginia Nevada New Hampshire Jersey York Ohio Pennsylvania Rhode Island Vermont,Connecticut Delaware Maine Maryland Massachusetts Missouri Virginia Nevada New Hampshire Ohio Pennsylvania Rhode Island Vermont,2016-02-18,Connecticut
1951,New YorkFebMeet at Dag Hammarskjold Plaza onstreet,27500.0,https://www.facebook.com/Proudblacks-954167134618867/,26514.0,0.0,02/18/16 05:03:07 AM PST,HispanicTV   African American US,Connecticut Delaware Maine Maryland Massachusetts Missouri Virginia Nevada New Hampshire Jersey York Ohio Pennsylvania Rhode Island Vermont,Connecticut Delaware Maine Maryland Massachusetts Missouri Virginia Nevada New Hampshire Ohio Pennsylvania Rhode Island Vermont,2016-02-18,Delaware
1951,New YorkFebMeet at Dag Hammarskjold Plaza onstreet,27500.0,https://www.facebook.com/Proudblacks-954167134618867/,26514.0,0.0,02/18/16 05:03:07 AM PST,HispanicTV   African American US,Connecticut Delaware Maine Maryland Massachusetts Missouri Virginia Nevada New Hampshire Jersey York Ohio Pennsylvania Rhode Island Vermont,Connecticut Delaware Maine Maryland Massachusetts Missouri Virginia Nevada New Hampshire Ohio Pennsylvania Rhode Island Vermont,2016-02-18,Maine
1951,New YorkFebMeet at Dag Hammarskjold Plaza onstreet,27500.0,https://www.facebook.com/Proudblacks-954167134618867/,26514.0,0.0,02/18/16 05:03:07 AM PST,HispanicTV   African American US,Connecticut Delaware Maine Maryland Massachusetts Missouri Virginia Nevada New Hampshire Jersey York Ohio Pennsylvania Rhode Island Vermont,Connecticut Delaware Maine Maryland Massachusetts Missouri Virginia Nevada New Hampshire Ohio Pennsylvania Rhode Island Vermont,2016-02-18,Maryland
1951,New YorkFebMeet at Dag Hammarskjold Plaza onstreet,27500.0,https://www.facebook.com/Proudblacks-954167134618867/,26514.0,0.0,02/18/16 05:03:07 AM PST,HispanicTV   African American US,Connecticut Delaware Maine Maryland Massachusetts Missouri Virginia Nevada New Hampshire Jersey York Ohio Pennsylvania Rhode Island Vermont,Connecticut Delaware Maine Maryland Massachusetts Missouri Virginia Nevada New Hampshire Ohio Pennsylvania Rhode Island Vermont,2016-02-18,Massachusetts
1951,New YorkFebMeet at Dag Hammarskjold Plaza onstreet,27500.0,https://www.facebook.com/Proudblacks-954167134618867/,26514.0,0.0,02/18/16 05:03:07 AM PST,HispanicTV   African American US,Connecticut Delaware Maine Maryland Massachusetts Missouri Virginia Nevada New Hampshire Jersey York Ohio Pennsylvania Rhode Island Vermont,Connecticut Delaware Maine Maryland Massachusetts Missouri Virginia Nevada New Hampshire Ohio Pennsylvania Rhode Island Vermont,2016-02-18,Missouri
1951,New YorkFebMeet at Dag Hammarskjold Plaza onstreet,27500.0,https://www.facebook.com/Proudblacks-954167134618867/,26514.0,0.0,02/18/16 05:03:07 AM PST,HispanicTV   African American US,Connecticut Delaware Maine Maryland Massachusetts Missouri Virginia Nevada New Hampshire Jersey York Ohio Pennsylvania Rhode Island Vermont,Connecticut Delaware Maine Maryland Massachusetts Missouri Virginia Nevada New Hampshire Ohio Pennsylvania Rhode Island Vermont,2016-02-18,Virginia
1951,New YorkFebMeet at Dag Hammarskjold Plaza onstreet,27500.0,https://www.facebook.com/Proudblacks-954167134618867/,26514.0,0.0,02/18/16 05:03:07 AM PST,HispanicTV   African American US,Connecticut Delaware Maine Maryland Massachusetts Missouri Virginia Nevada New Hampshire Jersey York Ohio Pennsylvania Rhode Island Vermont,Connecticut Delaware Maine Maryland Massachusetts Missouri Virginia Nevada New Hampshire Ohio Pennsylvania Rhode Island Vermont,2016-02-18,Nevada
1951,New YorkFebMeet at Dag Hammarskjold Plaza onstreet,27500.0,https://www.facebook.com/Proudblacks-954167134618867/,26514.0,0.0,02/18/16 05:03:07 AM PST,HispanicTV   African American US,Connecticut Delaware Maine Maryland Massachusetts Missouri Virginia Nevada New Hampshire Jersey York Ohio Pennsylvania Rhode Island Vermont,Connecticut Delaware Maine Maryland Massachusetts Missouri Virginia Nevada New Hampshire Ohio Pennsylvania Rhode Island Vermont,2016-02-18,New New Hampshire
1951,New YorkFebMeet at Dag Hammarskjold Plaza onstreet,27500.0,https://www.facebook.com/Proudblacks-954167134618867/,26514.0,0.0,02/18/16 05:03:07 AM PST,HispanicTV   African American US,Connecticut Delaware Maine Maryland Massachusetts Missouri Virginia Nevada New Hampshire Jersey York Ohio Pennsylvania Rhode Island Vermont,Connecticut Delaware Maine Maryland Massachusetts Missouri Virginia Nevada New Hampshire Ohio Pennsylvania Rhode Island Vermont,2016-02-18,Ohio
1951,New YorkFebMeet at Dag Hammarskjold Plaza onstreet,27500.0,https://www.facebook.com/Proudblacks-954167134618867/,26514.0,0.0,02/18/16 05:03:07 AM PST,HispanicTV   African American US,Connecticut Delaware Maine Maryland Massachusetts Missouri Virginia Nevada New Hampshire Jersey York Ohio Pennsylvania Rhode Island Vermont,Connecticut Delaware Maine Maryland Massachusetts Missouri Virginia Nevada New Hampshire Ohio Pennsylvania Rhode Island Vermont,2016-02-18,Pennsylvania
1951,New YorkFebMeet at Dag Hammarskjold Plaza onstreet,27500.0,https://www.facebook.com/Proudblacks-954167134618867/,26514.0,0.0,02/18/16 05:03:07 AM PST,HispanicTV   African American US,Connecticut Delaware Maine Maryland Massachusetts Missouri Virginia Nevada New Hampshire Jersey York Ohio Pennsylvania Rhode Island Vermont,Connecticut Delaware Maine Maryland Massachusetts Missouri Virginia Nevada New Hampshire Ohio Pennsylvania Rhode Island Vermont,2016-02-18,Rhode
1951,New YorkFebMeet at Dag Hammarskjold Plaza onstreet,27500.0,https://www.facebook.com/Proudblacks-954167134618867/,26514.0,0.0,02/18/16 05:03:07 AM PST,HispanicTV   African American US,Connecticut Delaware Maine Maryland Massachusetts Missouri Virginia Nevada New Hampshire Jersey York Ohio Pennsylvania Rhode Island Vermont,Connecticut Delaware Maine Maryland Massachusetts Missouri Virginia Nevada New Hampshire Ohio Pennsylvania Rhode Island Vermont,2016-02-18,Island
1951,New YorkFebMeet at Dag Hammarskjold Plaza onstreet,27500.0,https://www.facebook.com/Proudblacks-954167134618867/,26514.0,0.0,02/18/16 05:03:07 AM PST,HispanicTV   African American US,Connecticut Delaware Maine Maryland Massachusetts Missouri Virginia Nevada New Hampshire Jersey York Ohio Pennsylvania Rhode Island Vermont,Connecticut Delaware Maine Maryland Massachusetts Missouri Virginia Nevada New Hampshire Ohio Pennsylvania Rhode Island Vermont,2016-02-18,Vermont
1958,Due to the town of Twin falls Idaho becoming a center of refugeeresettlement which led Citizens before refugees,0.0,https://www.facebook.com/events/1171162859608506/,,,08/15/16 07: 14:22 AM PDT,,Idaho,Idaho,2016-08-15,Idaho
2281,years for rape murder and burglary for a man who didnt commit any ofthose crimes Philadelphia is a place poisoned by police misconduct for somany years That is the reason why they didnt immediately release aninnocent man even after it wa Black Man Released AfterYears BehindBars For Nothing I Black Matters BM,188.31,https://blackmattersus.com/14623-black-man-released-after-25-years-behind-,174.0,10.0,08/30/16 07:25:35 AM PDT,Martin Luther King Jr AfricanAmerican Civil Rights Movement                                           AfricanAmerican history or Malcolm X,Detroit Michigan,Michigan,2016-08-30,Michigan
2282,years for rape murder and burglary for a man who didnt commit any ofthose crimes Philadelphia is a place poisoned by police misconduct for somany years That is the reason why they didnt immediately release aninnocent man even after it wa Black Man Released AfterYears BehindBars For Nothing I Black Matters BM,0.0,https://blackmattersus.com/14623-black-man-released-after-25-years-behind-,0.0,0.0,09/21/16 01:15:20 AM PDT,,Charlotte North Carolina,North Carolina,2016-09-21,North Carolina
2283,years for rape murder and burglary for a man who didnt commit any ofthose crimes Philadelphia is a place poisoned by police misconduct for somany years That is the reason why they didnt immediately release aninnocent man even after it wa Black Man Released AfterYears BehindBars For Nothing I Black Matters BM,0.0,https://blackmattersus.com/14623-black-man-released-after-25-years-behind-,0.0,0.0,10/06/16 06:20:33 AM PDT,Human rights Martin Luther King Jr Pan                                          Africanism Black Power Black Panther Party Black panther Malcolm X                                           Black Color or Cop Block   African American US,Charlotte North Carolina,North Carolina,2016-10-06,North Carolina
2384,Were proud to announce an initiative focused on providing free legaleducation to empower our people and strengthen our communityWe believe that having these legal workshops on a monthly basis will prove tobe beneficial in a tangible way for our communityMeetatCharlotte NC Legal Night at,512.87,https://www.facebook.com/events/651125608392879/,1279.0,43.0,01/12/17 11:11:34 PM PST,Martin Luther King Jr AfricanAmerican                                          culture AfricanAmerican Civil Rights Movement  AfricanAmerican                                           history or Malcolm X,Charlotte North Carolina,North Carolina,2017-01-12,North Carolina
2438,Black edification is a PROblack platform to educate and empower ourpeople,611.7,https://www.facebook.com/BlackEdification/,7889.0,153.0,06/28/16 11: 16:35 AM PDT,people who like Black Edification   Freckle Baltimore Color AfricanAmerican                                          culture Visual perception or Black Color,Georgia Alabama Arizona California Florida Mississippi New Mexico York Oklahoma Texas Washington,Georgia Alabama Arizona California Florida Mississippi New Mexico Oklahoma Texas Washington,2016-06-28,Georgia
2438,Black edification is a PROblack platform to educate and empower ourpeople,611.7,https://www.facebook.com/BlackEdification/,7889.0,153.0,06/28/16 11: 16:35 AM PDT,people who like Black Edification   Freckle Baltimore Color AfricanAmerican                                          culture Visual perception or Black Color,Georgia Alabama Arizona California Florida Mississippi New Mexico York Oklahoma Texas Washington,Georgia Alabama Arizona California Florida Mississippi New Mexico Oklahoma Texas Washington,2016-06-28,Alabama
2438,Black edification is a PROblack platform to educate and empower ourpeople,611.7,https://www.facebook.com/BlackEdification/,7889.0,153.0,06/28/16 11: 16:35 AM PDT,people who like Black Edification   Freckle Baltimore Color AfricanAmerican                                          culture Visual perception or Black Color,Georgia Alabama Arizona California Florida Mississippi New Mexico York Oklahoma Texas Washington,Georgia Alabama Arizona California Florida Mississippi New Mexico Oklahoma Texas Washington,2016-06-28,Arizona
2438,Black edification is a PROblack platform to educate and empower ourpeople,611.7,https://www.facebook.com/BlackEdification/,7889.0,153.0,06/28/16 11: 16:35 AM PDT,people who like Black Edification   Freckle Baltimore Color AfricanAmerican                                          culture Visual perception or Black Color,Georgia Alabama Arizona California Florida Mississippi New Mexico York Oklahoma Texas Washington,Georgia Alabama Arizona California Florida Mississippi New Mexico Oklahoma Texas Washington,2016-06-28,California
2438,Black edification is a PROblack platform to educate and empower ourpeople,611.7,https://www.facebook.com/BlackEdification/,7889.0,153.0,06/28/16 11: 16:35 AM PDT,people who like Black Edification   Freckle Baltimore Color AfricanAmerican                                          culture Visual perception or Black Color,Georgia Alabama Arizona California Florida Mississippi New Mexico York Oklahoma Texas Washington,Georgia Alabama Arizona California Florida Mississippi New Mexico Oklahoma Texas Washington,2016-06-28,Florida
2438,Black edification is a PROblack platform to educate and empower ourpeople,611.7,https://www.facebook.com/BlackEdification/,7889.0,153.0,06/28/16 11: 16:35 AM PDT,people who like Black Edification   Freckle Baltimore Color AfricanAmerican                                          culture Visual perception or Black Color,Georgia Alabama Arizona California Florida Mississippi New Mexico York Oklahoma Texas Washington,Georgia Alabama Arizona California Florida Mississippi New Mexico Oklahoma Texas Washington,2016-06-28,Mississippi
2438,Black edification is a PROblack platform to educate and empower ourpeople,611.7,https://www.facebook.com/BlackEdification/,7889.0,153.0,06/28/16 11: 16:35 AM PDT,people who like Black Edification   Freckle Baltimore Color AfricanAmerican                                          culture Visual perception or Black Color,Georgia Alabama Arizona California Florida Mississippi New Mexico York Oklahoma Texas Washington,Georgia Alabama Arizona California Florida Mississippi New Mexico Oklahoma Texas Washington,2016-06-28,New Mexico
2438,Black edification is a PROblack platform to educate and empower ourpeople,611.7,https://www.facebook.com/BlackEdification/,7889.0,153.0,06/28/16 11: 16:35 AM PDT,people who like Black Edification   Freckle Baltimore Color AfricanAmerican                                          culture Visual perception or Black Color,Georgia Alabama Arizona California Florida Mississippi New Mexico York Oklahoma Texas Washington,Georgia Alabama Arizona California Florida Mississippi New Mexico Oklahoma Texas Washington,2016-06-28,Oklahoma
2438,Black edification is a PROblack platform to educate and empower ourpeople,611.7,https://www.facebook.com/BlackEdification/,7889.0,153.0,06/28/16 11: 16:35 AM PDT,people who like Black Edification   Freckle Baltimore Color AfricanAmerican                                          culture Visual perception or Black Color,Georgia Alabama Arizona California Florida Mississippi New Mexico York Oklahoma Texas Washington,Georgia Alabama Arizona California Florida Mississippi New Mexico Oklahoma Texas Washington,2016-06-28,Texas
2442,Melanin is gold Its a gift of God We have to appreciate this in all shadesThe black girls with freckles are also beautiful,500.0,https://www.facebook.com/Black-Edification-1772583676310336/,4717.0,470.0,06/25/16 01 :08:42 PM PDT,Freckle Baltimore Color AfricanAmerican culture Visual                                          perception or Black Color,Alabama Arizona California Florida Georgia Mississippi New Mexico York Oklahoma Texas Washington Baltimore,Alabama Arizona California Florida Georgia Mississippi New Mexico Oklahoma Texas Washington,2016-06-25,Alabama
2442,Melanin is gold Its a gift of God We have to appreciate this in all shadesThe black girls with freckles are also beautiful,500.0,https://www.facebook.com/Black-Edification-1772583676310336/,4717.0,470.0,06/25/16 01 :08:42 PM PDT,Freckle Baltimore Color AfricanAmerican culture Visual                                          perception or Black Color,Alabama Arizona California Florida Georgia Mississippi New Mexico York Oklahoma Texas Washington Baltimore,Alabama Arizona California Florida Georgia Mississippi New Mexico Oklahoma Texas Washington,2016-06-25,Arizona
2442,Melanin is gold Its a gift of God We have to appreciate this in all shadesThe black girls with freckles are also beautiful,500.0,https://www.facebook.com/Black-Edification-1772583676310336/,4717.0,470.0,06/25/16 01 :08:42 PM PDT,Freckle Baltimore Color AfricanAmerican culture Visual                                          perception or Black Color,Alabama Arizona California Florida Georgia Mississippi New Mexico York Oklahoma Texas Washington Baltimore,Alabama Arizona California Florida Georgia Mississippi New Mexico Oklahoma Texas Washington,2016-06-25,California
2442,Melanin is gold Its a gift of God We have to appreciate this in all shadesThe black girls with freckles are also beautiful,500.0,https://www.facebook.com/Black-Edification-1772583676310336/,4717.0,470.0,06/25/16 01 :08:42 PM PDT,Freckle Baltimore Color AfricanAmerican culture Visual                                          perception or Black Color,Alabama Arizona California Florida Georgia Mississippi New Mexico York Oklahoma Texas Washington Baltimore,Alabama Arizona California Florida Georgia Mississippi New Mexico Oklahoma Texas Washington,2016-06-25,Florida
2442,Melanin is gold Its a gift of God We have to appreciate this in all shadesThe black girls with freckles are also beautiful,500.0,https://www.facebook.com/Black-Edification-1772583676310336/,4717.0,470.0,06/25/16 01 :08:42 PM PDT,Freckle Baltimore Color AfricanAmerican culture Visual                                          perception or Black Color,Alabama Arizona California Florida Georgia Mississippi New Mexico York Oklahoma Texas Washington Baltimore,Alabama Arizona California Florida Georgia Mississippi New Mexico Oklahoma Texas Washington,2016-06-25,Georgia
2442,Melanin is gold Its a gift of God We have to appreciate this in all shadesThe black girls with freckles are also beautiful,500.0,https://www.facebook.com/Black-Edification-1772583676310336/,4717.0,470.0,06/25/16 01 :08:42 PM PDT,Freckle Baltimore Color AfricanAmerican culture Visual                                          perception or Black Color,Alabama Arizona California Florida Georgia Mississippi New Mexico York Oklahoma Texas Washington Baltimore,Alabama Arizona California Florida Georgia Mississippi New Mexico Oklahoma Texas Washington,2016-06-25,Mississippi
2442,Melanin is gold Its a gift of God We have to appreciate this in all shadesThe black girls with freckles are also beautiful,500.0,https://www.facebook.com/Black-Edification-1772583676310336/,4717.0,470.0,06/25/16 01 :08:42 PM PDT,Freckle Baltimore Color AfricanAmerican culture Visual                                          perception or Black Color,Alabama Arizona California Florida Georgia Mississippi New Mexico York Oklahoma Texas Washington Baltimore,Alabama Arizona California Florida Georgia Mississippi New Mexico Oklahoma Texas Washington,2016-06-25,New Mexico
2442,Melanin is gold Its a gift of God We have to appreciate this in all shadesThe black girls with freckles are also beautiful,500.0,https://www.facebook.com/Black-Edification-1772583676310336/,4717.0,470.0,06/25/16 01 :08:42 PM PDT,Freckle Baltimore Color AfricanAmerican culture Visual                                          perception or Black Color,Alabama Arizona California Florida Georgia Mississippi New Mexico York Oklahoma Texas Washington Baltimore,Alabama Arizona California Florida Georgia Mississippi New Mexico Oklahoma Texas Washington,2016-06-25,Oklahoma
2442,Melanin is gold Its a gift of God We have to appreciate this in all shadesThe black girls with freckles are also beautiful,500.0,https://www.facebook.com/Black-Edification-1772583676310336/,4717.0,470.0,06/25/16 01 :08:42 PM PDT,Freckle Baltimore Color AfricanAmerican culture Visual                                          perception or Black Color,Alabama Arizona California Florida Georgia Mississippi New Mexico York Oklahoma Texas Washington Baltimore,Alabama Arizona California Florida Georgia Mississippi New Mexico Oklahoma Texas Washington,2016-06-25,Texas
2443,Melanin is gold Its a gift of God We have to appreciate this in all shadesThe black girls with freckles are also beautiful,0.0,https://www.facebook.com/Black-Edification-1772583676310336/,0.0,0.0,07/17/16 12:37:25 AM PDT,Freckle Baltimore Color AfricanAmerican culture Visual                                          perception or Black Color,Alabama Arizona California Florida Georgia Mississippi New Mexico York Oklahoma Texas Washington Baltimore,Alabama Arizona California Florida Georgia Mississippi New Mexico Oklahoma Texas Washington,2016-07-17,Alabama
2443,Melanin is gold Its a gift of God We have to appreciate this in all shadesThe black girls with freckles are also beautiful,0.0,https://www.facebook.com/Black-Edification-1772583676310336/,0.0,0.0,07/17/16 12:37:25 AM PDT,Freckle Baltimore Color AfricanAmerican culture Visual                                          perception or Black Color,Alabama Arizona California Florida Georgia Mississippi New Mexico York Oklahoma Texas Washington Baltimore,Alabama Arizona California Florida Georgia Mississippi New Mexico Oklahoma Texas Washington,2016-07-17,Arizona
2443,Melanin is gold Its a gift of God We have to appreciate this in all shadesThe black girls with freckles are also beautiful,0.0,https://www.facebook.com/Black-Edification-1772583676310336/,0.0,0.0,07/17/16 12:37:25 AM PDT,Freckle Baltimore Color AfricanAmerican culture Visual                                          perception or Black Color,Alabama Arizona California Florida Georgia Mississippi New Mexico York Oklahoma Texas Washington Baltimore,Alabama Arizona California Florida Georgia Mississippi New Mexico Oklahoma Texas Washington,2016-07-17,California
2443,Melanin is gold Its a gift of God We have to appreciate this in all shadesThe black girls with freckles are also beautiful,0.0,https://www.facebook.com/Black-Edification-1772583676310336/,0.0,0.0,07/17/16 12:37:25 AM PDT,Freckle Baltimore Color AfricanAmerican culture Visual                                          perception or Black Color,Alabama Arizona California Florida Georgia Mississippi New Mexico York Oklahoma Texas Washington Baltimore,Alabama Arizona California Florida Georgia Mississippi New Mexico Oklahoma Texas Washington,2016-07-17,Florida
2443,Melanin is gold Its a gift of God We have to appreciate this in all shadesThe black girls with freckles are also beautiful,0.0,https://www.facebook.com/Black-Edification-1772583676310336/,0.0,0.0,07/17/16 12:37:25 AM PDT,Freckle Baltimore Color AfricanAmerican culture Visual                                          perception or Black Color,Alabama Arizona California Florida Georgia Mississippi New Mexico York Oklahoma Texas Washington Baltimore,Alabama Arizona California Florida Georgia Mississippi New Mexico Oklahoma Texas Washington,2016-07-17,Georgia
2443,Melanin is gold Its a gift of God We have to appreciate this in all shadesThe black girls with freckles are also beautiful,0.0,https://www.facebook.com/Black-Edification-1772583676310336/,0.0,0.0,07/17/16 12:37:25 AM PDT,Freckle Baltimore Color AfricanAmerican culture Visual                                          perception or Black Color,Alabama Arizona California Florida Georgia Mississippi New Mexico York Oklahoma Texas Washington Baltimore,Alabama Arizona California Florida Georgia Mississippi New Mexico Oklahoma Texas Washington,2016-07-17,Mississippi
2443,Melanin is gold Its a gift of God We have to appreciate this in all shadesThe black girls with freckles are also beautiful,0.0,https://www.facebook.com/Black-Edification-1772583676310336/,0.0,0.0,07/17/16 12:37:25 AM PDT,Freckle Baltimore Color AfricanAmerican culture Visual                                          perception or Black Color,Alabama Arizona California Florida Georgia Mississippi New Mexico York Oklahoma Texas Washington Baltimore,Alabama Arizona California Florida Georgia Mississippi New Mexico Oklahoma Texas Washington,2016-07-17,New Mexico
2443,Melanin is gold Its a gift of God We have to appreciate this in all shadesThe black girls with freckles are also beautiful,0.0,https://www.facebook.com/Black-Edification-1772583676310336/,0.0,0.0,07/17/16 12:37:25 AM PDT,Freckle Baltimore Color AfricanAmerican culture Visual                                          perception or Black Color,Alabama Arizona California Florida Georgia Mississippi New Mexico York Oklahoma Texas Washington Baltimore,Alabama Arizona California Florida Georgia Mississippi New Mexico Oklahoma Texas Washington,2016-07-17,Oklahoma
2443,Melanin is gold Its a gift of God We have to appreciate this in all shadesThe black girls with freckles are also beautiful,0.0,https://www.facebook.com/Black-Edification-1772583676310336/,0.0,0.0,07/17/16 12:37:25 AM PDT,Freckle Baltimore Color AfricanAmerican culture Visual                                          perception or Black Color,Alabama Arizona California Florida Georgia Mississippi New Mexico York Oklahoma Texas Washington Baltimore,Alabama Arizona California Florida Georgia Mississippi New Mexico Oklahoma Texas Washington,2016-07-17,Texas
2447,If you also think that there should only be peace come with us on Juneandlets make it happenStop war Stop killing the innocent Some believed Trump would withdraw theUS from useless and bloody military campaigns But what we see is only theenhancement of hostility We dont need wars no more We want peace Itstime for politicians to take care of the US residents instead of fating them aswell as other nationals to death Were organizing a peaceful gathering todraw public attention to the abovementioned terrible problem Our Presidentand Congress must listen to those who granted them powerus the peopleIf you also think that there should only be peace come with us and lets makeit happenStop war Stop killing the innocent Make peace not war Make peace notwar,4891.47,https://www.facebook.com/events/147549059117757/,6172.0,191.0,05/17/17 05:53:39 AM PDT,people who like United Muslims of America,Washington Columbia,Washington Columbia,2017-05-17,Washington D.C.
2451,If you also think that there should only be peace come with us and lets makeit happenStop war Stop killing the innocent Some believed Trump would withdraw theUS from useless and bloody military campaigns But what we see is only theenhancement of hostility We dont need wars no more We want peace Itstime for politicians to take care of the US residents instead of fating them aswell as other nationals to deathWere organizing a peaceful gathering to draw public attention to the abovementioned terrible problem Our President and Congress must listen to thosewho granted them powerus the people If you also think that there shouldonly be peace come with us and lets make it happenStop war Stop killing the innocent Make peace not war Make peace notwar,4593.46,https://www.facebook.com/events/239129926564203/,6721.0,243.0,05/17/17 05:49:58 AM PDT,people who like United Muslims of America,New York,New York,2017-05-17,New York
2904,The community of nd Amendment supporters guns loverspatriots DefendThe nd,0.0,https://www.facebook.com/savethe2a/,0.0,0.0,04/19/17 07:35:54 AM PDT,people who like Defend the nd   The Second Amendment Protect the Second                                          Amendment Protecting Your Gun Rights God Guns  American Freedom                                           Preserve our right to keep and bear arms or Second Amendment Supporters                                           Politics US politics conservative                                              nd Amendment or National Rifle Association,California Illinois,California Illinois,2017-04-19,California
2904,The community of nd Amendment supporters guns loverspatriots DefendThe nd,0.0,https://www.facebook.com/savethe2a/,0.0,0.0,04/19/17 07:35:54 AM PDT,people who like Defend the nd   The Second Amendment Protect the Second                                          Amendment Protecting Your Gun Rights God Guns  American Freedom                                           Preserve our right to keep and bear arms or Second Amendment Supporters                                           Politics US politics conservative                                              nd Amendment or National Rifle Association,California Illinois,California Illinois,2017-04-19,Illinois
2910,The community of nd Amendment supporters guns loverspatriots DefendThe nd,0.0,https://www.facebook.com/savethe2a/,0.0,0.0,04/19/17 07:39:27 AM PDT,people who like Defend the nd   Right to keep and bear arms nd Amendment                                           National Rifle Association Gun Owners of America Second Amendment to                                          the United States Constitution Concealed carry in the United States National                                          Association for Gun Rights Guns  Ammo or From my cold dead hands                                              Anything About Guns or Gun Rights,California Illinois,California Illinois,2017-04-19,California
2910,The community of nd Amendment supporters guns loverspatriots DefendThe nd,0.0,https://www.facebook.com/savethe2a/,0.0,0.0,04/19/17 07:39:27 AM PDT,people who like Defend the nd   Right to keep and bear arms nd Amendment                                           National Rifle Association Gun Owners of America Second Amendment to                                          the United States Constitution Concealed carry in the United States National                                          Association for Gun Rights Guns  Ammo or From my cold dead hands                                              Anything About Guns or Gun Rights,California Illinois,California Illinois,2017-04-19,Illinois
91,We dont want to honor racism slavery and hatred This is what ConfederateHeritage is Not My Heritage Rally,13661.08,https://www.facebook.com/events/227388350945080/,49978.0,1499.0,03/15/16 08:02:45 AM PDT,people who are going to Not My Heritage                                           Rally   African American US,Jackson Mississippi,Mississippi,2016-03-15,Mississippi
534,Stand for the people not the Government Join the rally in Atlanta this SundayAmerican CrusadeGa,10.68,https://www.facebook.com/events/I678907209017708/,5.0,0.0,04/13/16 03:24:02 AM PDT,Independence or Patriotism,Atlanta Georgia,Georgia,2016-04-13,Georgia
1885,INSTagram Of The United States or simplyINSTOTUS Unique Instagrampage for American patriots only FOLLOW JUST DO IT,2277.54,https://www.facebook.com/Lalalo-1 028159433939877/,13211.0,10.0,05/20/16 04:36:31 AM PDT,US Patriot Tactical Flags of the Confederate                                          States of America The Patriot Post Confederate States of America                                          American Patriots Thank A Soldier Flag of the United States Guns                                           Patriots American Patriot Proud to be an American American patriotism or                                          Chris Kyle,Alabama Arkansas Georgia Illinois Iowa Louisiana Minnesota Mississippi Nebraska Wisconsin,Alabama Arkansas Georgia Illinois Iowa Louisiana Minnesota Mississippi Nebraska Wisconsin,2016-05-20,Alabama
1885,INSTagram Of The United States or simplyINSTOTUS Unique Instagrampage for American patriots only FOLLOW JUST DO IT,2277.54,https://www.facebook.com/Lalalo-1 028159433939877/,13211.0,10.0,05/20/16 04:36:31 AM PDT,US Patriot Tactical Flags of the Confederate                                          States of America The Patriot Post Confederate States of America                                          American Patriots Thank A Soldier Flag of the United States Guns                                           Patriots American Patriot Proud to be an American American patriotism or                                          Chris Kyle,Alabama Arkansas Georgia Illinois Iowa Louisiana Minnesota Mississippi Nebraska Wisconsin,Alabama Arkansas Georgia Illinois Iowa Louisiana Minnesota Mississippi Nebraska Wisconsin,2016-05-20,Arkansas
1885,INSTagram Of The United States or simplyINSTOTUS Unique Instagrampage for American patriots only FOLLOW JUST DO IT,2277.54,https://www.facebook.com/Lalalo-1 028159433939877/,13211.0,10.0,05/20/16 04:36:31 AM PDT,US Patriot Tactical Flags of the Confederate                                          States of America The Patriot Post Confederate States of America                                          American Patriots Thank A Soldier Flag of the United States Guns                                           Patriots American Patriot Proud to be an American American patriotism or                                          Chris Kyle,Alabama Arkansas Georgia Illinois Iowa Louisiana Minnesota Mississippi Nebraska Wisconsin,Alabama Arkansas Georgia Illinois Iowa Louisiana Minnesota Mississippi Nebraska Wisconsin,2016-05-20,Georgia
1885,INSTagram Of The United States or simplyINSTOTUS Unique Instagrampage for American patriots only FOLLOW JUST DO IT,2277.54,https://www.facebook.com/Lalalo-1 028159433939877/,13211.0,10.0,05/20/16 04:36:31 AM PDT,US Patriot Tactical Flags of the Confederate                                          States of America The Patriot Post Confederate States of America                                          American Patriots Thank A Soldier Flag of the United States Guns                                           Patriots American Patriot Proud to be an American American patriotism or                                          Chris Kyle,Alabama Arkansas Georgia Illinois Iowa Louisiana Minnesota Mississippi Nebraska Wisconsin,Alabama Arkansas Georgia Illinois Iowa Louisiana Minnesota Mississippi Nebraska Wisconsin,2016-05-20,Illinois
1885,INSTagram Of The United States or simplyINSTOTUS Unique Instagrampage for American patriots only FOLLOW JUST DO IT,2277.54,https://www.facebook.com/Lalalo-1 028159433939877/,13211.0,10.0,05/20/16 04:36:31 AM PDT,US Patriot Tactical Flags of the Confederate                                          States of America The Patriot Post Confederate States of America                                          American Patriots Thank A Soldier Flag of the United States Guns                                           Patriots American Patriot Proud to be an American American patriotism or                                          Chris Kyle,Alabama Arkansas Georgia Illinois Iowa Louisiana Minnesota Mississippi Nebraska Wisconsin,Alabama Arkansas Georgia Illinois Iowa Louisiana Minnesota Mississippi Nebraska Wisconsin,2016-05-20,Iowa
1885,INSTagram Of The United States or simplyINSTOTUS Unique Instagrampage for American patriots only FOLLOW JUST DO IT,2277.54,https://www.facebook.com/Lalalo-1 028159433939877/,13211.0,10.0,05/20/16 04:36:31 AM PDT,US Patriot Tactical Flags of the Confederate                                          States of America The Patriot Post Confederate States of America                                          American Patriots Thank A Soldier Flag of the United States Guns                                           Patriots American Patriot Proud to be an American American patriotism or                                          Chris Kyle,Alabama Arkansas Georgia Illinois Iowa Louisiana Minnesota Mississippi Nebraska Wisconsin,Alabama Arkansas Georgia Illinois Iowa Louisiana Minnesota Mississippi Nebraska Wisconsin,2016-05-20,Louisiana
1885,INSTagram Of The United States or simplyINSTOTUS Unique Instagrampage for American patriots only FOLLOW JUST DO IT,2277.54,https://www.facebook.com/Lalalo-1 028159433939877/,13211.0,10.0,05/20/16 04:36:31 AM PDT,US Patriot Tactical Flags of the Confederate                                          States of America The Patriot Post Confederate States of America                                          American Patriots Thank A Soldier Flag of the United States Guns                                           Patriots American Patriot Proud to be an American American patriotism or                                          Chris Kyle,Alabama Arkansas Georgia Illinois Iowa Louisiana Minnesota Mississippi Nebraska Wisconsin,Alabama Arkansas Georgia Illinois Iowa Louisiana Minnesota Mississippi Nebraska Wisconsin,2016-05-20,Minnesota
1885,INSTagram Of The United States or simplyINSTOTUS Unique Instagrampage for American patriots only FOLLOW JUST DO IT,2277.54,https://www.facebook.com/Lalalo-1 028159433939877/,13211.0,10.0,05/20/16 04:36:31 AM PDT,US Patriot Tactical Flags of the Confederate                                          States of America The Patriot Post Confederate States of America                                          American Patriots Thank A Soldier Flag of the United States Guns                                           Patriots American Patriot Proud to be an American American patriotism or                                          Chris Kyle,Alabama Arkansas Georgia Illinois Iowa Louisiana Minnesota Mississippi Nebraska Wisconsin,Alabama Arkansas Georgia Illinois Iowa Louisiana Minnesota Mississippi Nebraska Wisconsin,2016-05-20,Mississippi
1885,INSTagram Of The United States or simplyINSTOTUS Unique Instagrampage for American patriots only FOLLOW JUST DO IT,2277.54,https://www.facebook.com/Lalalo-1 028159433939877/,13211.0,10.0,05/20/16 04:36:31 AM PDT,US Patriot Tactical Flags of the Confederate                                          States of America The Patriot Post Confederate States of America                                          American Patriots Thank A Soldier Flag of the United States Guns                                           Patriots American Patriot Proud to be an American American patriotism or                                          Chris Kyle,Alabama Arkansas Georgia Illinois Iowa Louisiana Minnesota Mississippi Nebraska Wisconsin,Alabama Arkansas Georgia Illinois Iowa Louisiana Minnesota Mississippi Nebraska Wisconsin,2016-05-20,Nebraska
1885,INSTagram Of The United States or simplyINSTOTUS Unique Instagrampage for American patriots only FOLLOW JUST DO IT,2277.54,https://www.facebook.com/Lalalo-1 028159433939877/,13211.0,10.0,05/20/16 04:36:31 AM PDT,US Patriot Tactical Flags of the Confederate                                          States of America The Patriot Post Confederate States of America                                          American Patriots Thank A Soldier Flag of the United States Guns                                           Patriots American Patriot Proud to be an American American patriotism or                                          Chris Kyle,Alabama Arkansas Georgia Illinois Iowa Louisiana Minnesota Mississippi Nebraska Wisconsin,Alabama Arkansas Georgia Illinois Iowa Louisiana Minnesota Mississippi Nebraska Wisconsin,2016-05-20,Wisconsin
1945,Follow BlackAmericaToday Stay woke,634.08,https://www.facebook.com/Proudblacks-954167134618867/,5609.0,2.0,05/17/16 04:18:29 AM PDT,Martin Luther King Jr Black Power Black                                          Panther Party AfricanAmerican Civil Rights Movement  or Malcolm                                          X Field of study AfricanAmerican history,Florida Georgia New York,Florida Georgia New York,2016-05-17,Florida
1945,Follow BlackAmericaToday Stay woke,634.08,https://www.facebook.com/Proudblacks-954167134618867/,5609.0,2.0,05/17/16 04:18:29 AM PDT,Martin Luther King Jr Black Power Black                                          Panther Party AfricanAmerican Civil Rights Movement  or Malcolm                                          X Field of study AfricanAmerican history,Florida Georgia New York,Florida Georgia New York,2016-05-17,Georgia
1945,Follow BlackAmericaToday Stay woke,634.08,https://www.facebook.com/Proudblacks-954167134618867/,5609.0,2.0,05/17/16 04:18:29 AM PDT,Martin Luther King Jr Black Power Black                                          Panther Party AfricanAmerican Civil Rights Movement  or Malcolm                                          X Field of study AfricanAmerican history,Florida Georgia New York,Florida Georgia New York,2016-05-17,New York
2367,Were proud to announce an initiative focused on providing free legaleducation to empower our people and strengthen our communityWe urge our city to continue to support and defend our immigrantcommunities and their families Immigrants and refugees are an integral partof our economy our cultural and social life and our future Join the LegalNight meeting aton MarchLegal Night atFree legal help for immigrants,0.0,https://www.facebook.com/events/274895506278564/,0.0,0.0,02/22/17 07:03:56 AM PST,Civil law common law,Charlotte North Carolina,North Carolina,2017-02-22,North Carolina
2368,Were proud to announce an initiative focused on providing free legaleducation to empower our people and strengthen our communityWe urge our city to continue to support and defend our immigrantcommunities and their families Immigrants and refugees are an integral partof our economy our cultural and social life and our future Join the Legalht meetin aton MarchLegal Night atiFree legal help for immigrants,257.6,https://www.facebook.com/events/274895506278564/,580.0,35.0,02/22/17 07:05:06 AM PST,Martin Luther King Jr AfricanAmerican                                          culture AfricanAmerican Civil Rights Movement  AfricanAmerican                                           history Malcolm X or Legal education,Charlotte North Carolina,North Carolina,2017-02-22,North Carolina
2386,Were proud to announce an initiative focused on providing free legaleducation to empower our people and strengthen our communityWe believe that having these legal workshops on a monthly basis will prove tobe beneficial in a tangible way for our communityMeet you atCharlotte NC Legal Night at,0.0,https://www.facebook.com/events/651125608392879/,0.0,0.0,02/22/17 07:05:06 AM PST,Martin Luther King Jr AfricanAmerican                                          culture AfricanAmerican Civil Rights Movement  AfricanAmerican                                           history Malcolm X or Legal education,Charlotte North Carolina,North Carolina,2017-02-22,North Carolina
2440,Many of us are poor and struggling due to systemic racism So fight forsomethingIT IS OUR DUTY WE HAVE NOTHING TO LOSE BUT OUR CHAINS,73.75,https://www.facebook.com/Black-Edification-1772583676310336/,2318.0,146.0,07/19/16 02:16:10 PM PDT,Freckle Baltimore Color AfricanAmerican culture Visual                                          perception or Black Color,Alabama Arizona California Florida Georgia Mississippi New Mexico York Oklahoma Texas Washington Baltimore,Alabama Arizona California Florida Georgia Mississippi New Mexico Oklahoma Texas Washington,2016-07-19,Alabama
2440,Many of us are poor and struggling due to systemic racism So fight forsomethingIT IS OUR DUTY WE HAVE NOTHING TO LOSE BUT OUR CHAINS,73.75,https://www.facebook.com/Black-Edification-1772583676310336/,2318.0,146.0,07/19/16 02:16:10 PM PDT,Freckle Baltimore Color AfricanAmerican culture Visual                                          perception or Black Color,Alabama Arizona California Florida Georgia Mississippi New Mexico York Oklahoma Texas Washington Baltimore,Alabama Arizona California Florida Georgia Mississippi New Mexico Oklahoma Texas Washington,2016-07-19,Arizona
2440,Many of us are poor and struggling due to systemic racism So fight forsomethingIT IS OUR DUTY WE HAVE NOTHING TO LOSE BUT OUR CHAINS,73.75,https://www.facebook.com/Black-Edification-1772583676310336/,2318.0,146.0,07/19/16 02:16:10 PM PDT,Freckle Baltimore Color AfricanAmerican culture Visual                                          perception or Black Color,Alabama Arizona California Florida Georgia Mississippi New Mexico York Oklahoma Texas Washington Baltimore,Alabama Arizona California Florida Georgia Mississippi New Mexico Oklahoma Texas Washington,2016-07-19,California
2440,Many of us are poor and struggling due to systemic racism So fight forsomethingIT IS OUR DUTY WE HAVE NOTHING TO LOSE BUT OUR CHAINS,73.75,https://www.facebook.com/Black-Edification-1772583676310336/,2318.0,146.0,07/19/16 02:16:10 PM PDT,Freckle Baltimore Color AfricanAmerican culture Visual                                          perception or Black Color,Alabama Arizona California Florida Georgia Mississippi New Mexico York Oklahoma Texas Washington Baltimore,Alabama Arizona California Florida Georgia Mississippi New Mexico Oklahoma Texas Washington,2016-07-19,Florida
2440,Many of us are poor and struggling due to systemic racism So fight forsomethingIT IS OUR DUTY WE HAVE NOTHING TO LOSE BUT OUR CHAINS,73.75,https://www.facebook.com/Black-Edification-1772583676310336/,2318.0,146.0,07/19/16 02:16:10 PM PDT,Freckle Baltimore Color AfricanAmerican culture Visual                                          perception or Black Color,Alabama Arizona California Florida Georgia Mississippi New Mexico York Oklahoma Texas Washington Baltimore,Alabama Arizona California Florida Georgia Mississippi New Mexico Oklahoma Texas Washington,2016-07-19,Georgia
2440,Many of us are poor and struggling due to systemic racism So fight forsomethingIT IS OUR DUTY WE HAVE NOTHING TO LOSE BUT OUR CHAINS,73.75,https://www.facebook.com/Black-Edification-1772583676310336/,2318.0,146.0,07/19/16 02:16:10 PM PDT,Freckle Baltimore Color AfricanAmerican culture Visual                                          perception or Black Color,Alabama Arizona California Florida Georgia Mississippi New Mexico York Oklahoma Texas Washington Baltimore,Alabama Arizona California Florida Georgia Mississippi New Mexico Oklahoma Texas Washington,2016-07-19,Mississippi
2440,Many of us are poor and struggling due to systemic racism So fight forsomethingIT IS OUR DUTY WE HAVE NOTHING TO LOSE BUT OUR CHAINS,73.75,https://www.facebook.com/Black-Edification-1772583676310336/,2318.0,146.0,07/19/16 02:16:10 PM PDT,Freckle Baltimore Color AfricanAmerican culture Visual                                          perception or Black Color,Alabama Arizona California Florida Georgia Mississippi New Mexico York Oklahoma Texas Washington Baltimore,Alabama Arizona California Florida Georgia Mississippi New Mexico Oklahoma Texas Washington,2016-07-19,New Mexico
2440,Many of us are poor and struggling due to systemic racism So fight forsomethingIT IS OUR DUTY WE HAVE NOTHING TO LOSE BUT OUR CHAINS,73.75,https://www.facebook.com/Black-Edification-1772583676310336/,2318.0,146.0,07/19/16 02:16:10 PM PDT,Freckle Baltimore Color AfricanAmerican culture Visual                                          perception or Black Color,Alabama Arizona California Florida Georgia Mississippi New Mexico York Oklahoma Texas Washington Baltimore,Alabama Arizona California Florida Georgia Mississippi New Mexico Oklahoma Texas Washington,2016-07-19,Oklahoma
2440,Many of us are poor and struggling due to systemic racism So fight forsomethingIT IS OUR DUTY WE HAVE NOTHING TO LOSE BUT OUR CHAINS,73.75,https://www.facebook.com/Black-Edification-1772583676310336/,2318.0,146.0,07/19/16 02:16:10 PM PDT,Freckle Baltimore Color AfricanAmerican culture Visual                                          perception or Black Color,Alabama Arizona California Florida Georgia Mississippi New Mexico York Oklahoma Texas Washington Baltimore,Alabama Arizona California Florida Georgia Mississippi New Mexico Oklahoma Texas Washington,2016-07-19,Texas
2964,FREE shooting practice for our subscribers Hurry onlypackages leftDear subscribers we offer you to gather together and visitshooting range in Gainesville FL Onwe are making anevent for our subscribers Join the event and share it with your friends Firstpeople who will message us will get a FREE mm Shooting Packageincludes the day pass a rental handgunrounds mmtarget eyeearprotection if neededIf ou want to get it just message us Shooting practiceat,1000.0,https://www .face book. com/Defend-the-2nd-692068924291672/,,55.0,02/17 /17 07:48:04 AM PST,Protect the Second Amendment Gun Owners                                          of America Concealed carry Concealed carry in the United States National                                          Association for Gun Rights Guns  Ammo or Students for Concealed Carry,Gainesville Florida,Florida,,Florida
3345,Join the event bring your friends feel safe with usIts free Organized on a donation basis Free Selfdefense class in N Y,0.0,https://www.facebook.com/events/406662303016780/,,,03/21/17 08:22:41 AM PDT,Martin Luther King Jr PanAfricanism Black                                          Power Martial arts African American Black history Black Panther Party                                          AfricanAmerican culture AfricanAmerican Civil Rights Movement                                           Black History Month AfricanAmerican history Angela Davis Malcolm X Self                                          Defense Family Black Color or The Self Defense Company                                              Mixed martial arts Martial arts The Womens                                          Self Defense Institute PERSONAL  HOME DEFENSE Selfdefense Self                                          defense United States Personal Defense Right of selfdefense Self                                          Defense Family or Active Self Protection,New York,New York,2017-03-21,New York
3356,The first selfdefense classJoin the event bring yourfriends feel safe with us Selfdefense classes,0.0,https://www.facebook.com/events/180754319075270/,0.0,0.0,02/06/17 05:40:00 AM PST,The Womens Self Defense Institute African                                          American culture AfricanAmerican Civil Rights Movement  African                                          American history Right of selfdefense or Malcolm X,Orlando Florida,Florida,2017-02-06,Florida
455,Stop federal overreach Stand for the patriots in a protest rally in Atlanta GAAmerican CrusadeGa,12.46,https://www.facebook.com/events/I678907209017708/,16.0,0.0,04/13/16 03:23:42 AM PDT,Independence or Patriotism,Atlanta Georgia,Georgia,2016-04-13,Georgia
512,Stand for the people not the Government Join the rally in Atlanta this SundayAmerican CrusadeGa,21.5,https://www.facebook.com/events/I678907209017708/,20.0,0.0,04/13/16 03:23:58 AM PDT,Independence or Patriotism,Atlanta Georgia,Georgia,2016-04-13,Georgia
3323,ROLLUP YOUR SLEEVES IT IS A CALL TO SELFDEFENSE,500.0,https://www.facebook.com/Fit-Black-966468950153780/,1406.0,130.0,02/02/17 11 :44:54 PM PST,The Womens Self Defense Institute African                                   American culture AfricanAmerican Civil Rights Movement  African                                   American history Right of selfdefense or Malcolm X,New York,New York,2017-02-02,New York
3329,Join the event bring your friends feel safe with usDont miss the opportunity to train outdoorsIts free Organized on a donation basis Free Selfdefense class in OrlandoFl,2592.07,https://www.facebook.com/events/1470671329619188/,3612.0,194.0,02/13/17 06: 56:45 AM PST,Mixed martial arts Martial arts The Womens                                   Self Defense Institute PERSONAL  HOME DEFENSE Selfdefense Self                                   defense United States Personal Defense Right of selfdefense Self                                   Defense Family or Active Self Protection                                       Martin Luther King Jr PanAfricanism                                   Black Power African American Black history Black Panther Party African                                   American culture AfricanAmerican Civil Rights Movement  Black                                   History Month AfricanAmerican history Angela Davis Malcolm X or Black                                   Color,Orlando Florida,Florida,2017-02-13,Florida
3355,Join the event bring your friends feel safe with usIts free Organized on a donation basis Join the event bring your friendsfeel safe with usIts free Organized on a donation basis Free Selfdefense class in NYFree Selfdefense class in NY,1690.0,https://www.facebook.com/events/144838441523561 Of,2002.0,94.0,04/13/17 05:26:20 AM PDT,Martin Luther King Jr PanAfricanism Black                                   Power Martial arts African American Black history Black Panther Party                                   AfricanAmerican culture AfricanAmerican Civil Rights Movement                                    Black History Month AfricanAmerican history Angela Davis Malcolm X Self                                   Defense Family Black Color or The Self Defense Company                                       Mixed martial arts Martial arts The Womens                                   Self Defense Institute PERSONAL  HOME DEFENSE Selfdefense Self                                   defense United States Personal Defense Right of selfdefense Self                                   Defense Family or Active Self Protection,New York,New York,2017-04-13,New York
3372,The second selfdefense class withJoin the event bringyour friends feel safe with us Selfdefense classes with,2999.12,https://www.facebook.com/events/694209204073106/,4250.0,198.0,02/01 /17 03:29: 15 AM PST,The Womens Self Defense Institute African                                   American culture AfricanAmerican Civil Rights Movement  African                                   American history Right of selfdefense or Malcolm X,New York,New York,,New York
2,You can go to hell or followinstead Texas is where youalways want to be We are Texans and were not like the rest Follow us LoneStar State RebelsInstagram photos and videos,1000.0,https:Hinstagram.com/south_lone_star/,17256.0,38.0,10/20/15 10:36:20 AM PDT,,Texas,Texas,2015-10-20,Texas
22,Click learn more See the latest breaking news photos and videos BlackAmerica Blacklivessss,1550.41,https://www.instagram.com/black—america—today/,9555.0,32.0,12/01/15 07:37:28 AM PST,,Chicago Illinois,Illinois,2015-12-01,Illinois
26,Home of the Brave Support our Veterans Click Learn More Veterans USAGovSpending,898.36,https://www.instagram.com/veterans_us/,1721.0,6.0,12/01/15 05:51:31 AM PST,Veterans,Washington Columbia New Mexico,Washington Columbia New Mexico,2015-12-01,Washington D.C.
26,Home of the Brave Support our Veterans Click Learn More Veterans USAGovSpending,898.36,https://www.instagram.com/veterans_us/,1721.0,6.0,12/01/15 05:51:31 AM PST,Veterans,Washington Columbia New Mexico,Washington Columbia New Mexico,2015-12-01,New Mexico
33,Unbelievable amount of the US governments waste Click Learn More TheUS Gov Spending Stats GovSpending,950.0,https://instagram.com/gov_spending/,2404.0,6.0,12/01/15 05:57:42 AM PST,Liberalism,Massachusetts,Massachusetts,2015-12-01,Massachusetts
41,gather recent videos about outrageous police misconduct really valuableones but underrepresented by mass media,5.27,https://www.facebook.com/B lack I ivessss-9301 58090385628/,7190.0,479.0,06/15/16 02:14:28 AM PDT,Cop Block,Maryland,Maryland,2016-06-15,Maryland
44,You can go to hell or followinstead Texas is where youalways want to be We are Texans and were not like the rest Follow us LoneStar State RebelsInstagram photos and videos,0.0,https:Hinstagram.com/south_lone_star,0.0,0.0,10/13/15 01:34:37 AM PDT,,Texas,Texas,2015-10-13,Texas
53,Join us because we care Black Matters,0.0,https://www.facebook.com/blackmattersus/,0.0,0.0,07/13/15 07:13:40 AM PDT,people who like Black Matters,Atlanta Georgia Maryland Missouri Virginia,Georgia Maryland Missouri Virginia,2015-07-13,Georgia
53,Join us because we care Black Matters,0.0,https://www.facebook.com/blackmattersus/,0.0,0.0,07/13/15 07:13:40 AM PDT,people who like Black Matters,Atlanta Georgia Maryland Missouri Virginia,Georgia Maryland Missouri Virginia,2015-07-13,Maryland
53,Join us because we care Black Matters,0.0,https://www.facebook.com/blackmattersus/,0.0,0.0,07/13/15 07:13:40 AM PDT,people who like Black Matters,Atlanta Georgia Maryland Missouri Virginia,Georgia Maryland Missouri Virginia,2015-07-13,Missouri
53,Join us because we care Black Matters,0.0,https://www.facebook.com/blackmattersus/,0.0,0.0,07/13/15 07:13:40 AM PDT,people who like Black Matters,Atlanta Georgia Maryland Missouri Virginia,Georgia Maryland Missouri Virginia,2015-07-13,Virginia
54,Join us because we care Black Matters,53424.95,https://www.facebook.com/blackmattersus/,201428.0,12127.0,07/13/15 07:20:58 AM PDT,people who like Black Matters,Atlanta Georgia Maryland Missouri Virginia,Georgia Maryland Missouri Virginia,2015-07-13,Georgia
54,Join us because we care Black Matters,53424.95,https://www.facebook.com/blackmattersus/,201428.0,12127.0,07/13/15 07:20:58 AM PDT,people who like Black Matters,Atlanta Georgia Maryland Missouri Virginia,Georgia Maryland Missouri Virginia,2015-07-13,Maryland
54,Join us because we care Black Matters,53424.95,https://www.facebook.com/blackmattersus/,201428.0,12127.0,07/13/15 07:20:58 AM PDT,people who like Black Matters,Atlanta Georgia Maryland Missouri Virginia,Georgia Maryland Missouri Virginia,2015-07-13,Missouri
54,Join us because we care Black Matters,53424.95,https://www.facebook.com/blackmattersus/,201428.0,12127.0,07/13/15 07:20:58 AM PDT,people who like Black Matters,Atlanta Georgia Maryland Missouri Virginia,Georgia Maryland Missouri Virginia,2015-07-13,Virginia
57,Stand up South Carolina Lets stop the propaganda of hate and whitesupremacy Not My Heritage,4670.0,https://www.facebook.com/events/I 730167210590258/,7457.0,304.0,07/21/16 05:32:28 AM PDT,people who like Black Matters,South Carolina,South Carolina,2016-07-21,South Carolina
62,One year ago nine people were killed by a gunman including the seniorpastor state senat Remember Victims of Charleston Shooting,14398.69,https://www.facebook.com/events/257074994652475/,42890.0,2182.0,06/01/16 06:03:23 AM PDT,,Charleston South Carolina,South Carolina,2016-06-01,South Carolina
64,Join us Because we care,340.34,https://www.facebook.com/Black-Matters-1579673598947501/,500.0,25.0,07/10/15 01:03:31 AM PDT,people who like Black Matters,Arkansas Washington Columbia Atlanta Georgia New Orleans Louisiana Baltimore Maryland Missouri Cleveland Ohio Philadelphia Pennsylvania Memphis Tennessee Richmond Virginia Milwaukee Wisconsin,Arkansas Washington Columbia Georgia Louisiana Maryland Missouri Ohio Pennsylvania Tennessee Virginia Wisconsin,2015-07-10,Arkansas
64,Join us Because we care,340.34,https://www.facebook.com/Black-Matters-1579673598947501/,500.0,25.0,07/10/15 01:03:31 AM PDT,people who like Black Matters,Arkansas Washington Columbia Atlanta Georgia New Orleans Louisiana Baltimore Maryland Missouri Cleveland Ohio Philadelphia Pennsylvania Memphis Tennessee Richmond Virginia Milwaukee Wisconsin,Arkansas Washington Columbia Georgia Louisiana Maryland Missouri Ohio Pennsylvania Tennessee Virginia Wisconsin,2015-07-10,Washington D.C.
64,Join us Because we care,340.34,https://www.facebook.com/Black-Matters-1579673598947501/,500.0,25.0,07/10/15 01:03:31 AM PDT,people who like Black Matters,Arkansas Washington Columbia Atlanta Georgia New Orleans Louisiana Baltimore Maryland Missouri Cleveland Ohio Philadelphia Pennsylvania Memphis Tennessee Richmond Virginia Milwaukee Wisconsin,Arkansas Washington Columbia Georgia Louisiana Maryland Missouri Ohio Pennsylvania Tennessee Virginia Wisconsin,2015-07-10,Georgia
64,Join us Because we care,340.34,https://www.facebook.com/Black-Matters-1579673598947501/,500.0,25.0,07/10/15 01:03:31 AM PDT,people who like Black Matters,Arkansas Washington Columbia Atlanta Georgia New Orleans Louisiana Baltimore Maryland Missouri Cleveland Ohio Philadelphia Pennsylvania Memphis Tennessee Richmond Virginia Milwaukee Wisconsin,Arkansas Washington Columbia Georgia Louisiana Maryland Missouri Ohio Pennsylvania Tennessee Virginia Wisconsin,2015-07-10,Louisiana
64,Join us Because we care,340.34,https://www.facebook.com/Black-Matters-1579673598947501/,500.0,25.0,07/10/15 01:03:31 AM PDT,people who like Black Matters,Arkansas Washington Columbia Atlanta Georgia New Orleans Louisiana Baltimore Maryland Missouri Cleveland Ohio Philadelphia Pennsylvania Memphis Tennessee Richmond Virginia Milwaukee Wisconsin,Arkansas Washington Columbia Georgia Louisiana Maryland Missouri Ohio Pennsylvania Tennessee Virginia Wisconsin,2015-07-10,Maryland
64,Join us Because we care,340.34,https://www.facebook.com/Black-Matters-1579673598947501/,500.0,25.0,07/10/15 01:03:31 AM PDT,people who like Black Matters,Arkansas Washington Columbia Atlanta Georgia New Orleans Louisiana Baltimore Maryland Missouri Cleveland Ohio Philadelphia Pennsylvania Memphis Tennessee Richmond Virginia Milwaukee Wisconsin,Arkansas Washington Columbia Georgia Louisiana Maryland Missouri Ohio Pennsylvania Tennessee Virginia Wisconsin,2015-07-10,Missouri
64,Join us Because we care,340.34,https://www.facebook.com/Black-Matters-1579673598947501/,500.0,25.0,07/10/15 01:03:31 AM PDT,people who like Black Matters,Arkansas Washington Columbia Atlanta Georgia New Orleans Louisiana Baltimore Maryland Missouri Cleveland Ohio Philadelphia Pennsylvania Memphis Tennessee Richmond Virginia Milwaukee Wisconsin,Arkansas Washington Columbia Georgia Louisiana Maryland Missouri Ohio Pennsylvania Tennessee Virginia Wisconsin,2015-07-10,Ohio
64,Join us Because we care,340.34,https://www.facebook.com/Black-Matters-1579673598947501/,500.0,25.0,07/10/15 01:03:31 AM PDT,people who like Black Matters,Arkansas Washington Columbia Atlanta Georgia New Orleans Louisiana Baltimore Maryland Missouri Cleveland Ohio Philadelphia Pennsylvania Memphis Tennessee Richmond Virginia Milwaukee Wisconsin,Arkansas Washington Columbia Georgia Louisiana Maryland Missouri Ohio Pennsylvania Tennessee Virginia Wisconsin,2015-07-10,Pennsylvania
64,Join us Because we care,340.34,https://www.facebook.com/Black-Matters-1579673598947501/,500.0,25.0,07/10/15 01:03:31 AM PDT,people who like Black Matters,Arkansas Washington Columbia Atlanta Georgia New Orleans Louisiana Baltimore Maryland Missouri Cleveland Ohio Philadelphia Pennsylvania Memphis Tennessee Richmond Virginia Milwaukee Wisconsin,Arkansas Washington Columbia Georgia Louisiana Maryland Missouri Ohio Pennsylvania Tennessee Virginia Wisconsin,2015-07-10,Tennessee
64,Join us Because we care,340.34,https://www.facebook.com/Black-Matters-1579673598947501/,500.0,25.0,07/10/15 01:03:31 AM PDT,people who like Black Matters,Arkansas Washington Columbia Atlanta Georgia New Orleans Louisiana Baltimore Maryland Missouri Cleveland Ohio Philadelphia Pennsylvania Memphis Tennessee Richmond Virginia Milwaukee Wisconsin,Arkansas Washington Columbia Georgia Louisiana Maryland Missouri Ohio Pennsylvania Tennessee Virginia Wisconsin,2015-07-10,Virginia
64,Join us Because we care,340.34,https://www.facebook.com/Black-Matters-1579673598947501/,500.0,25.0,07/10/15 01:03:31 AM PDT,people who like Black Matters,Arkansas Washington Columbia Atlanta Georgia New Orleans Louisiana Baltimore Maryland Missouri Cleveland Ohio Philadelphia Pennsylvania Memphis Tennessee Richmond Virginia Milwaukee Wisconsin,Arkansas Washington Columbia Georgia Louisiana Maryland Missouri Ohio Pennsylvania Tennessee Virginia Wisconsin,2015-07-10,Wisconsin
65,Two years have passed since Augustthe date when yearoldEzell Ford was mur Justice For Ezell Ford And Donnell Thompson,14881.75,https://www.facebook.com/events/1702267153358101/,41395.0,1734.0,08/04/16 07:25:31 AM PDT,BlackNewscom Black History Month or AfricanAmerican history,Los Angeles California,California,2016-08-04,California
66,A rally in loving memory of Aiyana JonesMaywill mark the sixth anniversary of the br The th Anniversary Of TheAiyana Jones Death,0.82,https://www.facebook.com/events/1727519624184050/,3.0,0.0,05/06/16 01:00:41 AM PDT,HuffPost Black Voices,Detroit Michigan,Michigan,2016-05-06,Michigan
67,A rally in loving memory of Aiyana JonesMaywill mark the sixth anniversary of the br The th Anniversary Of TheAiyana Jones Death,1714.83,https://www.facebook.com/events/1727519624184050/,13066.0,804.0,05/06/16 02:21:24 AM PDT,Detroit BlackNewscom or HuffPost Black                                    Voices,Detroit Michigan,Michigan,2016-05-06,Michigan
68,A rally in loving memory of Aiyana JonesMaywill mark the sixth anniversary of the br The th Anniversary Of TheAiyana Jones Death,9192.47,https://www.facebook.com/events/1727519624184050/,54836.0,2546.0,05/10/16 01:31:35 AM PDT,,Detroit Michigan,Michigan,2016-05-10,Michigan
69,A rally in loving memory of Aiyana JonesMaywill mark the sixth anniversary of the br The th Anniversary Of TheAiyana Jones Death,1505.34,https://www.facebook.com/events/1 727519624184050/,8376.0,314.0,05/16/16 07:59:50 AM PDT,African American US,Detroit Michigan,Michigan,2016-05-16,Michigan
70,A rally in loving memory of Aiyana JonesMaywill mark the sixth anniversary of the br The th Anniversary Of TheAiyana Jones Death,2570.85,https://www.facebook.com/events/1 727519624184050/,10089.0,442.0,05/17/16 12:21:13 AM PDT,African American US,Detroit Michigan,Michigan,2016-05-17,Michigan
82,Fastgrowing black community Latest news and everyday updates,257.25,https://www.facebook.com/Black-Matters-1579673598947501/,191.0,6.0,07/10/15 01:02:58 AM PDT,people who like Black Matters,Arkansas Washington Columbia Atlanta Georgia New Orleans Louisiana Baltimore Maryland Missouri Cleveland Ohio Philadelphia Pennsylvania Memphis Tennessee Richmond Virginia Milwaukee Wisconsin,Arkansas Washington Columbia Georgia Louisiana Maryland Missouri Ohio Pennsylvania Tennessee Virginia Wisconsin,2015-07-10,Arkansas
82,Fastgrowing black community Latest news and everyday updates,257.25,https://www.facebook.com/Black-Matters-1579673598947501/,191.0,6.0,07/10/15 01:02:58 AM PDT,people who like Black Matters,Arkansas Washington Columbia Atlanta Georgia New Orleans Louisiana Baltimore Maryland Missouri Cleveland Ohio Philadelphia Pennsylvania Memphis Tennessee Richmond Virginia Milwaukee Wisconsin,Arkansas Washington Columbia Georgia Louisiana Maryland Missouri Ohio Pennsylvania Tennessee Virginia Wisconsin,2015-07-10,Washington D.C.
82,Fastgrowing black community Latest news and everyday updates,257.25,https://www.facebook.com/Black-Matters-1579673598947501/,191.0,6.0,07/10/15 01:02:58 AM PDT,people who like Black Matters,Arkansas Washington Columbia Atlanta Georgia New Orleans Louisiana Baltimore Maryland Missouri Cleveland Ohio Philadelphia Pennsylvania Memphis Tennessee Richmond Virginia Milwaukee Wisconsin,Arkansas Washington Columbia Georgia Louisiana Maryland Missouri Ohio Pennsylvania Tennessee Virginia Wisconsin,2015-07-10,Georgia
82,Fastgrowing black community Latest news and everyday updates,257.25,https://www.facebook.com/Black-Matters-1579673598947501/,191.0,6.0,07/10/15 01:02:58 AM PDT,people who like Black Matters,Arkansas Washington Columbia Atlanta Georgia New Orleans Louisiana Baltimore Maryland Missouri Cleveland Ohio Philadelphia Pennsylvania Memphis Tennessee Richmond Virginia Milwaukee Wisconsin,Arkansas Washington Columbia Georgia Louisiana Maryland Missouri Ohio Pennsylvania Tennessee Virginia Wisconsin,2015-07-10,Louisiana
82,Fastgrowing black community Latest news and everyday updates,257.25,https://www.facebook.com/Black-Matters-1579673598947501/,191.0,6.0,07/10/15 01:02:58 AM PDT,people who like Black Matters,Arkansas Washington Columbia Atlanta Georgia New Orleans Louisiana Baltimore Maryland Missouri Cleveland Ohio Philadelphia Pennsylvania Memphis Tennessee Richmond Virginia Milwaukee Wisconsin,Arkansas Washington Columbia Georgia Louisiana Maryland Missouri Ohio Pennsylvania Tennessee Virginia Wisconsin,2015-07-10,Maryland
82,Fastgrowing black community Latest news and everyday updates,257.25,https://www.facebook.com/Black-Matters-1579673598947501/,191.0,6.0,07/10/15 01:02:58 AM PDT,people who like Black Matters,Arkansas Washington Columbia Atlanta Georgia New Orleans Louisiana Baltimore Maryland Missouri Cleveland Ohio Philadelphia Pennsylvania Memphis Tennessee Richmond Virginia Milwaukee Wisconsin,Arkansas Washington Columbia Georgia Louisiana Maryland Missouri Ohio Pennsylvania Tennessee Virginia Wisconsin,2015-07-10,Missouri
82,Fastgrowing black community Latest news and everyday updates,257.25,https://www.facebook.com/Black-Matters-1579673598947501/,191.0,6.0,07/10/15 01:02:58 AM PDT,people who like Black Matters,Arkansas Washington Columbia Atlanta Georgia New Orleans Louisiana Baltimore Maryland Missouri Cleveland Ohio Philadelphia Pennsylvania Memphis Tennessee Richmond Virginia Milwaukee Wisconsin,Arkansas Washington Columbia Georgia Louisiana Maryland Missouri Ohio Pennsylvania Tennessee Virginia Wisconsin,2015-07-10,Ohio
82,Fastgrowing black community Latest news and everyday updates,257.25,https://www.facebook.com/Black-Matters-1579673598947501/,191.0,6.0,07/10/15 01:02:58 AM PDT,people who like Black Matters,Arkansas Washington Columbia Atlanta Georgia New Orleans Louisiana Baltimore Maryland Missouri Cleveland Ohio Philadelphia Pennsylvania Memphis Tennessee Richmond Virginia Milwaukee Wisconsin,Arkansas Washington Columbia Georgia Louisiana Maryland Missouri Ohio Pennsylvania Tennessee Virginia Wisconsin,2015-07-10,Pennsylvania
82,Fastgrowing black community Latest news and everyday updates,257.25,https://www.facebook.com/Black-Matters-1579673598947501/,191.0,6.0,07/10/15 01:02:58 AM PDT,people who like Black Matters,Arkansas Washington Columbia Atlanta Georgia New Orleans Louisiana Baltimore Maryland Missouri Cleveland Ohio Philadelphia Pennsylvania Memphis Tennessee Richmond Virginia Milwaukee Wisconsin,Arkansas Washington Columbia Georgia Louisiana Maryland Missouri Ohio Pennsylvania Tennessee Virginia Wisconsin,2015-07-10,Tennessee
82,Fastgrowing black community Latest news and everyday updates,257.25,https://www.facebook.com/Black-Matters-1579673598947501/,191.0,6.0,07/10/15 01:02:58 AM PDT,people who like Black Matters,Arkansas Washington Columbia Atlanta Georgia New Orleans Louisiana Baltimore Maryland Missouri Cleveland Ohio Philadelphia Pennsylvania Memphis Tennessee Richmond Virginia Milwaukee Wisconsin,Arkansas Washington Columbia Georgia Louisiana Maryland Missouri Ohio Pennsylvania Tennessee Virginia Wisconsin,2015-07-10,Virginia
82,Fastgrowing black community Latest news and everyday updates,257.25,https://www.facebook.com/Black-Matters-1579673598947501/,191.0,6.0,07/10/15 01:02:58 AM PDT,people who like Black Matters,Arkansas Washington Columbia Atlanta Georgia New Orleans Louisiana Baltimore Maryland Missouri Cleveland Ohio Philadelphia Pennsylvania Memphis Tennessee Richmond Virginia Milwaukee Wisconsin,Arkansas Washington Columbia Georgia Louisiana Maryland Missouri Ohio Pennsylvania Tennessee Virginia Wisconsin,2015-07-10,Wisconsin
83,Join us Because we care,468.0,https://www.facebook.com/Black-Matters-1579673598947501/,613.0,30.0,07/10/15 01:03:32 AM PDT,people who like Black Matters,Arkansas Washington Columbia Atlanta Georgia New Orleans Louisiana Baltimore Maryland Missouri Cleveland Ohio Philadelphia Pennsylvania Memphis Tennessee Richmond Virginia Milwaukee Wisconsin,Arkansas Washington Columbia Georgia Louisiana Maryland Missouri Ohio Pennsylvania Tennessee Virginia Wisconsin,2015-07-10,Arkansas
83,Join us Because we care,468.0,https://www.facebook.com/Black-Matters-1579673598947501/,613.0,30.0,07/10/15 01:03:32 AM PDT,people who like Black Matters,Arkansas Washington Columbia Atlanta Georgia New Orleans Louisiana Baltimore Maryland Missouri Cleveland Ohio Philadelphia Pennsylvania Memphis Tennessee Richmond Virginia Milwaukee Wisconsin,Arkansas Washington Columbia Georgia Louisiana Maryland Missouri Ohio Pennsylvania Tennessee Virginia Wisconsin,2015-07-10,Washington D.C.
83,Join us Because we care,468.0,https://www.facebook.com/Black-Matters-1579673598947501/,613.0,30.0,07/10/15 01:03:32 AM PDT,people who like Black Matters,Arkansas Washington Columbia Atlanta Georgia New Orleans Louisiana Baltimore Maryland Missouri Cleveland Ohio Philadelphia Pennsylvania Memphis Tennessee Richmond Virginia Milwaukee Wisconsin,Arkansas Washington Columbia Georgia Louisiana Maryland Missouri Ohio Pennsylvania Tennessee Virginia Wisconsin,2015-07-10,Georgia
83,Join us Because we care,468.0,https://www.facebook.com/Black-Matters-1579673598947501/,613.0,30.0,07/10/15 01:03:32 AM PDT,people who like Black Matters,Arkansas Washington Columbia Atlanta Georgia New Orleans Louisiana Baltimore Maryland Missouri Cleveland Ohio Philadelphia Pennsylvania Memphis Tennessee Richmond Virginia Milwaukee Wisconsin,Arkansas Washington Columbia Georgia Louisiana Maryland Missouri Ohio Pennsylvania Tennessee Virginia Wisconsin,2015-07-10,Louisiana
83,Join us Because we care,468.0,https://www.facebook.com/Black-Matters-1579673598947501/,613.0,30.0,07/10/15 01:03:32 AM PDT,people who like Black Matters,Arkansas Washington Columbia Atlanta Georgia New Orleans Louisiana Baltimore Maryland Missouri Cleveland Ohio Philadelphia Pennsylvania Memphis Tennessee Richmond Virginia Milwaukee Wisconsin,Arkansas Washington Columbia Georgia Louisiana Maryland Missouri Ohio Pennsylvania Tennessee Virginia Wisconsin,2015-07-10,Maryland
83,Join us Because we care,468.0,https://www.facebook.com/Black-Matters-1579673598947501/,613.0,30.0,07/10/15 01:03:32 AM PDT,people who like Black Matters,Arkansas Washington Columbia Atlanta Georgia New Orleans Louisiana Baltimore Maryland Missouri Cleveland Ohio Philadelphia Pennsylvania Memphis Tennessee Richmond Virginia Milwaukee Wisconsin,Arkansas Washington Columbia Georgia Louisiana Maryland Missouri Ohio Pennsylvania Tennessee Virginia Wisconsin,2015-07-10,Missouri
83,Join us Because we care,468.0,https://www.facebook.com/Black-Matters-1579673598947501/,613.0,30.0,07/10/15 01:03:32 AM PDT,people who like Black Matters,Arkansas Washington Columbia Atlanta Georgia New Orleans Louisiana Baltimore Maryland Missouri Cleveland Ohio Philadelphia Pennsylvania Memphis Tennessee Richmond Virginia Milwaukee Wisconsin,Arkansas Washington Columbia Georgia Louisiana Maryland Missouri Ohio Pennsylvania Tennessee Virginia Wisconsin,2015-07-10,Ohio
83,Join us Because we care,468.0,https://www.facebook.com/Black-Matters-1579673598947501/,613.0,30.0,07/10/15 01:03:32 AM PDT,people who like Black Matters,Arkansas Washington Columbia Atlanta Georgia New Orleans Louisiana Baltimore Maryland Missouri Cleveland Ohio Philadelphia Pennsylvania Memphis Tennessee Richmond Virginia Milwaukee Wisconsin,Arkansas Washington Columbia Georgia Louisiana Maryland Missouri Ohio Pennsylvania Tennessee Virginia Wisconsin,2015-07-10,Pennsylvania
83,Join us Because we care,468.0,https://www.facebook.com/Black-Matters-1579673598947501/,613.0,30.0,07/10/15 01:03:32 AM PDT,people who like Black Matters,Arkansas Washington Columbia Atlanta Georgia New Orleans Louisiana Baltimore Maryland Missouri Cleveland Ohio Philadelphia Pennsylvania Memphis Tennessee Richmond Virginia Milwaukee Wisconsin,Arkansas Washington Columbia Georgia Louisiana Maryland Missouri Ohio Pennsylvania Tennessee Virginia Wisconsin,2015-07-10,Tennessee
83,Join us Because we care,468.0,https://www.facebook.com/Black-Matters-1579673598947501/,613.0,30.0,07/10/15 01:03:32 AM PDT,people who like Black Matters,Arkansas Washington Columbia Atlanta Georgia New Orleans Louisiana Baltimore Maryland Missouri Cleveland Ohio Philadelphia Pennsylvania Memphis Tennessee Richmond Virginia Milwaukee Wisconsin,Arkansas Washington Columbia Georgia Louisiana Maryland Missouri Ohio Pennsylvania Tennessee Virginia Wisconsin,2015-07-10,Virginia
83,Join us Because we care,468.0,https://www.facebook.com/Black-Matters-1579673598947501/,613.0,30.0,07/10/15 01:03:32 AM PDT,people who like Black Matters,Arkansas Washington Columbia Atlanta Georgia New Orleans Louisiana Baltimore Maryland Missouri Cleveland Ohio Philadelphia Pennsylvania Memphis Tennessee Richmond Virginia Milwaukee Wisconsin,Arkansas Washington Columbia Georgia Louisiana Maryland Missouri Ohio Pennsylvania Tennessee Virginia Wisconsin,2015-07-10,Wisconsin
86,Two years have passed since Augustthe date when yearoldEzell Ford was mur Justice For Ezell Ford and Donnell Thompson,3529.26,https://www.facebook.com/events/1051176154917933/,2920.0,75.0,08/22/16 07:04:52 AM PDT,Martin Luther Black Panther Party AfricanAmerican Civil Rights                                    Movement AfricanAmerican history or Malcolm X,Los Angeles California,California,2016-08-22,California
87,Two years have passed since Augustthe date when yearoldEzell Ford was mur Justice For Ezell Ford and Donnell Thompson,7.11,https://www.facebook.com/events/1051176154917933/,6368.0,180.0,08/23/16 04:11:38 AM PDT,Malcolm X,Los Angeles California,California,2016-08-23,California
88,Two years have passed since Augustthe date when yearoldEzell Ford was mur Justice For Ezell Ford and Donnell Thompson,6003.52,https://www.facebook.com/events/I 051176154917933/,5289.0,236.0,08/26/16 04:19:56 AM PDT,Malcolm X,Los Angeles California,California,2016-08-26,California
89,Two years have passed since Augustthe date when yearoldEzell Ford was mur Justice For Ezell Ford Jesse Romero and DonnellThompson,147.23,https://www.facebook.com/events/1 051176154917933/,172.0,9.0,08/29/16 12:27:53 AM PDT,Latin or Malcolm X,Los Angeles California,California,2016-08-29,California
90,Two years have passed since Augustthe date when yearoldEzell Ford was mur Justice For Ezell Ford Jesse Romero and DonnellThompson,3849.25,https://www.facebook.com/events/1 051176154917933/,3477.0,103.0,08/29/16 05:11:27 AM PDT,Latin or Malcolm X,Los Angeles California,California,2016-08-29,California
92,Fastgrowing black community Latest news and everyday updates,445.3,https://www.facebook.com/Black-Matters-1579673598947501/,608.0,27.0,07/10/15 01:03:03 AM PDT,people who like Black Matters,Arkansas Washington Columbia Atlanta Georgia New Orleans Louisiana Baltimore Maryland Missouri Cleveland Ohio Philadelphia Pennsylvania Memphis Tennessee Richmond Virginia Milwaukee Wisconsin,Arkansas Washington Columbia Georgia Louisiana Maryland Missouri Ohio Pennsylvania Tennessee Virginia Wisconsin,2015-07-10,Arkansas
92,Fastgrowing black community Latest news and everyday updates,445.3,https://www.facebook.com/Black-Matters-1579673598947501/,608.0,27.0,07/10/15 01:03:03 AM PDT,people who like Black Matters,Arkansas Washington Columbia Atlanta Georgia New Orleans Louisiana Baltimore Maryland Missouri Cleveland Ohio Philadelphia Pennsylvania Memphis Tennessee Richmond Virginia Milwaukee Wisconsin,Arkansas Washington Columbia Georgia Louisiana Maryland Missouri Ohio Pennsylvania Tennessee Virginia Wisconsin,2015-07-10,Washington D.C.
92,Fastgrowing black community Latest news and everyday updates,445.3,https://www.facebook.com/Black-Matters-1579673598947501/,608.0,27.0,07/10/15 01:03:03 AM PDT,people who like Black Matters,Arkansas Washington Columbia Atlanta Georgia New Orleans Louisiana Baltimore Maryland Missouri Cleveland Ohio Philadelphia Pennsylvania Memphis Tennessee Richmond Virginia Milwaukee Wisconsin,Arkansas Washington Columbia Georgia Louisiana Maryland Missouri Ohio Pennsylvania Tennessee Virginia Wisconsin,2015-07-10,Georgia
92,Fastgrowing black community Latest news and everyday updates,445.3,https://www.facebook.com/Black-Matters-1579673598947501/,608.0,27.0,07/10/15 01:03:03 AM PDT,people who like Black Matters,Arkansas Washington Columbia Atlanta Georgia New Orleans Louisiana Baltimore Maryland Missouri Cleveland Ohio Philadelphia Pennsylvania Memphis Tennessee Richmond Virginia Milwaukee Wisconsin,Arkansas Washington Columbia Georgia Louisiana Maryland Missouri Ohio Pennsylvania Tennessee Virginia Wisconsin,2015-07-10,Louisiana
92,Fastgrowing black community Latest news and everyday updates,445.3,https://www.facebook.com/Black-Matters-1579673598947501/,608.0,27.0,07/10/15 01:03:03 AM PDT,people who like Black Matters,Arkansas Washington Columbia Atlanta Georgia New Orleans Louisiana Baltimore Maryland Missouri Cleveland Ohio Philadelphia Pennsylvania Memphis Tennessee Richmond Virginia Milwaukee Wisconsin,Arkansas Washington Columbia Georgia Louisiana Maryland Missouri Ohio Pennsylvania Tennessee Virginia Wisconsin,2015-07-10,Maryland
92,Fastgrowing black community Latest news and everyday updates,445.3,https://www.facebook.com/Black-Matters-1579673598947501/,608.0,27.0,07/10/15 01:03:03 AM PDT,people who like Black Matters,Arkansas Washington Columbia Atlanta Georgia New Orleans Louisiana Baltimore Maryland Missouri Cleveland Ohio Philadelphia Pennsylvania Memphis Tennessee Richmond Virginia Milwaukee Wisconsin,Arkansas Washington Columbia Georgia Louisiana Maryland Missouri Ohio Pennsylvania Tennessee Virginia Wisconsin,2015-07-10,Missouri
92,Fastgrowing black community Latest news and everyday updates,445.3,https://www.facebook.com/Black-Matters-1579673598947501/,608.0,27.0,07/10/15 01:03:03 AM PDT,people who like Black Matters,Arkansas Washington Columbia Atlanta Georgia New Orleans Louisiana Baltimore Maryland Missouri Cleveland Ohio Philadelphia Pennsylvania Memphis Tennessee Richmond Virginia Milwaukee Wisconsin,Arkansas Washington Columbia Georgia Louisiana Maryland Missouri Ohio Pennsylvania Tennessee Virginia Wisconsin,2015-07-10,Ohio
92,Fastgrowing black community Latest news and everyday updates,445.3,https://www.facebook.com/Black-Matters-1579673598947501/,608.0,27.0,07/10/15 01:03:03 AM PDT,people who like Black Matters,Arkansas Washington Columbia Atlanta Georgia New Orleans Louisiana Baltimore Maryland Missouri Cleveland Ohio Philadelphia Pennsylvania Memphis Tennessee Richmond Virginia Milwaukee Wisconsin,Arkansas Washington Columbia Georgia Louisiana Maryland Missouri Ohio Pennsylvania Tennessee Virginia Wisconsin,2015-07-10,Pennsylvania
92,Fastgrowing black community Latest news and everyday updates,445.3,https://www.facebook.com/Black-Matters-1579673598947501/,608.0,27.0,07/10/15 01:03:03 AM PDT,people who like Black Matters,Arkansas Washington Columbia Atlanta Georgia New Orleans Louisiana Baltimore Maryland Missouri Cleveland Ohio Philadelphia Pennsylvania Memphis Tennessee Richmond Virginia Milwaukee Wisconsin,Arkansas Washington Columbia Georgia Louisiana Maryland Missouri Ohio Pennsylvania Tennessee Virginia Wisconsin,2015-07-10,Tennessee
92,Fastgrowing black community Latest news and everyday updates,445.3,https://www.facebook.com/Black-Matters-1579673598947501/,608.0,27.0,07/10/15 01:03:03 AM PDT,people who like Black Matters,Arkansas Washington Columbia Atlanta Georgia New Orleans Louisiana Baltimore Maryland Missouri Cleveland Ohio Philadelphia Pennsylvania Memphis Tennessee Richmond Virginia Milwaukee Wisconsin,Arkansas Washington Columbia Georgia Louisiana Maryland Missouri Ohio Pennsylvania Tennessee Virginia Wisconsin,2015-07-10,Virginia
92,Fastgrowing black community Latest news and everyday updates,445.3,https://www.facebook.com/Black-Matters-1579673598947501/,608.0,27.0,07/10/15 01:03:03 AM PDT,people who like Black Matters,Arkansas Washington Columbia Atlanta Georgia New Orleans Louisiana Baltimore Maryland Missouri Cleveland Ohio Philadelphia Pennsylvania Memphis Tennessee Richmond Virginia Milwaukee Wisconsin,Arkansas Washington Columbia Georgia Louisiana Maryland Missouri Ohio Pennsylvania Tennessee Virginia Wisconsin,2015-07-10,Wisconsin
93,A Year Without Justice for Tamir Rice Join the meeting A Year WithoutJustice for Tamir Rice,3988.68,https://www.facebook.com/events/1486230091674577/,17231.0,922.0,11/19/15 11:59:53 PM PST,,Cleveland Ohio,Ohio,2015-11-19,Ohio
94,Keeping eye on our brothers cases and much more,0.0,https://www.facebook.com/blackmattersus/,0.0,0.0,07/13/15 07:17:59 AM PDT,people who like Black Matters,Atlanta Georgia Maryland Missouri Virginia,Georgia Maryland Missouri Virginia,2015-07-13,Georgia
94,Keeping eye on our brothers cases and much more,0.0,https://www.facebook.com/blackmattersus/,0.0,0.0,07/13/15 07:17:59 AM PDT,people who like Black Matters,Atlanta Georgia Maryland Missouri Virginia,Georgia Maryland Missouri Virginia,2015-07-13,Maryland
94,Keeping eye on our brothers cases and much more,0.0,https://www.facebook.com/blackmattersus/,0.0,0.0,07/13/15 07:17:59 AM PDT,people who like Black Matters,Atlanta Georgia Maryland Missouri Virginia,Georgia Maryland Missouri Virginia,2015-07-13,Missouri
94,Keeping eye on our brothers cases and much more,0.0,https://www.facebook.com/blackmattersus/,0.0,0.0,07/13/15 07:17:59 AM PDT,people who like Black Matters,Atlanta Georgia Maryland Missouri Virginia,Georgia Maryland Missouri Virginia,2015-07-13,Virginia
95,Keeping eye on our brothers cases and much more,20446.19,https://www.facebook.com/blackmattersus/,69296.0,4366.0,07/13/15 07:20:58 AM PDT,people who like Black Matters,Atlanta Georgia Maryland Missouri Virginia,Georgia Maryland Missouri Virginia,2015-07-13,Georgia
95,Keeping eye on our brothers cases and much more,20446.19,https://www.facebook.com/blackmattersus/,69296.0,4366.0,07/13/15 07:20:58 AM PDT,people who like Black Matters,Atlanta Georgia Maryland Missouri Virginia,Georgia Maryland Missouri Virginia,2015-07-13,Maryland
95,Keeping eye on our brothers cases and much more,20446.19,https://www.facebook.com/blackmattersus/,69296.0,4366.0,07/13/15 07:20:58 AM PDT,people who like Black Matters,Atlanta Georgia Maryland Missouri Virginia,Georgia Maryland Missouri Virginia,2015-07-13,Missouri
95,Keeping eye on our brothers cases and much more,20446.19,https://www.facebook.com/blackmattersus/,69296.0,4366.0,07/13/15 07:20:58 AM PDT,people who like Black Matters,Atlanta Georgia Maryland Missouri Virginia,Georgia Maryland Missouri Virginia,2015-07-13,Virginia
96,Counterprotest against White Power Confederate rally at Stone MountainNot My Heritage,14.912,https://www.facebook.com/events/1579032272388106/,54463.0,2813.0,04/06/16 08:41:45 AM PDT,,Atlanta Georgia,Georgia,2016-04-06,Georgia
100,Keeping eye on our brothers cases and much more,0.0,https://www.facebook.com/blackmattersus/,0.0,0.0,07/13/15 07:18:00 AM PDT,people who like Black Matters,Atlanta Georgia Maryland Missouri Virginia,Georgia Maryland Missouri Virginia,2015-07-13,Georgia
100,Keeping eye on our brothers cases and much more,0.0,https://www.facebook.com/blackmattersus/,0.0,0.0,07/13/15 07:18:00 AM PDT,people who like Black Matters,Atlanta Georgia Maryland Missouri Virginia,Georgia Maryland Missouri Virginia,2015-07-13,Maryland
100,Keeping eye on our brothers cases and much more,0.0,https://www.facebook.com/blackmattersus/,0.0,0.0,07/13/15 07:18:00 AM PDT,people who like Black Matters,Atlanta Georgia Maryland Missouri Virginia,Georgia Maryland Missouri Virginia,2015-07-13,Missouri
100,Keeping eye on our brothers cases and much more,0.0,https://www.facebook.com/blackmattersus/,0.0,0.0,07/13/15 07:18:00 AM PDT,people who like Black Matters,Atlanta Georgia Maryland Missouri Virginia,Georgia Maryland Missouri Virginia,2015-07-13,Virginia
101,Keeping eye on our brothers cases and much more,23298.73,https://www.facebook.com/blackmattersus/,79112.0,5155.0,07/13/15 07:20:58 AM PDT,people who like Black Matters,Atlanta Georgia Maryland Missouri Virginia,Georgia Maryland Missouri Virginia,2015-07-13,Georgia
101,Keeping eye on our brothers cases and much more,23298.73,https://www.facebook.com/blackmattersus/,79112.0,5155.0,07/13/15 07:20:58 AM PDT,people who like Black Matters,Atlanta Georgia Maryland Missouri Virginia,Georgia Maryland Missouri Virginia,2015-07-13,Maryland
101,Keeping eye on our brothers cases and much more,23298.73,https://www.facebook.com/blackmattersus/,79112.0,5155.0,07/13/15 07:20:58 AM PDT,people who like Black Matters,Atlanta Georgia Maryland Missouri Virginia,Georgia Maryland Missouri Virginia,2015-07-13,Missouri
101,Keeping eye on our brothers cases and much more,23298.73,https://www.facebook.com/blackmattersus/,79112.0,5155.0,07/13/15 07:20:58 AM PDT,people who like Black Matters,Atlanta Georgia Maryland Missouri Virginia,Georgia Maryland Missouri Virginia,2015-07-13,Virginia
102,Almostyears have passed since the death of Eric Garner a father ofwhowas violentl Rally In Memory Of Eric Garner,12.485,https://www.facebook.com/events/1085290071563825/,37821.0,2775.0,07/06/16 03:03:43 AM PDT,BlackNewscom,New York,New York,2016-07-06,New York
103,Almostyears have passed since the death of Eric Garner a father ofwhowas violentl Rally In Memory Of Eric Garner,0.0,https://www.facebook.com/events/1085290071563825/,0.0,0.0,07/28/16 06:40:03 AM PDT,BlackNewscom Black History Month or AfricanAmerican history,New York,New York,2016-07-28,New York
104,Almostyears have passed since the death of Eric Garner a father ofwhowas violentl Rally In Memory Of Eric Garner,0.0,https://www.facebook.com/events/1085290071563825/,0.0,0.0,08/04/16 07:24:02 AM PDT,BlackNewscom Black History Month or AfricanAmerican history,Los Angeles California,California,2016-08-04,California
107,Come support an innocent man who is on death row Kevin Cooper has beenin prison sinceFree Kevin Cooper,1.495,https://www.facebook.com/events/983667495074239/,1879.0,64.0,06/10/16 02:08:55 AM PDT,,Oakland California,California,2016-06-10,California
108,We dont want to honor racism slavery and hatred Sand ur groundjoin therally Not My Heritage Rally,2.84,https://www.facebook.com/events/227388350945080/,9306.0,261.0,03/18/16 07:55:46 AM PDT,,Jackson Mississippi,Mississippi,2016-03-18,Mississippi
110,Join us because we care Black Matters,0.0,https://www.facebook.com/blackmattersus/,0.0,0.0,07/13/15 07:13:41 AM PDT,people who like Black Matters,Atlanta Georgia Maryland Missouri Virginia,Georgia Maryland Missouri Virginia,2015-07-13,Georgia
110,Join us because we care Black Matters,0.0,https://www.facebook.com/blackmattersus/,0.0,0.0,07/13/15 07:13:41 AM PDT,people who like Black Matters,Atlanta Georgia Maryland Missouri Virginia,Georgia Maryland Missouri Virginia,2015-07-13,Maryland
110,Join us because we care Black Matters,0.0,https://www.facebook.com/blackmattersus/,0.0,0.0,07/13/15 07:13:41 AM PDT,people who like Black Matters,Atlanta Georgia Maryland Missouri Virginia,Georgia Maryland Missouri Virginia,2015-07-13,Missouri
110,Join us because we care Black Matters,0.0,https://www.facebook.com/blackmattersus/,0.0,0.0,07/13/15 07:13:41 AM PDT,people who like Black Matters,Atlanta Georgia Maryland Missouri Virginia,Georgia Maryland Missouri Virginia,2015-07-13,Virginia
111,Join us because we care Black Matters,31741.49,https://www.facebook.com/blackmattersus/,113435.0,7173.0,07/13/15 07:20:58 AM PDT,people who like Black Matters,Atlanta Georgia Maryland Missouri Virginia,Georgia Maryland Missouri Virginia,2015-07-13,Georgia
111,Join us because we care Black Matters,31741.49,https://www.facebook.com/blackmattersus/,113435.0,7173.0,07/13/15 07:20:58 AM PDT,people who like Black Matters,Atlanta Georgia Maryland Missouri Virginia,Georgia Maryland Missouri Virginia,2015-07-13,Maryland
111,Join us because we care Black Matters,31741.49,https://www.facebook.com/blackmattersus/,113435.0,7173.0,07/13/15 07:20:58 AM PDT,people who like Black Matters,Atlanta Georgia Maryland Missouri Virginia,Georgia Maryland Missouri Virginia,2015-07-13,Missouri
111,Join us because we care Black Matters,31741.49,https://www.facebook.com/blackmattersus/,113435.0,7173.0,07/13/15 07:20:58 AM PDT,people who like Black Matters,Atlanta Georgia Maryland Missouri Virginia,Georgia Maryland Missouri Virginia,2015-07-13,Virginia
114,Man Dies After Police Use Pepper Spray During Arrest In AlabamaA man in Alabama collapsed and died after officers sprayed him with pepperspray while arresting him after a chase Tuscaloosa police said SaturdayPolice said Ware ran into nearby woods and struggled with officers when theycaught up with him Officers sprayed him with oleoresin capsicum morecommonly known as pepper spray according to police The chemical agentdebilitates a person by causing temporary blindness and irritating a personsnose and throatThe six officers who were involved in Wares case will remain on duty duringan investigation according to police Officials said police car dash cam andbody camera footage of the incident would be released after thatinvestigationThis tragedy happen accidentally and probably the police officers didnt wishdeath upon him because they tried to give him first aid However the man isdead and there is no chance to rewind and bring him back Hes gone foreverbut the cops will remain on duty and get away with this murder Is thisacceptableWe will know about he process of detention after the investigation is overLets wait and keep our eyes open Black Lives Matter,303.3,https://www.facebook.com/Black-Matters-1579673598947501/,1236.0,151.0,07/14/15 06:13:31 AM PDT,Black Matters  s                                      Black Matters,Baltimore Maryland Missouri Cleveland Ohio,Maryland Missouri Ohio,2015-07-14,Maryland
114,Man Dies After Police Use Pepper Spray During Arrest In AlabamaA man in Alabama collapsed and died after officers sprayed him with pepperspray while arresting him after a chase Tuscaloosa police said SaturdayPolice said Ware ran into nearby woods and struggled with officers when theycaught up with him Officers sprayed him with oleoresin capsicum morecommonly known as pepper spray according to police The chemical agentdebilitates a person by causing temporary blindness and irritating a personsnose and throatThe six officers who were involved in Wares case will remain on duty duringan investigation according to police Officials said police car dash cam andbody camera footage of the incident would be released after thatinvestigationThis tragedy happen accidentally and probably the police officers didnt wishdeath upon him because they tried to give him first aid However the man isdead and there is no chance to rewind and bring him back Hes gone foreverbut the cops will remain on duty and get away with this murder Is thisacceptableWe will know about he process of detention after the investigation is overLets wait and keep our eyes open Black Lives Matter,303.3,https://www.facebook.com/Black-Matters-1579673598947501/,1236.0,151.0,07/14/15 06:13:31 AM PDT,Black Matters  s                                      Black Matters,Baltimore Maryland Missouri Cleveland Ohio,Maryland Missouri Ohio,2015-07-14,Missouri
114,Man Dies After Police Use Pepper Spray During Arrest In AlabamaA man in Alabama collapsed and died after officers sprayed him with pepperspray while arresting him after a chase Tuscaloosa police said SaturdayPolice said Ware ran into nearby woods and struggled with officers when theycaught up with him Officers sprayed him with oleoresin capsicum morecommonly known as pepper spray according to police The chemical agentdebilitates a person by causing temporary blindness and irritating a personsnose and throatThe six officers who were involved in Wares case will remain on duty duringan investigation according to police Officials said police car dash cam andbody camera footage of the incident would be released after thatinvestigationThis tragedy happen accidentally and probably the police officers didnt wishdeath upon him because they tried to give him first aid However the man isdead and there is no chance to rewind and bring him back Hes gone foreverbut the cops will remain on duty and get away with this murder Is thisacceptableWe will know about he process of detention after the investigation is overLets wait and keep our eyes open Black Lives Matter,303.3,https://www.facebook.com/Black-Matters-1579673598947501/,1236.0,151.0,07/14/15 06:13:31 AM PDT,Black Matters  s                                      Black Matters,Baltimore Maryland Missouri Cleveland Ohio,Maryland Missouri Ohio,2015-07-14,Ohio
115,Have you ever been mistreated or abused by racist police officersDo you want you story to be read by thousands of peopleWe can make this happen easily We can post your story in ourcommunitylts very important to us because black people should stopstruggling with racism and police brutalityIf we all speak outwe can do it We can obtain justice and equalityYou can send your story to blackmattersuscom or you can messageus via Facebook anonym or notWe are not to judge we are to share experience and support each other Sodont be shy and help the black community United we stand,218.95,https://www.facebook.com/Black-Matters-1579673598947501/,584.0,46.0,07/14/15 06:10:21 AM PDT,Black Matters  s                                      Black Matters,Baltimore Maryland Missouri Cleveland Ohio,Maryland Missouri Ohio,2015-07-14,Maryland
115,Have you ever been mistreated or abused by racist police officersDo you want you story to be read by thousands of peopleWe can make this happen easily We can post your story in ourcommunitylts very important to us because black people should stopstruggling with racism and police brutalityIf we all speak outwe can do it We can obtain justice and equalityYou can send your story to blackmattersuscom or you can messageus via Facebook anonym or notWe are not to judge we are to share experience and support each other Sodont be shy and help the black community United we stand,218.95,https://www.facebook.com/Black-Matters-1579673598947501/,584.0,46.0,07/14/15 06:10:21 AM PDT,Black Matters  s                                      Black Matters,Baltimore Maryland Missouri Cleveland Ohio,Maryland Missouri Ohio,2015-07-14,Missouri
115,Have you ever been mistreated or abused by racist police officersDo you want you story to be read by thousands of peopleWe can make this happen easily We can post your story in ourcommunitylts very important to us because black people should stopstruggling with racism and police brutalityIf we all speak outwe can do it We can obtain justice and equalityYou can send your story to blackmattersuscom or you can messageus via Facebook anonym or notWe are not to judge we are to share experience and support each other Sodont be shy and help the black community United we stand,218.95,https://www.facebook.com/Black-Matters-1579673598947501/,584.0,46.0,07/14/15 06:10:21 AM PDT,Black Matters  s                                      Black Matters,Baltimore Maryland Missouri Cleveland Ohio,Maryland Missouri Ohio,2015-07-14,Ohio
116,Unarmed Black Man On A Horse Allegedly Strangled To Death By White CopIn MississippiOne of the last things that Jonathan Sanders an unarmed black manreportedly said before he died was Let me go I cant breathe OnWednesday night a white police officer in the small town of StonewallMississippi allegedly strangled Sanders a yearold black horseman with aflashlight before killing him in view of his family membersOfficer Kevin Herrington pulled Sanders off a horse and choked him with aflashlight Sanders attorney Stewart Parrish initially told an ABC affiliateParrish later clarified that those allegations came from family members whowitnessed the death Parrish said that Sanders experienced some kind ofasphyxiation during the altercationSanders died on the scene and leaves behind two childrenThe last words of Eric garner were I cant breathe the last words ofJonathan Sanders were I cant breathe let me go Biting irony isnt itSince when is it illegal to train your horse in close propinquity to your houseAmerica was always and it is nowa police state for black people,1615.11,https://www.facebook.com/Black-Matters-1579673598947501/,9042.0,1003.0,07/13/15 07:20:12 AM PDT,Black Matters  s                                      Black Matters,Baltimore Maryland Missouri Cleveland Ohio,Maryland Missouri Ohio,2015-07-13,Maryland
116,Unarmed Black Man On A Horse Allegedly Strangled To Death By White CopIn MississippiOne of the last things that Jonathan Sanders an unarmed black manreportedly said before he died was Let me go I cant breathe OnWednesday night a white police officer in the small town of StonewallMississippi allegedly strangled Sanders a yearold black horseman with aflashlight before killing him in view of his family membersOfficer Kevin Herrington pulled Sanders off a horse and choked him with aflashlight Sanders attorney Stewart Parrish initially told an ABC affiliateParrish later clarified that those allegations came from family members whowitnessed the death Parrish said that Sanders experienced some kind ofasphyxiation during the altercationSanders died on the scene and leaves behind two childrenThe last words of Eric garner were I cant breathe the last words ofJonathan Sanders were I cant breathe let me go Biting irony isnt itSince when is it illegal to train your horse in close propinquity to your houseAmerica was always and it is nowa police state for black people,1615.11,https://www.facebook.com/Black-Matters-1579673598947501/,9042.0,1003.0,07/13/15 07:20:12 AM PDT,Black Matters  s                                      Black Matters,Baltimore Maryland Missouri Cleveland Ohio,Maryland Missouri Ohio,2015-07-13,Missouri
116,Unarmed Black Man On A Horse Allegedly Strangled To Death By White CopIn MississippiOne of the last things that Jonathan Sanders an unarmed black manreportedly said before he died was Let me go I cant breathe OnWednesday night a white police officer in the small town of StonewallMississippi allegedly strangled Sanders a yearold black horseman with aflashlight before killing him in view of his family membersOfficer Kevin Herrington pulled Sanders off a horse and choked him with aflashlight Sanders attorney Stewart Parrish initially told an ABC affiliateParrish later clarified that those allegations came from family members whowitnessed the death Parrish said that Sanders experienced some kind ofasphyxiation during the altercationSanders died on the scene and leaves behind two childrenThe last words of Eric garner were I cant breathe the last words ofJonathan Sanders were I cant breathe let me go Biting irony isnt itSince when is it illegal to train your horse in close propinquity to your houseAmerica was always and it is nowa police state for black people,1615.11,https://www.facebook.com/Black-Matters-1579673598947501/,9042.0,1003.0,07/13/15 07:20:12 AM PDT,Black Matters  s                                      Black Matters,Baltimore Maryland Missouri Cleveland Ohio,Maryland Missouri Ohio,2015-07-13,Ohio
117,I cant breathe symbolize an anger and frustration over the relationshipbetween law enforcement and black people in America,10.31,https://www.facebook.com/Black-Matters-1579673598947501/,45.0,7.0,07/16/15 02:22:00 AM PDT,Black Matters  s                                      Black Matters,Baltimore Maryland Missouri Cleveland Ohio,Maryland Missouri Ohio,2015-07-16,Maryland
117,I cant breathe symbolize an anger and frustration over the relationshipbetween law enforcement and black people in America,10.31,https://www.facebook.com/Black-Matters-1579673598947501/,45.0,7.0,07/16/15 02:22:00 AM PDT,Black Matters  s                                      Black Matters,Baltimore Maryland Missouri Cleveland Ohio,Maryland Missouri Ohio,2015-07-16,Missouri
117,I cant breathe symbolize an anger and frustration over the relationshipbetween law enforcement and black people in America,10.31,https://www.facebook.com/Black-Matters-1579673598947501/,45.0,7.0,07/16/15 02:22:00 AM PDT,Black Matters  s                                      Black Matters,Baltimore Maryland Missouri Cleveland Ohio,Maryland Missouri Ohio,2015-07-16,Ohio
118,TaNehisi Coates on growing up in West BaltimoreThe famous AfricanAmerican writer TaNehisi Coates grew up in WestBaltimore with people who lost a child whether to the streets to guns or to jailToday his goal is to protect his son from the different forms of violence thathe experienced in school and on the streetsPeople of color have been dealing with injustice ever since they crossed theNorth American continent For instance in West Baltimore TaNehisi wastrained not to go to the neighborhoods unless you know this place He wastold that you cannot tolerate anybody attempting any physically violent threatto you Moreover his mom was feared that her children would get arrestedWhat does it mean Undoubtedly black Americans were afraid of policeimproper procedure injustice or what is worse being killed by police officerThats why the nationwide furor over the growing number of unarmed blackmen fatally shot by police officers has put the public on a new trend inAmerica In fact this new trend caused disproportionate number of unarmedpeople of color killed by policeHow dangerous is to live in your area today,157.72,https://www.facebook.com/Black-Matters-1 579673598947501/,327.0,18.0,07/15/15 08:23:22 AM PDT,Black Matters  s                                      Black Matters,Baltimore Maryland Missouri Cleveland Ohio,Maryland Missouri Ohio,2015-07-15,Maryland
118,TaNehisi Coates on growing up in West BaltimoreThe famous AfricanAmerican writer TaNehisi Coates grew up in WestBaltimore with people who lost a child whether to the streets to guns or to jailToday his goal is to protect his son from the different forms of violence thathe experienced in school and on the streetsPeople of color have been dealing with injustice ever since they crossed theNorth American continent For instance in West Baltimore TaNehisi wastrained not to go to the neighborhoods unless you know this place He wastold that you cannot tolerate anybody attempting any physically violent threatto you Moreover his mom was feared that her children would get arrestedWhat does it mean Undoubtedly black Americans were afraid of policeimproper procedure injustice or what is worse being killed by police officerThats why the nationwide furor over the growing number of unarmed blackmen fatally shot by police officers has put the public on a new trend inAmerica In fact this new trend caused disproportionate number of unarmedpeople of color killed by policeHow dangerous is to live in your area today,157.72,https://www.facebook.com/Black-Matters-1 579673598947501/,327.0,18.0,07/15/15 08:23:22 AM PDT,Black Matters  s                                      Black Matters,Baltimore Maryland Missouri Cleveland Ohio,Maryland Missouri Ohio,2015-07-15,Missouri
118,TaNehisi Coates on growing up in West BaltimoreThe famous AfricanAmerican writer TaNehisi Coates grew up in WestBaltimore with people who lost a child whether to the streets to guns or to jailToday his goal is to protect his son from the different forms of violence thathe experienced in school and on the streetsPeople of color have been dealing with injustice ever since they crossed theNorth American continent For instance in West Baltimore TaNehisi wastrained not to go to the neighborhoods unless you know this place He wastold that you cannot tolerate anybody attempting any physically violent threatto you Moreover his mom was feared that her children would get arrestedWhat does it mean Undoubtedly black Americans were afraid of policeimproper procedure injustice or what is worse being killed by police officerThats why the nationwide furor over the growing number of unarmed blackmen fatally shot by police officers has put the public on a new trend inAmerica In fact this new trend caused disproportionate number of unarmedpeople of color killed by policeHow dangerous is to live in your area today,157.72,https://www.facebook.com/Black-Matters-1 579673598947501/,327.0,18.0,07/15/15 08:23:22 AM PDT,Black Matters  s                                      Black Matters,Baltimore Maryland Missouri Cleveland Ohio,Maryland Missouri Ohio,2015-07-15,Ohio
119,Black church vandalized for the third time in a row on Floridas SpaceCoastWas it a hatecrimeA predominantly Melbourne black church was vandalized for the third time insix months According to the Melbourne Police Department the vandalbought axes to chop through access points to get in Church BishopJacquelyn Gordon said that the church was in the process of developmentsince they moved two years ago intofoot industrial complexMoreover the message SS Charlestonwas found on the car nearby theChurch which raised concerns about church security SS Charlestonindicates the tragedy in Charleston when nine people were shot to death bywhite supremacist Dylann Roof at Emanuel AME church Before the churchmembers found the words We see u that were painted in the radical emblemof the Nazi party swastikaHow many hateful people living in America today What of these people aregetting their hatred and racism from their parents or friends What if it is ahate crime Has the government created a fund to assist this church,262.75,https://www.facebook.com/Black-Matters-1579673598947501/,672.0,45.0,07/15/15 08:22:39 AM PDT,Black Matters  s                                      Black Matters,Baltimore Maryland Missouri Cleveland Ohio,Maryland Missouri Ohio,2015-07-15,Maryland
119,Black church vandalized for the third time in a row on Floridas SpaceCoastWas it a hatecrimeA predominantly Melbourne black church was vandalized for the third time insix months According to the Melbourne Police Department the vandalbought axes to chop through access points to get in Church BishopJacquelyn Gordon said that the church was in the process of developmentsince they moved two years ago intofoot industrial complexMoreover the message SS Charlestonwas found on the car nearby theChurch which raised concerns about church security SS Charlestonindicates the tragedy in Charleston when nine people were shot to death bywhite supremacist Dylann Roof at Emanuel AME church Before the churchmembers found the words We see u that were painted in the radical emblemof the Nazi party swastikaHow many hateful people living in America today What of these people aregetting their hatred and racism from their parents or friends What if it is ahate crime Has the government created a fund to assist this church,262.75,https://www.facebook.com/Black-Matters-1579673598947501/,672.0,45.0,07/15/15 08:22:39 AM PDT,Black Matters  s                                      Black Matters,Baltimore Maryland Missouri Cleveland Ohio,Maryland Missouri Ohio,2015-07-15,Missouri
119,Black church vandalized for the third time in a row on Floridas SpaceCoastWas it a hatecrimeA predominantly Melbourne black church was vandalized for the third time insix months According to the Melbourne Police Department the vandalbought axes to chop through access points to get in Church BishopJacquelyn Gordon said that the church was in the process of developmentsince they moved two years ago intofoot industrial complexMoreover the message SS Charlestonwas found on the car nearby theChurch which raised concerns about church security SS Charlestonindicates the tragedy in Charleston when nine people were shot to death bywhite supremacist Dylann Roof at Emanuel AME church Before the churchmembers found the words We see u that were painted in the radical emblemof the Nazi party swastikaHow many hateful people living in America today What of these people aregetting their hatred and racism from their parents or friends What if it is ahate crime Has the government created a fund to assist this church,262.75,https://www.facebook.com/Black-Matters-1579673598947501/,672.0,45.0,07/15/15 08:22:39 AM PDT,Black Matters  s                                      Black Matters,Baltimore Maryland Missouri Cleveland Ohio,Maryland Missouri Ohio,2015-07-15,Ohio
120,Amandla Stenberg Black Female Bodies Are Treated As Less Than HumanDo black females lives matter tooThats the big question yearold Amandla Stenberg posed on Instagram onSunday The powerful post broke down the cultural double standards thatplague black women every dayBlack features are beautiful black women are not Stenberg wrote Whitewomen are paragons of virtue and desire black women are objects offetishism and brutality This at least seems to be the mentality surroundingblack femininity and beauty in a society built upon eurocentric beautystandardsEverybody knows that racism is alive and prospering in America However allthe news about killing black men and black teenagers police brutality unfairsentences and other issues distract us from the fact that black women arebeing abused in the most violent ways Usually they cant stand up forthemselves unlike men so they endure and sufferIn modern America black women experience more depression than probablyduring slavery when everything was obvious but now racism is hiddenbehind the mask of tolerance,331.57,https://www.facebook.com/Black-Matters-1 579673598947501/,1080.0,113.0,07/15/15 03:35:13 AM PDT,Black Matters  s                                      Black Matters,Baltimore Maryland Missouri Cleveland Ohio,Maryland Missouri Ohio,2015-07-15,Maryland
120,Amandla Stenberg Black Female Bodies Are Treated As Less Than HumanDo black females lives matter tooThats the big question yearold Amandla Stenberg posed on Instagram onSunday The powerful post broke down the cultural double standards thatplague black women every dayBlack features are beautiful black women are not Stenberg wrote Whitewomen are paragons of virtue and desire black women are objects offetishism and brutality This at least seems to be the mentality surroundingblack femininity and beauty in a society built upon eurocentric beautystandardsEverybody knows that racism is alive and prospering in America However allthe news about killing black men and black teenagers police brutality unfairsentences and other issues distract us from the fact that black women arebeing abused in the most violent ways Usually they cant stand up forthemselves unlike men so they endure and sufferIn modern America black women experience more depression than probablyduring slavery when everything was obvious but now racism is hiddenbehind the mask of tolerance,331.57,https://www.facebook.com/Black-Matters-1 579673598947501/,1080.0,113.0,07/15/15 03:35:13 AM PDT,Black Matters  s                                      Black Matters,Baltimore Maryland Missouri Cleveland Ohio,Maryland Missouri Ohio,2015-07-15,Missouri
120,Amandla Stenberg Black Female Bodies Are Treated As Less Than HumanDo black females lives matter tooThats the big question yearold Amandla Stenberg posed on Instagram onSunday The powerful post broke down the cultural double standards thatplague black women every dayBlack features are beautiful black women are not Stenberg wrote Whitewomen are paragons of virtue and desire black women are objects offetishism and brutality This at least seems to be the mentality surroundingblack femininity and beauty in a society built upon eurocentric beautystandardsEverybody knows that racism is alive and prospering in America However allthe news about killing black men and black teenagers police brutality unfairsentences and other issues distract us from the fact that black women arebeing abused in the most violent ways Usually they cant stand up forthemselves unlike men so they endure and sufferIn modern America black women experience more depression than probablyduring slavery when everything was obvious but now racism is hiddenbehind the mask of tolerance,331.57,https://www.facebook.com/Black-Matters-1 579673598947501/,1080.0,113.0,07/15/15 03:35:13 AM PDT,Black Matters  s                                      Black Matters,Baltimore Maryland Missouri Cleveland Ohio,Maryland Missouri Ohio,2015-07-15,Ohio
121,New York City Agrees to Pay Family of Eric GarnerMillionNew York City has agreed to pay the estate of Eric Garnermillion tosettle a lawsuit over his death after he was placed in a chokehold by a NewYork Police Department officerThe city didnt admit fault in the settlement the comptrollers office said inannouncing the accord Monday eveningonathan Moore an attorney for the family said the city made its offer ofmillion Monday and the Garner family in his office agreed unanimously toend the caseThere is no amount of money that would compensate them for their lossMr Moore said Eric Garner is dead He had no reason to die on that dayWhatever you think he was doing he shouldnt have diedYeah right money wont bring Eric back Hes gone forever and his his familyknows that But anyway its some sort of victory Its way better than nothingRest in peace Eric Garner No justice no peace,424.29,https://www.facebook.com/Black-Matters-1579673598947501/,1662.0,181.0,07/15/15 03:34:05 AM PDT,Black Matters  s                                      Black Matters,Baltimore Maryland Missouri Cleveland Ohio,Maryland Missouri Ohio,2015-07-15,Maryland
121,New York City Agrees to Pay Family of Eric GarnerMillionNew York City has agreed to pay the estate of Eric Garnermillion tosettle a lawsuit over his death after he was placed in a chokehold by a NewYork Police Department officerThe city didnt admit fault in the settlement the comptrollers office said inannouncing the accord Monday eveningonathan Moore an attorney for the family said the city made its offer ofmillion Monday and the Garner family in his office agreed unanimously toend the caseThere is no amount of money that would compensate them for their lossMr Moore said Eric Garner is dead He had no reason to die on that dayWhatever you think he was doing he shouldnt have diedYeah right money wont bring Eric back Hes gone forever and his his familyknows that But anyway its some sort of victory Its way better than nothingRest in peace Eric Garner No justice no peace,424.29,https://www.facebook.com/Black-Matters-1579673598947501/,1662.0,181.0,07/15/15 03:34:05 AM PDT,Black Matters  s                                      Black Matters,Baltimore Maryland Missouri Cleveland Ohio,Maryland Missouri Ohio,2015-07-15,Missouri
121,New York City Agrees to Pay Family of Eric GarnerMillionNew York City has agreed to pay the estate of Eric Garnermillion tosettle a lawsuit over his death after he was placed in a chokehold by a NewYork Police Department officerThe city didnt admit fault in the settlement the comptrollers office said inannouncing the accord Monday eveningonathan Moore an attorney for the family said the city made its offer ofmillion Monday and the Garner family in his office agreed unanimously toend the caseThere is no amount of money that would compensate them for their lossMr Moore said Eric Garner is dead He had no reason to die on that dayWhatever you think he was doing he shouldnt have diedYeah right money wont bring Eric back Hes gone forever and his his familyknows that But anyway its some sort of victory Its way better than nothingRest in peace Eric Garner No justice no peace,424.29,https://www.facebook.com/Black-Matters-1579673598947501/,1662.0,181.0,07/15/15 03:34:05 AM PDT,Black Matters  s                                      Black Matters,Baltimore Maryland Missouri Cleveland Ohio,Maryland Missouri Ohio,2015-07-15,Ohio
122,Cleveland judge wont be forced to issue warrants in Rice shootingA divided Ohio appeals court panel on Friday said it would not force amunicipal judge to issue arrest warrants for Cleveland police officers involvedin the fatal shooting of yearold Tamir Rice in a city park last NovemberCleveland Municipal Court Judge Ronald,269.17,https://www.facebook.com/Black-Matters-1 579673598947501/,1514.0,173.0,07/14/15 06:13:13 AM PDT,Black Matters  s                                      Black Matters,Baltimore Maryland Missouri Cleveland Ohio,Maryland Missouri Ohio,2015-07-14,Maryland
122,Cleveland judge wont be forced to issue warrants in Rice shootingA divided Ohio appeals court panel on Friday said it would not force amunicipal judge to issue arrest warrants for Cleveland police officers involvedin the fatal shooting of yearold Tamir Rice in a city park last NovemberCleveland Municipal Court Judge Ronald,269.17,https://www.facebook.com/Black-Matters-1 579673598947501/,1514.0,173.0,07/14/15 06:13:13 AM PDT,Black Matters  s                                      Black Matters,Baltimore Maryland Missouri Cleveland Ohio,Maryland Missouri Ohio,2015-07-14,Missouri
122,Cleveland judge wont be forced to issue warrants in Rice shootingA divided Ohio appeals court panel on Friday said it would not force amunicipal judge to issue arrest warrants for Cleveland police officers involvedin the fatal shooting of yearold Tamir Rice in a city park last NovemberCleveland Municipal Court Judge Ronald,269.17,https://www.facebook.com/Black-Matters-1 579673598947501/,1514.0,173.0,07/14/15 06:13:13 AM PDT,Black Matters  s                                      Black Matters,Baltimore Maryland Missouri Cleveland Ohio,Maryland Missouri Ohio,2015-07-14,Ohio
123,Teen shot by St Louis police paralyzed mom laments gun violenceA teenager shot by city police is paralyzed below the waist his mother saidSunday as her family copes with another episode of gun violence Not sevenyears ago her teenage daughter was accidentally shot to deathThis time a firearm in the hand of her son Brandon Claxtonprompted anofficer to shoot him three times aboutpm Saturday in a housingcomplex in theblock of Hodiamont Avenue officials said Policeencountered him while responding to a call about someone with a stolenpistolHis mother said that she respected the police and that her son shouldnthave had the gun But from what witnesses have told her she said Theydidnt have to shoot him down like thatOne of three witnesses interviewed Sunday told a reporter that Brandon didhave a gun in his hand But all three said that he did not point a weapon atanyone as he tried to run from officersWhen a white guy walks around with a rifle nobody bats an eye When ablack guy walks with a pistol or even a toy gun hell be immediately shot bythe police Have you ever heard about open carry in the United States Thenhere we go Racial prejudice at its finestOur condolences to the family,252.08,https://www.facebook.com/Black-Matters-1 579673598947501/,1237.0,205.0,07/14/15 06:12:50 AM PDT,Black Matters  s                                      Black Matters,Baltimore Maryland Missouri Cleveland Ohio,Maryland Missouri Ohio,2015-07-14,Maryland
123,Teen shot by St Louis police paralyzed mom laments gun violenceA teenager shot by city police is paralyzed below the waist his mother saidSunday as her family copes with another episode of gun violence Not sevenyears ago her teenage daughter was accidentally shot to deathThis time a firearm in the hand of her son Brandon Claxtonprompted anofficer to shoot him three times aboutpm Saturday in a housingcomplex in theblock of Hodiamont Avenue officials said Policeencountered him while responding to a call about someone with a stolenpistolHis mother said that she respected the police and that her son shouldnthave had the gun But from what witnesses have told her she said Theydidnt have to shoot him down like thatOne of three witnesses interviewed Sunday told a reporter that Brandon didhave a gun in his hand But all three said that he did not point a weapon atanyone as he tried to run from officersWhen a white guy walks around with a rifle nobody bats an eye When ablack guy walks with a pistol or even a toy gun hell be immediately shot bythe police Have you ever heard about open carry in the United States Thenhere we go Racial prejudice at its finestOur condolences to the family,252.08,https://www.facebook.com/Black-Matters-1 579673598947501/,1237.0,205.0,07/14/15 06:12:50 AM PDT,Black Matters  s                                      Black Matters,Baltimore Maryland Missouri Cleveland Ohio,Maryland Missouri Ohio,2015-07-14,Missouri
123,Teen shot by St Louis police paralyzed mom laments gun violenceA teenager shot by city police is paralyzed below the waist his mother saidSunday as her family copes with another episode of gun violence Not sevenyears ago her teenage daughter was accidentally shot to deathThis time a firearm in the hand of her son Brandon Claxtonprompted anofficer to shoot him three times aboutpm Saturday in a housingcomplex in theblock of Hodiamont Avenue officials said Policeencountered him while responding to a call about someone with a stolenpistolHis mother said that she respected the police and that her son shouldnthave had the gun But from what witnesses have told her she said Theydidnt have to shoot him down like thatOne of three witnesses interviewed Sunday told a reporter that Brandon didhave a gun in his hand But all three said that he did not point a weapon atanyone as he tried to run from officersWhen a white guy walks around with a rifle nobody bats an eye When ablack guy walks with a pistol or even a toy gun hell be immediately shot bythe police Have you ever heard about open carry in the United States Thenhere we go Racial prejudice at its finestOur condolences to the family,252.08,https://www.facebook.com/Black-Matters-1 579673598947501/,1237.0,205.0,07/14/15 06:12:50 AM PDT,Black Matters  s                                      Black Matters,Baltimore Maryland Missouri Cleveland Ohio,Maryland Missouri Ohio,2015-07-14,Ohio
124,Hands up dont shoot was built on pain We dont ask police to hug us weonly ask them to stop killing black men Because we are disproportionallykilled by cops over and over again,4.92,https://www.facebook.com/Black-Matters-1 579673598947501/,15.0,2.0,07/17/15 06:33:37 AM PDT,Black Matters  s                                      Black Matters,Baltimore Maryland Missouri Cleveland Ohio,Maryland Missouri Ohio,2015-07-17,Maryland
124,Hands up dont shoot was built on pain We dont ask police to hug us weonly ask them to stop killing black men Because we are disproportionallykilled by cops over and over again,4.92,https://www.facebook.com/Black-Matters-1 579673598947501/,15.0,2.0,07/17/15 06:33:37 AM PDT,Black Matters  s                                      Black Matters,Baltimore Maryland Missouri Cleveland Ohio,Maryland Missouri Ohio,2015-07-17,Missouri
124,Hands up dont shoot was built on pain We dont ask police to hug us weonly ask them to stop killing black men Because we are disproportionallykilled by cops over and over again,4.92,https://www.facebook.com/Black-Matters-1 579673598947501/,15.0,2.0,07/17/15 06:33:37 AM PDT,Black Matters  s                                      Black Matters,Baltimore Maryland Missouri Cleveland Ohio,Maryland Missouri Ohio,2015-07-17,Ohio
125,yearold WWII veteran is evicted on stretcherThe WWII veteran Johnnie H Hodges refused to leave his house after he wasnot able to pay his mortgage while caring for his sick wife Police andambulance workers had to carry him away on a stretcherA yearold Navy veteran lived in his Buffalo home with his wife fordecades But about four years ago he was taking care of his wife who hadAlzheimers disease and spent all his income on her rehabilitation In theprocess he defaulted on his mortgage and amassed a huge debt totalingto MT Bank Unfortunately due to his default on his mortgage loanpayments he was evicted from his house on a stretcherWhy does the US government treat military veterans absolutelydisgracefully Why the WWII veterans are literally being treated like humangarbage by their own government How potentially disabled veteran wasevicted from his house How come homelessness and unemployment amongAmerican veterans is much higher today than for the general population of theUnited States of America,8.85,https://www.facebook.com/Black-Matters-1579673598947501/,28.0,10.0,07/17/15 06:33:04 AM PDT,Black Matters  s                                      Black Matters,Baltimore Maryland Missouri Cleveland Ohio,Maryland Missouri Ohio,2015-07-17,Maryland
125,yearold WWII veteran is evicted on stretcherThe WWII veteran Johnnie H Hodges refused to leave his house after he wasnot able to pay his mortgage while caring for his sick wife Police andambulance workers had to carry him away on a stretcherA yearold Navy veteran lived in his Buffalo home with his wife fordecades But about four years ago he was taking care of his wife who hadAlzheimers disease and spent all his income on her rehabilitation In theprocess he defaulted on his mortgage and amassed a huge debt totalingto MT Bank Unfortunately due to his default on his mortgage loanpayments he was evicted from his house on a stretcherWhy does the US government treat military veterans absolutelydisgracefully Why the WWII veterans are literally being treated like humangarbage by their own government How potentially disabled veteran wasevicted from his house How come homelessness and unemployment amongAmerican veterans is much higher today than for the general population of theUnited States of America,8.85,https://www.facebook.com/Black-Matters-1579673598947501/,28.0,10.0,07/17/15 06:33:04 AM PDT,Black Matters  s                                      Black Matters,Baltimore Maryland Missouri Cleveland Ohio,Maryland Missouri Ohio,2015-07-17,Missouri
125,yearold WWII veteran is evicted on stretcherThe WWII veteran Johnnie H Hodges refused to leave his house after he wasnot able to pay his mortgage while caring for his sick wife Police andambulance workers had to carry him away on a stretcherA yearold Navy veteran lived in his Buffalo home with his wife fordecades But about four years ago he was taking care of his wife who hadAlzheimers disease and spent all his income on her rehabilitation In theprocess he defaulted on his mortgage and amassed a huge debt totalingto MT Bank Unfortunately due to his default on his mortgage loanpayments he was evicted from his house on a stretcherWhy does the US government treat military veterans absolutelydisgracefully Why the WWII veterans are literally being treated like humangarbage by their own government How potentially disabled veteran wasevicted from his house How come homelessness and unemployment amongAmerican veterans is much higher today than for the general population of theUnited States of America,8.85,https://www.facebook.com/Black-Matters-1579673598947501/,28.0,10.0,07/17/15 06:33:04 AM PDT,Black Matters  s                                      Black Matters,Baltimore Maryland Missouri Cleveland Ohio,Maryland Missouri Ohio,2015-07-17,Ohio
126,What differences do you see in the picture below What do you think is thedifference between police attitude towards white citizens and black citizensThink about it,4.45,https://www.facebook.com/Black-Matters-1579673598947501/,18.0,3.0,07/17/15 06:32:46 AM PDT,Black Matters  s                                      Black Matters,Baltimore Maryland Missouri Cleveland Ohio,Maryland Missouri Ohio,2015-07-17,Maryland
126,What differences do you see in the picture below What do you think is thedifference between police attitude towards white citizens and black citizensThink about it,4.45,https://www.facebook.com/Black-Matters-1579673598947501/,18.0,3.0,07/17/15 06:32:46 AM PDT,Black Matters  s                                      Black Matters,Baltimore Maryland Missouri Cleveland Ohio,Maryland Missouri Ohio,2015-07-17,Missouri
126,What differences do you see in the picture below What do you think is thedifference between police attitude towards white citizens and black citizensThink about it,4.45,https://www.facebook.com/Black-Matters-1579673598947501/,18.0,3.0,07/17/15 06:32:46 AM PDT,Black Matters  s                                      Black Matters,Baltimore Maryland Missouri Cleveland Ohio,Maryland Missouri Ohio,2015-07-17,Ohio
127,St Louis police shot teenager Teen is paralyzedLast Saturday the yearold Brandon Claxton prompted an officer to shoothim three times in a housing complex in Hodiamont Avenue According topolice they responded to a call about someone with a stolen caliber pistolBrandon Claxton is in critical conditionsBut according to witnesses Brandon did not point a pistol at anyone but hewas trying to run away from the officersWhere is the video evidence of police shooting Police Chief Sam Dotsonsaid that there is not a clear view on video What if police is trying to cover upthe story Did you know that police did not allow Brandons mother to seeher son because he was in custody Do you believe that police was justifiedto arrest BrandonCameras dont lie We need to know the truth whether the boy posed a threator not,500.0,https://www.facebook.com/Black-Matters-1579673598947501/,5959.0,754.0,07/17/15 12:52:41 AM PDT,Black Matters  s                                      Black Matters,Baltimore Maryland Missouri Cleveland Ohio,Maryland Missouri Ohio,2015-07-17,Maryland
127,St Louis police shot teenager Teen is paralyzedLast Saturday the yearold Brandon Claxton prompted an officer to shoothim three times in a housing complex in Hodiamont Avenue According topolice they responded to a call about someone with a stolen caliber pistolBrandon Claxton is in critical conditionsBut according to witnesses Brandon did not point a pistol at anyone but hewas trying to run away from the officersWhere is the video evidence of police shooting Police Chief Sam Dotsonsaid that there is not a clear view on video What if police is trying to cover upthe story Did you know that police did not allow Brandons mother to seeher son because he was in custody Do you believe that police was justifiedto arrest BrandonCameras dont lie We need to know the truth whether the boy posed a threator not,500.0,https://www.facebook.com/Black-Matters-1579673598947501/,5959.0,754.0,07/17/15 12:52:41 AM PDT,Black Matters  s                                      Black Matters,Baltimore Maryland Missouri Cleveland Ohio,Maryland Missouri Ohio,2015-07-17,Missouri
127,St Louis police shot teenager Teen is paralyzedLast Saturday the yearold Brandon Claxton prompted an officer to shoothim three times in a housing complex in Hodiamont Avenue According topolice they responded to a call about someone with a stolen caliber pistolBrandon Claxton is in critical conditionsBut according to witnesses Brandon did not point a pistol at anyone but hewas trying to run away from the officersWhere is the video evidence of police shooting Police Chief Sam Dotsonsaid that there is not a clear view on video What if police is trying to cover upthe story Did you know that police did not allow Brandons mother to seeher son because he was in custody Do you believe that police was justifiedto arrest BrandonCameras dont lie We need to know the truth whether the boy posed a threator not,500.0,https://www.facebook.com/Black-Matters-1579673598947501/,5959.0,754.0,07/17/15 12:52:41 AM PDT,Black Matters  s                                      Black Matters,Baltimore Maryland Missouri Cleveland Ohio,Maryland Missouri Ohio,2015-07-17,Ohio
128,Rapper OG Maco walked the red carpet of BET Awards in a shirt donning thenames of police brutality victims Helluva statement indeed,130.63,https://www.facebook.com/Black-Matters-1579673598947501/,1704.0,184.0,07/21/15 07:32:31 AM PDT,Black Matters  s                                      Black Matters,Baltimore Maryland Missouri Cleveland Ohio,Maryland Missouri Ohio,2015-07-21,Maryland
128,Rapper OG Maco walked the red carpet of BET Awards in a shirt donning thenames of police brutality victims Helluva statement indeed,130.63,https://www.facebook.com/Black-Matters-1579673598947501/,1704.0,184.0,07/21/15 07:32:31 AM PDT,Black Matters  s                                      Black Matters,Baltimore Maryland Missouri Cleveland Ohio,Maryland Missouri Ohio,2015-07-21,Missouri
128,Rapper OG Maco walked the red carpet of BET Awards in a shirt donning thenames of police brutality victims Helluva statement indeed,130.63,https://www.facebook.com/Black-Matters-1579673598947501/,1704.0,184.0,07/21/15 07:32:31 AM PDT,Black Matters  s                                      Black Matters,Baltimore Maryland Missouri Cleveland Ohio,Maryland Missouri Ohio,2015-07-21,Ohio
129,This is so sad how slowly this is becoming reality Please America Pleasewake up and realize its time to change Dont hide your head in the sand,125.56,https://www.facebook.com/Black-Matters-1579673598947501/,1536.0,157.0,07/21/15 06:55:01 AM PDT,Black Matters  s                                      Black Matters,Baltimore Maryland Missouri Cleveland Ohio,Maryland Missouri Ohio,2015-07-21,Maryland
129,This is so sad how slowly this is becoming reality Please America Pleasewake up and realize its time to change Dont hide your head in the sand,125.56,https://www.facebook.com/Black-Matters-1579673598947501/,1536.0,157.0,07/21/15 06:55:01 AM PDT,Black Matters  s                                      Black Matters,Baltimore Maryland Missouri Cleveland Ohio,Maryland Missouri Ohio,2015-07-21,Missouri
129,This is so sad how slowly this is becoming reality Please America Pleasewake up and realize its time to change Dont hide your head in the sand,125.56,https://www.facebook.com/Black-Matters-1579673598947501/,1536.0,157.0,07/21/15 06:55:01 AM PDT,Black Matters  s                                      Black Matters,Baltimore Maryland Missouri Cleveland Ohio,Maryland Missouri Ohio,2015-07-21,Ohio
130,We want our chief backLast week in a place that bills itself as the Friendliest Town on the EasternShore angry residents marched to City Hall demanding to give back a jobfor Kelvin Sewell the communitys first black police chiefOn Junehe was fired amid allegations leveled against white officers ofdepartmental racism After that the crowd of Sewells supporters moved tovoice their outrage to the Pocomoke City Council with posters that read WeSupport Chief Kelvin SewellAs a nation we have looked the other way for far too long and it is disgracefulThis time were not fighting with police were fighting for justice The system isbroken police doesnt protect us and the government cares only abouttycoons interests So heres a questionwho will care about Americans whocant protect themselves Who will care about usJusticeforChiefSewell,210.75,https://www.facebook.com/Black-Matters-1 579673598947501/,869.0,125.0,07/21/15 06:54:35 AM PDT,Black Matters  s                                      Black Matters,Baltimore Maryland Missouri Cleveland Ohio,Maryland Missouri Ohio,2015-07-21,Maryland
130,We want our chief backLast week in a place that bills itself as the Friendliest Town on the EasternShore angry residents marched to City Hall demanding to give back a jobfor Kelvin Sewell the communitys first black police chiefOn Junehe was fired amid allegations leveled against white officers ofdepartmental racism After that the crowd of Sewells supporters moved tovoice their outrage to the Pocomoke City Council with posters that read WeSupport Chief Kelvin SewellAs a nation we have looked the other way for far too long and it is disgracefulThis time were not fighting with police were fighting for justice The system isbroken police doesnt protect us and the government cares only abouttycoons interests So heres a questionwho will care about Americans whocant protect themselves Who will care about usJusticeforChiefSewell,210.75,https://www.facebook.com/Black-Matters-1 579673598947501/,869.0,125.0,07/21/15 06:54:35 AM PDT,Black Matters  s                                      Black Matters,Baltimore Maryland Missouri Cleveland Ohio,Maryland Missouri Ohio,2015-07-21,Missouri
130,We want our chief backLast week in a place that bills itself as the Friendliest Town on the EasternShore angry residents marched to City Hall demanding to give back a jobfor Kelvin Sewell the communitys first black police chiefOn Junehe was fired amid allegations leveled against white officers ofdepartmental racism After that the crowd of Sewells supporters moved tovoice their outrage to the Pocomoke City Council with posters that read WeSupport Chief Kelvin SewellAs a nation we have looked the other way for far too long and it is disgracefulThis time were not fighting with police were fighting for justice The system isbroken police doesnt protect us and the government cares only abouttycoons interests So heres a questionwho will care about Americans whocant protect themselves Who will care about usJusticeforChiefSewell,210.75,https://www.facebook.com/Black-Matters-1 579673598947501/,869.0,125.0,07/21/15 06:54:35 AM PDT,Black Matters  s                                      Black Matters,Baltimore Maryland Missouri Cleveland Ohio,Maryland Missouri Ohio,2015-07-21,Ohio
131,Made In The US The Justice Turns Into BusinessFor years inmates with nonviolent felonies and misdemeanor charges inNew York City had to sit in Rikers Island for months awaiting trial cause theycouldnt afford to pay bailUnder the citys new bail initiative announced by Mayor Bill de Blasio lastweek somelowlevel offenders are eligible for release without bail Thesystem needs serious reform According to the New York Police Departmentthe biggest part of arrests are lowlevel offenses like peeing on the street ordisorderly conductThe New York Daily News reports thatpercent of themillion people hitwith summonses betweenandwere black and Hispanic So whatshould we doThe criminal penal system is antiquated It should be changed The worse itis now designed to be for profit which has led to laws being designed to keeppeople in prison rather than rehabilitating More and more it looks like its abusinessThe first rule of any society is development At such rate the US governmentwill start to sell indulgences soonOur system is not only unfair but also corrupt We should explore alternativesolutions and limit the number of people in prison to the most violent andpotentially dangerous offenders Only real criminals should be in jailLemme ask you have you ever seen a one of the tobacco industry executivesgo to jail I guess no We also have never seen the Bush or any otherPresidents administrations were brought to justiceAmerica has a justice system that was supplanted the Jim Crow laws as ameans to keep the minorities from developing real opportunities for keepingthe very rich from ever being brought to justice,364.87,https://www.facebook.com/Black-Matters-1579673598947501/,1426.0,109.0,07/21/15 06:54:01 AM PDT,Black Matters  s                                      Black Matters,Baltimore Maryland Missouri Cleveland Ohio,Maryland Missouri Ohio,2015-07-21,Maryland
131,Made In The US The Justice Turns Into BusinessFor years inmates with nonviolent felonies and misdemeanor charges inNew York City had to sit in Rikers Island for months awaiting trial cause theycouldnt afford to pay bailUnder the citys new bail initiative announced by Mayor Bill de Blasio lastweek somelowlevel offenders are eligible for release without bail Thesystem needs serious reform According to the New York Police Departmentthe biggest part of arrests are lowlevel offenses like peeing on the street ordisorderly conductThe New York Daily News reports thatpercent of themillion people hitwith summonses betweenandwere black and Hispanic So whatshould we doThe criminal penal system is antiquated It should be changed The worse itis now designed to be for profit which has led to laws being designed to keeppeople in prison rather than rehabilitating More and more it looks like its abusinessThe first rule of any society is development At such rate the US governmentwill start to sell indulgences soonOur system is not only unfair but also corrupt We should explore alternativesolutions and limit the number of people in prison to the most violent andpotentially dangerous offenders Only real criminals should be in jailLemme ask you have you ever seen a one of the tobacco industry executivesgo to jail I guess no We also have never seen the Bush or any otherPresidents administrations were brought to justiceAmerica has a justice system that was supplanted the Jim Crow laws as ameans to keep the minorities from developing real opportunities for keepingthe very rich from ever being brought to justice,364.87,https://www.facebook.com/Black-Matters-1579673598947501/,1426.0,109.0,07/21/15 06:54:01 AM PDT,Black Matters  s                                      Black Matters,Baltimore Maryland Missouri Cleveland Ohio,Maryland Missouri Ohio,2015-07-21,Missouri
131,Made In The US The Justice Turns Into BusinessFor years inmates with nonviolent felonies and misdemeanor charges inNew York City had to sit in Rikers Island for months awaiting trial cause theycouldnt afford to pay bailUnder the citys new bail initiative announced by Mayor Bill de Blasio lastweek somelowlevel offenders are eligible for release without bail Thesystem needs serious reform According to the New York Police Departmentthe biggest part of arrests are lowlevel offenses like peeing on the street ordisorderly conductThe New York Daily News reports thatpercent of themillion people hitwith summonses betweenandwere black and Hispanic So whatshould we doThe criminal penal system is antiquated It should be changed The worse itis now designed to be for profit which has led to laws being designed to keeppeople in prison rather than rehabilitating More and more it looks like its abusinessThe first rule of any society is development At such rate the US governmentwill start to sell indulgences soonOur system is not only unfair but also corrupt We should explore alternativesolutions and limit the number of people in prison to the most violent andpotentially dangerous offenders Only real criminals should be in jailLemme ask you have you ever seen a one of the tobacco industry executivesgo to jail I guess no We also have never seen the Bush or any otherPresidents administrations were brought to justiceAmerica has a justice system that was supplanted the Jim Crow laws as ameans to keep the minorities from developing real opportunities for keepingthe very rich from ever being brought to justice,364.87,https://www.facebook.com/Black-Matters-1579673598947501/,1426.0,109.0,07/21/15 06:54:01 AM PDT,Black Matters  s                                      Black Matters,Baltimore Maryland Missouri Cleveland Ohio,Maryland Missouri Ohio,2015-07-21,Ohio
132,KKK AfricanAmerican group plan rallies at South Carolina CapitolCould you please just close your eyes for a minute Now imagine yearsafter the Third Reich was down Berlin organizes Nazi military paradeSounds weird inconceivable rightSo tell me why KKK march at South Carolina Capitol draws the ire only oflocal AfricanAmericansA Ku Klux Klan chapter and an AfricanAmerican group plan overlappingdemonstrations on Saturday outside the South Carolina State House wherestate officials removed the Confederate battle flag last weekWe have been fought with slavery Jim Crow laws and etc for REALLy longtime so whats the problem today Nothing good coming out of this mess Sowhat is the purpose of this march Hmmm It feels like this could be billed asthe fight of the century What do you think about it guys,277.98,https://www.facebook.com/Black-Matters-1579673598947501/,1244.0,161.0,07/21/15 06:53:25 AM PDT,Black Matters  s                                      Black Matters,Baltimore Maryland Missouri Cleveland Ohio,Maryland Missouri Ohio,2015-07-21,Maryland
132,KKK AfricanAmerican group plan rallies at South Carolina CapitolCould you please just close your eyes for a minute Now imagine yearsafter the Third Reich was down Berlin organizes Nazi military paradeSounds weird inconceivable rightSo tell me why KKK march at South Carolina Capitol draws the ire only oflocal AfricanAmericansA Ku Klux Klan chapter and an AfricanAmerican group plan overlappingdemonstrations on Saturday outside the South Carolina State House wherestate officials removed the Confederate battle flag last weekWe have been fought with slavery Jim Crow laws and etc for REALLy longtime so whats the problem today Nothing good coming out of this mess Sowhat is the purpose of this march Hmmm It feels like this could be billed asthe fight of the century What do you think about it guys,277.98,https://www.facebook.com/Black-Matters-1579673598947501/,1244.0,161.0,07/21/15 06:53:25 AM PDT,Black Matters  s                                      Black Matters,Baltimore Maryland Missouri Cleveland Ohio,Maryland Missouri Ohio,2015-07-21,Missouri
132,KKK AfricanAmerican group plan rallies at South Carolina CapitolCould you please just close your eyes for a minute Now imagine yearsafter the Third Reich was down Berlin organizes Nazi military paradeSounds weird inconceivable rightSo tell me why KKK march at South Carolina Capitol draws the ire only oflocal AfricanAmericansA Ku Klux Klan chapter and an AfricanAmerican group plan overlappingdemonstrations on Saturday outside the South Carolina State House wherestate officials removed the Confederate battle flag last weekWe have been fought with slavery Jim Crow laws and etc for REALLy longtime so whats the problem today Nothing good coming out of this mess Sowhat is the purpose of this march Hmmm It feels like this could be billed asthe fight of the century What do you think about it guys,277.98,https://www.facebook.com/Black-Matters-1579673598947501/,1244.0,161.0,07/21/15 06:53:25 AM PDT,Black Matters  s                                      Black Matters,Baltimore Maryland Missouri Cleveland Ohio,Maryland Missouri Ohio,2015-07-21,Ohio
133,Another Woman Commits Suicide In JailA teen committed suicide in a jail cell an hour after being arrested anothersuspicious case of a Black woman dying in police custody in the past weekThe second case over a week huh How retarded andor brainwashed byFox News is one supposed to be to believe this is a coincidence No way weare gonna buy such bullshitThe weirdest thing about this specific case is that the suicide was committedjust an hour after the arrest Moreover the woman was suspected of stealingsomeones phone which is quite not a reason for getting to her accountWeve got to also take into consideration thatinblack men go to prison asopposed to a considerably lower rate with the white menorgstory inblackmengtoprisonthemostdisturbingfactsabout racialinequalityintheuscriminaljusticesystemIt definitely seems like theres more to this since until recently taking intocustody hasnt been a reason for suicide among black women Now for somepeople the only way to deal with police violence at the police stations is simplykilling themselves,0.0,https://www.facebook.com/Black-Matters-1579673598947501/,0.0,0.0,07/21/15 07:32:07 AM PDT,Black Matters  s                                      Black Matters,Baltimore Maryland Missouri Cleveland Ohio,Maryland Missouri Ohio,2015-07-21,Maryland
133,Another Woman Commits Suicide In JailA teen committed suicide in a jail cell an hour after being arrested anothersuspicious case of a Black woman dying in police custody in the past weekThe second case over a week huh How retarded andor brainwashed byFox News is one supposed to be to believe this is a coincidence No way weare gonna buy such bullshitThe weirdest thing about this specific case is that the suicide was committedjust an hour after the arrest Moreover the woman was suspected of stealingsomeones phone which is quite not a reason for getting to her accountWeve got to also take into consideration thatinblack men go to prison asopposed to a considerably lower rate with the white menorgstory inblackmengtoprisonthemostdisturbingfactsabout racialinequalityintheuscriminaljusticesystemIt definitely seems like theres more to this since until recently taking intocustody hasnt been a reason for suicide among black women Now for somepeople the only way to deal with police violence at the police stations is simplykilling themselves,0.0,https://www.facebook.com/Black-Matters-1579673598947501/,0.0,0.0,07/21/15 07:32:07 AM PDT,Black Matters  s                                      Black Matters,Baltimore Maryland Missouri Cleveland Ohio,Maryland Missouri Ohio,2015-07-21,Missouri
133,Another Woman Commits Suicide In JailA teen committed suicide in a jail cell an hour after being arrested anothersuspicious case of a Black woman dying in police custody in the past weekThe second case over a week huh How retarded andor brainwashed byFox News is one supposed to be to believe this is a coincidence No way weare gonna buy such bullshitThe weirdest thing about this specific case is that the suicide was committedjust an hour after the arrest Moreover the woman was suspected of stealingsomeones phone which is quite not a reason for getting to her accountWeve got to also take into consideration thatinblack men go to prison asopposed to a considerably lower rate with the white menorgstory inblackmengtoprisonthemostdisturbingfactsabout racialinequalityintheuscriminaljusticesystemIt definitely seems like theres more to this since until recently taking intocustody hasnt been a reason for suicide among black women Now for somepeople the only way to deal with police violence at the police stations is simplykilling themselves,0.0,https://www.facebook.com/Black-Matters-1579673598947501/,0.0,0.0,07/21/15 07:32:07 AM PDT,Black Matters  s                                      Black Matters,Baltimore Maryland Missouri Cleveland Ohio,Maryland Missouri Ohio,2015-07-21,Ohio
134,Black white Asian Hispanic it doesnt matter Racism is racism its wrongregardless,34.92,https://www.facebook.com/Black-Matters-1579673598947501/,117.0,18.0,08/04/15 05:32:25 AM PDT,Black Matters  s                                      Black Matters,Baltimore Maryland Missouri Cleveland Ohio,Maryland Missouri Ohio,2015-08-04,Maryland
134,Black white Asian Hispanic it doesnt matter Racism is racism its wrongregardless,34.92,https://www.facebook.com/Black-Matters-1579673598947501/,117.0,18.0,08/04/15 05:32:25 AM PDT,Black Matters  s                                      Black Matters,Baltimore Maryland Missouri Cleveland Ohio,Maryland Missouri Ohio,2015-08-04,Missouri
134,Black white Asian Hispanic it doesnt matter Racism is racism its wrongregardless,34.92,https://www.facebook.com/Black-Matters-1579673598947501/,117.0,18.0,08/04/15 05:32:25 AM PDT,Black Matters  s                                      Black Matters,Baltimore Maryland Missouri Cleveland Ohio,Maryland Missouri Ohio,2015-08-04,Ohio
135,I see racism as a pervasive element of both right and left wing politics in theUS Trust no one,3.44,https://www.facebook.com/Black-Matters-1579673598947501/,14.0,1.0,08/04/15 08:31:29 AM PDT,Black Matters  s                                      Black Matters,Baltimore Maryland Missouri Cleveland Ohio,Maryland Missouri Ohio,2015-08-04,Maryland
135,I see racism as a pervasive element of both right and left wing politics in theUS Trust no one,3.44,https://www.facebook.com/Black-Matters-1579673598947501/,14.0,1.0,08/04/15 08:31:29 AM PDT,Black Matters  s                                      Black Matters,Baltimore Maryland Missouri Cleveland Ohio,Maryland Missouri Ohio,2015-08-04,Missouri
135,I see racism as a pervasive element of both right and left wing politics in theUS Trust no one,3.44,https://www.facebook.com/Black-Matters-1579673598947501/,14.0,1.0,08/04/15 08:31:29 AM PDT,Black Matters  s                                      Black Matters,Baltimore Maryland Missouri Cleveland Ohio,Maryland Missouri Ohio,2015-08-04,Ohio
136,We do not need to drink the water from the fountain of youth Because blackdont crack,1.0,https://www.facebook.com/Black-Matters-1579673598947501/,12708.0,1347.0,08/06/15 07:38:42 AM PDT,Black Matters  s                                      Black Matters,Baltimore Maryland Missouri Cleveland Ohio,Maryland Missouri Ohio,2015-08-06,Maryland
136,We do not need to drink the water from the fountain of youth Because blackdont crack,1.0,https://www.facebook.com/Black-Matters-1579673598947501/,12708.0,1347.0,08/06/15 07:38:42 AM PDT,Black Matters  s                                      Black Matters,Baltimore Maryland Missouri Cleveland Ohio,Maryland Missouri Ohio,2015-08-06,Missouri
136,We do not need to drink the water from the fountain of youth Because blackdont crack,1.0,https://www.facebook.com/Black-Matters-1579673598947501/,12708.0,1347.0,08/06/15 07:38:42 AM PDT,Black Matters  s                                      Black Matters,Baltimore Maryland Missouri Cleveland Ohio,Maryland Missouri Ohio,2015-08-06,Ohio
137,Special prosecutor opened an investigation into death of black womenRaynette TurnerNew York Attorney General Eric Schneiderman will launch an investigationinto to the death of one of the five black women who died in an American jailover a twoweek span Raynette Tumer who was the mother of eight childrendied in jail cell in police custody last week She was arrested for shopliftingsome crab legs from a grocery store Due to her bad health history she wastaken to the hospital and released But she died in jail waiting for someone tohelpAccording to American legislation the courthouse officials are supposed tocheck the cell every fifteen minutes but no one checked Tumers cell formore than two hoursA total of five AfricanAmerican women have been found dead in policecustody in just the last month Most of them were hold for minor charges andstill their deaths are under investigation Sandra Bland from Texas KindraChapman from Alabama Joyce Curnell from South Carolina Ralkina Jonesfrom Ohio and Raynetta Turner from New York were found dead in their cellafter being arrested by police officersOnce again it raises questions about how black people are treated in policecustody What if death in police custody is about excessive police force Doyou realize that dozens of black people were found dead in the US,277.27,https://www.facebook.com/Black-Matters-1 579673598947501/,1294.0,120.0,08/05/15 07:05:06 AM PDT,Black Matters  s                                      Black Matters,Baltimore Maryland Missouri Cleveland Ohio,Maryland Missouri Ohio,2015-08-05,Maryland
137,Special prosecutor opened an investigation into death of black womenRaynette TurnerNew York Attorney General Eric Schneiderman will launch an investigationinto to the death of one of the five black women who died in an American jailover a twoweek span Raynette Tumer who was the mother of eight childrendied in jail cell in police custody last week She was arrested for shopliftingsome crab legs from a grocery store Due to her bad health history she wastaken to the hospital and released But she died in jail waiting for someone tohelpAccording to American legislation the courthouse officials are supposed tocheck the cell every fifteen minutes but no one checked Tumers cell formore than two hoursA total of five AfricanAmerican women have been found dead in policecustody in just the last month Most of them were hold for minor charges andstill their deaths are under investigation Sandra Bland from Texas KindraChapman from Alabama Joyce Curnell from South Carolina Ralkina Jonesfrom Ohio and Raynetta Turner from New York were found dead in their cellafter being arrested by police officersOnce again it raises questions about how black people are treated in policecustody What if death in police custody is about excessive police force Doyou realize that dozens of black people were found dead in the US,277.27,https://www.facebook.com/Black-Matters-1 579673598947501/,1294.0,120.0,08/05/15 07:05:06 AM PDT,Black Matters  s                                      Black Matters,Baltimore Maryland Missouri Cleveland Ohio,Maryland Missouri Ohio,2015-08-05,Missouri
137,Special prosecutor opened an investigation into death of black womenRaynette TurnerNew York Attorney General Eric Schneiderman will launch an investigationinto to the death of one of the five black women who died in an American jailover a twoweek span Raynette Tumer who was the mother of eight childrendied in jail cell in police custody last week She was arrested for shopliftingsome crab legs from a grocery store Due to her bad health history she wastaken to the hospital and released But she died in jail waiting for someone tohelpAccording to American legislation the courthouse officials are supposed tocheck the cell every fifteen minutes but no one checked Tumers cell formore than two hoursA total of five AfricanAmerican women have been found dead in policecustody in just the last month Most of them were hold for minor charges andstill their deaths are under investigation Sandra Bland from Texas KindraChapman from Alabama Joyce Curnell from South Carolina Ralkina Jonesfrom Ohio and Raynetta Turner from New York were found dead in their cellafter being arrested by police officersOnce again it raises questions about how black people are treated in policecustody What if death in police custody is about excessive police force Doyou realize that dozens of black people were found dead in the US,277.27,https://www.facebook.com/Black-Matters-1 579673598947501/,1294.0,120.0,08/05/15 07:05:06 AM PDT,Black Matters  s                                      Black Matters,Baltimore Maryland Missouri Cleveland Ohio,Maryland Missouri Ohio,2015-08-05,Ohio
138,Black people come together Only together we are stronger Stand up for yourrights Stand up against discrimination Stand up for equalityIt all depends on us not the Congressneither the White House Because itsnot the government who want to end discrimination,1.025,https://www.facebook.com/Black-Matters-1579673598947501/,3595.0,242.0,08/05/15 07:04:05 AM PDT,Black Matters  s                                      Black Matters,Baltimore Maryland Missouri Cleveland Ohio,Maryland Missouri Ohio,2015-08-05,Maryland
138,Black people come together Only together we are stronger Stand up for yourrights Stand up against discrimination Stand up for equalityIt all depends on us not the Congressneither the White House Because itsnot the government who want to end discrimination,1.025,https://www.facebook.com/Black-Matters-1579673598947501/,3595.0,242.0,08/05/15 07:04:05 AM PDT,Black Matters  s                                      Black Matters,Baltimore Maryland Missouri Cleveland Ohio,Maryland Missouri Ohio,2015-08-05,Missouri
138,Black people come together Only together we are stronger Stand up for yourrights Stand up against discrimination Stand up for equalityIt all depends on us not the Congressneither the White House Because itsnot the government who want to end discrimination,1.025,https://www.facebook.com/Black-Matters-1579673598947501/,3595.0,242.0,08/05/15 07:04:05 AM PDT,Black Matters  s                                      Black Matters,Baltimore Maryland Missouri Cleveland Ohio,Maryland Missouri Ohio,2015-08-05,Ohio
139,The Civil Rights Activist Mary McLeod BethuneMary McLeod Bethune was the civil rights activist and an educator who foundthe National Council of Negro Women inBeing one of thechildren offormer slaves she was the first and the only child to go to AfricanAmericanschool She found the Daytona Normal and Industrial Institute for Negro Girlsbecause she believed that education was the key to racial advancement Inaddition Bethune did a lot of work to contribute to American society Forinstance she was the president of the Florida chapter of the NationalAssociation of Colored Women Moreover inMary Bethune became anadvisory to President Roosevelt on minority affairs and later on she startedher civil rights organization the National Council of Negro WomenThe great educator and civil right activist Mary McLeod Bethunedemonstrated the values of education the philosophy of love and the wiseuse of power Sadly at leastyears of data reveals that Congress dont payattention to American civil rights as Mary McLeod Bethune didyears ago,285.12,https://www.facebook.com/Black-Matters-1579673598947501/,902.0,92.0,08/05/15 07:03:32 AM PDT,Black Matters  s                                      Black Matters,Baltimore Maryland Missouri Cleveland Ohio,Maryland Missouri Ohio,2015-08-05,Maryland
139,The Civil Rights Activist Mary McLeod BethuneMary McLeod Bethune was the civil rights activist and an educator who foundthe National Council of Negro Women inBeing one of thechildren offormer slaves she was the first and the only child to go to AfricanAmericanschool She found the Daytona Normal and Industrial Institute for Negro Girlsbecause she believed that education was the key to racial advancement Inaddition Bethune did a lot of work to contribute to American society Forinstance she was the president of the Florida chapter of the NationalAssociation of Colored Women Moreover inMary Bethune became anadvisory to President Roosevelt on minority affairs and later on she startedher civil rights organization the National Council of Negro WomenThe great educator and civil right activist Mary McLeod Bethunedemonstrated the values of education the philosophy of love and the wiseuse of power Sadly at leastyears of data reveals that Congress dont payattention to American civil rights as Mary McLeod Bethune didyears ago,285.12,https://www.facebook.com/Black-Matters-1579673598947501/,902.0,92.0,08/05/15 07:03:32 AM PDT,Black Matters  s                                      Black Matters,Baltimore Maryland Missouri Cleveland Ohio,Maryland Missouri Ohio,2015-08-05,Missouri
139,The Civil Rights Activist Mary McLeod BethuneMary McLeod Bethune was the civil rights activist and an educator who foundthe National Council of Negro Women inBeing one of thechildren offormer slaves she was the first and the only child to go to AfricanAmericanschool She found the Daytona Normal and Industrial Institute for Negro Girlsbecause she believed that education was the key to racial advancement Inaddition Bethune did a lot of work to contribute to American society Forinstance she was the president of the Florida chapter of the NationalAssociation of Colored Women Moreover inMary Bethune became anadvisory to President Roosevelt on minority affairs and later on she startedher civil rights organization the National Council of Negro WomenThe great educator and civil right activist Mary McLeod Bethunedemonstrated the values of education the philosophy of love and the wiseuse of power Sadly at leastyears of data reveals that Congress dont payattention to American civil rights as Mary McLeod Bethune didyears ago,285.12,https://www.facebook.com/Black-Matters-1579673598947501/,902.0,92.0,08/05/15 07:03:32 AM PDT,Black Matters  s                                      Black Matters,Baltimore Maryland Missouri Cleveland Ohio,Maryland Missouri Ohio,2015-08-05,Ohio
140,The drama in Pocomoke A Maryland town several weeks ago fired its firstblack Police Chief now exposing a racial riftThe leaders of small Marylands city in Eastern Shore fired the PocomokeCitys first black police Chief Kelvin Sewell due to his incompetence andrefusal to fire black police officers Franklin Savage and Lynell Green ChiefSewell was hired by Pocomoke City back inafter his retirement from theBaltimore Police Department Earlier before Sewells dismissal he filed acomplaint on unequal employment opportunities claiming he was paid lessthan his white predecessorsThis is circumstantial evidence that America is divided into different partsbased on race and income Racism has gotten so bad black people aretreated unfairly If God created us equally why the unequal treatment ofminorities still exists in our country What if the firing gas stirred a new spiritof AfricanAmerican activism,177.64,https://www.facebook.com/Black-Matters-1579673598947501/,847.0,70.0,08/05/15 07:03:16 AM PDT,Black Matters  s                                      Black Matters,Baltimore Maryland Missouri Cleveland Ohio,Maryland Missouri Ohio,2015-08-05,Maryland
140,The drama in Pocomoke A Maryland town several weeks ago fired its firstblack Police Chief now exposing a racial riftThe leaders of small Marylands city in Eastern Shore fired the PocomokeCitys first black police Chief Kelvin Sewell due to his incompetence andrefusal to fire black police officers Franklin Savage and Lynell Green ChiefSewell was hired by Pocomoke City back inafter his retirement from theBaltimore Police Department Earlier before Sewells dismissal he filed acomplaint on unequal employment opportunities claiming he was paid lessthan his white predecessorsThis is circumstantial evidence that America is divided into different partsbased on race and income Racism has gotten so bad black people aretreated unfairly If God created us equally why the unequal treatment ofminorities still exists in our country What if the firing gas stirred a new spiritof AfricanAmerican activism,177.64,https://www.facebook.com/Black-Matters-1579673598947501/,847.0,70.0,08/05/15 07:03:16 AM PDT,Black Matters  s                                      Black Matters,Baltimore Maryland Missouri Cleveland Ohio,Maryland Missouri Ohio,2015-08-05,Missouri
140,The drama in Pocomoke A Maryland town several weeks ago fired its firstblack Police Chief now exposing a racial riftThe leaders of small Marylands city in Eastern Shore fired the PocomokeCitys first black police Chief Kelvin Sewell due to his incompetence andrefusal to fire black police officers Franklin Savage and Lynell Green ChiefSewell was hired by Pocomoke City back inafter his retirement from theBaltimore Police Department Earlier before Sewells dismissal he filed acomplaint on unequal employment opportunities claiming he was paid lessthan his white predecessorsThis is circumstantial evidence that America is divided into different partsbased on race and income Racism has gotten so bad black people aretreated unfairly If God created us equally why the unequal treatment ofminorities still exists in our country What if the firing gas stirred a new spiritof AfricanAmerican activism,177.64,https://www.facebook.com/Black-Matters-1579673598947501/,847.0,70.0,08/05/15 07:03:16 AM PDT,Black Matters  s                                      Black Matters,Baltimore Maryland Missouri Cleveland Ohio,Maryland Missouri Ohio,2015-08-05,Ohio
141,Who said that protesting is not effective Yes it isHow many black people were killed and shot by police department for thepast few years How many protests have been held sinceHow usefulwere protestsAccording to analysis by APstates have putnew laws to tackle policeviolence such as use of police officer body cameras racialbias training andsurplus of military equipment However there is more work to be done tosolve racial tensions in AmericaThe public stand against discrimination happens when there is lack of insideconnections with the government People attempt to stop racism thegovernment usually assumes to be problematic but protesters force thegovernment to find compromise Its a well known fact when governments donot deliver people protest,0.0,https://www.facebook.com/Black-Matters-1579673598947501/,0.0,0.0,08/05/15 12:11:58 AM PDT,Black Matters  s                                      Black Matters,Baltimore Maryland Missouri Cleveland Ohio,Maryland Missouri Ohio,2015-08-05,Maryland
141,Who said that protesting is not effective Yes it isHow many black people were killed and shot by police department for thepast few years How many protests have been held sinceHow usefulwere protestsAccording to analysis by APstates have putnew laws to tackle policeviolence such as use of police officer body cameras racialbias training andsurplus of military equipment However there is more work to be done tosolve racial tensions in AmericaThe public stand against discrimination happens when there is lack of insideconnections with the government People attempt to stop racism thegovernment usually assumes to be problematic but protesters force thegovernment to find compromise Its a well known fact when governments donot deliver people protest,0.0,https://www.facebook.com/Black-Matters-1579673598947501/,0.0,0.0,08/05/15 12:11:58 AM PDT,Black Matters  s                                      Black Matters,Baltimore Maryland Missouri Cleveland Ohio,Maryland Missouri Ohio,2015-08-05,Missouri
141,Who said that protesting is not effective Yes it isHow many black people were killed and shot by police department for thepast few years How many protests have been held sinceHow usefulwere protestsAccording to analysis by APstates have putnew laws to tackle policeviolence such as use of police officer body cameras racialbias training andsurplus of military equipment However there is more work to be done tosolve racial tensions in AmericaThe public stand against discrimination happens when there is lack of insideconnections with the government People attempt to stop racism thegovernment usually assumes to be problematic but protesters force thegovernment to find compromise Its a well known fact when governments donot deliver people protest,0.0,https://www.facebook.com/Black-Matters-1579673598947501/,0.0,0.0,08/05/15 12:11:58 AM PDT,Black Matters  s                                      Black Matters,Baltimore Maryland Missouri Cleveland Ohio,Maryland Missouri Ohio,2015-08-05,Ohio
142,Three Bronx officers were caught on camera by the passenger in a car as thedriver appears to be repeatedly punched in the head and thrown to thegroundYall is punching me in the face What did I do to deserve this theyearold Timothy Nelson can be heard saying in the recording of the Julytraffic stopDo they really needcops showing up for a traffic stop And thats why Idrather call a crack head for help before I call the cops they dont protect andserve they shoot and kill anybody thats not wearing a police badge And I donot wear it,61.33,https://www.facebook.com/Black-Matters-1579673598947501/,221.0,35.0,08/04/15 08:31:58 AM PDT,Black Matters  s                                      Black Matters,Baltimore Maryland Missouri Cleveland Ohio,Maryland Missouri Ohio,2015-08-04,Maryland
142,Three Bronx officers were caught on camera by the passenger in a car as thedriver appears to be repeatedly punched in the head and thrown to thegroundYall is punching me in the face What did I do to deserve this theyearold Timothy Nelson can be heard saying in the recording of the Julytraffic stopDo they really needcops showing up for a traffic stop And thats why Idrather call a crack head for help before I call the cops they dont protect andserve they shoot and kill anybody thats not wearing a police badge And I donot wear it,61.33,https://www.facebook.com/Black-Matters-1579673598947501/,221.0,35.0,08/04/15 08:31:58 AM PDT,Black Matters  s                                      Black Matters,Baltimore Maryland Missouri Cleveland Ohio,Maryland Missouri Ohio,2015-08-04,Missouri
142,Three Bronx officers were caught on camera by the passenger in a car as thedriver appears to be repeatedly punched in the head and thrown to thegroundYall is punching me in the face What did I do to deserve this theyearold Timothy Nelson can be heard saying in the recording of the Julytraffic stopDo they really needcops showing up for a traffic stop And thats why Idrather call a crack head for help before I call the cops they dont protect andserve they shoot and kill anybody thats not wearing a police badge And I donot wear it,61.33,https://www.facebook.com/Black-Matters-1579673598947501/,221.0,35.0,08/04/15 08:31:58 AM PDT,Black Matters  s                                      Black Matters,Baltimore Maryland Missouri Cleveland Ohio,Maryland Missouri Ohio,2015-08-04,Ohio
143,So basically cops are detaining folks for no real reason in order to find areason to further detainarrest them Thats a problem,31.88,https://www.facebook.com/Black-Matters-1579673598947501/,105.0,9.0,08/04/15 08:31:45 AM PDT,Black Matters  s                                      Black Matters,Baltimore Maryland Missouri Cleveland Ohio,Maryland Missouri Ohio,2015-08-04,Maryland
143,So basically cops are detaining folks for no real reason in order to find areason to further detainarrest them Thats a problem,31.88,https://www.facebook.com/Black-Matters-1579673598947501/,105.0,9.0,08/04/15 08:31:45 AM PDT,Black Matters  s                                      Black Matters,Baltimore Maryland Missouri Cleveland Ohio,Maryland Missouri Ohio,2015-08-04,Missouri
143,So basically cops are detaining folks for no real reason in order to find areason to further detainarrest them Thats a problem,31.88,https://www.facebook.com/Black-Matters-1579673598947501/,105.0,9.0,08/04/15 08:31:45 AM PDT,Black Matters  s                                      Black Matters,Baltimore Maryland Missouri Cleveland Ohio,Maryland Missouri Ohio,2015-08-04,Ohio
144,Man rammed St Louis police carfor the black people Black people are fedup with an age of racist societyThe yearold Kevin Labriado from Bellefontaine Neighbors was chargedfor ramming police car from behind twice screaming for black people Heassaulted two officers and his child who was sitting in his car Two St Louisofficers were on patrol until Labriado and his fiveyearold daughteraccidentally rammed their car When police officer tried to arrest himLabriado yelled several times This is for the black peopleWhat if Labriado sought to revenge for all black lives that officers took awayRacism obviously gave rise to the tensions in society that led to disrespectand hate Moreover black people are fed up with racism and police violencetowards black community What is more racial tensions have gotten worseunder the current government Even after several months of protests over thedeaths of Eric Garner Tamir Rice Michael Brown Sandra Bland and FreddieGray the government inspired more unrest Today black community is indesperate situation seeking for help,85.07,https://www.facebook.com/Black-Matters-1579673598947501/,351.0,63.0,08/04/15 08:30:58 AM PDT,Black Matters  s                                      Black Matters,Baltimore Maryland Missouri Cleveland Ohio,Maryland Missouri Ohio,2015-08-04,Maryland
144,Man rammed St Louis police carfor the black people Black people are fedup with an age of racist societyThe yearold Kevin Labriado from Bellefontaine Neighbors was chargedfor ramming police car from behind twice screaming for black people Heassaulted two officers and his child who was sitting in his car Two St Louisofficers were on patrol until Labriado and his fiveyearold daughteraccidentally rammed their car When police officer tried to arrest himLabriado yelled several times This is for the black peopleWhat if Labriado sought to revenge for all black lives that officers took awayRacism obviously gave rise to the tensions in society that led to disrespectand hate Moreover black people are fed up with racism and police violencetowards black community What is more racial tensions have gotten worseunder the current government Even after several months of protests over thedeaths of Eric Garner Tamir Rice Michael Brown Sandra Bland and FreddieGray the government inspired more unrest Today black community is indesperate situation seeking for help,85.07,https://www.facebook.com/Black-Matters-1579673598947501/,351.0,63.0,08/04/15 08:30:58 AM PDT,Black Matters  s                                      Black Matters,Baltimore Maryland Missouri Cleveland Ohio,Maryland Missouri Ohio,2015-08-04,Missouri
144,Man rammed St Louis police carfor the black people Black people are fedup with an age of racist societyThe yearold Kevin Labriado from Bellefontaine Neighbors was chargedfor ramming police car from behind twice screaming for black people Heassaulted two officers and his child who was sitting in his car Two St Louisofficers were on patrol until Labriado and his fiveyearold daughteraccidentally rammed their car When police officer tried to arrest himLabriado yelled several times This is for the black peopleWhat if Labriado sought to revenge for all black lives that officers took awayRacism obviously gave rise to the tensions in society that led to disrespectand hate Moreover black people are fed up with racism and police violencetowards black community What is more racial tensions have gotten worseunder the current government Even after several months of protests over thedeaths of Eric Garner Tamir Rice Michael Brown Sandra Bland and FreddieGray the government inspired more unrest Today black community is indesperate situation seeking for help,85.07,https://www.facebook.com/Black-Matters-1579673598947501/,351.0,63.0,08/04/15 08:30:58 AM PDT,Black Matters  s                                      Black Matters,Baltimore Maryland Missouri Cleveland Ohio,Maryland Missouri Ohio,2015-08-04,Ohio
145,We can start by having community days for the kids its a must to invest inthe youth We underestimate what were capable of doing on our own Wedont have to wait on others to value our lives,65.87,https://www.facebook.com/Black-Matters-1579673598947501/,402.0,49.0,08/04/15 05:31:20 AM PDT,Black Matters  s                                      Black Matters,Baltimore Maryland Missouri Cleveland Ohio,Maryland Missouri Ohio,2015-08-04,Maryland
145,We can start by having community days for the kids its a must to invest inthe youth We underestimate what were capable of doing on our own Wedont have to wait on others to value our lives,65.87,https://www.facebook.com/Black-Matters-1579673598947501/,402.0,49.0,08/04/15 05:31:20 AM PDT,Black Matters  s                                      Black Matters,Baltimore Maryland Missouri Cleveland Ohio,Maryland Missouri Ohio,2015-08-04,Missouri
145,We can start by having community days for the kids its a must to invest inthe youth We underestimate what were capable of doing on our own Wedont have to wait on others to value our lives,65.87,https://www.facebook.com/Black-Matters-1579673598947501/,402.0,49.0,08/04/15 05:31:20 AM PDT,Black Matters  s                                      Black Matters,Baltimore Maryland Missouri Cleveland Ohio,Maryland Missouri Ohio,2015-08-04,Ohio
146,Alabama Police Officer Kept His Job After Proposal to Murder Black Man andHide EvidenceA police officer in Alabama proposed murdering a black resident and creatingbogus evidence to suggest the killing was in selfdefenseOfficer Troy Middlebrooks kept his job and continues to patrol Alexander Cityafter authorities there paid the manto avoid being publicly sued overthe incident Middlebrooks a veteran of the US marines said the man needsa god damn bullet and allegedly referred to him as that nigger afterbecoming frustrated that the man was not punished more harshly over a priorruninThe payment was made to the black resident Vincent Bias after a secretrecording of Middlebrookss remarks was played to the citys police chiefsand the mayor Elected city councillors said they were not consultedDo you know that you can go to prison for murderous intent However if youare a white police officer offering to KILL a BLACK AMERICAN and then hidethe evidence then you dont even get fired Oh yeah its happening in awonderful state called Alabama You know how it works here Do you haveany more questions for American law enforcement system,0.0,https://www.facebook.com/Black-Matters-1579673598947501/,0.0,0.0,08/06/15 07:36:02 AM PDT,Black Matters  s                                      Black Matters,Baltimore Maryland Missouri Cleveland Ohio,Maryland Missouri Ohio,2015-08-06,Maryland
146,Alabama Police Officer Kept His Job After Proposal to Murder Black Man andHide EvidenceA police officer in Alabama proposed murdering a black resident and creatingbogus evidence to suggest the killing was in selfdefenseOfficer Troy Middlebrooks kept his job and continues to patrol Alexander Cityafter authorities there paid the manto avoid being publicly sued overthe incident Middlebrooks a veteran of the US marines said the man needsa god damn bullet and allegedly referred to him as that nigger afterbecoming frustrated that the man was not punished more harshly over a priorruninThe payment was made to the black resident Vincent Bias after a secretrecording of Middlebrookss remarks was played to the citys police chiefsand the mayor Elected city councillors said they were not consultedDo you know that you can go to prison for murderous intent However if youare a white police officer offering to KILL a BLACK AMERICAN and then hidethe evidence then you dont even get fired Oh yeah its happening in awonderful state called Alabama You know how it works here Do you haveany more questions for American law enforcement system,0.0,https://www.facebook.com/Black-Matters-1579673598947501/,0.0,0.0,08/06/15 07:36:02 AM PDT,Black Matters  s                                      Black Matters,Baltimore Maryland Missouri Cleveland Ohio,Maryland Missouri Ohio,2015-08-06,Missouri
146,Alabama Police Officer Kept His Job After Proposal to Murder Black Man andHide EvidenceA police officer in Alabama proposed murdering a black resident and creatingbogus evidence to suggest the killing was in selfdefenseOfficer Troy Middlebrooks kept his job and continues to patrol Alexander Cityafter authorities there paid the manto avoid being publicly sued overthe incident Middlebrooks a veteran of the US marines said the man needsa god damn bullet and allegedly referred to him as that nigger afterbecoming frustrated that the man was not punished more harshly over a priorruninThe payment was made to the black resident Vincent Bias after a secretrecording of Middlebrookss remarks was played to the citys police chiefsand the mayor Elected city councillors said they were not consultedDo you know that you can go to prison for murderous intent However if youare a white police officer offering to KILL a BLACK AMERICAN and then hidethe evidence then you dont even get fired Oh yeah its happening in awonderful state called Alabama You know how it works here Do you haveany more questions for American law enforcement system,0.0,https://www.facebook.com/Black-Matters-1579673598947501/,0.0,0.0,08/06/15 07:36:02 AM PDT,Black Matters  s                                      Black Matters,Baltimore Maryland Missouri Cleveland Ohio,Maryland Missouri Ohio,2015-08-06,Ohio
147,Young Unarmed Black Man Killed By Cop Didnt Want ToDie Too YoungAn unarmed black teenager in Texas was shot dead by a cop who had onlyrecently graduated from the police academy Just over a week before hisdeath he posted that he doesnt want to die too young on TwitterOfficers responded to a burglary call aroundam on Friday hearing reportsthat a suspect was damaging vehicles First spotting Taylor moving about thelot officers also noticed Taylors SUV had been smashed into the front of thedealership showroom Finding that Taylor had moved inside the showroomArlington Police Chief Police Will Johnson said Taylor would not comply whentold to lie down on the ground but fled to a back room yearold officerBrad Miller entered the showroom to arrest Taylor and then an altercationbroke out Miller fired four shots including the fatal bullets from the gun ofMiller A second officer fired a taser Johnson saidAnd now there are three main points that you should think ofTaylor was described as a good kid He was a football player at AngeloState University Never was involved in criminal activitiesThe officer graduated from the police academy less thanmonths ago andwas working under the supervision of a training officerTaylor didnt want to die youngBlack teens dont really live they survive And unfortunately there is no oneto save them from death There is no one to stop police brutality We all wantour kids to feel safe we want them to be safe and sound Are our hopesdoomed to disappointment,44.54,https://www.facebook.com/Black-Matters-1579673598947501/,290.0,86.0,08/10/15 07:36:40 AM PDT,Black Matters  s                                      Black Matters,Baltimore Maryland Missouri Cleveland Ohio,Maryland Missouri Ohio,2015-08-10,Maryland
147,Young Unarmed Black Man Killed By Cop Didnt Want ToDie Too YoungAn unarmed black teenager in Texas was shot dead by a cop who had onlyrecently graduated from the police academy Just over a week before hisdeath he posted that he doesnt want to die too young on TwitterOfficers responded to a burglary call aroundam on Friday hearing reportsthat a suspect was damaging vehicles First spotting Taylor moving about thelot officers also noticed Taylors SUV had been smashed into the front of thedealership showroom Finding that Taylor had moved inside the showroomArlington Police Chief Police Will Johnson said Taylor would not comply whentold to lie down on the ground but fled to a back room yearold officerBrad Miller entered the showroom to arrest Taylor and then an altercationbroke out Miller fired four shots including the fatal bullets from the gun ofMiller A second officer fired a taser Johnson saidAnd now there are three main points that you should think ofTaylor was described as a good kid He was a football player at AngeloState University Never was involved in criminal activitiesThe officer graduated from the police academy less thanmonths ago andwas working under the supervision of a training officerTaylor didnt want to die youngBlack teens dont really live they survive And unfortunately there is no oneto save them from death There is no one to stop police brutality We all wantour kids to feel safe we want them to be safe and sound Are our hopesdoomed to disappointment,44.54,https://www.facebook.com/Black-Matters-1579673598947501/,290.0,86.0,08/10/15 07:36:40 AM PDT,Black Matters  s                                      Black Matters,Baltimore Maryland Missouri Cleveland Ohio,Maryland Missouri Ohio,2015-08-10,Missouri
147,Young Unarmed Black Man Killed By Cop Didnt Want ToDie Too YoungAn unarmed black teenager in Texas was shot dead by a cop who had onlyrecently graduated from the police academy Just over a week before hisdeath he posted that he doesnt want to die too young on TwitterOfficers responded to a burglary call aroundam on Friday hearing reportsthat a suspect was damaging vehicles First spotting Taylor moving about thelot officers also noticed Taylors SUV had been smashed into the front of thedealership showroom Finding that Taylor had moved inside the showroomArlington Police Chief Police Will Johnson said Taylor would not comply whentold to lie down on the ground but fled to a back room yearold officerBrad Miller entered the showroom to arrest Taylor and then an altercationbroke out Miller fired four shots including the fatal bullets from the gun ofMiller A second officer fired a taser Johnson saidAnd now there are three main points that you should think ofTaylor was described as a good kid He was a football player at AngeloState University Never was involved in criminal activitiesThe officer graduated from the police academy less thanmonths ago andwas working under the supervision of a training officerTaylor didnt want to die youngBlack teens dont really live they survive And unfortunately there is no oneto save them from death There is no one to stop police brutality We all wantour kids to feel safe we want them to be safe and sound Are our hopesdoomed to disappointment,44.54,https://www.facebook.com/Black-Matters-1579673598947501/,290.0,86.0,08/10/15 07:36:40 AM PDT,Black Matters  s                                      Black Matters,Baltimore Maryland Missouri Cleveland Ohio,Maryland Missouri Ohio,2015-08-10,Ohio
148,Michael we didnt forget you We havent forgotten anyone No justicenopeaceBlackLivesMatter Ferguson,999.99,https://www.facebook.com/Black-Matters-1 579673598947501/,8752.0,1102.0,08/12/15 12:53:51 AM PDT,Black Matters  s                                      Black Matters,Baltimore Maryland Missouri Cleveland Ohio,Maryland Missouri Ohio,2015-08-12,Maryland
148,Michael we didnt forget you We havent forgotten anyone No justicenopeaceBlackLivesMatter Ferguson,999.99,https://www.facebook.com/Black-Matters-1 579673598947501/,8752.0,1102.0,08/12/15 12:53:51 AM PDT,Black Matters  s                                      Black Matters,Baltimore Maryland Missouri Cleveland Ohio,Maryland Missouri Ohio,2015-08-12,Missouri
148,Michael we didnt forget you We havent forgotten anyone No justicenopeaceBlackLivesMatter Ferguson,999.99,https://www.facebook.com/Black-Matters-1 579673598947501/,8752.0,1102.0,08/12/15 12:53:51 AM PDT,Black Matters  s                                      Black Matters,Baltimore Maryland Missouri Cleveland Ohio,Maryland Missouri Ohio,2015-08-12,Ohio
149,BREAKING NEWSOakland JoeBartOakland police officers fatally shot a man suspected in alleged carjackingattempt in Downtown Oakland Wednesday night Is it a race warYesterday night a group ofprotesters burned Confederate flag and tried toshutdown a freeway in Downtown Oakland The opposition to police violencewas in response to the police shooting earlier in the dayAccording to Oakland Police Department yesterday atpm in the areaof th Avenue and International Boulevard Oakland police officers spotted avehicle they believe to be connected to a previous robbery on JulyThepursuit started when the driver fled through Oakland streets until the suspectcrashed into another car in the area of th Avenue and Martin Luther KingJr street But when the suspect ran of the car three officers opened fire Thesuspect Joe Bart has died at the hospitalDid you know that it was fifth shooting this year that involved police officersHow quickly it has become so usual Why it has become so legit Where isthe government speaking about the existence of racism in AmericaBlack Lives Matter,0.0,https://www.facebook.com/Black-Matters-1579673598947501/,0.0,0.0,08/13/15 07:18:16 AM PDT,Black Matters  s                                      Black Matters,Baltimore Maryland Missouri Cleveland Ohio,Maryland Missouri Ohio,2015-08-13,Maryland
149,BREAKING NEWSOakland JoeBartOakland police officers fatally shot a man suspected in alleged carjackingattempt in Downtown Oakland Wednesday night Is it a race warYesterday night a group ofprotesters burned Confederate flag and tried toshutdown a freeway in Downtown Oakland The opposition to police violencewas in response to the police shooting earlier in the dayAccording to Oakland Police Department yesterday atpm in the areaof th Avenue and International Boulevard Oakland police officers spotted avehicle they believe to be connected to a previous robbery on JulyThepursuit started when the driver fled through Oakland streets until the suspectcrashed into another car in the area of th Avenue and Martin Luther KingJr street But when the suspect ran of the car three officers opened fire Thesuspect Joe Bart has died at the hospitalDid you know that it was fifth shooting this year that involved police officersHow quickly it has become so usual Why it has become so legit Where isthe government speaking about the existence of racism in AmericaBlack Lives Matter,0.0,https://www.facebook.com/Black-Matters-1579673598947501/,0.0,0.0,08/13/15 07:18:16 AM PDT,Black Matters  s                                      Black Matters,Baltimore Maryland Missouri Cleveland Ohio,Maryland Missouri Ohio,2015-08-13,Missouri
149,BREAKING NEWSOakland JoeBartOakland police officers fatally shot a man suspected in alleged carjackingattempt in Downtown Oakland Wednesday night Is it a race warYesterday night a group ofprotesters burned Confederate flag and tried toshutdown a freeway in Downtown Oakland The opposition to police violencewas in response to the police shooting earlier in the dayAccording to Oakland Police Department yesterday atpm in the areaof th Avenue and International Boulevard Oakland police officers spotted avehicle they believe to be connected to a previous robbery on JulyThepursuit started when the driver fled through Oakland streets until the suspectcrashed into another car in the area of th Avenue and Martin Luther KingJr street But when the suspect ran of the car three officers opened fire Thesuspect Joe Bart has died at the hospitalDid you know that it was fifth shooting this year that involved police officersHow quickly it has become so usual Why it has become so legit Where isthe government speaking about the existence of racism in AmericaBlack Lives Matter,0.0,https://www.facebook.com/Black-Matters-1579673598947501/,0.0,0.0,08/13/15 07:18:16 AM PDT,Black Matters  s                                      Black Matters,Baltimore Maryland Missouri Cleveland Ohio,Maryland Missouri Ohio,2015-08-13,Ohio
150,Black people still face discriminationNew data shows that white privilege still dominates in the United States ofAmerica It is painfully obvious that unequal treatment is harmful on a dailybasis For instance poor service plays an important role contributing toalteration in health that is potential harmful realities for many black people,82.95,https://www.facebook.com/Black-Matters-1579673598947501/,294.0,34.0,08/18/15 08:23:09 AM PDT,Black Matters  s                                      Black Matters,Baltimore Maryland Missouri Cleveland Ohio,Maryland Missouri Ohio,2015-08-18,Maryland
150,Black people still face discriminationNew data shows that white privilege still dominates in the United States ofAmerica It is painfully obvious that unequal treatment is harmful on a dailybasis For instance poor service plays an important role contributing toalteration in health that is potential harmful realities for many black people,82.95,https://www.facebook.com/Black-Matters-1579673598947501/,294.0,34.0,08/18/15 08:23:09 AM PDT,Black Matters  s                                      Black Matters,Baltimore Maryland Missouri Cleveland Ohio,Maryland Missouri Ohio,2015-08-18,Missouri
150,Black people still face discriminationNew data shows that white privilege still dominates in the United States ofAmerica It is painfully obvious that unequal treatment is harmful on a dailybasis For instance poor service plays an important role contributing toalteration in health that is potential harmful realities for many black people,82.95,https://www.facebook.com/Black-Matters-1579673598947501/,294.0,34.0,08/18/15 08:23:09 AM PDT,Black Matters  s                                      Black Matters,Baltimore Maryland Missouri Cleveland Ohio,Maryland Missouri Ohio,2015-08-18,Ohio
151,Why black parents worry about their children How should we talk to ourchildren about how safely interact with police officers in order to protectthemselvesTina CarterShileds has five kids and three of them recently started to driveThe first thought she had when they wanted to drive alone was Wait aminute Im really scared right now What should they do if they get pulledover What if they do something they dont supposed to be doing It is notalways fair when officers arrest African Americans but its a reality What ifpolice officers will automatically assume that your child is criminal because ofhow him or her looksBlack parents should remember that their kids will always be judged by theway they look Thats why its important to instruct our children how to reactwhen you are in trouble with law enforcement Because if a stranger followsyour child after himher buy a bag of Skittles ran back into the storeRemember anything is better than dyingAnyways its hard to believe that inst century black parents have to teachtheir children both survive and thrive But who will take responsibility fortraining police officers,160.23,https://www.facebook.com/Black-Matters-1 579673598947501/,594.0,63.0,08/18/15 08:22:50 AM PDT,Black Matters  s                                      Black Matters,Baltimore Maryland Missouri Cleveland Ohio,Maryland Missouri Ohio,2015-08-18,Maryland
151,Why black parents worry about their children How should we talk to ourchildren about how safely interact with police officers in order to protectthemselvesTina CarterShileds has five kids and three of them recently started to driveThe first thought she had when they wanted to drive alone was Wait aminute Im really scared right now What should they do if they get pulledover What if they do something they dont supposed to be doing It is notalways fair when officers arrest African Americans but its a reality What ifpolice officers will automatically assume that your child is criminal because ofhow him or her looksBlack parents should remember that their kids will always be judged by theway they look Thats why its important to instruct our children how to reactwhen you are in trouble with law enforcement Because if a stranger followsyour child after himher buy a bag of Skittles ran back into the storeRemember anything is better than dyingAnyways its hard to believe that inst century black parents have to teachtheir children both survive and thrive But who will take responsibility fortraining police officers,160.23,https://www.facebook.com/Black-Matters-1 579673598947501/,594.0,63.0,08/18/15 08:22:50 AM PDT,Black Matters  s                                      Black Matters,Baltimore Maryland Missouri Cleveland Ohio,Maryland Missouri Ohio,2015-08-18,Missouri
151,Why black parents worry about their children How should we talk to ourchildren about how safely interact with police officers in order to protectthemselvesTina CarterShileds has five kids and three of them recently started to driveThe first thought she had when they wanted to drive alone was Wait aminute Im really scared right now What should they do if they get pulledover What if they do something they dont supposed to be doing It is notalways fair when officers arrest African Americans but its a reality What ifpolice officers will automatically assume that your child is criminal because ofhow him or her looksBlack parents should remember that their kids will always be judged by theway they look Thats why its important to instruct our children how to reactwhen you are in trouble with law enforcement Because if a stranger followsyour child after himher buy a bag of Skittles ran back into the storeRemember anything is better than dyingAnyways its hard to believe that inst century black parents have to teachtheir children both survive and thrive But who will take responsibility fortraining police officers,160.23,https://www.facebook.com/Black-Matters-1 579673598947501/,594.0,63.0,08/18/15 08:22:50 AM PDT,Black Matters  s                                      Black Matters,Baltimore Maryland Missouri Cleveland Ohio,Maryland Missouri Ohio,2015-08-18,Ohio
152,What is like to live in America if you are blackWell first of all you have to work much harder to prove that you are worthothers Second of all everybody is judging and stereotyping you by the colorof your skin Third of all you are always being an other even in the countryyou were born Forth of all you are always expected to be load and to dancewell In addition there are lots of people who like to throw race cardsCan we live like that How long should we wait for the governmentcontributions,119.55,https://www.facebook.com/Black-Matters-1579673598947501/,315.0,42.0,08/18/15 08:22:26 AM PDT,Black Matters  s                                      Black Matters,Baltimore Maryland Missouri Cleveland Ohio,Maryland Missouri Ohio,2015-08-18,Maryland
152,What is like to live in America if you are blackWell first of all you have to work much harder to prove that you are worthothers Second of all everybody is judging and stereotyping you by the colorof your skin Third of all you are always being an other even in the countryyou were born Forth of all you are always expected to be load and to dancewell In addition there are lots of people who like to throw race cardsCan we live like that How long should we wait for the governmentcontributions,119.55,https://www.facebook.com/Black-Matters-1579673598947501/,315.0,42.0,08/18/15 08:22:26 AM PDT,Black Matters  s                                      Black Matters,Baltimore Maryland Missouri Cleveland Ohio,Maryland Missouri Ohio,2015-08-18,Missouri
152,What is like to live in America if you are blackWell first of all you have to work much harder to prove that you are worthothers Second of all everybody is judging and stereotyping you by the colorof your skin Third of all you are always being an other even in the countryyou were born Forth of all you are always expected to be load and to dancewell In addition there are lots of people who like to throw race cardsCan we live like that How long should we wait for the governmentcontributions,119.55,https://www.facebook.com/Black-Matters-1579673598947501/,315.0,42.0,08/18/15 08:22:26 AM PDT,Black Matters  s                                      Black Matters,Baltimore Maryland Missouri Cleveland Ohio,Maryland Missouri Ohio,2015-08-18,Ohio
153,Men March begins with mile walk to DC to denounce epidemic of theculture of gun violence and racismmile trek to Washington has started this Sunday evening in order to bringmore attention to widespread violence in different cities across America Thefounder of the group Munir Bahar said that the march will lasthours in amemory of more thanpeople who have been killed in Baltimore this yearTheMen March will highlight the racism and violence across the countryWhats wrong with our society Police kill unarmed citizens we kill eachother What example we will be setting for the future generations How arewe going to break the cycle of violence Are there any chances to overcomedeeply rooted racism and violence in America What if peace comes after thefairness,1414.97,https://www.facebook.com/Black-Matters-1579673598947501/,11736.0,1130.0,08/18/15 08:22:08 AM PDT,Black Matters  s                                      Black Matters,Baltimore Maryland Missouri Cleveland Ohio,Maryland Missouri Ohio,2015-08-18,Maryland
153,Men March begins with mile walk to DC to denounce epidemic of theculture of gun violence and racismmile trek to Washington has started this Sunday evening in order to bringmore attention to widespread violence in different cities across America Thefounder of the group Munir Bahar said that the march will lasthours in amemory of more thanpeople who have been killed in Baltimore this yearTheMen March will highlight the racism and violence across the countryWhats wrong with our society Police kill unarmed citizens we kill eachother What example we will be setting for the future generations How arewe going to break the cycle of violence Are there any chances to overcomedeeply rooted racism and violence in America What if peace comes after thefairness,1414.97,https://www.facebook.com/Black-Matters-1579673598947501/,11736.0,1130.0,08/18/15 08:22:08 AM PDT,Black Matters  s                                      Black Matters,Baltimore Maryland Missouri Cleveland Ohio,Maryland Missouri Ohio,2015-08-18,Missouri
153,Men March begins with mile walk to DC to denounce epidemic of theculture of gun violence and racismmile trek to Washington has started this Sunday evening in order to bringmore attention to widespread violence in different cities across America Thefounder of the group Munir Bahar said that the march will lasthours in amemory of more thanpeople who have been killed in Baltimore this yearTheMen March will highlight the racism and violence across the countryWhats wrong with our society Police kill unarmed citizens we kill eachother What example we will be setting for the future generations How arewe going to break the cycle of violence Are there any chances to overcomedeeply rooted racism and violence in America What if peace comes after thefairness,1414.97,https://www.facebook.com/Black-Matters-1579673598947501/,11736.0,1130.0,08/18/15 08:22:08 AM PDT,Black Matters  s                                      Black Matters,Baltimore Maryland Missouri Cleveland Ohio,Maryland Missouri Ohio,2015-08-18,Ohio
154,Straight Outta Compton is straight realityThe new movie Straight Outta Compton focus on legendary hiphop pioneersNWA and their struggles against racism and police violence The movie iscoming this weekend in the theaters However some of the cinemas refusedto show the movie citing safety and liability concernsDoes it remind you of anything How about Ferguson How about BaltimoreToday you are willing to be detained in the name of defending your rightsToday cops can easily shoot you for a small violation Even having black copsand black mayors doesnt end police brutality Fortunately today you areallowed to record police officers in order to further prevent potentially seriouscases of police wrongdoing fairly,121.04,https://www.facebook.com/Black-Matters-1579673598947501/,553.0,70.0,08/18/15 08:21:46 AM PDT,Black Matters  s                                      Black Matters,Baltimore Maryland Missouri Cleveland Ohio,Maryland Missouri Ohio,2015-08-18,Maryland
154,Straight Outta Compton is straight realityThe new movie Straight Outta Compton focus on legendary hiphop pioneersNWA and their struggles against racism and police violence The movie iscoming this weekend in the theaters However some of the cinemas refusedto show the movie citing safety and liability concernsDoes it remind you of anything How about Ferguson How about BaltimoreToday you are willing to be detained in the name of defending your rightsToday cops can easily shoot you for a small violation Even having black copsand black mayors doesnt end police brutality Fortunately today you areallowed to record police officers in order to further prevent potentially seriouscases of police wrongdoing fairly,121.04,https://www.facebook.com/Black-Matters-1579673598947501/,553.0,70.0,08/18/15 08:21:46 AM PDT,Black Matters  s                                      Black Matters,Baltimore Maryland Missouri Cleveland Ohio,Maryland Missouri Ohio,2015-08-18,Missouri
154,Straight Outta Compton is straight realityThe new movie Straight Outta Compton focus on legendary hiphop pioneersNWA and their struggles against racism and police violence The movie iscoming this weekend in the theaters However some of the cinemas refusedto show the movie citing safety and liability concernsDoes it remind you of anything How about Ferguson How about BaltimoreToday you are willing to be detained in the name of defending your rightsToday cops can easily shoot you for a small violation Even having black copsand black mayors doesnt end police brutality Fortunately today you areallowed to record police officers in order to further prevent potentially seriouscases of police wrongdoing fairly,121.04,https://www.facebook.com/Black-Matters-1579673598947501/,553.0,70.0,08/18/15 08:21:46 AM PDT,Black Matters  s                                      Black Matters,Baltimore Maryland Missouri Cleveland Ohio,Maryland Missouri Ohio,2015-08-18,Ohio
155,Police Officers Take Down A Onelegged Homeless Black Man ArmedWith Crutches in San FranciscoWriter Chaedria LaBouvier reported that she had seenSan Franciscopolice officers subduing a homeless black man who had one leg outsideTwitter headquartersWitnesses told LaBouvier that police had been called because the man waswaving sticks which later turned out to be his crutchesNone of the employees at Twitter or other tech companies came out to objectas theofficers took down the onelegged homeless manThe US Justice Department recently filed court documents in an Idaho casewhich declared it unconstitutional to criminalize homelessness According tothe Coalition on Homelessness the city handed outcitations tohomeless people who were sitting on sidewalks betweenam andpminWhat kind of people police usually hire Mentally unstable bloodthirstycowards or We already know the answer Sometimes we all wonder dopolice officers have mercy for anyone Hard to say because what we seeconfuses us,81.42,https://www.facebook.com/Black-Matters-1579673598947501/,199.0,21.0,08/18/15 08:21:25 AM PDT,Black Matters  s                                      Black Matters,Baltimore Maryland Missouri Cleveland Ohio,Maryland Missouri Ohio,2015-08-18,Maryland
155,Police Officers Take Down A Onelegged Homeless Black Man ArmedWith Crutches in San FranciscoWriter Chaedria LaBouvier reported that she had seenSan Franciscopolice officers subduing a homeless black man who had one leg outsideTwitter headquartersWitnesses told LaBouvier that police had been called because the man waswaving sticks which later turned out to be his crutchesNone of the employees at Twitter or other tech companies came out to objectas theofficers took down the onelegged homeless manThe US Justice Department recently filed court documents in an Idaho casewhich declared it unconstitutional to criminalize homelessness According tothe Coalition on Homelessness the city handed outcitations tohomeless people who were sitting on sidewalks betweenam andpminWhat kind of people police usually hire Mentally unstable bloodthirstycowards or We already know the answer Sometimes we all wonder dopolice officers have mercy for anyone Hard to say because what we seeconfuses us,81.42,https://www.facebook.com/Black-Matters-1579673598947501/,199.0,21.0,08/18/15 08:21:25 AM PDT,Black Matters  s                                      Black Matters,Baltimore Maryland Missouri Cleveland Ohio,Maryland Missouri Ohio,2015-08-18,Missouri
155,Police Officers Take Down A Onelegged Homeless Black Man ArmedWith Crutches in San FranciscoWriter Chaedria LaBouvier reported that she had seenSan Franciscopolice officers subduing a homeless black man who had one leg outsideTwitter headquartersWitnesses told LaBouvier that police had been called because the man waswaving sticks which later turned out to be his crutchesNone of the employees at Twitter or other tech companies came out to objectas theofficers took down the onelegged homeless manThe US Justice Department recently filed court documents in an Idaho casewhich declared it unconstitutional to criminalize homelessness According tothe Coalition on Homelessness the city handed outcitations tohomeless people who were sitting on sidewalks betweenam andpminWhat kind of people police usually hire Mentally unstable bloodthirstycowards or We already know the answer Sometimes we all wonder dopolice officers have mercy for anyone Hard to say because what we seeconfuses us,81.42,https://www.facebook.com/Black-Matters-1579673598947501/,199.0,21.0,08/18/15 08:21:25 AM PDT,Black Matters  s                                      Black Matters,Baltimore Maryland Missouri Cleveland Ohio,Maryland Missouri Ohio,2015-08-18,Ohio
156,Handcolored portrait of an unidentified black woman shucking corn ByGeorge Barnard,81.43,https://www.facebook.com/Black-Matters-1579673598947501/,219.0,32.0,08/18/15 08:20:41 AM PDT,Black Matters  s                                      Black Matters,Baltimore Maryland Missouri Cleveland Ohio,Maryland Missouri Ohio,2015-08-18,Maryland
156,Handcolored portrait of an unidentified black woman shucking corn ByGeorge Barnard,81.43,https://www.facebook.com/Black-Matters-1579673598947501/,219.0,32.0,08/18/15 08:20:41 AM PDT,Black Matters  s                                      Black Matters,Baltimore Maryland Missouri Cleveland Ohio,Maryland Missouri Ohio,2015-08-18,Missouri
156,Handcolored portrait of an unidentified black woman shucking corn ByGeorge Barnard,81.43,https://www.facebook.com/Black-Matters-1579673598947501/,219.0,32.0,08/18/15 08:20:41 AM PDT,Black Matters  s                                      Black Matters,Baltimore Maryland Missouri Cleveland Ohio,Maryland Missouri Ohio,2015-08-18,Ohio
157,Racism doesnt usually look like someone shouting slurs it looks like peopleeagerly looking for a reason why a black kid deserved to die,413.94,https://www.facebook.com/Black-Matters-1579673598947501/,2644.0,251.0,08/18/15 08:20:23 AM PDT,Black Matters  s                                      Black Matters,Baltimore Maryland Missouri Cleveland Ohio,Maryland Missouri Ohio,2015-08-18,Maryland
157,Racism doesnt usually look like someone shouting slurs it looks like peopleeagerly looking for a reason why a black kid deserved to die,413.94,https://www.facebook.com/Black-Matters-1579673598947501/,2644.0,251.0,08/18/15 08:20:23 AM PDT,Black Matters  s                                      Black Matters,Baltimore Maryland Missouri Cleveland Ohio,Maryland Missouri Ohio,2015-08-18,Missouri
157,Racism doesnt usually look like someone shouting slurs it looks like peopleeagerly looking for a reason why a black kid deserved to die,413.94,https://www.facebook.com/Black-Matters-1579673598947501/,2644.0,251.0,08/18/15 08:20:23 AM PDT,Black Matters  s                                      Black Matters,Baltimore Maryland Missouri Cleveland Ohio,Maryland Missouri Ohio,2015-08-18,Ohio
158,BREAKING NEWS St Louis police fatally shot a black teenager while tryingto issue search warrantOn Wednesday Augracial tensions again sparked in Missouri city afterSt Louis police officers fatally shot black teenager at Walton Avenue andPage Boulevard while trying to issue search warrant According to St LouisPolice Chief San Dotson a young black man pointed a gun at officers andwas trying to escape from a house where officers were carrying out a searchwarrant for him The yearold and yearold officers who shot thesuspect four times were about seven years on the forceThat was followed by crowd ofpeople who gathered by intersection Lateron nine people were arrested on charges of resisting arrest The protesterssaid that the police provoked the situation What do you think about it What ifthis situation makes us want to keep the police out of our neighborhood Whydo you think police shoots first and then asks questions Do you realize thatthe shooting came just ten days after St Louis was flooded with protesterswho were marking the anniversary of Michael Brown What if the city and thegovernment needs to center its attention on racism and discrimination inAmerica instead of suspecting every single black menWe cannot accept the fact that police can easily kill black people in Americathan we must do something about it Protest or accept it You choose This isyour life,100.0,https://www.facebook.com/Black-Matters-1579673598947501/,447.0,99.0,08/21/15 08:05:07 AM PDT,Black Matters  s                                      Black Matters,Baltimore Maryland Missouri Cleveland Ohio,Maryland Missouri Ohio,2015-08-21,Maryland
158,BREAKING NEWS St Louis police fatally shot a black teenager while tryingto issue search warrantOn Wednesday Augracial tensions again sparked in Missouri city afterSt Louis police officers fatally shot black teenager at Walton Avenue andPage Boulevard while trying to issue search warrant According to St LouisPolice Chief San Dotson a young black man pointed a gun at officers andwas trying to escape from a house where officers were carrying out a searchwarrant for him The yearold and yearold officers who shot thesuspect four times were about seven years on the forceThat was followed by crowd ofpeople who gathered by intersection Lateron nine people were arrested on charges of resisting arrest The protesterssaid that the police provoked the situation What do you think about it What ifthis situation makes us want to keep the police out of our neighborhood Whydo you think police shoots first and then asks questions Do you realize thatthe shooting came just ten days after St Louis was flooded with protesterswho were marking the anniversary of Michael Brown What if the city and thegovernment needs to center its attention on racism and discrimination inAmerica instead of suspecting every single black menWe cannot accept the fact that police can easily kill black people in Americathan we must do something about it Protest or accept it You choose This isyour life,100.0,https://www.facebook.com/Black-Matters-1579673598947501/,447.0,99.0,08/21/15 08:05:07 AM PDT,Black Matters  s                                      Black Matters,Baltimore Maryland Missouri Cleveland Ohio,Maryland Missouri Ohio,2015-08-21,Missouri
158,BREAKING NEWS St Louis police fatally shot a black teenager while tryingto issue search warrantOn Wednesday Augracial tensions again sparked in Missouri city afterSt Louis police officers fatally shot black teenager at Walton Avenue andPage Boulevard while trying to issue search warrant According to St LouisPolice Chief San Dotson a young black man pointed a gun at officers andwas trying to escape from a house where officers were carrying out a searchwarrant for him The yearold and yearold officers who shot thesuspect four times were about seven years on the forceThat was followed by crowd ofpeople who gathered by intersection Lateron nine people were arrested on charges of resisting arrest The protesterssaid that the police provoked the situation What do you think about it What ifthis situation makes us want to keep the police out of our neighborhood Whydo you think police shoots first and then asks questions Do you realize thatthe shooting came just ten days after St Louis was flooded with protesterswho were marking the anniversary of Michael Brown What if the city and thegovernment needs to center its attention on racism and discrimination inAmerica instead of suspecting every single black menWe cannot accept the fact that police can easily kill black people in Americathan we must do something about it Protest or accept it You choose This isyour life,100.0,https://www.facebook.com/Black-Matters-1579673598947501/,447.0,99.0,08/21/15 08:05:07 AM PDT,Black Matters  s                                      Black Matters,Baltimore Maryland Missouri Cleveland Ohio,Maryland Missouri Ohio,2015-08-21,Ohio
159,What is like driving while black in AmericaThroughout the twentyfirst century there are thousands of complaints of thepolice profiling black drivers in America Black Americans often complaintabout being pulled over for the phenomenon called driving while black Forexample a rich African American driving new Ferrari can be stoppedhundreds of times for no apparent reason just because the fact that a blackman driving an expensive car attract the attention of the police officersBut what if racial profiling ends with lethal consequences Do you rememberSandra Bland who had runins with the police while driving Do you allremember that she was found dead in police custody Do we all have toavoid traffic stops in order to surviveFor the matter of fact the routine traffic stops are being a big deal for thepeople of color According to the Justice Department statistics black driversare aboutpercent more likely to be subject to police than whites Overallthis number indicates the racial difference in America,100.0,https://www.facebook.com/Black-Matters-1579673598947501/,322.0,47.0,08/21/15 07:46:04 AM PDT,Black Matters  s                                      Black Matters,Baltimore Maryland Missouri Cleveland Ohio,Maryland Missouri Ohio,2015-08-21,Maryland
159,What is like driving while black in AmericaThroughout the twentyfirst century there are thousands of complaints of thepolice profiling black drivers in America Black Americans often complaintabout being pulled over for the phenomenon called driving while black Forexample a rich African American driving new Ferrari can be stoppedhundreds of times for no apparent reason just because the fact that a blackman driving an expensive car attract the attention of the police officersBut what if racial profiling ends with lethal consequences Do you rememberSandra Bland who had runins with the police while driving Do you allremember that she was found dead in police custody Do we all have toavoid traffic stops in order to surviveFor the matter of fact the routine traffic stops are being a big deal for thepeople of color According to the Justice Department statistics black driversare aboutpercent more likely to be subject to police than whites Overallthis number indicates the racial difference in America,100.0,https://www.facebook.com/Black-Matters-1579673598947501/,322.0,47.0,08/21/15 07:46:04 AM PDT,Black Matters  s                                      Black Matters,Baltimore Maryland Missouri Cleveland Ohio,Maryland Missouri Ohio,2015-08-21,Missouri
159,What is like driving while black in AmericaThroughout the twentyfirst century there are thousands of complaints of thepolice profiling black drivers in America Black Americans often complaintabout being pulled over for the phenomenon called driving while black Forexample a rich African American driving new Ferrari can be stoppedhundreds of times for no apparent reason just because the fact that a blackman driving an expensive car attract the attention of the police officersBut what if racial profiling ends with lethal consequences Do you rememberSandra Bland who had runins with the police while driving Do you allremember that she was found dead in police custody Do we all have toavoid traffic stops in order to surviveFor the matter of fact the routine traffic stops are being a big deal for thepeople of color According to the Justice Department statistics black driversare aboutpercent more likely to be subject to police than whites Overallthis number indicates the racial difference in America,100.0,https://www.facebook.com/Black-Matters-1579673598947501/,322.0,47.0,08/21/15 07:46:04 AM PDT,Black Matters  s                                      Black Matters,Baltimore Maryland Missouri Cleveland Ohio,Maryland Missouri Ohio,2015-08-21,Ohio
160,Silenced racism in AmericaTamir Rice Rumain Brisbon Kajieme Powel Dante Parker Michael BrownJohn Crawford III Eric Garner Jonathan Ferrell Kimani Gray Michael Brownand Sandra Bland are one of many examples of excessive police brutalityused on black AmericansYou never know if a simple traffic stop will end up with you in a police custodyor bullets in your chestUnfortunately many of Americans feel very uncomfortable talking about theseissues which seem to confirm the idea that the government remain silentNevertheless one should accept that AfricanAmericans are more likely to betargeted by police officers on the street than whites Therefore it endangersthe rights of black communityDoubtless when the government defends the officers who have killed blackmen it strikes us how unfair the system is and reaffirms our view that Americawould spend billions of dollars on radical extremists than talking about thedomestic terrorism racial inequality and police brutality,483.15,https://www.facebook.com/Black-Matters-1579673598947501/,3218.0,408.0,08/21/15 07:45:31 AM PDT,Black Matters  s                                      Black Matters,Baltimore Maryland Missouri Cleveland Ohio,Maryland Missouri Ohio,2015-08-21,Maryland
160,Silenced racism in AmericaTamir Rice Rumain Brisbon Kajieme Powel Dante Parker Michael BrownJohn Crawford III Eric Garner Jonathan Ferrell Kimani Gray Michael Brownand Sandra Bland are one of many examples of excessive police brutalityused on black AmericansYou never know if a simple traffic stop will end up with you in a police custodyor bullets in your chestUnfortunately many of Americans feel very uncomfortable talking about theseissues which seem to confirm the idea that the government remain silentNevertheless one should accept that AfricanAmericans are more likely to betargeted by police officers on the street than whites Therefore it endangersthe rights of black communityDoubtless when the government defends the officers who have killed blackmen it strikes us how unfair the system is and reaffirms our view that Americawould spend billions of dollars on radical extremists than talking about thedomestic terrorism racial inequality and police brutality,483.15,https://www.facebook.com/Black-Matters-1579673598947501/,3218.0,408.0,08/21/15 07:45:31 AM PDT,Black Matters  s                                      Black Matters,Baltimore Maryland Missouri Cleveland Ohio,Maryland Missouri Ohio,2015-08-21,Missouri
160,Silenced racism in AmericaTamir Rice Rumain Brisbon Kajieme Powel Dante Parker Michael BrownJohn Crawford III Eric Garner Jonathan Ferrell Kimani Gray Michael Brownand Sandra Bland are one of many examples of excessive police brutalityused on black AmericansYou never know if a simple traffic stop will end up with you in a police custodyor bullets in your chestUnfortunately many of Americans feel very uncomfortable talking about theseissues which seem to confirm the idea that the government remain silentNevertheless one should accept that AfricanAmericans are more likely to betargeted by police officers on the street than whites Therefore it endangersthe rights of black communityDoubtless when the government defends the officers who have killed blackmen it strikes us how unfair the system is and reaffirms our view that Americawould spend billions of dollars on radical extremists than talking about thedomestic terrorism racial inequality and police brutality,483.15,https://www.facebook.com/Black-Matters-1579673598947501/,3218.0,408.0,08/21/15 07:45:31 AM PDT,Black Matters  s                                      Black Matters,Baltimore Maryland Missouri Cleveland Ohio,Maryland Missouri Ohio,2015-08-21,Ohio
161,Black power is greater then you thought You just have to use it right Fight foryour civil rights use your power Civil Rights legislation is the most effectivestep towards eliminating unspoken by the government inequality in AmericaWhat if the civil rights movement generates social change What if the civilrights movement accelerates the process of the same opportunities,584.77,https://www.facebook.com/Black-Matters-1579673598947501/,1720.0,230.0,08/20/15 07:43:42 AM PDT,Black Matters  s                                      Black Matters,Baltimore Maryland Missouri Cleveland Ohio,Maryland Missouri Ohio,2015-08-20,Maryland
161,Black power is greater then you thought You just have to use it right Fight foryour civil rights use your power Civil Rights legislation is the most effectivestep towards eliminating unspoken by the government inequality in AmericaWhat if the civil rights movement generates social change What if the civilrights movement accelerates the process of the same opportunities,584.77,https://www.facebook.com/Black-Matters-1579673598947501/,1720.0,230.0,08/20/15 07:43:42 AM PDT,Black Matters  s                                      Black Matters,Baltimore Maryland Missouri Cleveland Ohio,Maryland Missouri Ohio,2015-08-20,Missouri
161,Black power is greater then you thought You just have to use it right Fight foryour civil rights use your power Civil Rights legislation is the most effectivestep towards eliminating unspoken by the government inequality in AmericaWhat if the civil rights movement generates social change What if the civilrights movement accelerates the process of the same opportunities,584.77,https://www.facebook.com/Black-Matters-1579673598947501/,1720.0,230.0,08/20/15 07:43:42 AM PDT,Black Matters  s                                      Black Matters,Baltimore Maryland Missouri Cleveland Ohio,Maryland Missouri Ohio,2015-08-20,Ohio
162,Confederate flags are permitted to fly at schools in TennesseeParents are worried about their childrens safetyYet here we are Tennessee parents are worried about their childrens safetyat the local school after discovering that anyone is permitted to wearConfederate flag attire and to fly the Confederate flags at school Thisprovoked widespread discontent among black parents of Rutherford CountyOne of the parents said that she witnessed the students wearing theConfederate flag Tshirt and the controversial flags flying in the backstudents carsHow would you feel if your child studies among those who like to fly theConfederate flags on their trucks How would you feel about the safety ofyour child Why children were permitted to openly display the Confederateflag on the school grounds What kind of symbol the Confederate flag is foryou Do you remember Dylann Roof who killed black people at church Doyou remember that he was promoting the Confederate flag What if your childstudies among the same people Is it an appropriate place for your kid tostudyIf Nazi flag was banned than the Confederate flag must be outlawed tooThus if the government continues to accept this flag it will bring more racistand hateful movements because the Confederate flag shows a lack ofempathy for African Americans slavery and for every black American man,0.0,https://www.facebook.com/Black-Matters-1579673598947501/,0.0,0.0,08/20/15 07:42:57 AM PDT,Black Matters  s                                      Black Matters,Baltimore Maryland Missouri Cleveland Ohio,Maryland Missouri Ohio,2015-08-20,Maryland
162,Confederate flags are permitted to fly at schools in TennesseeParents are worried about their childrens safetyYet here we are Tennessee parents are worried about their childrens safetyat the local school after discovering that anyone is permitted to wearConfederate flag attire and to fly the Confederate flags at school Thisprovoked widespread discontent among black parents of Rutherford CountyOne of the parents said that she witnessed the students wearing theConfederate flag Tshirt and the controversial flags flying in the backstudents carsHow would you feel if your child studies among those who like to fly theConfederate flags on their trucks How would you feel about the safety ofyour child Why children were permitted to openly display the Confederateflag on the school grounds What kind of symbol the Confederate flag is foryou Do you remember Dylann Roof who killed black people at church Doyou remember that he was promoting the Confederate flag What if your childstudies among the same people Is it an appropriate place for your kid tostudyIf Nazi flag was banned than the Confederate flag must be outlawed tooThus if the government continues to accept this flag it will bring more racistand hateful movements because the Confederate flag shows a lack ofempathy for African Americans slavery and for every black American man,0.0,https://www.facebook.com/Black-Matters-1579673598947501/,0.0,0.0,08/20/15 07:42:57 AM PDT,Black Matters  s                                      Black Matters,Baltimore Maryland Missouri Cleveland Ohio,Maryland Missouri Ohio,2015-08-20,Missouri
162,Confederate flags are permitted to fly at schools in TennesseeParents are worried about their childrens safetyYet here we are Tennessee parents are worried about their childrens safetyat the local school after discovering that anyone is permitted to wearConfederate flag attire and to fly the Confederate flags at school Thisprovoked widespread discontent among black parents of Rutherford CountyOne of the parents said that she witnessed the students wearing theConfederate flag Tshirt and the controversial flags flying in the backstudents carsHow would you feel if your child studies among those who like to fly theConfederate flags on their trucks How would you feel about the safety ofyour child Why children were permitted to openly display the Confederateflag on the school grounds What kind of symbol the Confederate flag is foryou Do you remember Dylann Roof who killed black people at church Doyou remember that he was promoting the Confederate flag What if your childstudies among the same people Is it an appropriate place for your kid tostudyIf Nazi flag was banned than the Confederate flag must be outlawed tooThus if the government continues to accept this flag it will bring more racistand hateful movements because the Confederate flag shows a lack ofempathy for African Americans slavery and for every black American man,0.0,https://www.facebook.com/Black-Matters-1579673598947501/,0.0,0.0,08/20/15 07:42:57 AM PDT,Black Matters  s                                      Black Matters,Baltimore Maryland Missouri Cleveland Ohio,Maryland Missouri Ohio,2015-08-20,Ohio
164,PowerDrunk Pig Threatens To Drag Teens Out Of CarPolice officer Jeff Willis is facing disciplinary action after a video surfaced ofhim violently threatening teenagers because they were smiling at him and nottaking him seriously enough Willis pulled them over because one of thepassengers allegedly flipped him the middle fighter from the windowWhen one of the young men asks the officer What did I do the officerresponds by saying I dont know I just dont like you I just dont like youThe only crime committed by the occupants of the car was shooting the videoWe have a legal right to film and photograph police in every state Peopleshould know their rightsits the first step to stop police brutalityIf another person smiling makes you that upset you should not be permittedto own a gun People who have mental illness or anger issues should nothaving access to guns Guns should be in the hands of responsible adultsPolice went out of the control How much respect do you think Police has forpeopleIn this way if you cant control yourself its time to retire you dontdeserve to carry the badgeAmerica needs better gun control Although its not the type of gun that is theproblem It is the type of gun owner that is the problem America control yourblue pigs,29.39,https://www.facebook.com/Black-Matters-1579673598947501/,149.0,37.0,08/25/15 07:58:45 AM PDT,,Baltimore Maryland Missouri Cleveland Ohio,Maryland Missouri Ohio,2015-08-25,Maryland
164,PowerDrunk Pig Threatens To Drag Teens Out Of CarPolice officer Jeff Willis is facing disciplinary action after a video surfaced ofhim violently threatening teenagers because they were smiling at him and nottaking him seriously enough Willis pulled them over because one of thepassengers allegedly flipped him the middle fighter from the windowWhen one of the young men asks the officer What did I do the officerresponds by saying I dont know I just dont like you I just dont like youThe only crime committed by the occupants of the car was shooting the videoWe have a legal right to film and photograph police in every state Peopleshould know their rightsits the first step to stop police brutalityIf another person smiling makes you that upset you should not be permittedto own a gun People who have mental illness or anger issues should nothaving access to guns Guns should be in the hands of responsible adultsPolice went out of the control How much respect do you think Police has forpeopleIn this way if you cant control yourself its time to retire you dontdeserve to carry the badgeAmerica needs better gun control Although its not the type of gun that is theproblem It is the type of gun owner that is the problem America control yourblue pigs,29.39,https://www.facebook.com/Black-Matters-1579673598947501/,149.0,37.0,08/25/15 07:58:45 AM PDT,,Baltimore Maryland Missouri Cleveland Ohio,Maryland Missouri Ohio,2015-08-25,Missouri
164,PowerDrunk Pig Threatens To Drag Teens Out Of CarPolice officer Jeff Willis is facing disciplinary action after a video surfaced ofhim violently threatening teenagers because they were smiling at him and nottaking him seriously enough Willis pulled them over because one of thepassengers allegedly flipped him the middle fighter from the windowWhen one of the young men asks the officer What did I do the officerresponds by saying I dont know I just dont like you I just dont like youThe only crime committed by the occupants of the car was shooting the videoWe have a legal right to film and photograph police in every state Peopleshould know their rightsits the first step to stop police brutalityIf another person smiling makes you that upset you should not be permittedto own a gun People who have mental illness or anger issues should nothaving access to guns Guns should be in the hands of responsible adultsPolice went out of the control How much respect do you think Police has forpeopleIn this way if you cant control yourself its time to retire you dontdeserve to carry the badgeAmerica needs better gun control Although its not the type of gun that is theproblem It is the type of gun owner that is the problem America control yourblue pigs,29.39,https://www.facebook.com/Black-Matters-1579673598947501/,149.0,37.0,08/25/15 07:58:45 AM PDT,,Baltimore Maryland Missouri Cleveland Ohio,Maryland Missouri Ohio,2015-08-25,Ohio
165,Love this sign because its true Whether killed or jailed too many Blackchildren lose their fathers because of corrupted system,246.39,https://www.facebook.com/Black-Matters-1579673598947501/,2543.0,309.0,08/24/15 08:27:46 AM PDT,Black Matters  s                                      Black Matters,Baltimore Maryland Missouri Cleveland Ohio,Maryland Missouri Ohio,2015-08-24,Maryland
165,Love this sign because its true Whether killed or jailed too many Blackchildren lose their fathers because of corrupted system,246.39,https://www.facebook.com/Black-Matters-1579673598947501/,2543.0,309.0,08/24/15 08:27:46 AM PDT,Black Matters  s                                      Black Matters,Baltimore Maryland Missouri Cleveland Ohio,Maryland Missouri Ohio,2015-08-24,Missouri
165,Love this sign because its true Whether killed or jailed too many Blackchildren lose their fathers because of corrupted system,246.39,https://www.facebook.com/Black-Matters-1579673598947501/,2543.0,309.0,08/24/15 08:27:46 AM PDT,Black Matters  s                                      Black Matters,Baltimore Maryland Missouri Cleveland Ohio,Maryland Missouri Ohio,2015-08-24,Ohio
166,Prominent Black Lives Matter activist Shaun King revealed to be whiteBlack Lives Matter activist Shaun King has claimed for years that he isbiracial being born to a white mother and a black father But recentlyuncovered records claim he misled the public about his race and that he is infact a white man pretending to be blackKings race would not be under scrutiny if it was not an essential componentof his career education and social status In addition to getting a fullridescholarship that is exclusively for black men King has the position of JusticeColumnist at progressive news website Daily Kos and enjoys astrong follower count on Twitter most of whom are a result of hisactivism following the death of Mike Brown in FergusonKings race would not be under scrutiny if it was not an essential componentof his career education and social status In addition to getting a fullridescholarship that is exclusively for black men King has the position of JusticeColumnist at progressive news website Daily Kos and enjoys astrong follower count on Twitter most of whom are a result of hisactivism following the death of Mike Brown in FergusonKing still did not directly answer the simple yes or no question about his ethnicbackground Are you black Instead he said If you have known me fromwhen I was in elementary school at Huntertown Elementary until now youveknown me as black or biracialTurning blackness into a performance is antiblacknessirrespective ofwhether the white person doing it is Rachel Dolezal or Shaun King,78.12,https://www.facebook.com/Black-Matters-1579673598947501/,323.0,47.0,08/24/15 08:27:21 AM PDT,Black Matters  s                                      Black Matters,Baltimore Maryland Missouri Cleveland Ohio,Maryland Missouri Ohio,2015-08-24,Maryland
166,Prominent Black Lives Matter activist Shaun King revealed to be whiteBlack Lives Matter activist Shaun King has claimed for years that he isbiracial being born to a white mother and a black father But recentlyuncovered records claim he misled the public about his race and that he is infact a white man pretending to be blackKings race would not be under scrutiny if it was not an essential componentof his career education and social status In addition to getting a fullridescholarship that is exclusively for black men King has the position of JusticeColumnist at progressive news website Daily Kos and enjoys astrong follower count on Twitter most of whom are a result of hisactivism following the death of Mike Brown in FergusonKings race would not be under scrutiny if it was not an essential componentof his career education and social status In addition to getting a fullridescholarship that is exclusively for black men King has the position of JusticeColumnist at progressive news website Daily Kos and enjoys astrong follower count on Twitter most of whom are a result of hisactivism following the death of Mike Brown in FergusonKing still did not directly answer the simple yes or no question about his ethnicbackground Are you black Instead he said If you have known me fromwhen I was in elementary school at Huntertown Elementary until now youveknown me as black or biracialTurning blackness into a performance is antiblacknessirrespective ofwhether the white person doing it is Rachel Dolezal or Shaun King,78.12,https://www.facebook.com/Black-Matters-1579673598947501/,323.0,47.0,08/24/15 08:27:21 AM PDT,Black Matters  s                                      Black Matters,Baltimore Maryland Missouri Cleveland Ohio,Maryland Missouri Ohio,2015-08-24,Missouri
166,Prominent Black Lives Matter activist Shaun King revealed to be whiteBlack Lives Matter activist Shaun King has claimed for years that he isbiracial being born to a white mother and a black father But recentlyuncovered records claim he misled the public about his race and that he is infact a white man pretending to be blackKings race would not be under scrutiny if it was not an essential componentof his career education and social status In addition to getting a fullridescholarship that is exclusively for black men King has the position of JusticeColumnist at progressive news website Daily Kos and enjoys astrong follower count on Twitter most of whom are a result of hisactivism following the death of Mike Brown in FergusonKings race would not be under scrutiny if it was not an essential componentof his career education and social status In addition to getting a fullridescholarship that is exclusively for black men King has the position of JusticeColumnist at progressive news website Daily Kos and enjoys astrong follower count on Twitter most of whom are a result of hisactivism following the death of Mike Brown in FergusonKing still did not directly answer the simple yes or no question about his ethnicbackground Are you black Instead he said If you have known me fromwhen I was in elementary school at Huntertown Elementary until now youveknown me as black or biracialTurning blackness into a performance is antiblacknessirrespective ofwhether the white person doing it is Rachel Dolezal or Shaun King,78.12,https://www.facebook.com/Black-Matters-1579673598947501/,323.0,47.0,08/24/15 08:27:21 AM PDT,Black Matters  s                                      Black Matters,Baltimore Maryland Missouri Cleveland Ohio,Maryland Missouri Ohio,2015-08-24,Ohio
167,We do not want to fit into racist negative stereotypes that America has placeon us We are so tired of the government and media putting out the falseimages of black Americans Why blacks are portrayed as brutal andaggressive Can we stop it somehow,495.92,https://www.facebook.com/Black-Matters-1579673598947501/,4386.0,468.0,09/01/15 07:38:20 AM PDT,,Baltimore Maryland Missouri Cleveland Ohio,Maryland Missouri Ohio,2015-09-01,Maryland
167,We do not want to fit into racist negative stereotypes that America has placeon us We are so tired of the government and media putting out the falseimages of black Americans Why blacks are portrayed as brutal andaggressive Can we stop it somehow,495.92,https://www.facebook.com/Black-Matters-1579673598947501/,4386.0,468.0,09/01/15 07:38:20 AM PDT,,Baltimore Maryland Missouri Cleveland Ohio,Maryland Missouri Ohio,2015-09-01,Missouri
167,We do not want to fit into racist negative stereotypes that America has placeon us We are so tired of the government and media putting out the falseimages of black Americans Why blacks are portrayed as brutal andaggressive Can we stop it somehow,495.92,https://www.facebook.com/Black-Matters-1579673598947501/,4386.0,468.0,09/01/15 07:38:20 AM PDT,,Baltimore Maryland Missouri Cleveland Ohio,Maryland Missouri Ohio,2015-09-01,Ohio
168,This is enough police officers No more Eric GartnersMore than twenty protesters organized by the Mass Action Against PoliceBrutality group are calling for a further investigation into videotaped incidentthat took place in Washington Street in Roslindale Nearly threeminutevideotape posted to Youtube shows Boston Police officer earlier this monthchoking an yearold Elvin Vargas and attempting to put him in a cruiserafter he was arrested on AugustHave you noticed than excessive force by police is disproportionate on peopleof color When the government law enforcement the criminal justice systemwill treat all communities with dignity How long should we complain aboutthreats against our lives As the ability to record police activity has becomemore widespread can we achieve justice,124.29,https://www.facebook.com/Black-Matters-1579673598947501/,728.0,81.0,09/01/15 07:37:52 AM PDT,,Baltimore Maryland Missouri Cleveland Ohio,Maryland Missouri Ohio,2015-09-01,Maryland
168,This is enough police officers No more Eric GartnersMore than twenty protesters organized by the Mass Action Against PoliceBrutality group are calling for a further investigation into videotaped incidentthat took place in Washington Street in Roslindale Nearly threeminutevideotape posted to Youtube shows Boston Police officer earlier this monthchoking an yearold Elvin Vargas and attempting to put him in a cruiserafter he was arrested on AugustHave you noticed than excessive force by police is disproportionate on peopleof color When the government law enforcement the criminal justice systemwill treat all communities with dignity How long should we complain aboutthreats against our lives As the ability to record police activity has becomemore widespread can we achieve justice,124.29,https://www.facebook.com/Black-Matters-1579673598947501/,728.0,81.0,09/01/15 07:37:52 AM PDT,,Baltimore Maryland Missouri Cleveland Ohio,Maryland Missouri Ohio,2015-09-01,Missouri
168,This is enough police officers No more Eric GartnersMore than twenty protesters organized by the Mass Action Against PoliceBrutality group are calling for a further investigation into videotaped incidentthat took place in Washington Street in Roslindale Nearly threeminutevideotape posted to Youtube shows Boston Police officer earlier this monthchoking an yearold Elvin Vargas and attempting to put him in a cruiserafter he was arrested on AugustHave you noticed than excessive force by police is disproportionate on peopleof color When the government law enforcement the criminal justice systemwill treat all communities with dignity How long should we complain aboutthreats against our lives As the ability to record police activity has becomemore widespread can we achieve justice,124.29,https://www.facebook.com/Black-Matters-1579673598947501/,728.0,81.0,09/01/15 07:37:52 AM PDT,,Baltimore Maryland Missouri Cleveland Ohio,Maryland Missouri Ohio,2015-09-01,Ohio
169,Jamycheal Mitchell Mentally III Criminalized and Killed by the SystemStories like the one of Jamycheal Mitchell the yearold young man whowas found dead in his jail cell on Augustare particularly hard to hearWhat the police ruled natural causes turned out to be that he starved todeath The crime Shoplifting Mitchell who had a severe mental illness hadbeen ruled permanently disabled and was unable to work In April he stole azebra cake a Snickers and Mountain Dew from a localin PortsmouthVirginia It would be a month before he ever went before a judgeA judge then ruled him incompetent to stand trial He should have beentransported to a local mental health facility but he wasnt Apparently therewasnt one that had room for him Three months later he was found dead inhis cell No meds had ever been administered He had never made it to amental health facility He had lost nearlypounds because he refused toeat All for less thanworth of snacks he stole while in a mental healthcrisisYes you can die overdollars here in America Nothing new here Justice isjust an empty word in this country Be sure you will never know the truth Weare far away from the truth,269.69,https://www.facebook.com/Black-Matters-1579673598947501/,1209.0,135.0,09/09/15 08:07:30 AM PDT,Black Matters  s                                      Black Matters,Baltimore Maryland Missouri Cleveland Ohio,Maryland Missouri Ohio,2015-09-09,Maryland
169,Jamycheal Mitchell Mentally III Criminalized and Killed by the SystemStories like the one of Jamycheal Mitchell the yearold young man whowas found dead in his jail cell on Augustare particularly hard to hearWhat the police ruled natural causes turned out to be that he starved todeath The crime Shoplifting Mitchell who had a severe mental illness hadbeen ruled permanently disabled and was unable to work In April he stole azebra cake a Snickers and Mountain Dew from a localin PortsmouthVirginia It would be a month before he ever went before a judgeA judge then ruled him incompetent to stand trial He should have beentransported to a local mental health facility but he wasnt Apparently therewasnt one that had room for him Three months later he was found dead inhis cell No meds had ever been administered He had never made it to amental health facility He had lost nearlypounds because he refused toeat All for less thanworth of snacks he stole while in a mental healthcrisisYes you can die overdollars here in America Nothing new here Justice isjust an empty word in this country Be sure you will never know the truth Weare far away from the truth,269.69,https://www.facebook.com/Black-Matters-1579673598947501/,1209.0,135.0,09/09/15 08:07:30 AM PDT,Black Matters  s                                      Black Matters,Baltimore Maryland Missouri Cleveland Ohio,Maryland Missouri Ohio,2015-09-09,Missouri
169,Jamycheal Mitchell Mentally III Criminalized and Killed by the SystemStories like the one of Jamycheal Mitchell the yearold young man whowas found dead in his jail cell on Augustare particularly hard to hearWhat the police ruled natural causes turned out to be that he starved todeath The crime Shoplifting Mitchell who had a severe mental illness hadbeen ruled permanently disabled and was unable to work In April he stole azebra cake a Snickers and Mountain Dew from a localin PortsmouthVirginia It would be a month before he ever went before a judgeA judge then ruled him incompetent to stand trial He should have beentransported to a local mental health facility but he wasnt Apparently therewasnt one that had room for him Three months later he was found dead inhis cell No meds had ever been administered He had never made it to amental health facility He had lost nearlypounds because he refused toeat All for less thanworth of snacks he stole while in a mental healthcrisisYes you can die overdollars here in America Nothing new here Justice isjust an empty word in this country Be sure you will never know the truth Weare far away from the truth,269.69,https://www.facebook.com/Black-Matters-1579673598947501/,1209.0,135.0,09/09/15 08:07:30 AM PDT,Black Matters  s                                      Black Matters,Baltimore Maryland Missouri Cleveland Ohio,Maryland Missouri Ohio,2015-09-09,Ohio
170,All lives matter All lives mattered during slavery too All lives mattered duringsegregation too All lives mattered during apartheid too All lives alwaysmatter But there are situations where some lives are focused more on duringthat time Not because they matter MORE but because theyre not put on anequal playing field not treated the same way and are treated like theyrelessmatter less,7.74,https://www.facebook.com/Black-Matters-1579673598947501/,56.0,8.0,09/09/15 08:06:58 AM PDT,Black Matters  s                                      Black Matters,Baltimore Maryland Missouri Cleveland Ohio,Maryland Missouri Ohio,2015-09-09,Maryland
170,All lives matter All lives mattered during slavery too All lives mattered duringsegregation too All lives mattered during apartheid too All lives alwaysmatter But there are situations where some lives are focused more on duringthat time Not because they matter MORE but because theyre not put on anequal playing field not treated the same way and are treated like theyrelessmatter less,7.74,https://www.facebook.com/Black-Matters-1579673598947501/,56.0,8.0,09/09/15 08:06:58 AM PDT,Black Matters  s                                      Black Matters,Baltimore Maryland Missouri Cleveland Ohio,Maryland Missouri Ohio,2015-09-09,Missouri
170,All lives matter All lives mattered during slavery too All lives mattered duringsegregation too All lives mattered during apartheid too All lives alwaysmatter But there are situations where some lives are focused more on duringthat time Not because they matter MORE but because theyre not put on anequal playing field not treated the same way and are treated like theyrelessmatter less,7.74,https://www.facebook.com/Black-Matters-1579673598947501/,56.0,8.0,09/09/15 08:06:58 AM PDT,Black Matters  s                                      Black Matters,Baltimore Maryland Missouri Cleveland Ohio,Maryland Missouri Ohio,2015-09-09,Ohio
171,The real enemy is around us Watch out,11.01,https://www.facebook.com/Black-Matters-1579673598947501/,53.0,12.0,09/09/15 08:06:26 AM PDT,Black Matters  s                                      Black Matters,Baltimore Maryland Missouri Cleveland Ohio,Maryland Missouri Ohio,2015-09-09,Maryland
171,The real enemy is around us Watch out,11.01,https://www.facebook.com/Black-Matters-1579673598947501/,53.0,12.0,09/09/15 08:06:26 AM PDT,Black Matters  s                                      Black Matters,Baltimore Maryland Missouri Cleveland Ohio,Maryland Missouri Ohio,2015-09-09,Missouri
171,The real enemy is around us Watch out,11.01,https://www.facebook.com/Black-Matters-1579673598947501/,53.0,12.0,09/09/15 08:06:26 AM PDT,Black Matters  s                                      Black Matters,Baltimore Maryland Missouri Cleveland Ohio,Maryland Missouri Ohio,2015-09-09,Ohio
172,Because They Lack Crucial Training These Cops Severely Beat a BlindAutistic Teen UnconsciousDuring the incident Abramssuffered two seizures after police used forceagainst him at the Green Lines Lexington Parkway StationThe teen suffers from Aspergers syndrome which causes him to stronglydislike being touched or having people in his person space and is consideredlegally blind wearing extremely magnified glassesOfficers thought the noncompliance of Abrams was reason enough to justifyforcibly taking him down which resulted in him being battered and leftunconsciousAbrams noncompliance wasnt done out of malice but out of not reallyunderstanding the situation and believing he hadnt done anything wrongAbrams autism makes it extremely difficult for him to interpret the intentionsor feelings of others according to his mother Police released the teen to thecustody of his mother rather than take him to the juvenile detention facilityPolice are trained to think like the military in combat which means theyprioritize their own safety and the safety of fellow officers over everythingelse including that of the citizens they allegedly protect and serve,143.57,https://www.facebook.com/Black-Matters-1579673598947501/,766.0,91.0,09/09/15 08:05:55 AM PDT,Black Matters  s                                      Black Matters,Baltimore Maryland Missouri Cleveland Ohio,Maryland Missouri Ohio,2015-09-09,Maryland
172,Because They Lack Crucial Training These Cops Severely Beat a BlindAutistic Teen UnconsciousDuring the incident Abramssuffered two seizures after police used forceagainst him at the Green Lines Lexington Parkway StationThe teen suffers from Aspergers syndrome which causes him to stronglydislike being touched or having people in his person space and is consideredlegally blind wearing extremely magnified glassesOfficers thought the noncompliance of Abrams was reason enough to justifyforcibly taking him down which resulted in him being battered and leftunconsciousAbrams noncompliance wasnt done out of malice but out of not reallyunderstanding the situation and believing he hadnt done anything wrongAbrams autism makes it extremely difficult for him to interpret the intentionsor feelings of others according to his mother Police released the teen to thecustody of his mother rather than take him to the juvenile detention facilityPolice are trained to think like the military in combat which means theyprioritize their own safety and the safety of fellow officers over everythingelse including that of the citizens they allegedly protect and serve,143.57,https://www.facebook.com/Black-Matters-1579673598947501/,766.0,91.0,09/09/15 08:05:55 AM PDT,Black Matters  s                                      Black Matters,Baltimore Maryland Missouri Cleveland Ohio,Maryland Missouri Ohio,2015-09-09,Missouri
172,Because They Lack Crucial Training These Cops Severely Beat a BlindAutistic Teen UnconsciousDuring the incident Abramssuffered two seizures after police used forceagainst him at the Green Lines Lexington Parkway StationThe teen suffers from Aspergers syndrome which causes him to stronglydislike being touched or having people in his person space and is consideredlegally blind wearing extremely magnified glassesOfficers thought the noncompliance of Abrams was reason enough to justifyforcibly taking him down which resulted in him being battered and leftunconsciousAbrams noncompliance wasnt done out of malice but out of not reallyunderstanding the situation and believing he hadnt done anything wrongAbrams autism makes it extremely difficult for him to interpret the intentionsor feelings of others according to his mother Police released the teen to thecustody of his mother rather than take him to the juvenile detention facilityPolice are trained to think like the military in combat which means theyprioritize their own safety and the safety of fellow officers over everythingelse including that of the citizens they allegedly protect and serve,143.57,https://www.facebook.com/Black-Matters-1579673598947501/,766.0,91.0,09/09/15 08:05:55 AM PDT,Black Matters  s                                      Black Matters,Baltimore Maryland Missouri Cleveland Ohio,Maryland Missouri Ohio,2015-09-09,Ohio
173,Think about this for a second My house is on fire with my entire family insideI make it out and scream for help My neighbor grabs the water hose andsprays his house which isnt on fire Then tells me all houses matter,217.15,https://www.facebook.com/Black-Matters-1579673598947501/,929.0,86.0,09/09/15 08:05:34 AM PDT,Black Matters  s                                      Black Matters,Baltimore Maryland Missouri Cleveland Ohio,Maryland Missouri Ohio,2015-09-09,Maryland
173,Think about this for a second My house is on fire with my entire family insideI make it out and scream for help My neighbor grabs the water hose andsprays his house which isnt on fire Then tells me all houses matter,217.15,https://www.facebook.com/Black-Matters-1579673598947501/,929.0,86.0,09/09/15 08:05:34 AM PDT,Black Matters  s                                      Black Matters,Baltimore Maryland Missouri Cleveland Ohio,Maryland Missouri Ohio,2015-09-09,Missouri
173,Think about this for a second My house is on fire with my entire family insideI make it out and scream for help My neighbor grabs the water hose andsprays his house which isnt on fire Then tells me all houses matter,217.15,https://www.facebook.com/Black-Matters-1579673598947501/,929.0,86.0,09/09/15 08:05:34 AM PDT,Black Matters  s                                      Black Matters,Baltimore Maryland Missouri Cleveland Ohio,Maryland Missouri Ohio,2015-09-09,Ohio
174,Innocent Bystanders Could Face Criminal Charges for Not Jumping in to HelpOfficer Make ArrestResidents of Huntsville Alabama who declined to intervene to help a policeofficer subdue a suspect could face criminal prosecution under a state statuterequiring them to assist an officer in trouble Had the situation been reversedhowever police officers would face neither criminal nor civil prosecution fordeclining to aid a citizen under assault by a suspectA man named Devonte Conerly who was suspected in a hit and run incidentallegedly tried to disarm the police officer who stopped him Several officersresponded to a call for assistance and eventually subdued and handcuffedConerly They then rebuked several bystanders who had declined tointerveneBystanders are not liable to prosecution if the failure to render aid wasreasonable under the circumstances but the burden of demonstrating thatthis is the case is placed upon the accusedWhen youll see a bunch of cops beating an unarmed man dont forget thatyou can be in his place just for not helping cops in committing a crime,294.06,https://www.facebook.com/Black-Matters-1 579673598947501/,759.0,91.0,09/09/15 08:05:05 AM PDT,Black Matters  s                                      Black Matters,Baltimore Maryland Missouri Cleveland Ohio,Maryland Missouri Ohio,2015-09-09,Maryland
174,Innocent Bystanders Could Face Criminal Charges for Not Jumping in to HelpOfficer Make ArrestResidents of Huntsville Alabama who declined to intervene to help a policeofficer subdue a suspect could face criminal prosecution under a state statuterequiring them to assist an officer in trouble Had the situation been reversedhowever police officers would face neither criminal nor civil prosecution fordeclining to aid a citizen under assault by a suspectA man named Devonte Conerly who was suspected in a hit and run incidentallegedly tried to disarm the police officer who stopped him Several officersresponded to a call for assistance and eventually subdued and handcuffedConerly They then rebuked several bystanders who had declined tointerveneBystanders are not liable to prosecution if the failure to render aid wasreasonable under the circumstances but the burden of demonstrating thatthis is the case is placed upon the accusedWhen youll see a bunch of cops beating an unarmed man dont forget thatyou can be in his place just for not helping cops in committing a crime,294.06,https://www.facebook.com/Black-Matters-1 579673598947501/,759.0,91.0,09/09/15 08:05:05 AM PDT,Black Matters  s                                      Black Matters,Baltimore Maryland Missouri Cleveland Ohio,Maryland Missouri Ohio,2015-09-09,Missouri
174,Innocent Bystanders Could Face Criminal Charges for Not Jumping in to HelpOfficer Make ArrestResidents of Huntsville Alabama who declined to intervene to help a policeofficer subdue a suspect could face criminal prosecution under a state statuterequiring them to assist an officer in trouble Had the situation been reversedhowever police officers would face neither criminal nor civil prosecution fordeclining to aid a citizen under assault by a suspectA man named Devonte Conerly who was suspected in a hit and run incidentallegedly tried to disarm the police officer who stopped him Several officersresponded to a call for assistance and eventually subdued and handcuffedConerly They then rebuked several bystanders who had declined tointerveneBystanders are not liable to prosecution if the failure to render aid wasreasonable under the circumstances but the burden of demonstrating thatthis is the case is placed upon the accusedWhen youll see a bunch of cops beating an unarmed man dont forget thatyou can be in his place just for not helping cops in committing a crime,294.06,https://www.facebook.com/Black-Matters-1 579673598947501/,759.0,91.0,09/09/15 08:05:05 AM PDT,Black Matters  s                                      Black Matters,Baltimore Maryland Missouri Cleveland Ohio,Maryland Missouri Ohio,2015-09-09,Ohio
175,Racism is still a stumbling block between black and white Americans,294.63,https://www.facebook.com/Black-Matters-1579673598947501/,922.0,119.0,09/09/15 08:04:38 AM PDT,Black Matters  s                                      Black Matters,Baltimore Maryland Missouri Cleveland Ohio,Maryland Missouri Ohio,2015-09-09,Maryland
175,Racism is still a stumbling block between black and white Americans,294.63,https://www.facebook.com/Black-Matters-1579673598947501/,922.0,119.0,09/09/15 08:04:38 AM PDT,Black Matters  s                                      Black Matters,Baltimore Maryland Missouri Cleveland Ohio,Maryland Missouri Ohio,2015-09-09,Missouri
175,Racism is still a stumbling block between black and white Americans,294.63,https://www.facebook.com/Black-Matters-1579673598947501/,922.0,119.0,09/09/15 08:04:38 AM PDT,Black Matters  s                                      Black Matters,Baltimore Maryland Missouri Cleveland Ohio,Maryland Missouri Ohio,2015-09-09,Ohio
176,We wont apologize for our blackness Its not our duty to do that Black isbeautiful Beautiful is forever and it makes us to be proud We will carry it withus everywhere and forever We dont care if the government doesnt want toaccept the fact that we are stronger than we were before We dont care if thegovernment doesnt see our problems We can build our history on our ownbecause we are stronger by nature,287.16,https://www.facebook.com/Black-Matters-1579673598947501/,89.0,7.0,09/09/15 08:04:12 AM PDT,Black Matters  s                                      Black Matters,Baltimore Maryland Missouri Cleveland Ohio,Maryland Missouri Ohio,2015-09-09,Maryland
176,We wont apologize for our blackness Its not our duty to do that Black isbeautiful Beautiful is forever and it makes us to be proud We will carry it withus everywhere and forever We dont care if the government doesnt want toaccept the fact that we are stronger than we were before We dont care if thegovernment doesnt see our problems We can build our history on our ownbecause we are stronger by nature,287.16,https://www.facebook.com/Black-Matters-1579673598947501/,89.0,7.0,09/09/15 08:04:12 AM PDT,Black Matters  s                                      Black Matters,Baltimore Maryland Missouri Cleveland Ohio,Maryland Missouri Ohio,2015-09-09,Missouri
176,We wont apologize for our blackness Its not our duty to do that Black isbeautiful Beautiful is forever and it makes us to be proud We will carry it withus everywhere and forever We dont care if the government doesnt want toaccept the fact that we are stronger than we were before We dont care if thegovernment doesnt see our problems We can build our history on our ownbecause we are stronger by nature,287.16,https://www.facebook.com/Black-Matters-1579673598947501/,89.0,7.0,09/09/15 08:04:12 AM PDT,Black Matters  s                                      Black Matters,Baltimore Maryland Missouri Cleveland Ohio,Maryland Missouri Ohio,2015-09-09,Ohio
177,Know your rights and your freedomThe murders of Michael Brown Tryvon Martin Freddie Gray Eric Gartnerand other black victims have dramatized depth of racism in America societyThey were young and Black that was enough for police officers to decide thatthey looked suspicious The police brutality has sparked the movement andhas emerged to demand justice and political attention However the everydayracism we see was not understood but ignored Moreover the governmentalong with the law enforcement violate our rights through the illegal use offorce and mass arrests in order to obstruct our free expressionYes standing up for your right to protest for the equality and justice ischallenging but its worth discrimination and unfairness black civilians faceeveryday Remember knowing your rights can be the most powerful weaponyou have against police abuse and brutalityThe most famous civil rights activists represent a basic philosophy known fortheir fight against injustice and lasting profound impact in the lives of AfricanAmericans Martin Luther King Jr Malcolm X Mary McLeod Bethune RosaParks changed our lives foreverBut what changes have you made Have you contributed to a greaterequality What are you doing to fight against injustice and racism Have youever protested in civil rights protests or have you ever been part of BlackLives Matter movement How do your protect your right to free expressionPlease comment below what have YOU done to prove BLACK LIVESMATTER,2.59,https://www.facebook.com/Black-Matters-1579673598947501/,17.0,0.0,09/23/15 02:52:24 AM PDT,Black Matters  s                                      Black Matters,Baltimore Maryland Missouri Cleveland Ohio,Maryland Missouri Ohio,2015-09-23,Maryland
177,Know your rights and your freedomThe murders of Michael Brown Tryvon Martin Freddie Gray Eric Gartnerand other black victims have dramatized depth of racism in America societyThey were young and Black that was enough for police officers to decide thatthey looked suspicious The police brutality has sparked the movement andhas emerged to demand justice and political attention However the everydayracism we see was not understood but ignored Moreover the governmentalong with the law enforcement violate our rights through the illegal use offorce and mass arrests in order to obstruct our free expressionYes standing up for your right to protest for the equality and justice ischallenging but its worth discrimination and unfairness black civilians faceeveryday Remember knowing your rights can be the most powerful weaponyou have against police abuse and brutalityThe most famous civil rights activists represent a basic philosophy known fortheir fight against injustice and lasting profound impact in the lives of AfricanAmericans Martin Luther King Jr Malcolm X Mary McLeod Bethune RosaParks changed our lives foreverBut what changes have you made Have you contributed to a greaterequality What are you doing to fight against injustice and racism Have youever protested in civil rights protests or have you ever been part of BlackLives Matter movement How do your protect your right to free expressionPlease comment below what have YOU done to prove BLACK LIVESMATTER,2.59,https://www.facebook.com/Black-Matters-1579673598947501/,17.0,0.0,09/23/15 02:52:24 AM PDT,Black Matters  s                                      Black Matters,Baltimore Maryland Missouri Cleveland Ohio,Maryland Missouri Ohio,2015-09-23,Missouri
177,Know your rights and your freedomThe murders of Michael Brown Tryvon Martin Freddie Gray Eric Gartnerand other black victims have dramatized depth of racism in America societyThey were young and Black that was enough for police officers to decide thatthey looked suspicious The police brutality has sparked the movement andhas emerged to demand justice and political attention However the everydayracism we see was not understood but ignored Moreover the governmentalong with the law enforcement violate our rights through the illegal use offorce and mass arrests in order to obstruct our free expressionYes standing up for your right to protest for the equality and justice ischallenging but its worth discrimination and unfairness black civilians faceeveryday Remember knowing your rights can be the most powerful weaponyou have against police abuse and brutalityThe most famous civil rights activists represent a basic philosophy known fortheir fight against injustice and lasting profound impact in the lives of AfricanAmericans Martin Luther King Jr Malcolm X Mary McLeod Bethune RosaParks changed our lives foreverBut what changes have you made Have you contributed to a greaterequality What are you doing to fight against injustice and racism Have youever protested in civil rights protests or have you ever been part of BlackLives Matter movement How do your protect your right to free expressionPlease comment below what have YOU done to prove BLACK LIVESMATTER,2.59,https://www.facebook.com/Black-Matters-1579673598947501/,17.0,0.0,09/23/15 02:52:24 AM PDT,Black Matters  s                                      Black Matters,Baltimore Maryland Missouri Cleveland Ohio,Maryland Missouri Ohio,2015-09-23,Ohio
178,What progress have we made towards eliminating racial profiling Who istrying to damage the stereotypes of African Americans How many black menhave died for minor crimes at the hands of the police officers,800.0,https://www.facebook.com/Black-Matters-1 579673598947501/,7341.0,541.0,10/09/15 07:01:29 AM PDT,Black Matters  s                                      Black Matters,Baltimore Maryland Missouri Cleveland Ohio,Maryland Missouri Ohio,2015-10-09,Maryland
178,What progress have we made towards eliminating racial profiling Who istrying to damage the stereotypes of African Americans How many black menhave died for minor crimes at the hands of the police officers,800.0,https://www.facebook.com/Black-Matters-1 579673598947501/,7341.0,541.0,10/09/15 07:01:29 AM PDT,Black Matters  s                                      Black Matters,Baltimore Maryland Missouri Cleveland Ohio,Maryland Missouri Ohio,2015-10-09,Missouri
178,What progress have we made towards eliminating racial profiling Who istrying to damage the stereotypes of African Americans How many black menhave died for minor crimes at the hands of the police officers,800.0,https://www.facebook.com/Black-Matters-1 579673598947501/,7341.0,541.0,10/09/15 07:01:29 AM PDT,Black Matters  s                                      Black Matters,Baltimore Maryland Missouri Cleveland Ohio,Maryland Missouri Ohio,2015-10-09,Ohio
179,WEAR BLACK FIGHT BACK CHALLENGE FOR OUR SUBSCRIBERSOctober nd is one of the most important days for all of us Fromonward people around the country have mobilized for a National Day ofProtest to stop police brutality repression and the criminalization of agenerationThe powerful National Day of Protest will be brought in cities and towns allacross the country Lets make history together Its time to stand up for ourrights and our freedomOur community has a challenge for you guys All you need to do iswear blacktake a picture of yourself during or right beforeafter this eventsend it to us Simple as thatWe will post all the pictures on our page so that the whole African Americancommunity will know about you and your effortsIts really important for us to know were united Its important for us to knowwe care about our futureBlack Matters will appreciate your efforts tooCheck the official website to find an event in your area,2998.22,https://www.facebook.com/blackmattersus/,11134.0,1016.0,10/21/15 07:59:43 AM PDT,Black Matters  s                                      Black Matters,Baltimore Maryland Missouri Cleveland Ohio,Maryland Missouri Ohio,2015-10-21,Maryland
179,WEAR BLACK FIGHT BACK CHALLENGE FOR OUR SUBSCRIBERSOctober nd is one of the most important days for all of us Fromonward people around the country have mobilized for a National Day ofProtest to stop police brutality repression and the criminalization of agenerationThe powerful National Day of Protest will be brought in cities and towns allacross the country Lets make history together Its time to stand up for ourrights and our freedomOur community has a challenge for you guys All you need to do iswear blacktake a picture of yourself during or right beforeafter this eventsend it to us Simple as thatWe will post all the pictures on our page so that the whole African Americancommunity will know about you and your effortsIts really important for us to know were united Its important for us to knowwe care about our futureBlack Matters will appreciate your efforts tooCheck the official website to find an event in your area,2998.22,https://www.facebook.com/blackmattersus/,11134.0,1016.0,10/21/15 07:59:43 AM PDT,Black Matters  s                                      Black Matters,Baltimore Maryland Missouri Cleveland Ohio,Maryland Missouri Ohio,2015-10-21,Missouri
179,WEAR BLACK FIGHT BACK CHALLENGE FOR OUR SUBSCRIBERSOctober nd is one of the most important days for all of us Fromonward people around the country have mobilized for a National Day ofProtest to stop police brutality repression and the criminalization of agenerationThe powerful National Day of Protest will be brought in cities and towns allacross the country Lets make history together Its time to stand up for ourrights and our freedomOur community has a challenge for you guys All you need to do iswear blacktake a picture of yourself during or right beforeafter this eventsend it to us Simple as thatWe will post all the pictures on our page so that the whole African Americancommunity will know about you and your effortsIts really important for us to know were united Its important for us to knowwe care about our futureBlack Matters will appreciate your efforts tooCheck the official website to find an event in your area,2998.22,https://www.facebook.com/blackmattersus/,11134.0,1016.0,10/21/15 07:59:43 AM PDT,Black Matters  s                                      Black Matters,Baltimore Maryland Missouri Cleveland Ohio,Maryland Missouri Ohio,2015-10-21,Ohio
180,Help us spread their shame Anonymous unhoods the KKK prominentpoliticiansUS Senators Thom Tillis RNC John Cornyn RTx Dan CoatsRInand Johnny Isakson RGaUS mayors Madeline Rogero of Knoxville Tennessee Jim Gray of LexingtonKentucky Paul D Fraim of Norfolk Virginia Kent Guinn of Ocala Floridaand Tom Henry of Fort Wayne IndianaAs long as there are the KKK members in the government racism in thecountry will prosper They should resignIf you want to stop this madness take a minute to sign the petitionaushouseofrepresentativesussenatelistthekukluxklanasanofficialterroristorganizationWe need aroundsigns to reachThe KKK should be labeled asa terrorist groupShare this with your friends and ask them to sign the petitionYour efforts will be appreciated Its time to make a change,3000.0,https://www.facebook.com/blackmattersus/,22670.0,1781.0,11/06/15 06:50:26 AM PST,Black Matters  s                                      Black Matters,Baltimore Maryland Missouri Cleveland Ohio,Maryland Missouri Ohio,2015-11-06,Maryland
180,Help us spread their shame Anonymous unhoods the KKK prominentpoliticiansUS Senators Thom Tillis RNC John Cornyn RTx Dan CoatsRInand Johnny Isakson RGaUS mayors Madeline Rogero of Knoxville Tennessee Jim Gray of LexingtonKentucky Paul D Fraim of Norfolk Virginia Kent Guinn of Ocala Floridaand Tom Henry of Fort Wayne IndianaAs long as there are the KKK members in the government racism in thecountry will prosper They should resignIf you want to stop this madness take a minute to sign the petitionaushouseofrepresentativesussenatelistthekukluxklanasanofficialterroristorganizationWe need aroundsigns to reachThe KKK should be labeled asa terrorist groupShare this with your friends and ask them to sign the petitionYour efforts will be appreciated Its time to make a change,3000.0,https://www.facebook.com/blackmattersus/,22670.0,1781.0,11/06/15 06:50:26 AM PST,Black Matters  s                                      Black Matters,Baltimore Maryland Missouri Cleveland Ohio,Maryland Missouri Ohio,2015-11-06,Missouri
180,Help us spread their shame Anonymous unhoods the KKK prominentpoliticiansUS Senators Thom Tillis RNC John Cornyn RTx Dan CoatsRInand Johnny Isakson RGaUS mayors Madeline Rogero of Knoxville Tennessee Jim Gray of LexingtonKentucky Paul D Fraim of Norfolk Virginia Kent Guinn of Ocala Floridaand Tom Henry of Fort Wayne IndianaAs long as there are the KKK members in the government racism in thecountry will prosper They should resignIf you want to stop this madness take a minute to sign the petitionaushouseofrepresentativesussenatelistthekukluxklanasanofficialterroristorganizationWe need aroundsigns to reachThe KKK should be labeled asa terrorist groupShare this with your friends and ask them to sign the petitionYour efforts will be appreciated Its time to make a change,3000.0,https://www.facebook.com/blackmattersus/,22670.0,1781.0,11/06/15 06:50:26 AM PST,Black Matters  s                                      Black Matters,Baltimore Maryland Missouri Cleveland Ohio,Maryland Missouri Ohio,2015-11-06,Ohio
182,Theill attract the UNs attention to the long terminjustice and cruelty against people of color in the United States Thegenocide instituted by white supremacists should be stoppedJoin our protest that will be heldAlso join the event for more infoCrimesOfGenocide,1550.0,https://www.facebook.com/blackmattersus/,4529.0,221.0,02/09/16 05:40: 15 AM PST,Black Tea Patriots or BlackNewscom                                     Multicultural Affinity African American US,New York,New York,2016-02-09,New York
184,Officer Liang who fatally shot yearold Akai Gurley was found guilty ofmanslaughter assault and other criminal chargesRead moreandothercharges,1.5,https://www.facebook.com/blackmattersus/,10457.0,1000.0,02/12/16 07:09:39 AM PST,Black Matters  s                                      Black Matters,New York,New York,2016-02-12,New York
185,yearold Mario Woods was killed by the San Francisco police onDecember An autopsy released on Thursday shows that Mario was hittimes by officers bullets Sixteen of the wounds were said to have gone fromback to front through Woods body including six in his back and two in theback of his headRead morebulletsrecoveredfrombodyofmariowoodsautopsyreportsshow,1500.0,https://www.facebook.com/blackmattersus/,16684.0,1237.0,02/12/16 07:01:48 AM PST,Black Matters  s                                      Black Matters,New York,New York,2016-02-12,New York
186,Formation undoubtedly focuses on black identity as Beyonce justifiesher authority as a proud Black woman and concurrently authenticating herroots and historyRead mored ivabegoespoliticalwithherform ation,461.96,https://www.facebook.com/blackmattersus/,1590.0,180.0,02/12/16 12:36:07 AM PST,BlackNewscom,New York,New York,2016-02-12,New York
187,ATTENTION NEWYORKWe need your support Well provide you with free food and coffee Come andbring your friendsJoin the FB event for more details,4.3,https://www.facebook.com/blackmattersus/,5.0,0.0,02/18/16 05:46:32 AM PST,Black Tea Patriots or BlackNewscom,New York,New York,2016-02-18,New York
189,ATTENTION NEWYORKWe need your support Well provide you with free food and coffee Come andbring your friendsJoin the FB event for more details,0.0,https://www.facebook.com/blackmattersus/,,,02/18/16 05:09:11 AM PST,Black Tea Patriots or BlackNewscom,New York,New York,2016-02-18,New York
190,ATTENTION NEWYORKWe need your support Well provide you with free food and coffee Come andbring your friendsJoin the FB event for more details,1386.19,https://www.facebook.com/blackmattersus/,3466.0,353.0,02/18/1605:12:00 AM PST,Black Tea Patriots or BlackNewscom                                     Multicultural Affinity African American US,New York,New York,2016-02-18,New York
191,A yearold boy dies after being shot multiple times in West Baltimore ABaltimore teenager died Monday morning shortly afteram after beingshot several times on a street corner less than two miles from his old highschool Baltimore Suns crime reporter Kevin Rector said that an officer in theblock of West Baltimore street s heard multiple gunshots comin TeenFatally Shot In West Baltimore I Black Matters Black Matters,4.18,https://www.facebook.com/Black-Matters-1579673598947501/,5.0,2.0,03/04/16 12:46:32 AM PST,Black Matters  s                                      Black Matters,New York,New York,2016-03-04,New York
192,As what happened to India while in police custody remains a major concernmany are wondering why the yearold was denied an appropriate medicalevaluation and proper care The frequent reports of police brutality andextreme use of force leading to death has regrettably become a daily courseConsequently protests and demonstrations overflow in every nook andcranny demanding answers and justice On FebruaryIndia T Cummingswas under the influence of the synth JusticeForindia Yearold DeniedMedical Treatment Dies in Police Custody I Black Matters Black Matters,2.89,https://www.facebook.com/Black-Matters-1579673598947501/,7.0,0.0,03/04/16 12:4&00 AM PST,Black Matters  s                                      Black Matters,New York,New York,2016-03-04,New York
193,yearold Lane Durham from Oklahoma is facing up toyears ofconfinement for sexual harassment when he volunteered as a missionary inKenyaAll I wanted was to follow Gods plan for meDurham told before courtpleading for mercy In JuneMatthew Durham came under nationalspotlight when he was accused of raping and molesting several young blackgirls and boys in an orphanage in Kenya Now yearold Lane Durhamfrom Oklahoma is facing up toyears of confinement for sexualharassment when he volunteered as a missiYears For Sexually AbusingKenyan Orphans Isnt Enough I Black Matters Black Matters,20.09,https://www.facebook.com/Black-Matters-1579673598947501/,20.0,1.0,03/10/16 04:13:40 AM PST,Black Matters  s                                      Black Matters,New York,New York,2016-03-10,New York
194,Sean Chungwas sent to Rikers Island last month because of a musicvideo he posted in November The last thing you would imagine someone willgo to jail for is their rap lyrics Afterwards this is Americathe Land of theFree and home of the Brave The country where artists like IceT and IceCube can sing about killing cops and win multimillion dollar record dealsIm bout to dust som A Blatant Disregard For The First AmendmentYoung Rapper Jailed For Lyrics I Black Matters Black Matters,383.97,https://www.facebook.com/Black-Matters-1579673598947501/,1818.0,150.0,03/10/16 04:12:29 AM PST,Black Matters  s                                      Black Matters,New York,New York,2016-03-10,New York
195,Family members of India Kager will receive the video of India and Angelosshooting today March th On Marchwomen all over the world celebratedheartily the pride in being a woman But in the case of Gina she only wishesthe justice to be served Ginas grieving ever since the death of her daughterIndia Kager along with Angelo Perry Indias boyfriendhas been escalatedby an attorneys de Gina Kager Receives The Video Of Indias DeathBlack Matters Black Matters,199.96,https://www.facebook.com/Black-Matters-1579673598947501/,393.0,32.0,03/11/16 01:52:05 AM PST,Black Matters  s                                      Black Matters,New York,New York,2016-03-11,New York
196,A narcotics detective who abused his power in the past was shot in theshoulder by his fellow officer Its time to reap what you sow The day beforeyesterday an unidentified police sergeant accidentally shot Jon Gladstone anarcotics detective while firing at two unarmed drug dealers in Brooklyn Thedrug dealers were surrounded by these two undercover cops It happenedwhile the criminals were sitting in a parked van When the NYPD Cop ShotAnother Cop During A Drug Bust I Black Matters Black Matters,400.0,https://www.facebook.com/Black-Matters-1579673598947501/,1829.0,184.0,03/11/16 01:51:39 AM PST,Black Matters  s                                      Black Matters,New York,New York,2016-03-11,New York
197,The VA State Attorney Colon Stolle sees no law violation in Virginia Policeactions The VA State Attorney Colon Stolle on Wednesday gave a verdictconcerning the four Virginia Police Officers who were involved in the shootingof India Kager at a press conference He is sure that they didnt violate thelaw and shouldnt be prosecuted During the press conference a minutevideo of No Charges For VA Beach Police For Killing India Kager I BlackMatters Black Matters,0.68,https://www.facebook.com/Black-Matters-1579673598947501/,5.0,0.0,03/11/16 01:51:03 AM PST,Black Matters  s                                      Black Matters,New York,New York,2016-03-11,New York
198,The family of Luis Martinez wants Dist Attorney Jackie Lacey to file chargesagainst the police officers who were involved in the fatal shooting of a yearold man On AprilHollenbeck Division patrol officers were called byMartinezs wife reporting that her husband Luis Martinez had stabbedhimself Luis Martinez was a yearold man with a broken hip from fallingover a railing from the third floor of his apartment Martinezs injuries were sosev Family Seeks Charges Against LAPD Involved in Fatal Shooting Of AMan I Black Matters Black Matters,1.88,https://www.facebook.com/Black-Matters-1579673598947501/,4.0,0.0,03/11/16 01:50 37 AM PST,Black Matters  s                                      Black Matters,New York,New York,2016-03-11,New York
199,The mother of Tamir Rice wants to inspire young activists to rally against asystem that is stacked against communities of color Samaria Rice themother of yearold Tamir Rice who was fatally shot by officer TimothyLoehmann inwill address police brutality and other important issues atKalamazoo College in Michigan on Wednesday She wants to speak out atthe college in order to inspire students to stand up against Samaria Rice ToSpeak At Michigan College I Black Matters Black Matters,1000.0,https://www.facebook.com/Black-Matters-1579673598947501/,3484.0,320.0,03/11/16 01:49:33 AM PST,Black Matters  s                                      Black Matters,New York,New York,2016-03-11,New York
200,Since history men have developed fetishes on the curve body figures of blackwomen making them feel like sex objects Alessandrai Rhines explains why itis wrong to use black women as experiments Since history men havedeveloped fetishes on the curve body figures of black women making themfeel like sex objects Black women have been made to feel like they are highlysexualized beings since slavery Poet Alessandria Rhines performed atButton Poetry Live in Januaryexplaining in her p Alessandrai RhinesExplains Why It Is Wrong To Use Black Women As Experiments I BlackMatters Black Matters,200.0,https://www.facebook.com/Black-Matters-1579673598947501/,359.0,29.0,03/11/16 01:48:30 AM PST,Black Matters  s                                      Black Matters,New York,New York,2016-03-11,New York
201,Marylands Highest Court on Tuesday ordered a Baltimore police officer totestify against his colleagues who were also charged with Freddie Graysdeath Baltimores police officer William Porter is set to testify against hiscolleagues who sort the death of Freddie Gray under the grant of limitedimmunity which means that what he says cant be used against him duringhis own trial as the court ordered The Court of Appeals gave no reason forthe d Second Freddie Gray Trial Said Officer Must Testify Against CoDefendants I Black Matters Black Matters,144.32,https://www.facebook.com/Black-Matters-1579673598947501/,391.0,39.0,03/10/16 04:07 33 AM PST,Black Matters  s                                      Black Matters,New York,New York,2016-03-10,New York
202,University of Missouri assistant communications professor is appealing herfiring last month over her role in racism protests last year Melissa Click whowas caught on tape cursing student journalists and also police officers duringprotest last year stated on Tuesday that her dismissal on Febbyuniversity system curators was unprofessional In their decision to terminatemy employment the curators bowed to conservative voi Missouri ProfessorDismissed Over Misconduct Files Appeal I Black Matters Black Matters,7.47,https://www.facebook.com/Black-Matters-1579673598947501/,7.0,0.0,03/10/16 04:07:22 AM PST,Black Matters  s                                      Black Matters,New York,New York,2016-03-10,New York
203,A seventhgrade student at a private school in Hopewell Virginia was told byschool administrators he must remove his dreadlocks if he wanted to stay inthe school A seventhgrade student at a private school in Hopewell Virginiawas told by school administrators he must remove his dreadlocks if he wantedto stay in the school Isaiah Freemanhas had dreadlocks at the WestEnd Christian School since third grade It therefore came as a surprise to hisfa SeventhGrader Told To Cut Dreadlocks Or Leave The School I BlackMatters Black Matters,145.67,https://www.facebook.com/Black-Matters-1579673598947501/,432.0,42.0,03/10/16 04:07 06 AM PST,Black Matters  s                                      Black Matters,New York,New York,2016-03-10,New York
204,She didnt only win the women champions against Maria Sharapova lastyear but now she is on her way to being the highest paid On the fact of itAmerican sports are dominated by Black Americans Talk of BasketballSoccer American football Athletics and the like we have represented thenation on an international level and almost always brought glory to this nationThis is because Black culture has imbibed into us drive Serena Williams WillBe Worlds Highest Paid Female Athlete I Black Matters Black Matters,3.4,https://www.facebook.com/Black-Matters-1579673598947501/,19.0,2.0,03/14/16 06:11:54 AM PDT,Black Matters  s                                      Black Matters,New York,New York,2016-03-14,New York
205,Unrepentant hateful Trump supporter enjoyed sucker punching black man atrallyncrallynexttimewemighthavetokillhim Following statements from hisemperor saying hed like to punch a protester in the face Donald Trumpsupporter John McGrawwas caught on video sucker punching a blackman during a rally Wednesday in Fayetteville North Carolina Videos postedto social media showing several angles of McGraws Trump Supporter WhoPunched Black Man at NC Rally Next Time We Might Have to Kill HimBlack Black Matters,5.46,https://www.facebook.com/Black-Matters-1579673598947501/,10.0,0.0,03/14/16 06:11:31 AM PDT,Black Matters  s                                      Black Matters,New York,New York,2016-03-14,New York
206,A St Paul Police sergeant who posted on Facebook run them over aboutBLM protesters wont face any criminal chargesfree The sergeant Jeffrey Rothecker in his Facebook comment referred toprotesters as idiots He wrote about how drivers could even escape charges ifthey ever killed any of the protesters during protests He out smarted thepolice department and resigned before any disciplinary actions were takenThe Police Says Run Them Over And Goes ScotFree I Black MattersBlack Matters,11.77,https://blackmattersus.com/4678-police-says-run-them-over-and-goes-scot-,15.0,0.0,03/14/16 06:11:09 AM PDT,Black Matters  s                                      Black Matters,New York,New York,2016-03-14,New York
207,Trump said You know Barack ObamaAfricanAmericanif I were AfricanAmerican I would be so angry at him I will do more for the AfricanAmerican people in one year than Barack Obama has done in his sevenyears soon to be eight years and then by the way hes out and thankgoodness OK The controversial Trump has made so many promisesespecially to AfricanAmericans during his recent campaigns Some of thesepromises include Trump saying Im going to unify the country Trump toldthousands of people at a rally in this suburb of Detroit Im going to unifyblacks and whites A Donald Trumps Promises to AfricanAmericansBlack Matters Black Matters,7.71,https://www.facebook.com/Black-Matters-1579673598947501/,45.0,5.0,03/14/16 06:10:15 AM PDT,,New York,New York,2016-03-14,New York
208,Governor of the State of Mississippi has proclaimed the month of Aprilas Confederate Heritage Month We dont want to honor racism slavery andhatred Yet this is what Confederate Heritage is The Confederate flag isAmericas most potent symbol of white supremacy Symbols of hate have noplace in our governmentJoin our Not My Heritage Rally atpm on March thMississipi stJackson MississipiMore info,2.21,https://www.facebook.com/blackmattersus/,21.0,0.0,03/18/16 07:54:09 AM PDT,,Jackson Mississippi,Mississippi,2016-03-18,Mississippi
209,Wakiesha Wilsonwas found dead on Easter Weekend at the LAPDsdetention center in jail cell According to ABC report the black womanWakiesha Wilson had a disagreement with officers before she was founddied Wilson spoke to her lovely family that v Black Woman Found Dead InJail Cell After Arguing With Detention Officers I Black Matters Black Matters,3.5,https://blackmattersus.com/6189-black-woman-found-dead-in-jail-cell-after-,18946.0,1276.0,04/06/16 08:48:17 AM PDT,Black Matters  s                                      Black Matters,Atlanta Georgia,Georgia,2016-04-06,Georgia
211,Atlanta Hawks forward Sefolosha files a civil lawsuit againstNYPD officersfor breaking his leg Atlanta Hawks forward Thabo Sefolosha filed a civillawsuit against five New York Police Department officers and the city onWednesday in relation to an inciden NBA Star Sues NYPD Over False ArrestExcessive Force And Malicious Prosecution I Black Matters Black Matters,900.0,https://www.facebook.com/Black-Matters-1579673598947501/,2441.0,197.0,04/08/16 07:30:09 AM PDT,Black Matters  s                                      Black Matters,Atlanta Georgia,Georgia,2016-04-08,Georgia
212,Jay Z and Beyonce stood with families of police brutality victims donated bailfor Baltimore and Ferguson protesters The neverending cases of policebrutality and statesanctioned violence against Black peoplethe mostprominent being the police slaying of Michael Brown Er Musics BillionDollarCouple Help Raise Awareness Of Race And Police Brutality I Black MattersBlack Matters,300.0,https://www.facebook.com/Black-Matters-1579673598947501/,1112.0,120.0,04/07/16 08:20:46 AM PDT,Black Matters  s                                      Black Matters,Atlanta Georgia,Georgia,2016-04-07,Georgia
265,Six years later and still no justice for Aiyana Stanley JonesOn Maya peaceful rally will be held in Detroit outside the ColemanA Young Municipal Center to remember Aiyana and all victims of policebrutality,1.461,https://www.facebook.com/Black-Matters-1579673598947501/,1264.0,79.0,05/19/16 04:36:50 AM PDT,,Detroit Michigan,Michigan,2016-05-19,Michigan
266,She only allowed her son to drive a golf cart A beautiful family who alwaystake a yearly vacation at the luxury resort on Bald Head Island met a horribleexperience this year as soon as they met with polic Mom Brutalized AndJailed For Presumptuous Child Abuse I Black Matters Black Matters,439.92,https://www.facebook.com/Black-Matters-1579673598947501/,325.0,19.0,05/24/16 07:44:29 AM PDT,,Detroit Michigan,Michigan,2016-05-24,Michigan
268,President Obama signed bill HR modernizing terms relating tominorities into law Friday Over the years the minority have been lookeddown upon illtreated teased by peers and felt inferior due to their historicalbackground In the st century Negro Oriental and Indian To BeAbated From All Federal Laws I Black Matters Black Matters,424.8,https://www.facebook.com/Black-Matters-1579673598947501/,340.0,24.0,05/24/16 07:43:49 AM PDT,,Detroit Michigan,Michigan,2016-05-24,Michigan
269,Thevote would ban the display of the Confederate flag on flagpolesat VA cemeteries Due to the meaning and what the Confederate flag standsfor The House last Thursday voted to ban its display on flagpoles at Veterans,0.0,https://www.facebook.com/Black-Matters-1579673598947501/,0.0,0.0,05/24/16 07:43:26 AM PDT,,Detroit Michigan,Michigan,2016-05-24,Michigan
270,Ummmmm did you just not want ME to sit next to you Former NBA basketball player Etan Thomas writes about a woman who refused to allow him sitnext to her on a train Thomas explains that he politely and softly NBA StarConfronts Racist Woman On A Train I Black Matters Black Matters,568.74,https://www.facebook.com/Black-Matters-1579673598947501/,718.0,89.0,05/23/16 08:19:17 AM PDT,,Detroit Michigan,Michigan,2016-05-23,Michigan
271,Police watch three black Florida teenagers drown in a pond after chasingthem for an alleged stolen car Natasha Winkler who is the mother of LaniyaMiller one of the three teens who drowned in a pond in St Petersburg Flafter a police chase on Marchsaid t Black Moms say Cops Watched TheirDaughters Drown Without Doing Anything I Black Matters Black Matters,152.39,https://www.facebook.com/Black-Matters-1579673598947501/,130.0,10.0,05/23/16 08:17:29 AM PDT,,Detroit Michigan,Michigan,2016-05-23,Michigan
273,A new research shows that blacks are more likely to be diagnosed withdepression and schizophrenia disorders than whites The study which waspublished by the Psychiatric Services journal analyzed medical records ofpatients from the Mental Health Research Network One of the co MoreBlacks Are Diagnosed With Schizophrenia But Few Are Treated I BlackMatters Black Matters,85.33,https://www.facebook.com/Black-Matters-1579673598947501/,57.0,5.0,05/23/16 08:06:15 AM PDT,,Detroit Michigan,Michigan,2016-05-23,Michigan
274,A black man found hanged on a tree still no investigation initiated The bodyof a yearold Atlanta resident was discovered in the territory of the forestnot far from Richmond Road and Park East Drive Beachwood Ohio The blOhio Authorities Keep Their Eyes Shut At KKKstyle Death I Black MattersBlack Matters,65.51,https://blackmattersus.com/8347-ohio-authorities-keep-their-eyes-shut-at-kkk-,74.0,11.0,05/25/16 12:32:02 AM PDT,,Detroit Michigan,Michigan,2016-05-25,Michigan
298,Augustmarks a twoyear anniversary of the brutal murder of MichaelBrown anRally In Memory Of Mike Brown,6.105,https://www.facebook.com/events/309180056094025/,29689.0,1969.0,07/28/16 06:40:40 AM PDT,BlackNewscom Black History Month or AfricanAmerican history,New York,New York,2016-07-28,New York
299,Augustmarks a twoyear anniversary of the brutal murder of MichaelBrown anRally In Memory Of Mike Brown,7.533,https://www.facebook.com/events/309180056094025/,14949.0,1042.0,08/04/16 07:23:59 AM PDT,BlackNewscom Black History Month or AfricanAmerican history,Los Angeles California,California,2016-08-04,California
302,Stand up South Carolina Lets stop the propaganda of hate and whitesupremacy Not My Heritage,0.0,https://www.facebook.com/events/I 730167210590258/,0.0,0.0,07/21/16 01:07:46 AM PDT,people who like Black Matters,South Carolina,South Carolina,2016-07-21,South Carolina
303,White supremacists are planning to raise the racist flag again The stateofficials ordere Not My Heritage,822.74,https://www.facebook.com/events/I 730167210590258/,1239.0,58.0,06/29/16 06:11:58 AM PDT,people who like Black Matters,South Carolina,South Carolina,2016-06-29,South Carolina
304,White supremacists are planning to raise the racist flag again The stateofficials ordere Not My Heritage,3626.22,https://www.facebook.com/events/1730167210590258/,12125.0,665.0,06/30/16 01:17:16 AM PDT,,South Carolina,South Carolina,2016-06-30,South Carolina
305,White supremacists are planning to raise the racist flag again The stateofficials ordere Not My Heritage,6495.7,https://www.facebook.com/events/I 730167210590258/,30994.0,1367.0,07/05/16 03:40:13 AM PDT,HuffPost Black Voices   African                                    AmericanUSor Asian AmericanUS,South Carolina,South Carolina,2016-07-05,South Carolina
307,A rally in loving memory of Aiyana JonesMaymarked the sixth anniversary of the brutal slaying of yearold AiyanaStanleyJones by Detroit Police Officer Joe Weekley She was shot by thecop while she slept on a couch during a botched raid The killer is stillemployed by the Detroit Police Department He was charged with involuntarymanslaughter and two lesser charges in her death but the case was droppedin JanuaryJustice hasnt been served for Aiyana and her grieving familyWere planning a peaceful rally in front of the Coleman A Young MunicipalCenter on Mayto honor the memory of Aiyana and other victims of policeviolence and demand demilitarization of police We should draw as muchattention as possible to the lack of justice for the families of those who losttheir beloved ones at the hands of the policeInvite everyone you know and join us on MayWe should stand up for the better future of our kids The th Anniversary OfThe Aiyana Jones Death,5326.68,https://www.facebook.com/events/17275196241840501,58081.0,4010.0,04/30/16 08:50:57 AM PDT,,Detroit Michigan,Michigan,2016-04-30,Michigan
309,We finally made it Welcome to the official Black Matters Website,141.81,https://www.facebook.com/blackmattersus/,197.0,15.0,03/10/16 05:50:56 AM PST,Black Matters  s                                      Black Matters,New York,New York,2016-03-10,New York
310,As what happened to India while in police custody remains a major concernmany are wondering why the yearold was denied an appropriate medicalevaluation and proper care The frequent reports of police brutality andextreme use of force leading to death has regrettably become a daily courseConsequently protests and demonstrations overflow in every nook andcranny demanding answers and justice On FebruaryIndia T Cummingswas under the influence of the synth JusticeForindia Yearold DeniedMedical Treatment Dies in Police Custody I Black Matters Black Matters,0.0,https://www.facebook.com/Black-Matters-1579673598947501/,0.0,0.0,03/04/16 12:41:08 AM PST,BlackNewscom,New York,New York,2016-03-04,New York
313,NovemberIs the One year anniversary Death ofyear old TamirRice killed by two Cleveland Police Officers Timothy Loehmann and FrankGarmback You are welcome Join the meeting A Year Without Justice forTamir Rice,0.0,https://www.facebook.com/events/1 486230091674577/,0.0,0.0,11/19/15 11:51:19 PM PST,Black Matters  s                                      Black Matters,Cleveland Ohio,Ohio,2015-11-19,Ohio
314,A Year Without Justice for Tamir Rice Join the meeting A Year WithoutJustice for Tamir Rice,0.0,https://www.facebook.com/events/I 486230091674577/,0.0,0.0,11/19/15 11:27:57 PM PST,,Cleveland Ohio,Ohio,2015-11-19,Ohio
315,NovemberIs the One year anniversary Death ofyear old TamirRice killed by two Cleveland Police Officers Timothy Loehmann and FrankGarmback You are welcome Join the meeting,0.0,,,,11 /19/15 11 :21 :05 PM PST,Black Matters  s                                     Black Matters,Cleveland Ohio,Ohio,,Ohio
316,Why I March JusticeOrElseyears agoyears a million men women and children gathered on theNational Mall in Washington DC answering the call from Minister LouisFarrakhan to come to the nations capital and show our strength in numbersand unity and remind politicians that our voices would be heardyearslater we return to call on our politicians to fix our broken criminal justicesystem once and for allI march to fix a system that houses more black men in our prison system thanthere were black men enslaved inTo fix a system that allows for localprosecutors to investigate their friends at the police department when there isan officerinvolved shooting To fix a system that has drug laws thatdisproportionately arrest black and brown people for using drugs when whitepeople use at the same rate To fix a system that has built a private industryoff the backs of prisoners laboring for pennies To fix a system that doesntvideo record the actions of law enforcement at all times To fix a system thatcriminalizes young women who are pimped and sexually trafficked beforethey even turnTo fix a system that does not collect any national data onincidents when police use excessive force or discharge their firearm To fix asystem that has incarcerated more people than any other nation in the worldTo fix a system that has created a school to prison pipeline by harsher schooldiscipline practices for young students of color To fix a system of policing thattargets communities of color by programs like StopFrisk or BrokenWindowsThis is why I march This is why we all should march in order to build a betterfuture for our kids We should fight the institutional racism in the countryLike and share if you want to help the movement,3.82,https://www.facebook.com/Black-Matters-1 579673598947501/,58.0,2.0,10/06/15 06:44:30 AM PDT,Black Matters  s                                      Black Matters,Baltimore Maryland Missouri Cleveland Ohio,Maryland Missouri Ohio,2015-10-06,Maryland
316,Why I March JusticeOrElseyears agoyears a million men women and children gathered on theNational Mall in Washington DC answering the call from Minister LouisFarrakhan to come to the nations capital and show our strength in numbersand unity and remind politicians that our voices would be heardyearslater we return to call on our politicians to fix our broken criminal justicesystem once and for allI march to fix a system that houses more black men in our prison system thanthere were black men enslaved inTo fix a system that allows for localprosecutors to investigate their friends at the police department when there isan officerinvolved shooting To fix a system that has drug laws thatdisproportionately arrest black and brown people for using drugs when whitepeople use at the same rate To fix a system that has built a private industryoff the backs of prisoners laboring for pennies To fix a system that doesntvideo record the actions of law enforcement at all times To fix a system thatcriminalizes young women who are pimped and sexually trafficked beforethey even turnTo fix a system that does not collect any national data onincidents when police use excessive force or discharge their firearm To fix asystem that has incarcerated more people than any other nation in the worldTo fix a system that has created a school to prison pipeline by harsher schooldiscipline practices for young students of color To fix a system of policing thattargets communities of color by programs like StopFrisk or BrokenWindowsThis is why I march This is why we all should march in order to build a betterfuture for our kids We should fight the institutional racism in the countryLike and share if you want to help the movement,3.82,https://www.facebook.com/Black-Matters-1 579673598947501/,58.0,2.0,10/06/15 06:44:30 AM PDT,Black Matters  s                                      Black Matters,Baltimore Maryland Missouri Cleveland Ohio,Maryland Missouri Ohio,2015-10-06,Missouri
316,Why I March JusticeOrElseyears agoyears a million men women and children gathered on theNational Mall in Washington DC answering the call from Minister LouisFarrakhan to come to the nations capital and show our strength in numbersand unity and remind politicians that our voices would be heardyearslater we return to call on our politicians to fix our broken criminal justicesystem once and for allI march to fix a system that houses more black men in our prison system thanthere were black men enslaved inTo fix a system that allows for localprosecutors to investigate their friends at the police department when there isan officerinvolved shooting To fix a system that has drug laws thatdisproportionately arrest black and brown people for using drugs when whitepeople use at the same rate To fix a system that has built a private industryoff the backs of prisoners laboring for pennies To fix a system that doesntvideo record the actions of law enforcement at all times To fix a system thatcriminalizes young women who are pimped and sexually trafficked beforethey even turnTo fix a system that does not collect any national data onincidents when police use excessive force or discharge their firearm To fix asystem that has incarcerated more people than any other nation in the worldTo fix a system that has created a school to prison pipeline by harsher schooldiscipline practices for young students of color To fix a system of policing thattargets communities of color by programs like StopFrisk or BrokenWindowsThis is why I march This is why we all should march in order to build a betterfuture for our kids We should fight the institutional racism in the countryLike and share if you want to help the movement,3.82,https://www.facebook.com/Black-Matters-1 579673598947501/,58.0,2.0,10/06/15 06:44:30 AM PDT,Black Matters  s                                      Black Matters,Baltimore Maryland Missouri Cleveland Ohio,Maryland Missouri Ohio,2015-10-06,Ohio
317,Mass Shooting At Umpqua Community College In OregonReported DeadTen people were killed and seven were wounded Thursday in a shooting at asmall community college in Roseburg Oregon The shooting took place inclassrooms in Snyder HallLaw enforcement officials have identified Chris Harper Mercer as the manresponsible for the mass shootingHe had four weapons on himthreehandguns and one assault weapon Also he was definitely ready to put up afight because he had body armor and stash of ammunitionOne of the witnesses said that the gunman first asked about peoplesreligions before he began firingThe hospital said that all victims were female between the ages ofandand quoted a doctor who said that an army of doctors and nurses hadvolunteered to helpIts the th shooting at a school so far this year Obama said that America isthe only country on Earth that sees these kinds of mass shootings every fewmonths And hes right People already got used to this Isnt it time for somegun control yetSome white supremacists say that the killer was mixed and he supportedBLM This information is not confirmed and is more likely to be fake Thisdude is definitely not black His parents are Caucasian The fact its been afew hours since the shooting and they havent say what race he is means heswhite And honestly word shooting isnt used correctly here Can we call itterror Oh wait White male thoughUCC Oregon shooting,598.82,https://www.facebook.com/Black-Matters-1579673598947501/,4925.0,709.0,10/02/15 07:28:43 AM PDT,Black Matters  s                                      Black Matters,Baltimore Maryland Missouri Cleveland Ohio,Maryland Missouri Ohio,2015-10-02,Maryland
317,Mass Shooting At Umpqua Community College In OregonReported DeadTen people were killed and seven were wounded Thursday in a shooting at asmall community college in Roseburg Oregon The shooting took place inclassrooms in Snyder HallLaw enforcement officials have identified Chris Harper Mercer as the manresponsible for the mass shootingHe had four weapons on himthreehandguns and one assault weapon Also he was definitely ready to put up afight because he had body armor and stash of ammunitionOne of the witnesses said that the gunman first asked about peoplesreligions before he began firingThe hospital said that all victims were female between the ages ofandand quoted a doctor who said that an army of doctors and nurses hadvolunteered to helpIts the th shooting at a school so far this year Obama said that America isthe only country on Earth that sees these kinds of mass shootings every fewmonths And hes right People already got used to this Isnt it time for somegun control yetSome white supremacists say that the killer was mixed and he supportedBLM This information is not confirmed and is more likely to be fake Thisdude is definitely not black His parents are Caucasian The fact its been afew hours since the shooting and they havent say what race he is means heswhite And honestly word shooting isnt used correctly here Can we call itterror Oh wait White male thoughUCC Oregon shooting,598.82,https://www.facebook.com/Black-Matters-1579673598947501/,4925.0,709.0,10/02/15 07:28:43 AM PDT,Black Matters  s                                      Black Matters,Baltimore Maryland Missouri Cleveland Ohio,Maryland Missouri Ohio,2015-10-02,Missouri
317,Mass Shooting At Umpqua Community College In OregonReported DeadTen people were killed and seven were wounded Thursday in a shooting at asmall community college in Roseburg Oregon The shooting took place inclassrooms in Snyder HallLaw enforcement officials have identified Chris Harper Mercer as the manresponsible for the mass shootingHe had four weapons on himthreehandguns and one assault weapon Also he was definitely ready to put up afight because he had body armor and stash of ammunitionOne of the witnesses said that the gunman first asked about peoplesreligions before he began firingThe hospital said that all victims were female between the ages ofandand quoted a doctor who said that an army of doctors and nurses hadvolunteered to helpIts the th shooting at a school so far this year Obama said that America isthe only country on Earth that sees these kinds of mass shootings every fewmonths And hes right People already got used to this Isnt it time for somegun control yetSome white supremacists say that the killer was mixed and he supportedBLM This information is not confirmed and is more likely to be fake Thisdude is definitely not black His parents are Caucasian The fact its been afew hours since the shooting and they havent say what race he is means heswhite And honestly word shooting isnt used correctly here Can we call itterror Oh wait White male thoughUCC Oregon shooting,598.82,https://www.facebook.com/Black-Matters-1579673598947501/,4925.0,709.0,10/02/15 07:28:43 AM PDT,Black Matters  s                                      Black Matters,Baltimore Maryland Missouri Cleveland Ohio,Maryland Missouri Ohio,2015-10-02,Ohio
319,Fastgrowing black community Latest news and everyday updates,0.0,https://www.facebook.com/Black-Matters-1579673598947501/,0.0,0.0,07/13/15 07:12:00 AM PDT,people who like Black Matters,Atlanta Georgia Maryland Missouri Virginia,Georgia Maryland Missouri Virginia,2015-07-13,Georgia
319,Fastgrowing black community Latest news and everyday updates,0.0,https://www.facebook.com/Black-Matters-1579673598947501/,0.0,0.0,07/13/15 07:12:00 AM PDT,people who like Black Matters,Atlanta Georgia Maryland Missouri Virginia,Georgia Maryland Missouri Virginia,2015-07-13,Maryland
319,Fastgrowing black community Latest news and everyday updates,0.0,https://www.facebook.com/Black-Matters-1579673598947501/,0.0,0.0,07/13/15 07:12:00 AM PDT,people who like Black Matters,Atlanta Georgia Maryland Missouri Virginia,Georgia Maryland Missouri Virginia,2015-07-13,Missouri
319,Fastgrowing black community Latest news and everyday updates,0.0,https://www.facebook.com/Black-Matters-1579673598947501/,0.0,0.0,07/13/15 07:12:00 AM PDT,people who like Black Matters,Atlanta Georgia Maryland Missouri Virginia,Georgia Maryland Missouri Virginia,2015-07-13,Virginia
320,Fastgrowing black community Latest news and everyday updates,199.71,https://www.facebook.com/Black-Matters-1579673598947501/,432.0,20.0,07/13/15 07:20:58 AM PDT,people who like Black Matters,Atlanta Georgia Maryland Missouri Virginia,Georgia Maryland Missouri Virginia,2015-07-13,Georgia
320,Fastgrowing black community Latest news and everyday updates,199.71,https://www.facebook.com/Black-Matters-1579673598947501/,432.0,20.0,07/13/15 07:20:58 AM PDT,people who like Black Matters,Atlanta Georgia Maryland Missouri Virginia,Georgia Maryland Missouri Virginia,2015-07-13,Maryland
320,Fastgrowing black community Latest news and everyday updates,199.71,https://www.facebook.com/Black-Matters-1579673598947501/,432.0,20.0,07/13/15 07:20:58 AM PDT,people who like Black Matters,Atlanta Georgia Maryland Missouri Virginia,Georgia Maryland Missouri Virginia,2015-07-13,Missouri
320,Fastgrowing black community Latest news and everyday updates,199.71,https://www.facebook.com/Black-Matters-1579673598947501/,432.0,20.0,07/13/15 07:20:58 AM PDT,people who like Black Matters,Atlanta Georgia Maryland Missouri Virginia,Georgia Maryland Missouri Virginia,2015-07-13,Virginia
321,Fastgrowing black community Latest news and everyday updates,0.0,https://www.facebook.com/Black-Matters-1579673598947501/,0.0,0.0,07/13/15 07:12:24 AM PDT,people who like Black Matters,Atlanta Georgia Maryland Missouri Virginia,Georgia Maryland Missouri Virginia,2015-07-13,Georgia
321,Fastgrowing black community Latest news and everyday updates,0.0,https://www.facebook.com/Black-Matters-1579673598947501/,0.0,0.0,07/13/15 07:12:24 AM PDT,people who like Black Matters,Atlanta Georgia Maryland Missouri Virginia,Georgia Maryland Missouri Virginia,2015-07-13,Maryland
321,Fastgrowing black community Latest news and everyday updates,0.0,https://www.facebook.com/Black-Matters-1579673598947501/,0.0,0.0,07/13/15 07:12:24 AM PDT,people who like Black Matters,Atlanta Georgia Maryland Missouri Virginia,Georgia Maryland Missouri Virginia,2015-07-13,Missouri
321,Fastgrowing black community Latest news and everyday updates,0.0,https://www.facebook.com/Black-Matters-1579673598947501/,0.0,0.0,07/13/15 07:12:24 AM PDT,people who like Black Matters,Atlanta Georgia Maryland Missouri Virginia,Georgia Maryland Missouri Virginia,2015-07-13,Virginia
322,Fastgrowing black community Latest news and everyday updates,254.91,https://www.facebook.com/Black-Matters-1579673598947501/,444.0,19.0,07/13/15 07:20:58 AM PDT,people who like Black Matters,Atlanta Georgia Maryland Missouri Virginia,Georgia Maryland Missouri Virginia,2015-07-13,Georgia
322,Fastgrowing black community Latest news and everyday updates,254.91,https://www.facebook.com/Black-Matters-1579673598947501/,444.0,19.0,07/13/15 07:20:58 AM PDT,people who like Black Matters,Atlanta Georgia Maryland Missouri Virginia,Georgia Maryland Missouri Virginia,2015-07-13,Maryland
322,Fastgrowing black community Latest news and everyday updates,254.91,https://www.facebook.com/Black-Matters-1579673598947501/,444.0,19.0,07/13/15 07:20:58 AM PDT,people who like Black Matters,Atlanta Georgia Maryland Missouri Virginia,Georgia Maryland Missouri Virginia,2015-07-13,Missouri
322,Fastgrowing black community Latest news and everyday updates,254.91,https://www.facebook.com/Black-Matters-1579673598947501/,444.0,19.0,07/13/15 07:20:58 AM PDT,people who like Black Matters,Atlanta Georgia Maryland Missouri Virginia,Georgia Maryland Missouri Virginia,2015-07-13,Virginia
323,Join us because we care Black Matters,0.0,https://www.facebook.com/blackmattersus/,0.0,0.0,07/13/15 07:16:57 AM PDT,people who like Black Matters,Atlanta Georgia Maryland Missouri Virginia,Georgia Maryland Missouri Virginia,2015-07-13,Georgia
323,Join us because we care Black Matters,0.0,https://www.facebook.com/blackmattersus/,0.0,0.0,07/13/15 07:16:57 AM PDT,people who like Black Matters,Atlanta Georgia Maryland Missouri Virginia,Georgia Maryland Missouri Virginia,2015-07-13,Maryland
323,Join us because we care Black Matters,0.0,https://www.facebook.com/blackmattersus/,0.0,0.0,07/13/15 07:16:57 AM PDT,people who like Black Matters,Atlanta Georgia Maryland Missouri Virginia,Georgia Maryland Missouri Virginia,2015-07-13,Missouri
323,Join us because we care Black Matters,0.0,https://www.facebook.com/blackmattersus/,0.0,0.0,07/13/15 07:16:57 AM PDT,people who like Black Matters,Atlanta Georgia Maryland Missouri Virginia,Georgia Maryland Missouri Virginia,2015-07-13,Virginia
324,Join us because we care Black Matters,0.0,https://www.facebook.com/blackmattersus/,0.0,0.0,07/13/15 07:16:58 AM PDT,people who like Black Matters,Atlanta Georgia Maryland Missouri Virginia,Georgia Maryland Missouri Virginia,2015-07-13,Georgia
324,Join us because we care Black Matters,0.0,https://www.facebook.com/blackmattersus/,0.0,0.0,07/13/15 07:16:58 AM PDT,people who like Black Matters,Atlanta Georgia Maryland Missouri Virginia,Georgia Maryland Missouri Virginia,2015-07-13,Maryland
324,Join us because we care Black Matters,0.0,https://www.facebook.com/blackmattersus/,0.0,0.0,07/13/15 07:16:58 AM PDT,people who like Black Matters,Atlanta Georgia Maryland Missouri Virginia,Georgia Maryland Missouri Virginia,2015-07-13,Missouri
324,Join us because we care Black Matters,0.0,https://www.facebook.com/blackmattersus/,0.0,0.0,07/13/15 07:16:58 AM PDT,people who like Black Matters,Atlanta Georgia Maryland Missouri Virginia,Georgia Maryland Missouri Virginia,2015-07-13,Virginia
325,Californiaknows how to partyCaliforniaknows how to partyIn the citaaay of LAIn the citaaay of good of WattsIn the citaaay the city of ComptonWe keep it rockin We keep it rockinPacCalifornia Love,45.94,https://www.facebook.com/Black-Matters-1579673598947501/,326.0,4.0,06/10/15 07:34:52 AM PDT,,Baltimore Maryland Missouri Cleveland Ohio,Maryland Missouri Ohio,2015-06-10,Maryland
325,Californiaknows how to partyCaliforniaknows how to partyIn the citaaay of LAIn the citaaay of good of WattsIn the citaaay the city of ComptonWe keep it rockin We keep it rockinPacCalifornia Love,45.94,https://www.facebook.com/Black-Matters-1579673598947501/,326.0,4.0,06/10/15 07:34:52 AM PDT,,Baltimore Maryland Missouri Cleveland Ohio,Maryland Missouri Ohio,2015-06-10,Missouri
325,Californiaknows how to partyCaliforniaknows how to partyIn the citaaay of LAIn the citaaay of good of WattsIn the citaaay the city of ComptonWe keep it rockin We keep it rockinPacCalifornia Love,45.94,https://www.facebook.com/Black-Matters-1579673598947501/,326.0,4.0,06/10/15 07:34:52 AM PDT,,Baltimore Maryland Missouri Cleveland Ohio,Maryland Missouri Ohio,2015-06-10,Ohio
326,Sinceoverof our lives have been taken at the hands of policeThose lives of which were made to be worthless because of our race Eachtime we die many of your people and those who stand by you justify thetaking of our lives because they believe we are not human and are notworthy of lifeWhy should we be a target for police violence and harassment,99.97,https://www.facebook.com/Black-Matters-1579673598947501/,1478.0,517.0,06/11/15 0113:16 AM PDT,,Baltimore Maryland Missouri Cleveland Ohio,Maryland Missouri Ohio,2015-06-11,Maryland
326,Sinceoverof our lives have been taken at the hands of policeThose lives of which were made to be worthless because of our race Eachtime we die many of your people and those who stand by you justify thetaking of our lives because they believe we are not human and are notworthy of lifeWhy should we be a target for police violence and harassment,99.97,https://www.facebook.com/Black-Matters-1579673598947501/,1478.0,517.0,06/11/15 0113:16 AM PDT,,Baltimore Maryland Missouri Cleveland Ohio,Maryland Missouri Ohio,2015-06-11,Missouri
326,Sinceoverof our lives have been taken at the hands of policeThose lives of which were made to be worthless because of our race Eachtime we die many of your people and those who stand by you justify thetaking of our lives because they believe we are not human and are notworthy of lifeWhy should we be a target for police violence and harassment,99.97,https://www.facebook.com/Black-Matters-1579673598947501/,1478.0,517.0,06/11/15 0113:16 AM PDT,,Baltimore Maryland Missouri Cleveland Ohio,Maryland Missouri Ohio,2015-06-11,Ohio
327,Just like Trayvon Martin race mattered for Amadou Diallo Oscar GrantSean Bell Emmett Till and thousands more we will never know the name ofwho died because of their skin colorAngela DavisRacism is still alive in the USA,34.77,https://www.facebook.com/Black-Matters-1579673598947501/,125.0,7.0,06/11/15 06:51:30 AM PDT,,Baltimore Maryland Missouri Cleveland Ohio,Maryland Missouri Ohio,2015-06-11,Maryland
327,Just like Trayvon Martin race mattered for Amadou Diallo Oscar GrantSean Bell Emmett Till and thousands more we will never know the name ofwho died because of their skin colorAngela DavisRacism is still alive in the USA,34.77,https://www.facebook.com/Black-Matters-1579673598947501/,125.0,7.0,06/11/15 06:51:30 AM PDT,,Baltimore Maryland Missouri Cleveland Ohio,Maryland Missouri Ohio,2015-06-11,Missouri
327,Just like Trayvon Martin race mattered for Amadou Diallo Oscar GrantSean Bell Emmett Till and thousands more we will never know the name ofwho died because of their skin colorAngela DavisRacism is still alive in the USA,34.77,https://www.facebook.com/Black-Matters-1579673598947501/,125.0,7.0,06/11/15 06:51:30 AM PDT,,Baltimore Maryland Missouri Cleveland Ohio,Maryland Missouri Ohio,2015-06-11,Ohio
328,Race war started by Texas teacherA Texas fourthgrade teacher Karen Fitzgibbons published a racial Facebookpost in which she confirmed that Black people are responsible for racialtensions in the USA Moreover she claimed that she is almost to the pointof defending the segregation After her post about the recent pool partyincident drew local attention the teacher deleted her profileThis makes me ANGRY This officer should not have had to resign Imgoing to just go ahead and say itthe blacks are the ones causing theproblems and this racial tension I guess thats what happens when youflunk out of school and have no education Im sure their parents are just asguilty for not knowing what their kids were doing or knew it and didnt careshe wrote She also addedIm almost to the point of wanting them allsegregated on one side of town so they can hurt each other and leave theinnocent people alone Maybe the s and s were really on to somethingNow let the bashing of my true and honest opinion beginGOimnotracistimsickofthemcausingtrouble itwasagatedcommunityAs we see Karen Fitzgibbons is a real racist who approves the humiliation ofblack people This news clearly reflects that American society is close tocollapse if not to say to war As the authorities are doing nothing to resolvethe situation in the near future we may face real race war within our country,31.54,https://www.facebook.com/Black-Matters-1579673598947501/,168.0,17.0,06/11/15 07:03:58 AM PDT,,Baltimore Maryland Missouri Cleveland Ohio,Maryland Missouri Ohio,2015-06-11,Maryland
328,Race war started by Texas teacherA Texas fourthgrade teacher Karen Fitzgibbons published a racial Facebookpost in which she confirmed that Black people are responsible for racialtensions in the USA Moreover she claimed that she is almost to the pointof defending the segregation After her post about the recent pool partyincident drew local attention the teacher deleted her profileThis makes me ANGRY This officer should not have had to resign Imgoing to just go ahead and say itthe blacks are the ones causing theproblems and this racial tension I guess thats what happens when youflunk out of school and have no education Im sure their parents are just asguilty for not knowing what their kids were doing or knew it and didnt careshe wrote She also addedIm almost to the point of wanting them allsegregated on one side of town so they can hurt each other and leave theinnocent people alone Maybe the s and s were really on to somethingNow let the bashing of my true and honest opinion beginGOimnotracistimsickofthemcausingtrouble itwasagatedcommunityAs we see Karen Fitzgibbons is a real racist who approves the humiliation ofblack people This news clearly reflects that American society is close tocollapse if not to say to war As the authorities are doing nothing to resolvethe situation in the near future we may face real race war within our country,31.54,https://www.facebook.com/Black-Matters-1579673598947501/,168.0,17.0,06/11/15 07:03:58 AM PDT,,Baltimore Maryland Missouri Cleveland Ohio,Maryland Missouri Ohio,2015-06-11,Missouri
328,Race war started by Texas teacherA Texas fourthgrade teacher Karen Fitzgibbons published a racial Facebookpost in which she confirmed that Black people are responsible for racialtensions in the USA Moreover she claimed that she is almost to the pointof defending the segregation After her post about the recent pool partyincident drew local attention the teacher deleted her profileThis makes me ANGRY This officer should not have had to resign Imgoing to just go ahead and say itthe blacks are the ones causing theproblems and this racial tension I guess thats what happens when youflunk out of school and have no education Im sure their parents are just asguilty for not knowing what their kids were doing or knew it and didnt careshe wrote She also addedIm almost to the point of wanting them allsegregated on one side of town so they can hurt each other and leave theinnocent people alone Maybe the s and s were really on to somethingNow let the bashing of my true and honest opinion beginGOimnotracistimsickofthemcausingtrouble itwasagatedcommunityAs we see Karen Fitzgibbons is a real racist who approves the humiliation ofblack people This news clearly reflects that American society is close tocollapse if not to say to war As the authorities are doing nothing to resolvethe situation in the near future we may face real race war within our country,31.54,https://www.facebook.com/Black-Matters-1579673598947501/,168.0,17.0,06/11/15 07:03:58 AM PDT,,Baltimore Maryland Missouri Cleveland Ohio,Maryland Missouri Ohio,2015-06-11,Ohio
329,The image ofshows several African American Youths dangling aroundthe stairs leading up to the back entrance of a segregated movie theater inAnniston AlabamaThat day the Tarzan film Call of the Savage was shown,90.65,https://www.facebook.com/Black-Matters-1579673598947501/,482.0,18.0,06/15/15 07:21:33 AM PDT,Black Matters  s                                      Black Matters,Baltimore Maryland Missouri Cleveland Ohio,Maryland Missouri Ohio,2015-06-15,Maryland
329,The image ofshows several African American Youths dangling aroundthe stairs leading up to the back entrance of a segregated movie theater inAnniston AlabamaThat day the Tarzan film Call of the Savage was shown,90.65,https://www.facebook.com/Black-Matters-1579673598947501/,482.0,18.0,06/15/15 07:21:33 AM PDT,Black Matters  s                                      Black Matters,Baltimore Maryland Missouri Cleveland Ohio,Maryland Missouri Ohio,2015-06-15,Missouri
329,The image ofshows several African American Youths dangling aroundthe stairs leading up to the back entrance of a segregated movie theater inAnniston AlabamaThat day the Tarzan film Call of the Savage was shown,90.65,https://www.facebook.com/Black-Matters-1579673598947501/,482.0,18.0,06/15/15 07:21:33 AM PDT,Black Matters  s                                      Black Matters,Baltimore Maryland Missouri Cleveland Ohio,Maryland Missouri Ohio,2015-06-15,Ohio
330,American Racists On The RoadThe racists group of America Back To The Blue are organizing a hate rallyin response to the public outcry and protests against police officersBikerspatriots want to descend on the McKinney Police HQ in a show ofsolidarity for the police because racebaiters and cophaters They plan tohave the biggest thing to happen in Patriot Movement since the BundyRanch victoryIt seems like we wont get into postracial America this event and theregular murder of innocent Black children by white supremacist police andcitizens makes that clear The modern government has brought racistAmerica to the forefront good or bad This is something that America has aserious issue withRACISMIs it time to call out the national guard,88.45,https://www.facebook.com/Black-Matters-1579673598947501/,524.0,24.0,06/15/15 07:22:00 AM PDT,Black Matters  s                                      Black Matters,Baltimore Maryland Missouri Cleveland Ohio,Maryland Missouri Ohio,2015-06-15,Maryland
330,American Racists On The RoadThe racists group of America Back To The Blue are organizing a hate rallyin response to the public outcry and protests against police officersBikerspatriots want to descend on the McKinney Police HQ in a show ofsolidarity for the police because racebaiters and cophaters They plan tohave the biggest thing to happen in Patriot Movement since the BundyRanch victoryIt seems like we wont get into postracial America this event and theregular murder of innocent Black children by white supremacist police andcitizens makes that clear The modern government has brought racistAmerica to the forefront good or bad This is something that America has aserious issue withRACISMIs it time to call out the national guard,88.45,https://www.facebook.com/Black-Matters-1579673598947501/,524.0,24.0,06/15/15 07:22:00 AM PDT,Black Matters  s                                      Black Matters,Baltimore Maryland Missouri Cleveland Ohio,Maryland Missouri Ohio,2015-06-15,Missouri
330,American Racists On The RoadThe racists group of America Back To The Blue are organizing a hate rallyin response to the public outcry and protests against police officersBikerspatriots want to descend on the McKinney Police HQ in a show ofsolidarity for the police because racebaiters and cophaters They plan tohave the biggest thing to happen in Patriot Movement since the BundyRanch victoryIt seems like we wont get into postracial America this event and theregular murder of innocent Black children by white supremacist police andcitizens makes that clear The modern government has brought racistAmerica to the forefront good or bad This is something that America has aserious issue withRACISMIs it time to call out the national guard,88.45,https://www.facebook.com/Black-Matters-1579673598947501/,524.0,24.0,06/15/15 07:22:00 AM PDT,Black Matters  s                                      Black Matters,Baltimore Maryland Missouri Cleveland Ohio,Maryland Missouri Ohio,2015-06-15,Ohio
331,Free Figures Black Power Rally at VCU,90.86,https://www.facebook.com/Black-Matters-1579673598947501/,764.0,43.0,06/15/15 07:21:47 AM PDT,,Baltimore Maryland Missouri Cleveland Ohio,Maryland Missouri Ohio,2015-06-15,Maryland
331,Free Figures Black Power Rally at VCU,90.86,https://www.facebook.com/Black-Matters-1579673598947501/,764.0,43.0,06/15/15 07:21:47 AM PDT,,Baltimore Maryland Missouri Cleveland Ohio,Maryland Missouri Ohio,2015-06-15,Missouri
331,Free Figures Black Power Rally at VCU,90.86,https://www.facebook.com/Black-Matters-1579673598947501/,764.0,43.0,06/15/15 07:21:47 AM PDT,,Baltimore Maryland Missouri Cleveland Ohio,Maryland Missouri Ohio,2015-06-15,Ohio
332,A woman pretended AfroAmerican to gain control over black communityassociationThe president of a local NAACP chapter in Spokane Washington is underinvestigation after her parents publicly accused her of lying being AfricanAmerican Both parents of Rachel Dolezal are white Rachel Dolezal alsoserves as the chair of Spokanes Office of Police Ombudsman Commissionand is an adjunct professor of Africana Studies at Eastern WashingtonUniversity Dolezal falsely identified herself as AfricanAmerican in order to beappointed as a chair Dolezals parents paid attention to the officialdocuments including a birth certificate confirming that Rachel is partSwedish Czech and German with traces of Native American heritageWe see how whites are trying to gain control over traditionally blackorganization that protects the rights and interests of the black community Inthe Dolezals case it is unlikely it was a mistake or personally motivatedfraud Simply she was given a task to join the association of black communityin order to control it and hold the interests of white majorityWe need a deep inspection of Rachel Dolezals activities while she was apresident of the local branch of the Association of black people In order not torepeat similar cases in future we need a careful control of all appointments byblack community As it is there is a dominance of whites in policedepartments and authorities of cities with a predominantly black population,89.51,https://www.facebook.com/Black-Matters-1579673598947501/,676.0,47.0,06/15/15 07:22:20 AM PDT,,Baltimore Maryland Missouri Cleveland Ohio,Maryland Missouri Ohio,2015-06-15,Maryland
332,A woman pretended AfroAmerican to gain control over black communityassociationThe president of a local NAACP chapter in Spokane Washington is underinvestigation after her parents publicly accused her of lying being AfricanAmerican Both parents of Rachel Dolezal are white Rachel Dolezal alsoserves as the chair of Spokanes Office of Police Ombudsman Commissionand is an adjunct professor of Africana Studies at Eastern WashingtonUniversity Dolezal falsely identified herself as AfricanAmerican in order to beappointed as a chair Dolezals parents paid attention to the officialdocuments including a birth certificate confirming that Rachel is partSwedish Czech and German with traces of Native American heritageWe see how whites are trying to gain control over traditionally blackorganization that protects the rights and interests of the black community Inthe Dolezals case it is unlikely it was a mistake or personally motivatedfraud Simply she was given a task to join the association of black communityin order to control it and hold the interests of white majorityWe need a deep inspection of Rachel Dolezals activities while she was apresident of the local branch of the Association of black people In order not torepeat similar cases in future we need a careful control of all appointments byblack community As it is there is a dominance of whites in policedepartments and authorities of cities with a predominantly black population,89.51,https://www.facebook.com/Black-Matters-1579673598947501/,676.0,47.0,06/15/15 07:22:20 AM PDT,,Baltimore Maryland Missouri Cleveland Ohio,Maryland Missouri Ohio,2015-06-15,Missouri
332,A woman pretended AfroAmerican to gain control over black communityassociationThe president of a local NAACP chapter in Spokane Washington is underinvestigation after her parents publicly accused her of lying being AfricanAmerican Both parents of Rachel Dolezal are white Rachel Dolezal alsoserves as the chair of Spokanes Office of Police Ombudsman Commissionand is an adjunct professor of Africana Studies at Eastern WashingtonUniversity Dolezal falsely identified herself as AfricanAmerican in order to beappointed as a chair Dolezals parents paid attention to the officialdocuments including a birth certificate confirming that Rachel is partSwedish Czech and German with traces of Native American heritageWe see how whites are trying to gain control over traditionally blackorganization that protects the rights and interests of the black community Inthe Dolezals case it is unlikely it was a mistake or personally motivatedfraud Simply she was given a task to join the association of black communityin order to control it and hold the interests of white majorityWe need a deep inspection of Rachel Dolezals activities while she was apresident of the local branch of the Association of black people In order not torepeat similar cases in future we need a careful control of all appointments byblack community As it is there is a dominance of whites in policedepartments and authorities of cities with a predominantly black population,89.51,https://www.facebook.com/Black-Matters-1579673598947501/,676.0,47.0,06/15/15 07:22:20 AM PDT,,Baltimore Maryland Missouri Cleveland Ohio,Maryland Missouri Ohio,2015-06-15,Ohio
333,Pac believed in FightTupac Shakur was indeed not just one of the greatest rappers of all time but aworldly icon whose status in hiphop culture can never be replaced Hisrevolutionary knowledge mixed with street experience made him powerfulunstoppable force that spoke to the hearts of millions of people His songstouch on a number of engaging topics including religion women oppressionetc Pac was a humanitarian who stood up for those who couldnt stand upfor themselves He believed in Fight and Speaking the TruthNowadays a lot of singers both black and white use their music to sellrecords just for making money American society at all levels became toocorruptive starting from our government and ending with ordinary citizens Onthe contrary Tupac did his music to influence the world Thats why he spoketo issues of poverty oppression and racismToday young AfricanAmericans have fallen under bad influence of moneydrugs and so on Yeah it is all started from the governments attitudetowards Blacks But lets remember Tupac and his ability to question thesocial order Changes one of his popular songs asks everyone to changetheir lifestyles for better society He always asked people to share with eachother and to learn to love each other,174.4,https://www.facebook.com/Black-Matters-1579673598947501/,1075.0,47.0,06/16/15 07:36:57 AM PDT,,Baltimore Maryland Missouri Cleveland Ohio,Maryland Missouri Ohio,2015-06-16,Maryland
333,Pac believed in FightTupac Shakur was indeed not just one of the greatest rappers of all time but aworldly icon whose status in hiphop culture can never be replaced Hisrevolutionary knowledge mixed with street experience made him powerfulunstoppable force that spoke to the hearts of millions of people His songstouch on a number of engaging topics including religion women oppressionetc Pac was a humanitarian who stood up for those who couldnt stand upfor themselves He believed in Fight and Speaking the TruthNowadays a lot of singers both black and white use their music to sellrecords just for making money American society at all levels became toocorruptive starting from our government and ending with ordinary citizens Onthe contrary Tupac did his music to influence the world Thats why he spoketo issues of poverty oppression and racismToday young AfricanAmericans have fallen under bad influence of moneydrugs and so on Yeah it is all started from the governments attitudetowards Blacks But lets remember Tupac and his ability to question thesocial order Changes one of his popular songs asks everyone to changetheir lifestyles for better society He always asked people to share with eachother and to learn to love each other,174.4,https://www.facebook.com/Black-Matters-1579673598947501/,1075.0,47.0,06/16/15 07:36:57 AM PDT,,Baltimore Maryland Missouri Cleveland Ohio,Maryland Missouri Ohio,2015-06-16,Missouri
333,Pac believed in FightTupac Shakur was indeed not just one of the greatest rappers of all time but aworldly icon whose status in hiphop culture can never be replaced Hisrevolutionary knowledge mixed with street experience made him powerfulunstoppable force that spoke to the hearts of millions of people His songstouch on a number of engaging topics including religion women oppressionetc Pac was a humanitarian who stood up for those who couldnt stand upfor themselves He believed in Fight and Speaking the TruthNowadays a lot of singers both black and white use their music to sellrecords just for making money American society at all levels became toocorruptive starting from our government and ending with ordinary citizens Onthe contrary Tupac did his music to influence the world Thats why he spoketo issues of poverty oppression and racismToday young AfricanAmericans have fallen under bad influence of moneydrugs and so on Yeah it is all started from the governments attitudetowards Blacks But lets remember Tupac and his ability to question thesocial order Changes one of his popular songs asks everyone to changetheir lifestyles for better society He always asked people to share with eachother and to learn to love each other,174.4,https://www.facebook.com/Black-Matters-1579673598947501/,1075.0,47.0,06/16/15 07:36:57 AM PDT,,Baltimore Maryland Missouri Cleveland Ohio,Maryland Missouri Ohio,2015-06-16,Ohio
334,Today we celebrate the legendary rapper who ever lived Happy BdayTupacThe greatest of all time rapper is known not only for his music but for the wisewords he spoke and his strength in standing up against oppression His realname was Lesane Parish Crooks Shakur was onlyyears old at the timehe was shot and killed inHis killer has never been caught We willnever forget Pac Today we remember him on what wouldve been his thBirthday,90.07,https://www.facebook.com/Black-Matters-1579673598947501/,153.0,10.0,06/16/15 07:37:14 AM PDT,Black Matters  s                                      Black Matters,Baltimore Maryland Missouri Cleveland Ohio,Maryland Missouri Ohio,2015-06-16,Maryland
334,Today we celebrate the legendary rapper who ever lived Happy BdayTupacThe greatest of all time rapper is known not only for his music but for the wisewords he spoke and his strength in standing up against oppression His realname was Lesane Parish Crooks Shakur was onlyyears old at the timehe was shot and killed inHis killer has never been caught We willnever forget Pac Today we remember him on what wouldve been his thBirthday,90.07,https://www.facebook.com/Black-Matters-1579673598947501/,153.0,10.0,06/16/15 07:37:14 AM PDT,Black Matters  s                                      Black Matters,Baltimore Maryland Missouri Cleveland Ohio,Maryland Missouri Ohio,2015-06-16,Missouri
334,Today we celebrate the legendary rapper who ever lived Happy BdayTupacThe greatest of all time rapper is known not only for his music but for the wisewords he spoke and his strength in standing up against oppression His realname was Lesane Parish Crooks Shakur was onlyyears old at the timehe was shot and killed inHis killer has never been caught We willnever forget Pac Today we remember him on what wouldve been his thBirthday,90.07,https://www.facebook.com/Black-Matters-1579673598947501/,153.0,10.0,06/16/15 07:37:14 AM PDT,Black Matters  s                                      Black Matters,Baltimore Maryland Missouri Cleveland Ohio,Maryland Missouri Ohio,2015-06-16,Ohio
335,It is an American history AfricanAmerican citizens sat behind signs like theseon city buses,84.15,https://www.facebook.com/Black-Matters-1579673598947501/,476.0,26.0,06/16/15 08:20:31 AM PDT,,Baltimore Maryland Missouri Cleveland Ohio,Maryland Missouri Ohio,2015-06-16,Maryland
335,It is an American history AfricanAmerican citizens sat behind signs like theseon city buses,84.15,https://www.facebook.com/Black-Matters-1579673598947501/,476.0,26.0,06/16/15 08:20:31 AM PDT,,Baltimore Maryland Missouri Cleveland Ohio,Maryland Missouri Ohio,2015-06-16,Missouri
335,It is an American history AfricanAmerican citizens sat behind signs like theseon city buses,84.15,https://www.facebook.com/Black-Matters-1579673598947501/,476.0,26.0,06/16/15 08:20:31 AM PDT,,Baltimore Maryland Missouri Cleveland Ohio,Maryland Missouri Ohio,2015-06-16,Ohio
336,Americans so much effort to hate each other instead of putting the effort intodoing something useful Stop racism We all belong to ONE HUMAN RACE,175.37,https://www.facebook.com/Black-Matters-1579673598947501/,745.0,42.0,06/17/15 07:41:34 AM PDT,Black Matters  s                                      Black Matters,Baltimore Maryland Missouri Cleveland Ohio,Maryland Missouri Ohio,2015-06-17,Maryland
336,Americans so much effort to hate each other instead of putting the effort intodoing something useful Stop racism We all belong to ONE HUMAN RACE,175.37,https://www.facebook.com/Black-Matters-1579673598947501/,745.0,42.0,06/17/15 07:41:34 AM PDT,Black Matters  s                                      Black Matters,Baltimore Maryland Missouri Cleveland Ohio,Maryland Missouri Ohio,2015-06-17,Missouri
336,Americans so much effort to hate each other instead of putting the effort intodoing something useful Stop racism We all belong to ONE HUMAN RACE,175.37,https://www.facebook.com/Black-Matters-1579673598947501/,745.0,42.0,06/17/15 07:41:34 AM PDT,Black Matters  s                                      Black Matters,Baltimore Maryland Missouri Cleveland Ohio,Maryland Missouri Ohio,2015-06-17,Ohio
337,No national outrage for an incident at pool party where a black teen was shotto deathToday the pool party in Georgia is even more shocking than a recent poolparty in Texas A young man from Georgia was shot to death at a pool partyat Fayette It was an advertised on socialteenagers pool party whichended up with shootings of unknown assailant for unknown reasons One ofthe five injured a yearold black teenager Clanton passed away on theway to hospitalIn fact the media has not made a transparent effort to cover up the incidentWhy the pool party in Georgia is a silent story Why the police was not awareof a large party Why this story has no national outrage Is it ok when a blackteenager diesUnfortunately the responding police officers were not able to prevent thetragedy From these facts one might conclude police officers know theeasiest ways to arrest people but they are irresponsible to avoid theshootings at the average pool party,175.31,https://www.facebook.com/Black-Matters-1579673598947501/,746.0,23.0,06/17/15 07:41:07 AM PDT,Black Matters  s                                      Black Matters,Baltimore Maryland Missouri Cleveland Ohio,Maryland Missouri Ohio,2015-06-17,Maryland
337,No national outrage for an incident at pool party where a black teen was shotto deathToday the pool party in Georgia is even more shocking than a recent poolparty in Texas A young man from Georgia was shot to death at a pool partyat Fayette It was an advertised on socialteenagers pool party whichended up with shootings of unknown assailant for unknown reasons One ofthe five injured a yearold black teenager Clanton passed away on theway to hospitalIn fact the media has not made a transparent effort to cover up the incidentWhy the pool party in Georgia is a silent story Why the police was not awareof a large party Why this story has no national outrage Is it ok when a blackteenager diesUnfortunately the responding police officers were not able to prevent thetragedy From these facts one might conclude police officers know theeasiest ways to arrest people but they are irresponsible to avoid theshootings at the average pool party,175.31,https://www.facebook.com/Black-Matters-1579673598947501/,746.0,23.0,06/17/15 07:41:07 AM PDT,Black Matters  s                                      Black Matters,Baltimore Maryland Missouri Cleveland Ohio,Maryland Missouri Ohio,2015-06-17,Missouri
337,No national outrage for an incident at pool party where a black teen was shotto deathToday the pool party in Georgia is even more shocking than a recent poolparty in Texas A young man from Georgia was shot to death at a pool partyat Fayette It was an advertised on socialteenagers pool party whichended up with shootings of unknown assailant for unknown reasons One ofthe five injured a yearold black teenager Clanton passed away on theway to hospitalIn fact the media has not made a transparent effort to cover up the incidentWhy the pool party in Georgia is a silent story Why the police was not awareof a large party Why this story has no national outrage Is it ok when a blackteenager diesUnfortunately the responding police officers were not able to prevent thetragedy From these facts one might conclude police officers know theeasiest ways to arrest people but they are irresponsible to avoid theshootings at the average pool party,175.31,https://www.facebook.com/Black-Matters-1579673598947501/,746.0,23.0,06/17/15 07:41:07 AM PDT,Black Matters  s                                      Black Matters,Baltimore Maryland Missouri Cleveland Ohio,Maryland Missouri Ohio,2015-06-17,Ohio
338,A yearold child was tasered by cop for skateboardingA San Diego sheriffs deputy was filmed tasering yearold child in thespine for skateboarding Witnesses reported that the cop tried to force them todelete videos from their phones Videos show how the child writhes in agonyfrom being tased Police said that the child ran away from home and wasmissing for a dayandhalf However it doesnt give the reason to taser achildWe see another case of police misconduct when the policeman actuallyattacked the child This case should reach the court because the child hasntdone anything unlawful The policeman exceeded his powers and used forceagainst a child So he should be punished Before the trial nothings gonnachange and cops are about to do whatever they want The task of allAmericans who have witnessed police brutality is to extend all the informationabout it in order to reach out the government and the court,270.36,https://www.facebook.com/Black-Matters-1579673598947501/,1290.0,97.0,06/17/15 07:41:46 AM PDT,Black Matters  s                                      Black Matters,Baltimore Maryland Missouri Cleveland Ohio,Maryland Missouri Ohio,2015-06-17,Maryland
338,A yearold child was tasered by cop for skateboardingA San Diego sheriffs deputy was filmed tasering yearold child in thespine for skateboarding Witnesses reported that the cop tried to force them todelete videos from their phones Videos show how the child writhes in agonyfrom being tased Police said that the child ran away from home and wasmissing for a dayandhalf However it doesnt give the reason to taser achildWe see another case of police misconduct when the policeman actuallyattacked the child This case should reach the court because the child hasntdone anything unlawful The policeman exceeded his powers and used forceagainst a child So he should be punished Before the trial nothings gonnachange and cops are about to do whatever they want The task of allAmericans who have witnessed police brutality is to extend all the informationabout it in order to reach out the government and the court,270.36,https://www.facebook.com/Black-Matters-1579673598947501/,1290.0,97.0,06/17/15 07:41:46 AM PDT,Black Matters  s                                      Black Matters,Baltimore Maryland Missouri Cleveland Ohio,Maryland Missouri Ohio,2015-06-17,Missouri
338,A yearold child was tasered by cop for skateboardingA San Diego sheriffs deputy was filmed tasering yearold child in thespine for skateboarding Witnesses reported that the cop tried to force them todelete videos from their phones Videos show how the child writhes in agonyfrom being tased Police said that the child ran away from home and wasmissing for a dayandhalf However it doesnt give the reason to taser achildWe see another case of police misconduct when the policeman actuallyattacked the child This case should reach the court because the child hasntdone anything unlawful The policeman exceeded his powers and used forceagainst a child So he should be punished Before the trial nothings gonnachange and cops are about to do whatever they want The task of allAmericans who have witnessed police brutality is to extend all the informationabout it in order to reach out the government and the court,270.36,https://www.facebook.com/Black-Matters-1579673598947501/,1290.0,97.0,06/17/15 07:41:46 AM PDT,Black Matters  s                                      Black Matters,Baltimore Maryland Missouri Cleveland Ohio,Maryland Missouri Ohio,2015-06-17,Ohio
339,Onlydays this year nobody was killed by policeAccording to data from Mapping Police Violence there are onlydays thiscalendar year when nobody was killed by police in the USA Since Januaryat leastpeople have now been killed by policemen Moreoveranalyzing all deaths caused by police AfricanAmerican and Hispanic peopleare more likely to be killed than Whites Figures show that the index of deathsfor black people isper million while for whites it isper million,248.56,https://www.facebook.com/Black-Matters-1579673598947501/,1005.0,55.0,06/17/15 07:42:02 AM PDT,Black Matters  s                                      Black Matters,Baltimore Maryland Missouri Cleveland Ohio,Maryland Missouri Ohio,2015-06-17,Maryland
339,Onlydays this year nobody was killed by policeAccording to data from Mapping Police Violence there are onlydays thiscalendar year when nobody was killed by police in the USA Since Januaryat leastpeople have now been killed by policemen Moreoveranalyzing all deaths caused by police AfricanAmerican and Hispanic peopleare more likely to be killed than Whites Figures show that the index of deathsfor black people isper million while for whites it isper million,248.56,https://www.facebook.com/Black-Matters-1579673598947501/,1005.0,55.0,06/17/15 07:42:02 AM PDT,Black Matters  s                                      Black Matters,Baltimore Maryland Missouri Cleveland Ohio,Maryland Missouri Ohio,2015-06-17,Missouri
339,Onlydays this year nobody was killed by policeAccording to data from Mapping Police Violence there are onlydays thiscalendar year when nobody was killed by police in the USA Since Januaryat leastpeople have now been killed by policemen Moreoveranalyzing all deaths caused by police AfricanAmerican and Hispanic peopleare more likely to be killed than Whites Figures show that the index of deathsfor black people isper million while for whites it isper million,248.56,https://www.facebook.com/Black-Matters-1579673598947501/,1005.0,55.0,06/17/15 07:42:02 AM PDT,Black Matters  s                                      Black Matters,Baltimore Maryland Missouri Cleveland Ohio,Maryland Missouri Ohio,2015-06-17,Ohio
340,In early s this Black Americana Chocolate Eyes,169.47,https://www.facebook.com/Black-Matters-1579673598947501/,844.0,21.0,06/17/15 07:45:33 AM PDT,,Baltimore Maryland Missouri Cleveland Ohio,Maryland Missouri Ohio,2015-06-17,Maryland
340,In early s this Black Americana Chocolate Eyes,169.47,https://www.facebook.com/Black-Matters-1579673598947501/,844.0,21.0,06/17/15 07:45:33 AM PDT,,Baltimore Maryland Missouri Cleveland Ohio,Maryland Missouri Ohio,2015-06-17,Missouri
340,In early s this Black Americana Chocolate Eyes,169.47,https://www.facebook.com/Black-Matters-1579673598947501/,844.0,21.0,06/17/15 07:45:33 AM PDT,,Baltimore Maryland Missouri Cleveland Ohio,Maryland Missouri Ohio,2015-06-17,Ohio
341,Sadness and shocking tragedy at historically black church in CharlestoneCLICK TO GET LIVE UPDATES ON OUR PAGEA white gunman opened a fire at pastor andother church members at blackchurch in Charlestone S on Wednesday night The young cleanshavedshooter walked in during a prayer meeting and started shooting the peopleCharleston Police Chief Greg Mullen said that the incident would beinvestigated as hate crimeEmanuel AME Church is a historically AfricaAmerican church which wasfound by Denmark Vesey in order to organize a slave revolt inDespite the first black American president AfricaAmericans remain the mostcommon victims of hate crimes But what if the hate crime relates toxenophobia American xenophobia is based on the dominant white heritagethat is giving birth to another form of hate and discrimination These formstake another level of hate Unfortunately American tolerance is not what wethink it is US public is swapping patriotism for nationalism tolerance forIslamophobia racism and antiimmigrant sentiment For instance lastFebruary American gunman killed three young Muslims two miles away fromthe University of North Carolina campus Was this gunman motivated by hateand intolerance Should we expect for more hatecrimesWhat if American racial change still occurs through generations What of itracism happens due to unequal opportunities What if America is still adeeply racist country What if the church is not a safe place anymoreCharlestonShooting chsnews,1295.48,https://www.facebook.com/Black-Matters-1579673598947501/,5072.0,274.0,06/18/15 04:36:59 AM PDT,Black Matters  s                                      Black Matters,Baltimore Maryland Missouri Cleveland Ohio,Maryland Missouri Ohio,2015-06-18,Maryland
341,Sadness and shocking tragedy at historically black church in CharlestoneCLICK TO GET LIVE UPDATES ON OUR PAGEA white gunman opened a fire at pastor andother church members at blackchurch in Charlestone S on Wednesday night The young cleanshavedshooter walked in during a prayer meeting and started shooting the peopleCharleston Police Chief Greg Mullen said that the incident would beinvestigated as hate crimeEmanuel AME Church is a historically AfricaAmerican church which wasfound by Denmark Vesey in order to organize a slave revolt inDespite the first black American president AfricaAmericans remain the mostcommon victims of hate crimes But what if the hate crime relates toxenophobia American xenophobia is based on the dominant white heritagethat is giving birth to another form of hate and discrimination These formstake another level of hate Unfortunately American tolerance is not what wethink it is US public is swapping patriotism for nationalism tolerance forIslamophobia racism and antiimmigrant sentiment For instance lastFebruary American gunman killed three young Muslims two miles away fromthe University of North Carolina campus Was this gunman motivated by hateand intolerance Should we expect for more hatecrimesWhat if American racial change still occurs through generations What of itracism happens due to unequal opportunities What if America is still adeeply racist country What if the church is not a safe place anymoreCharlestonShooting chsnews,1295.48,https://www.facebook.com/Black-Matters-1579673598947501/,5072.0,274.0,06/18/15 04:36:59 AM PDT,Black Matters  s                                      Black Matters,Baltimore Maryland Missouri Cleveland Ohio,Maryland Missouri Ohio,2015-06-18,Missouri
341,Sadness and shocking tragedy at historically black church in CharlestoneCLICK TO GET LIVE UPDATES ON OUR PAGEA white gunman opened a fire at pastor andother church members at blackchurch in Charlestone S on Wednesday night The young cleanshavedshooter walked in during a prayer meeting and started shooting the peopleCharleston Police Chief Greg Mullen said that the incident would beinvestigated as hate crimeEmanuel AME Church is a historically AfricaAmerican church which wasfound by Denmark Vesey in order to organize a slave revolt inDespite the first black American president AfricaAmericans remain the mostcommon victims of hate crimes But what if the hate crime relates toxenophobia American xenophobia is based on the dominant white heritagethat is giving birth to another form of hate and discrimination These formstake another level of hate Unfortunately American tolerance is not what wethink it is US public is swapping patriotism for nationalism tolerance forIslamophobia racism and antiimmigrant sentiment For instance lastFebruary American gunman killed three young Muslims two miles away fromthe University of North Carolina campus Was this gunman motivated by hateand intolerance Should we expect for more hatecrimesWhat if American racial change still occurs through generations What of itracism happens due to unequal opportunities What if America is still adeeply racist country What if the church is not a safe place anymoreCharlestonShooting chsnews,1295.48,https://www.facebook.com/Black-Matters-1579673598947501/,5072.0,274.0,06/18/15 04:36:59 AM PDT,Black Matters  s                                      Black Matters,Baltimore Maryland Missouri Cleveland Ohio,Maryland Missouri Ohio,2015-06-18,Ohio
342,Rachel Dolezal is wearing the other persons shoesRachel Dolezal drew attention to her racial identification A whiteborn formerNAACP leader claimed to be black The criticism towards Dolezal stemscontroversy around her identity and her position as the president of theNAACP in Washington Today Dolezal sees herself as first transracialRachel Dolezal stated that her racial identity was black American Indianwhite and two more races Moreover if she proves that she is black thananyone else will be able to prove that heshe is not even a human beingWhat do you think about her What kind of rights should she have,199.94,https://www.facebook.com/Black-Matters-1579673598947501/,866.0,46.0,06/18/15 02:50:25 AM PDT,Black Matters  s                                      Black Matters,Baltimore Maryland Missouri Cleveland Ohio,Maryland Missouri Ohio,2015-06-18,Maryland
342,Rachel Dolezal is wearing the other persons shoesRachel Dolezal drew attention to her racial identification A whiteborn formerNAACP leader claimed to be black The criticism towards Dolezal stemscontroversy around her identity and her position as the president of theNAACP in Washington Today Dolezal sees herself as first transracialRachel Dolezal stated that her racial identity was black American Indianwhite and two more races Moreover if she proves that she is black thananyone else will be able to prove that heshe is not even a human beingWhat do you think about her What kind of rights should she have,199.94,https://www.facebook.com/Black-Matters-1579673598947501/,866.0,46.0,06/18/15 02:50:25 AM PDT,Black Matters  s                                      Black Matters,Baltimore Maryland Missouri Cleveland Ohio,Maryland Missouri Ohio,2015-06-18,Missouri
342,Rachel Dolezal is wearing the other persons shoesRachel Dolezal drew attention to her racial identification A whiteborn formerNAACP leader claimed to be black The criticism towards Dolezal stemscontroversy around her identity and her position as the president of theNAACP in Washington Today Dolezal sees herself as first transracialRachel Dolezal stated that her racial identity was black American Indianwhite and two more races Moreover if she proves that she is black thananyone else will be able to prove that heshe is not even a human beingWhat do you think about her What kind of rights should she have,199.94,https://www.facebook.com/Black-Matters-1579673598947501/,866.0,46.0,06/18/15 02:50:25 AM PDT,Black Matters  s                                      Black Matters,Baltimore Maryland Missouri Cleveland Ohio,Maryland Missouri Ohio,2015-06-18,Ohio
343,The violent pool storyWhite police officer slammed black teen against hiscarThis black family from Ohio will never forget the June th According to thefamilys testimony Krystal Dixon and her sister Maya Dixon took their eightchildren nephews and nieces to Ohio public school in a FairfieldNevertheless the pool employee demanded the family to leave due to one ofthe children did not have swim trunks One of the boys broke the rules andthe staff asked the family to leave As sixmonths pregnant Krystal Dixonwalked to the parking lot the police officer grabbed her arm and asked for anIDcard The witness video shows how the police officer pepper sprayedDixons family and grabbed yearold child by neck But according to theFairfield police department the white police officer did not use excessiveforceDid the pool staff force them to leave because they were black Was it a racefactor Dont you think the police officers attempt to arrest Krystal Dixon wasunlawful How the police officers should be charged What kind of right ofdefense do you have against unlawful arrestsThese days there is far more to being a good cop than choosing not to hurtinnocent people Plus when are we going to stop being stereotypical Eventoday the stereotypes effect black population of the United States of Americatransmitted through music lyrics titles literature movies and folk sayingWhite Americans across the country embrace AfricanAmericans the image ofcriminals and looters How are we going to live with that,91.73,https://www.facebook.com/Black-Matters-1 579673598947501/,441.0,31.0,06/18/15 07:21:41 AM PDT,Black Matters  s                                      Black Matters,Baltimore Maryland Missouri Cleveland Ohio,Maryland Missouri Ohio,2015-06-18,Maryland
343,The violent pool storyWhite police officer slammed black teen against hiscarThis black family from Ohio will never forget the June th According to thefamilys testimony Krystal Dixon and her sister Maya Dixon took their eightchildren nephews and nieces to Ohio public school in a FairfieldNevertheless the pool employee demanded the family to leave due to one ofthe children did not have swim trunks One of the boys broke the rules andthe staff asked the family to leave As sixmonths pregnant Krystal Dixonwalked to the parking lot the police officer grabbed her arm and asked for anIDcard The witness video shows how the police officer pepper sprayedDixons family and grabbed yearold child by neck But according to theFairfield police department the white police officer did not use excessiveforceDid the pool staff force them to leave because they were black Was it a racefactor Dont you think the police officers attempt to arrest Krystal Dixon wasunlawful How the police officers should be charged What kind of right ofdefense do you have against unlawful arrestsThese days there is far more to being a good cop than choosing not to hurtinnocent people Plus when are we going to stop being stereotypical Eventoday the stereotypes effect black population of the United States of Americatransmitted through music lyrics titles literature movies and folk sayingWhite Americans across the country embrace AfricanAmericans the image ofcriminals and looters How are we going to live with that,91.73,https://www.facebook.com/Black-Matters-1 579673598947501/,441.0,31.0,06/18/15 07:21:41 AM PDT,Black Matters  s                                      Black Matters,Baltimore Maryland Missouri Cleveland Ohio,Maryland Missouri Ohio,2015-06-18,Missouri
343,The violent pool storyWhite police officer slammed black teen against hiscarThis black family from Ohio will never forget the June th According to thefamilys testimony Krystal Dixon and her sister Maya Dixon took their eightchildren nephews and nieces to Ohio public school in a FairfieldNevertheless the pool employee demanded the family to leave due to one ofthe children did not have swim trunks One of the boys broke the rules andthe staff asked the family to leave As sixmonths pregnant Krystal Dixonwalked to the parking lot the police officer grabbed her arm and asked for anIDcard The witness video shows how the police officer pepper sprayedDixons family and grabbed yearold child by neck But according to theFairfield police department the white police officer did not use excessiveforceDid the pool staff force them to leave because they were black Was it a racefactor Dont you think the police officers attempt to arrest Krystal Dixon wasunlawful How the police officers should be charged What kind of right ofdefense do you have against unlawful arrestsThese days there is far more to being a good cop than choosing not to hurtinnocent people Plus when are we going to stop being stereotypical Eventoday the stereotypes effect black population of the United States of Americatransmitted through music lyrics titles literature movies and folk sayingWhite Americans across the country embrace AfricanAmericans the image ofcriminals and looters How are we going to live with that,91.73,https://www.facebook.com/Black-Matters-1 579673598947501/,441.0,31.0,06/18/15 07:21:41 AM PDT,Black Matters  s                                      Black Matters,Baltimore Maryland Missouri Cleveland Ohio,Maryland Missouri Ohio,2015-06-18,Ohio
344,What else has to happen for you all to realize black lives matter,173.92,https://www.facebook.com/Black-Matters-1579673598947501/,708.0,59.0,06/23/15 07:41:01 AM PDT,Black Matters  s                                      Black Matters,Baltimore Maryland Missouri Cleveland Ohio,Maryland Missouri Ohio,2015-06-23,Maryland
344,What else has to happen for you all to realize black lives matter,173.92,https://www.facebook.com/Black-Matters-1579673598947501/,708.0,59.0,06/23/15 07:41:01 AM PDT,Black Matters  s                                      Black Matters,Baltimore Maryland Missouri Cleveland Ohio,Maryland Missouri Ohio,2015-06-23,Missouri
344,What else has to happen for you all to realize black lives matter,173.92,https://www.facebook.com/Black-Matters-1579673598947501/,708.0,59.0,06/23/15 07:41:01 AM PDT,Black Matters  s                                      Black Matters,Baltimore Maryland Missouri Cleveland Ohio,Maryland Missouri Ohio,2015-06-23,Ohio
345,Thousands Walk Hand In Hand Across Ravenel Bridge To Show Support ForMother Emanuel ChurchOn Sunday evening hours after Emanuel AME Church opened its doors forthe first service following the killing of nine of its congregants Wednesdaythousands in Charleston took to the streets in a show of support andsolidarityObservers on the bridge and thousands more at the base joined hands tocreate a unity chain then held a moment of silence that lasted five minutesin honor of the fallenPolice estimated thattotook part in Sundays gatheringaccording to the Post and Courier Cars drove slowly past the bridge taking inthe sight and honking horns in solidarity as people chanted CharlestonstrongThroughout history people start to unite only when they face danger or whentheyre in times of great sorrow Modern America is accustomed to meet onlyimaginary dangers however Americans are getting more and more reasonsto sorrow over something day by dayDoes it mean that the key to the unity ofmillion Americans is constantfear and unending sorrow Does it mean that only this can make Americansunite and forget about the infighting and differences Unfortunately yes itdoes,258.89,https://www.facebook.com/Black-Matters-1579673598947501/,759.0,48.0,06/23/15 07:41:21 AM PDT,Black Matters  s                                      Black Matters,Baltimore Maryland Missouri Cleveland Ohio,Maryland Missouri Ohio,2015-06-23,Maryland
345,Thousands Walk Hand In Hand Across Ravenel Bridge To Show Support ForMother Emanuel ChurchOn Sunday evening hours after Emanuel AME Church opened its doors forthe first service following the killing of nine of its congregants Wednesdaythousands in Charleston took to the streets in a show of support andsolidarityObservers on the bridge and thousands more at the base joined hands tocreate a unity chain then held a moment of silence that lasted five minutesin honor of the fallenPolice estimated thattotook part in Sundays gatheringaccording to the Post and Courier Cars drove slowly past the bridge taking inthe sight and honking horns in solidarity as people chanted CharlestonstrongThroughout history people start to unite only when they face danger or whentheyre in times of great sorrow Modern America is accustomed to meet onlyimaginary dangers however Americans are getting more and more reasonsto sorrow over something day by dayDoes it mean that the key to the unity ofmillion Americans is constantfear and unending sorrow Does it mean that only this can make Americansunite and forget about the infighting and differences Unfortunately yes itdoes,258.89,https://www.facebook.com/Black-Matters-1579673598947501/,759.0,48.0,06/23/15 07:41:21 AM PDT,Black Matters  s                                      Black Matters,Baltimore Maryland Missouri Cleveland Ohio,Maryland Missouri Ohio,2015-06-23,Missouri
345,Thousands Walk Hand In Hand Across Ravenel Bridge To Show Support ForMother Emanuel ChurchOn Sunday evening hours after Emanuel AME Church opened its doors forthe first service following the killing of nine of its congregants Wednesdaythousands in Charleston took to the streets in a show of support andsolidarityObservers on the bridge and thousands more at the base joined hands tocreate a unity chain then held a moment of silence that lasted five minutesin honor of the fallenPolice estimated thattotook part in Sundays gatheringaccording to the Post and Courier Cars drove slowly past the bridge taking inthe sight and honking horns in solidarity as people chanted CharlestonstrongThroughout history people start to unite only when they face danger or whentheyre in times of great sorrow Modern America is accustomed to meet onlyimaginary dangers however Americans are getting more and more reasonsto sorrow over something day by dayDoes it mean that the key to the unity ofmillion Americans is constantfear and unending sorrow Does it mean that only this can make Americansunite and forget about the infighting and differences Unfortunately yes itdoes,258.89,https://www.facebook.com/Black-Matters-1579673598947501/,759.0,48.0,06/23/15 07:41:21 AM PDT,Black Matters  s                                      Black Matters,Baltimore Maryland Missouri Cleveland Ohio,Maryland Missouri Ohio,2015-06-23,Ohio
346,Whatever the white man has done Black Americans have done and ofteneven betterMiss Black America in,174.35,https://www.facebook.com/Black-Matters-1579673598947501/,757.0,65.0,06/23/15 07:41:58 AM PDT,Black Matters  s                                      Black Matters,Baltimore Maryland Missouri Cleveland Ohio,Maryland Missouri Ohio,2015-06-23,Maryland
346,Whatever the white man has done Black Americans have done and ofteneven betterMiss Black America in,174.35,https://www.facebook.com/Black-Matters-1579673598947501/,757.0,65.0,06/23/15 07:41:58 AM PDT,Black Matters  s                                      Black Matters,Baltimore Maryland Missouri Cleveland Ohio,Maryland Missouri Ohio,2015-06-23,Missouri
346,Whatever the white man has done Black Americans have done and ofteneven betterMiss Black America in,174.35,https://www.facebook.com/Black-Matters-1579673598947501/,757.0,65.0,06/23/15 07:41:58 AM PDT,Black Matters  s                                      Black Matters,Baltimore Maryland Missouri Cleveland Ohio,Maryland Missouri Ohio,2015-06-23,Ohio
347,How many of you believe in Black JesusThere is quite a big number of people arguing about ethnicity of Jesus ChristWas Jesus white oliveskinned or black The Coptic Museum in Cairo Egyptowns the earliest painting of Jesus Christ in the Church of Rome th centurywhere skin color of Jesus was black,174.26,https://www.facebook.com/Black-Matters-1579673598947501/,581.0,57.0,06/23/15 07:42:12 AM PDT,Black Matters  s                                      Black Matters,Baltimore Maryland Missouri Cleveland Ohio,Maryland Missouri Ohio,2015-06-23,Maryland
347,How many of you believe in Black JesusThere is quite a big number of people arguing about ethnicity of Jesus ChristWas Jesus white oliveskinned or black The Coptic Museum in Cairo Egyptowns the earliest painting of Jesus Christ in the Church of Rome th centurywhere skin color of Jesus was black,174.26,https://www.facebook.com/Black-Matters-1579673598947501/,581.0,57.0,06/23/15 07:42:12 AM PDT,Black Matters  s                                      Black Matters,Baltimore Maryland Missouri Cleveland Ohio,Maryland Missouri Ohio,2015-06-23,Missouri
347,How many of you believe in Black JesusThere is quite a big number of people arguing about ethnicity of Jesus ChristWas Jesus white oliveskinned or black The Coptic Museum in Cairo Egyptowns the earliest painting of Jesus Christ in the Church of Rome th centurywhere skin color of Jesus was black,174.26,https://www.facebook.com/Black-Matters-1579673598947501/,581.0,57.0,06/23/15 07:42:12 AM PDT,Black Matters  s                                      Black Matters,Baltimore Maryland Missouri Cleveland Ohio,Maryland Missouri Ohio,2015-06-23,Ohio
348,Black is beautiful God knows what he is doing The Black skin is a glorioussymbol of national greatness,174.02,https://www.facebook.com/Black-Matters-1579673598947501/,796.0,74.0,06/23/15 07:42:35 AM PDT,Black Matters  s                                      Black Matters,Baltimore Maryland Missouri Cleveland Ohio,Maryland Missouri Ohio,2015-06-23,Maryland
348,Black is beautiful God knows what he is doing The Black skin is a glorioussymbol of national greatness,174.02,https://www.facebook.com/Black-Matters-1579673598947501/,796.0,74.0,06/23/15 07:42:35 AM PDT,Black Matters  s                                      Black Matters,Baltimore Maryland Missouri Cleveland Ohio,Maryland Missouri Ohio,2015-06-23,Missouri
348,Black is beautiful God knows what he is doing The Black skin is a glorioussymbol of national greatness,174.02,https://www.facebook.com/Black-Matters-1579673598947501/,796.0,74.0,06/23/15 07:42:35 AM PDT,Black Matters  s                                      Black Matters,Baltimore Maryland Missouri Cleveland Ohio,Maryland Missouri Ohio,2015-06-23,Ohio
349,A small group of activists burned two confederate flags in response toshooting in Charleston South CarolinaWhy the symbol of the proslavery rebellion is still flying on the ground ofSouth Carolina Why the symbol of white supremacy is still flying on theSouth Carolina statehouse in Columbia Why the flag that represents themurder of blacks was not removed from the national statehouseThe confederate flag represents terrorism reminding us about the slaverytime racism and people that were murdered in a hatecrime Today we askto remove this symbol of racism that fliesmiles away from the EmanuelAfrican Methodist Episcopal Church in CharlestonYes we must wipe off every single symbol of racism from the United States ofAmerica including the confederate flag KKK and other racist organizationsWe must give new names to the streets which were named after racistpolitical figures and slave traders We must remove monuments dedicated toAndrew Jackson Robert Lee Benjamin Huger James Longstreet who ownedslaves on their farmsHow can we ever expect to get the racist symbols removed until we showourselves to be men the same as any other race of men,174.75,https://www.facebook.com/Black-Matters-1 579673598947501/,412.0,23.0,06/23/15 07:42:57 AM PDT,Black Matters  s                                      Black Matters,Baltimore Maryland Missouri Cleveland Ohio,Maryland Missouri Ohio,2015-06-23,Maryland
349,A small group of activists burned two confederate flags in response toshooting in Charleston South CarolinaWhy the symbol of the proslavery rebellion is still flying on the ground ofSouth Carolina Why the symbol of white supremacy is still flying on theSouth Carolina statehouse in Columbia Why the flag that represents themurder of blacks was not removed from the national statehouseThe confederate flag represents terrorism reminding us about the slaverytime racism and people that were murdered in a hatecrime Today we askto remove this symbol of racism that fliesmiles away from the EmanuelAfrican Methodist Episcopal Church in CharlestonYes we must wipe off every single symbol of racism from the United States ofAmerica including the confederate flag KKK and other racist organizationsWe must give new names to the streets which were named after racistpolitical figures and slave traders We must remove monuments dedicated toAndrew Jackson Robert Lee Benjamin Huger James Longstreet who ownedslaves on their farmsHow can we ever expect to get the racist symbols removed until we showourselves to be men the same as any other race of men,174.75,https://www.facebook.com/Black-Matters-1 579673598947501/,412.0,23.0,06/23/15 07:42:57 AM PDT,Black Matters  s                                      Black Matters,Baltimore Maryland Missouri Cleveland Ohio,Maryland Missouri Ohio,2015-06-23,Missouri
349,A small group of activists burned two confederate flags in response toshooting in Charleston South CarolinaWhy the symbol of the proslavery rebellion is still flying on the ground ofSouth Carolina Why the symbol of white supremacy is still flying on theSouth Carolina statehouse in Columbia Why the flag that represents themurder of blacks was not removed from the national statehouseThe confederate flag represents terrorism reminding us about the slaverytime racism and people that were murdered in a hatecrime Today we askto remove this symbol of racism that fliesmiles away from the EmanuelAfrican Methodist Episcopal Church in CharlestonYes we must wipe off every single symbol of racism from the United States ofAmerica including the confederate flag KKK and other racist organizationsWe must give new names to the streets which were named after racistpolitical figures and slave traders We must remove monuments dedicated toAndrew Jackson Robert Lee Benjamin Huger James Longstreet who ownedslaves on their farmsHow can we ever expect to get the racist symbols removed until we showourselves to be men the same as any other race of men,174.75,https://www.facebook.com/Black-Matters-1 579673598947501/,412.0,23.0,06/23/15 07:42:57 AM PDT,Black Matters  s                                      Black Matters,Baltimore Maryland Missouri Cleveland Ohio,Maryland Missouri Ohio,2015-06-23,Ohio
350,Whats life of black American today How equal are weHave you ever been hurt by aggressive police officers because of your raceWhats your storyTake an action and tell us your story and we post it on Black Matters Wedont want our community to continue struggling with racism and policeaggression We want to fight back and to show how strong we are,188.85,https://www.facebook.com/Black-Matters-1579673598947501/,504.0,42.0,07/10/15 05:42:38 AM PDT,Black Matters  s                                      Black Matters,Baltimore Maryland Missouri Cleveland Ohio,Maryland Missouri Ohio,2015-07-10,Maryland
350,Whats life of black American today How equal are weHave you ever been hurt by aggressive police officers because of your raceWhats your storyTake an action and tell us your story and we post it on Black Matters Wedont want our community to continue struggling with racism and policeaggression We want to fight back and to show how strong we are,188.85,https://www.facebook.com/Black-Matters-1579673598947501/,504.0,42.0,07/10/15 05:42:38 AM PDT,Black Matters  s                                      Black Matters,Baltimore Maryland Missouri Cleveland Ohio,Maryland Missouri Ohio,2015-07-10,Missouri
350,Whats life of black American today How equal are weHave you ever been hurt by aggressive police officers because of your raceWhats your storyTake an action and tell us your story and we post it on Black Matters Wedont want our community to continue struggling with racism and policeaggression We want to fight back and to show how strong we are,188.85,https://www.facebook.com/Black-Matters-1579673598947501/,504.0,42.0,07/10/15 05:42:38 AM PDT,Black Matters  s                                      Black Matters,Baltimore Maryland Missouri Cleveland Ohio,Maryland Missouri Ohio,2015-07-10,Ohio
351,Even kids realize that black lives matter Why are adults so blind then Racialinequality should be stopped by any means,116.2,https://www.facebook.com/Black-Matters-1579673598947501/,506.0,50.0,07/10/15 05:43:10 AM PDT,Black Matters  s                                      Black Matters,Baltimore Maryland Missouri Cleveland Ohio,Maryland Missouri Ohio,2015-07-10,Maryland
351,Even kids realize that black lives matter Why are adults so blind then Racialinequality should be stopped by any means,116.2,https://www.facebook.com/Black-Matters-1579673598947501/,506.0,50.0,07/10/15 05:43:10 AM PDT,Black Matters  s                                      Black Matters,Baltimore Maryland Missouri Cleveland Ohio,Maryland Missouri Ohio,2015-07-10,Missouri
351,Even kids realize that black lives matter Why are adults so blind then Racialinequality should be stopped by any means,116.2,https://www.facebook.com/Black-Matters-1579673598947501/,506.0,50.0,07/10/15 05:43:10 AM PDT,Black Matters  s                                      Black Matters,Baltimore Maryland Missouri Cleveland Ohio,Maryland Missouri Ohio,2015-07-10,Ohio
352,Dont tell us race isnt the issueDont tell us the system worksStop being blind people,117.17,https://www.facebook.com/Black-Matters-1579673598947501/,402.0,47.0,07/10/15 05:43:31 AM PDT,Black Matters  s                                      Black Matters,Baltimore Maryland Missouri Cleveland Ohio,Maryland Missouri Ohio,2015-07-10,Maryland
352,Dont tell us race isnt the issueDont tell us the system worksStop being blind people,117.17,https://www.facebook.com/Black-Matters-1579673598947501/,402.0,47.0,07/10/15 05:43:31 AM PDT,Black Matters  s                                      Black Matters,Baltimore Maryland Missouri Cleveland Ohio,Maryland Missouri Ohio,2015-07-10,Missouri
352,Dont tell us race isnt the issueDont tell us the system worksStop being blind people,117.17,https://www.facebook.com/Black-Matters-1579673598947501/,402.0,47.0,07/10/15 05:43:31 AM PDT,Black Matters  s                                      Black Matters,Baltimore Maryland Missouri Cleveland Ohio,Maryland Missouri Ohio,2015-07-10,Ohio
353,Nothing really changes Everything remains the sameBeing black is awesome its being black in America that sucks,90.36,https://www.facebook.com/Black-Matters-1579673598947501/,327.0,46.0,07/10/15 05:43:55 AM PDT,Black Matters  s                                      Black Matters,Baltimore Maryland Missouri Cleveland Ohio,Maryland Missouri Ohio,2015-07-10,Maryland
353,Nothing really changes Everything remains the sameBeing black is awesome its being black in America that sucks,90.36,https://www.facebook.com/Black-Matters-1579673598947501/,327.0,46.0,07/10/15 05:43:55 AM PDT,Black Matters  s                                      Black Matters,Baltimore Maryland Missouri Cleveland Ohio,Maryland Missouri Ohio,2015-07-10,Missouri
353,Nothing really changes Everything remains the sameBeing black is awesome its being black in America that sucks,90.36,https://www.facebook.com/Black-Matters-1579673598947501/,327.0,46.0,07/10/15 05:43:55 AM PDT,Black Matters  s                                      Black Matters,Baltimore Maryland Missouri Cleveland Ohio,Maryland Missouri Ohio,2015-07-10,Ohio
354,There are people who generally believe racism is over but minorities believethat theres a lot of racial discrimination in the United States of AmericaThousands of African Americans experience discrimination due to inequalitywhich results cultural failure and racial pathology Do you realize that racismsits at the very core of American thinking,146.63,https://www.facebook.com/Black-Matters-1579673598947501/,281.0,24.0,07/10/15 05:44:38 AM PDT,Black Matters  s                                      Black Matters,Baltimore Maryland Missouri Cleveland Ohio,Maryland Missouri Ohio,2015-07-10,Maryland
354,There are people who generally believe racism is over but minorities believethat theres a lot of racial discrimination in the United States of AmericaThousands of African Americans experience discrimination due to inequalitywhich results cultural failure and racial pathology Do you realize that racismsits at the very core of American thinking,146.63,https://www.facebook.com/Black-Matters-1579673598947501/,281.0,24.0,07/10/15 05:44:38 AM PDT,Black Matters  s                                      Black Matters,Baltimore Maryland Missouri Cleveland Ohio,Maryland Missouri Ohio,2015-07-10,Missouri
354,There are people who generally believe racism is over but minorities believethat theres a lot of racial discrimination in the United States of AmericaThousands of African Americans experience discrimination due to inequalitywhich results cultural failure and racial pathology Do you realize that racismsits at the very core of American thinking,146.63,https://www.facebook.com/Black-Matters-1579673598947501/,281.0,24.0,07/10/15 05:44:38 AM PDT,Black Matters  s                                      Black Matters,Baltimore Maryland Missouri Cleveland Ohio,Maryland Missouri Ohio,2015-07-10,Ohio
355,Keep calm and remember your roots Dont let the government to take it awayfrom you,67.76,https://www.facebook.com/Black-Matters-1579673598947501/,345.0,47.0,07/10/15 05:44:21 AM PDT,Black Matters  s                                      Black Matters,Baltimore Maryland Missouri Cleveland Ohio,Maryland Missouri Ohio,2015-07-10,Maryland
355,Keep calm and remember your roots Dont let the government to take it awayfrom you,67.76,https://www.facebook.com/Black-Matters-1579673598947501/,345.0,47.0,07/10/15 05:44:21 AM PDT,Black Matters  s                                      Black Matters,Baltimore Maryland Missouri Cleveland Ohio,Maryland Missouri Ohio,2015-07-10,Missouri
355,Keep calm and remember your roots Dont let the government to take it awayfrom you,67.76,https://www.facebook.com/Black-Matters-1579673598947501/,345.0,47.0,07/10/15 05:44:21 AM PDT,Black Matters  s                                      Black Matters,Baltimore Maryland Missouri Cleveland Ohio,Maryland Missouri Ohio,2015-07-10,Ohio
357,McKinney Police Officer Involved In Pool Party IncidentEric Casebolt the McKinney police officer who was caught on video pinninga teenage girl to the ground and pulling his gun on others at a pool party hasresigned Tuesday eveningThe McKinney Police Department Chief Of Police Greg Conley said thatCasebolts decision to leave was voluntary and that he would continue tocollect a pension and benefitsWhy are the police so aggressive Its in every state around the country Theyoung girl at the pool party was treated horrible Our society needs policegood police people who will solve crimes but unfortunately today we needsomeone who will protect us from the police At the same time it is good thatmillions of regular people got a glimpse of what kind of policing minoritieshave endured for decades,85.25,https://www.facebook.com/Black-Matters-1579673598947501/,559.0,12.0,06/10/15 07:31:35 AM PDT,,Baltimore Maryland Missouri Cleveland Ohio,Maryland Missouri Ohio,2015-06-10,Maryland
357,McKinney Police Officer Involved In Pool Party IncidentEric Casebolt the McKinney police officer who was caught on video pinninga teenage girl to the ground and pulling his gun on others at a pool party hasresigned Tuesday eveningThe McKinney Police Department Chief Of Police Greg Conley said thatCasebolts decision to leave was voluntary and that he would continue tocollect a pension and benefitsWhy are the police so aggressive Its in every state around the country Theyoung girl at the pool party was treated horrible Our society needs policegood police people who will solve crimes but unfortunately today we needsomeone who will protect us from the police At the same time it is good thatmillions of regular people got a glimpse of what kind of policing minoritieshave endured for decades,85.25,https://www.facebook.com/Black-Matters-1579673598947501/,559.0,12.0,06/10/15 07:31:35 AM PDT,,Baltimore Maryland Missouri Cleveland Ohio,Maryland Missouri Ohio,2015-06-10,Missouri
357,McKinney Police Officer Involved In Pool Party IncidentEric Casebolt the McKinney police officer who was caught on video pinninga teenage girl to the ground and pulling his gun on others at a pool party hasresigned Tuesday eveningThe McKinney Police Department Chief Of Police Greg Conley said thatCasebolts decision to leave was voluntary and that he would continue tocollect a pension and benefitsWhy are the police so aggressive Its in every state around the country Theyoung girl at the pool party was treated horrible Our society needs policegood police people who will solve crimes but unfortunately today we needsomeone who will protect us from the police At the same time it is good thatmillions of regular people got a glimpse of what kind of policing minoritieshave endured for decades,85.25,https://www.facebook.com/Black-Matters-1579673598947501/,559.0,12.0,06/10/15 07:31:35 AM PDT,,Baltimore Maryland Missouri Cleveland Ohio,Maryland Missouri Ohio,2015-06-10,Ohio
358,Say it loudI am Black and Im proud,94.04,https://www.facebook.com/Black-Matters-1579673598947501/,635.0,45.0,06/10/15 07:34:31 AM PDT,,Baltimore Maryland Missouri Cleveland Ohio,Maryland Missouri Ohio,2015-06-10,Maryland
358,Say it loudI am Black and Im proud,94.04,https://www.facebook.com/Black-Matters-1579673598947501/,635.0,45.0,06/10/15 07:34:31 AM PDT,,Baltimore Maryland Missouri Cleveland Ohio,Maryland Missouri Ohio,2015-06-10,Missouri
358,Say it loudI am Black and Im proud,94.04,https://www.facebook.com/Black-Matters-1579673598947501/,635.0,45.0,06/10/15 07:34:31 AM PDT,,Baltimore Maryland Missouri Cleveland Ohio,Maryland Missouri Ohio,2015-06-10,Ohio
359,Police Charges Black Student For Driving To A Welllit AreaLast time I checked US wasnt involved in any wars or antiterroristoperations at least officially Well then how come Detroit is no lessdangerous then the city ranks third in the list of topUS most dangerouscitiesWhen yearold DaJuawn Wallace saw flashing blue police lights in hisrearview mirror he chose to proceed with caution since some people areknown to be robbed by fake police officers He preferred to find a welllit areato pull over in As a result he was charged with fleeing policePeople are terrified by the police to such a degree that they even prefer tocommunicate with officers only in the welllit areas And get charged for thatSometimes it makes me actually think that when not involved in any militaryoperations in the foreign countries our countrys at war with its own citizenswith the help of police,180.82,https://www.facebook.com/Black-Matters-1579673598947501/,1078.0,139.0,07/10/15 05:45:02 AM PDT,Black Matters  s                                      Black Matters,Baltimore Maryland Missouri Cleveland Ohio,Maryland Missouri Ohio,2015-07-10,Maryland
359,Police Charges Black Student For Driving To A Welllit AreaLast time I checked US wasnt involved in any wars or antiterroristoperations at least officially Well then how come Detroit is no lessdangerous then the city ranks third in the list of topUS most dangerouscitiesWhen yearold DaJuawn Wallace saw flashing blue police lights in hisrearview mirror he chose to proceed with caution since some people areknown to be robbed by fake police officers He preferred to find a welllit areato pull over in As a result he was charged with fleeing policePeople are terrified by the police to such a degree that they even prefer tocommunicate with officers only in the welllit areas And get charged for thatSometimes it makes me actually think that when not involved in any militaryoperations in the foreign countries our countrys at war with its own citizenswith the help of police,180.82,https://www.facebook.com/Black-Matters-1579673598947501/,1078.0,139.0,07/10/15 05:45:02 AM PDT,Black Matters  s                                      Black Matters,Baltimore Maryland Missouri Cleveland Ohio,Maryland Missouri Ohio,2015-07-10,Missouri
359,Police Charges Black Student For Driving To A Welllit AreaLast time I checked US wasnt involved in any wars or antiterroristoperations at least officially Well then how come Detroit is no lessdangerous then the city ranks third in the list of topUS most dangerouscitiesWhen yearold DaJuawn Wallace saw flashing blue police lights in hisrearview mirror he chose to proceed with caution since some people areknown to be robbed by fake police officers He preferred to find a welllit areato pull over in As a result he was charged with fleeing policePeople are terrified by the police to such a degree that they even prefer tocommunicate with officers only in the welllit areas And get charged for thatSometimes it makes me actually think that when not involved in any militaryoperations in the foreign countries our countrys at war with its own citizenswith the help of police,180.82,https://www.facebook.com/Black-Matters-1579673598947501/,1078.0,139.0,07/10/15 05:45:02 AM PDT,Black Matters  s                                      Black Matters,Baltimore Maryland Missouri Cleveland Ohio,Maryland Missouri Ohio,2015-07-10,Ohio
360,Keeping eye on our brothers cases and much more,0.0,https://www.facebook.com/blackmattersus,0.0,0.0,06/10/15 03:01:20 AM PDT,people who like Black Matters,Baltimore Maryland Missouri,Maryland Missouri,2015-06-10,Maryland
360,Keeping eye on our brothers cases and much more,0.0,https://www.facebook.com/blackmattersus,0.0,0.0,06/10/15 03:01:20 AM PDT,people who like Black Matters,Baltimore Maryland Missouri,Maryland Missouri,2015-06-10,Missouri
361,Keeping eye on our brothers cases and much more,34.66,https://www.facebook.com/blackmattersus/,82.0,5.0,06/10/15 03:20:43 AM PDT,people who like Black Matters,Baltimore Maryland Missouri,Maryland Missouri,2015-06-10,Maryland
361,Keeping eye on our brothers cases and much more,34.66,https://www.facebook.com/blackmattersus/,82.0,5.0,06/10/15 03:20:43 AM PDT,people who like Black Matters,Baltimore Maryland Missouri,Maryland Missouri,2015-06-10,Missouri
362,Keeping eye on our brothers cases and much more,0.0,https://www.facebook.com/blackmattersus/,0.0,0.0,07/02/15 03:10:36 AM PDT,people who like Black Matters,Atlanta Georgia Baltimore Maryland Missouri Richmond Virginia,Georgia Maryland Missouri Virginia,2015-07-02,Georgia
362,Keeping eye on our brothers cases and much more,0.0,https://www.facebook.com/blackmattersus/,0.0,0.0,07/02/15 03:10:36 AM PDT,people who like Black Matters,Atlanta Georgia Baltimore Maryland Missouri Richmond Virginia,Georgia Maryland Missouri Virginia,2015-07-02,Maryland
362,Keeping eye on our brothers cases and much more,0.0,https://www.facebook.com/blackmattersus/,0.0,0.0,07/02/15 03:10:36 AM PDT,people who like Black Matters,Atlanta Georgia Baltimore Maryland Missouri Richmond Virginia,Georgia Maryland Missouri Virginia,2015-07-02,Missouri
362,Keeping eye on our brothers cases and much more,0.0,https://www.facebook.com/blackmattersus/,0.0,0.0,07/02/15 03:10:36 AM PDT,people who like Black Matters,Atlanta Georgia Baltimore Maryland Missouri Richmond Virginia,Georgia Maryland Missouri Virginia,2015-07-02,Virginia
363,Keeping eye on our brothers cases and much more,0.0,https://www.facebook.com/blackmattersus,0.0,0.0,06/10/15 03:01:20 AM PDT,people who like Black Matters,Baltimore Maryland Missouri,Maryland Missouri,2015-06-10,Maryland
363,Keeping eye on our brothers cases and much more,0.0,https://www.facebook.com/blackmattersus,0.0,0.0,06/10/15 03:01:20 AM PDT,people who like Black Matters,Baltimore Maryland Missouri,Maryland Missouri,2015-06-10,Missouri
364,Keeping eye on our brothers cases and much more,12858.46,https://www.facebook.com/blackmattersus/,46447.0,2740.0,06/10/15 03:29:48 AM PDT,people who like Black Matters,Baltimore Maryland Missouri,Maryland Missouri,2015-06-10,Maryland
364,Keeping eye on our brothers cases and much more,12858.46,https://www.facebook.com/blackmattersus/,46447.0,2740.0,06/10/15 03:29:48 AM PDT,people who like Black Matters,Baltimore Maryland Missouri,Maryland Missouri,2015-06-10,Missouri
365,Keeping eye on our brothers cases and much more,3544.99,https://www.facebook.com/blackmattersus/,13502.0,547.0,07/02/15 03:10:36 AM PDT,people who like Black Matters,Atlanta Georgia Baltimore Maryland Missouri Richmond Virginia,Georgia Maryland Missouri Virginia,2015-07-02,Georgia
365,Keeping eye on our brothers cases and much more,3544.99,https://www.facebook.com/blackmattersus/,13502.0,547.0,07/02/15 03:10:36 AM PDT,people who like Black Matters,Atlanta Georgia Baltimore Maryland Missouri Richmond Virginia,Georgia Maryland Missouri Virginia,2015-07-02,Maryland
365,Keeping eye on our brothers cases and much more,3544.99,https://www.facebook.com/blackmattersus/,13502.0,547.0,07/02/15 03:10:36 AM PDT,people who like Black Matters,Atlanta Georgia Baltimore Maryland Missouri Richmond Virginia,Georgia Maryland Missouri Virginia,2015-07-02,Missouri
365,Keeping eye on our brothers cases and much more,3544.99,https://www.facebook.com/blackmattersus/,13502.0,547.0,07/02/15 03:10:36 AM PDT,people who like Black Matters,Atlanta Georgia Baltimore Maryland Missouri Richmond Virginia,Georgia Maryland Missouri Virginia,2015-07-02,Virginia
366,Keeping eye on our brothers cases and much more,50.11,https://www.facebook.com/Black-Matters-1579673598947501/,158.0,0.0,06/10/15 03:01:19 AM PDT,people who like Black Matters,Baltimore Maryland Missouri,Maryland Missouri,2015-06-10,Maryland
366,Keeping eye on our brothers cases and much more,50.11,https://www.facebook.com/Black-Matters-1579673598947501/,158.0,0.0,06/10/15 03:01:19 AM PDT,people who like Black Matters,Baltimore Maryland Missouri,Maryland Missouri,2015-06-10,Missouri
367,Keeping eye on our brothers cases and much more,0.0,https://www.facebook.com/Black-Matters-1579673598947501/,0.0,0.0,07/02/15 03:10:36 AM PDT,people who like Black Matters,Atlanta Georgia Baltimore Maryland Missouri Richmond Virginia,Georgia Maryland Missouri Virginia,2015-07-02,Georgia
367,Keeping eye on our brothers cases and much more,0.0,https://www.facebook.com/Black-Matters-1579673598947501/,0.0,0.0,07/02/15 03:10:36 AM PDT,people who like Black Matters,Atlanta Georgia Baltimore Maryland Missouri Richmond Virginia,Georgia Maryland Missouri Virginia,2015-07-02,Maryland
367,Keeping eye on our brothers cases and much more,0.0,https://www.facebook.com/Black-Matters-1579673598947501/,0.0,0.0,07/02/15 03:10:36 AM PDT,people who like Black Matters,Atlanta Georgia Baltimore Maryland Missouri Richmond Virginia,Georgia Maryland Missouri Virginia,2015-07-02,Missouri
367,Keeping eye on our brothers cases and much more,0.0,https://www.facebook.com/Black-Matters-1579673598947501/,0.0,0.0,07/02/15 03:10:36 AM PDT,people who like Black Matters,Atlanta Georgia Baltimore Maryland Missouri Richmond Virginia,Georgia Maryland Missouri Virginia,2015-07-02,Virginia
368,Join us because we care Black matters,0.0,https://www.facebook.com/blackmattersus,0.0,0.0,06/10/15 02:59:59 AM PDT,people who like Black Matters,Baltimore Maryland Missouri,Maryland Missouri,2015-06-10,Maryland
368,Join us because we care Black matters,0.0,https://www.facebook.com/blackmattersus,0.0,0.0,06/10/15 02:59:59 AM PDT,people who like Black Matters,Baltimore Maryland Missouri,Maryland Missouri,2015-06-10,Missouri
369,Join us because we care Black matters,13704.02,https://www.facebook.com/Black-Matters-1579673598947501/,56408.0,3296.0,06/10/15 03:27:28 AM PDT,people who like Black Matters,Baltimore Maryland Missouri,Maryland Missouri,2015-06-10,Maryland
369,Join us because we care Black matters,13704.02,https://www.facebook.com/Black-Matters-1579673598947501/,56408.0,3296.0,06/10/15 03:27:28 AM PDT,people who like Black Matters,Baltimore Maryland Missouri,Maryland Missouri,2015-06-10,Missouri
370,Join us because we care Black matters,1294.75,https://www.facebook.com/Black-Matters-1579673598947501/,3716.0,177.0,07/02/15 03:10:36 AM PDT,people who like Black Matters,Atlanta Georgia Baltimore Maryland Missouri Richmond Virginia,Georgia Maryland Missouri Virginia,2015-07-02,Georgia
370,Join us because we care Black matters,1294.75,https://www.facebook.com/Black-Matters-1579673598947501/,3716.0,177.0,07/02/15 03:10:36 AM PDT,people who like Black Matters,Atlanta Georgia Baltimore Maryland Missouri Richmond Virginia,Georgia Maryland Missouri Virginia,2015-07-02,Maryland
370,Join us because we care Black matters,1294.75,https://www.facebook.com/Black-Matters-1579673598947501/,3716.0,177.0,07/02/15 03:10:36 AM PDT,people who like Black Matters,Atlanta Georgia Baltimore Maryland Missouri Richmond Virginia,Georgia Maryland Missouri Virginia,2015-07-02,Missouri
370,Join us because we care Black matters,1294.75,https://www.facebook.com/Black-Matters-1579673598947501/,3716.0,177.0,07/02/15 03:10:36 AM PDT,people who like Black Matters,Atlanta Georgia Baltimore Maryland Missouri Richmond Virginia,Georgia Maryland Missouri Virginia,2015-07-02,Virginia
371,Join us because we care Black matters,0.0,https://www.facebook.com/blackmattersus,0.0,0.0,06/10/15 02:59:57 AM PDT,people who like Black Matters,Baltimore Maryland Missouri,Maryland Missouri,2015-06-10,Maryland
371,Join us because we care Black matters,0.0,https://www.facebook.com/blackmattersus,0.0,0.0,06/10/15 02:59:57 AM PDT,people who like Black Matters,Baltimore Maryland Missouri,Maryland Missouri,2015-06-10,Missouri
372,Join us because we care Black matters,7018.96,https://www.facebook.com/Black-Matters-1579673598947501/,26442.0,1574.0,06/10/15 03:30:17 AM PDT,people who like Black Matters,Baltimore Maryland Missouri,Maryland Missouri,2015-06-10,Maryland
372,Join us because we care Black matters,7018.96,https://www.facebook.com/Black-Matters-1579673598947501/,26442.0,1574.0,06/10/15 03:30:17 AM PDT,people who like Black Matters,Baltimore Maryland Missouri,Maryland Missouri,2015-06-10,Missouri
373,Join us because we care Black matters,440.12,https://www.facebook.com/Black-Matters-1579673598947501/,1343.0,71.0,07/02/15 03:10:36 AM PDT,people who like Black Matters,Atlanta Georgia Baltimore Maryland Missouri Richmond Virginia,Georgia Maryland Missouri Virginia,2015-07-02,Georgia
373,Join us because we care Black matters,440.12,https://www.facebook.com/Black-Matters-1579673598947501/,1343.0,71.0,07/02/15 03:10:36 AM PDT,people who like Black Matters,Atlanta Georgia Baltimore Maryland Missouri Richmond Virginia,Georgia Maryland Missouri Virginia,2015-07-02,Maryland
373,Join us because we care Black matters,440.12,https://www.facebook.com/Black-Matters-1579673598947501/,1343.0,71.0,07/02/15 03:10:36 AM PDT,people who like Black Matters,Atlanta Georgia Baltimore Maryland Missouri Richmond Virginia,Georgia Maryland Missouri Virginia,2015-07-02,Missouri
373,Join us because we care Black matters,440.12,https://www.facebook.com/Black-Matters-1579673598947501/,1343.0,71.0,07/02/15 03:10:36 AM PDT,people who like Black Matters,Atlanta Georgia Baltimore Maryland Missouri Richmond Virginia,Georgia Maryland Missouri Virginia,2015-07-02,Virginia
375,Join us because we care Black matters,0.0,https://www.facebook.com/Black-Matters-1579673598947501/,0.0,0.0,07/02/15 03:10:36 AM PDT,people who like Black Matters,Atlanta Georgia Baltimore Maryland Missouri Richmond Virginia,Georgia Maryland Missouri Virginia,2015-07-02,Georgia
375,Join us because we care Black matters,0.0,https://www.facebook.com/Black-Matters-1579673598947501/,0.0,0.0,07/02/15 03:10:36 AM PDT,people who like Black Matters,Atlanta Georgia Baltimore Maryland Missouri Richmond Virginia,Georgia Maryland Missouri Virginia,2015-07-02,Maryland
375,Join us because we care Black matters,0.0,https://www.facebook.com/Black-Matters-1579673598947501/,0.0,0.0,07/02/15 03:10:36 AM PDT,people who like Black Matters,Atlanta Georgia Baltimore Maryland Missouri Richmond Virginia,Georgia Maryland Missouri Virginia,2015-07-02,Missouri
375,Join us because we care Black matters,0.0,https://www.facebook.com/Black-Matters-1579673598947501/,0.0,0.0,07/02/15 03:10:36 AM PDT,people who like Black Matters,Atlanta Georgia Baltimore Maryland Missouri Richmond Virginia,Georgia Maryland Missouri Virginia,2015-07-02,Virginia
376,Your life matterMy life matter Black matters,0.0,https://www.facebook.com/blackmattersus,0.0,0.0,06/10/15 02:58:57 AM PDT,people who like Black Matters,Baltimore Maryland Missouri,Maryland Missouri,2015-06-10,Maryland
376,Your life matterMy life matter Black matters,0.0,https://www.facebook.com/blackmattersus,0.0,0.0,06/10/15 02:58:57 AM PDT,people who like Black Matters,Baltimore Maryland Missouri,Maryland Missouri,2015-06-10,Missouri
377,Your life matterMy life matter Black matters,85.63,https://www.facebook.com/Black-Matters-1579673598947501/,249.0,7.0,06/10/15 03:31:26 AM PDT,people who like Black Matters,Baltimore Maryland Missouri,Maryland Missouri,2015-06-10,Maryland
377,Your life matterMy life matter Black matters,85.63,https://www.facebook.com/Black-Matters-1579673598947501/,249.0,7.0,06/10/15 03:31:26 AM PDT,people who like Black Matters,Baltimore Maryland Missouri,Maryland Missouri,2015-06-10,Missouri
378,Your life matterMy life matter Black matters,0.0,https://www.facebook.com/Black-Matters-1579673598947501/,0.0,0.0,07/02/15 03:10:36 AM PDT,people who like Black Matters,Atlanta Georgia Baltimore Maryland Missouri Richmond Virginia,Georgia Maryland Missouri Virginia,2015-07-02,Georgia
378,Your life matterMy life matter Black matters,0.0,https://www.facebook.com/Black-Matters-1579673598947501/,0.0,0.0,07/02/15 03:10:36 AM PDT,people who like Black Matters,Atlanta Georgia Baltimore Maryland Missouri Richmond Virginia,Georgia Maryland Missouri Virginia,2015-07-02,Maryland
378,Your life matterMy life matter Black matters,0.0,https://www.facebook.com/Black-Matters-1579673598947501/,0.0,0.0,07/02/15 03:10:36 AM PDT,people who like Black Matters,Atlanta Georgia Baltimore Maryland Missouri Richmond Virginia,Georgia Maryland Missouri Virginia,2015-07-02,Missouri
378,Your life matterMy life matter Black matters,0.0,https://www.facebook.com/Black-Matters-1579673598947501/,0.0,0.0,07/02/15 03:10:36 AM PDT,people who like Black Matters,Atlanta Georgia Baltimore Maryland Missouri Richmond Virginia,Georgia Maryland Missouri Virginia,2015-07-02,Virginia
379,Your life matterMy life matter Black matters,0.0,https://www.facebook.com/blackmattersus,0.0,0.0,06/10/15 02:58:56 AM PDT,people who like Black Matters,Baltimore Maryland Missouri,Maryland Missouri,2015-06-10,Maryland
379,Your life matterMy life matter Black matters,0.0,https://www.facebook.com/blackmattersus,0.0,0.0,06/10/15 02:58:56 AM PDT,people who like Black Matters,Baltimore Maryland Missouri,Maryland Missouri,2015-06-10,Missouri
380,Your life matterMy life matter Black matters,69.56,https://www.facebook.com/Black-Matters-1579673598947501/,207.0,7.0,06/10/15 03:30:43 AM PDT,people who like Black Matters,Baltimore Maryland Missouri,Maryland Missouri,2015-06-10,Maryland
380,Your life matterMy life matter Black matters,69.56,https://www.facebook.com/Black-Matters-1579673598947501/,207.0,7.0,06/10/15 03:30:43 AM PDT,people who like Black Matters,Baltimore Maryland Missouri,Maryland Missouri,2015-06-10,Missouri
381,Your life matterMy life matter Black matters,0.0,https://www.facebook.com/Black-Matters-1579673598947501/,0.0,0.0,07/02/15 03:10:36 AM PDT,people who like Black Matters,Atlanta Georgia Baltimore Maryland Missouri Richmond Virginia,Georgia Maryland Missouri Virginia,2015-07-02,Georgia
381,Your life matterMy life matter Black matters,0.0,https://www.facebook.com/Black-Matters-1579673598947501/,0.0,0.0,07/02/15 03:10:36 AM PDT,people who like Black Matters,Atlanta Georgia Baltimore Maryland Missouri Richmond Virginia,Georgia Maryland Missouri Virginia,2015-07-02,Maryland
381,Your life matterMy life matter Black matters,0.0,https://www.facebook.com/Black-Matters-1579673598947501/,0.0,0.0,07/02/15 03:10:36 AM PDT,people who like Black Matters,Atlanta Georgia Baltimore Maryland Missouri Richmond Virginia,Georgia Maryland Missouri Virginia,2015-07-02,Missouri
381,Your life matterMy life matter Black matters,0.0,https://www.facebook.com/Black-Matters-1579673598947501/,0.0,0.0,07/02/15 03:10:36 AM PDT,people who like Black Matters,Atlanta Georgia Baltimore Maryland Missouri Richmond Virginia,Georgia Maryland Missouri Virginia,2015-07-02,Virginia
382,Your life matterMy life matter Black matters,50.16,https://www.facebook.com/Black-Matters-1579673598947501/,157.0,2.0,06/10/15 02:58:54 AM PDT,people who like Black Matters,Baltimore Maryland Missouri,Maryland Missouri,2015-06-10,Maryland
382,Your life matterMy life matter Black matters,50.16,https://www.facebook.com/Black-Matters-1579673598947501/,157.0,2.0,06/10/15 02:58:54 AM PDT,people who like Black Matters,Baltimore Maryland Missouri,Maryland Missouri,2015-06-10,Missouri
383,Your life matterMy life matter Black matters,0.0,https://www.facebook.com/Black-Matters-1579673598947501/,0.0,0.0,07/02/15 03:10:36 AM PDT,people who like Black Matters,Atlanta Georgia Baltimore Maryland Missouri Richmond Virginia,Georgia Maryland Missouri Virginia,2015-07-02,Georgia
383,Your life matterMy life matter Black matters,0.0,https://www.facebook.com/Black-Matters-1579673598947501/,0.0,0.0,07/02/15 03:10:36 AM PDT,people who like Black Matters,Atlanta Georgia Baltimore Maryland Missouri Richmond Virginia,Georgia Maryland Missouri Virginia,2015-07-02,Maryland
383,Your life matterMy life matter Black matters,0.0,https://www.facebook.com/Black-Matters-1579673598947501/,0.0,0.0,07/02/15 03:10:36 AM PDT,people who like Black Matters,Atlanta Georgia Baltimore Maryland Missouri Richmond Virginia,Georgia Maryland Missouri Virginia,2015-07-02,Missouri
383,Your life matterMy life matter Black matters,0.0,https://www.facebook.com/Black-Matters-1579673598947501/,0.0,0.0,07/02/15 03:10:36 AM PDT,people who like Black Matters,Atlanta Georgia Baltimore Maryland Missouri Richmond Virginia,Georgia Maryland Missouri Virginia,2015-07-02,Virginia
384,We really can change the world if we stay united,0.0,https://www.facebook.com/blackmattersus,0.0,0.0,06/10/15 02:58:20 AM PDT,people who like Black Matters,Baltimore Maryland Missouri,Maryland Missouri,2015-06-10,Maryland
384,We really can change the world if we stay united,0.0,https://www.facebook.com/blackmattersus,0.0,0.0,06/10/15 02:58:20 AM PDT,people who like Black Matters,Baltimore Maryland Missouri,Maryland Missouri,2015-06-10,Missouri
385,We really can change the world if we stay united,25.87,https://www.facebook.com/Black-Matters-1579673598947501/,66.0,3.0,06/10/15 03:28:34 AM PDT,people who like Black Matters,Baltimore Maryland Missouri,Maryland Missouri,2015-06-10,Maryland
385,We really can change the world if we stay united,25.87,https://www.facebook.com/Black-Matters-1579673598947501/,66.0,3.0,06/10/15 03:28:34 AM PDT,people who like Black Matters,Baltimore Maryland Missouri,Maryland Missouri,2015-06-10,Missouri
386,We really can change the world if we stay united,0.0,https://www.facebook.com/Black-Matters-1579673598947501/,0.0,0.0,07/02/15 03:10:36 AM PDT,people who like Black Matters,Atlanta Georgia Baltimore Maryland Missouri Richmond Virginia,Georgia Maryland Missouri Virginia,2015-07-02,Georgia
386,We really can change the world if we stay united,0.0,https://www.facebook.com/Black-Matters-1579673598947501/,0.0,0.0,07/02/15 03:10:36 AM PDT,people who like Black Matters,Atlanta Georgia Baltimore Maryland Missouri Richmond Virginia,Georgia Maryland Missouri Virginia,2015-07-02,Maryland
386,We really can change the world if we stay united,0.0,https://www.facebook.com/Black-Matters-1579673598947501/,0.0,0.0,07/02/15 03:10:36 AM PDT,people who like Black Matters,Atlanta Georgia Baltimore Maryland Missouri Richmond Virginia,Georgia Maryland Missouri Virginia,2015-07-02,Missouri
386,We really can change the world if we stay united,0.0,https://www.facebook.com/Black-Matters-1579673598947501/,0.0,0.0,07/02/15 03:10:36 AM PDT,people who like Black Matters,Atlanta Georgia Baltimore Maryland Missouri Richmond Virginia,Georgia Maryland Missouri Virginia,2015-07-02,Virginia
387,We really can change the world if we stay united,0.0,https://www.facebook.com/blackmattersus,0.0,0.0,06/10/15 02:58:20 AM PDT,people who like Black Matters,Baltimore Maryland Missouri,Maryland Missouri,2015-06-10,Maryland
387,We really can change the world if we stay united,0.0,https://www.facebook.com/blackmattersus,0.0,0.0,06/10/15 02:58:20 AM PDT,people who like Black Matters,Baltimore Maryland Missouri,Maryland Missouri,2015-06-10,Missouri
388,We really can change the world if we stay united,105.62,https://www.facebook.com/Black-Matters-1579673598947501/,311.0,8.0,06/10/15 03:21:09 AM PDT,people who like Black Matters,Baltimore Maryland Missouri,Maryland Missouri,2015-06-10,Maryland
388,We really can change the world if we stay united,105.62,https://www.facebook.com/Black-Matters-1579673598947501/,311.0,8.0,06/10/15 03:21:09 AM PDT,people who like Black Matters,Baltimore Maryland Missouri,Maryland Missouri,2015-06-10,Missouri
389,We really can change the world if we stay united,0.0,https://www.facebook.com/Black-Matters-1579673598947501/,0.0,0.0,07/02/15 03:10:36 AM PDT,people who like Black Matters,Atlanta Georgia Baltimore Maryland Missouri Richmond Virginia,Georgia Maryland Missouri Virginia,2015-07-02,Georgia
389,We really can change the world if we stay united,0.0,https://www.facebook.com/Black-Matters-1579673598947501/,0.0,0.0,07/02/15 03:10:36 AM PDT,people who like Black Matters,Atlanta Georgia Baltimore Maryland Missouri Richmond Virginia,Georgia Maryland Missouri Virginia,2015-07-02,Maryland
389,We really can change the world if we stay united,0.0,https://www.facebook.com/Black-Matters-1579673598947501/,0.0,0.0,07/02/15 03:10:36 AM PDT,people who like Black Matters,Atlanta Georgia Baltimore Maryland Missouri Richmond Virginia,Georgia Maryland Missouri Virginia,2015-07-02,Missouri
389,We really can change the world if we stay united,0.0,https://www.facebook.com/Black-Matters-1579673598947501/,0.0,0.0,07/02/15 03:10:36 AM PDT,people who like Black Matters,Atlanta Georgia Baltimore Maryland Missouri Richmond Virginia,Georgia Maryland Missouri Virginia,2015-07-02,Virginia
390,We really can change the world if we stay united,65.61,https://www.facebook.com/Black-Matters-1579673598947501/,204.0,4.0,06/10/15 02:58:18 AM PDT,people who like Black Matters,Baltimore Maryland Missouri,Maryland Missouri,2015-06-10,Maryland
390,We really can change the world if we stay united,65.61,https://www.facebook.com/Black-Matters-1579673598947501/,204.0,4.0,06/10/15 02:58:18 AM PDT,people who like Black Matters,Baltimore Maryland Missouri,Maryland Missouri,2015-06-10,Missouri
391,We really can change the world if we stay united,0.0,https://www.facebook.com/Black-Matters-1579673598947501/,0.0,0.0,07/02/15 03:10:36 AM PDT,people who like Black Matters,Atlanta Georgia Baltimore Maryland Missouri Richmond Virginia,Georgia Maryland Missouri Virginia,2015-07-02,Georgia
391,We really can change the world if we stay united,0.0,https://www.facebook.com/Black-Matters-1579673598947501/,0.0,0.0,07/02/15 03:10:36 AM PDT,people who like Black Matters,Atlanta Georgia Baltimore Maryland Missouri Richmond Virginia,Georgia Maryland Missouri Virginia,2015-07-02,Maryland
391,We really can change the world if we stay united,0.0,https://www.facebook.com/Black-Matters-1579673598947501/,0.0,0.0,07/02/15 03:10:36 AM PDT,people who like Black Matters,Atlanta Georgia Baltimore Maryland Missouri Richmond Virginia,Georgia Maryland Missouri Virginia,2015-07-02,Missouri
391,We really can change the world if we stay united,0.0,https://www.facebook.com/Black-Matters-1579673598947501/,0.0,0.0,07/02/15 03:10:36 AM PDT,people who like Black Matters,Atlanta Georgia Baltimore Maryland Missouri Richmond Virginia,Georgia Maryland Missouri Virginia,2015-07-02,Virginia
392,Black matters because everyones life matters,0.0,https://www.facebook.com/blackmattersus,0.0,0.0,06/10/15 02:58:03 AM PDT,people who like Black Matters,Baltimore Maryland Missouri,Maryland Missouri,2015-06-10,Maryland
392,Black matters because everyones life matters,0.0,https://www.facebook.com/blackmattersus,0.0,0.0,06/10/15 02:58:03 AM PDT,people who like Black Matters,Baltimore Maryland Missouri,Maryland Missouri,2015-06-10,Missouri
393,Black matters because everyones life matters,56.53,https://www.facebook.com/Black-Matters-1579673598947501/,191.0,2.0,06/10/15 03:22:04 AM PDT,people who like Black Matters,Baltimore Maryland Missouri,Maryland Missouri,2015-06-10,Maryland
393,Black matters because everyones life matters,56.53,https://www.facebook.com/Black-Matters-1579673598947501/,191.0,2.0,06/10/15 03:22:04 AM PDT,people who like Black Matters,Baltimore Maryland Missouri,Maryland Missouri,2015-06-10,Missouri
394,Black matters because everyones life matters,0.0,https://www.facebook.com/Black-Matters-1579673598947501/,0.0,0.0,07/02/15 03:10:36 AM PDT,people who like Black Matters,Atlanta Georgia Baltimore Maryland Missouri Richmond Virginia,Georgia Maryland Missouri Virginia,2015-07-02,Georgia
394,Black matters because everyones life matters,0.0,https://www.facebook.com/Black-Matters-1579673598947501/,0.0,0.0,07/02/15 03:10:36 AM PDT,people who like Black Matters,Atlanta Georgia Baltimore Maryland Missouri Richmond Virginia,Georgia Maryland Missouri Virginia,2015-07-02,Maryland
394,Black matters because everyones life matters,0.0,https://www.facebook.com/Black-Matters-1579673598947501/,0.0,0.0,07/02/15 03:10:36 AM PDT,people who like Black Matters,Atlanta Georgia Baltimore Maryland Missouri Richmond Virginia,Georgia Maryland Missouri Virginia,2015-07-02,Missouri
394,Black matters because everyones life matters,0.0,https://www.facebook.com/Black-Matters-1579673598947501/,0.0,0.0,07/02/15 03:10:36 AM PDT,people who like Black Matters,Atlanta Georgia Baltimore Maryland Missouri Richmond Virginia,Georgia Maryland Missouri Virginia,2015-07-02,Virginia
395,Black matters because everyones life matters,0.0,https://www.facebook.com/blackmattersus,0.0,0.0,06/10/15 02:58:01 AM PDT,people who like Black Matters,Baltimore Maryland Missouri,Maryland Missouri,2015-06-10,Maryland
395,Black matters because everyones life matters,0.0,https://www.facebook.com/blackmattersus,0.0,0.0,06/10/15 02:58:01 AM PDT,people who like Black Matters,Baltimore Maryland Missouri,Maryland Missouri,2015-06-10,Missouri
396,Black matters because everyones life matters,83.22,https://www.facebook.com/Black-Matters-1579673598947501/,250.0,7.0,06/10/15 03:27:56 AM PDT,people who like Black Matters,Baltimore Maryland Missouri,Maryland Missouri,2015-06-10,Maryland
396,Black matters because everyones life matters,83.22,https://www.facebook.com/Black-Matters-1579673598947501/,250.0,7.0,06/10/15 03:27:56 AM PDT,people who like Black Matters,Baltimore Maryland Missouri,Maryland Missouri,2015-06-10,Missouri
397,Black matters because everyones life matters,0.0,https://www.facebook.com/Black-Matters-1579673598947501/,0.0,0.0,07/02/15 03:10:36 AM PDT,people who like Black Matters,Atlanta Georgia Baltimore Maryland Missouri Richmond Virginia,Georgia Maryland Missouri Virginia,2015-07-02,Georgia
397,Black matters because everyones life matters,0.0,https://www.facebook.com/Black-Matters-1579673598947501/,0.0,0.0,07/02/15 03:10:36 AM PDT,people who like Black Matters,Atlanta Georgia Baltimore Maryland Missouri Richmond Virginia,Georgia Maryland Missouri Virginia,2015-07-02,Maryland
397,Black matters because everyones life matters,0.0,https://www.facebook.com/Black-Matters-1579673598947501/,0.0,0.0,07/02/15 03:10:36 AM PDT,people who like Black Matters,Atlanta Georgia Baltimore Maryland Missouri Richmond Virginia,Georgia Maryland Missouri Virginia,2015-07-02,Missouri
397,Black matters because everyones life matters,0.0,https://www.facebook.com/Black-Matters-1579673598947501/,0.0,0.0,07/02/15 03:10:36 AM PDT,people who like Black Matters,Atlanta Georgia Baltimore Maryland Missouri Richmond Virginia,Georgia Maryland Missouri Virginia,2015-07-02,Virginia
398,Black matters because everyones life matters,38.89,https://www.facebook.com/Black-Matters-1579673598947501/,136.0,1.0,06/10/15 02:58:00 AM PDT,people who like Black Matters,Baltimore Maryland Missouri,Maryland Missouri,2015-06-10,Maryland
398,Black matters because everyones life matters,38.89,https://www.facebook.com/Black-Matters-1579673598947501/,136.0,1.0,06/10/15 02:58:00 AM PDT,people who like Black Matters,Baltimore Maryland Missouri,Maryland Missouri,2015-06-10,Missouri
399,Black matters because everyones life matters,0.0,https://www.facebook.com/Black-Matters-1579673598947501/,0.0,0.0,07/02/15 03:10:36 AM PDT,people who like Black Matters,Atlanta Georgia Baltimore Maryland Missouri Richmond Virginia,Georgia Maryland Missouri Virginia,2015-07-02,Georgia
399,Black matters because everyones life matters,0.0,https://www.facebook.com/Black-Matters-1579673598947501/,0.0,0.0,07/02/15 03:10:36 AM PDT,people who like Black Matters,Atlanta Georgia Baltimore Maryland Missouri Richmond Virginia,Georgia Maryland Missouri Virginia,2015-07-02,Maryland
399,Black matters because everyones life matters,0.0,https://www.facebook.com/Black-Matters-1579673598947501/,0.0,0.0,07/02/15 03:10:36 AM PDT,people who like Black Matters,Atlanta Georgia Baltimore Maryland Missouri Richmond Virginia,Georgia Maryland Missouri Virginia,2015-07-02,Missouri
399,Black matters because everyones life matters,0.0,https://www.facebook.com/Black-Matters-1579673598947501/,0.0,0.0,07/02/15 03:10:36 AM PDT,people who like Black Matters,Atlanta Georgia Baltimore Maryland Missouri Richmond Virginia,Georgia Maryland Missouri Virginia,2015-07-02,Virginia
400,We can be heard only when we stand together Black matters,0.0,https://www.facebook.com/blackmattersus,0.0,0.0,06/10/15 02:57:12 AM PDT,people who like Black Matters,Baltimore Maryland Missouri,Maryland Missouri,2015-06-10,Maryland
400,We can be heard only when we stand together Black matters,0.0,https://www.facebook.com/blackmattersus,0.0,0.0,06/10/15 02:57:12 AM PDT,people who like Black Matters,Baltimore Maryland Missouri,Maryland Missouri,2015-06-10,Missouri
401,We can be heard only when we stand together Black matters,74.07,https://www.facebook.com/Black-Matters-1579673598947501/,203.0,4.0,06/10/15 03:26:57 AM PDT,people who like Black Matters,Baltimore Maryland Missouri,Maryland Missouri,2015-06-10,Maryland
401,We can be heard only when we stand together Black matters,74.07,https://www.facebook.com/Black-Matters-1579673598947501/,203.0,4.0,06/10/15 03:26:57 AM PDT,people who like Black Matters,Baltimore Maryland Missouri,Maryland Missouri,2015-06-10,Missouri
402,We can be heard only when we stand together Black matters,0.0,https://www.facebook.com/Black-Matters-1579673598947501/,0.0,0.0,07/02/15 03:10:36 AM PDT,people who like Black Matters,Atlanta Georgia Baltimore Maryland Missouri Richmond Virginia,Georgia Maryland Missouri Virginia,2015-07-02,Georgia
402,We can be heard only when we stand together Black matters,0.0,https://www.facebook.com/Black-Matters-1579673598947501/,0.0,0.0,07/02/15 03:10:36 AM PDT,people who like Black Matters,Atlanta Georgia Baltimore Maryland Missouri Richmond Virginia,Georgia Maryland Missouri Virginia,2015-07-02,Maryland
402,We can be heard only when we stand together Black matters,0.0,https://www.facebook.com/Black-Matters-1579673598947501/,0.0,0.0,07/02/15 03:10:36 AM PDT,people who like Black Matters,Atlanta Georgia Baltimore Maryland Missouri Richmond Virginia,Georgia Maryland Missouri Virginia,2015-07-02,Missouri
402,We can be heard only when we stand together Black matters,0.0,https://www.facebook.com/Black-Matters-1579673598947501/,0.0,0.0,07/02/15 03:10:36 AM PDT,people who like Black Matters,Atlanta Georgia Baltimore Maryland Missouri Richmond Virginia,Georgia Maryland Missouri Virginia,2015-07-02,Virginia
403,We can be heard only when we stand together Black matters,0.0,https://www.facebook.com/blackmattersus,0.0,0.0,06/10/15 02:57:12 AM PDT,people who like Black Matters,Baltimore Maryland Missouri,Maryland Missouri,2015-06-10,Maryland
403,We can be heard only when we stand together Black matters,0.0,https://www.facebook.com/blackmattersus,0.0,0.0,06/10/15 02:57:12 AM PDT,people who like Black Matters,Baltimore Maryland Missouri,Maryland Missouri,2015-06-10,Missouri
404,We can be heard only when we stand together Black matters,77.74,https://www.facebook.com/Black-Matters-1579673598947501/,248.0,6.0,06/10/15 03:21:36 AM PDT,people who like Black Matters,Baltimore Maryland Missouri,Maryland Missouri,2015-06-10,Maryland
404,We can be heard only when we stand together Black matters,77.74,https://www.facebook.com/Black-Matters-1579673598947501/,248.0,6.0,06/10/15 03:21:36 AM PDT,people who like Black Matters,Baltimore Maryland Missouri,Maryland Missouri,2015-06-10,Missouri
405,We can be heard only when we stand together Black matters,0.0,https://www.facebook.com/Black-Matters-1579673598947501/,0.0,0.0,07/02/15 03:10:36 AM PDT,people who like Black Matters,Atlanta Georgia Baltimore Maryland Missouri Richmond Virginia,Georgia Maryland Missouri Virginia,2015-07-02,Georgia
405,We can be heard only when we stand together Black matters,0.0,https://www.facebook.com/Black-Matters-1579673598947501/,0.0,0.0,07/02/15 03:10:36 AM PDT,people who like Black Matters,Atlanta Georgia Baltimore Maryland Missouri Richmond Virginia,Georgia Maryland Missouri Virginia,2015-07-02,Maryland
405,We can be heard only when we stand together Black matters,0.0,https://www.facebook.com/Black-Matters-1579673598947501/,0.0,0.0,07/02/15 03:10:36 AM PDT,people who like Black Matters,Atlanta Georgia Baltimore Maryland Missouri Richmond Virginia,Georgia Maryland Missouri Virginia,2015-07-02,Missouri
405,We can be heard only when we stand together Black matters,0.0,https://www.facebook.com/Black-Matters-1579673598947501/,0.0,0.0,07/02/15 03:10:36 AM PDT,people who like Black Matters,Atlanta Georgia Baltimore Maryland Missouri Richmond Virginia,Georgia Maryland Missouri Virginia,2015-07-02,Virginia
406,We can be heard only when we stand together Black matters,45.72,https://www.facebook.com/Black-Matters-1579673598947501/,160.0,1.0,06/10/15 02:57:10 AM PDT,people who like Black Matters,Baltimore Maryland Missouri,Maryland Missouri,2015-06-10,Maryland
406,We can be heard only when we stand together Black matters,45.72,https://www.facebook.com/Black-Matters-1579673598947501/,160.0,1.0,06/10/15 02:57:10 AM PDT,people who like Black Matters,Baltimore Maryland Missouri,Maryland Missouri,2015-06-10,Missouri
407,We can be heard only when we stand together Black matters,0.0,https://www.facebook.com/Black-Matters-1579673598947501/,0.0,0.0,07/02/15 03:10:36 AM PDT,people who like Black Matters,Atlanta Georgia Baltimore Maryland Missouri Richmond Virginia,Georgia Maryland Missouri Virginia,2015-07-02,Georgia
407,We can be heard only when we stand together Black matters,0.0,https://www.facebook.com/Black-Matters-1579673598947501/,0.0,0.0,07/02/15 03:10:36 AM PDT,people who like Black Matters,Atlanta Georgia Baltimore Maryland Missouri Richmond Virginia,Georgia Maryland Missouri Virginia,2015-07-02,Maryland
407,We can be heard only when we stand together Black matters,0.0,https://www.facebook.com/Black-Matters-1579673598947501/,0.0,0.0,07/02/15 03:10:36 AM PDT,people who like Black Matters,Atlanta Georgia Baltimore Maryland Missouri Richmond Virginia,Georgia Maryland Missouri Virginia,2015-07-02,Missouri
407,We can be heard only when we stand together Black matters,0.0,https://www.facebook.com/Black-Matters-1579673598947501/,0.0,0.0,07/02/15 03:10:36 AM PDT,people who like Black Matters,Atlanta Georgia Baltimore Maryland Missouri Richmond Virginia,Georgia Maryland Missouri Virginia,2015-07-02,Virginia
408,AfricanAmerican soldiers played a decisive role in the US Army on thewestern frontier during the Plains Wars but its not mentioned in our historybooks,189.05,https://www.facebook.com/Black-Matters-1579673598947501/,636.0,60.0,06/24/15 06:12:24 AM PDT,Black Matters  s                                      Black Matters,Baltimore Maryland Missouri Cleveland Ohio,Maryland Missouri Ohio,2015-06-24,Maryland
408,AfricanAmerican soldiers played a decisive role in the US Army on thewestern frontier during the Plains Wars but its not mentioned in our historybooks,189.05,https://www.facebook.com/Black-Matters-1579673598947501/,636.0,60.0,06/24/15 06:12:24 AM PDT,Black Matters  s                                      Black Matters,Baltimore Maryland Missouri Cleveland Ohio,Maryland Missouri Ohio,2015-06-24,Missouri
408,AfricanAmerican soldiers played a decisive role in the US Army on thewestern frontier during the Plains Wars but its not mentioned in our historybooks,189.05,https://www.facebook.com/Black-Matters-1579673598947501/,636.0,60.0,06/24/15 06:12:24 AM PDT,Black Matters  s                                      Black Matters,Baltimore Maryland Missouri Cleveland Ohio,Maryland Missouri Ohio,2015-06-24,Ohio
409,Cornel West on ObamaThe First Black President Has Become The FirstNiggerized Black PresidentReacting to President Obamas use of the nword on Marc Marons podcastCornel West called him the first niggerized president in an appearance onCNN West criticized Obama as a person who is afraid and intimidated whenit comes to putting a spotlight on white supremacyA niggerized black person is a black person who is afraid and scared andintimidated when it comes to putting a spotlight on white supremacy andfighting against white supremacy West explained So when many of us saidwe have to fight against racism what were we toldNo he cant deal withracism because he has other issues political calculations Hes the presidentof all America not just black America We know hes president of all Americabut white supremacy is American as cherry pieWest is right as usual African minorities would choose Mr West inandinstead of Obama But we had no choice Cornel is a good leader heknows what black community is suffering from Obama was promoted by bigcorporations owned by white people Obama never tried to protect blacksfrom police pressure never tried to stop police violence against blacks Justcount how many black lives were destroyed during his presidency Thenumber is horrific,0.0,https://www.facebook.com/Black-Matters-1 579673598947501/,0.0,0.0,06/24/15 06:03:43 AM PDT,Black Matters  s                                      Black Matters,Baltimore Maryland Missouri Cleveland Ohio,Maryland Missouri Ohio,2015-06-24,Maryland
409,Cornel West on ObamaThe First Black President Has Become The FirstNiggerized Black PresidentReacting to President Obamas use of the nword on Marc Marons podcastCornel West called him the first niggerized president in an appearance onCNN West criticized Obama as a person who is afraid and intimidated whenit comes to putting a spotlight on white supremacyA niggerized black person is a black person who is afraid and scared andintimidated when it comes to putting a spotlight on white supremacy andfighting against white supremacy West explained So when many of us saidwe have to fight against racism what were we toldNo he cant deal withracism because he has other issues political calculations Hes the presidentof all America not just black America We know hes president of all Americabut white supremacy is American as cherry pieWest is right as usual African minorities would choose Mr West inandinstead of Obama But we had no choice Cornel is a good leader heknows what black community is suffering from Obama was promoted by bigcorporations owned by white people Obama never tried to protect blacksfrom police pressure never tried to stop police violence against blacks Justcount how many black lives were destroyed during his presidency Thenumber is horrific,0.0,https://www.facebook.com/Black-Matters-1 579673598947501/,0.0,0.0,06/24/15 06:03:43 AM PDT,Black Matters  s                                      Black Matters,Baltimore Maryland Missouri Cleveland Ohio,Maryland Missouri Ohio,2015-06-24,Missouri
409,Cornel West on ObamaThe First Black President Has Become The FirstNiggerized Black PresidentReacting to President Obamas use of the nword on Marc Marons podcastCornel West called him the first niggerized president in an appearance onCNN West criticized Obama as a person who is afraid and intimidated whenit comes to putting a spotlight on white supremacyA niggerized black person is a black person who is afraid and scared andintimidated when it comes to putting a spotlight on white supremacy andfighting against white supremacy West explained So when many of us saidwe have to fight against racism what were we toldNo he cant deal withracism because he has other issues political calculations Hes the presidentof all America not just black America We know hes president of all Americabut white supremacy is American as cherry pieWest is right as usual African minorities would choose Mr West inandinstead of Obama But we had no choice Cornel is a good leader heknows what black community is suffering from Obama was promoted by bigcorporations owned by white people Obama never tried to protect blacksfrom police pressure never tried to stop police violence against blacks Justcount how many black lives were destroyed during his presidency Thenumber is horrific,0.0,https://www.facebook.com/Black-Matters-1 579673598947501/,0.0,0.0,06/24/15 06:03:43 AM PDT,Black Matters  s                                      Black Matters,Baltimore Maryland Missouri Cleveland Ohio,Maryland Missouri Ohio,2015-06-24,Ohio
410,Autopsy Says Freddie Gray Died After Sustaining HighEnergy Injury inPolice VanThe Baltimore state medical examiners office has found that Freddie Graylikely died from a single highenergy injury sustained as he rode shackled inthe back of a police van on the day of his arrest according to an autopsyreport obtained by the Baltimore SunThe autopsy report suggested that Gray may have attempted to stand upduring the van ride and that the injury could have occurred as he was thrownagainst the van wall when the vehicle changed direction Like really Whenpolice took Gray to the hospital doctors determined that he had sustained asevered spine and crushed voice box Highenergy injury We dont think soIts hard to believe Do they think were idiots or somethingCops imprison you shoot you sever your spine crush your larynx send youto war keep you poor call you a thug and get away with it Theres no excusefor what happened to Freddie,22.75,https://www.facebook.com/Black-Matters-1 579673598947501/,71.0,12.0,06/24/15 06:53:54 AM PDT,Black Matters  s                                      Black Matters,Baltimore Maryland Missouri Cleveland Ohio,Maryland Missouri Ohio,2015-06-24,Maryland
