,adID,adText,adSpend,adLP,adImpress,adClicks,adCreation,adLocation_cleaned,adStates,adDate
1,487,Join our rally atFree the patriots stand for liberty and our rights,4364.22,,3335.0,171.0,04/12/16 01 :59:17 AM PDT,Atlanta Georgia,Georgia,2016-04-12
2,515,Join our rally atFree the patriots stand for liberty and our rights,837.8,,636.0,41.0,04/14/16 04:15:55 AM PDT,Atlanta Georgia,Georgia,2016-04-14
3,532,Join our rally atFree the patriots stand for liberty and our rights,0.0,,,0.0,04/14/16 04:15:52 AM PDT,Atlanta Georgia,Georgia,2016-04-14
4,1863,"When ur credit card gets declined and u
pretending to sort it out with your bank
but u know u really just broke AF",10.08,https://www.facebook.com/Memopolis-450474615151098/,117.0,16.0,05/12/16 06:07:04 AM PDT,,,2016-05-12
6,3307,"Photo by Isadora Kosofskypart of an ongoing series
documenting bonding visits between children and their incarcerated parents
at eight mens and womens prisons in Florida",0.0,https://www.facebook.com/Hell_and_Back-1806743482876111/,0.0,0.0,02/13/17 07:32:39 AM PST,,,2017-02-13
7,1298,"Eric Driester I welcomed the great John Pilger back to CounterPunch Radio this week
to discuss the monstrosity known as HillaryClinton and the dangers of a
Clinton presidency",2000.0,https://www.facebook.com/EricDraitserl/posts/950925828350122,3749.0,91.0,07/06/16 06:56:45 AM PDT,,,2016-07-06
15,486,Join our rally atFree the patriots stand for liberty and our rights,821.33,,560.0,39.0,04/14/16 04:15:57 AM PDT,Atlanta Georgia,Georgia,2016-04-14
16,496,Stand for the people not the government Join our rally at Georgia,173.93,,132.0,7.0,04/13/16 03:24:00 AM PDT,Atlanta Georgia,Georgia,2016-04-13
22,1734,"Never piss off a woman
They remember stuff that hasnt even
happened yet",100.0,https://www.facebook.com/Memopolis-450474615151098/,1203.0,205.0,05/12/16 06:08:29 AM PDT,,,2016-05-12
23,1736,"When youre in the toilet and someone
starts banging on the door so you finish
your business and just sit there like",100.0,https://www.facebook.com/Memopolis-450474615151098/,977.0,196.0,05/12/16 06:06:22 AM PDT,,,2016-05-12
24,1767,"When you double text and they still
dont reply",100.0,https://www.facebook.com/Memopolis-450474615151098/,1077.0,228.0,05/12/16 06:06:52 AM PDT,,,2016-05-12
25,1834,"Kanye looks like Blades little brother Butter
Knife",300.0,https://www.facebook.com/Memopolis-450474615151098/,2757.0,494.0,05/12/16 06-08-06 AM PDT,,,2016-05-12
26,1835,"me making new Netflix accounts to get
freemonth trials",17.76,https://www.facebook.com/Memopolis-450474615151098/,56.0,9.0,04/22/16 12:01:33 AM PDT,,,2016-04-22
30,2411,"Being prochoice
doesnt mean that youd
have an abortion
It just means you think the
choice is yours
not the governments",500.0,https://www.facebook.com/Bom-Liberal-522628564598423/,2261.0,309.0,07/21/16 09:37:16 AM PDT,,,2016-07-21
32,2773,"I WAS BANNED FROM TELEVISION FOR BEING TOO VIOLENT

LIKE S SHARE IF YOU GREW UP WATCHING ME
ON TELEVISION HAVE A GUN AND HAVENT
SHOT OR KILLED ANYONE GOD BLESS THE SOUTH",74.18,https://www.facebook.com/godblessthesouth/,1628.0,327.0,03/10/17 06:53:30 AM PST,,,2017-03-10
36,3293,Hanged for dream to live,200.0,https://www.facebook.com/Native-Americans-United-386046198404902/,2162.0,648.0,02/01/17 11:33:53 PM PST,,,2017-02-01
37,3504,"We the people New petition Disavow support for the Clinton political dynasty Disqualify
and remove Hillary Clinton fromPresidential Ballot",550.8,https://www.facebook.com/wethepeoplepetitions/posts/501304456731720,1011.0,169.0,08/05/16 01:24:42 AM PDT,,,2016-08-05
38,1238,"Be a blactivist Join the We all know that black communities and Natives have always been plagued
by an array of issues that we have to deal on a daily basis Watching
Americas reaction to racism is very telling Last year police brutality and
racism have made it t the forefront Hundreds of unarmed black men and
women died at the hands of police officers
We are tired to feel neglected and ignored We all have had enough And now
we need to come together be honest and get the governments attention
We do not expect you to solve generations of inequality and oppression
overnight We do however expect you to come and to address the issues
and put forward a plan to make change",0.0,https://www.facebook.com/blacktivists/,0.0,0.0,02/18/16 05:30:07 AM PST,New York,New York,2016-02-18
39,3362,Dont miss the opportunity to train with our coach You will enjoy it for sure Its free Organized on a donation basis Free Selfdefense classes in Tampa FL,0.0,,0.0,0.0,03/21 /17 08:20: 13 AM PDT,New York,New York,
40,435,Rochester Police Officers tased black man for dancing OnlylnPoliceState,282.74,https://www.facebook.com/blackmattersus.mvmnt/,15063.0,2276.0,11/02/16 08:04 10 AM PDT,,,2016-11-02
41,458,Your mom knows what to do,200.0,https://www.facebook.com/brownunitedfront/,23655.0,3468.0,03/23/17 09:11:00 AM PDT,,,2017-03-23
42,471,Mexicas have solution to everything,400.0,https://www.facebook.com/brownunitedfront/,28035.0,3620.0,03/25/17 12:30:00 PM PDT,,,2017-03-25
43,473,Everyone likes gossips,381.03,https://www.facebook.com/brownunitedfront/,27113.0,3119.0,03/29/17 11:23:00 AM PDT,,,2017-03-29
44,475,Verde Blanco rojol,0.0,https://www.facebook.com/brownunitedfront/,0.0,0.0,04/25/17 07:50:00 AM PDT,,,2017-04-25
45,478,Cowboys stole everything from charros,400.0,https://www.facebook.com/brownunitedfront/,19980.0,2624.0,04/14/17 10:40:00 AM PDT,,,2017-04-14
46,479,Just because we speak Espanol doesnt make us Hispanic,300.0,https://www.facebook.com/brownunitedfront/,12168.0,1884.0,04/22/17 09:35:01 AM PDT,,,2017-04-22
47,483,My every Saturdays morning,400.0,https://www.facebook.com/brownunitedfront/,10406.0,1435.0,05/11/17 06:02:00 AM PDT,,,2017-05-11
48,486,My grandma was exactly like this,359.66,https://www.facebook.com/brownunitedfront/,17821.0,2243.0,03/29/17 12:23:00 PM PDT,,,2017-03-29
49,487,What is your type and why,300.0,https://www.facebook.com/brownunitedfront/,22633.0,3417.0,03/25/17 12:00:00 PM PDT,,,2017-03-25
50,490,Stop using this word for gods sake,300.0,https://www.facebook.com/brownunitedfront/,35322.0,4929.0,02/08/17 04:30:54 AM PST,,,2017-02-08
51,491,Do you like zoot suit style,300.0,https://www.facebook.com/brownunitedfront/,32189.0,5009.0,02/08/17 04:30:36 AM PST,,,2017-02-08
52,495,Speaks volumes,600.0,https://www.facebook.com/brownunitedfront/,39337.0,5321.0,03/10/17 03:09:18 AM PST,,,2017-03-10
53,503,Enough said,500.0,https://www.facebook.com/brownunitedfront/,39931.0,7609.0,03/15/17 11:30:00 AM PDT,,,2017-03-15
54,569,Black Americans have really different problems to face no white American canever experience in his own lifeWe have the same problems in our communities after the presidentialelections as we had beforeSo give no attention to what you are told by the media Get down to your ownbusinessSubscribe to our channelFollow my FacebookFollow me on InstagramFollow me on TwitterThe truth about blackand white problems,0.0,https://www.facebook.com/WilliamsandKalvin/,0.0,0.0,11/20/16 11:32:07 PM PST,,,2016-11-20
55,602,We were all humans until race disconnected us religion separated us politicsdivided us and wealth classified us,400.0,https://www.facebook.com/brownunitedfront/,34505.0,3682.0,03/18/17 08:08:05 AM PDT,,,2017-03-18
56,604,LIKE if youve ever felt that way,0.88,https://www.facebook.com/brownunitedfront/,1.0,0.0,,,,
57,606,Yes they are,658.17,https://www.facebook.com/brownunitedfront/,20156.0,2512.0,04/25/17 03-10-00 PM PDT,,,2017-04-25
58,607,A real man will put his family first,143.76,https://www.facebook.com/brownunitedfront/,282.0,28.0,04/26/17 07:37:35 AM PDT,,,2017-04-26
60,710,Colin Kaepernick is not just a talented football playerHe is one of the few who understands the real nature of thingsWe are black first of all and only then we are AmericansSo remember who you really areSubscribe to our channelFollow my FacebookFollow me on InstagramFollow me on Twitter,200.0,https://www.facebook.com/WilliamsandKalvin/,3554.0,161.0,12/09/16 11:03:17 PM PST,,,2016-12-09
61,711,Dylan Storm Roofs website hinted at why he chose historic Charleston toshoot nine people to death at Emanuel African Methodist Episcopal Church inSouth CarolinaAlong with a long hatefilled screed the yearold included photos ofhimself burning an American flag taking aim with a pistol and posing proudlyat sites connected to the ConfederacySubscribe to our channelFollow my FacebookFollow me on InstagramFollow me on TwitterThe Truth aboutpunishment and mercy,99.0,https://www.facebook.com/WilliamsandKalvin/,2424.0,142.0,04/17/17 02:01:42 AM PDT,,,2017-04-17
62,828,This is exactly what you feed needs,100.0,https://www.facebook.com/WiIIiamsandKalvin/,19391.0,3338.0,03/16/17 03:03:52 AM PDT,,,2017-03-16
63,829,Remember your roots,20.0,https://www.facebook.com/WiIIiamsandKalvin/,1361.0,269.0,04/15/17 02:43:52 AM PDT,,,2017-04-15
64,830,Explosion in Manchester ISIS attack in Marawi bomb attack in Bangkok carbombing in Syriaall happened in one day This is heartbreaking and we arepraying for everyoneDont you think that it is vicious cycle Now they will bomb more in Syria tostop terrorists And then another bombing here and there But these attackscant bring PeaceStop wasting money on weapons America you better stay away from thisand start taking care of your own people Within your own country,110.66,https://www.facebook.com/WiIliamsandKalvin/,60.0,5.0,05/28/17 07:52:35 AM PDT,,,2017-05-28
65,831,Blessings to all Syrian families,400.0,https://www.facebook.com/WiIIiamsandKalvin/,18975.0,2854.0,05/22/17 07:55 00 AM PDT,,,2017-05-22
66,834,IT HAS TO GO VIRAL,500.0,https://www.facebook.com/WiIIiamsandKalvin/,43230.0,6609.0,02/06/17 03:58:23 AM PST,,,2017-02-06
67,840,The kid makes us all proud Dont let anyone bring you down,100.0,https://www.facebook.com/WiIIiamsandKalvin/,4525.0,577.0,03/17/17 09- 13-00 PM PDT,,,2017-03-17
68,847,Nonviolence is a powerful and just weapon which cuts without wounding andennobles the man who wields it It is a sword that healsMartin Luther King JrSubscribe to our channelFollow my FacebookFollow me on InstagramFollow me on TwitterThe Truth about themost peaceful weapon,300.0,https://www.facebook.com/WiIIiamsandKalvin/,5071.0,85.0,04/20/17 08:32:54 AM PDT,,,2017-04-20
69,858,White people do everything to make Blacks think that we are not beautifulAnd first of all they want us believe that European standards of beauty arethe onlyBut let me tell you this BLACK IS BEAUTIFUL We just need to keep sayingand showing it them,100.0,https://www.facebook.com/WiIIiamsandKalvin/,10397.0,1884.0,04/17/17 02:01:07 AM PDT,,,2017-04-17
70,860,Haters gonna hate regardless,100.0,https://www.facebook.com/WiIIiamsandKalvin/,8958.0,1055.0,03/19/17 08-00-00 AM PDT,,,2017-03-19
71,2411,Montgomery County middle school kids have tasted the outrage of the publicafter a video of them chanting racist words went viral on Facebook furtherdeepening the agony of racism in schools today Montgomery County middleschool kids have tasted the outrage of the public after a video of themchanting racist words went viral on Facebook further deepening Racism InAmerican Schools Video Shows White Kids Chant NWord On School BusBM BM,0.0,https://blackmattersus.com/16579-racism-in-american-schools-video-shows-,0.0,0.0,09/29/16 05:39:01 AM PDT,,,2016-09-29
72,2413,Indiana jury awarded the man acompensation following a mistakenidentity case whereby cops entered his home without warrant and unlawfullyarrested him Back in JulyIndiana police came into the home of anyearold high school student DeShawn Franklin without a warrant wokehim up from his sleep wi Indiana Jury Gives Black ManCompensationAfter Unlawful Arrest I Black Matters BM,287.95,https://blackmattersus.com/14744-indiana-jury-gives-black-,248.0,19.0,09/01/16 12:08:51 AM PDT,,,2016-09-01
73,2452,Respect,200.0,https://www.facebook.com/blackmattersus.mvmnt/,17245.0,2806.0,03/24/17 02:24:22 AM PDT,,,2017-03-24
74,2453,Black woman are truly making history each day,100.0,https://www.facebook.com/blackmattersus.mvmnt,2289.0,481.0,03/24/17 02:25:14 AM PDT,,,2017-03-24
75,2456,Novemberwill mark the second anniversary of the Tamir Rices death Theyearold was carrying a toy airsoft gun when officer Timothy Loehmannshot him within two seconds of arriving on the scene A grand jury decided notindict the killerTamirs mother said she is mad as hell with the grand jurys decision ofdeclaring the officer not guilty She went on to say He was my bright andshining star He was full of light and laughter Tamir had the potential tobecome anything in the World but Officer Loehmann and Garmback didntgive him a chanceDue to the corrupt system Samaria Rice has a dead childHowever he will always live in our hearts Join us on Novemberto honorthe memory of Tamir and show support to his family Remember Tamir Rice,1.5,https://www.facebook.com/events/267467333650934/,3450.0,247.0,11/26/16 12:00:00 AM PST,,,2016-11-26
76,2457,Novemberwill mark the second anniversary of the Tamir Rices death Theyearold was carrying a toy airsoft gun when officer Timothy Loehmannshot him within two seconds of arriving on the scene A grand jury decided notindict the killerTamirs mother said she is mad as hell with the grand jurys decision ofdeclaring the officer not guilty She went on to say He was my bright andshining star He was full of light and laughter Tamir had the potential tobecome anything in the World but Officer Loehmann and Garmback didntgive him a chanceDue to the corrupt system Samaria Rice has a dead childHowever he will always live in our hearts Join us on Novemberto honorthe memory of Tamir and show support to his family Remember Tamir Rice,0.0,https://www.facebook.com/events/267467333650934/,0.0,0.0,11/26/16 12:00:00 AM PST,,,2016-11-26
77,2460,Do everything in your power to change the society we live in and fight toprotect our children,300.0,https://www.facebook.com/blackmattersus.mvmnt/,3689.0,500.0,10/03/16 04:43:25 AM PDT,,,2016-10-03
78,2463,Do everything in your power to change the society we live in and fight toprotect our children,0.0,https://www.facebook.com/blackmattersus.mvmnt/,0.0,0.0,10/03/16 04:43:25 AM PDT,,,2016-10-03
79,2465,A Sense Of Priorities,583.93,https://www.facebook.com/blackmattersus.mvmnt/,17566.0,2106.0,02/28/17 11:49:37 PM PST,,,2017-02-28
80,2479,Your help is needed This case is a classic example of racial profiling in thesystem which has cost innocent Jerome Smithyears of his life already andcan cost even more Jerome must be brought home No one pays attention tohim no one fights for his life Let us help this man achieve justice Please signthe petitionithFromLifeIm prison entskapp refs,0.0,https://www.facebook.com/blackmattersus.mvmnt/,0.0,0.0,09/29/16 08:22:39 AM PDT,,,2016-09-29
81,2480,Your help is needed This case is a classic example of racial profiling in thesystem which has cost innocent Jerome Smithyears of his life already andcan cost even more Jerome must be brought home No one pays attention tohim no one fights for his life Let us help this man achieve justice Please signthe petitionithFromLifeIm prison entskapp refs,0.0,https://www.facebook.com/blackmattersus.mvmnt/,0.0,0.0,09/29/16 08:22:39 AM PDT,,,2016-09-29
82,2506,Congratulations young lady,100.0,https://www.facebook.com/blackmattersus.mvmnt/,8231.0,1172.0,03/24/17 02:25:32 AM PDT,,,2017-03-24
83,2550,On December rd the KKK terrorist organization will host a victory parade inNorth Carolina to celebrate the election of Donald TrumpJoin us on Decin Marshall Park Charlotte as we voice our opposition tothe Klan demonstration their hateful agenda violence and oppressionCharlotte Against Hate,0.0,https://www.facebook.com/events/1795123670705170/,0.0,0.0,12/03/16 01:00:00 PM PST,,,2016-12-03
84,2551,The cop beat this man like he was a runaway slave,300.0,https://www.facebook.com/blackmattersus.mvmnt/,4655.0,313.0,10/03/16 04:47:13 AM PDT,,,2016-10-03
85,2552,The cop beat this man like he was a runaway slave,0.0,https://www.facebook.com/blackmattersus.mvmnt/,0.0,0.0,10/03/16 04:47:13 AM PDT,,,2016-10-03
86,2553,The cop beat this man like he was a runaway slave,0.0,https://www.facebook.com/blackmattersus.mvmnt/,0.0,0.0,10/03/16 04:47:13 AM PDT,,,2016-10-03
87,2554,The cop beat this man like he was a runaway slave,0.0,https://www.facebook.com/blackmattersus.mvmnt/,0.0,0.0,10/03/16 04:47:13 AM PDT,,,2016-10-03
88,2558,InJerome Smith was sentenced to life in prison for a crime he didntcommitThe prosecutor hid key evidence that goes to the heart of Jeromesinnocence untilyears after the trialNo jury ever saw or heard that evidence Jeromes attorneys were unable toprepare properly which hindered their defenseHELP BRING JEROME HOME ATTEND HIS JUVENILE SENTENCINGHEARINGOCTOBERAMOrleans Criminal District CourtTulane Ave New Orleans LA FreeJerome Skee Smith,0.0,https://www.facebook.com/events/1140553372667995/,0.0,0.0,10/03/16 05:16:53 AM PDT,,,2016-10-03
89,2571,The video is circulating across the internet allegedly depicting a white NYPDofficer raping a black yearold girl in a jail cell According to some sourcesthe incident took place in South Africa However there are some crucialpoints that are hidden from the society A shocking video went viral of an onduty white cop raping a young black teen in a jail collecting numerouscomments Firstly in the description box it was w Major mismatches in thestory of white cop rapingyo black girl I BM BM,0.0,https://www.facebook.com/blackmattersus.mvmnt/,0.0,0.0,10/03/16 07:58:31 AM PDT,,,2016-10-03
90,2594,Bernie for president,0.0,https://www.facebook.com/Born-Liberal-522628564598423/,0.0,0.0,06/08/16 05:53:54 AM PDT,,,2016-06-08
91,2603,AugustRepublican President Richard M Nixon resigned Withimpeachment proceedings underway against him for his involvement in theWatergate affair Nixon was finally bowing to pressure from the public andCongress to leave the White HouseMany people asked themselves How dare he to do thatThis is the awful part of our history however the similar actions still happenduring current campaign deleted emails accident with Bernie Sanders andthe DNC This is bad and nobody cares Does the political hypocrisy jump atthe high level nowadays,500.0,https://www.facebook.com/Born-Liberal-522628564598423/,1422.0,220.0,08/11/16 04:45:55 AM PDT,,,2016-08-11
92,2606,Lets say stop to police brutality We must be against racism of all kinds andmake a strong and peaceful responce to these,500.0,https://www.facebook.com/Born-Liberal-522628564598423/,1303.0,245.0,07/15/16 01:01 11 AM PDT,,,2016-07-15
93,2612,Using our tax money to bomb innocent people in Syria and the Middle Eastis terrorism tool,283.52,https://www.facebook.com/MuslimAmerica/,1500.0,175.0,05/21/17 10:24:00 AM PDT,,,2017-05-21
94,2614,HANDS OFF THE MIDDLE EAST,332.82,https://www.facebook.com/MuslimAmerica/,2242.0,303.0,05/20/17 11:24:00 AM PDT,,,2017-05-20
95,2636,Wake up people Its time to start governing and policing our own a Blackcommunity has been brainwashed until we cant understand our realproblems so we cant even try to fix them,11.23,https://www.facebook.com/BM-173996283023459/,294.0,29.0,11/12/16 04:49:45 AM PST,,,2016-11-12
96,2712,This is both amazing and heartbreaking,300.0,https://www.facebook.com/brownunitedfront/,14818.0,2073.0,04/22/17 03:18 00 PM PDT,,,2017-04-22
97,2716,Looks better than most new cars,300.0,https://www.facebook.com/brownunitedfront/,33706.0,4760.0,04/21/17 10:33:00 AM PDT,,,2017-04-21
98,2722,What do you usually choose,500.0,https://www.facebook.com/brownunitedfront/,18565.0,1927.0,04/22/17 12:09:42 AM PDT,,,2017-04-22
99,2723,Hollywood wants guys who can act toughHollywood dont want tough guysDanny Trejo,400.0,https://www.facebook.com/brownunitedfront/,31768.0,3613.0,04/15/17 11:00:01 AM PDT,,,2017-04-15
100,2724,Indigenous dancersMexico City,300.0,https://www.facebook.com/brownunitedfront/,37042.0,4851.0,04/23/17 10:46:00 AM PDT,,,2017-04-23
101,2726,Have you ever felt this way,6.03,https://www.facebook.com/brownunitedfront/,229.0,45.0,05/06/17 12:06 41 AM PDT,,,2017-05-06
102,2727,The history of liberty is a history of resistance,300.0,https://www.facebook.com/brownunitedfront/,14039.0,2064.0,04/21/17 09:32 00 AM PDT,,,2017-04-21
103,2728,Gorgeous print from cartoonist Lalo Alcaraz,200.0,https://www.facebook.com/brownunitedfront/,19376.0,2323.0,05/20/17 08:03 00 AM PDT,,,2017-05-20
104,2737,Have you ever passed through this lol,400.0,https://www.facebook.com/brownunitedfront/,28636.0,2920.0,03/22/17 09:30:00 AM PDT,,,2017-03-22
105,2739,Our women are the most powerful,200.0,https://www.facebook.com/brownunitedfront/,15590.0,2082.0,04/04/17 10:20:00 AM PDT,,,2017-04-04
106,2742,Remember of your heritage Art Jesus Helguera,200.0,https://www.facebook.com/brownunitedfront/,19729.0,2934.0,05/17/17 07:15:37 AM PDT,,,2017-05-17
107,2743,The sun loves us,55.56,https://www.facebook.com/brownunitedfront/,1315.0,160.0,04/23/17 06:23:00 PM PDT,,,2017-04-23
108,2745,Today wouldve been her th birthday and it is actually a real holiday inTexas called Selena Day,400.0,https://www.facebook.com/brownunitedfront/,24763.0,2938.0,04/19/17 07:39:45 AM PDT,,,2017-04-19
109,2751,Mexican women are the perfect mix of princess and warrior,200.0,https://www.facebook.com/brownunitedfront/,15233.0,1883.0,05/20/17 04:01:00 PM PDT,,,2017-05-20
110,2752,Uncle Sam says SHHH BE QUIET If this big guy gets up we got problems,100.0,https://www.facebook.com/brownunitedfront/,6366.0,820.0,04/20/17 08:23:00 AM PDT,,,2017-04-20
111,2753,So true,276.53,https://www.facebook.com/brownunitedfront/,15285.0,2151.0,04/14/17 07:48:53 AM PDT,,,2017-04-14
112,2754,Noel Gugliemi is just great,198.81,https://www.facebook.com/brownunitedfront/,21209.0,3404.0,03/29/17 10:22:00 AM PDT,,,2017-03-29
113,2755,Like if you do the same,200.0,https://www.facebook.com/brownunitedfront/,28647.0,3148.0,05/23/17 08:03:00 AM PDT,,,2017-05-23
114,2756,Our history is forever in our blood,200.0,https://www.facebook.com/brownunitedfront/,42304.0,6357.0,05/17/17 07:19:15 AM PDT,,,2017-05-17
115,2757,Nothing strange just Mexican chefs in a sushi restaurant in SanFranciscoSource,195.64,https://www.facebook.com/brownunitedfront/,3400.0,461.0,05/17/17 12:03:00 PM PDT,,,2017-05-17
116,2758,Like if you have one,400.0,https://www.facebook.com/brownunitedfront/,9392.0,1398.0,04/29/17 07:54:35 AM PDT,,,2017-04-29
117,2759,Like if you would print that on your shirt,200.0,https://www.facebook.com/brownunitedfront/,50241.0,6491.0,05/24/17 10:01:00 AM PDT,,,2017-05-24
118,2760,Unusual Mexican Altar found near Cuernavaca Mexico,200.0,https://www.facebook.com/brownunitedfront/,14082.0,1784.0,05/20/17 12:05:00 PM PDT,,,2017-05-20
119,2761,Would you buy it for your girlfriend,300.0,https://www.facebook.com/brownunitedfront/,12222.0,1332.0,05/19/17 08:05:00 AM PDT,,,2017-05-19
120,2763,Haha perfectly said,600.0,https://www.facebook.com/brownunitedfront/,64700.0,8484.0,05/11/17 05:27:28 AM PDT,,,2017-05-11
121,2764,I would,110.0,https://www.facebook.com/brownunitedfront/,44817.0,5897.0,05/06/17 12:06 23 AM PDT,,,2017-05-06
122,2765,Stand strong and keep fighting for your rights,300.0,https://www.facebook.com/brownunitedfront/,46008.0,7065.0,05/02/17 06:28:27 AM PDT,,,2017-05-02
123,2769,Keep calm and drive a lowrider,400.0,https://www.facebook.com/brownunitedfront/,23660.0,3644.0,04/29/17 07:53:22 AM PDT,,,2017-04-29
124,2772,Time to stop the ignorance,300.0,https://www.facebook.com/brownunitedfront/,30141.0,3804.0,04/22/17 07:35:00 AM PDT,,,2017-04-22
125,2773,Love that is earned is actually more stable,300.0,https://www.facebook.com/brownunitedfront/,34247.0,3621.0,04/17/17 01:00:01 PM PDT,,,2017-04-17
126,2774,This land is ours,300.0,https://www.facebook.com/brownunitedfront/,25001.0,2326.0,04/17/17 10:00 00 AM PDT,,,2017-04-17
127,2776,My parents crossed over the border with three little kids If they had to gothrough all that to bring me here I think I have to give backMelisa Simon,400.0,https://www.facebook.com/brownunitedfront/,26894.0,3905.0,03/27/17 08-58-00 AM PDT,,,2017-03-27
128,2777,Our creativity comes from the ancestors,400.0,https://www.facebook.com/brownunitedfront/,30198.0,4178.0,03/24/17 10:11:00 AM PDT,,,2017-03-24
129,2778,This lady is the one you shouldnt mess with,103.35,https://www.facebook.com/brownunitedfront/,6193.0,847.0,03/22/17 12:15:00 PM PDT,,,2017-03-22
130,2779,The most important thing in the world is to be yourself no matter what,0.0,https://www.facebook.com/brownunitedfront/,0.0,0.0,03/17/17 09:3&00 AM PDT,,,2017-03-17
131,2781,Did you know,84.97,https://www.facebook.com/brownunitedfront/,13582.0,1357.0,03/14/17 08:04 50 AM PDT,,,2017-03-14
132,2785,Selena in Los Angeles California,0.0,https://www.facebook.com/brownunitedfront/,0.0,0.0,03/14/17 06:56:24 AM PDT,,,2017-03-14
133,2800,Orgullo Mexicano,300.0,https://www.facebook.com/brownunitedfront/,30041.0,4088.0,02/03/17 01:24:24 AM PST,,,2017-02-03
134,2809,Community of people who support our brave heroes,315.41,https://www.facebook.com/Back-the-Badge-341177102896426/,351.0,43.0,"Interests: Police, Law enforcement or Police officer                                    And Must Also Match: Interests: The Thin Blue Line, National Police Wives                                    Association or Heroes Behind The Badge",,,
135,2812,Community of people who support our brave heroes,0.0,https://www.facebook.com/Back-the-Badge-341177102896426/,0.0,0.0,"Interests: State police, Law enforcement in the United                                    States, Police, Law enforcement or Police officer                                    And Must Also Match: Interests Support Law Enforcement, The Thin Blue                                    Line. Officer Down Memorial Page, The Thin Blue Line (emblem). Police                                    Wives Unite, National Police Wives Association or Heroes Behind The Badge",,,
136,2814,Community of people who support our brave Police Officers,0.0,https://www.facebook.com/copsareheroes/,0.0,0.0,"Interests: State police, Law enforcement in the United                                    States, Police, Law enforcement or Police officer                                    And Must Also Match: Interests Support Law Enforcement, The Thin Blue                                    Line. Officer Down Memorial Page, The Thin Blue Line (emblem). Police                                    Wives Unite, National Police Wives Association or Heroes Behind The Badge",,,
137,2870,Join us and make changes for the Black community Its time to take actions,47.55,https://www.facebook.com/PanAfrootsmove/,29.0,0.0,05/11/17 06:00:00 AM PDT,,,2017-05-11
138,2995,Hallelujah Join our non denominational Christian group,0.0,https://www.facebook.com/Black_liberation_church-1160193507389202/,0.0,0.0,Exclude people who like Black_Baptist_church,,,
139,3084,There are always roadblocks obstacles and challenges and you have to findother ways to reach your goal Thats what makes it interesting Boris KodjoeSuccess stories Boris Kodjoe More Than ActorComment Boris Kodjoe the World of Alfa clothing There are alwaysroadblocks obstacles and challenges and you have to find other ways toreach your goal Thats what makes it interesting Boris Kodjoe Born BorisFrederic Cecil Boris Kodjoe More Than ActorBlackBlackblackblackinfo,467.5,http://black4black.info/2017/01/19/boris-kodjoe-more-than-actor/,2267.0,19.0,01/25/17 01:04:29 AM PST,,,2017-01-25
140,3096,Mexican grad cap,600.0,https://www.facebook.com/brownunitedfront/,44731.0,7292.0,04/25/17 11:09:00 AM PDT,,,2017-04-25
141,3097,Be all you can be in the Raza,130.34,https://www.facebook.com/brownunitedfront/,13115.0,1677.0,04/25/17 09:09:00 AM PDT,,,2017-04-25
142,3098,Hell yeaah,0.0,https://www.facebook.com/brownunitedfront/,0.0,0.0,04/27/17 03:12:00 PM PDT,,,2017-04-27
143,3099,Selena in Los Angeles California,0.0,https://www.facebook.com/brownunitedfront/,0.0,0.0,04/27/17 08:12:00 AM PDT,,,2017-04-27
144,3110,This invasive war cult has no place in any civilized society America as theland of the free should ban Sharia on federal level,200.0,https://www.facebook.com/StopAllInvaders/,6355.0,1015.0,05/19/17 08-29-31 AM PDT,,,2017-05-19
145,3123,Native art is so pure,300.0,https://www.facebook.com/Native-Americans-United-386046198404902/,3971.0,420.0,02/07/17 05:17:47 AM PST,,,2017-02-07
146,3127,Native American Painted Shield Lakota,200.0,https://www.facebook.com/Native-Americans-United-386046198404902/,927.0,155.0,02/01/17 11:32:16 PM PST,,,2017-02-01
147,3140,Do you want to see topgirls who applied for a job at FacebookHit the linktypetheater,10.0,https://www.facebook.com/Melanie-Black-659489547567007/,533.0,19.0,01/29/17 01:54:00 AM PST,,,2017-01-29
148,3141,Support our Veterans Veterans Come First,1.04,https://www.facebook.comNeterans-Come-First-1757336424535312/,26.0,2.0,Exclude people who like Veterans Come First,,,
149,3144,Our page is the living evidence of importance of police reform in AmericaWatch The Police,500.0,https://www.facebook.com/Watch-the-Police-1095374457243609/,955.0,50.0,Exclude people who like Watch the Police,,,
150,3146,We speak for all fellow members of LGBT community across the nationGender preference does not define you Your spirit defines you,0.0,https://www.facebook.com/LGBT-United-839497472793277/,0.0,0.0,Exclude people who like LGBT United,,,
151,3147,First online player for ur browser Listen everything for free musicfbinfoFaceMusic Stop AI,0.0,https://musicfb.info/,0.0,0.0,Behaviors: Facebook access (browser): Chrome                                    And Must Also Match: Interests: free music or Free software,,,
152,3149,A tiny browser extension will help you to browse listen and share any kind ofmusic Free online music library musicfbinfo FaceMusic Stop AI,354.55,https://musicfb.info/,1060.0,4.0,Behaviors: Facebook access (browser): Chrome                                    And Must Also Match: Interests Free software                                    And Must Also Match: Interests Music,,,
153,3150,A tiny browser extension will help you to browse listen and share any kind ofmusic Free online music library musicfbinfo FaceMusic Stop AI,2720.45,https://musicfb.info/,10198.0,28.0,Behaviors: Facebook access (browser): Chrome                                    And Must Also Match: Interests: Free software                                    And Must Also Match: Interests: Music,,,
154,3151,Free online player Just add in ur browser and jump in the world of free musicmusicfbinfo FaceMusic Stop A,0.0,https://musicfb.info/,0.0,0.0,Behaviors: Facebook access (browser): Chrome                                    And Must Also Match: Interests: free music or Free software,,,
155,3152,Free online player Just add in ur browser and jump in the world of free musicmusicfbinfo FaceMusic Stop AI,0.0,https://musicfb.info/,0.0,0.0,Behaviors: Facebook access (browser): Chrome                                    And Must Also Match: Interests Free software                                    And Must Also Match: Interests Music,,,
156,3154,Free online player Jump in the world of free music Click and download for urbrowser musicfbinfo FaceMusic Stop AI,0.0,https://musicfb.info/,0.0,0.0,Behaviors: Facebook access (browser): Chrome                                    And Must Also Match: Interests: free music or Free software,,,
157,3155,Free online player Jump in the world of free music Click and download for urbrowser musicfbinfo FaceMusic Stop AI,0.0,https://musicfb.info/,0.0,0.0,Behaviors: Facebook access (browser): Chrome                                    And Must Also Match: Interests Free software                                    And Must Also Match: Interests Music,,,
158,3156,Free online player Jump in the world of free music Click and download for urbrowser musicfbinfo FaceMusic Stop AI,0.0,https://musicfb.info/,0.0,0.0,Behaviors: Facebook access (browser): Chrome                                    And Must Also Match: Interests Free software                                    And Must Also Match: Interests Music,,,
159,3157,Free online player Jump in the world of free music Click and download for urbrowser musicfbinfo FaceMusic Stop AI,0.0,https://musicfb.info/,0.0,0.0,Behaviors: Facebook access (browser): Chrome                                    And Must Also Match: Interests: free music or Free software,,,
160,3176,A tiny browser extension will help you to browse listen and share any kind ofmusic Free online music library musicfbinfo FaceMusic Stop AI,0.0,https://musicfb.info/,0.0,0.0,Behaviors: Facebook access (browser): Chrome                                    And Must Also Match: Interests Spotify,,,
161,3180,Free online player Just add in ur browser and jump in the world of free musicmusicfbinfo FaceMusic Stop AI,0.0,https://musicfb.info/,0.0,0.0,Behaviors: Facebook access (browser): Chrome                                    And Must Also Match: Interests Music                                    And Must Also Match: Interests Free software,,,
162,3193,Only for Chrome usersAny music via FaceMusic absolutely legal and for free Free online musiclibrary Downloadmusicfbinfo FaceMusic Stop AI,0.0,https:Hmusicfb.info/,0.0,0.0,"Behaviors: Facebook access (browser): Chrome                                    And Must Also Match: Interests: Grooveshark, Last.fm, SoundCloud, Vevo or                                    Google Play Music",,,
163,3196,Free online player Jump in the world of free music Click and download for urbrowser musicfbinfo FaceMusic Stop AI,0.0,https://musicfb.info/,0.0,0.0,Behaviors: Facebook access (browser): Chrome                                    And Must Also Match: Interests Music                                    And Must Also Match: Interests Free software,,,
164,3197,Free online player Jump in the world of free music Click and download for urbrowser musicfbinfo FaceMusic Stop AI,0.0,https://musicfb.info/,0.0,0.0,Behaviors: Facebook access (browser): Chrome                                    And Must Also Match: Interests Spotify,,,
165,3201,Download and listen music for free Unique browser extension Download andstart listen musicfbinfo FaceMusic Stop AI,0.0,https://musicfb.info/,0.0,0.0,"Behaviors: Facebook access (browser): Chrome                                    And Must Also Match: Interests Grooveshark, Last.fm, SoundCloud. Vevo,                                    Shazam (service) or Google Play Music",,,
166,3209,Free online player Jump in the world of free music Click and download for urbrowser musicfbinfo FaceMusic Stop AI,0.0,https://musicfb.info/,0.0,0.0,Behaviors: Facebook access (browser): Chrome                                    And Must Also Match: Interests Music                                    And Must Also Match: Interests Free software,,,
167,3210,Free online player Jump in the world of free music Click and download for urbrowser musicfbinfo FaceMusic Stop AI,0.0,https://musicfb.info/,0.0,0.0,Behaviors: Facebook access (browser): Chrome                                    And Must Also Match: Interests Spotify,,,
168,3213,Free online player Jump in the world of free music Click and download for urbrowser musicfbinfo FaceMusic Stop AI,0.0,https://musicfb.info/,0.0,0.0,"Behaviors: Facebook access (browser): Chrome                                    And Must Also Match: Interests: Grooveshark, Last.fm, SoundCloud, Vevo,                                    Shazam (service) or Google Play Music",,,
169,3215,Listen to your favorite music viaFaceMusic absolutely legal and for freeFree online music player Download now musicfbinfo FaceMusic Stop AI,0.0,https://musicfb.info/,0.0,0.0,Behaviors: Facebook access (browser): Chrome                                    And Must Also Match: Interests Music                                    And Must Also Match: Interests Free software,,,
170,3216,Listen to your favorite music viaFaceMusic absolutely legal and for freeFree online music player Download now musicfbinfo FaceMusic Stop AI,0.0,https://musicfb.info/,0.0,0.0,Behaviors: Facebook access (browser): Chrome                                    And Must Also Match: Interests Spotify,,,
171,3231,Free online player Jump in the world of free music Click and download for urbrowser musicfbinfo FaceMusic Stop AI,0.0,https://musicfb.info/,0.0,0.0,"Behaviors: Facebook access (browser): Chrome                                    And Must Also Match: Interests Music; Last.fm, SoundCloud or Apple Music",,,
172,3235,Free online player Jump in the world of free music Click and download for urbrowser musicfbinfo FaceMusic Stop AI,0.0,https://musicfb.info/,10.0,0.0,"Behaviors: Facebook access (browser): Chrome                                    And Must Also Match: Interests Music; Last.fm, SoundCloud or Apple Music",,,
173,3236,Free online player Jump in the world of free music Click and download for urbrowser musicfbinfo FaceMusic Stop AI,0.0,https://musicfb.info/,21.0,0.0,"Behaviors: Facebook access (browser): Chrome                                    And Must Also Match: Interests Spotify, (Tunes, Music; SoundCloud or Apple                                    Music",,,
174,3237,Free online player Jump in the world of free music Click and download for urbrowser musicfbinfo FaceMusic Stop AI,0.0,https://musicfb.info/,134.0,0.0,Behaviors: Facebook access (browser): Chrome                                    And Must Also Match: Interests: free music or Free software,,,
175,3242,Free online player Just add in ur browser and jump in the world of free musicmusicfbinfo FaceMusic Stop AI,156.29,https://musicfb.info/,688.0,4.0,"Interests: Music or Rock music                                    And Must Also Match: Behaviors: Facebook access (browser): Firefox,                                    Facebook access (browser): Chrome or Facebook access (browser): Opera",,,
176,3247,Free online player Just add in ur browser and jump in the world of free musicmusicfbinfo FaceMusic Stop AI,0.0,https://musicfb.info/,17.0,0.0,"Behaviors: Facebook access (browser): Chrome                                    And Must Also Match: Interests Music; Last.fm, SoundCloud or Apple Music",,,
177,3248,Free online player Just add in ur browser and jump in the world of free musicmusicfbinfo FaceMusic Stop AI,0.0,https://musicfb.info/,0.0,0.0,"Behaviors: Facebook access (browser): Chrome                                    And Must Also Match: Interests Spotify, (Tunes, Music; SoundCloud or Apple                                    Music",,,
178,3251,Free music extension Be online and listen anything u like musicfbinfoFaceMusic Stop AI,0.0,https://musicfb.info/,16.0,0.0,"Behaviors: Facebook access (browser): Chrome                                    And Must Also Match: Interests Music; Last.fm, SoundCloud or Apple Music",,,
179,3254,This is the real problem,0.0,https://www.facebook.com/Stop-Refugees-831055207009551/,0.0,0.0,10/14/15 03:36:56 AM PDT,,,2015-10-14
180,3258,Brexit may be a threat to both researchers think Stranger Things There AreMore Sheep Than People In Wales By NowComment Agriculture census farming Brexit may be a threat to bothresearchers think Share on FacebookShare on Twitter At the moment therearemillion sheep and Iambs in Wales and onlypeopleThere Are More Sheep Than People In Wales By NowDuDeersdudeerscom,200.0,http://dudeers.com/2016/12/23/there-are-more-sheep-than-people-in-wales-,1132.0,36.0,01/11/17 03:34:00 PM PST,,,2017-01-11
181,3322,Explosion in Manchester ISIS attack in Marawi bomb attack in Bangkok carbombing in Syriaall happened in one day This is heartbreaking and we arepraying for everyoneDont you think that it is vicious cycle Now they will bomb more in Syria tostop terrorists And then another bombing here and there But these attackscant bring PeaceStop wasting money on weapons America you better stay away from thisand start taking care of your own people Within your own country,78.08,https://www.facebook.com/WiIliamsandKalvin/,3107.0,557.0,05/28/17 07:52:35 AM PDT,,,2017-05-28
182,3323,Honestly white princesses are fine But these are lovely and magical,72.82,https://www.facebook.com/WiIIiamsandKalvin/,7492.0,1401.0,03/29/17 12:38:43 AM PDT,,,2017-03-29
183,3324,Never doubt that,0.0,https://www.facebook.com/WiIIiamsandKalvin/,0.0,0.0,11/14/16 07:28:43 AM PST,,,2016-11-14
184,3326,She has big plans for the Detroit and she will regain its former glory,200.0,https://www.facebook.com/WiIIiamsandKalvin/,27148.0,5001.0,02/20/17 04:41:58 AM PST,,,2017-02-20
185,3327,Africa was never poor white people came there and took everythingincluding people,200.0,https://www.facebook.com/WiIIiamsandKalvin/,20391.0,2602.0,02/20/17 04:41:28 AM PST,,,2017-02-20
186,3328,Rest in peace Thank you for trying to teach Black kids how to lovethemselves,200.0,https://www.facebook.com/WiIIiamsandKalvin/,39937.0,6356.0,02/20/17 04:42:51 AM PST,,,2017-02-20
187,3331,Looks like melanin is some magic philosophers stone that allows Blackpeople live forever and stay beautiful forever,300.0,https://www.facebook.com/WiIIiamsandKalvin/,25070.0,4150.0,02/06/17 03:59:38 AM PST,,,2017-02-06
188,3334,Dont let anything stop you Yuo body can be weak but your mind has to bestrong,400.0,https://www.facebook.com/WiIIiamsandKalvin/,9926.0,1961.0,02/18/17 04:42:21 AM PST,,,2017-02-18
189,5,WHERE is your VOICE,3714.15,https://www.facebook.com/GovSpending-1651761351759857/,29786.0,201.0,06/15/16 03:39:52 AM PDT,Georgia,Georgia,2016-06-15
190,12,Its time for us to understand that we do deserve all best Its time for ourpeople to stand up and use all the opportunities of this life Follow black prideus if you agree,4893.72,https://www.facebook.com/Bat-240131319678646/,44111.0,625.0,08/17/16 04:17:52 AM PDT,,,2016-08-17
191,16,A Wounded Warrior and his service dog Support our VeteransFollow TheUS Gov Spending Stats Instalol,2131.44,https://www.instagram.com/veterans_us/,21093.0,53.0,05/12/16 02:37:39 AM PDT,,,2016-05-12
192,24,TAG YOUR PHOTOS WITH TXagainst Send us the reason why dont youwant illegals in TexasComments photos and videos are welcomed,6618.25,https://www.facebook.com/GovSpending-1651761351759857/,77759.0,9.0,04/20/16 12:07:11 AM PDT,,,2016-04-20
193,25,Homeland of brave Support our veterans Join us Veterans USAGovSpending,1401.8,https://instagram.com/veterans_us/,3970.0,35.0,11/09/15 05:01:08 AM PST,,,2015-11-09
194,29,What do you know about PTSD Do you know that US Military deaths sincecountwhile veterans suicides sinceaccount forWeare losingtimes more warriors in civilian life than on the battlefieldsLearn more Follow us Veterans USAGovSpending,1506.21,https:Hinstagram.com/veterans_us/,3527.0,33.0,11/12/15 04:38:35 AM PST,,,2015-11-12
195,30,Click learn more People dont want to look at the homeless But maybe theywill look at or think about or support dealing with homelessness once theyknow thatof the homeless adult population are veterans Join usVeterans USAGovSpending,0.0,https:Hinstagram.com/veterans_us/,0.0,0.0,11/19/15 05:20:22 AM PST,,,2015-11-19
196,32,Heritage not hate yall Our flag has nothing to do with racism The FederalGovernment shouldnt be able to dictate what we can and cannot do Gofollow Confederate pageon lnstagram south united if you are proud of oursouthern heritage God bless Dixie Confederate pageon lnstagram Noracism no hate The south will rise againSouth United GovSpending,3.0,https://www.instagram.com/south_united/,12727.0,375.0,08/18/16 08:31 :16 AM PDT,Alabama Arkansas Florida Georgia Louisiana Mississippi North Carolina South Tennessee Texas Virginia,Alabama Arkansas Florida Georgia Louisiana Mississippi North Carolina Tennessee Texas Virginia,2016-08-18
197,36,Hes lucky to return home to reunite with his family for the holidays But hesjust one of a few servicemen to do this For many of our brave troopsstationed abroad and far from their loved ones Our brave servicemen andservicewomen will continue to make sacrifices for our great country while theVA employees will be having their dinner and laughing at the VA backlogClick to Learn More Veterans USAGovSpending,8339.12,https://www.instagram.com/veterans_us/,143644.0,496.0,01/14/16 07:18:30 AM PST,,,2016-01-14
198,40,Lets make America great again for the future generations Click Learn MoreVeterans USAGovSpending,1203.51,https://www.instagram.com/veterans_us/,12476.0,25.0,01 /06/16 03: 11 :48 AM PST,,,
199,42,If we ever forget that we are One Nation Under God then we will be a nationgone under Ronald Reagan,6015.85,https://www.facebook.com/Bat-240131319678646/,22608.0,266.0,06/15/16 04:02:09 AM PDT,Ohio Tennessee Virginia,Ohio Tennessee Virginia,2016-06-15
200,50,Black MattersCops OnTeen Brutality Against Juveniles L A Countyprobation officers brutalize teen in detention center Fox News Hosts BelieveCharleston Shooting Wasnt Hate Crime FoxFriends hosts declare thatthe shooting was motivated by religious hatred towards Christians but notracism Brutal Alabama Cop Fatally Shoots Black Teen Holding Cellphone Amobile police officer fatally shot a yearold black teen Michael Mooreduring a traffic stop Monday Junein Toulminville Alabama Black Matters,13458.49,https:Hblackmattersus.com/,92618.0,6555.0,06/21/16 07:09:02 AM PDT,,,2016-06-21
201,51,Get breaking news and analysis on the life of African American community inthe US Black MattersCops OnTeen Brutality Against Juveniles L ACounty probation officers brutalize teen in detention center Fox News HostsBelieve Charleston Shooting Wasnt Hate Crime FoxFriends hostsdeclare that the shooting was motivated by religious hatred towardsChristians but not racism Brutal Alabama Cop Fatally Shoots Black TeenHolding Cellphone A mobile police officer fatally shot a yearold blackteen Michael Moore during a traffic stop Monday Junein ToulminvilleAlabama Black Matters,1168.31,https://blackmattersus.com/?utm_source=facebook&utm_medium=cpc&utm_,12653.0,393.0,07/06/16 07:18:32 AM PDT,,,2016-07-06
202,63,Get breaking news and analysis on the life of African American community inthe US Black MattersCops OnTeen Brutality Against Juveniles L ACounty probation officers brutalize teen in detention center Fox News HostsBelieve Charleston Shooting Wasnt Hate Crime FoxFriends hostsdeclare that the shooting was motivated by religious hatred towardsChristians but not racism Brutal Alabama Cop Fatally Shoots Black TeenHolding Cellphone A mobile police officer fatally shot a yearold blackteen Michael Moore during a traffic stop Monday Junein ToulminvilleAlabama Black Matters,0.0,https://blackmattersus.com/,0.0,0.0,06/21/16 07:08:44 AM PDT,,,2016-06-21
203,75,Black Community We finally made a website News about black racial andsocial issues Get breaking news and analysis on the life of African Americancommunity in the US Black Matters Hillary Doesnt Deserve Black VotesYoung black voters give up on Mrs Clinton Outraged Flint Resident LawsuitMust Be Filed Against State Flint Water Crisis touched the feelings of allAmericans and the whole world Justice For Aiyana Jones Rally The tragicdeath of Aiyana Jones a yearold AfricanAmerican fatally shot by a Detroitpolice officerOfficers Who Shot Jeremy McDole Wont Face Statecharges Family Protests In Wilmington Friday The tragic alleged murder ofJeremy McDole happened last September after he had been robbed andshot by an unknown robber Black Girl Gets Rope Burns During A CampingTrip When Sandy Rougelys yearold daughter returned from a one daycamping trip on AprilSandy was shocked to see a horrible rope burn onthe front side of the kids neck Black Matters,0.0,https:Hblackmattersus.com/,0.0,0.0,05/23/16 08:02:51 AM PDT,,,2016-05-23
204,76,Black Community We finally made a website News about black racial andsocial issues Get breaking news and analysis on the life of African Americancommunity in the US Black Matters Hillary Doesnt Deserve Black VotesYoung black voters give up on Mrs Clinton Outraged Flint Resident LawsuitMust Be Filed Against State Flint Water Crisis touched the feelings of allAmericans and the whole world Justice For Aiyana Jones Rally The tragicdeath of Aiyana Jones a yearold AfricanAmerican fatally shot by a Detroitpolice officerOfficers Who Shot Jeremy McDole Wont Face Statecharges Family Protests In Wilmington Friday The tragic alleged murder ofJeremy McDole happened last September after he had been robbed andshot by an unknown robber Black Matters,14182.61,https:Hblackmattersus.com/,89836.0,3402.0,05/24/16 12:19:06 AM PDT,,,2016-05-24
205,77,Black Community We finally made a website News about black racial andsocial issues Get breaking news and analysis on the life of African Americancommunity in the US Black Matters Hillary Doesnt Deserve Black VotesYoung black voters give up on Mrs Clinton Outraged Flint Resident LawsuitMust Be Filed Against State Flint Water Crisis touched the feelings of allAmericans and the whole world Justice For Aiyana Jones Rally The tragicdeath of Aiyana Jones a yearold AfricanAmerican fatally shot by a Detroitpolice officerOfficers Who Shot Jeremy McDole Wont Face Statecharges Family Protests In Wilmington Friday The tragic alleged murder ofJeremy McDole happened last September after he had been robbed andshot by an unknown robber Black Matters,0.0,https:Hblackmattersus.com/,0.0,0.0,06/16/16 01:21:05 AM PDT,,,2016-06-16
206,97,Get breaking news and analysis on the life of African American community inthe US Black Matters Black Matters This Is What Being Confident In OnesBlackness Means To Some White Conservatives Black Matters LifeExpectancy For Black Americans Increase Black Matters Police BrutalityVideos Change How Black Men Live Black Matters,5241.6,https://blackmattersus.com/,74257.0,2603.0,05/10/16 07:26:47 AM PDT,,,2016-05-10
207,98,Get breaking news and analysis on the life of African American community inthe US Black Matters Black Matters This Is What Being Confident In OnesBlackness Means To Some White Conservatives Black Matters LifeExpectancy For Black Americans Increase Black Matters Police BrutalityVideos Change How Black Men Live Black Matters,0.0,https://blackmattersus.com/,0.0,0.0,06/23/16 06:07:51 AM PDT,,,2016-06-23
208,99,Get breaking news and analysis on the life of African American community inthe US Black Matters Black Matters,0.0,https://blackmattersus.com/,0.0,0.0,06/23/16 06:11:47 AM PDT,,,2016-06-23
209,109,Get breaking news and analysis on the life of African American community inthe US Black Matters Justice I dont think so Black Matters,3525.68,https://blackmattersus.com/,34545.0,2218.0,06/23/16 06:05:12 AM PDT,,,2016-06-23
210,112,Get breaking news of African American community in the US,271.0,https://www.facebook.com/Black-Matters-1579673598947501/,3086.0,117.0,04/12/16 07:44:27 AM PDT,,,2016-04-12
211,216,An unarmed black man who was shot by two officers in Florida inhasbeen compensated by the state through the effort of the Black Lives MatterFusion reported that the nowparalyzed Dontrell Stephens the unarmed blackman who was shot in Florida during traffic stop in Septemberby Sgt,1.0,https://www.facebook.com/Black-Matters-1579673598947501/,13936.0,2116.0,04/14/16 01:21:30 AM PDT,,,2016-04-14
212,230,Nine Black Lives Matter protesters were arrested after a counterprotest at aprowhite rally organized by members of Ku Klux Klan in Georgia A whitepower rally was held over the weekend by members of KKK Aryan Nationsects and other white supremacist groups to celebrate the ConfederateMemorial Day BLM Members Arrested For CounterProtest Against WhitePower Rally In Georgia I Black Matters Black Matters,2548.82,https://blackmattersus.com/7167-blm-members-arrested-for-counter-protest-,19309.0,2252.0,04/25/16 05:25:19 AM PDT,,,2016-04-25
213,239,The teachers responsible for such a cruel and inhumane punishment of childshould be fired and never allowed to teach again A Georgian woman isfurious after a teacher punished her yearold special needs grandson bymaking him hang by his belt from a loop on the top of a chalkboard TeachersHung YearOld Black Special Needs Boy By Belt From Top Of ChalkboardBlack Matters Black Matters,2.64,https://www.facebook.com/Black-Matters-1579673598947501/,19.0,1.0,05/06/16 03:35:04 AM PDT,,,2016-05-06
214,244,A Public Defender posed a controversial question to potential Jurors for thetrial of a young Black man convicted of murder The question indicated to anincreasing awareness among public defenders that they too may harbor racialand ethnic biases about Blacks Earlier this year San Francisco publicdefender Mark Jacobs posed a shocking question to a group of jurors priorto the trial of a young black man The quest Racial Incongruities In USCriminal Justice System I Black Matters Black Matters,100.0,https://www.facebook.com/Black-Matters-1579673598947501/,1118.0,63.0,05/06/16 03:32:11 AM PDT,,,2016-05-06
215,254,Highprofiled black deaths at the hands of police have forced AfricanAmericans to change their personality and the way they live their lives Amid aspiral of black deaths at the hands of officers many young AfricanAmericansworried about the possibility of becoming victims of police brutality havePolice Brutality Videos Change How Black Men Live I Black Matters BlackMatters,218.76,https://www.facebook.com/Black-Matters-1579673598947501/,1864.0,176.0,05/10/16 02:24:12 AM PDT,,,2016-05-10
216,260,I dont do black hair the barber said,246.25,https://www.facebook.com/Black-Matters-1579673598947501/,1500.0,99.0,05/13/16 06:40:13 AM PDT,,,2016-05-13
217,272,Chicago researchers believe a few minutes of meditation may be a solution todealing with stress problems for black students Researchers at the EriksonInstitute in Chicago are carrying out a yearstudy to determine whethersitting down for few minutes with legs crossed each other a New StudyMeditation May Help Black Students Cope With Stress I Black Matters BlackMatters,90.73,https://www.facebook.com/Black-Matters-1579673598947501/,90.0,6.0,05/23/16 08:06:37 AM PDT,Detroit Michigan,Michigan,2016-05-23
218,282,We are conducting this survey because your opinion is important to us BlackVoices must be heard Black opinion matters Online survey powered byTypeform Thank you for your time We highly appreciate your efforts and youropinion Please SHARE this article with your friends to m Take Part in BlackPride Survey I Black Matters Black Matters,1500.0,https://blackmattersus.com/10718-take-part-in-black-pride-survey/,21301.0,1814.0,07/07/16 08:05:38 AM PDT,,,2016-07-07
219,287,Stereotype Being black while shopping in a grocery store A grocery clerkAbhishek Dubey has been arrested for holding yearold Black boy Dylanunder gunpoint in store Dubey racially profiled the young boy suspecti AtlantaMan Arrested For Locking Black Boy In Grocery Store I Black Matters BlackMatters,500.0,https://www.facebook.com/Black-Matters-1579673598947501/,4077.0,466.0,07/22/16 02:39:42 AM PDT,,,2016-07-22
220,288,Individual protesters in Oakland refused to attend police barbecue until theirmessage is heard Black Lives Matter Wichita Kan Activists earlier thisweek engaged in a protest that ended in a reunion cookout with the policeThe Wichita Police Chief Go Oakland Protesters Response To Police BBQInvitation I Black Matters Black Matters,500.0,https://www.facebook.com/Black-Matters-1579673598947501/,3203.0,345.0,07/22/16 02:39:14 AM PDT,,,2016-07-22
221,374,Join us because we care Black matters,44.87,https://www.facebook.com/Black-Matters-1579673598947501/,137.0,0.0,06/10/15 02:59:53 AM PDT,Baltimore Maryland Missouri,Maryland Missouri,2015-06-10
222,418,Whats life of black American today How equal are weHave you ever been hurt by aggressive police officers because of your raceWhats your storyTake an action and tell us your story and we post it on Black Matters Wedont want our community to continue struggling with racism and policeaggression We want to fight back and to show how strong we are,0.0,https://www.facebook.com/Black-Matters-1579673598947501/,0.0,0.0,07/08/15 07:23:45 AM PDT,Baltimore Maryland Missouri Cleveland Ohio,Maryland Missouri Ohio,2015-07-08
223,437,The first lesson of economics is scarcity there is never enough of anything tofully satisfy all those who want it The first lesson of Obamas policies is todisregard the first lesson of economicsUSA TO ISSUE MORE GREEN CARDS THAN POPULATIONS OF IOWANEW HAMPSHIRE SOUTH CAROLINA COMBINED The lions share ofthese visas are for lesserskilled and lowerpaid workers and their dependentswho because they are here on workauthorized visas are added directly tothe same labor pool occupied by current unemployed jobseekers Expresslybecause they arrive on legal immigrant visas most will be able to draw a widerange of taxpayerfunded benefits and corporations will be allowed to directlysubstitute these workers for AmericansImproved border security would have no effect on the continued arrival ofthese foreign workers refugees and permanent immigrantsbecause theyare all invited here by the federal governmentObama swore an oath to uphold our Constitution and protect the Americanpeople but he has done everything in his power to destroy us In a short fewyears America will resemble Mehico City where you will need to defendyour life almost on a daily basisObama is killing our country In turn I hope he drops dead soon,129.4,https://www.facebook.com/patriototus,472.0,92.0,08/04/15 05:37:48 AM PDT,,,2015-08-04
224,440,This brave hero finally gets home to her daughterThis picture takes my breath away recognizing the contribution that themilitary child makes as their parent or parents serve our nation,43.18,https://www.facebook.com/patriototus,120.0,21.0,08/05/15 12:06:30 AM PDT,,,2015-08-05
225,441,Its time for THE PEOPLE to stand for Constitutional rights Join,24.95,,15.0,0.0,04/13/16 03:23:03 AM PDT,Atlanta Georgia,Georgia,2016-04-13
226,459,The leader of radical religious group Nation of Islam Louis Farrakhanannounced that th anniversary Million Man March rally will take place onOctoberin Washington DC at the National Mall Organizers of theMillion Man March call for justice standing against the police and for blacksLatinos and incarceratedThey say racism rises among the police officers but in fact it rises amongradical groups Only black activists say black lives matter forgetting the factthat justice is when all lives matterAmericans are not against blacks Latinos etc But if somebody breaks thelaw he should be punished despite of his color or religion If somebody goesover the speed limit he should be ticketed If somebody breaks theimmigration law he should be deported If somebody kills a man he shouldbe imprisonedGiven the fact that two Islamic extremists who were arrested one year ago inFerguson belong to the Nation of Islam I cannot believe in Farrakhansbenevolent intentionsThis Million Man March looks like another liberal overture to black and Muslimcommunities This is a bad idea especially if we take into account the recentnews about British jihadi who have published the address of the Navy SealRobert ONeill the man who fatally shot Osama bin Laden and called onAmerican extremists to execute himThere is no problem if whoever wants to live in the United States But heshould live here legally he should not break the law Its justice,1993.03,https://www.facebook.com/patriototus,2499.0,229.0,10/08/15 12:34:04 AM PDT,Washington,Washington,2015-10-08
227,462,Join the Crusade against Federal tyranny Protect the Constitution,48.63,,60.0,1.0,04/13/16 03:24:25 AM PDT,Atlanta Georgia,Georgia,2016-04-13
228,463,Join the Crusade against Federal tyranny Protect the Constitution,11.24,,14.0,0.0,04/13/16 03:24:30 AM PDT,Atlanta Georgia,Georgia,2016-04-13
229,467,America has always been hinged on hardworking people If you remove jobsyoull remove our country from the world map The state of Pennsylvaniarose owing to multiple enterprises mining coal producing steel and creatingthe need for other jobs groceries doctors dentists insurance gas vehiclesmechanics and the list goes on As far as Mr Trump pursues the goal ofcreating more jobs and supports the working class He said he would putminers back to work We could help Mr Trump win Pennsylvania which is abattleground state Wed like to organize a rally Miners for Trump inPennsylvaniaHave something against coal industries Please note then that burning coal isnot more harmful than lumber Alternative energy is only possible whensubsidized by government for it is not lucrative You cannot leave tens ofthousands of people without a job just because of lobbyists interestsThe current list of locations is being elaborated Suggested cities are EriePittsburg Scranton Harrisburg Allentown and PhillyConfirmed locationsMarconi Plaza Philadelphia Miners for Trump Unity day in Pennsylvania,2.96,https://www.facebook.com/events/312522819127036/,2.0,0.0,09/22/16 05:01:05 AM PDT,New York,New York,2016-09-22
230,468,America has always been hinged on hardworking people If you remove jobsyoull remove our country from the world map The state of Pennsylvaniarose owing to multiple enterprises mining coal producing steel and creatingthe need for other jobs groceries doctors dentists insurance gas vehiclesmechanics and the list goes on As far as Mr Trump pursues the goal ofcreating more jobs and supports the working class He said he would putminers back to work We could help Mr Trump win Pennsylvania which is abattleground state Wed like to organize a rally Miners for Trump inPennsylvaniaHave something against coal industries Please note then that burning coal isnot more harmful than lumber Alternative energy is only possible whensubsidized by government for it is not lucrative You cannot leave tens ofthousands of people without a job just because of lobbyists interestsThe current list of locations is being elaborated Suggested cities are EriePittsburg Scranton Harrisburg Allentown and PhillyConfirmed locationsMarconi Plaza Philadelphia Miners for Trump Unity day in Pennsylvania,0.0,https://www.facebook.com/events/312522819127036/,0.0,0.0,09/22/16 05:09:05 AM PDT,Pennsylvania,Pennsylvania,2016-09-22
231,469,America has always been hinged on hardworking people If you remove jobsyoull remove our country from the world map The state of Pennsylvaniarose owing to multiple enterprises mining coal producing steel and creatingthe need for other jobs groceries doctors dentists insurance gas vehiclesmechanics and the list goes on As far as Mr Trump pursues the goal ofcreating more jobs and supports the working class He said he would putminers back to work We could help Mr Trump win Pennsylvania which is abattleground state Wed like to organize a rally Miners for Trump inPennsylvaniaHave something against coal industries Please note then that burning coal isnot more harmful than lumber Alternative energy is only possible whensubsidized by government for it is not lucrative You cannot leave tens ofthousands of people without a job just because of lobbyists interestsThe current list of locations is being elaborated Suggested cities are EriePittsburg Scranton Harrisburg Allentown and PhillyConfirmed locationsMarconi Plaza Philadelphia Miners for Trump Unity day in Pennsylvania,876.44,https://www.facebook.com/events/312522819127036/,1225.0,77.0,09/22/16 05:13:54 AM PDT,Allen Erie Harrisburg Philadelphia Pittsburg Scranton Pennsylvania,Pennsylvania,2016-09-22
232,470,America has always been hinged on hardworking people If you remove jobsyoull remove our country from the world map The state of Pennsylvaniarose owing to multiple enterprises mining coal producing steel and creatingthe need for other jobs groceries doctors dentists insurance gas vehiclesmechanics and the list goes on As far as Mr Trump pursues the goal ofcreating more jobs and supports the working class He said he would putminers back to work We could help Mr Trump win Pennsylvania which is abattleground state Wed like to organize a rally Miners for Trump inPennsylvaniaHave something against coal industries Please note then that burning coal isnot more harmful than lumber Alternative energy is only possible whensubsidized by government for it is not lucrative You cannot leave tens ofthousands of people without a job just because of lobbyists interestsThe current list of locations is being elaborated Suggested cities are EriePittsburg Scranton Harrisburg Allentown and PhillyConfirmed locationsMarconi Plaza Philadelphia Miners for Trump Unity day in Pennsylvania,7120.6,https://www.facebook.com/events/312522819127036/,7282.0,457.0,09/23/16 02:42:16 AM PDT,Philadelphia Pittsburg Pennsylvania,Pennsylvania,2016-09-23
233,472,Donald John Trump was elected the th president of the United States onTuesday Today some massive crowds of libtards marched in NYC againstelection of Donald TrumpCome to Trump Tower th Aveon Saturday to show Mr Trump thereactually ARE people in NY who voted for him Support Trump in NYC,0.0,https://www.facebook.com/events/365162297165103/,0.0,0.0,11/10/16 04:41:38 AM PST,New York,New York,2016-11-10
234,473,Donald John Trump was elected the th president of the United States onTuesday Today some massive crowds of libtards marched in NYC againstelection of Donald TrumpCome to Trump Tower th Aveon Saturday to show Mr Trump thereactually ARE people in NY who voted for him Support Trump in NYC,0.0,https://www.facebook.com/events/365162297165103/,0.0,0.0,11/10/16 04:44:36 AM PST,New York,New York,2016-11-10
235,474,Donald John Trump was elected the th president of the United States onTuesday Today some massive crowds of libtards marched in NYC againstelection of Donald TrumpCome to Trump Tower th Aveon Saturday to show Mr Trump thereactually ARE people in NY who voted for him Support Trump in NYC,0.6,https://www.facebook.com/events/365162297165103/,1.0,0.0,11/10/16 04:50:28 AM PST,New York,New York,2016-11-10
236,475,Donald John Trump was elected the th president of the United States onTuesday Today some massive crowds of libtards marched in NYC againstelection of Donald TrumpCome to Trump Tower th Aveon Saturday to show Mr Trump thereactually ARE people in NY who voted for him Support Trump in NYC,1999.4,https://www.facebook.com/events/365162297165103/,4171.0,551.0,11/10/16 05:00:07 AM PST,New York,New York,2016-11-10
237,476,We insist over and over again Black Lives Matter is a radical hate group andits violent actions must be stopped And were glad to know that our policeofficials are on our side on that issue,500.0,https://www.facebook.com/Being-Patriotic-1601685693432389/,3001.0,204.0,07/14/16 01:35:03 AM PDT,New York,New York,2016-07-14
238,483,Its time for THE PEOPLE to stand for Constitutional rights Join II,84.01,,60.0,3.0,04/13/16 03:22:57 AM PDT,Atlanta Georgia,Georgia,2016-04-13
239,491,absolutely love this picture I cant explain why but just everything about itmakes it kind of dusty in here,80.79,https://www.facebook.com/patriototus,635.0,52.0,07/15/15 08:28:48 AM PDT,,,2015-07-15
240,493,Stand for the people not the Government Join the rally in Atlanta,148.73,,94.0,4.0,04/13/16 03:24:03 AM PDT,Atlanta Georgia,Georgia,2016-04-13
241,495,This cute babe is a fan of the Patriots What is your favorite NFL team,461.56,https://www.facebook.com/patriototus,975.0,41.0,07/17/15 12:55:09 AM PDT,,,2015-07-17
242,501,Stop federal overreach Stand for the patriots in a protest rally in AtlantaGA,108.14,,78.0,3.0,04/13/16 03:23:39 AM PDT,Atlanta Georgia,Georgia,2016-04-13
243,502,We pay tax money that are wasted on wars in the East instead of protect ourown borders and support economy,643.98,https://www.facebook.com/patriototus,2772.0,487.0,08/05/15 07:23:53 AM PDT,,,2015-08-05
244,503,The Justice Department is set to release aboutinmates from federalprisons in a bid to reduce overcrowding It is the largest onetime release offederal prisoners The Department will release drug offenders who receivedharsh sentences over the last three decades Every third of them is illegalimmigrantBarack Obama has criticized overblown sentencing laws thatdisproportionately impact communities of color But is it indeed a reason torelease criminals If Latinos commit crimes often than whites it doesntmean that some Latino criminals should escape penalty,120.46,https://www.facebook.com/patriototus,134.0,21.0,10/08/15 12:39:35 AM PDT,Washington,Washington,2015-10-08
245,514,Jindal on ImmigrationWe Got to Stop the Hyphenated AmericansAmericas immigration problem will only be solved with a secure borderLouisiana Gov Bobby Jindal tells Newsmax TVIn an exclusive interview with Newsmax Prime host JD Hayworth the GOPpresidential hopeful said part of the problem also lies with President BarackObama out there saying dont worry were not going to enforceGood words Mr Jindal too bad democrats dont understand such an obviousthings and continue to let illegals into the US They want to keep the borderopen so violent illegal aliens can victimize our citizensJindal said that in a trip to the border he witnessed illegal aliens easilygaining entryI saw three groups come right across in broad daylight he said One groupwalked across a manmade dam got to a fence they swing the gate wideopen Its not even lockedAmerica floods the country with people who have no job skills and offer thema living on welfare Voila we have a work ethic breakdown I think its time forgovernment to do their job and protect our country America for Americans,40.79,https://www.facebook.com/patriototus,71.0,8.0,08/13/15 02:19:00 AM PDT,,,2015-08-13
246,530,The recent poll has shown military representatives prefer Trump two timesmore than Clinton I wonder how Hillary can even have military supportersour soldiers have suffered enough from the liberalinchief for the last eightyearsWhats also confusing in that pollalmost every fifth polled soldier refuses tovote at all Its a great demonstration out troops no longer trust the Presidentand Clinton would definitely not change the situationNo need to remind you what mistakes can Hillary do if allowed running ourmilitary forces we dont need another Iraq and we definitely dont needanother Benghazi,25.14,https://www.facebook.com/Being-Patriotic-1601685693432389/,192.0,43.0,05/10/16 08:13:33 AM PDT,,,2016-05-10
247,531,Remember that terrible case when a student was forced by YorkComprehensive High School officials to remove the Old Glory from hispickup It happened in Mayand luckily had a happy end as a result thestudents were allowed to attach our flag to their vehiclesThe story ended well by efforts of dozens of patriots united to protest againstHigh School authorities It was a peaceful but strong and confident protestthat made the authorities listen it was a great example of how consciouspeople should act We have to keep ready to stand against all kinds of attackson American values and Constitutional lawsUnfortunately our current Government approves and even provokes theseattacks and the liberals offensive and violent moods make it cleareveryAmerican patriot has to be careful and attentive,17.24,https://www.facebook.com/Being-Patriotic-1 601685693432389/,129.0,32.0,05/10/16 08:12:26 AM PDT,,,2016-05-10
248,533,Stop federal overreach Stand for the patriots in a protest rally in AtlantaGA,4.41,,6.0,0.0,04/13/16 03:23:45 AM PDT,Atlanta Georgia,Georgia,2016-04-13
249,535,Join the Crusade against Federal tyranny Protect the ConstitutionAtlanta,88.55,,88.0,6.0,04/13/16 03:24:29 AM PDT,Atlanta Georgia,Georgia,2016-04-13
250,536,Its time for THE PEOPLE to stand for Constitutional rights Join II,2.23,,4.0,0.0,04/13/16 03:23:02 AM PDT,Atlanta Georgia,Georgia,2016-04-13
251,542,A heavily armed Syed Farook his wife and brother opened fire on a holidaybanquet for his coworkers Wednesday killingpeople and seriouslywounding more than a dozen others in a precision assault Hours later twoterrorists died in a shootout with San Bernardino police One shooter still atlargeIt is known that gunmen are Muslims They are very religious and probablylinked with ISIS California shooting should become a lesson for theadministrationaccepting refugees from Syria threatens the NationalsecurityIts tragedy Enemies of America attacked our people again Unfortunatelytoday we have no strong leader who is courageous enough to conquerterrorism Nevertheless we will not allow terrorists to change our way of lifeWe will not allow them to restrict our freedomsWe express our sincere condolences to families of victims in Californiashooting If you want to express sympathy for victims change your Facebookprofile picture using this web siteIAm San Bernardino,4263.7,https://www.facebook.com/patriototus/,16250.0,3298.0,12/03/15 06:25:21 AM PST,,,2015-12-03
252,561,SCOTUS RULES AGAINST KENTUCKY CLERK IN GAY MARRIAGE CASEThe Supreme Court on Monday evening denied a Kentucky clerks request tokeep enforcing her no marriage licenses policyan attempt to avoidissuing marriage licenses to samesex coupleswhile she appeals the trialcourts preliminary rulingRowan County Clerk Kim Davis will have to choose whether to issue marriagelicenses defying her Christian conviction or continue to refuse them defyinga federal judge who could pummel her with fines or order that she be hauledoff to jailFor Ms Davis to enact her own personal policy is completely unacceptableShe is on her fourth marriage a sinner according to her Bible yet shesscreaming about religious convictions What a hypocriteAnd she doesnt even perform the ceremony only issue a license What herreligious convictions has to do with it Its not up to her to make policy itsher role only to enact itFunny how all these Christians are preaching and practicing all this hateehIf Jesus were around today his response would be most likely What the hellis wrong with you peopleSameSexMarriage MarriageEquality Kentucky SCOTUS homophobiabigotry,500.0,https://www.facebook.com/LGBT-United-839497472793277/,8111.0,951.0,09/01/15 07:44:55 AM PDT,,,2015-09-01
253,564,Westboro baptist church is planning to stand against tolerance in educationsystem near LG God Hs Bigots Rally,670.15,https://www.facebook.com/events/533144703560571/,1495.0,73.0,05/11 /16 07: 19:33 AM PDT,Kansas,Kansas,
254,566,Westboro baptist church is planning to stand against tolerance in educationsystem near LG Westboro Baptist Church counter protest,3319.9,https://www.facebook.com/events/533144703560571/,,318.0,05/16/16 07:50:43 AM PDT,Kansas,Kansas,2016-05-16
255,567,Westboro baptist church is planning to stand against tolerance in educationsystem near LG Westboro Baptist Church counter protest,5069.71,https://www.facebook.com/events/533144703560571/,9372.0,373.0,05/18/16 12:13:06 AM PDT,Kansas,Kansas,2016-05-18
256,568,Excuse meWHATTaxpayers SpendMillion to Find Out Why Lesbians Are FatA US Health and Human Services study to understand why lesbians are fathas now cost taxpayers overmillion todateThe study Sexual Orientation and Obesity A Test of a GenderedBiopsychosocial Model seeks to determine why there is a disparity in theobesity rates between straight women and lesbian women and straight menand gay menOh God It made you look the fools People overeat when they are unhappywith themselves and their lives Not only lesbians And we have enoughreasons First of allyour researchlts humiliating,116.59,https://www .facebook.com/LGBT-United-839497 472793277 I,467.0,67.0,07/15/15 03:40:04 AM PDT,,,2015-07-15
257,571,Congratulations Now we have the Gay Scouts of AmericaThe Boy Scouts of America Executive Committee unanimously approvedallowing gay adults to serve as leaders officials said on Monday in a majorstep toward dismantling a policy that has caused deep rifts in the yearoldorganizationThis resolution will allow chartered organizations to select adult leaderswithout regard to sexual orientation continuing Scoutings longstandingpolicy of chartered organizations selecting their leadersThe Boy Scouts of Americas ban on gay adults has stood as a toweringexample of explicit institutional homophobia in one of Americas mostimportant and recognizable civic organizationsThis is a step in the right directionbut were still really concerned that thereare still going to be groups that are going to be hostile to gay leadersThisstory certainly brought out the haters and the loony Christians Theyve lostso many cultural battles in their effort to keep us all in the middle ages that Ithink its unhinged most of them,120.29,https://www .facebook.com/LGBT-United-839497 472793277 /,280.0,30.0,07/15/15 03:40:52 AM PDT,,,2015-07-15
258,576,Happiness is like a kiss You must share it to enjoy itShare your kisses be happy and have a gay day,500.0,https://www.facebook.com/LGBT-United-839497472793277/,4930.0,630.0,08/18/15 08:17:48 AM PDT,,,2015-08-18
259,594,Is here anyone from Glendale Arizona WE NEED YOU HELP US to protectthe memory of the victims of hateLast week on Friday May Kieu and Dorothy Dutiel both yearoldsophomores at Independence High School in Glendale each died of a singlegunshot wound aboutam just outside the schools cafeteria The girlswere a couple Police are calling it a murdersuicide This heartbreakingincident is all over the news and the comments are disgusting Homophobesuse the incident as a proof that love is a sinThis is just ignorance Two children died and people are grieving How wouldyou feel if strangers came to your neighborhood or your school to push theiragenda These people are just aggravating the situation and traumatizingother KIDSIf you live in Glendale Arizona please come and support us todayNth AveGlendale AZLETS STAND UP AGAINST BIGOTRY If youare not from Glendale please SHARE this post Let people know we supportthemPS please send us photos from the event,856.29,https://www.facebook.com/Igbtun/,4189.0,679.0,02/18/16 06:40:45 AM PST,Glendale Arizona,Arizona,2016-02-18
260,597,Thats s cool,680.25,https://www.facebook.com/LGBT-United-839497472793277/,6695.0,885.0,08/11/15 08:31:18 AM PDT,,,2015-08-11
261,612,We are not here to entertain straight people They can stare all they want Butplease stop asking these stupid questions about lesbian relationshipsWe dont think of ourselves as a lesbian couple so pleas stop saying thatWe think of ourselves as a couple and like any other we are a couple whois madly in love and who doesnt want to hide that love in order to make otherpeople feel more comfortableOh youd like to join because youve seen a lot of adult videos with lesbiansYou think our deeply emotional fully satisfyingonalllevels relationship is justan act a makeout for you to watch For you to join us in our bedroomNo no and NOlesbian loveislove straight stereotypes,79.35,https://www.facebook.com/LGBT-United-839497472793277/,661.0,104.0,08/24/15 08:28:43 AM PDT,,,2015-08-24
262,614,Discrimination runs rampant in too many people in this countryand it comesin too many forms Ok I just noticed one interesting thingThe kids that needfoster care come from heterosexual families So I think the straights should bebanned from being foster parentsA Kansas Department of Children and Families official said that the state willcontinue to allow qualified single adults to serve as foster parents for abusedand neglected children but she said her agency isnt ready to say whether itwill allow married samesex couples to do soOh GodJust because your gay doesnt make you any less of a human orany less deserving of any right afforded to anyone else Anyone who believesthat a gay person is below a straight person needs treatmentIt is time for this freaking discrimination to end They have no valid reasons fordenying married gays from adopting and fostering kids All they are doing isdenying kids loving homes because of their own bigotry,1700.0,https://www .facebook.com/LGBT-United-839497 472793277 I,22805.0,2341.0,08/04/15 06: 19:55 AM PDT,,,2015-08-04
263,626,INCloseted minor leaguer for St Louis Cardinals quit after coach and playersspoke of killing gay peopleTyler Dunnington was a thround pick by the St Louis Cardinals in theMajor League Baseball draft and given a chance to pursue his dream of beingin the big leagues But after just one season pitching for a Cardinals minorleague team and performing solidly Dunnington quit He explains that duringhis playing days he was a closeted gay man playing in an uncomfortableenvironment A particular low point came when a coach made a braggingreference to the brutal murder in Wyoming of gay college student MatthewShepard whose death led to federal hate crime legislation in the USAnd the hate goes on and on and onYou need fight back Its a shame allthose big strong men are afraid of what somebody does in private,57.37,https://www.facebook.com/LGBT-United-839497472793277/,495.0,76.0,03/24/16 12:08:31 AM PDT,,,2016-03-24
264,627,Finally It took long enough Its so strange that there are individuals andgroups out there still living in the pastFor the first time LGBTQ groups included in NYCs St Patricks paradeThe nations largest St Patricks Day parade kicked off Thursday in NewYork City and for the first time in decades gay activists are not decrying it asan exercise in exclusionThe first of roughlymarchers began striding up Fifth Avenue justafteram in a procession of throbbing pipes and drums smiling dignitariesand waving flagsThank you Now we can come out of the closet and show you who we arehave a fundamental objection to creating divisionsgroupscategories ofcitizens Black white rich poor nationality and gender Just be people,0.0,https://www.facebook.com/LGBT-United-839497472793277/,0.0,0.0,03/24/16 12:08:02 AM PDT,,,2016-03-24
265,628,HUMAN RIGHTS PHOTO CHALLENGEDespite our race religion gender age education sexual orientation andbeliefs we are all HUMANSIn the midst of the presidential race all what politicians dream about ismoney They keep giving empty promises in order to win votes And this isour friendly reminder for the candidates we are the ones who elect them Wedont deserve having problems with employment marriage child birth etcWe all deserve the right to be acceptedGo for it Clicking the like button is not enoughIf you want to attract the candidates attention to the fight for human rights dothe followingTake a picture with Campaign HUMAN RIGHTS logo state requiredPost it in comments within a weekShare with your friends,0.0,https://www .facebook.com/LGBT-United-839497 472793277 I,,,03/23/16 05:38:23 AM PDT,,,2016-03-23
266,629,HUMAN RIGHTS PHOTO CHALLENGEDespite our race religion gender age education sexual orientation andbeliefs we are all HUMANSIn the midst of the presidential race all what politicians dream about ismoney They keep giving empty promises in order to win votes And this isour friendly reminder for the candidates we are the ones who elect them Wedont deserve having problems with employment marriage child birth etcWe all deserve the right to be acceptedGo for it Clicking the like button is not enoughIf you want to attract the candidates attention to the fight for human rights dothe followingTake a picture with Campaign HUMAN RIGHTS logo state requiredPost it in comments within a weekShare with your friendsFor the first placesecond placethird place,169.09,https://www .facebook.com/LGBT-United-839497 472793277 I,870.0,64.0,03/22/1607:17:38 AM PDT,,,2016-03-22
267,630,HUMAN RIGHTS PHOTO CHALLENGEDespite our race religion gender age education sexual orientation andbeliefs we are all HUMANSIn the midst of the presidential race all what politicians dream about ismoney They keep giving empty promises in order to win votes And this isour friendly reminder for the candidates we are the ones who elect them Wedont deserve having problems with employment marriage child birth etcWe all deserve the right to be acceptedGo for it Clicking the like button is not enoughIf you want to attract the candidates attention to the fight for human rights dothe followingTake a picture with Campaign HUMAN RIGHTS logo state requiredPost it in comments within a weekShare with your friendsFor the first placesecond placethird place,7.8,https://www .facebook.com/LGBT-United-839497 472793277 I,14.0,2.0,03/22/16 07: 19:51 AM PDT,Glendale Arizona,Arizona,2016-03-22
268,631,Is here anyone from Glendale Arizona WE NEED YOU HELP US to protectthe memory of the victims of hateLast week on Friday May Kieu and Dorothy Dutiel both yearoldsophomores at Independence High School in Glendale each died of a singlegunshot wound aboutam just outside the schools cafeteria The girlswere a couple Police are calling it a murdersuicide This heartbreakingincident is all over the news and the comments are disgusting Homophobesuse the incident as a proof that homo love is a sinThis is just ignorance Two children died and people are grieving How wouldyou feel if strangers came to your neighborhood or your school to push theiragenda These assholes are just aggravating the situation and traumatizingother KIDSIf you live in Glendale Arizona please come and support us todayNth AveGlendale AZLETS STAND UP AGAINST BIGOTRY If youare not from Glendale please SHARE this post Let people know we supportthemPS please send us photos from the event,0.0,https://www.facebook.com/Igbtun/,0.0,0.0,02/18/16 05:41:28 AM PST,Glendale Arizona,Arizona,2016-02-18
269,632,Is here anyone from Glendale Arizona WE NEED YOU HELP US to protectthe memory of the victims of hateLast week on Friday May Kieu and Dorothy Dutiel both yearoldsophomores at Independence High School in Glendale each died of a singlegunshot wound aboutam just outside the schools cafeteria The girlswere a couple Police are calling it a murdersuicide This heartbreakingincident is all over the news and the comments are disgusting Homophobesuse the incident as a proof that homo love is a sinThis is just ignorance Two children died and people are grieving How wouldyou feel if strangers came to your neighborhood or your school to push theiragenda These assholes are just aggravating the situation and traumatizingother KIDSIf you live in Glendale Arizona please come and support us todayNth Ave Glendale AZLETS STAND UP AGAINST BIGOTRY If youare not from Glendale please SHARE this post Let people know we supportthemPS please send us photos from the event,0.0,https://www.facebook.com/lgbtun/,0.0,0.0,02/18/16 05:42:24 AM PST,Glendale Arizona,Arizona,2016-02-18
270,634,Most parents arent prepared for the words Mom Dad Im gay For manyparents first reaction probably will be How will I ever handle this Theanswer is simple and difficult at the same time love and acceptance will helpto understand your childs sexuality and its meaning to you and yourcontinued relationship with your son or daughterSome parents feel they would have been happier not knowing about theirchilds sexuality They look back to before they knew and recall this time asproblemfreeoverlooking the distance they often felt from their child duringthat timeSometimes parents try to deny what is happeningby rejecting what theyrehearing Its just a phase youll get over it by shutting down If youchoose that lifestyle I dont want to hear about it or by not registering theimpact of what were being told Thats nice dear and what do you wantfor dinnerSuch denial often prove as a traumatizing experience for LGBT children Ifyou as a parent II pretend to forgot the truth about your childs sexuality youwould never really know your child A large part of his or her life would be keptsecret from you and you would never really know the whole personIt is important to accept and understand your childs sexuality becausehomosexuality and bisexuality are not a phase While people may experimentfor some time with their sexuality someone who has reached the point oftelling a parent that he or she is gay is not usually going through a phaseOn the contrary he or she has given long and hard thought to understandingand acknowledging his or her sexual orientation So if youre wondering Isshehe sure the answer will almost always be yesDONT BE YOUR CHILDS FIRST CLOSETchildren lgbt momdadimgay gayisok comingout acceptance,7.91,https://www .facebook.com/LGBT-United-839497 472793277 /,20.0,7.0,08/24/15 08:28:21 AM PDT,,,2015-08-24
271,639,SOLDIER SHANERecently Pentagon confirmed plan to lift ban on transgender military serviceLets meet the big player in repealing the banSergeant Shane Ortegadoesnt stand out or appear out of the ordinaryamong his fellow Army soldiersBut theres one thing that differs him from the bulk of troops Shane is the firstopenly trans soldier of the US ArmyHes astonishingly handsome he works out constantly check out hismuscular build he covered in tattoos hes part black Latino and Cherokeehes obsessed with his girlfriend a former model and aspiring doctor and hegets giddy talking about both video games and chopping wood in AlaskaYet despite his solid performance and commitment to serve SGT Ortega hasbeen at risk of getting kicked out of the Army because in official Armypaperwork he is identified as a womanBut the real warriors never surrender Ortega struggled for the equal rights forthe transgender people in the military And he succeededAmericas military progressing slowly towards inclusion and equal opportunityLets hope that these changesll ensure peace instead of waging more warIgbt transgender equality usarmy Ortega,500.0,https://www.facebook.com/LGBT-United-839497472793277/,3274.0,464.0,07/16/15 01:46:23 AM PDT,,,2015-07-16
272,640,Dykes On Bikes birthday is in JulyDykes on bikes is a chartered lesbian motorcycle club withchapters andnumerous affiliations founded back inThey are known for theirparticipation in gay pride events such as Pride parades and significant LGBTevents like the international Gay GamesDykes on Bikes have been leading marches such as Gay pride parades GayGames events and protestsThe Dyke March events are generally noncommercial often in sharp contrastto corporatesponsored pride events and are usually inclusive of lesbian biand trans women Leading pride parades around the world from SanFrancisco to Melbourne Paris London Tokyo Toronto VancouverSydneyZurich Tel Aviv you name itDykesOnBikes DOB lesbian dyke Igbt prideparade,299.93,https://www.facebook.com/LGBT-United-839497472793277/,865.0,91.0,07/16/15 01:45:49 AM PDT,,,2015-07-16
273,643,PleaseSTOP DISCRIMINATION AGAINST HOMOSEXUAL TEACHERSAfter eight years on the job Margie Winters was fired as director of religiouseducation at Waldron Mercy Academy outside Philadelphia not because shejust married her wife but because some parents just found out that shesbeen married for all eight yearsUnfortunately LGBT teachers have long understood that openly expressingtheir identity in school can make them an easy target for discrimination It isthe biggest mistakeWhen students perceive that theyre not supposed to talk abouthomosexuality they conclude that there must be something wrong aboutbeing gay And its a dangerous message that can lead to bullying andharassmentGay teachers need to serve as example for kids Its very powerful both forstraight students and for LGBT students to know that they have teachers andpeople they respect who are LGBT and who are good at their jobs Itsimportant for all students to see that nothing to be ashamed And it must beillegal for employers to discriminate against employees based on their actualor perceived sexual orientation,600.0,https://www .facebook.com/LGBT-United-839497 472793277 I,,229.0,07/10/15 05:36:04 AM PDT,,,2015-07-10
274,644,When this triumphant yearbook entry was published,500.0,https://www .facebook.com/LGBT-United-839497 472793277 I,3359.0,421.0,07/09/15 07:00:23 AM PDT,,,2015-07-09
275,646,This man is great example of human filth and lies Rape children ReallyAre you nutsLouisiana Justice Refuses To Obey Supreme Court Writes Opinion ImplyingGay People Rape Their ChildrenRaising children and starting a family is something that all people look forwardto in life We are just people not criminals AND WE LOVE CHILDREN NOTRAPE We are all equal It is better for child to live with homosexual parentsthen to live on the street or in orphanage Millions of children need love andthey dont care if our love is different Why should we let those children thatare left on the streets be on the streets when a warm and open home areopen to them I dont understand,400.0,https://www .facebook.com/LGBT-United-839497 4 72793277 I,1400.0,156.0,07 /10/15 05: 35:23 AM PDT,,,
276,647,The greatest legacy one can pass on to ones children and grandchildren isnot money or other material things accumulated in ones life but rather alegacy of character and faithLove your children and have a good day,153.89,https://www .facebook.com/LGBT-United-839497 472793277 I,520.0,47.0,07/09/15 06:59:52 AM PDT,,,2015-07-09
277,648,I wish all parents were like this,141.51,https://www .facebook.com/LGBT-United-839497 472793277 I,311.0,44.0,07/08/15 07:26:12 AM PDT,,,2015-07-08
278,649,Homophobic nurse tries to discourage birth mom from allowing gay couple toadopt childWhile the birth mother was resting with the baby Andy and his partner took abreak from the hospital to get some food When they returned they had aflurry of phone messages from the mother crying and urging them to get backsoon A nurse had been questioning her about her decision to let a gaycouple adopt her babyArent you afraid those boys are gonna hurt that baby Arent you afraidthat hes not gonna grow up and be normal asked the nurseExcuse me who the hell is she This bigot is forcing her views onto themother because she doesnt think the baby would grow up normal Amother whos making the difficult decision to place her son up for adoptionand a wonderful couple who wants to raise that child What the hell right doesthe nurse have to try to stop that I hope they fire herIm happy for the Gay couple on becoming parents,452.12,https://www .facebook.com/LGBT-United-839497 472793277 I,6675.0,2042.0,07/10/15 06:14:07 AM PDT,,,2015-07-10
279,651,Nature chooses who will be transgender individuals dont choose thisWe received a letterthe history of lifeHello Just wanted to see if you could share my coming out as trans story onyour page I have been on a long rough journey to this point and I think mystory could help younger trans youth see that no matter how bad it gets italways gets better I would really appreciate this because I want to becomesomeone who inspires the LGBT community to be themselvesEver since I was little I knew I was different I wasnt like any of the otherkids I had a unique way of thinking and often that left me isolated SomethingI still feel the sting of today Unlike most boys who played with Spiderman andSuperman action figures when they were little I played with barbiesIwanted to look like them I wanted to be them It felt right playing with thesedolls I had to hide when I did it though because even at an early age I knewboys werent supposed to play with dolls Once I had gotten got caught bymy grandmothers ex husband and he told me to put them away and stopbeing a sissyPlease spendminutes to read this letterit is very important just to beheartThank you for your brave act You are a true heroPlease share your stories and photosInspire us and others,0.0,https://www .facebook.com/LGBT-United-839497 472793277 I,0.0,0.0,07 /10/15 05: 35:43 AM PDT,,,
280,652,Homophobic nurse tries to discourage birth mom from allowing gay couple toadopt childWhile the birth mother was resting with the baby Andy and his partner took abreak from the hospital to get some food When they returned they had aflurry of phone messages from the mother crying and urging them to get backsoon A nurse had been questioning her about her decision to let a gaycouple adopt her babyArent you afraid those boys are gonna hurt that baby Arent you afraidthat hes not gonna grow up and be normal asked the nurseExcuse me who the hell is she This bigot is forcing her views onto themother because she doesnt think the baby would grow up normal Amother whos making the difficult decision to place her son up for adoptionand a wonderful couple who wants to raise that child What the hell right doesthe nurse have to try to stop that I hope they fire herIm happy for the Gay couple on becoming parents,0.0,https://www .facebook.com/LGBT-United-839497 472793277 I,,,07/10/15 05:37:30 AM PDT,,,2015-07-10
281,655,NOT EVERY BOY WANTS TO BE A SOLDIERA beautiful message was seen on the streets of the capitol with no groupname or credits attached to the projectIt was the poster at top of the bearded man in a pink gown behaving like aqueen and holding a sign saying Not every boy wants to be a soldier Atimely message for todayThe two recent US wars were costly for our nation to put it lightly They ledto domestic devastation of country No matter what Defense Secretary orPOTUS are saying they dont fool me with promises of gay military equality askey to the nations agenda Better talk to me about cutting DoDs budgetFOLKSIgbt USarmy CrossDress GaySoldier Obama DefenseBudgetStopWar,184.81,https://www.facebook.com/LGBT-United-839497472793277/,452.0,35.0,06/23/15 07:04:01 AM PDT,,,2015-06-23
282,664,People can tolerate two homosexuals they see leaving together but the nextday theyre smiling holding hands tenderly embracing one another then theycannot be forgiven It is not the departure for pleasure that is unacceptable itis waking up happyMichel Foucault philosopher and social criticlgbt homophobia Foucault society queerquote,99.95,https://www .facebook.com/LGBT-United-839497 472793277 /,,26.0,06/23/15 07:02:40 AM PDT,,,2015-06-23
283,700,After what happened in Dallas ordinary Texans did not remain indifferentSeveral men armed with AR went to the Splendora Police Department andstood guarding the building Yall should do the same thingwe must protectour cops We wont let some gangsters attack the people who keep oursecurityIf this is a war against policewere joining this war on the cops side,500.0,https://www.facebook.com/Heart-of-Texas-761114847343674/,5401.0,1501.0,07/14/16 12:54:34 AM PDT,Texas,Texas,2016-07-14
284,724,Fellow Texans Its time to say a strong NO to the establishment robbers It isunacceptable for us to see them ruin all weve been building for decades Forcenturies The establishment thinks they can treat us like stupid sheep butthey are wrong We wont put up with this anymore The corrupt media doesnot talk about the crimes committed by Killary Rotten Clinton neither does itmention the leaked emails but it would rather keep on kicking around someoutdated tapes featuring Trump Even Republicans are now offering her avictory by renouncing their nominee What is this if not treason No no noWe are free citizens of Texas and weve had enough of this cheap show onthe screen Were ready to prove our commitment to liberty low taxes andgun rights If Trump wins there will be a possibility to secede peacefully butnot without tension What will happen if Hitlery becomes President Highertaxes to feed undocumented aliens More refugees mosques and terroristattacks Banned guns Continuing economic depression Lets remind themwhat Texas is made of and show that were ready to SECEDEUse our page to team up with other locals Invite your friends and familyspread the word and lets make this effort together Get Ready to Secede,3200.0,https://www.facebook.com/events/1828560880690663/,16168.0,2342.0,10/26/16 04:07:29 AM PDT,Texas,Texas,2016-10-26
285,725,Fellow Texans Its time to say a strong NO to the establishment robbers It isunacceptable for us to see them ruin all weve been building for decades Forcenturies The establishment thinks they can treat us like stupid sheep butthey are wrong We wont put up with this anymore The corrupt media doesnot talk about the crimes committed by Killary Rotten Clinton neither does itmention the leaked emails but it would rather keep on kicking around someoutdated tapes featuring Trump Even Republicans are now offering her avictory by renouncing their nominee What is this if not treason No no noWe are free citizens of Texas and weve had enough of this cheap show onthe screen Were ready to prove our commitment to liberty low taxes andgun rights If Trump wins there will be a possibility to secede peacefully butnot without tension What will happen if Hitlery becomes President Highertaxes to feed undocumented aliens More refugees mosques and terroristattacks Banned guns Continuing economic depression Lets remind themwhat Texas is made of and show that were ready to SECEDEUse our page to team up with other locals Invite your friends and familyspread the word and lets make this effort together Get Ready to Secede,4386.32,https://www.facebook.com/events/1828560880690663/,17334.0,1807.0,11 /02/16 05: 16:25 AM PDT,Abilene Amarillo Austin Beaumont Bryan Conroe Corpus Christi Dallas Fort Worth Houston Lubbock Odessa San Angelo Antonio Temple Texas City Tyler Waco,Texas,
286,726,Fellow Texans Its time to say a strong NO to the establishment robbers It isunacceptable for us to see them ruin all weve been building for decades Forcenturies The establishment thinks they can treat us like stupid sheep butthey are wrong We wont put up with this anymore The corrupt media doesnot talk about the crimes committed by Killary Rotten Clinton neither does itmention the leaked emails but it would rather keep on kicking around someoutdated tapes featuring Trump Even Republicans are now offering her avictory by renouncing their nominee What is this if not treason No no noWe are free citizens of Texas and weve had enough of this cheap show onthe screen Were ready to prove our commitment to liberty low taxes andgun rights If Trump wins there will be a possibility to secede peacefully butnot without tension What will happen if Hitlery becomes President Highertaxes to feed undocumented aliens More refugees mosques and terroristattacks Banned guns Continuing economic depression Lets remind themwhat Texas is made of and show that were ready to SECEDEUse our page to team up with other locals Invite your friends and familyspread the word and lets make this effort together Get Ready to Secede,627.68,https://www.facebook.com/events/1828560880690663/,2897.0,225.0,11/03/16 07:56:02 AM PDT,Abilene Amarillo Austin Beaumont Bryan Conroe Corpus Christi Dallas Fort Worth Houston Lubbock Odessa San Angelo Antonio Temple Texas City Tyler Waco,Texas,2016-11-03
287,777,A New Orleans judge ordered to release seven inmates awaiting trial becausethe Louisiana doesnt have money to defend them Some of them have spentmore than half a year awaiting a trial but the city failed to provide the legalhelp to them Each year the budget is shredding but the Louisiana remainsthe state with the highest incarceration rateEach year the system incarcerates thousands of black men and women forminor violations but they let go the murderers and rapists What is wrong withour country,100.0,https://www.facebook.comnWil liam sKalvin-788980617892144/,653.0,73.0,04/12/16 09:29:36 AM PDT,,,2016-04-12
288,832,BLACK DOLLARS MATTERWhile Black activists are trying to strict American governments attention byorganizing protests Black bank owners urge Black Americans to transfermoney into their banksA few days ago there were started the MoveYourMany campaign which themain goal is to demonstrate the value of Black lives within America At therequest of rapper Killer Mike overpeople have transferred their moneyinto Blackowned banks in the lastdaysyears ago Martin Luther King Jr requested Blacks to replace their fundsfrom nonBlack banks to Blackowned institutions which would help toempower and advance Black communityThe best way to fight the system is to break its capitalist back which is why itis important for Blacks to invest in ourselves,500.0,https://www.facebook.com/WilliamsKalvin-788980617892144/,6508.0,1240.0,07/21/16 09:17:51 AM PDT,,,2016-07-21
289,927,Dance like Misty shine like Lupita slay like Serena speak like Viola fight likeRosa,300.0,https://www.facebook.com/blacktivists/,34501.0,4216.0,05/19/17 07:17:56 AM PDT,,,2017-05-19
290,933,What a beautiful and intelligent child she is How magnificent is her mindWhat a beautiful and intelligent child she is How magnificent,298.65,https://www.facebook.com/blacktivists/,18914.0,771.0,05/18/17 07:08:27 AM PDT,,,2017-05-18
291,934,Police brutality in America gone crazy But America is too busy bombingcountries in the Middle East,110.98,https://www.facebook.com/blacktivists/,10373.0,1501.0,05/23/17 06:13:38 AM PDT,,,2017-05-23
292,935,Police brutality in America gone crazy But America is too busy bombingcountries in the Middle East,789.02,https://www.facebook.com/blacktivists/,52688.0,5519.0,05/24/17 08:24:35 AM PDT,,,2017-05-24
293,936,Only mom can jump in the conversation and resolve the argument betweenfather and daughter and finally settle on the proper way to count Only momcan jump in the conversation and resolve the argument,0.0,https://www.facebook.com/blacktivists/,0.0,0.0,04/13/17 04:43:00 AM PDT,,,2017-04-13
294,937,repost,200.0,https://www.facebook.com/blacktivists/,32942.0,4290.0,05/16/1706:17:51 AM PDT,,,2017-05-16
295,940,When you leave your baby girl alone with her father thats what happensWhen you leave your baby girl alone with her father thats wh,200.0,https://www.facebook.com/blacktivists/,58233.0,4781.0,04/19/17 07:17:40 AM PDT,,,2017-04-19
296,943,No child should grow with an unhealthy sense of selfesteem Be proud ofwho you are,181.54,https://www.facebook.com/blacktivists/,6524.0,863.0,05/18/17 07: 11 :34 AM PDT,,,2017-05-18
297,944,Black beauty in all shades,67.64,https://www.facebook.com/blacktivists/,9022.0,1363.0,03/16/17 05: 34:24 AM PDT,,,2017-03-16
298,946,We should more often expose our children to positive cultural traditions Weshould more often expose our children to positive cultural,200.0,https://www.facebook.com/blacktivists/,63405.0,3990.0,03/23/17 02:44:31 AM PDT,,,2017-03-23
299,947,They marinated their lives in coconut oil,271.69,https://www.facebook.com/blacktivists/,27660.0,4067.0,05/18/17 07:10:08 AM PDT,,,2017-05-18
300,948,Lets be real Our hair is always political,331.95,https://www.facebook.com/Blacktivist-12837154 7 505950/,17771.0,2466.0,12/05/16 11: 17:42 PM PST,,,2016-12-05
301,953,This video may bring tears to your eyes Make it go viral We need this unityin our communities This video may bring tears to your eyes Make it go viralWewwwfacebookcom,200.0,https://www.facebook.com/blacktivists/,83692.0,4369.0,03/23/17 02:47:20 AM PDT,,,2017-03-23
302,955,This hairdresser from Atlanta is amazing She can install locs at supersonicspeeds This hairdresser from Atlanta is amazing She can install locs,523.0,https://www.facebook.com/blacktivists/,489186.0,26179.0,04/03/17 08:21:28 AM PDT,,,2017-04-03
303,957,Practicing the big sister skills Practicing the big sister skills,300.0,https://www.facebook.com/blacktivists/,28841.0,1233.0,05/16/17 06:12:45 AM PDT,,,2017-05-16
304,959,Believe it or not black doctors exist,200.0,https://www.facebook.com/blacktivists/,31093.0,5101.0,03/23/17 02:50:09 AM PDT,,,2017-03-23
305,960,repost,200.0,https://www.facebook.com/Blacktivist-12837154 7 505950/,7527.0,878.0,03/23/17 02:43:42 AM PDT,,,2017-03-23
306,963,repost,221.36,https://www.facebook.com/blacktivists/,9891.0,1479.0,05/18/17 07: 10:51 AM PDT,,,2017-05-18
307,968,repost,200.0,https://www.facebook.com/Blacktivist-12837154 7 505950/,,3894.0,03/23/17 02:47:38 AM PDT,,,2017-03-23
308,969,r e p o s t,200.0,https://www.facebook.com/blacktivists/,8649.0,1288.0,05/16/17 06: 16:49 AM PDT,,,2017-05-16
309,971,Black grandma will always find a way to support her grandkids,200.0,https://www.facebook.com/blacktivists/,38624.0,6915.0,03/23/17 02:51:16 AM PDT,,,2017-03-23
310,972,This picture probably wont go viral because thats not what the media tellS isabout black dads,500.0,https://www.facebook.com/blacktivists/,40946.0,3949.0,05/10/17 06:53:19 AM PDT,,,2017-05-10
311,975,Where is the outcry over children killed by USI guess I should shut my mouth before I wind up missing,202.64,https://www.facebook.com/blacktivists/,11548.0,1027.0,05/19/17 07:09:25 AM PDT,,,2017-05-19
312,980,THOUGHT WE DIDNT HAVE MONEY TO DO SIMPLE THINGS SUCH ASFIXING A TOWNS WATER SUPPLY AND PIPES BUT CAN BOMBCOUNTRIES LIKE WE TAKE SHITS,700.0,https://www.facebook.com/blacktivists/,54103.0,6274.0,05/26/17 08:05:44 AM PDT,,,2017-05-26
313,982,Recent USled coalition strike in Syrias Raqqa province has killedSyrianwomenThe second coalition strike killed a furtherSyrian civiliansThe US bombed Syria because of political regime that American governmentbelieves is torturing peopleWell we are so thankful that Syria didnt bomb America for poisoning childrenin Flint and gassing natives at Standing Rock,170.74,https://www.facebook.com/blacktivists/,8031.0,896.0,05/16/17 07:05:58 AM PDT,,,2017-05-16
314,987,repost,104.8,https://www.facebook.com/blacktivists/,6482.0,1250.0,04/21 /17 07:42:24 AM PDT,,,
315,991,Tag a great dad and break the dangerous myth of themissing black fathers,200.0,https://www.facebook.com/blacktivists/,4185.0,538.0,04/21/17 07:39:47 AM PDT,,,2017-04-21
316,996,repost,200.0,https://www.facebook.com/blacktivists/,21936.0,3559.0,04/20/17 01:29:32 AM PDT,,,2017-04-20
317,997,repost,200.0,https://www.facebook.com/blacktivists/,7434.0,1200.0,04/19/17 07: 16:35 AM PDT,,,2017-04-19
318,999,All it takes is to believe,400.0,https://www.facebook.com/blacktivists/,57613.0,11245.0,04/19/17 07:11:35 AM PDT,,,2017-04-19
319,1000,Dont believe stereotypes Dont believe the media,300.0,https://www.facebook.com/blacktivists/,18426.0,2658.0,04/19/17 07:07:51 AM PDT,,,2017-04-19
320,1006,Ifs not flesh and blood But the heart which makes us fathers and sons,146.11,https://www.facebook.com/blacktivists/,3517.0,337.0,04/14/17 08: 01 :22 AM PDT,,,2017-04-14
321,1010,This video is so precious Father surprises his daughter when he comes toher school after being released from prison His daughter hasnt seen him foryears This video is so precious Father surprises his daughter when,163.31,https://www.facebook.com/blacktivists/,23950.0,2515.0,04/14/17 07:59:25 AM PDT,,,2017-04-14
322,1011,Watch this baby drama This childs great escape is hilarious Watch thisbaby drama This childs great escape is hilarious,173.44,https://www.facebook.com/blacktivists/,93044.0,5582.0,04/14/17 07:58:44 AM PDT,,,2017-04-14
323,1013,Hopefully it will reach someone Please understand our struggles Oneperson cannot represent the whole race,48.43,https://www.facebook.com/blacktivists/,3834.0,550.0,04/13/17 04:45: 19 AM PDT,,,2017-04-13
324,1018,Shout out to black people who think that natural beauty is for them,300.0,https://www.facebook.com/blacktivists/,12877.0,2133.0,04/13/17 04:38:53 AM PDT,,,2017-04-13
325,1020,repost,85.47,https://www.facebook.com/Blacktivist-12837154 7 505950/,10942.0,1999.0,03/23/17 02:45:04 AM PDT,,,2017-03-23
326,1022,In America most employees are instructed to follow black and Latinocustomers because they always are the ones that are the thieves Racialprofiling Yes it is,400.0,https://www.facebook.com/Blacktivist-12837154 7 505950/,48518.0,4588.0,12/04/16 11 :03:21 PM PST,,,2016-12-04
327,1024,You wont stop laughing if you watch this video FatherDaughterTalk,491.23,https://www.facebook.com/Blacktivist-12837154 7 505950/,253726.0,23021.0,02/22/17 06: 15:48 AM PST,,,2017-02-22
328,1027,Black Power Puff Girls Justice must be served By any means necessary,300.0,https://www.facebook.com/Blacktivist-12837154 7 505950/,43618.0,6730.0,02/07/1707:18:42 AM PST,,,2017-02-07
329,1029,This incredibly talented and adorable little boy created his own melody at theage of ONE,389.88,https://www.facebook.com/blacktivists/,55233.0,,12/05/16 06:09:12 AM PST,,,2016-12-05
330,1030,Make sure you guide your children and motivate them,100.0,https://www.facebook.com/Blacktivist-128371547505950/,162331.0,12303.0,02/21/17 05:45:54 AM PST,,,2017-02-21
331,1032,Listen to what this kid just said The role of adults in childrens life is veryimportant,400.0,https://www.facebook.com/blacktivists/,32315.0,1849.0,12/08/16 05:47:30 AM PST,,,2016-12-08
332,1033,This video may bring tears to your eyes Make it go viral We need this unityin our communities,1500.0,https://www.facebook.com/Blacktivist-128371547505950/,501552.0,49197.0,02/14/17 06:35:27 AM PST,,,2017-02-14
333,1035,This powerful message is worth sharing with the worldClick to get oneEkWU,300.0,https://www.facebook.com/Blacktivist-128371547505950/,11909.0,1257.0,12/02/16 05:26:58 AM PST,,,2016-12-02
334,1037,When your mom sends you to shoot a hair tutorial so she can have a fewminutes of peace When your mom sends you to shoot a hair tutorial so shecan ha wwwfacebookcom,300.0,https://www.facebook.com/Blacktivist-128371547505950/,56416.0,4011.0,03/09/17 02:48:35 AM PST,,,2017-03-09
335,1040,When ballet dancers can mix modern dance and ballet When ballet dancerscan mix modern dance and ballet,300.0,https://www.facebook.com/Blacktivist-128371547505950/,295361.0,23054.0,02/09/17 11 :34:38 PM PST,,,2017-02-09
336,1041,Black intelligence is one of the most highly feared things in this country,300.0,https://www.facebook.com/Blacktivist-128371547505950/,31096.0,3516.0,11/03/16 08:09:10 AM PDT,,,2016-11-03
337,1042,Bye Felicia,286.66,https://www.facebook.com/blacktivists/,17394.0,2828.0,12/08/16 11:09:22 PM PST,,,2016-12-08
338,1045,Absolutely stunning child,400.0,https://www.facebook.com/Blacktivist-12837154 7 505950/,20322.0,2847.0,11/01/16 06:22:57 AM PDT,,,2016-11-01
339,1046,Meet these beautiful lawyersThe organization was created to motivate women toin meaningful legalcareers,271.14,https://www.facebook.com/blacktivists/,10940.0,1555.0,12/08/16 11:09:06 PM PST,,,2016-12-08
340,1050,young entrepreneurs members of the Black Male EntrepreneurshipInstitute walked into the blackowned Industrial bank and put their moneythereThis is what black community should be doing This need to continue SupportBlack Business,400.0,https://www.facebook.com/blacktivists/,14395.0,1663.0,12/01/16 07:37:32 AM PST,,,2016-12-01
341,1052,How interesting But you can only get white from black,600.0,https://www.facebook.com/Blacktivist-12837154 7 505950/,10808.0,2218.0,10/20/16 07:54:43 AM PDT,,,2016-10-20
342,1054,Remember folks dance and music is a large part of our culture Rememberfolks dance and music is a large part of our culture,0.76,https://www.facebook.com/Blacktivist-128371547505950/,88.0,4.0,01 /26/17 01 :29:39 AM PST,,,
343,1056,RUNNING INTO DADDYS ARMS A LOT EASIERMeet this little yearold angel Recently she received her stRunners Blade We cant wait to see what you do next little one,255.67,https://www.facebook.com/blacktivists/,14019.0,1733.0,12/09/16 05:45:39 AM PST,,,2016-12-09
344,1057,Growing up dark skinned in America is not an easy task to do Tell yourchildren that they represent a rainbow of beautiful shades that make themspecial,400.0,https://www.facebook.com/blacktivists/,16202.0,1872.0,11 /01 /16 06:23:30 AM PDT,,,
345,1061,Anyways nobody is listening to us,399.28,https://www.facebook.com/Blacktivist-128371547505950/,11932.0,2056.0,10/12/16 03:59:42 AM PDT,Davis,,2016-10-12
346,1062,Anyways nobody is listening to us,0.0,https://www.facebook.com/Blacktivist-128371547505950/,0.0,0.0,10/18/16 06:42:06 AM PDT,,,2016-10-18
347,1063,Anyways nobody is listening to us,0.0,https://www.facebook.com/Blacktivist-128371547505950/,0.0,0.0,10/18/16 06:42:43 AM PDT,,,2016-10-18
348,1065,Dont choose the side of the oppressor There is enough room for you in thefight for black equality and justice A fight for Civil Rights isnt over,0.0,https://www.facebook.com/Blacktivist-128371547505950/,0.0,0.0,10/18/16 06:42:05 AM PDT,,,2016-10-18
349,1066,Dont choose the side of the oppressor There is enough room for you in thefight for black equality and justice A fight for Civil Rights isnt over,0.0,https://www.facebook.com/Blacktivist-128371547505950/,0.0,0.0,10/18/16 06:42:45 AM PDT,,,2016-10-18
350,1070,Bless this kid and her parents who keep out Heritage alive RosaParks,400.0,https://www.facebook.com/Blacktivist-12837154 7 505950/,28025.0,3291.0,11/01/16 06:21 :48 AM PDT,,,2016-11-01
351,1071,Dear copplease stop using our children for publicity stunts,0.0,https://www.facebook.com/Blacktivist-12837154 7 505950/,0.0,0.0,10/20/16 07:48:37 AM PDT,,,2016-10-20
352,1072,Dear cop please stop using our children for publicity stunts,500.0,https://www.facebook.com/Blacktivist-12837154 7 505950/,12077.0,2393.0,10/20/16 07:51:40AM PDT,,,2016-10-20
353,1073,Look at this beautiful four generation photo Such a blessing,500.0,https://www.facebook.com/blacktivists/,27357.0,3208.0,11 /30/16 07: 13:38 AM PST,,,
354,1074,Its should bean official terminology,500.0,https://www.facebook.com/Blacktivist-128371547505950/,68239.0,9666.0,11/03/16 08:09:45 AM PDT,,,2016-11-03
355,1076,Just because dads are the best friends,500.0,https://www.facebook.com/Blacktivist-12837154 7 505950/,81872.0,5921.0,02/17/17 05:42:46 AM PST,,,2017-02-17
356,1077,Goals Congrats to these two,0.0,https://www.facebook.com/Blacktivist-128371547505950/,0.0,0.0,02/07/17 07:18:27 AM PST,,,2017-02-07
357,1078,You will never have to tell a real man how to be the one,500.0,https://www.facebook.com/Blacktivist-12837154 7 505950/,19845.0,2214.0,12/05/16 11: 16:08 PM PST,,,2016-12-05
358,1082,I wish you are still alive to see what America has turn to,400.0,https://www.facebook.com/blacktivists/,25220.0,2953.0,11/30/16 07:14:37 AM PST,,,2016-11-30
359,1083,Its beautiful when you grow together,199.31,https://www.facebook.com/blacktivists/,41781.0,6542.0,03/14/17 01:15:46 AM PDT,,,2017-03-14
360,1087,Positive young black men serving this country will not be on any news outletThar s why we decided to post it here,400.0,https://www.facebook.com/Blacktivist-128371547505950/,12055.0,1781.0,10/18/16 06:57:44 AM PDT,,,2016-10-18
361,1091,Go well beyond profiling,0.0,https://www.facebook.com/Blacktivist-12837154 7 505950/,,,05/11/16 05:07:07 AM PDT,Baltimore Maryland,Maryland,2016-05-11
362,1092,This young woman who resembles an iconic activist Angela Davis broughtback good memories,1200.0,https://www.facebook.com/Blacktivist-128371547505950/,57648.0,8903.0,10/14/16 03:17:23 AM PDT,Davis,,2016-10-14
363,1093,This young woman who resembles an iconic activist Angela Davis broughtback good memories,0.0,https://www.facebook.com/Blacktivist-128371547505950/,0.0,0.0,10/18/16 06:42:06 AM PDT,,,2016-10-18
364,1094,This young woman who resembles an iconic activist Angela Davis broughtback good memories,0.0,https://www.facebook.com/Blacktivist-128371547505950/,0.0,0.0,10/18/16 06:42:44 AM PDT,,,2016-10-18
365,1095,Never back down my friends Black America is so tired of explaining anddebating,400.0,https://www.facebook.com/Blacktivist-128371547505950/,17618.0,2094.0,11 /01 /16 06:24:00 AM PDT,,,
366,1098,You wont see this image circulating on social media because its too positivefor America,300.0,https://www.facebook.com/Blacktivist-128371547505950/,18808.0,2494.0,11/18/16 08:22:43 AM PST,,,2016-11-18
367,1101,FOOTBALL COACH SUSPENDED AND THE WHOLE SEASON CANCELEDAFTER YOUNG ATHLETES TOOK A KNEEYoung people continue to take a knee during a national anthem to protestpolice brutality and racial injustice in America However most of theseathletes paid the price for this demonstration For instance on Septemberafter getting permission from league officials the staff and the students of theBeaumont Bulls football team took a knee before their game On the next daythe students and the staff received death threats Moreover the executiveboard decided to suspend Coach RahORah Barber for the rest of the seasonand canceled the whole football season So now we know what oppositionmight face in this country,600.0,https://www.facebook.com/Blacktivist-128371547505950/,10831.0,1804.0,10/20/16 07:54:03 AM PDT,,,2016-10-20
368,1102,When your melanin pops severely,269.54,https://www.facebook.com/blacktivists/,15198.0,2533.0,12/08/16 11 :09:37 PM PST,,,2016-12-08
369,1103,The blue gang is free to do whatever they want,600.0,https://www.facebook.com/blacktivists/,20252.0,2801.0,11 /30/16 07: 13:08 AM PST,,,
370,1108,Your ignorance is their power Knowledge is your power Grab it and use itright,400.0,https://www.facebook.com/blacktivists/,27094.0,3409.0,12/06/16 11:30:39 PM PST,,,2016-12-06
371,1111,Watch out guys A new generation of educated black men are rising and trustme they wont be silenced,500.0,https://www.facebook.com/Blacktivist-128371547505950/,8461.0,1545.0,10/20/16 07:52:36 AM PDT,,,2016-10-20
372,1113,She just beat it,400.0,https://www.facebook.com/Blacktivist-1 28371547505950/,43895.0,9623.0,12/04/16 11:02:43 PM PST,,,2016-12-04
373,1118,You make us proud This is what should be reported by media more often toprove the world that Black Girls Rock,0.0,https://www.facebook.com/Blacktivist-128371547505950/,0.0,0.0,03/15/17 05:24:49 AM PDT,,,2017-03-15
374,1124,In America racial oppression and racism were never an ancient history,400.0,https://www.facebook.com/Blacktivist-128371547505950/,31308.0,3704.0,11/01/16 06:22:05 AM PDT,,,2016-11-01
375,1129,Repost,318.43,https://www.facebook.com/blacktivists/,17839.0,2945.0,12/09/16 03:50:28 AM PST,,,2016-12-09
376,1136,Share this and make it go viral Media wont share this because positive Blackmale images ifs not okay to display in America,400.0,https://www.facebook.com/Blacktivist-128371547505950/,9746.0,1415.0,10/18/16 06: 58:45 AM PDT,,,2016-10-18
377,1137,When ballet dancers can mix modern dance and ballet When ballet dancerscan mix modern dance and ballet,0.0,https://www.facebook.com/Blacktivist-128371547505950/,,,02/09/17 11 :32:25 PM PST,,,2017-02-09
378,1139,Black girls are the definition of national greatness,395.08,https://www.facebook.com/blacktivists/,29629.0,4433.0,11/30/16 07:15:04 AM PST,,,2016-11-30
379,1140,A black man employed by Comcast being given a ticket for doing his jobThis man was working on a house when a bystander reported him to thecops When police showed up they drew the gun and told the man to put hishands up because he was accused of walking around the property lookingthrough windows and searching for a way to steal from home Despite the factthat the man wore a red Comcast shirt and was standing next to his whiteComcast truck searching for some wiring to do his job the police gave him aticket for literally doing his job Welcome to the United States of Racism,400.0,https://www .face book. com/Blacktivist-12837154 7 505950/,11817.0,2744.0,10/18/16 06:44:30 AM PDT,,,2016-10-18
380,1143,Art imitates life art This photo is great,400.0,https://www.facebook.com/blacktivists/,24266.0,3722.0,11/30/16 07:15:24 AM PST,,,2016-11-30
381,1158,Black women are stunning gorgeous and absolutely beautiful,400.0,https://www.facebook.com/blacktivists/,19266.0,2665.0,12/07/16 11 :05:45 PM PST,,,2016-12-07
382,1164,Their mom decided to start her childrens first day of school at the NationalMuseum of African American History and Culture What a great day ofhomeschool,1000.0,https://www.facebook.com/Blacktivist-12837154 7 505950/,19035.0,2135.0,10/14/16 03: 19:29 AM PDT,Davis,,2016-10-14
383,1165,Their mom decided to start her childrens first day of school at the NationalMuseum of African American History and Culture What a great day ofhomeschool,0.0,https://www.facebook.com/Blacktivist-12837154 7 505950/,0.0,0.0,10/18/16 06:42:07 AM PDT,,,2016-10-18
384,1166,Their mom decided to start her childrens first day of school at the NationalMuseum of African American History and Culture What a great day ofhomeschool,0.0,https://www.facebook.com/Blacktivist-12837154 7 505950/,,,10/18/16 06:42:43 AM PDT,,,2016-10-18
385,1167,It takes so much of diligence and hard work for black people to be successfulin any business Thats why supporting these businesses not only help blackentrepreneurs but also puts money in the community,400.0,https://www.facebook.com/blacktivists/,18845.0,2668.0,12/06/16 11:30:03 PM PST,,,2016-12-06
386,1176,Share this image because it will never make it to the mainstream media,400.0,https://www.facebook.com/Blacktivist-12837154 7 505950/,17968.0,2305.0,10/18/16 06:43:38 AM PDT,,,2016-10-18
387,1182,Represent your unapologetically African roots,400.0,https://www.facebook.com/blacktivists/,31256.0,4962.0,12/01/16 07:36:41 AM PST,,,2016-12-01
388,1186,When ballet dancers can mix modern dance and ballet When ballet dancerscan mix modern dance and ballet,0.0,https://www.facebook.com/Blacktivist-128371547505950/,,,02/09/17 03:48:08 AM PST,,,2017-02-09
389,1236,White people do not want to be killed and terrorized by police neither doblacks This is called injustice,0.74,https://www.facebook.com/Blacktivist-128371547505950/,3.0,0.0,05/11/16 05:00:55 AM PDT,Baltimore Maryland,Maryland,2016-05-11
390,1237,ANOTHER BLACK MAN MURDERED IN POLICE CUSTODY THINGSHAVE BEEN VERY SILENT ON HIS BEHALFThe yearold black man died Febat Fairfield Medical center after hehad a medical episode at the jail when deputies were moving Ariel J Clarkfrom one cell to another According to police reports Ariel J Clarkwastoo combative with officers and was threatening to kill them during his arrestOn Februarya motorist calledafter interacting with Clark reportingthat Clark who was driving his wife and two children from Buffulo to Texaswas threatening to kill him and his son Clarks wife said that a man and hisson began to argue with her husband who had been acting wierd because hehadnt slept in five days When the police arrived Clark was arrested takento the Fairfield County Jail where he was placed in a restraint chair for hiscombative behavior Three days after arriving in jail Clark had somebreathing difficulties and deputies started chest compression But an hourlater he was pronounced dead at a local hospitalAn investigation has been opened after the death of a Fairfield County JailinmateNow the question is whether the jails standard operating procedures werefollowedWe would like to see a true picture of what he looked like after fighting withthe police Also we would like to see the picture of him when he arrived athospital For now the only thing we know is that another black man died inpolice custody,51.87,https://www.facebook.com/Blacktivist-128371547505950/,54.0,6.0,04/07/16 07:44:35 AM PDT,,,2016-04-07
391,1251,Americalnstotus,0.0,https://instagram.com/black_america_news,0.0,0.0,10/09/15 05: 50:41 AM PDT,Washington Columbia,Washington Columbia,2015-10-09
392,1252,Americalnstotus,0.0,https://instagram.com/black_america_news,,,10/09/15 08:04:33 AM PDT,Washington Columbia,Washington Columbia,2015-10-09
393,1261,If you dont want refugees stop creating them Hands off SyriaPlease come out to support us on June rd in front of Trump Tower in NewYork We must stop this madness Some believed Trump would withdraw theUS from useless and bloody military campaigns But what we see is only theenhancement of hostility We dont need wars no more We want peace Itstime for politicians to take care of the US residents instead of fating them aswell as other nationals to deathWere organizing a peaceful gathering to draw public attention to the abovementioned terrible problem Our President and Congress must listen to thosewho granted them powerus the people If you also think that there shouldonly be peace come with us and lets make it happenStop war Stop killing the innocent Make peace not war Make peace notwar,2105.19,https://www.facebook.com/events/239129926564203/,5456.0,256.0,05/26/17 02:05:30 AM PDT,New York,New York,2017-05-26
394,1278,More thanillegal aliens commit sex assaults every year in Texas aloneAmericans would really feel safer if the government closes the borders anddeports all illegal aliens,500.0,https://www.facebook.com/Stop-AI-896610653786585/,3852.0,696.0,08/04/16 05:14:35 AM PDT,,,2016-08-04
395,1299,Fortunately some patriots in the United States dont stay away while traitorsdestroy this country Our friends from San Diego organized a rally to supportideas of Donald Trump Patriots carried and waved American flags while theClintonSanders supporters carried MEXICAN flags and attempted to confronta very diverse group of Donald Trump supporters That explains why theDemocrats encourage the illegal immigration They are ready to destroyAmerica just to be electedWe have to defend this nation Lets organize rallies against the illegalimmigration around the whole country Lets flood the United States withAmerican flagsIf you have a desire to organize a rally in your city please contact us We canhelp you Only our patriotism can save the United States of America,200.0,https://www.facebook.com/Stop-Al-896610653786585/,1492.0,288.0,06/06/16 07:46:25 AM PDT,,,2016-06-06
396,1301,bet most of Americans dont want to pay for illegal aliens that get morewelfare benefits than US citizens And if the people are only source ofpower according to the Constitution of the United States of America whydoes the government not deport all illegal aliens yet,300.0,https://www.facebook.com/Stop-Al-896610653786585/,1111.0,237.0,05/18/16 01:48:58 AM PDT,,,2016-05-18
397,1312,Aboutbillion dollars are spent each year on illegal aliens for welfaresocial services by the American taxpayers Are leftists still sure that illegalimmigration improves our economy,0.0,https://www.facebook.com/Stop-AI-896610653786585/,0.0,0.0,05/05/16 03:28:16 AM PDT,,,2016-05-05
398,1313,Aboutbillion dollars are spent each year on illegal aliens for welfaresocial services by the American taxpayers Are leftists still sure that illegalimmigration improves our economy,500.0,https://www.facebook.com/Stop-AI-896610653786585/,2933.0,493.0,05/05/16 07:25:05 AM PDT,,,2016-05-05
399,1314,Aboutbillion dollars are spent each year on illegal aliens for welfaresocial services by the American taxpayers Are leftists still sure that illegalimmigration improves our economy,0.0,https://www.facebook.com/Stop-AI-896610653786585/,0.0,0.0,07/06/16 06:56:35 AM PDT,,,2016-07-06
400,1317,We have many problems in our country at the moment Healthcare educationand Veterans are just on the top of the list But one problem is destroying ourcountry more than anything else Illegal aliens affect our economy drasticallyNot only they sink the job market and steal hundreds of millions of welfaredollars they also flood America with drugs which is the worst Mexicancartels have a stable stream of drugs through the border and our governmentdoes nothing with itTo cure our nation we need to get rid of all the gangs and illegal immigrantsand build a huge wall so they would never come back,200.0,https://www.facebook.com/Stop-Al-896610653786585/,1488.0,379.0,06/06/16 07:46:01 AM PDT,,,2016-06-06
401,1328,Its wrong if you support Hillary Clinton who said that problems within theVeterans Affairs Department have not been as widespread Hundreds ofthousands of veterans may have died awaiting VA careWE CANNOT TRUST HILLARY TO TAKE CARE OF OUR VETERANS,1000.0,https://www.facebook.com/Stop-Al-896610653786585/,9819.0,2668.0,08/10/16 02:25:38 AM PDT,,,2016-08-10
402,1427,No one is above the law Against Police Brutality,496.81,https://www.facebook.com/BlackJourney2Justice/,487.0,18.0,12/10/15 02:18:40 AM PST,,,2015-12-10
403,1429,Stop police terror with us Joinneed to unite,8449.32,,,294.0,04/12/16 03:08:57 AM PDT,San Francisco California,California,2016-04-12
404,1514,Did you see this DamnWe lost count of how many mentally ill citizens were murdered duringencounters with violent cops Here is another woman suffering from mentalillnessFull story,0.0,https://www.facebook.com/Dont-Shoot-1157233400960126/,0.0,0.0,06/28/16 06:49:12 AM PDT,,,2016-06-28
405,1576,We want to live in the country with no fear,0.0,https://www.facebook.com/BlackJourney2Justice/,0.0,0.0,09/23/15 04:47:56 AM PDT,,,2015-09-23
406,1577,We want to live in the country with no fear,0.0,https://www.facebook.com/BlackJourney2Justice/,0.0,0.0,11/06/15 02:41:18 AM PST,,,2015-11-06
407,1578,We want to live in the country with no fear,0.0,https://www.facebook.com/BlackJourney2Justice/,0.0,0.0,02/12/16 05:52:58 AM PST,,,2016-02-12
408,1579,We want to live in the country with no fear,0.0,https://www.facebook.com/BlackJourney2Justice/,0.0,0.0,05/05/16 02:12:02 AM PDT,,,2016-05-05
409,1584,We run this community because we care,0.0,https://www.facebook.com/BlackJourney2Justice/,0.0,0.0,09/23/15 04:47:25 AM PDT,,,2015-09-23
410,1586,We run this community because we care,0.0,https://www.facebook.com/BlackJourney2Justice/,0.0,0.0,02/12/16 05:52:58 AM PST,,,2016-02-12
411,1587,We run this community because we care,0.0,https://www.facebook.com/BlackJourney2Justice/,0.0,0.0,05/05/16 02:12:02 AM PDT,,,2016-05-05
412,1589,Its not about who is good and bad its about what is right,0.0,https://www.facebook.com/BlackJourney2Justice/,0.0,0.0,11/06/15 02:41:18 AM PST,,,2015-11-06
413,1590,Its not about who is good and bad its about what is right,0.0,https://www.facebook.com/BlackJourney2Justice/,0.0,0.0,02/12/16 05:52:58 AM PST,,,2016-02-12
414,1591,Its not about who is good and bad its about what is right,0.0,https://www.facebook.com/BlackJourney2Justice/,0.0,0.0,05/05/16 02:12:02 AM PDT,,,2016-05-05
415,1600,We want to grow and not being shot Join us,0.0,https://www.facebook.com/BlackJourney2Justice/,0.0,0.0,09/23/15 04:48:34 AM PDT,,,2015-09-23
416,1601,We want to grow and not being shot Join us,0.0,https://www.facebook.com/BlackJourney2Justice/,0.0,0.0,11/06/15 02:41:18 AM PST,,,2015-11-06
417,1603,We want to grow and not being shot Join us,0.0,https://www.facebook.com/BlackJourney2Justice/,0.0,0.0,05/05/16 02:12:02 AM PDT,,,2016-05-05
418,1604,We are not against police we against police brutality,0.0,https://www.facebook.com/BlackJourney2Justice/,0.0,0.0,09/23/15 04:49:10 AM PDT,,,2015-09-23
419,1605,We are not against police we against police brutality,0.0,https://www.facebook.com/BlackJourney2Justice/,0.0,0.0,11/06/15 02:41:18 AM PST,,,2015-11-06
420,1606,We are not against police we against police brutality,0.0,https://www.facebook.com/BlackJourney2Justice/,0.0,0.0,02/12/16 05:52:58 AM PST,,,2016-02-12
421,1607,We are not against police we against police brutality,0.0,https://www.facebook.com/BlackJourney2Justice/,0.0,0.0,05/05/16 02:12:02 AM PDT,,,2016-05-05
422,1621,Who is ready to do the same in any public place during the weekendsWe really need to stop Islamophobia and the fear of Muslims and changethat false image about us its everybodys duty,500.0,https://www.facebook.com/MuslimAmerica/,1640.0,213.0,03/17/16 04:22:59 AM PDT,New York,New York,2016-03-17
423,1623,The time has come to understand one simple thing we the American muslimsare as American Support Hillary Save American Muslims,3981.07,https://www.facebook.com/events/1170988439609888/,1849.0,94.0,06/24/16 03:28:02 AM PDT,Washington Columbia Clinton,Washington Columbia,2016-06-24
424,1637,The safety freedom and dignity of all people must be safeguarded Terrorismand antiMus Safe Space for Muslim Neighborhood,5004.3,https://www.facebook.com/events/1092180614203742/,3072.0,107.0,08/10/16 03:06:37 AM PDT,Washington Columbia,Washington Columbia,2016-08-10
425,1638,The safety freedom and dignity of all people must be safeguarded Terrorismand antiMus Safe Space for Muslim Neighborhood,12918.43,https://www.facebook.com/events/1092180614203742/,7267.0,427.0,08/15/16 07:24:16 AM PDT,Washington Columbia,Washington Columbia,2016-08-15
426,1639,The safety freedom and dignity of all people must be safeguarded Terrorismand antiMus Safe Space for Muslim Neighborhood,17081.05,https://www.facebook.com/events/1092180614203742/,23858.0,865.0,08/23/16 04:43:48 AM PDT,Washington Columbia,Washington Columbia,2016-08-23
427,1683,Just dont mistake mans member for a deadly weapon and follow cop blockus,5828.7,https://www.facebook.com/AmericanCops-1667165370195771/,27675.0,606.0,08/16/16 02:58:27 AM PDT,,,2016-08-16
428,1684,Our existence is being threatened by a race that sees itselfmasters over ourmelanin but dear Strong Black Men the system and racism got reengagedso we have no choice but to fight back anyway anyhow Followblackmattersus,1721.32,https://www.facebook.com/Blackluive-1725227467722991/,11812.0,147.0,08/18/16 05:05:43 AM PDT,,,2016-08-18
429,1685,oh,0.0,https://www.facebook.com/Memopolis-45047 4615151098/,0.0,0.0,05/16/16 04: 17:32 AM PDT,,,2016-05-16
430,1687,Fed up with police violence Wanna stop police brutality Join us Cop BlockUsBlock AmericanCops,7018.16,https://www.instagram.com/cop_block_us/,113296.0,778.0,12/17/15 05:21:36 AM PST,,,2015-12-17
431,1690,Just smile and buy him a diet coke Join us Click Learn More Cop Block UsBlock AmericanCops,2238.35,https://www.instagram.com/cop_block_us/,34117.0,226.0,12/11/15 02:59:43 AM PST,,,2015-12-11
432,1691,BlackMatters is a nonprofit news outlet that delivers raw and originalinformation on the most urgent issues important to the AfricanAmericancommunity in America Join us,3046.37,https://www.facebook.com/Blackluive-1725227467722991/,37539.0,19.0,04/06/16 06:34:47 AM PDT,,,2016-04-06
433,1692,Say no to genocide in america Join our protest that will be held in front of theHeadquarters of the United Nations in New York city on FebruaryThe race is not to the swift nor does the battle to the strong but time andchance happen to them all as long as black community is not completelyirradicated from the land of america we the little remaining will continue tovoice our griverances out and strive our way through until we attain freedomand justice black americans are brutalised everyday and the oppressors goscot free we have no advocate but we assure white america that oneswe have lives our voices are our tool for survival,5729.7,https://www.facebook.com/Blackluive-1725227467722991/,57249.0,38.0,02/09/16 12:13:19 AM PST,New York,New York,2016-02-09
434,1693,We are looking for brave people who are ready to help our movement whoare creative and active if you are one of such people just let us knowComment below or DM,5505.22,https://www.facebook.com/Blackluive-1725227 467722991 I,,1.0,05/05/16 08:21 :51 AM PDT,Michigan,Michigan,2016-05-05
435,1695,I didnt believe the media SO I BECAME ONE Follow,4.942,https://www.facebook.com/B lack Iuive-1725227467722991/,36601.0,920.0,07/11/16 02:41:37 AM PDT,Louisiana Minnesota,Louisiana Minnesota,2016-07-11
436,1696,Racism is not Heritage and HonorIts time to stand up for whats right,80.1,https://www.facebook.com/BlackIuive-1725227467722991/,421.0,2.0,03/17/16 09:07:59 AM PDT,,,2016-03-17
437,1697,Racism is not Heritage and HonorIts time to stand up for whats right,3097.21,https://www.facebook.com/BlackIuive-1725227467722991/,12518.0,0.0,03/23/16 07:43:04 AM PDT,,,2016-03-23
438,1700,Ops seems like someone screwed upSalute our brave and smart cops who mistake mans member for a deadlyweapon Follow US and stay WOKE,5590.68,https://www.facebook.com/AmericanCops-1667165370195771/,36585.0,765.0,07/12/16 07:44:02 AM PDT,Chicago Illinois Baton Rouge Louisiana Baltimore Maryland Cleveland Ohio,Illinois Louisiana Maryland Ohio,2016-07-12
439,1701,Know your rightsRecord the interactionFOLLOW,749.45,https://www.facebook.com/Am ericanCops-1667165370195771 I,8446.0,0.0,03/16/16 08: 01: 13 AM PDT,,,2016-03-16
440,1705,Shes not even hot,1828.37,https://www.facebook.com/Memopolis-450474615151098/,11478.0,2378.0,06/22/16 07:34:20 AM PDT,,,2016-06-22
441,1707,Either We Together or We Aint,1512.73,https://www.facebook.com/Funnylnst-489676547881868/,8863.0,2.0,05/17/16 04:05:42 AM PDT,Atlanta Georgia New Mexico Ohio South Carolina,Georgia New Mexico Ohio South Carolina,2016-05-17
442,1715,If you do care about the future of black community follow blackmattersusKnow the truth stay tuned,6677.43,https://www.facebook.com/BlackIuive-1725227467722991/,61822.0,1075.0,08/16/16 02:29:55 AM PDT,,,2016-08-16
443,1716,How did he even get in the train,500.0,https://www.facebook.com/Memopolis-450474615151098/,12304.0,3114.0,07/21/16 06:22:01 AM PDT,,,2016-07-21
444,1722,He looks like the guy from Toy Story,700.0,https://www.facebook.com/Memopolis-450474615151098/,5748.0,1106.0,06/23/16 07:17:54 AM PDT,,,2016-06-23
445,1725,Grooms dont throw a bouquet they throw the garter,444.89,https://www.facebook.com/Memopolis-450474615151098/,1440.0,297.0,06/23/16 07:12:11 AM PDT,,,2016-06-23
446,1726,Who else liked it just because the girl was fine as hell,0.0,https://www.facebook.com/Memopolis-450474615151098/,0.0,0.0,06/22/16 07:31:53 AM PDT,,,2016-06-22
447,1727,Who else liked it just because the girl was fine as hell,0.0,https://www.facebook.com/Memopolis-450474615151098/,0.0,0.0,06/22/16 07:34:01 AM PDT,,,2016-06-22
448,1728,Who else liked it just because the girl was fine as hell,500.0,https://www.facebook.com/Memopolis-450474615151098/,11704.0,2888.0,06/22/16 07:35:37 AM PDT,,,2016-06-22
449,1729,Who else liked it just because the girl was fine as hell,0.0,https://www.facebook.com/Memopolis-450474615151098/,0.0,0.0,07/12/16 05:01:24 AM PDT,,,2016-07-12
450,1735,Right after the dick sucking competition,100.0,https://www.facebook.com/Memopolis-450474615151098/,677.0,122.0,05/12/16 06:07:31 AM PDT,,,2016-05-12
451,1738,As long as he has candy Id be fine with it,66.67,https://www.facebook.com/Memopolis-450474615151098/,26.0,1.0,04/22/16 08:10:43 AM PDT,,,2016-04-22
452,1746,Me IRL,100.0,https://www.facebook.com/Memopolis-450474615151098/,554.0,77.0,04/19/16 12:04:53 AM PDT,,,2016-04-19
453,1750,Word,99.0,https://www.facebook.com/Memopolis-450474615151098/,1113.0,130.0,04/18/16 04:20:26 AM PDT,,,2016-04-18
454,1754,Welcome to America,100.0,https://www.facebook.com/Memopolis-450474615151098/,466.0,52.0,04/13/16 12:29:58 AM PDT,,,2016-04-13
455,1755,When you have a Bentley steering wheel In a Jeep,100.0,https://www.facebook.com/Memopolis-450474615151098/,497.0,58.0,04/13/16 12:29:32 AM PDT,,,2016-04-13
456,1756,I will evolve into my feline form,100.0,https://www.facebook.com/Memopolis-450474615151098/,190.0,42.0,04/12/16 08:30:26 AM PDT,,,2016-04-12
457,1760,I was blasting the pokemon theme song from my car driving to the park tolook for pokemon,399.92,https://www.facebook.com/Memopolis-450474615151098/,8037.0,1502.0,07/12/16 05:07:27 AM PDT,,,2016-07-12
458,1777,What a savage,64.29,https://www.facebook.com/Memopolis-45047 4615151098/,77.0,9.0,04/18/16 04: 16:25 AM PDT,,,2016-04-18
459,1778,Unless payeris top screen then exceptions are made,100.0,https://www.facebook.com/Memopolis-450474615151098/,1851.0,192.0,04/15/16 08:16:00 AM PDT,,,2016-04-15
460,1782,Been there done that,75.02,https://www.facebook.com/Memopolis-450474615151098/,400.0,33.0,04/11/16 08:45:29 AM PDT,,,2016-04-11
461,1783,Parenting goals,99.99,https://www.facebook.com/Memopolis-45047 4615151098/,575.0,70.0,04/11/16 06:39:05 AM PDT,,,2016-04-11
462,1784,Think of all little boys and girls who can lose or have already lost theirfathersGod bless our troops We are forever grateful Home of the BraveSupport our Veterans Please repost if you like and dont forget to tag meFollow the link Veterans USA Funnylnst,141.03,https://www.instagram.com/veterans_us/,509.0,5.0,08/12/16 02:10:06 AM PDT,,,2016-08-12
463,1789,No sleep grades are struggling flat broke stressed to the max Homesickjust done adulting Thats basically everything you feel after your first year ofcollege,289.13,https://www.facebook.com/Memopolis-450474615151098/,2079.0,245.0,04/21/16 02:21:58 AM PDT,,,2016-04-21
464,1791,Sunday Bunday,90.07,https://www.facebook.com/Memopolis-450474615151098/,473.0,79.0,04/20/16 02:45:58 AM PDT,,,2016-04-20
465,1792,Then they ask u to stay late,89.47,https://www.facebook.com/Memopolis-450474615151098/,739.0,94.0,04/20/16 02:45:21 AM PDT,,,2016-04-20
466,1796,We didnt believe the media and decided to become one Want to know theactual state of things in USGo visit our website Click here for moreinformation Black Mattersus Blackluive,8690.39,https://blackmattersus.com/,66936.0,117.0,02/04/16 12:40:35 AM PST,,,2016-02-04
467,1799,And they say black people dont have culture,700.0,https://www.facebook.com/Memopolis-450474615151098/,7758.0,1468.0,06/23/16 07:20:12 AM PDT,,,2016-06-23
468,1802,My girl,0.0,https://www.facebook.com/Memopolis-450474615151098/,0.0,0.0,06/22/16 07:31:43 AM PDT,,,2016-06-22
469,1804,My girl,499.85,https://www.facebook.com/Memopolis-450474615151098/,372.0,47.0,06/22/16 07:36:09 AM PDT,,,2016-06-22
470,1809,years later No changes Hundreds of Americans have helddemonstrations in San Francisco to protest police fatal shooting ofMarioWoods last month Click to Learn More Cop Block Us AmericanCops,6915.75,https://www.instagram.com/cop_blockus/,31506.0,149.0,03/11/16 05:53:42 AM PST,San Francisco California,California,2016-03-11
471,1811,Reverse your camera and then zoom in,600.0,https://www.facebook.com/Memopolis-45047 4615151098/,9338.0,1755.0,06/23/16 07:29:41 AM PDT,,,2016-06-23
472,1821,Hulk got his cousin pregnant,0.0,https://www.facebook.com/Memopolis-450474615151098/,0.0,0.0,05/16/16 04:1&54 AM PDT,,,2016-05-16
473,1822,Bu but but this is a guy,100.0,https://www.facebook.com/Memopolis-450474615151098/,1371.0,306.0,05/06/16 04:14:47 AM PDT,,,2016-05-06
474,1842,Fuck if I found a wild Charizard Id stop too,0.0,https://www.facebook.com/Memopolis-450474615151098/,0.0,0.0,07/13/16 01:13:05 AM PDT,,,2016-07-13
475,1843,If she didnt get the reference shes not worth your time,554.17,https://www.facebook.com/Memopolis-450474615151098/,9882.0,2065.0,07/12/16 05:02:54 AM PDT,,,2016-07-12
476,1848,ButBut hes Asian,400.0,https://www.facebook.com/Memopolis-45047 4615151098/,240.0,94.0,06/17/16 06:38:53 AM PDT,,,2016-06-17
477,1868,Hey everyoneYou know a great number of black people support us saying thatHillaryClintonlsNotMyPresident So this time we would like to make aflashmob against HillaryClinton because she is the real enemy of blackcommunity and our followers prove it showing their disgrace to her personalityand policy Thats why we ask you to do the same and send your photos tous Why Because we want to live in a better future and Hillary is not theperson who will help us in getting justice and peace by all meansDear followers if you agree just dont be ignorant to your future in Americajoin our flashmob and take a photo with HillaryClintonForPrison ornohillary and tagLooking forward to your photos BlackMattersUS AmericanCops,1953.63,https://www.instagram.com/blackmattersus/,21555.0,67.0,04/06/16 04:26:42 AM PDT,,,2016-04-06
478,1869,Cheers to the actual heroes that protect and serve communities all overAmerica and the world Cop Block UsBlock AmericanCops,3977.37,https://www.instagram.com/cop_block_us/,15109.0,71.0,03/23/16 06:29:16 AM PDT,,,2016-03-23
479,1870,Hello friends Enjoy us daily All the funniest memes and actual news NutsNews news Funnylnst,2555.92,https://www.instagram.com/nuts.news/,31345.0,157.0,02/11/16 01 :58:14 AM PST,,,2016-02-11
480,1871,Hello friends Enjoy us daily All the funniest memes and actual news ClickLearn More Nuts News news Funnylnst,957.55,https://www.instagram.com/nuts.news/,3330.0,25.0,12/01/15 04:32:19 AM PST,,,2015-12-01
481,1877,Black lives do matter We want justice or else Follow us to know the truth Goto our website to stay abreast of the latest black news in America link in thebio,2222.46,https://www.facebook.com/Yoyoyoyoyoy-1729293847304592/,10114.0,9.0,05/20/16 04:41:47 AM PDT,New York,New York,2016-05-20
482,1879,Is it a crime to be proud of being Black Our women are of the most beautyand men of the most strength American government and media try tosuppress the idea of Blacks being equal Im not even talking about beingbetter We are better we are tougher and we managed to pass through thecenturies of slavery and oppression Thats why we must stay together causetogether we are power United we stand divided we fall Join us Black PrideYoyoyoyoyoy,3282.37,https://www.instagram.com/black_pride_us/,7575.0,68.0,11 /16/15 05:31 :05 AM PST,,,
483,1883,Amandla Stenberg who played Rue in the first Hunger Games movie mayonly beyears old but has wisdom beyond those years Amandla Stenbergis asking a very important question today What would America be like if weloved black people as much as we love black cultureWanna know more about black culture Join us Black PrideYoyoyoyoyoy,516.19,https://www.instagram.com/black prideus/,2766.0,24.0,11/13/15 05:09:26 AM PST,,,2015-11-13
484,1887,Confederate pageon Instagram Follow comment repost Click LearnMore South UnitedYoyoyoyoyo,1290.57,https://www.instagram.com/southunited/,3215.0,30.0,12/01/15 06:21:56 AM PST,,,2015-12-01
485,1888,African American Breaking News and Opinion Click Learn More Black PrideYoyoyoyoyoy,2697.8,https://www.instagram.com/black_pride_us/,27541.0,60.0,12/01/15 06:15:06 AM PST,,,2015-12-01
486,1892,Defend southern heritage Follow instagram south united and get last newshistory articles and even more Click Learn more South United Yoyoyoyoyo,0.0,https://instagram.com/south_united/,,,11/18/15 04:55:24 AM PST,Oklahoma Texas,Oklahoma Texas,2015-11-18
487,1893,Defend southern heritage Follow instagram south united and get last newshistory articles and even more Click Learn more South United Yoyoyoyoyo,957.06,https://instagram.com/south_united/,6856.0,5.0,11/18/15 04:55:49 AM PST,Oklahoma Texas,Oklahoma Texas,2015-11-18
488,1894,Click to Learn More In the s a sevenyearold English girl was washedup on the shores of West Africa and was adopted by her rescuers Shebecame the wife of a Prince and started a dynasty that extends into many oftodays Xhosa royal families Due to her recessive gene now and then a childis born in the area with bright blue eyes This is fascinating This is a pure luckfor a Black girl to be adopted and loved after being thrown to the sea I guessshe deserved to be a queen after what she had experienced Black peopleare the best of the best and Im proud to be Black Blackprideus blackblacklove african africanamerican blacklivesmatter icantbreatheblackpride blackandproud black priiide Yoyoyoyoyoy,405.25,https://www.instagram.com/black_pride_us/,1589.0,4.0,01/15/16 12:56:09 AM PST,,,2016-01-15
489,1900,Click to Learn More Everybody knows that Islam is against terrorism but noteveryone believes this fact Islam does not support terrorism under anycircumstances Terrorism goes against every principle in Islam In fact if aMuslim engages in terrorism he is not following Islam and so he is not aMuslim America stop insulting peaceful citizens stop taking all of us ascriminals we dont deserve such attitude muslimvoice muslimVoiceMusliminst,3587.37,https://www.instagram.com/muslim voice/,9741.0,53.0,01/15/16 01:59:05 AM PST,,,2016-01-15
490,1905,Christmas is coming Were sure that you wont be able to find a betterpresent than a gun Dont believe us Just try once and youll understandwhat were talking about Gun power selfconfidence freedom Tea PartyNewsTeapartypat,114.89,https://www.instagram.com/tea_party_news/,336.0,2.0,12/15/15 08:32:06 AM PST,Texas,Texas,2015-12-15
491,1906,Christmas is coming Were sure that you wont be able to find a betterpresent than a gun Dont believe us Just try once and youll understandwhat were talking about Gun power selfconfidence freedom Tea PartyNewsTeapartypat,0.0,https://www.instagram.com/teaparty_news/,0.0,0.0,12/18/15 03:25:39 AM PST,Texas,Texas,2015-12-18
492,1907,Christmas is coming Were sure that you wont be able to find a betterpresent than a gun Dont believe usJust try once and youll understand whatwere talking about Gun power selfconfidence freedom Tea Party NewsTeapartypat,3245.41,https://www.instagram.com/teaparty_news/,23781.0,78.0,12/18/15 03:27:24 AM PST,Texas,Texas,2015-12-18
493,1908,Do you support Trump Wanna MakeAmericaGreatAgain Wanna see yourkid on our account Take pictures make videos send them to us via DM ortag KIDSTRUMP and well make a patriotic team of young Trumpsupporters here Im sure itll be greatIt would be nice if you tell us why your kid supports Donald Trump and whatare his or her thoughts about Elections Lets have some fun Dont stayaside Tea Party NewsTeapartypat,1.32,https://www.instagram.com/tea_party_news/,279.0,1.0,04/19/16 08: 12:20 AM PDT,,,2016-04-19
494,1909,Do you support Trump Wanna MakeAmericaGreatAgain Wanna see yourkid on our account Take pictures make videos send them to us via DM ortag KIDSTRUMP and well make a patriotic team of young Trumpsupporters here Im sure itll be greatIt would be nice if you tell us why your kid supports Donald Trump and whatare his or her thoughts about Elections Lets have some fun Dont stayaside Tea Party NewsTeapartypat,9970.58,https://www.instagram.com/tea_party_news/,165121.0,78.0,04/21/16 12:28:18 AM PDT,,,2016-04-21
495,1912,Do you support Trump Wanna MakeAmericaGreatAgain Wanna see yourkid on our account Take pictures make videos send them to us via DM ortag KIDSTRUMP and well make a patriotic team of young Trumpsupporters here Im sure itll be greatIt would be nice if you tell us why your kid supports Donald Trump and whatare his or her thoughts about Elections Lets have some fun Dont stayaside Tea Party News Teapartypat,0.0,https://www.instagram.com/tea_party_news/,,,04/19/16 08:08:19 AM PDT,,,2016-04-19
496,1913,Do you support Trump Wanna MakeAmericaGreatAgain Wanna see yourkid on our account Take pictures make videos send them to us via DM ortag KIDSTRUMP and well make a patriotic team of young Trumpsupporters here Im sure itll be greatIt would be nice if you tell us why your kid supports Donald Trump and whatare his or her thoughts about Elections Lets have some fun Dont stayaside Tea Party News Teapartypat,0.0,https://www.instagram.com/tea_party_news/,0.0,,04/19/16 08:05:39 AM PDT,,,2016-04-19
497,1914,Do you support Trump Wanna MakeAmericaGreatAgain Wanna see yourkid on our account Take pictures make videos send them to us via DM ortag KIDSTRUMP and well make a patriotic team of young Trumpsupporters here Im sure itll be greatIt would be nice if you tell us why your kid supports Donald Trump and whatare his or her thoughts about Elections Lets have some fun Dont stayaside Tea Party News Teapartypat,0.0,https://www.instagram.com/tea_party_news/,,,04/19/16 08:07:22 AM PDT,,,2016-04-19
498,1915,Salaams American Muslims are facing hard challenges in the postworld Follow muslim voice to learn more about the most peaceful religion onEarth Join the discussions over political social and religious issues Be thevoice,6821.84,https://www.facebook.com/Muslimlnst-1681844195367390/,44581.0,495.0,08/17/16 03:31:27 AM PDT,,,2016-08-17
499,1916,This is the community which unites all the muslims who live in the US We allare children of the Middle East Its time to unite,0.0,https://www.facebook.com/Musliminst-1681844195367390/,0.0,0.0,11/23/15 06:34:10 AM PST,,,2015-11-23
500,1917,This is the way our children have to be raised Its not the promotion ofviolence Its the promotion of confidence and the ability to defend yourselfFollow us if this video makes you proud,17306.95,https://www.facebook.com/Teapartypat-1649468318669272/,108433.0,857.0,04/22/16 10:43:02 AM PDT,,,2016-04-22
501,1919,This is the community which unites all the muslims who live in the US We allare children of the Middle East Its time to uniteVoice Muslim Inst,8.0,https://www.instagram.com/muslim_voice/,,,05/12/16 03:36:43 AM PDT,Minnesota,Minnesota,2016-05-12
502,1920,This is the community which unites all the muslims who live in the US We allare children of the Middle East Its time to uniteVoice Muslim Inst,3.0,https://www.instagram.com/muslim_voice/,20364.0,420.0,06/24/16 02:05:09 AM PDT,Minnesota,Minnesota,2016-06-24
503,1921,I want Americans and Europeans understand and ask to feel the differencebetween terrorists and faithful Muslim Click Learn MoreVoiceMuslim Inst,1494.73,https://www.instagram.com/muslim_voice/,13604.0,47.0,01/06/16 03:51 :08 AM PST,,,2016-01-06
504,1925,This is the community which unites all the Muslims who live in the US ClickLearn MoreVoice,2821.63,https://www.instagram.com/muslim voice/,18491.0,82.0,12/02/15 05:23:15 AM PST,,,2015-12-02
505,1927,Stand with BlacklivesMatter movement All recent news the media will nevershow Blackvoice Baltimore News,29.41,https://www.instagram.com/baltimore.blackvoice/,1073.0,1.0,12/31/15 01 :02:36 AM PST,Baltimore Maryland,Maryland,2015-12-31
506,1928,THANK YOU to all those who risked their life for the sake of our country ClickLearn More Baltimore News Balt,4049.93,https://www.instagram.com/baItimore.blackvoice/,29879.0,67.0,01/06/16 04:26:59 AM PST,Baltimore Maryland,Maryland,2016-01-06
507,1929,police officers have already become the innocent victims of homegrownterrorism its not a coincidence its a war Thats why weve startedIstaypolice flashmob Join our flashmob and follow staypolice to supportAmerican law enforcement,1.681,https://www.facebook.com/Libelibe-1484239251885741/,11078.0,96.0,07/20/16 06:33:39 AM PDT,,,2016-07-20
508,1930,We need to show the society that we support our police officers FollowSTAYPOLICE,436.1,https://www.facebook.com/Libelibe-1484239251885741/,3252.0,22.0,08/04/16 06:23:23 AM PDT,,,2016-08-04
509,1931,Follow for the true Texas Pride Support The Police Atla,693.28,https://www.instagram.com/tx_patriots/,5394.0,7.0,05/12/16 03:20:33 AM PDT,,,2016-05-12
510,1932,Black people all around the world are proud of who they are and these Blacktwins are proudly identifying with their roots,3723.84,https://www.facebook.com/BaIt-1 94465337564400/,38262.0,683.0,08/12/16 09:06:46 AM PDT,,,2016-08-12
511,1933,You can achieve anything you want without taking your clothes off For morepositive black pictures follow BLACKAMERICATODAY Today is the day torise up and act Proudblacks,539.33,https://www.instagram.com/black_america_today/,2756.0,79.0,08/04/16 06:54:34 AM PDT,,,2016-08-04
512,1939,Support those who protect you Propolice Anticriminal Stop the war on ourpolicePress learn more to step behind this thin blue line Support The PoliceLibelibe,4559.86,https://www.instagram.com/stay4police/,57750.0,210.0,12/16/15 01:58:29 AM PST,,,2015-12-16
513,1941,Join Us Support The Police,26598.49,https://www.facebook.com/Libelibe-1484239251885741/,418904.0,9211.0,04/13/16 09: 15:28 AM PDT,,,2016-04-13
514,1942,NO MORE CHAOSInstagram Of The US stands against racismGod Bless America,1.51,https://www.facebook.com/Instotus-1751255138430954/,8.0,0.0,02/12/16 09:15:21 AM PST,,,2016-02-12
515,1944,We stand for American Law Enforcement and we want you to join us SupportThe Police Libelibe,2454.16,https://www.instagram.com/stay4police/,,72.0,02/25/16 12:51 :58 AM PST,,,2016-02-25
516,1946,Truth is on the side of the oppressedMalcolm X,12.209,https://www.facebook.com/Proudblacks-954167134618867/,61971.0,924.0,06/15/16 02:35:52 AM PDT,New York,New York,2016-06-15
517,1948,We are proud to stand for American Police especially at the time when societytends to discredit our heroes,2123.97,https://www.facebook.com/Libelibe-1484239251885741/,9440.0,44.0,08/16/16 04:47:49 AM PDT,,,2016-08-16
518,1950,We are black We are not weird We are limited edition,552.14,https://www.facebook.com/Balt-194465337564400/,5403.0,149.0,08/05/16 02:46:52 AM PDT,,,2016-08-05
519,1951,New YorkFebMeet at Dag Hammarskjold Plaza onstreet,27500.0,https://www.facebook.com/Proudblacks-954167134618867/,26514.0,0.0,02/18/16 05:03:07 AM PST,Connecticut Delaware Maine Maryland Massachusetts Missouri Virginia Nevada New Hampshire Jersey York Ohio Pennsylvania Rhode Island Vermont,Connecticut Delaware Maine Maryland Massachusetts Missouri Virginia Nevada New Hampshire Ohio Pennsylvania Rhode Island Vermont,2016-02-18
520,1954,NEW YORKFeb Protest with us at the UN Charge America withgenocidehuman rights violations,0.0,https://www.facebook.com/Proudblacks-954167134618867/,0.0,0.0,02/18/16 04:36:08 AM PST,,,2016-02-18
521,1958,Due to the town of Twin falls Idaho becoming a center of refugeeresettlement which led Citizens before refugees,0.0,https://www.facebook.com/events/1171162859608506/,,,08/15/16 07: 14:22 AM PDT,Idaho,Idaho,2016-08-15
522,1968,Your thoughts,344.07,https://www.facebook.com/blackmattersus.mvmnt/,16866.0,3062.0,05/22/17 08:22:48 AM PDT,,,2017-05-22
523,1976,These girls gonna break hearts Absolutely beautiful,220.3,https://www.facebook.com/blackmattersus.mvmnt/,3686.0,885.0,04/28/17 07:02:50 AM PDT,,,2017-04-28
524,1978,To most of us the given explanations sound messy and weak these officersare frightened because they have done something wrong and we all knowwhat Freshly released interviews of the officers related to Tamir Riceshooting contain suspicious details Tamir Rice Murderers InterviewsRleased I BlackMattersUScom blackmattersuscom,254.53,https://blackmattersus.com/32928-tam ir-rices-murderers-interviews-rleased/,619.0,80.0,04/28/17 06:52:12 AM PDT,,,2017-04-28
525,1988,Please dont stay indifferent as your mother could be one of these womenBefore Mothers Day Black Lives Matter will try and support some femaleminor offenders Black Lives Matter To Help Incarcerated Mothers IBlackMattersUScom blackmattersus com,184.62,https://blackmattersus. com/33616-black-lives-matter-to-help-incarcerated-,821.0,59.0,05/12/17 08:00:17 AM PDT,,,2017-05-12
526,1991,Congrats This is amazing You see our people succeed in everythingSupport each other and never give up,255.16,https://www.facebook.com/blackmattersus.mvmnt/,978.0,195.0,04/28/17 06:50:53 AM PDT,,,2017-04-28
527,1993,Aww what a cutie Black kids are awesome,200.0,https://www.facebook.com/blackmattersus.mvmnt/,3783.0,689.0,04/21/17 05:46:40 AM PDT,,,2017-04-21
528,1996,Dope Thas how black excellence look like,300.0,https://www.facebook.com/blackmattersus.mvmnt/,9905.0,1735.0,04/18/17 08:02:55 AM PDT,,,2017-04-18
529,1997,Possible,200.0,https://www.facebook.com/blackmattersus.mvmnt/,7028.0,1293.0,04/17/17 08:15:54 AM PDT,,,2017-04-17
530,2002,Crown her,200.0,https://www.facebook.com/blackmattersus.mvmnt/,11612.0,1482.0,04/14/17 07:14:54 AM PDT,,,2017-04-14
531,2013,Gorgeous Strength is your power,255.18,https://www.facebook.com/blackmattersus.mvmnt/,316.0,73.0,04/28/17 06:58:53 AM PDT,,,2017-04-28
532,2016,So cute This is life literally Never too much hair,0.0,https://www.facebook.com/blackmattersus.mvmnt/,,0.0,04/28/17 07:03:49 AM PDT,,,2017-04-28
533,2022,Please let me look this good when I get older,399.46,https://www.facebook.com/blackmattersus.mvmnt/,11681.0,1941.0,04/13/17 0&15:15 AM PDT,,,2017-04-13
534,2025,The Great Eight set record for black doctorates at Indiana University Blackwomen have become the most educated group in America,200.0,https://www.facebook.com/blackmattersus.mvmnt/,4650.0,718.0,04/13/17 0&15:56 AM PDT,,,2017-04-13
535,2026,This is just precious Absolutely the best feeling ever,0.0,https://www.facebook.com/blackmattersus.mvmnt/,,0.0,04/28/17 07:04:08 AM PDT,,,2017-04-28
536,2028,They might party hard and stay up late but they graduate,200.0,https://www.facebook.com/blackmattersus.mvmnt/,3821.0,588.0,04/14/17 07:08:15 AM PDT,,,2017-04-14
537,2029,Thats great This young man invents it to help his people Why dont we domore If a child can make a difference with impact what is stopping us,171.02,https://www.facebook.com/blackmattersus.mvmnt/,6273.0,859.0,05/17/17 06:24:41 AM PDT,,,2017-05-17
538,2031,So true Love your magical blackness,300.0,https://www.facebook.com/blackmattersus.mvmnt/,315.0,36.0,04/28/17 06:53:27 AM PDT,,,2017-04-28
539,2032,Well done I live for the sake of such exalted moments,253.16,https://www.facebook.com/blackmattersus.mvmnt/,9946.0,2059.0,05/24/17 07:59:30 AM PDT,,,2017-05-24
540,2034,In a new viral video three Texas police officers are violently detaining ayearold black girl In a new viral video three Texas police officers areviolently detaining a yearold black girl Texas Police Officers Vs Black GirlI BlackMattersUScom blackmattersuscom,161.63,https://blackmattersus.com/33919-texas-police-officers-vs-black-girl/,1706.0,254.0,05/24/17 07:58:12 AM PDT,,,2017-05-24
541,2038,Fact Be proud of your natural hair,200.0,https://www.facebook.com/blackmattersus.mvmnt/,9595.0,1528.0,04/17/17 08:29:21 AM PDT,,,2017-04-17
542,2039,Thats amazing Well done lil lady,199.8,https://www.facebook.com/blackmattersus.mvmnt/,4773.0,793.0,04/13/17 06:14:53 AM PDT,,,2017-04-13
543,2040,Well youll be in great hands with these Queens,200.0,https://www.facebook.com/blackmattersus.mvmnt/,5309.0,802.0,04/17/17 08:28:55 AM PDT,,,2017-04-17
544,2041,Thats dope Proud of them,200.0,https://www.facebook.com/blackmattersus.mvmnt/,13839.0,2525.0,04/21 /17 05:45:24 AM PDT,,,
545,2049,Understand more,194.75,https://www.facebook.com/blackmattersus.mvmnt/,4776.0,984.0,04/17/17 08:29:51 AM PDT,,,2017-04-17
546,2050,The student named locally as Milan has portraits of Trayvon Martin TamirRice and many others on her dress It really makes senseNever forget,93.0,https://www.facebook.com/blackmattersus.mvmnt/,2556.0,532.0,04/24/17 08:13:34 AM PDT,,,2017-04-24
547,2055,This is so cute Made my eyes water a bit Support each other,157.65,https://www.facebook.com/blackmattersus.mvmnt/,2693.0,642.0,05/24/17 08:11:54 AM PDT,,,2017-05-24
548,2056,Awesome Way better than winning a race,252.77,https://www.facebook.com/blackmattersus.mvmnt/,419.0,80.0,04/28/17 06:54:02 AM PDT,,,2017-04-28
549,2059,Her eyes are soul piercing,300.0,https://www.facebook.com/blackmattersus.mvmnt/,11352.0,2515.0,04/18/17 08:02:14 AM PDT,,,2017-04-18
550,2065,Dope Thats how black excellence looks like,300.0,https://www.facebook.com/blackmattersus.mvmnt/,10905.0,1876.0,04/19/17 06:28:05 AM PDT,,,2017-04-19
551,2066,Royalty,196.08,https://www.facebook.com/blackmattersus.mvmnt/,9500.0,2140.0,05/12/17 08:00:59 AM PDT,,,2017-05-12
552,2070,Graduation is one the most important days of your life and you may needsome ways to make your natural Black hair look gorgeous Graduation is onethe most important days of your life and you may need some ways to makeyour natural Black hair look gorgeous Wearing Your Natural Black Hair AtGraduation I BlackMattersUScom blackmattersuscom,138.47,https://blackmattersus.com/33865-wearing-your-natural-black-hair-at-,773.0,95.0,05/24/17 08: 11 :32 AM PDT,,,2017-05-24
553,2072,Aww Because you need such a cutie on your timeline,282.79,https://www.facebook.com/blackmattersus.mvmnt/,539.0,80.0,04/28/17 06:56:25 AM PDT,,,2017-04-28
554,2074,Congratulations beautiful QueensYou can achieve any goals if you really believe in yourself Just motivateyourself,244.7,https://www.facebook.com/blackmattersus.mvmnt/,4973.0,1013.0,05/24/17 08:01:00 AM PDT,,,2017-05-24
555,2077,The circle of life The beginning and the endingLove this image so much,200.0,https://www.facebook.com/blackmattersus.mvmnt/,5357.0,1029.0,04/19/17 06:29:57 AM PDT,,,2017-04-19
556,2082,Dope Lets make this viral,153.53,https://www.facebook.com/blackmattersus.mvmnt/,310.0,43.0,04/28/17 06:59:30 AM PDT,,,2017-04-28
557,2085,Work to reach your goals This is how we achieve greatness,205.99,https://www.facebook.com/blackmattersus.mvmnt/,8414.0,1462.0,04/28/17 07:06:17 AM PDT,,,2017-04-28
558,2088,Awesome job Iii man Thats how you keep the love for good music going,200.0,https://www.facebook.com/blackmattersus.mvmnt/,,2874.0,04/21 /17 05:48: 10 AM PDT,,,
559,2091,Incredible This is a very rare occurrence considering the parents and twoother children are black,0.0,https://www.facebook.com/blackmattersus.mvmnt/,0.0,0.0,04/28/17 07:05:00 AM PDT,,,2017-04-28
560,2092,Good question Lets make it go viral,200.0,https://www.facebook.com/blackmattersus.mvmnt/,10528.0,1406.0,04/14/17 07:09:09 AM PDT,,,2017-04-14
561,2093,Dope When our people stay wokeI hope these arenew black businesses,200.0,https://www.facebook.com/blackmattersus.mvmnU,5006.0,641.0,04/14/17 07:08:38 AM PDT,,,2017-04-14
562,2097,Our ladies are making strides in whatever they touch,200.0,https://www.facebook.com/blackmattersus.mvmnt/,5322.0,833.0,04/20/17 05:16:35 AM PDT,,,2017-04-20
563,2105,Congratsl Let all the mornings for all the young Black Kings and Queens bethat happy Proud,259.72,https://www.facebook.com/blackmattersus.mvmnt/,2610.0,589.0,04/28/17 07:00:07 AM PDT,,,2017-04-28
564,2108,Wow I like this version better,106.05,https://www.facebook.com/blackmattersus.mvmnt/,3785.0,772.0,04/24/17 08: 13:20 AM PDT,,,2017-04-24
565,2127,Shes gorgeous Be proud of your melanin pigment,261.85,https://www.facebook.com/blackmattersus.mvmnt/,8407.0,2173.0,04/28/17 06:59:52 AM PDT,,,2017-04-28
566,2128,Like and share,299.51,https://www.facebook.com/blackmattersus.mvmnt/,14551.0,1806.0,04/13/17 0&10:49 AM PDT,,,2017-04-13
567,2129,Absolutely stunning little baby girl with a beautiful smile straight from theheart Children with special needs matter,0.0,https://www.facebook.com/blackmattersus.mvmnU,0.0,0.0,04/28/17 07:05:19 AM PDT,,,2017-04-28
568,2131,Memphis Black Lives Matter chapter plans to collect money to bail out momsfor Mothers Day Memphis Black Lives Matter chapter plans to collect moneyto bail out moms for Mothers Day Black Lives Matter Plans To Bail Out MomsFor Mothers Day I BlackMattersUScom blackmattersuscom,103.07,https://blackmattersus.com/32867-black-lives-matter-plans-to-bail-out-moms-,1477.0,202.0,04/24/17 08: 10:44 AM PDT,,,2017-04-24
569,2134,Just a daily reminder for those who doubt Yes you are and dont forget it,253.91,https://www.facebook.com/blackmattersus.mvmnt/,666.0,161.0,04/28/17 06:51 :54 AM PDT,,,2017-04-28
570,2140,Absolutely gorgeous I hope I look that great when Im,271.75,https://www.facebook.com/blackmattersus.mvmnt/,2304.0,499.0,04/28/17 06:39:09 AM PDT,,,2017-04-28
571,2142,This is so true and amazing,200.0,https://www.facebook.com/blackmattersus.mvmnt/,2663.0,368.0,04/21 /17 05:42:51 AM PDT,,,
572,2143,Theyll graduate with honours for sure Black and educated,299.33,https://www.facebook.com/blackmattersus.mvmnt/,9738.0,1518.0,04/13/17 0&15:35 AM PDT,,,2017-04-13
573,2145,Cuteness overload,200.0,https://www.facebook.com/blackmattersus.mvmnt/,43302.0,3546.0,04/21 /17 05:42:20 AM PDT,,,
574,2149,Dope Lets make this go viral,342.66,https://www.facebook.com/blackmattersus.mvmnt/,16401.0,3087.0,05/17/17 06:33:38 AM PDT,,,2017-05-17
575,2159,Delicious Just a chocolate drop for your timeline,167.46,https://www.facebook.com/blackmattersus.mvmnt/,3486.0,797.0,05/24/17 08:00:29 AM PDT,,,2017-05-24
576,2160,Melanin be popping,200.0,https://www.facebook.com/blackmattersus.mvmnt/,5774.0,662.0,04/14/17 07:10:16 AM PDT,,,2017-04-14
577,2164,However you look at it the similarity is obvious,896.58,https://www.facebook.com/blackmattersus.mvmnt/,30915.0,4900.0,05/25/17 06:53:13 AM PDT,,,2017-05-25
578,2165,A Black Owned Pharmacy,199.25,https://www.facebook.com/blackmattersus.mvmnt/,6620.0,1080.0,04/13/17 06: 11 :48 AM PDT,,,2017-04-13
579,2168,Join us as we watch these lovely videos filling our hearts with hope for thefuture of Steve Harvey surprises young ballerinas from the MayfairPerformance Company introducing the gifted dancers to their role modelballet icon Misty Copeland Misty Copeland Inspires Young Black Ballerinas IB lackMattersUScom blackmattersus com,107.88,https://blackmattersus.com/33126-misty-copeland-inspires-young-black-,1838.0,194.0,05/01/17 07:00:55 AM PDT,,,2017-05-01
580,2171,Did you know,227.12,https://www.facebook.com/blackmattersus.mvmnt/,3488.0,651.0,04/28/17 07:02:30 AM PDT,,,2017-04-28
581,2172,She is amazing The strength of our girls is a legend,182.97,https://www.facebook.com/blackmattersus.mvmnt/,1859.0,325.0,04/28/17 07:03:10 AM PDT,,,2017-04-28
582,2173,She slays no doubt By the way this Queen isyears old Whats hersecret That melanin tho,253.82,https://www.facebook.com/blackmattersus.mvmnt/,11074.0,1795.0,05/24/17 08:01:18 AM PDT,,,2017-05-24
583,2174,Proud moments PreschoolHigh School and College Grad Congrats,200.0,https://www.facebook.com/blackmattersus.mvmnt/,5784.0,1340.0,04/20/17 05: 19:43 AM PDT,,,2017-04-20
584,2177,Thats deep,333.59,https://www.facebook.com/blackmattersus.mvmnt/,10834.0,2234.0,05/24/17 08:00:00 AM PDT,,,2017-05-24
585,2179,We applaud this womans dignity and ability cope with ignorance andindifference of the people The world is twice prejudiced against her kid butwe believe shes going to win Madeline Jones the mother of a little Blackgirl with autism tells the story of her struggle This Little Black Girls Mother IsReal Fighter I BlackMattersUScom blackmattersuscom,300.0,https://blackmattersus.com/32576-this-little-black-girls-mother-is-real-fighter/,411.0,12.0,04/18/17 07:58:00 AM PDT,,,2017-04-18
586,2185,More melanin,20.32,https://www.facebook.com/blackmattersus.mvmnt/,338.0,74.0,05/17/17 06:31:17 AM PDT,,,2017-05-17
587,2187,Like if you think the s were awesome,200.0,https://www.facebook.com/blackmattersus.mvmnt/,15741.0,3247.0,05/15/17 06:44:30 AM PDT,,,2017-05-15
588,2189,Stunning That melanin tho,164.52,https://www.facebook.com/blackmattersus.mvmnt/,2945.0,614.0,04/28/17 07:03:32 AM PDT,,,2017-04-28
589,2191,She slays Such an incredible Beauty,200.0,https://www.facebook.com/blackmattersus.mvmnt/,8093.0,1647.0,04/21/17 05:47:18 AM PDT,,,2017-04-21
590,2192,Truly a queen and her knights will protect her in life Awesome,200.0,https://www.facebook.com/blackmattersus.mvmnt/,4633.0,999.0,04/21 /17 05:48:28 AM PDT,,,
591,2195,Awesome She really does look like a black Tinker Bell,200.0,https://www.facebook.com/blackmattersus.mvmnt/,4492.0,614.0,04/14/17 07:11:34 AM PDT,,,2017-04-14
592,2209,Yet another innocent Black man losses his life due to the canker of policebrutality in America Police Brutality Black Man Beaten To Death By CopsBM BM,183.53,https:Hblackmattersus.com/16591-awful-police-brutality-black-man-calls-,791.0,137.0,09/28/16 02:04:23 AM PDT,,,2016-09-28
593,2246,Its time to wake up my people,50.04,https://www.facebook.com/blackmattersus.mvmnt/,716.0,102.0,12/07/16 11:38:12 PM PST,,,2016-12-07
594,2279,This made my heart melt,0.0,https://www.facebook.com/blackmattersus.mvmnt/,,0.0,03/24/17 03:07:46 AM PDT,,,2017-03-24
595,2281,years for rape murder and burglary for a man who didnt commit any ofthose crimes Philadelphia is a place poisoned by police misconduct for somany years That is the reason why they didnt immediately release aninnocent man even after it wa Black Man Released AfterYears BehindBars For Nothing I Black Matters BM,188.31,https://blackmattersus.com/14623-black-man-released-after-25-years-behind-,174.0,10.0,08/30/16 07:25:35 AM PDT,Detroit Michigan,Michigan,2016-08-30
596,2282,years for rape murder and burglary for a man who didnt commit any ofthose crimes Philadelphia is a place poisoned by police misconduct for somany years That is the reason why they didnt immediately release aninnocent man even after it wa Black Man Released AfterYears BehindBars For Nothing I Black Matters BM,0.0,https://blackmattersus.com/14623-black-man-released-after-25-years-behind-,0.0,0.0,09/21/16 01:15:20 AM PDT,Charlotte North Carolina,North Carolina,2016-09-21
597,2283,years for rape murder and burglary for a man who didnt commit any ofthose crimes Philadelphia is a place poisoned by police misconduct for somany years That is the reason why they didnt immediately release aninnocent man even after it wa Black Man Released AfterYears BehindBars For Nothing I Black Matters BM,0.0,https://blackmattersus.com/14623-black-man-released-after-25-years-behind-,0.0,0.0,10/06/16 06:20:33 AM PDT,Charlotte North Carolina,North Carolina,2016-10-06
598,2318,Appreciate beautiful dark skinned women,42.68,https://www.facebook.com/blackmattersus.mvmnt/,222.0,28.0,12/07/1611:37:56 PM PST,,,2016-12-07
599,2346,Brown girls do ballet too,0.0,https://www.facebook.com/blackmattersus.mvmnt/,0.0,0.0,03/24/17 03:08:11 AM PDT,,,2017-03-24
600,2357,Support Black buy Black donate BlackThis calendar will become a perfect present for every member of the Blakcommunity Fundraising Calendar Black Beauty Matters,500.0,https://www.facebook.com/commerce/products/1 194263447326332/,3637.0,153.0,12/26/16 07:58:10 AM PST,,,2016-12-26
601,2380,This photo reflects everything about black love black and educated black isbeautiful black familyWhat else Comment below,0.0,https://www.facebook.com/blackmattersus.mvmnt/,0.0,0.0,03/24/17 03:08:30 AM PDT,,,2017-03-24
602,2384,Were proud to announce an initiative focused on providing free legaleducation to empower our people and strengthen our communityWe believe that having these legal workshops on a monthly basis will prove tobe beneficial in a tangible way for our communityMeetatCharlotte NC Legal Night at,512.87,https://www.facebook.com/events/651125608392879/,1279.0,43.0,01/12/17 11:11:34 PM PST,Charlotte North Carolina,North Carolina,2017-01-12
603,2410,The USled coalition strike in Syrias Raqqa province killedwomen theSyrian Observatory for Human Rights said this morning The second coalitionstrike on a town near the Iraqi border killedmore civilians Just to make itclear our government is proposing spending cuts to most governmentagencies to pay for large increases in military and everything we got from thisis more and more civilians deaths EPA State and other developmentprograms Agriculture Labor Justice Health and Human ServicesEducation and many other domestic agencies faced more thancuts intheir budgets and only the Department of Defense has grown byHowever terrorists werent destroyed indays and it seems like theywont be destroyed in the closest perspective I mentioned before and I willdo it again this is not a war against terrorism or a war for freedom itsanother example of money conflict filling politicians pockets with bloodmoney is the main goal of it For America another continuous military conflictcan lead to a financial crisis this is exactly what happened in,399.99,https://www.facebook.com/bornliberal/,1929.0,242.0,05/16/17 07:40:03 AM PDT,,,2017-05-16
604,2418,In spite of the prevailing stereotypes about who uses SNAP Food Stampbenefits the most in the United States the highest usage is not in ComptonQueens nor the South Side of Chicago,500.0,https://www.facebook.com/Born-Liberal-522628564598423/,2727.0,553.0,08/04/16 06:15:41 AM PDT,,,2016-08-04
605,2422,Exactly And I also mind that you use some of your vast wealth to electpoliticians who will pass laws to allow you to avoid paying your fair share oftaxes,473.65,https://www.facebook.com/Born-Liberal-522628564598423/,1369.0,209.0,06/07/16 06:04:58 AM PDT,,,2016-06-07
606,2423,Exactly And I also mind that you use some of your vast wealth to electpoliticians who will pass laws to allow you to avoid paying your fair share oftaxes,0.0,https://www.facebook.com/Born-Liberal-522628564598423/,0.0,0.0,07/14/16 01:00:03 AM PDT,,,2016-07-14
607,2438,Black edification is a PROblack platform to educate and empower ourpeople,611.7,https://www.facebook.com/BlackEdification/,7889.0,153.0,06/28/16 11: 16:35 AM PDT,Georgia Alabama Arizona California Florida Mississippi New Mexico York Oklahoma Texas Washington,Georgia Alabama Arizona California Florida Mississippi New Mexico Oklahoma Texas Washington,2016-06-28
608,2442,Melanin is gold Its a gift of God We have to appreciate this in all shadesThe black girls with freckles are also beautiful,500.0,https://www.facebook.com/Black-Edification-1772583676310336/,4717.0,470.0,06/25/16 01 :08:42 PM PDT,Alabama Arizona California Florida Georgia Mississippi New Mexico York Oklahoma Texas Washington Baltimore,Alabama Arizona California Florida Georgia Mississippi New Mexico Oklahoma Texas Washington,2016-06-25
609,2443,Melanin is gold Its a gift of God We have to appreciate this in all shadesThe black girls with freckles are also beautiful,0.0,https://www.facebook.com/Black-Edification-1772583676310336/,0.0,0.0,07/17/16 12:37:25 AM PDT,Alabama Arizona California Florida Georgia Mississippi New Mexico York Oklahoma Texas Washington Baltimore,Alabama Arizona California Florida Georgia Mississippi New Mexico Oklahoma Texas Washington,2016-07-17
610,2447,If you also think that there should only be peace come with us on Juneandlets make it happenStop war Stop killing the innocent Some believed Trump would withdraw theUS from useless and bloody military campaigns But what we see is only theenhancement of hostility We dont need wars no more We want peace Itstime for politicians to take care of the US residents instead of fating them aswell as other nationals to death Were organizing a peaceful gathering todraw public attention to the abovementioned terrible problem Our Presidentand Congress must listen to those who granted them powerus the peopleIf you also think that there should only be peace come with us and lets makeit happenStop war Stop killing the innocent Make peace not war Make peace notwar,4891.47,https://www.facebook.com/events/147549059117757/,6172.0,191.0,05/17/17 05:53:39 AM PDT,Washington Columbia,Washington Columbia,2017-05-17
611,2448,Even though Syrian refugees make America great America must stopbombing Syria and other Middle East countries,500.0,https://www.facebook.com/MuslimAmerica/,6528.0,851.0,05/19/17 06: 18:46 AM PDT,,,2017-05-19
612,2451,If you also think that there should only be peace come with us and lets makeit happenStop war Stop killing the innocent Some believed Trump would withdraw theUS from useless and bloody military campaigns But what we see is only theenhancement of hostility We dont need wars no more We want peace Itstime for politicians to take care of the US residents instead of fating them aswell as other nationals to deathWere organizing a peaceful gathering to draw public attention to the abovementioned terrible problem Our President and Congress must listen to thosewho granted them powerus the people If you also think that there shouldonly be peace come with us and lets make it happenStop war Stop killing the innocent Make peace not war Make peace notwar,4593.46,https://www.facebook.com/events/239129926564203/,6721.0,243.0,05/17/17 05:49:58 AM PDT,New York,New York,2017-05-17
613,2452,STOP BOMBING SYRIA,2000.0,https://www.facebook.com/MuslimAmerica/,11601.0,1289.0,05/19/17 04: 13:26 AM PDT,,,2017-05-19
614,2456,Join us if you proud to be who you are and believe that your roots give youthe power Black Excellence,0.0,https://www.facebook.com/iloveblackexcellence/,,,12/08/16 12:45:17 AM PST,,,2016-12-08
615,2457,Join us if you proud to be who you are and believe that your roots give youthe power,86.87,https://www.facebook.com/iloveblackexcellence/,17.0,,12/08/16 12:46:22 AM PST,,,2016-12-08
616,2458,Join us if you proud to be who you are and believe that your roots give youthe power Black Excellence,9926.34,https://www.facebook.com/iloveblackexcellence/,31086.0,2514.0,12/08/16 05:45:46 AM PST,,,2016-12-08
617,2459,Join us if you proud to be who you are and believe that your roots give youthe power Black Excellence,13423.16,https://www.facebook.com/iloveblackexcellence/,91531.0,5957.0,12/27/16 05:53:41 AM PST,,,2016-12-27
618,2461,First and foremost we as Chicago Public School students would like to thankyou for the supportive donation to our schools As we all know CPS has beenstruggling financially and your donation has really given us a push to get towhere we need to be and possibly motivate others to give back to thecommunity as well This is only one of the many things that you have done toimprove our ChicagoAll of the things that you do for our city never go unnoticed All of the freeconcerts you host and all the time you spend here in the city really show youcare We notice it We look up to you because the fame usually takes humilityaway from artists but it hasnt changed youWe thank you for supporting Chicagos minority youth when not many othershave put time to think about the kids As minority students we feel ignoredand as though we dont have enough support from bigger influences like youBeing born and raised in Chicago is not easy at all There are so manystereotypes and restrictions we have as teenagers due to the frequentviolence and crimes Your music puts some at ease because we know thatsomeone cares and someone has experienced these daily struggles too Youand your music have taught us that you can be true to yourself and still besuccessful still be selfmadeOnce again thank you for aiding us and giving something back to the city weknow and love ChicagoSincerelyAlex Rojas Alondra Cerros and Annelisse BetancourtLake View High School StudentsChicago IllinoisIts not the full letter but some extracts Its sweet to observe how youngpeople dont hesitate to express their gratitude and respond to someone whocares for them We are sure that Chano needs it Love should be given backIt should workAs an independent artist he got peoples support and Chance didnt forgetwho made him famous Artists are made of talent work and peoples loveThats cool that this love goes back and forthWe need more of these positive black people on the media because somepeople forget how much love and care black people show Hopefully one daydifferent race will be the issue of diversity not stereotypesblackexcellence blackperfection blackbeauty blackbusinessafricanamerican blackcommunity melanin blackpride blackout americausa blackscience education diversity chancetherapper chicago musichiphop rap,200.0,https://www.facebook.com/iloveblackexcellence,155.0,,"Ad ID 2461                             Ad Text ""First and foremost, we as Chicago Public School students would like to thank                                           you for the supportive donation to our schools. As we all know, CPS has been                                          struggling financially, and your donation has really given us a push to get to                                          where we need to be and possibly motivate others to give back to the                                          community as well. This is only one of the many things that you have done to                                          improve our Chicago...                                          All of the things that you do for our city never go unnoticed. All of the free                                          concerts you host and all the time you spend here in the city really show you                                          care. We notice it. We look up to you because the fame usually takes humility                                          away from artists, but it hasn't changed you...                                          We thank you for supporting Chicago's minority youth when not many others                                          have put time to think about the kids. As minority students we feel ignored                                          and as though we don't have enough support from bigger influences like you.                                           Being born and raised in Chicago is not easy at all. There are so many                                          stereotypes and restrictions we have as teenagers due to the frequent                                          violence and crimes. Your music puts some at ease because we know that                                          someone cares and someone has experienced these daily struggles too. You                                          and your music have taught us that you can be true to yourself and still be                                          successful, still be self-made...                                          Once again, thank you for aiding us and giving something back to the city we                                          know and love, Chicago.                                          Sincerely,                                          Alex Rojas, Alondra Cerros, and Annelisse Betancourt                                          Lake View High School Students                                          Chicago, Illinois""                                           It's not the full letter, but some extracts. It's sweet to observe how young                                           people don't hesitate to express their gratitude and respond to someone who                                          cares for them. We are sure, that Chano needs it. Love should be given back.                                           It should work.                                          As an independent artist he got people's support and Chance didn't forget                                          who made him famous. Artists are made of talent, work and people's love.                                          That's cool that this love goes back and forth!                                          We need more of these positive black people on the media, because some                                           people forget how much love and care black people show. Hopefully one day                                          different race will be the issue of diversity, not stereotypes.                                          #blackexcellence #blackperfection #blackbeauty #blackbusiness                                          #africanamerican #blackcommunity #melanin #blackpride #blackout #america                                          #usa #blackscience #education #diversity #chancetherapper #chicago #music                                          #hiphop #rap                 Ad Landing Page https://www.facebook.com/iloveblackexcellence                      Ad Targeting Location - Living In: United States                                          Age: 18 - 65+                                          Placements: News Feed on desktop computers or News Feed on mobile                                          devices                                          People Who Match: Interests: Martin Luther King, Jr., My Black is Beautiful,                                           Black is beautiful or Black Girls Rock! Redactions Completed at the Direction of Ranking Member of the US House Permanent Select Committee on Intelligence                                                           P(1)0000842",,,
619,2462,Little black cutieblackexcellence blackperfection blackbeauty blackbusinessafricanamerican blackcommunity melanin blackpride blackout americausa blackscience education diversity blackchildren africanchildrenbaby blackgirlmagic,400.0,https://www.facebook.com/iloveblackexcellence/,6911.0,1074.0,03/16/17 07:25:41 AM PDT,,,2017-03-16
620,2470,Join us if you proud to be who you are and believe that your roots give youthe power Black Excellence,1500.02,https://www.facebook.com/iloveblackexcellence/,4059.0,178.0,05/10/17 05: 17:27 AM PDT,,,2017-05-10
621,2473,Everyone needs family At least one day a yearblackexcellence blackperfection blackbeauty blackbusinessafricanamerican blackcommunity melanin blackpride blackout americausa blackscience education diversity halloween,351.8,https://www.facebook.com/iloveblackexcellence/,2841.0,450.0,03/22/17 04:31:45 AM PDT,,,2017-03-22
622,2491,The Beaumont Bulls football team players also took a stand to support theantiracism movement by doing a kneeling protest But this move was greetedby a surprising and rather sad response from officials A young Texas footballteam Beaumont Bulls finds themselves out of the season for protestingagainst racial injustice in America Racial Injustice In America Texas FootballTeam Banned For Kneeling Protest I BM BM,484.34,https://blackmattersus.com/18252-racial-injustice-in-america-texas-football-,5620.0,553.0,10/20/16 07:25:23 AM PDT,,,2016-10-20
623,2501,Following the threat received by one of the districts elementary school over aBlack community outreach program held last month aboutteacherswere clad in Black Lives Matter Tshirts on Wednesday as a sign of solidaritywith the school SomeSeattle teachers dressed in Black Lives Matter Tshirt on Wednesday to call for racial equity Racial EquitySeattleTeachers To Wear BLM Shirts To Class I BM BM,400.0,https://blackmattersus.com/18354-racial-equity-2000-seattle-teachers-to-wear-,5661.0,726.0,10/21/16 05:33:42 AM PDT,,,2016-10-21
624,2502,Interview with legendary Ericka Huggins an activist educator and formerleading member of the Black Panther Party The s and s saw a numberof Black rights movements spring up all over the Unites States calling for civilrights equality and selfdetermination The Black Ericka Huggins Life InServing People I BM BM,176.67,https://blackmattersus.com/18824-ericka-huggins-life-in-serving-people/,777.0,41.0,11/03/16 08:21:26 AM PDT,,,2016-11-03
625,2503,Black teen sues the police involved in his false arrest following violentdetention after woman felt uneasy at ATM Black teen sues the policeinvolved in his false arrest following his violent detention after woman feltuneasy at ATM Teen Files Lawsuit Against DC Police For False ArrestBM BM,600.0,https://blackmattersus.com/18148-teen-files-lawsuit-against-d-c-police-for-,13721.0,1500.0,10/18/16 05:32:04 AM PDT,,,2016-10-18
626,2516,Nineyearold Aubrey ZvovusheRamos was prevented from joining herteammates to play a soccer match because of her Black hairstyle Nineyearold Aubrey ZvovusheRamos was prevented from joining her teammates toplay a soccer match because of her Black hairstyle Black Hairstyles BlackGirl Sent Out Of Soccer Pitch I BM BM,400.0,https://blackmattersus.com/18087-black-hairstyles-black-girl-sent-out-of-,5351.0,497.0,10/18/16 05:33:29 AM PDT,,,2016-10-18
627,2517,More and more unarmed black people are killed by police And the cases ofabuse and excessive force are simply swept under the rugThatsWhyWeProtest,0.0,https://www.facebook.com/blackmattersus.mvmnt/,,,10/21/16 05:34:54 AM PDT,,,2016-10-21
628,2518,More and more unarmed black people are killed by police And the cases ofabuse and excessive force are simply swept under the rugThatsWhyWeProtest,400.0,https://www.facebook.com/blackmattersus.mvmnt/,3739.0,505.0,10/21 /16 08:42:24 AM PDT,,,
629,2532,Seriously guys how many times black people going to be fooled into thinkingthat voting will make a true change in this country,37.64,https://www.facebook.com/BM-173996283023459/,763.0,78.0,11/11/16 04:57:11 AM PST,,,2016-11-11
630,2537,I guess social issues such as police brutality is not a priority for Americanpoliticians,305.89,https://www.facebook.com/blackmattersus.mvmnt/,4771.0,649.0,10/20/16 07:23:44 AM PDT,,,2016-10-20
631,2543,These girls did a very good job for Halloween,280.6,https://www.facebook.com/blackmattersus.mvmnt/,5677.0,755.0,11/01/16 08:02:57 AM PDT,,,2016-11-01
632,2544,Hundreds of Eastern Michigan University students came together to protestracism on campus where most of them carried Pro Black signs Pro BlackEMU Students Gather To Protest Racism I BM BM,82.48,https://blackmattersus. com/19020-pro-black-em u-students-gather-to-protest-,,87.0,11 /03/1608:21:10 AM PDT,,,
633,2553,Teach your children to be powerful and persistent like our ancestors,200.0,https://www.facebook.com/brownunitedfront/,47934.0,6369.0,05/19/17 07:50:46 AM PDT,,,2017-05-19
634,2554,Mexicans are known for their masculinity and militancy as many wars in thepast say Thats why the US often offers Mexicans to join the armed forces inexchange for what they promise to give American citizenship In this regardMexicans are often sent to the war zone in Syria or other countries fromwhere they sometimes do not return Many Mexicans have to go for it astoday the process of obtaining American citizenship can last for years andeven dozens of years The US policy towards Mexicans is becomingincreasingly brutal therefore it is necessary to stop any attempts by the USgovernment to send Mexicans to the war zones where they fight for anyunknown goals,1100.06,https://www.facebook.com/brownunitedfront/,132551.0,17694.0,05/17/17 08:37:31 AM PDT,,,2017-05-17
635,2557,The Senate of the US Congress approved a bill that seriously broadens thescope of combat operations of the US Armed Forces According to this billthe US will send far more soldiers to Syria Iraq Yemen Afghanistan andsimilar countries Since thousands of Mexican have served in the US Armythis law should never be implemented Mexican soldiers shouldnt die in vainfor the sake of foreign political ambitions,402.91,https://www.facebook.com/brownunitedfront/,15890.0,1746.0,05/26/17 08:21:42 AM PDT,,,2017-05-26
636,2559,Couldnt have said it better,1700.0,https://www.facebook.com/brownunitedfront/,233961.0,30775.0,04/28/17 08:07:17 AM PDT,,,2017-04-28
637,2561,Dont forget to thank whos really responsible for your meal today,400.0,https://www.facebook.com/brownunitedfront/,29476.0,4052.0,04/18/17 07:37:58 AM PDT,,,2017-04-18
638,2566,LIKE for all the Mexican Salvadorian Guatemalan Honduran NicaraguanImmigrant dads,400.0,https://www.facebook.com/brownunitedfront/,26625.0,3563.0,03/24/17 09:30:06 AM PDT,,,2017-03-24
639,2568,Jose Mujica does what a real president should do,87.35,https://www.facebook.com/brownunitedfront/,10049.0,1181.0,04/14/17 07:45:22 AM PDT,,,2017-04-14
640,2576,What everyone should remember,148.19,https://www.facebook.com/brownunitedfront/,10539.0,1486.0,05/12/17 07:30:14 AM PDT,,,2017-05-12
641,2579,Perfect example of how not to teach your children,112.97,https://www.facebook.com/brownunitedfront/,2810.0,428.0,04/18/17 07:37:42 AM PDT,,,2017-04-18
642,2582,More thanchildren and teens have crossed the USMexico border inthe past five years and their talents will benefit this country in the future,400.0,https://www.facebook.com/brownunitedfront/,25855.0,3727.0,03/24/17 09:26:50 AM PDT,,,2017-03-24
643,2586,Mexican girls are the best,300.0,https://www.facebook.com/brownunitedfront/,102110.0,16055.0,05/05/17 12:04:14 AM PDT,,,2017-05-05
644,2590,In Mexico they are called that Your thoughts,59.55,https://www.facebook.com/brownunitedfront/,1877.0,262.0,04/28/17 07:52:45 AM PDT,,,2017-04-28
645,2594,People think of Chicana women as being fiery and fierce which is usuallytrue But I think the quality that so many Chicana possess is strengthZoeSaldana,300.0,https://www.facebook.com/brownunitedfront/,6889.0,915.0,04/21/17 06:43:37 AM PDT,,,2017-04-21
646,2601,Being a cool Chicano from birth,400.0,https://www.facebook.com/brownunitedfront/,,5988.0,03/24/17 09:31 :58 AM PDT,,,2017-03-24
647,2604,Raise your children with respect to our roots,445.0,https://www.facebook.com/brownunitedfront/,43961.0,5571.0,04/13/17 07:51:07 AM PDT,,,2017-04-13
648,2611,True tattoo art,200.0,https://www.facebook.com/brownunitedfront/,40007.0,5433.0,05/19/17 07:52:31 AM PDT,,,2017-05-19
649,2612,Are you ready to protect your community,400.0,https://www.facebook.com/brownunitedfront/,7943.0,1338.0,04/28/17 07:53:48 AM PDT,,,2017-04-28
650,2613,An immigration judge has ordered an Army veteran from Chicago who servedtwo tours of duty to be deported His name is Miguel Perez and he is Chicanoin every sense of the word Perez moved to Chicago when he was yearsold and was a permanent legal resident He joined the US Army and servedtwo tours of duty in Afghanistan where he suffered a brain injury in anexplosion Perez served seven years but because he is not a US citizenImmigration Customs Enforcement detained him stripped his legal status andbegan the deportation processThis system doesnt appreciate our sacrifices America was designed thatway it will only benefit gringos Miguel Perez is a real hero who was betrayedby America When will we have real justice in this country,400.0,https://www.facebook.com/brownunitedfront/,21771.0,4204.0,03/23/17 08:04:13 AM PDT,,,2017-03-23
651,2626,Like if you say hello as same,200.0,https://www.facebook.com/brownunitedfront/,16913.0,2529.0,05/16/17 07:18:55 AM PDT,,,2017-05-16
652,2627,What your books wont tell you,321.12,https://www.facebook.com/brownunitedfront/,27442.0,4349.0,04/18/17 07:20:44 AM PDT,,,2017-04-18
653,2628,We came here not to build borders and separate but to build bridges andunite,400.0,https://www.facebook.com/brownunitedfront/,46180.0,6953.0,03/23/17 08:02:56 AM PDT,,,2017-03-23
654,2631,We didnt cross the border the border crossed us,173.82,https://www.facebook.com/brownunitedfront/,15193.0,1722.0,04/21/17 06:50:26 AM PDT,,,2017-04-21
655,2632,Immigrants arent stealing jobs youre just lazy,200.0,https://www.facebook.com/brownunitedfront/,9539.0,1473.0,04/21/17 06:43:59 AM PDT,,,2017-04-21
656,2635,Amen for Mexico,200.0,https://www.facebook.com/brownunitedfront/,16285.0,,03/24/17 09:31 :39 AM PDT,,,2017-03-24
657,2638,Mexican American children wearing native costumes by Escondido PublicLibrary,500.0,https://www.facebook.com/brownunitedfront/,18155.0,2589.0,04/20/17 05:56:23 AM PDT,,,2017-04-20
658,2642,Originals,59.4,https://www.facebook.com/brownunitedfront/,2570.0,306.0,04/21/17 06:52:42 AM PDT,,,2017-04-21
659,2650,Everyone has the right to life regardless of social status,306.0,https://www.facebook.com/brownunitedfront/,13425.0,2389.0,05/12/17 12:34:30 AM PDT,,,2017-05-12
660,2651,I remember those days,60.0,https://www.facebook.com/brownunitedfront/,12541.0,1585.0,05/03/17 12:05:46 AM PDT,,,2017-05-03
661,2659,Every dream can come real Never give up Source,137.9,https://www.facebook.com/brownunitedfront/,8969.0,337.0,05/12/17 07:29:16 AM PDT,,,2017-05-12
662,2661,This costume is dreamy so much reminds me of a stained glass spiralwindow,400.0,https://www.facebook.com/brownunitedfront/,12341.0,1623.0,03/22/17 08:04:58 AM PDT,,,2017-03-22
664,2670,It may sound like nonsense but its a cruel truth,0.0,https://www.facebook.com/brownunitedfront/,0.0,0.0,05/17/17 04:47:17 AM PDT,,,2017-05-17
665,2675,This was the day of my high school graduation dayMy fatherwas not there to see me walk and receive my diploma Thatday he was working like every other day of the week He works in agriculturalfarming I am a Latina my parents are Latinos working for the Americandream I had to go to him so he can see all his hard work paying off Givinghim my proof of what he has taught me Your words dont have nothingagainst his sweatRepost,400.0,https://www.facebook.com/brownunitedfront/,21573.0,3993.0,04/28/17 08:04:46 AM PDT,,,2017-04-28
666,2691,Like if you remember your school cholosl,400.0,https://www.facebook.com/brownunitedfront/,24863.0,3964.0,03/23/17 08:03:59 AM PDT,,,2017-03-23
667,2693,Embracing the Chicano culture and spreading it around is our great goalFrom the both sides of the borders we come from the same ancient culturalbackground that was strong enough to survive the seizure of our indigenouslands of the Aztlan To those who enters foreign territories there are someways of keeping our children safe Some parents choose a dual citizenship fortheir kids to keep protect them if anything happens This is a way to go,300.0,https://www.facebook.com/brownunitedfront/,15107.0,2050.0,03/22/17 08:05:33 AM PDT,,,2017-03-22
668,2702,La Raza League,300.0,https://www.facebook.com/brownunitedfront/,12703.0,1612.0,02/07 /17 04: 30: 11 AM PST,,,
669,2718,Black and Brown unite,600.0,https://www.facebook.com/brownunitedfront/,34587.0,,02/22/17 06:52:23 AM PST,,,2017-02-22
670,2721,Mictlantecuhtli the Aztec god of death,200.0,https://www.facebook.com/brownunitedfront/,13281.0,2029.0,02/16/17 12:41:10 AM PST,,,2017-02-16
671,2725,Ill just leave this here,500.0,https://www.facebook.com/brownunitedfront/,42646.0,6999.0,02/16/17 12:40:52 AM PST,,,2017-02-16
672,2726,What your books wont tell you,500.0,https://www.facebook.com/brownunitedfront/,31192.0,4658.0,02/22/17 06:49:48 AM PST,,,2017-02-22
673,2727,Real MexicanAmerican pride RespectFYI The three largest Hispanic groups in the United States are the MexicanAmericans Puerto Ricans and Cubans,440.0,https://www.facebook.com/brownunitedfront/,82748.0,11051.0,02/16/17 12:42:01 AM PST,,,2017-02-16
674,2728,Mom is always right,153.68,https://www.facebook.com/brownunitedfront/,4203.0,441.0,03/15/17 08:00:29 AM PDT,,,2017-03-15
675,2731,The scariest thing for gabachosstrong and educated Mexican family,400.0,https://www.facebook.com/brownunitedfront/,28262.0,3636.0,03/15/17 07:58:49 AM PDT,,,2017-03-15
676,2733,I will just leave it here,0.14,https://www.facebook.com/brownunitedfront/,4.0,1.0,03/16/17 08:08:39 AM PDT,,,2017-03-16
677,2734,We both fight the same system and we both will win in the future Indigenousblack civilisations of America and our civilisations were ruined by the samegabachos And we both are growing in numbers even whitewashed statisticand officials prove it Iowa Rep Steve King said that The United States ismoving towards becoming the whites becoming a minority a majorityminority within the country Also he said that Blacks and Hispanics will befighting each other before overtaking whites in population and this is exactlywhat authorities want They will be ruling us while we would be too busyfighting each other So dont let this happen Help black people in theirstruggle and let them help us,199.56,https://www.facebook.com/brownunitedfront/,19536.0,2583.0,03/15/17 07:59:42 AM PDT,,,2017-03-15
678,2737,The most dangerous weapon is an educated Chicano,232.99,https://www.facebook.com/brownunitedfront/,17364.0,2647.0,02/08/17 11:58:45 PM PST,,,2017-02-08
679,2738,This picture is worth a thousand words,365.5,https://www.facebook.com/brownunitedfront/,27844.0,4120.0,02/02/17 01:24:03 AM PST,,,2017-02-02
680,2753,BLUE LIVES MATTER,100.0,https://www.facebook.com/copsareheroes/,227.0,36.0,10/12/16 06:09:17 AM PDT,,,2016-10-12
681,2754,BLUE LIVES MATTER,0.0,https://www.facebook.com/copsareheroes/,,0.0,10/17/16 12:28:17 AM PDT,,,2016-10-17
682,2755,BLUE LIVES MATTER,0.0,https://www.facebook.com/copsareheroes/,,0.0,10/18/16 03: 13:22 AM PDT,,,2016-10-18
683,2756,BLUE LIVES MATTER,0.0,https://www.facebook.com/copsareheroes/,,,10/18/16 08:09:51 AM PDT,,,2016-10-18
684,2757,BLUE LIVES MATTER,0.0,https://www.facebook.com/copsareheroes/,,,10/18/16 08: 11 :38 AM PDT,,,2016-10-18
685,2758,BLUE LIVES MATTER,0.0,https://www.facebook.com/copsareheroes/,0.0,0.0,10/18/16 08:21 :29 AM PDT,,,2016-10-18
686,2759,BLUE LIVES MATTER,0.0,https://www.facebook.com/copsareheroes/,0.0,,10/18/16 08:27:21 AM PDT,,,2016-10-18
687,2760,BLUE LIVES MATTER,0.0,https://www.facebook.com/copsareheroes/,0.0,0.0,10/18/16 08:27:51 AM PDT,,,2016-10-18
688,2761,BLUE LIVES MATTER,0.0,https://www.facebook.com/copsareheroes/,0.0,0.0,10/18/16 08:28: 11 AM PDT,,,2016-10-18
689,2762,BLUE LIVES MATTER,0.0,https://www.facebook.com/copsareheroes/,,,10/19/16 04:54:17 AM PDT,,,2016-10-19
690,2765,Join our fight to save Southern Heritage God bless Dixie,429.98,https://www.facebook.com/South-United-1 777037362551238/,4466.0,316.0,02/16/17 04:26:03 AM PST,,,2017-02-16
691,2766,Join our fight to save Southern Heritage God bless Dixie,1705.5,https://www.facebook.com/South-United-1 777037362551238/,17353.0,929.0,02/16/17 11:27:46 PM PST,,,2017-02-16
692,2767,Join us in our fight to save Southern Heritage God bless Dixie,0.0,https://www.facebook.com/South-United-1 777037362551238/,0.0,0.0,02/20/17 05:30:43 AM PST,,,2017-02-20
693,2768,God bless Dixie,0.0,https://www .facebook.com/South-United-1777037362551238/,,,02/20/17 05:42:34 AM PST,,,2017-02-20
694,2769,Heritage not hate God bless Dixie,0.0,https://www.facebook.com/South-United-1 777037362551238/,0.0,0.0,03/09/17 04:41:38 AM PST,,,2017-03-09
695,2770,Join us if you know its just a car NOT A SYMBOL OF HATE South United,65705.82,https://www.facebook.com/South-United-1 777037362551238/,300815.0,16587.0,03/09/17 06:14:52 AM PST,,,2017-03-09
696,2777,God Bless Dixie The South will rise again,0.0,https://www .facebook.com/South-United-1777037362551238/,1.0,0.0,02/20/17 06:48:46 AM PST,,,2017-02-20
697,2778,God bless Dixie,0.0,https://www.facebook.com/South-United-1777037362551238/,0.0,0.0,02/20/17 06:37:54 AM PST,,,2017-02-20
698,2779,They fought for our freedom now its our time to fight for their rights,72.735,https://www.facebook.comNeterans-Come-First-1757336424535312/,112737.0,15163.0,04/06/17 05:56:18 AM PDT,,,2017-04-06
699,2780,Forever grateful,264.86,https://www.facebook.comNeterans-Come-First-1757336424535312/,609.0,4.0,05/03/17 07:24:41 AM PDT,,,2017-05-03
700,2790,HILLARY CLINTON CHEATS AMERICAN VETERANSThe last time Hillary Clinton had a press conference on veterans issues wasinand since then all her plans and offers concerning veterans lifeimprovement were stated only in emails made by her staff And here aresome real Clinton decisionsLast year Clinton claimed that the Veterans,100.0,https://www.facebook.comNeterans-Come-First-1757336424535312/,164.0,5.0,10/12/16 05:56:41 AM PDT,,,2016-10-12
701,2804,Once we recognize what it is we are feeling once we recognize we can feeldeeply love deeply can feel joy then we will demand that all parts of ourlives produce that kind of joyblack woman quotes powerful woke panafrican,40.76,https://www.facebook.com/Nefertitis-Community-576081822594619/,68.0,5.0,11 /15/16 05: 18:54 AM PST,,,
702,2806,Miss Black America Nicole Hibbert celebrates the National Day ofNonviolenceThe message is clear,99.94,https://www.facebook.com/Black4Black-1268698556482143/,533.0,17.0,11/03/16 07:50:22 AM PDT,,,2016-11-03
703,2811,KNOW YOUR RIGHTS CAMP is a free campaign for youth to raiseawareness on higher education selfempowerment and instruction toproperly interact with law enforcement in various scenariosThat is what organizers of campaign say about itWe say that it is very important for young Black people to be a part of ourcommunity And this camp will help them with thatYoung Blacks are educated and uplifted in rooms with walls full of art at thiscamp They have opportunity to learn our history Black historyBy the way this camp is supported by Colin KaepernickBlack people are powerful together,100.0,https://www.facebook.com/Black4Black-1268698556482143/,521.0,85.0,11/03/16 07:50:05 AM PDT,,,2016-11-03
704,2812,Support and develop Blackowned business is the key to success Its time tounite and empower our community,29.97,https://www.facebook.com/Black4Black-1268698556482143/,7.0,0.0,10/18/16 02:36:53 AM PDT,,,2016-10-18
705,2813,Support and develop Blackowned business is the key to success Its time tounite and empower our community,0.0,https://www.facebook.com/Black4Black-1268698556482143/,0.0,0.0,10/18/16 05:40:41 AM PDT,,,2016-10-18
706,2820,You got money for war but cant feed the poor,0.0,https://www.facebook.com/PanAfrootsmove/,0.0,0.0,05/26/17 07:50:09 AM PDT,,,2017-05-26
707,2821,You got money for war but cant feed the poor,678.82,https://www.facebook.com/PanAfrootsmove/,24977.0,3182.0,05/26/17 07:56:47 AM PDT,,,2017-05-26
708,2825,Just think about it Very powerful message,20.0,https://www.facebook.com/PanAfrootsmove/,562.0,79.0,05/16/17 08:02:51 AM PDT,,,2017-05-16
709,2826,Unapologetically melaneted Kings and Queens are powerful together Join us,9087.61,https://www.facebook.com/PanAfrootsmove/,36208.0,2369.0,10/21/16 06:28:12 AM PDT,,,2016-10-21
710,2827,Unapologetically melaneted Kings and Queens are powerful together Join us,918.64,https://www.facebook.com/PanAfrootsmove/,1226.0,105.0,11/10/1607:17:06 AM PST,,,2016-11-10
711,2828,Unapologetically melaneted Kings and Queens are powerful together Join usPanAfican Roots MOVE,30507.66,https://www.facebook.com/PanAfrootsmove/,234401.0,10018.0,11/11/16 04:04:53 AM PST,,,2016-11-11
712,2829,Unapologetically melaneted Kings and Queens are powerful together Join usPanAfican Roots MOVE,14689.31,https://www.facebook.com/PanAfrootsmove/,69567.0,2398.0,02/02/17 07:01:29 AM PST,,,2017-02-02
713,2833,Boy solves Rubiks Cube with eyes closed while freestyling This is what I callBlack excellence I bet the media wouldnt tell you about this genius,300.0,https://www.facebook.com/PanAfrootsmove/,10670.0,1047.0,04/28/17 07:42:57 AM PDT,,,2017-04-28
714,2835,Unapologetically melaneted Kings and Queens are powerful together Join usPanAfican Roots MOVE,20474.49,https://www.facebook.com/PanAfrootsmove/,118865.0,4373.0,03/22/17 04:27:16 AM PDT,,,2017-03-22
715,2837,What teamwork looks like,20.0,https://www.facebook.com/PanAfrootsmove/,1055.0,153.0,05/17/17 01:13:09 AM PDT,,,2017-05-17
716,2838,What a great friendship,60.0,https://www.facebook.com/PanAfrootsmove/,432.0,51.0,04/14/17 03:04:12 AM PDT,,,2017-04-14
717,2840,There is no such thing as justice for a Black man in this country Even when aWHITE woman tries to protect her client she is arrested This is a clearstatement,32.1,https://www.facebook.com/PanAfrootsmove/,1718.0,228.0,04/28/17 07:42:19 AM PDT,,,2017-04-28
718,2844,Join us and make changes for the Black community Its time to take actions,0.0,https://www.facebook.com/PanAfrootsmove/,0.0,0.0,10/18/16 01:57:02 AM PDT,,,2016-10-18
719,2846,Join us and make changes for the Black community Its time to take actions,0.0,https://www.facebook.com/PanAfrootsmove/,0.0,0.0,10/18/16 05:50:45 AM PDT,,,2016-10-18
720,2849,So beautiful and powerful Never forget your roots,20.0,https://www.facebook.com/PanAfrootsmove/,227.0,47.0,04/14/17 08:15:54 AM PDT,,,2017-04-14
721,2852,OMG she looks like their sister,20.0,https://www.facebook.com/PanAfrootsmove/,174.0,41.0,04/14/17 08:01:06 AM PDT,,,2017-04-14
722,2853,Relationship goals,20.0,https://www.facebook.com/PanAfrootsmove/,172.0,22.0,04/14/17 03:03:28 AM PDT,,,2017-04-14
723,2854,SomaliAmerican model Halima,20.0,https://www.facebook.com/PanAfrootsmove/,134.0,8.0,04/14/17 12:02:43 AM PDT,,,2017-04-14
724,2858,Repost,0.0,https://www.facebook.com/PanAfrootsmove/,,,03/14/17 07:48:03 AM PDT,,,2017-03-14
725,2861,This is so right,200.0,https://www.facebook.com/PanAfrootsmove/,367.0,48.0,12/08/1606:22:13 AM PST,,,2016-12-08
726,2862,Its a very strong photo Powerful and sad at the same time This Queenmanaged to stay alive and beautiful despite what happened to her Shesreally an example to everyone GUYS LETS MAKE HER VIRAL,300.0,https://www.facebook.com/Pan-African-roots-MOVE-265201130527872/,1604.0,258.0,02/01/17 04:45:42 AM PST,,,2017-02-01
727,2871,The darker the berry the sweeter the juice Like if you agree,300.0,https://www.facebook.com/Pan-African-roots-MOVE-265201130527872/,7289.0,997.0,02/01/17 04:45:53 AM PST,,,2017-02-01
728,2873,So proud of these young Kings Its heartwarming to see images like thisDont forget that educations were once a privilege that Black people didnthave Our grandparents were fighting to have the chance to study Dontwaste this opportunity Its never too late for the education,300.0,https://www.facebook.com/PanAfrootsmove/,7203.0,888.0,12/27/16 05:29:00 AM PST,,,2016-12-27
729,2876,EVERYTHING was once a Black culture Remember that,300.0,https://www.facebook.com/PanAfrootsmove/,12831.0,1551.0,12/27/16 05:29:31 AM PST,,,2016-12-27
730,2877,This little King is so cute but yet serious Looks like a future Mr PresidentShow him some love and support,200.0,https://www.facebook.com/PanAfrootsmove/,384.0,42.0,12/08/16 06:21 :39 AM PST,,,2016-12-08
731,2878,True To be pretty a girl doesnt need to show her body Its nothing wrongwith being sexy and loving it but we just have to forget that beauty is notabout taking clothes off,0.0,https://www.facebook.com/PanAfrootsmove/,0.0,0.0,03/14/17 07:48:30 AM PDT,,,2017-03-14
732,2883,Black babies are the best,57.8,https://www.facebook.com/PanAfrootsmove/,94.0,17.0,11/10/16 07:20:57 AM PST,,,2016-11-10
733,2897,The community of nd Amendment supporters guns loverspatriots DefendThe nd,6240.08,https://www.facebook.com/savethe2a/,17896.0,827.0,04/07/17 04:49:50 AM PDT,,,2017-04-07
734,2899,The community of nd Amendment supporters guns loverspatriots DefendThe nd,0.0,https://www.facebook.com/savethe2a/,0.0,0.0,04/19/17 07:28:30 AM PDT,,,2017-04-19
735,2904,The community of nd Amendment supporters guns loverspatriots DefendThe nd,0.0,https://www.facebook.com/savethe2a/,0.0,0.0,04/19/17 07:35:54 AM PDT,California Illinois,California Illinois,2017-04-19
736,2910,The community of nd Amendment supporters guns loverspatriots DefendThe nd,0.0,https://www.facebook.com/savethe2a/,0.0,0.0,04/19/17 07:39:27 AM PDT,California Illinois,California Illinois,2017-04-19
737,2985,On the video you see Brinkley Police Department Chief Edward Randledriving his car more thanmiles per hour to the football gameHe is pulled over by cops They realize that they stopped their chief so theyjust laughed together and let their chief goAccording to THV since the officer did not announce the trucks licenseplate number into his radio nobody else would know the chief had beenpulled overFortunately this guardian of order didnt kill anyone with his speeding car thatday but he probably will do it next time,100.0,https://www.facebook.com/Watch-the-Police-109537 4457243609/,723.0,146.0,11/03/16 07:59:21 AM PDT,,,2016-11-03
738,2986,The man on the video knows his rights better than cops do Police state failedin this case,65.0,https://www.facebook.com/Watch-the-Police-109537 4457243609/,721.0,101.0,11/11/16 06:07:26 AM PST,,,2016-11-11
739,2987,Incredible battle cop against his own logic and evidence Such officersmake only annoy people,99.99,https://www.facebook.com/Watch-the-Police-109537 4457243609/,416.0,38.0,11/03/16 07:59:54 AM PDT,,,2016-11-03
740,2989,Once again its legal to film the police You dont have to be a journalist to dothat You dont need a special permission Its your constitutional right Hereyou can see what lesson was given to a cop who threatened man with jail forfilming him Film the Police Its legal,100.0,https://www.facebook.com/Watch-the-Police-109537 4457243609/,445.0,51.0,11/03/16 07:59:38 AM PDT,,,2016-11-03
741,2993,The man pulled over because cop thought that he parked weirdly The copcalls him tatted up gangster and claims that he is talking shit Is it a properbehavior of public servant,0.0,https://www.facebook.com/Watch-the-Police-109537 4457243609/,,,11/11/16 06:06:27 AM PST,,,2016-11-11
742,2995,This yearold girl refused to put away her lollipop and a bag of chips in theNew York Metro Food is prohibited in New York Metro Cops decided not totake her food away Look what they did instead of this After the incidentpolice didnt charge the girl with anything It means they did it just for theirown pleasure,0.0,https://www.facebook.com/Watch-the-Police-109537 4457243609/,0.0,,11/03/16 07:59:05 AM PDT,,,2016-11-03
743,3041,Lets make it go viral Like and share,87.68,https://www.facebook.com/WiIIiamsandKalvin/,6582.0,1342.0,03/28/17 05:09:49 AM PDT,,,2017-03-28
744,3057,I love my dark skin my wide nose my big lipsDo you,20.0,https://www.facebook.comNViIIiamsandKaIvin/,2259.0,394.0,04/14/17 02:44:40 AM PDT,,,2017-04-14
745,3068,Agree,0.0,https://www.facebook.com/William sandKaIvin/,0.0,0.0,12/08/16 06:09:39 AM PST,Union,,2016-12-08
746,3070,The more people see this the better chances are the princess is back homePlease share,55.68,https://www.facebook.com/WiIIiamsandKalvin/,2456.0,334.0,03/28/17 07:07:49 AM PDT,,,2017-03-28
747,3105,The truth hurts but we must face itIts a sad fact but the most of Black men regard women of other raceromantic and beautifulBelieve me you Black men we got the most beautiful romantic and attractivefemales under the sunValue a Black woman and treat her like youd treat other women of otherraces and youll realize how of a Queen you haveblackexcellence PanAfricanism BlackNationalism BlackEmpowermentAfrican Empowerment AfricanAndProud BlackAndProud BlackPrideBlackPower BlackLivesMatter Amerikkka UnapologeticallyBlackUnapologeticallyAfrican BlacklnAmerica BlacklsBeautiful KnowThySelfKnowledgeOfSelf KnowledgeOfSelflsANationalityEconomicEmpowerment Integration Failed WhiteLiesMatter EducationAfrican U n ification AfricanUnity BlackLove JusticeOrElse ProBlackRegrann blackexcellence,175.46,https://www.facebook.com/Woke-Blacks-29423460095643l,2210.0,485.0,04/13/17 07:03:49 AM PDT,,,2017-04-13
748,3113,Black people we should be brave in our fight for justice We should befearless in our fight for our freedom We should not back down and give up forthe future of these little ones will be determined by how well we fight todayblackexcellence PanAfricanism BlackNationalism BlackEmpowermentAfrican Empowerment AfricanAndProud BlackAndProud BlackPrideBlackPower BlackLivesMatter Amerikkka UnapologeticaIIyBlackUnapologeticallyAfrican BlacklnAmerica BlacklsBeautiful KnowThySelfKnowledgeOfSelf KnowledgeOfSelflsANationaIityEconomicEmpowerment Integration Failed WhiteLiesMatter EducationAfrican Unification AfricanUnity BlackLove JusticeOrElse ProBlackRegrann blackexcellence,0.0,https://www.facebook.com/Woke-Blacks-294234600956431/,0.0,0.0,03/15/17 08:06:16 AM PDT,,,2017-03-15
749,3114,I didnt agree with him until i heard the basis of his arguementThe Black struggle cannot be equatedseriously speaking and not trying todiscriminateBlack people simply wanted to be treated like humans as simple as thatPanAfricanism BlackNationalism BlackEmpowermentAfricanEmpowerment AfricanAndProud BlackAndProud BlackPrideBlackPower BlackLivesMatter Amerikkka UnapologeticallyBlackUnapologeticallyAfrican BlacklnAmerica BlacklsBeautiful KnowThySelfKnowledgeOfSelf KnowledgeOfSelflsANationalityEconomicEmpowerment lntegrationFailed WhiteliesMatter EducationAfricanUnification AfricanUnity BlackLove JusticeOrElse ProBlackRegrann blackexcellence,0.0,https://www.facebook.com/Woke-B lacks-294234600956431 I,,,03/15/17 08: 05:48 AM PDT,,,2017-03-15
750,3119,Just a reminderNever forget that the black panthers group was only formed to protect Blackpeople from the kkk who used to kill Black people like animalsHowever the Black Panthers was dismantled by the US govt but the kkk stillexists todayNo tell me this aint about raceBetter still tell me why is this soPanAfricanism BlackNationalism BlackEmpowermentAfrican Empowerment AfricanAndProud BlackAndProud BlackPrideBlackPower BlackLivesMatter Amerikkka UnapologeticallyBlackUnapologeticallyAfrican BlacklnAmerica BlacklsBeautiful KnowThySelfKnowledgeOfSelf KnowledgeOfSelfIsANationaIityEconomicEmpowerment Integration Failed WhiteLiesMatter EducationAfrican Unification AfricanUnity BlackLove JusticeOrElse ProBlackRegrann blackexcellence goals woke,369.85,https://www.facebook.com/Woke-Blacks-294234600956431/,39914.0,7534.0,02/17/17 05:32:50 AM PST,,,2017-02-17
751,3122,Without our women all of us wouldnt be in existence Without their loveperseverance and protection most of Black men wouldnt be in these highpositions we hold todayBless all Black women who grind for for ourexistence You are all we gotPanAfricanism BlackNationalism BlackEmpowermentAfrican Empowerment AfricanAndProud BlackAndProud BlackPrideBlackPower BlackLivesMatter Amerikkka UnapologeticallyBlackUnapologeticallyAfrican BlacklnAmerica BlackIsBeautiful KnowThySelfKnowledgeOfSelf KnowledgeOfSelflsANationalityEconomicEmpowerment Integration Failed WhiteLiesMatter EducationAfrican U n ification AfricanUnity BlackLove JusticeOrElse ProBlackRegrann blackexcellence goals woke,300.0,https://www.facebook.com/Woke-Blacks-294234600956431/,12232.0,2058.0,02/07/17 04:26:02 AM PST,,,2017-02-07
752,3123,A freespirited mind thinks deeply Thins mind thinks about being detachedfrom the system since childbirth thinks about the liberation of his peoplethinks about survival in all possible casesMost importantly a freespirited mind always survives doesnt perish andeven does well under any given conditionI hope yall striving to be free yourselves from the systemwakeup wewillsurvive organize joshuabeal altonsterlingTerenceCrutcher westandtogether blacklivesmatter unitejusticenovember elections black melanin blackisbeautifulblacklivesmatter blackgirlmagic USA blackandproud democratrepublican Africa nam erica n unitejustice vote breakingnews,70.0,https://www.facebook.comNVoke-Blacks-294234600956431 /,1327.0,122.0,11/11/16 03:56:07 AM PST,,,2016-11-11
753,3127,This holiday season take some time to visit your loved ones friends andfamily we are all we have me and youThis pie is worth a thousand likesMother is always mothermelaninqueen dope beautiful wakeup wewillsurvive organizewestandtogether blacklivesmatter unitejustice black melaninblackisbeautiful blacklivesmatter blackgirlmagic USA blackandprouddemocrat republican Africanamerican unitejustice breakingnewsgoals woke,300.0,https://www.facebook.com/Woke-B lacks-294234600956431 I,8744.0,1314.0,12/27/16 05:42:56 AM PST,,,2016-12-27
754,3130,Her Royal Highness the faithful woke Black woman with a sense of purposewith a determination to keep her man going till the very endThe neverfalling natural pillar of her familyThank you for your unconditional loveTag a Queen who makes you feel all of the abovemelaninqueen dope beautiful wakeup wewillsurvive organizejoshuabeal altonsterling TerenceCrutcher westandtogetherblacklivesmatter unitejustice november elections black melaninblackisbeautiful blacklivesmatter blackgirlmagic USA blackandprouddemocrat republican Africanamerican unitejustice vote breakingnews,0.0,https://www.facebook.com/Woke-B lacks-294234600956431 /,,,12/01 /16 07:48:56 AM PST,,,
755,3133,They say Black people areyall know the negative narrativeBut this is what is going on in our lives We are intelligent and wiser than theyare Im proud of yallBlackDontCrack PanAfricanism BlackNationalism BlackEmpowermentAfrican Empowerment AfricanAndProud BlackAndProud BlackPrideBlackPower BlackLivesMatter Amerikkka UnapologeticaIIyBlackUnapologeticallyAfrican BlacklnAmerica BlacklsBeautiful KnowThySelfKnowledgeOfSelf KnowledgeOfSelflsANationaIityEconomicEmpowerment Integration Failed WhiteLiesMatter EducationAfrican Unification AfricanUnity BlackLove JusticeOrElse ProBlackblackexcellence goals evoke,111.19,https://www.facebook.com/Woke-Blacks-294234600956431/,5404.0,916.0,02/02/17 11:59:11 PM PST,,,2017-02-02
756,3138,An anthem for the beautiful black women out there plain and simplegoodold fashioned hip hopListen to the lyrics and flow with the tunePraising our Melanin queens,65.0,https://www.facebook.com/Woke-B lacks-294234600956431 I,5917.0,486.0,11 /08/16 02:25:54 PM PST,,,
757,3152,You dont have to be a man to fight for freedom All you have to do is to bean intelligent human beingMalcolm Xmelaninqueen dope beautiful wakeup wewillsurvive organizeWillSims joshuabeal altonsterling TerenceCrutcher westandtogetherblacklivesmatter unitejustice november elections black melaninblackisbeautiful blacklivesmatter blackgirlmagic USA blackandprouddemocrat republican Africanamerican unitejustice vote breakingnews,22.53,https://www.facebook.com/Woke-B lacks-294234600956431 /,344.0,51.0,12/09/16 06:06:21 AM PST,,,2016-12-09
758,3154,These little ones are always watching and learningThe love of a mother and the supernatural connection between our MelaninQueens and their kids cannot be overlookedTeam MelaninTag your Mum or Queen,100.0,https://www .face book. com/Woke-B lacks-294234600956431 I,809.0,63.0,12/01 /16 07:48:44 AM PST,,,
759,3159,Welcome to the futureIm very proud of all our Black youth out there making a difference by gettingknowledge The future is bright and our liberation is certain just stay woke tothe system and dont get drowned in its deceitWe cannot always build the future for our youth but we can build our youthfor the futureFranklin D Rooseveltmelaninqueen dope beautiful wakeup wewillsurvive organizewestandtogether blacklivesmatter unitejustice black melaninblackisbeautiful blacklivesmatter blackgirlmagic USA blackandprouddemocrat republican Africanamerican unitejustice breakingnewsgoals woke,200.0,https://www.facebook.com/Woke-Blacks-294234600956431/,6678.0,978.0,01/11/17 07:15:18 AM PST,,,2017-01-11
760,3161,We have a lot of work to do as Black people inLets not waste time onbs Ascomes to an end Id kindly ask and plead with all to keep in mindlets give credit only where duemelaninqueen dope beautiful wakeup wewillsurvive organizewestandtogether blacklivesmatter unitejustice black melaninblackisbeautiful blacklivesmatter blackgirlmagic USA blackandprouddemocrat republican Africanamerican unitejustice breakingnewsgoals woke,300.0,https://www.facebook.com/Woke-Blacks-294234600956431/,16418.0,2147.0,12/27/16 05:42:46 AM PST,,,2016-12-27
761,3163,This is exactly what i have been trying to tell yall Your vote should beprecious to yall cus its your power to put another person in authority overyou your freedom your daily life and your safetyTo most people its about just going out to vote if you did just that becauseyou want to well done if you didnt aka BOYCOTT just like me you alsogot your reasonsBUT let those reasons be genuine Let them be your reasons not influencedupon or manipulated in any wayIm proud of this mama not because she didnt vote Hillary or Trump butsimply because she did her research decided for herself in her interest andthe interest of her kids and voted consciouslyIm glad i choose not to be a part of this whole systemIm proud to be woke,58.99,https://www.facebook.com/Woke-B lacks-294234600956431 I,711.0,83.0,11/10/16 07:03:23 AM PST,,,2016-11-10
762,3169,Imma stay here comfy and untouched yet working hard and caring for myown and staring at all whats going onStay Black stay strongblacklivesmatter unitejustice november elections black melaninblackisbeautiful blacklivesmatter blackgirlmagic USA blackandprouddemocrat republican Africanamerican unitejustice vote breakingnewsmelaninqueen dope beautiful wakeup wewillsurvive organizejoshuabeal altonsterling TerenceCrutcher westandtogether,24.33,https://www.facebook.comNVoke-Blacks-294234600956431/,442.0,50.0,11/15/16 04:57:07 AM PST,,,2016-11-15
763,3170,To all Black youth to all young Black girls and ladies to the Black gentlemenand to the Black boys to all Black people lets never underrate the power ofour Queens every single one of them from new born babies to their mothersand young university graduates we believe in you and your strengthKeep the Black girl Magic shinning everywherePanAfricanism BlackNationalism BlackEmpowermenAfrican Empowerment AfricanAndProud BlackAndProud BlackPrideBlackPower BlackLivesMatter Amerikkka UnapologeticallyBlackUnapologeticallyAfrican BlacklnAmerica BlackIsBeautiful KnowThySelfKnowledgeOfSelf KnowledgeOfSelflsANationalityEconomicEmpowerment Integration Failed WhiteLiesMatter EducationAfrican Unification AfricanUnity BlackLove JusticeOrElse ProBlackRegrann blackexcellence,0.59,https://www.facebook.com/Woke-Blacks-29423460095643l /,5.0,1.0,03/15/17 08:05:34 AM PDT,,,2017-03-15
764,3173,We give too many people the power to lower our positive Black vibrations Weshouldnt give in rather stand true to our own frequencymelaninqueen dope beautiful wakeup wewillsurvive organizeWillSims joshuabeal altonsterling TerenceCrutcher westandtogetherblacklivesmatter unitejustice november elections black melaninblackisbeautiful blacklivesmatter blackgirlmagic USA blackandprouddemocrat republican Africanamerican unitejustice vote breakingnews,300.0,https://www.facebook.com/Woke-B lacks-294234600956431 /,6981.0,749.0,12/09/16 06:07:22 AM PST,,,2016-12-09
765,3179,We are black and we support the nd Ammendment Join us if selfdefenseis your priority,820.57,https://www.facebook.com/ProtectBlackGunOwners/,355.0,33.0,11/16/16 01 :26:41 AM PST,,,2016-11-16
766,3182,We are African Americans and we support the nd Amendment Join us ifselfdefense is your priority,0.0,https://www.facebook.com/ProtectBlackGunOwners/,,,12/08/16 05:30:05 AM PST,,,2016-12-08
767,3183,We are African Americans and we support the nd Amendment Join us ifselfdefense is your priority,592.49,https://www.facebook.com/ProtectBlackGunOwners/,309.0,27.0,12/08/16 05:30:34 AM PST,,,2016-12-08
768,3185,We support the nd Amendment Join us if selfdefense is your top priorityBlack Guns Matter,6302.35,https://www.facebook.com/ProtectBlackGunOwners/,9202.0,933.0,12/09/16 07:00:35 AM PST,,,2016-12-09
769,3187,Black American racial experience is real We support the nd ammendmentfor our safety,0.0,https://www.facebook.com/ProtectBlackGunOwners/,,,11/16/16 01 :08:41 AM PST,,,2016-11-16
770,3189,We are black and we support the nd Ammendment Join us if selfdefense ifa priority for you,0.0,https://www.facebook.com/ProtectBlackGunOwners/,0.0,0.0,11/16/16 01 :21 :46 AM PST,,,2016-11-16
771,3190,We are black and we support the nd Ammendment Join us if selfdefense ifa priority for you,0.0,https://www.facebook.com/ProtectBlackGunOwners/,,,11/16/16 01 :22:34 AM PST,,,2016-11-16
772,3191,We are black and we support the nd Ammendment Join us if selfdefenseis your priority,526.57,https://www.facebook.com/ProtectBlackGunOwners/,175.0,15.0,11/16/16 01 :26:33 AM PST,,,2016-11-16
773,3207,Supporting and developing blkowned Businesses is the key to raising ourcommunity,0.0,https://www.facebook.com/Black4Black-1268698556482143/,0.0,0.0,12/06/16 12:50:10 AM PST,,,2016-12-06
774,3227,Education is the passport to the future for tomorrow belongs to those whoprepare for it todayMalcolm X,199.97,https://www.facebook.com/Black4Black-1268698556482143/,,24.0,12/05/16 06:26:28 AM PST,,,2016-12-05
775,3241,LIKE if youve ever felt that way,200.0,https://www.facebook.com/brownunitedfront/,18213.0,2310.0,03/17/17 08:19:49 AM PDT,,,2017-03-17
776,3246,Say it loud,20.69,https://www.facebook.com/brownunitedfront/,285.0,57.0,04/25/17 07:39:02 AM PDT,,,2017-04-25
777,3252,Selena Fact,247.76,https://www.facebook.com/brownunitedfront/,10080.0,1669.0,04/24/17 07:54:45 AM PDT,,,2017-04-24
778,3253,Respect our labour,77.47,https://www.facebook.com/brownunitedfront/,1197.0,139.0,04/25/17 07:38:26 AM PDT,,,2017-04-25
779,3259,Illegals think they are proprietors in America They think that since there areso many of them in America we cant deport them allSo lets show them what American law is capable of when fully enforcedLets elect Trump and watch their sorry asses being deported all overAmerical,200.0,https://www.facebook.com/StopAllInvaders/,5019.0,909.0,05/11/17 07:42:22 AM PDT,,,2017-05-11
780,3264,FNX and HK,116.05,https://www.facebook.com/ProtectBlackGunOwners/,248.0,40.0,12/27/16 11 :25:41 PM PST,,,2016-12-27
781,3272,We support the nd Ammendment Join us if selfdefense is your priorityBlack Guns Matter,0.0,https://www.facebook.com/ProtectBlackGunOwners/,0.0,,12/26/16 06:39:01 AM PST,,,2016-12-26
782,3273,We support the nd Ammendment Join us if selfdefense is your priorityBlack Guns Matter,0.0,https://www.facebook.com/ProtectBlackGunOwners/,0.0,,12/26/16 06:39:43 AM PST,,,2016-12-26
783,3274,We support the nd Amendment Join us if selfdefense is your priority BlackGuns Matter,8761.46,https://www.facebook.com/ProtectBlackGunOwners/,15609.0,1456.0,12/26/16 06:40:25 AM PST,,,2016-12-26
784,3277,You feel safe with a gun and even safer when your ladys woke on the ndProtect yourselves,200.0,https://www.facebook.com/ProtectBlackGunOwners/,645.0,111.0,02/01 /17 05:26:35 AM PST,,,
785,3278,We support the nd Amendment Join us if selfdefense is your priority BlackGuns Matter,5275.35,https://www.facebook.com/ProtectBlackGunOwners/,11028.0,1205.0,02/03/17 01:40:54 AM PST,,,2017-02-03
786,3285,Fatherhood is a very natural thingits not something that shakes up my lifebut rather it enriches it Andrea Bocelli,200.0,https://www.facebook.com/Hell_and_Back-1806743482876111/,396.0,30.0,12/29/16 03:03:47 AM PST,,,2016-12-29
787,3298,So lovely girl,200.0,https://www.facebook.com/nativeprideunited/,2041.0,274.0,02/07/17 03:38:24 AM PST,,,2017-02-07
788,3306,Native beauty,200.0,https://www.facebook.com/Native-Americans-United-386046198404902/,2687.0,410.0,02/01/17 11:34:02 PM PST,,,2017-02-01
789,3308,According to the Correctional Association of New Yorks most recentstatistics as of Junewomen were in state or federal prisonsor local jails just underof the total US prison and jail populationmorethan two million In New York alone as of Januarywomen wereincarcerated in New Yorks prisonsaboutof the states total prisonpopulation ofMore thanpercent of women in state prisons andpercent of men in state prisons report being parents of children underAboutpercent of mothers in state prisons lived with their children beforeprison compared topercent of menAboutpercent of women in state prisons were employed fulltime prior totheir arrest compared withpercent of menNearlypercent were receiving public assistance before arrest comparedtopercent of men Aboutpercent had incomes of less thanpermonth prior to arrest compared topercent of men Real Truth,0.0,https://www.facebook.com/Hell_and_Back-1806743482876111/,0.0,0.0,02/13/17 07:32:20 AM PST,,,2017-02-13
790,9,Edward was a combat engineer in Afghanistan whose job was to clearroadside bombs Read about our heroes and stay forever grateful Click hereto learn more Veterans USAGovSpending,1052.89,https:Hinstagram.com/veterans_us/,4871.0,13.0,11/24/15 05:34:21 AM PST,,,2015-11-24
791,91,We dont want to honor racism slavery and hatred This is what ConfederateHeritage is Not My Heritage Rally,13661.08,https://www.facebook.com/events/227388350945080/,49978.0,1499.0,03/15/16 08:02:45 AM PDT,Jackson Mississippi,Mississippi,2016-03-15
792,458,Bob MirandaBoulay Camp Lejeune Marine reservist suffers serious healthissues after exposure to tainted water And hes not the only oneApproximatelyMarine Reservists may have suffered the same kind ofexposureWhere were the liberals shouting about ecological problems Why do theycare about shutting down the coal industry to avoid mysterious unprovedglobal warming but they dont mind thousands of Americans drinkingpoisoned waterNeither the VA officials nor our military commanders helped our Marines andnow they just feel abandoned Bob MirandaBoulay said I dont countthatis what our veterans feel That is not an attitude they deserveI wanted to make a difference Boulay said I love my country and I wantedto do the right thing I wanted to be a Marine That is a real shame ourveterans feel being betrayed by our country leaders,700.0,https://www.facebook.com/Being-Patriotic-1 601685693432389/,4697.0,1003.0,05/10/16 08:14:03 AM PDT,,,2016-05-10
793,534,Stand for the people not the Government Join the rally in Atlanta this SundayAmerican CrusadeGa,10.68,https://www.facebook.com/events/I678907209017708/,5.0,0.0,04/13/16 03:24:02 AM PDT,Atlanta Georgia,Georgia,2016-04-13
794,770,CHICAGO MAN SPENTYEARS IN PRISON ON DRUG CHARGESBECAUSE COPS LIED UNDER OATH ABOUT THE CASEJermaine Walker was arrested and sent to prison after the police officers anda states attorney investigator had LIED UNDER OATH They said that therewas no surveillance camera in the alley where they arrested himeven thoughit was and Walker said that Its another prove that if you are black in thiscountry you are never safe You can be arrested killed or imprison literally forthe color of your skinWalkers attorney said that Walker can obtain up tofor the time hespent in prison but is it a good price for theyears of his lifeThese bastards ruined this mans life and proved once again that there is notjustice in this country,0.0,https://www.facebook.com/WilliamsKalvin-788980617892144/,0.0,0.0,04/21/16 12:09:10 AM PDT,,,2016-04-21
795,794,Your voice counts Here you can find news and videos about blackcommunity,138.96,https://www.facebook.comnVilliam sandKaIvin/,64.0,1.0,01/14/16 06:38:34 AM PST,,,2016-01-14
796,804,We are proud to be black and stand for our community Join to end the racismin the US,48378.85,https://www.facebook.comnVilliam sandKaIvin,185599.0,10575.0,04/13/16 04:42:55 AM PDT,,,2016-04-13
797,910,As we celebrate and reflect upon the birth of the great Martin Luther King Jra voice of the people and one who sacrificed his life for the total liberation ofBlack Americans the question is who will keep his dream aliveHe saw the promiseland where blacks and whites live together in harmonyand each of them given equal rights and privileges freedom and justiceToday we do not see this equality among blacks and whites in AmericaThese rights and privileges freedom and justice shouldnt be for someselected few but allThanks for watching Id like to hear from youClick like Share and Comment Together we can make America a betterplaceAs we celebrate and reflectupon the birth of the great Martin Luther King Jr a voice of the people andone who sacrificed his life for the total liberatio WHO WILL BE THE NEXTMARTIN LUTHER KING JR WilliamsKalvin,0.0,https://www.facebook.com/WiIIiamsandKalvin/,0.0,0.0,01/19/16 03:47:57 AM PST,,,2016-01-19
798,928,repost,200.0,https://www.facebook.com/blacktivists/,11287.0,1567.0,05/19/17 07: 12:06 AM PDT,,,2017-05-19
799,930,repost,200.0,https://www.facebook.com/blacktivists/,28677.0,4314.0,05/16/17 06:14:35 AM PDT,,,2017-05-16
800,931,repost,300.0,https://www.facebook.com/blacktivists/,10543.0,1607.0,05/17/17 04:21:04AM PDT,,,2017-05-17
801,945,repost,200.0,https://www.facebook.com/blacktivists/,,1066.0,05/19/17 07: 11 :43 AM PDT,,,2017-05-19
802,949,repost,258.38,https://www.facebook.com/blacktivists/,16262.0,,05/30/17 07: 18:50 AM PDT,,,2017-05-30
803,950,repost,26.37,https://www.facebook.com/blacktivists/,458.0,84.0,05/11/17 04:19:41 AM PDT,,,2017-05-11
804,965,repost,300.0,https://www.facebook.com/blacktivists/,50812.0,9366.0,05/17/17 04:09:03 AM PDT,,,2017-05-17
805,967,repost,14.53,https://www.facebook.com/Blacktivist-12837154 7 505950/,492.0,72.0,03/29/17 07:31 :03 AM PDT,,,2017-03-29
806,978,repost,200.0,https://www.facebook.com/blacktivists/,8389.0,1209.0,04/21/17 07:39:28 AM PDT,,,2017-04-21
807,985,repost,200.0,https://www.facebook.com/blacktivists/,,1602.0,04/21 /17 07:43: 13 AM PDT,,,
808,988,Meet Tamya Fultzthe member of the chess team at Earle STEMelementary school who just took the bronze in the IESA state chesstournament in Peoria,122.79,https://www.facebook.com/blacktivists/,4372.0,553.0,04/21/17 07:41:22 AM PDT,,,2017-04-21
809,989,repostSquad goals,199.99,https://www.facebook.com/blacktivists/,7745.0,1110.0,04/21/17 07:40:47 AM PDT,,,2017-04-21
810,1003,repost,102.49,https://www.facebook.com/blacktivists/,1797.0,230.0,04/14/17 08:03:15 AM PDT,,,2017-04-14
811,1007,repost,117.92,https://www.facebook.com/blacktivists/,2919.0,315.0,04/14/17 08:01 :00 AM PDT,,,2017-04-14
812,1008,repost,213.84,https://www.facebook.com/blacktivists/,15764.0,2337.0,04/14/17 08:00:23 AM PDT,,,2017-04-14
813,1012,This is Diego He is crying at the funeral of his teacher Evandro Joao da Silvawho helped him come out of poverty and violence through music,155.34,https://www.facebook.com/blacktivists/,10922.0,1310.0,04/14/17 07:57:59 AM PDT,,,2017-04-14
814,1014,repost,400.0,https://www.facebook.com/blacktivists/,44393.0,7206.0,04/13/17 04:44:53 AM PDT,,,2017-04-13
815,1019,repost,177.0,https://www.facebook.com/blacktivists/,,583.0,04/13/17 03:41 :20 AM PDT,,,2017-04-13
816,1025,Whenever I watch it I smile each time Thanks for your positivityWhenever I watch it I smile each time Thanks for yourposit wwwfacebookcom,1102.0,https://www.facebook.com/Blacktivist-128371547505950/,77424.0,7711.0,03/09/17 02:47:28 AM PST,,,2017-03-09
817,1048,repost,0.0,https://www.facebook.com/blacktivists/,,,03/14/17 07:15:45 AM PDT,,,2017-03-14
818,1053,repost,253.7,https://www.facebook.com/Blacktivist-12837154 7 505950/,17905.0,2328.0,03/14/17 07:01:00AM PDT,,,2017-03-14
819,1088,Repost,400.0,https://www.facebook.com/Blacktivist-12837154 7 505950/,25038.0,3275.0,12/04/16 11 :04:46 PM PST,,,2016-12-04
820,1117,BLACK DOCTOR WAS HELD AT GUNPOINT BY TROOPER WHILETRYING TO SAVE CRASH VICTIMDr Nicholson walked towards the scene of the accident with his scrubs whenthe trooper drew his gun screaming Get back Get backI guess even today black people arent afforded the same humanity as otherAmericansLivingWithRacism,600.0,https://www.facebook.com/Blacktivist-128371547505950/,8515.0,1681.0,10/20/16 07:54:25 AM PDT,,,2016-10-20
821,1179,repostDont mess with us,400.0,https://www.facebook.com/Blacktivist-12837154 7 505950/,20526.0,3605.0,11/18/16 08:21 :54 AM PST,,,2016-11-18
822,1677,A message from Muslim American kids to all citizens of the usis this howwe really want our kids to feel,200.0,https://www.facebook.com/MuslimAmerica/,2379.0,165.0,03/17/16 04:20:47 AM PDT,,,2016-03-17
823,1885,INSTagram Of The United States or simplyINSTOTUS Unique Instagrampage for American patriots only FOLLOW JUST DO IT,2277.54,https://www.facebook.com/Lalalo-1 028159433939877/,13211.0,10.0,05/20/16 04:36:31 AM PDT,Alabama Arkansas Georgia Illinois Iowa Louisiana Minnesota Mississippi Nebraska Wisconsin,Alabama Arkansas Georgia Illinois Iowa Louisiana Minnesota Mississippi Nebraska Wisconsin,2016-05-20
824,1945,Follow BlackAmericaToday Stay woke,634.08,https://www.facebook.com/Proudblacks-954167134618867/,5609.0,2.0,05/17/16 04:18:29 AM PDT,Florida Georgia New York,Florida Georgia New York,2016-05-17
825,2110,Unapologetically black educated and beautiful,200.0,https://www.facebook.com/blackmattersus.mvmnt/,4404.0,802.0,04/19/17 06:28:29 AM PDT,,,2017-04-19
826,2120,Vanae JamesBey differs from most Black kids of her age Shes onlybutshes already chosen her future Vanae sees herself as a beacon ofinformation for people of color Vanae JamesBey has created a coloring bookwhich focuses on Black culture Kid Sheds Light On Black CultureBlackMattersUScom blackmattersuscom,105.57,https://blackmattersus.com/33146-kid-sheds-light-on-black-culture/,815.0,49.0,05/01/17 07:00:23 AM PDT,,,2017-05-01
827,2307,Institutional racism takes a hold of our schools as white students of theUniversity of North Dakota make a mockery of Black people InstitutionalRacism White Students Slam BLM I BM BM,113.88,https:Hblackmattersus.com/16599-institutional-racism-white-students-slam-,327.0,32.0,09/27/16 08:38:36 AM PDT,,,2016-09-27
828,2367,Were proud to announce an initiative focused on providing free legaleducation to empower our people and strengthen our communityWe urge our city to continue to support and defend our immigrantcommunities and their families Immigrants and refugees are an integral partof our economy our cultural and social life and our future Join the LegalNight meeting aton MarchLegal Night atFree legal help for immigrants,0.0,https://www.facebook.com/events/274895506278564/,0.0,0.0,02/22/17 07:03:56 AM PST,Charlotte North Carolina,North Carolina,2017-02-22
829,2368,Were proud to announce an initiative focused on providing free legaleducation to empower our people and strengthen our communityWe urge our city to continue to support and defend our immigrantcommunities and their families Immigrants and refugees are an integral partof our economy our cultural and social life and our future Join the Legalht meetin aton MarchLegal Night atiFree legal help for immigrants,257.6,https://www.facebook.com/events/274895506278564/,580.0,35.0,02/22/17 07:05:06 AM PST,Charlotte North Carolina,North Carolina,2017-02-22
830,2386,Were proud to announce an initiative focused on providing free legaleducation to empower our people and strengthen our communityWe believe that having these legal workshops on a monthly basis will prove tobe beneficial in a tangible way for our communityMeet you atCharlotte NC Legal Night at,0.0,https://www.facebook.com/events/651125608392879/,0.0,0.0,02/22/17 07:05:06 AM PST,Charlotte North Carolina,North Carolina,2017-02-22
831,2440,Many of us are poor and struggling due to systemic racism So fight forsomethingIT IS OUR DUTY WE HAVE NOTHING TO LOSE BUT OUR CHAINS,73.75,https://www.facebook.com/Black-Edification-1772583676310336/,2318.0,146.0,07/19/16 02:16:10 PM PDT,Alabama Arizona California Florida Georgia Mississippi New Mexico York Oklahoma Texas Washington Baltimore,Alabama Arizona California Florida Georgia Mississippi New Mexico Oklahoma Texas Washington,2016-07-19
832,2465,blackexcellence blackperfection blackbeauty blackbusinessafricanamerican blackcommunity melanin blackpride blackout americausa blackscience education diversity blackgirlmagic,360.35,https://www.facebook.com/iloveblackexcellence/,2989.0,515.0,03/22/17 04:32:12 AM PDT,,,2017-03-22
833,2466,blackexcellence blackperfection blackbeauty blackbusinessafricanamerican blackcommunity melanin blackpride blackout americausa blackscience education diversity blackgirlmgic,400.0,https://www.facebook.com/iloveblackexcellence/,3310.0,572.0,03/16/17 07:27:06 AM PDT,,,2017-03-16
834,2578,Hes so strong Its beautifulSource,226.49,https://www.facebook.com/brownunitedfront/,11618.0,1797.0,05/12/17 07:30:42 AM PDT,,,2017-05-12
835,2621,People should never have to apologise for striving for better livesSource,200.0,https://www.facebook.com/brownunitedfront/,15207.0,2077.0,04/21/17 06:46:48 AM PDT,,,2017-04-21
836,2630,Just keep it realRepost,400.0,https://www.facebook.com/brownunitedfront/,27790.0,4255.0,04/28/17 08:06:46 AM PDT,,,2017-04-28
837,2663,This is Juanita daughter of immigrants She was raised on a ranch in Mexicoand she brought with her those traditions She has six siblings and she will bethe first to graduate from a university Juanita has worked in the fields to helpher family I had the honour to capture her grad pictures In the back you cansee her mother working It made me so happy to see how proud her mother isof her Y su padre ha de estar muy orgulloso de lo que ella a logrado Desdeel cielo ha de sonrefr y decir esa es mi Juanita Source,251.37,https://www.facebook.com/brownunitedfronU,27749.0,,05/12/17 07:28: 10 AM PDT,,,2017-05-12
838,2677,I immigrated to the states when I wasalong with my mother and two oldersiblings During elementary middle school and high school I fought everyobstacle that was thrown my way When I got to high school I began to takeAP classes which led me to create a goal to continue onto higher educationFormal education allowed me to begin a career but most importantly itallowed me to figure out a special side of me I am so blessed and humbled tobe firstgeneration undocumented brown and a product of the hard work ofa single motherRepost,400.0,https://www.facebook.com/brownunitedfront/,,,04/28/17 08:06:24 AM PDT,,,2017-04-28
839,2700,People really need to understand,10.6,https://www.facebook.com/brownunitedfront/,283.0,48.0,01/27/17 12:32:54 AM PST,,,2017-01-27
840,2807,Remember your roots with Nagast Footwear Unapologetically melanated,100.0,https://www.facebook.com/Black4Black-1268698556482143/,393.0,11.0,11/03/16 07:49:39 AM PDT,,,2016-11-03
841,2851,Repost,40.0,https://www.facebook.com/PanAfrootsmove/,256.0,20.0,04/14/17 08: 01 :46 AM PDT,,,2017-04-14
842,2855,WOW He didnt let his vitiligo stop himRepost,0.0,https://www.facebook.com/PanAfrootsmove/,,,03/28/17 12:43:01 AM PDT,,,2017-03-28
843,2859,Kids learn by parents example Give them the good oneRepost from,400.0,https://www.facebook.com/PanAfrootsmove/,1690.0,38.0,12/08/16 06:21 :22 AM PST,,,2016-12-08
844,2964,FREE shooting practice for our subscribers Hurry onlypackages leftDear subscribers we offer you to gather together and visitshooting range in Gainesville FL Onwe are making anevent for our subscribers Join the event and share it with your friends Firstpeople who will message us will get a FREE mm Shooting Packageincludes the day pass a rental handgunrounds mmtarget eyeearprotection if neededIf ou want to get it just message us Shooting practiceat,1000.0,https://www .face book. com/Defend-the-2nd-692068924291672/,,55.0,02/17 /17 07:48:04 AM PST,Gainesville Florida,Florida,
845,3017,If you dont break the law we are told you have nothing to worry about fromcopsSadly those who blindly repeat that phrase remain irresponsibly oblivious tothe real problem of police abusing innocent peopleAs a recent ACLU lawsuit shows being innocent is no guarantee police wontkick in your door strangle you beat you and force you to fill out a falsestatementSubscribe to our channelFollow my FacebookFollow me on InstagramFollow me on TwitterThe truth about howpolice officers do their job,300.0,https://www.facebook.com/WiIIiamsandKaIvin/,6280.0,276.0,05/18/17 07:15:38 AM PDT,,,2017-05-18
846,3104,and Id choose you in a hundred lifetimes in a hundred worlds in anyversion of reality Id find you and Id choose youRepost,400.0,https://www.facebook.com/Woke-Blacks-294234600956431/,6094.0,1014.0,04/13/17 07:02:40 AM PDT,,,2017-04-13
847,3106,Repost,400.0,https://www.facebook.com/Woke-B lacks-294234600956431 I,9675.0,1761.0,04/13/17 07:04:15 AM PDT,,,2017-04-13
848,3108,Do you want to see real friendship goals Check out this graduation photo ofa soontobe college grad with her Friends with DegreesRepost from,400.0,https://www.facebook.com/Woke-Blacks-294234600956431/,6836.0,1153.0,04/13/17 07:04:39 AM PDT,,,2017-04-13
849,3111,The media will be delighted to show how Black people are doing some badsht but this they will not show you Black people are doing great things allover the worldMeet the OGUNSANYA QUADRUPLETSI These brothers and sisters allgraduated on the same day with a Masters Degree at the age ofyears oldfrom the University of Warwick in the UKblackexcellence PanAfricanism BlackNationalism BlackEmpowermentAfrican Empowerment AfricanAndProud BlackAndProud BlackPrideBlackPower BlackLivesMatter Amerikkka UnapologeticallyBlackUnapologeticallyAfrican BlacklnAmerica BlacklsBeautiful KnowThySelfKnowledgeOfSelf KnowledgeOfSelfIsANationaIityEconomicEmpowerment Integration Failed WhiteLiesMatter EducationAfrican Unification AfricanUnity BlackLove JusticeOrElse ProBlackRegrann blackexcellence,0.0,https://www.facebook.com/Woke-Blacks-294234600956431/,0.0,0.0,04/13/17 07:04:05 AM PDT,,,2017-04-13
850,3220,thank you for uplifting Black Kings,199.86,https://www.facebook.com/Black4Black-1268698556482143/,939.0,6.0,12/05/16 06:26:41 AM PST,,,2016-12-05
851,3224,Amazingorgeous,200.0,https://www.facebook.com/Black4Black-1268698556482143/,1036.0,3.0,12/05/16 06:26:06 AM PST,,,2016-12-05
852,3345,Join the event bring your friends feel safe with usIts free Organized on a donation basis Free Selfdefense class in N Y,0.0,https://www.facebook.com/events/406662303016780/,,,03/21/17 08:22:41 AM PDT,New York,New York,2017-03-21
853,3356,The first selfdefense classJoin the event bring yourfriends feel safe with us Selfdefense classes,0.0,https://www.facebook.com/events/180754319075270/,0.0,0.0,02/06/17 05:40:00 AM PST,Orlando Florida,Florida,2017-02-06
854,3379,Get your daily dose of funny conservative memes Nothing Left,0.0,https://www.facebook.com/Nothing-Left-362365657 45237 41,,,02/08/17 01: 16:09 AM PST,,,2017-02-08
855,772,Therer are two kinds of kids in American schools One kind of kids have a lotof opportunities to learn and to develop all their skills and they are whiteAnother kind of kids is black and the only thing they learn at school is to obeythe policeSubscribe to our channelFollow my FacebookFollow me on InstagramFollow me on Twitter,791.37,https://www.facebook.comNVilliamsKalvin-788980617892144/,6060.0,268.0,11/01/16 06:05:37 AM PDT,,,2016-11-01
856,778,Were black and Were proud of it Join to understand how beautiful we are,72.77,https://www.facebook.com/William sandKaIvin/,147.0,5.0,01/14/16 06:32:29 AM PST,,,2016-01-14
857,786,You are no longer safe and sound even in your own house You can be killedwithout a reason even if you commityted no crime You will see no mercyeven if you are a pregnant woman a black pregnant womanSubscribe to our channelCSbzPCwU DPvDC RVRaOcDtgFollow my FacebookFollow me on lnstagramFollow me on Twitter,0.0,https://www.facebook.com/WilliamsKalvin-788980617892144/,,,11/01/16 06:05:06 AM PDT,Union,,2016-11-01
858,796,Its time for changes in Black Community Stay together brother let us betogether here,114.87,https://www.facebook.comnViIIiamsandKaIvin/,46.0,1.0,01/14/16 06:33:13 AM PST,,,2016-01-14
859,798,Theres no reason to fight the whole government if you are alone You will diebut you can never win You need people who can stand with you for what youall think is right Stillcan we do thisSubscribe to our channelFollow my FacebookFollow me on Instagram,797.63,https://www.facebook.comnWil liam sKalvin-788980617892144/,7721.0,335.0,11/01/16 06:04:00 AM PDT,,,2016-11-01
860,800,I pity anyone who has to deal with neighbors in an apartment buildingEspecially when you have to deal with the complaining and passiveaggressive types Oh and lets not forget gentrifiers Or as I like to call themwhite migrators Apparently instead of knocking on a neighbors doorpeople take the easy and passiveaggressive way out and just leave notesinstead But one man wasnt having itLinknjpgohafbfefffbeoeDSubscribe to our channelFollow my FacebookFollow me on InstagramFollow me on Twitter,0.0,https://www.facebook.comNVilliamsKalvin-788980617892144/,0.0,0.0,10/18/16 02:55:16 AM PDT,,,2016-10-18
861,803,Icecream is something more than just a food you love When a businessexpresses its views cops are attacking because they know no other way toact BenJerrys icecream is boycotted by the police officers just becauseof the opinion of the business owners So lets stand against the politicalrepressionsSubscribe to our channelFollow my FacebookFollow me on InstagramFollow me on Twitter,799.95,https://www.facebook.comnVilliamsKalvin-788980617892144/,12654.0,693.0,10/21/16 07:46:31 AM PDT,Union,,2016-10-21
862,809,A demonstration which was held on Tuesday in response to the recent fatalpolice shooting of Philando Castile resulted in the arrest ofpeople outsidethe governors mansion in St Paul Minnesota Another arrest was carriedout the following day during the morning hours whereprotestors werearrested and charged with public nuisance and unlawful assembly Since Julythe day after which Castile was fatally shot to death sympathizers havebeen embarking on demonstration outside the governors home but policeofficers are asking the protesters out of the premises because they areblocking the streets This request seemed not successful therefore theprotesters stood against the officers According to the governor the protestorsare welcomed to stay because he had no problem with them being thereEven though the street was cleared few days after Julysome protestershave returned to the premises to continue the demonstrationSubscribe to our channelFollow my FacebookFollow me on Twitter,500.0,https://www.facebook.comNVilliamsKalvin-788980617892144/,4832.0,228.0,08/04/16 06:42:36 AM PDT,,,2016-08-04
863,813,Your voice counts Here you can find news and videos about blackcommunity,0.0,https://www.facebook.comnVilliam sandKaIvin/,48.0,0.0,01/14/16 06:38:30 AM PST,,,2016-01-14
864,821,Black people must help one another Only united we win and always dividedwe fall But there are some Blacks who think that serving whites is moreprofitable for them than helping their black brothers So Sheriff Clarke is oneof that pigsSubscribe to our channelFollow my FacebookFollow me on Twitter,2.0,https://www.facebook.com/WilliamsKalvin-788980617892144/,20230.0,1049.0,08/17/16 07:50:14 AM PDT,,,2016-08-17
865,835,Black guys are smart and no one can deny this White cops are one of thehardest of the problems we face every day still we found the way how todeal with this bastards So we developed the app that can collect andorganize the information about cos misconduct Use it and you will help theentire black communitySubscribe to our channelFollow my FacebookFollow me on InstagramFollow me on Twitter,0.0,https://www.facebook.comnVilliamsKalvin-788980617892144/,0.0,0.0,10/20/16 08:03:34 AM PDT,,,2016-10-20
866,841,A young black guy who was mentally disabled decided to end his life but willonly do that by making the cops kill him This is absolutely insane in thehighest order He took a gun and ordered his other two brothers to take avideo of the whole incident Michael Ford at the police vicinity opened fireand got the cops attention The filming was still in process as hecommanded The first cops who appeared fired back and almost immediatelyended up drawing fire He gave the other officer a chance to get into positionwhen he opened fire Its quite not understandable why his own cop shot himand shot the mentality ill man too This is a good example of sick reality too Isthere any explanation why cops have started shooting each otherFollow my FacebookSubscribe to my YouTube ChannelFollow me on Twitter,748.95,https://www.facebook.com/WiIIiamsandKaIvin/,3734.0,455.0,03/17/16 05:32:59 AM PDT,,,2016-03-17
867,843,Danney Williamshas been trying since at leastto be acknowledgedas the outofwedlock son of former President Bill Clinton and a blackprostitute in Little Rock ArkansasSubscribe to our channelFollow my FacebookFollow me on InstagramFollow me on Twitter,1126.07,https://www.facebook.com/WilliamsKalvin-788980617892144/,15453.0,1471.0,10/18/16 02:55:26 AM PDT,,,2016-10-18
868,844,Danney Williamshas been trying since at leastto be acknowledgedas the outofwedlock son of former President Bill Clinton and a blackprostitute in Little Rock ArkansasSubscribe to our channelFollow my FacebookFollow me on InstagramFollow me on Twitter,0.0,https://www.facebook.com/WilliamsKalvin-788980617892144/,0.0,0.0,10/20/16 08:03:20 AM PDT,,,2016-10-20
869,845,Danney Williamshas been trying since at leastto be acknowledgedas the outofwedlock son of former President Bill Clinton and a blackprostitute in Little Rock ArkansasSubscribe to our channelFollow my FacebookFollow me on InstagramFollow me on Twitter,0.0,https://www.facebook.com/WilliamsKalvin-788980617892144/,0.0,0.0,12/01/16 03:23:56 AM PST,,,2016-12-01
870,853,Kirk Figueroaambushed two officers who responded to his East Bostonapartment late Wednesday after they received a call about a domesticdisturbance possibly involving a gun at the locationHe wanted to die exactly the way he ultimately did while vowing torevolutionize policingSubscribe to our channelFollow my FacebookFollow me on lnstagramFollow me on Twitter,799.11,https://www.facebook.com/WilliamsKalvin-788980617892144/,7428.0,508.0,11/01/16 06:06:31 AM PDT,Union,,2016-11-01
871,865,Hi guys If theres no justice there will be no peace Theres no way tobelieve the lie instead of fighting for the truth We must keep on fighting forwhat we know is right Many of our brothers had been killed by the policeStill we have no doubts that the justice will prevail Remember the fallen theyare waiting for our victorySubscribe to our channelFollow my FacebookFollow me on Twitter,1598.82,https://www.facebook.comnViIliamsKalvin-788980617892144/,12958.0,490.0,08/22/16 07:25:53 AM PDT,,,2016-08-22
872,897,Robert Bentley Alabama Governor has decided to reform prison systemThis is actually good news Alabama happens to be one of the nationspoorest states which have led to overcrowd in its prison The prison systemhousesinmates but it was designed for Let me enlighten you alittle on how its going to be done Four other larger prisons will be builtadditionally to prevent the rate of overcrowd Even though one would havetaught of using this money for projects like health care facilities and other hechose prisons Its not bad though at least inmates will have free live behindbars It shows how much he cares for his peopleFollow my FacebookSubscribe to my YouTube ChannelFollow me on Twitter,1138.03,https://www.facebook.comnViIliamsKalvin-788980617892144/,6881.0,192.0,03/22/16 07:34:48 AM PDT,,,2016-03-22
873,902,Expecting mother includes late husband in maternity photo shootThrough the struggles and pains of losing a dear husband Nicole Bennett hasbuilt courage to take maternity photos with her yearold son She added oldphotos of late husband Deonta but they were slightly faded to appear as aspirita symbol of hope that he watches over themShe also did this as a memorial for her unborn daughter who is due MarchWe commend her for her boldness and we hope that she finds solace in thesephotosNicoleBernett Maternityphotoswithlatehusband,2.15,https://www.facebook.com/VWIIiamsandKalvin/,8.0,1.0,03/10/16 01:29:38 AM PST,,,2016-03-10
874,3018,Its hard to be black in America still its even harder to be safe if you areblack in AmericaBlack Lives Matters new app proclaiming no Black person is safe in Americais flipping the Facebook Safety Check tool on its headBut if the Facebook service is focused on natural disasters and so on theBLM App is aimed to provide personal safety of any black American in theracist country he livesSubscribe to our channelFollow my FacebookFollow me on InstagramFollow me on TwitterThe Truth aboutBlack Lives Matters new app,300.0,https://www.facebook.com/WilliamsandKalvin/,7999.0,385.0,02/03/17 03:58:53 AM PST,,,2017-02-03
875,3027,Power to the People We have to grow up we have to wise upWe dont have any other choice this time but boycott the electionThis time we choose between two racists No one represents Black peopleDont go to vote Only this way we can change the way of thingsSubscribe to our channelFollow my FacebookFollow me on InstagramFollow me on Twitter,0.0,https://www.facebook.com/\/ViIIiamsandKaIvin/,0.0,0.0,12/08/16 06:10:58 AM PST,,,2016-12-08
876,3031,Different melaninRepost,100.0,https://www.facebook.com/WilliamsandKalvin/,18695.0,3496.0,03/13/17 03:03:37 AM PDT,,,2017-03-13
877,3033,Black kids suffer more than children of any other nation in AmericaMore thanof everyblack children under the age ofsuffer fatalinjuries compared to a rate offor Hispanicsfor whites andforAsians the report saysSubscribe to our channelFollow my FacebookFollow me on InstagramFollow me on TwitterThe Truth aboutblack kids in white America,300.0,https://www.facebook.comNViIIiamsandKaIvin/,8809.0,236.0,04/21/17 07:24:36 AM PDT,,,2017-04-21
878,3047,You have a right to have a gun and you can use it to protect your family andyour countryIf someone wants to take your gun away from you this person wants to takeyour freedom and to take your life afterSo dont let anyone take your gun Your power is your freedomSubscribe to our channelFollow my FacebookFollow me on InstagramFollow me on Twitter,1463.41,https://www.facebook.comNViIIiamsandKaIvin/,22458.0,1446.0,12/08/16 06:10:58 AM PST,,,2016-12-08
879,3058,Every black man who has ever been at war for this country is a heroBut the reality is really strange and unjustIf the hero is black he will never be recognized as a hero who did a lot for hiscountry and his peopleSubscribe to our channelFollow my FacebookFollow me on InstagramFollow me on Twitter,400.0,https://www.facebook.comNViIIiamsandKaIvin/,5074.0,251.0,12/12/16 06:38:59 AM PST,,,2016-12-12
880,3061,White racist cant keep calm when a black man is all fineThey cant keep calm even if black people are treated just like white peopleI mean they are just treated equallyAnd no white racist can stand it WhyI wonder if all the white Americans are sick in their headsSubscribe to our channelFollow my FacebookFollow me on InstagramFollow me on TwitterThe Truth about realracism,0.0,https://www.facebook.comnWilliam sandKaIvin/,0.0,0.0,12/08/16 06:10:58 AM PST,,,2016-12-08
881,3066,Hillary Clinton is a traitor Hillary Clinton is a liar Hillary Clinton is insane Iknow that many black people support this old dirty bitch I dont know whythey do this still its their personal choice and we are a free country yet Butlisten to my word of truth and dont let them fool youSubscribe to our channelFollow my FacebookFollow me on InstagramFollow me on Twitter,0.0,https://www.facebook.comNViIIiamsandKaIvin/,0.0,0.0,11/07/16 09:45:09 AM PST,,,2016-11-07
882,3081,Videoblog about social issues WilliamsKalvin,0.29,https://www.facebook.com/\/ViIIiamsandKaIvin/,1.0,0.0,12/01/16 05:06:49 AM PST,,,2016-12-01
883,3082,Its time to wake up and break our chains Together we will find our way tofreedom,1362.18,https://www.facebook.comnViIIiamsandKaIvin/,5458.0,187.0,12/01/16 05:40:16 AM PST,,,2016-12-01
884,3090,Make this go viral This is how police brutality is towards Black malesrepost,65.24,https://www.facebook.com/WilliamsandKalvin/,5920.0,847.0,05/22/17 08: 18:59 AM PDT,,,2017-05-22
885,3091,repostblackslayingit,440.0,https://www.facebook.comNViIIiamsandKalvin/,7823.0,1410.0,05/10/17 04:53:46 AM PDT,,,2017-05-10
886,3092,There is nothing more important than bond between parents and their kidsLikeFatherLikeSonrepost,100.0,https://www.facebook.com/WilliamsandKalvin/,8968.0,879.0,05/05/17 07:48:43 AM PDT,,,2017-05-05
887,3096,White racist want to steal our fight Here is the exampleWhiteled antiracism groups have existed for hundreds of years and theyveoften been problematic counterproductive and just fucking weird since theirinceptionTake for instance the Pennsylvania AntiSlavery Society ofwhichbelieved that slave owners were missing out on a business opportunity by notputting slaves on the payrollSubscribe to our channelFollow my FacebookFollow me on InstagramFollow me on TwitterThe Truth aboutwhite supremacy wwwyoutubecom,0.0,https://www.facebook.com/WiIIiamsandKaIvin/,0.0,0.0,04/13/17 04:31:13 AM PDT,,,2017-04-13
888,3265,My wife doing some dry fire training Lets give a SALUTE to all the Sistasthat shootRepost from,300.0,https://www.facebook.com/ProtectBlackGunOwners/,3220.0,522.0,02/03/17 01 :32:43 AM PST,,,2017-02-03
889,3279,Repost from,200.0,https://www.facebook.com/ProtectBlackGunOwners/,1300.0,237.0,02/01 /17 05:27:29 AM PST,,,
890,455,Stop federal overreach Stand for the patriots in a protest rally in Atlanta GAAmerican CrusadeGa,12.46,https://www.facebook.com/events/I678907209017708/,16.0,0.0,04/13/16 03:23:42 AM PDT,Atlanta Georgia,Georgia,2016-04-13
891,512,Stand for the people not the Government Join the rally in Atlanta this SundayAmerican CrusadeGa,21.5,https://www.facebook.com/events/I678907209017708/,20.0,0.0,04/13/16 03:23:58 AM PDT,Atlanta Georgia,Georgia,2016-04-13
892,773,Community about black social and racial issues Like to subcribe,35.0,https://www.facebook.comNVilliam sandKaIvin/,49.0,2.0,01/14/16 06:27:21 AM PST,,,2016-01-14
893,775,Have you ever noticed that,298.16,https://www.facebook.com/WilliamsKalvin-788980617892144/,12624.0,2096.0,11/01/16 06:07:42 AM PDT,Union,,2016-11-01
894,780,Black Discrimination Awareness Like to join,39054.43,https://www.facebook.com/William sandKaIvin/,82725.0,2592.0,01/14/16 06:53:15 AM PST,,,2016-01-14
895,781,White media used to tell what is important for whites and cover factsimportant for Blacks,500.0,https://www.facebook.comnViIliamsKalvin-788980617892144/,8390.0,1591.0,07/21/16 09:15:28 AM PDT,,,2016-07-21
896,782,Brendan Carter decided to pay a visit to his sick uncle and was held byofficers in a public RTS bus station in Rochester New York Carter said hewas at a station waiting for bus Freeing himself from emotional traumaCarter decided to hip his soul with music when he put his headphones onand started to dance Suddenly officers approached him and began askinghim out of the premises Apparently he had not committed any crime orviolated any order so he was disturbed and begun to argue with themSeriously this guy was detained for useless reasons This is what Americanpolice find interest inunnecessary and useless way of harassing blacksVery ridiculousSubscribe to my ChannelFollow me on Twitter,99.78,https://www.facebook.com/VViIIiamsandKaIvin/,760.0,31.0,03/10/16 01:28:41 AM PST,,,2016-03-10
897,783,Your voice counts Here you can find news and videos about blackcommunity,0.0,https://www.facebook.com/WilliamsandKalvin/,39.0,1.0,01/14/16 06:38:40 AM PST,,,2016-01-14
898,788,Where is the justice Our brothers and sisters are being cruelly killed by thesocalled police every day and our judicial system is absolutely blind We areall Americans but why does our corrupt Government differ black and whitepeople We want the same attitude I dont want to be scared of living in mycountry They will never shut me upWhere is the justice Ourbrothers and sisters are being cruelly killed by the socalled police every dayand our judicial system is absolutely blind We are Police is not above thelaw WilliamsKalvin,0.0,https://www.youtube.com/watch?v=GjSyORgShOl,0.0,0.0,01/05/16 02:03:02 AM PST,,,2016-01-05
899,789,Where is the justice Our brothers and sisters are being cruelly killed by thesocalled police every day and our judicial system is absolutely blind We areall Americans but why does our corrupt Government differ black and whitepeople We want the same attitude I dont want to be scared of living in mycountry They will never shut me upWhere is the justice Ourbrothers and sisters are being cruelly killed by the socalled police every dayand our judicial system is absolutely blind We are Police is not above thelaw,1000.0,https://www.youtube.com/watch?v=GjSyORgShOl,3067.0,172.0,01/05/16 02:04:48 AM PST,,,2016-01-05
900,790,WilliamsKalvin,70.0,https://www.youtube.com/watch?v=-s1 WMSunMwc,128.0,1.0,11/04/15 04:08:18 AM PST,,,2015-11-04
901,791,Community about black social and racial issues Like to subscribe,8.08,https://www.facebook.comNVilliam sandKaIvin/,70.0,1.0,01/14/16 06:31:13 AM PST,,,2016-01-14
902,792,Were black and Were proud of it Join to understand how beautiful we are,0.0,https://www.facebook.com/William sandKaIvin/,51.0,0.0,01/14/16 06:32:30 AM PST,,,2016-01-14
903,795,Newest news and videos for Black community Stay together like to join,35.0,https://www.facebook.com/William sandKaIvin/,51.0,1.0,01/14/16 06:34:10 AM PST,,,2016-01-14
904,797,Community about black social and racial issues Like to subscribe,0.0,https://www.facebook.comNVilliam sandKaIvin/,41.0,0.0,01/14/16 06:31:14 AM PST,,,2016-01-14
905,799,I pity anyone who has to deal with neighbors in an apartment buildingEspecially when you have to deal with the complaining and passiveaggressive types Oh and lets not forget gentrifiers Or as I like to call themwhite migrators Apparently instead of knocking on a neighbors doorpeople take the easy and passiveaggressive way out and just leave notesinstead But one man wasnt having itLinknjpgohafbfefffbeoeDSubscribe to our channelFollow my FacebookFollow me on InstagramFollow me on Twitter,1200.0,https://www.facebook.comNVilliamsKalvin-788980617892144/,13263.0,1100.0,10/14/16 02:45:50 AM PDT,,,2016-10-14
906,801,I pity anyone who has to deal with neighbors in an apartment buildingEspecially when you have to deal with the complaining and passiveaggressive types Oh and lets not forget gentrifiers Or as I like to call themwhite migrators Apparently instead of knocking on a neighbors doorpeople take the easy and passiveaggressive way out and just leave notesinstead But one man wasnt having itLinknjpgohafbfefffbeoeDSubscribe to our channelFollow my FacebookFollow me on InstagramFollow me on Twitter,0.0,https://www.facebook.comNVilliamsKalvin-788980617892144/,0.0,0.0,10/20/16 08:03:20 AM PDT,,,2016-10-20
907,802,I pity anyone who has to deal with neighbors in an apartment buildingEspecially when you have to deal with the complaining and passiveaggressive types Oh and lets not forget gentrifiers Or as I like to call themwhite migrators Apparently instead of knocking on a neighbors doorpeople take the easy and passiveaggressive way out and just leave notesinstead But one man wasnt having itLinknjpgohafbfefffbeoeDSubscribe to our channelFollow my FacebookFollow me on InstagramFollow me on TwitterIf your neighbor isblack,0.0,https://www.facebook.comnViIliamsKalvin-788980617892144/,0.0,0.0,12/01/16 03:23:56 AM PST,,,2016-12-01
908,805,A yearold Oklahoma man was sentenced on Monday toyears in prisonfor sexually assaulting orphaned children while on a missionary trip in KenyainMatthew works at an orphanage built and run by an American citizennamed Upendo Children Centre The main aim of this orphanage was toassist abandoned children in Nairobi Kenya Upon Matthews arrival inKenya he insisted on not staying in the apartment allocated to him byauthorities but preferred to stay in the very dormitory where these childrenstayed He also based his choice on being in a better position to assist thechildren should the need arise Mathew raped three teenagersages ofandrespectively for not less thantimes He also maltreated ayear oldboy This outrageous act led to his sentence ofyears imprisonment and afined of,5000.0,https://www.facebook.comnViI Iiam sand Kalvin/,11206.0,1132.0,03/17/16 05:30:18 AM PDT,,,2016-03-17
909,806,Newest news and videos for Black community Stay together like to join,54.6,https://www.facebook.com/William sandKaIvin/,98.0,2.0,01/14/16 06:34:13 AM PST,,,2016-01-14
910,808,Your voice counts Here you can find news and videos about blackcommunity,0.0,https://www.facebook.comnVilliam sandKaIvin/,52.0,1.0,01/14/16 06:38:43 AM PST,,,2016-01-14
911,810,This is just for laughs DNo offends just saying things the way they areGuys what do you think about this Trump stitches parodyTheTrump justlaughs,300.0,https://www.facebook.com/WiIIiamsandKaIvin/,716.0,42.0,03/17/16 05:32:20 AM PDT,,,2016-03-17
912,812,Community about black social and racial issues Like to subcribe,30.42,https://www.facebook.com/WilliamsandKalvin/,91.0,1.0,01/14/16 06:27:17 AM PST,,,2016-01-14
913,814,Community about black social and racial issues Like to subcribe,0.0,https://www.facebook.comNVilliam sandKaIvin/,31.0,0.0,01/14/16 06:27:20 AM PST,,,2016-01-14
914,817,Newest news and videos for Black community Stay together like to join,35.0,https://www.facebook.com/William sandKaIvin/,88.0,1.0,01/14/16 06:34:14 AM PST,,,2016-01-14
915,818,Jimmy Prude created delicious and healthy vegan cookiesHe is a graduate of Howard University and he is challenging people toconsider making a change in their food choices to eat healthier and dontinvolve animals product in your foodPrude is another successful black business man that makes me feel so proudof black people Keep it up guys we can change the world together,100.0,https://www.facebook.comnViI Iiam sKalvin-788980617892144/,363.0,32.0,05/05/16 01:08:10 AM PDT,,,2016-05-05
916,820,Newest news and videos for Black community Stay together like to join,38.6,https://www.facebook.com/William sandKaIvin/,63.0,1.0,01/14/16 06:34:13 AM PST,,,2016-01-14
917,822,The police are killing black people without a reason and no one can evenindict them even if their guilt is evident And how can we judge a killer cop ifhe uses a droneSubscribe to our channelFollow my FacebookFollow me on InstagramFollow me on Twitter,798.52,https://www.facebook.com/WilliamsKalvin-788980617892144/,9015.0,443.0,11/01/16 06:04:39 AM PDT,,,2016-11-01
918,823,Hypocrisy of our society has gone way too far Celebrating human rightsday when black society is being oppressed by authorities and racist radicalsevery day is a spit in our faces Why do black people are always guilty ineverything in this country Arent african americans humans So this daycreates more questions than give answers Thanks everybody for watching,0.0,https://www.facebook.comnViIliamsKalvin-788980617892144/,0.0,0.0,12/18/15 03:20:05 AM PST,,,2015-12-18
919,824,Hypocrisy of our society has gone way too far Celebrating human rightsday when black society is being oppressed by authorities and racist radicalsevery day is a spit in our faces Why do black people are always guilty ineverything in this country Arent african americans humans So this daycreates more questions than give answers Thanks everybody for watching,200.0,https://www.facebook.comNVilliamsKalvin-788980617892144/,686.0,20.0,12/18/15 03:21:54 AM PST,,,2015-12-18
920,825,Were black and Were proud of it Join to understand how beautiful we are,68.81,https://www.facebook.com/William sandKaIvin/,138.0,4.0,01/14/16 06:32:24 AM PST,,,2016-01-14
921,826,It is so disheartening knowing that people are put behind bars because theyfailed to settle a fine Most people are jailed because one way or the otherthere was no money to do what was necessary at a particular time eventhough they were innocent Prosecutors have developed this platform as agold mine extracting huge sum of money from civilians You can be putbehind bars if you fail to comply with the demands Suddenly ones lifebecomes tattered when jail comes in because there is no freedom of makinga better living Federal prosecutors should shake up and hold judges and allthese people who take advantages of people by making them pay huge sumsof money or put someone behind bars because heshe couldnt pay a fineFollow my FacebookSubscribe to my YouTube ChannelFollow me on Twitter,0.0,https://www.facebook.comnWiI liam sKalvin-788980617892144/,0.0,0.0,03/24/16 06:22:02 AM PDT,,,2016-03-24
922,827,Its time for changes in Black Community Stay together brother let us betogether here,0.0,https://www.facebook.comnVilliam sandKaIvin/,27.0,0.0,01/14/16 06:33:15 AM PST,,,2016-01-14
923,829,Community about black social and racial issues Like to subscribe,35.0,https://www.facebook.comNVilliam sandKaIvin/,78.0,2.0,01/14/16 06:31:12 AM PST,,,2016-01-14
924,830,Ku Klux Klan is a movement in the United States that have advocated throughterrorism for white supremacy white nationalism and antiimmigration Theynormally aimed at groups whom they opposed The Klan held an antiimmigration rally on Saturday They got surrounded by group of protestorswho beat and kicked them violently On Monday evening a crowd of civil rightprotesters gathered for a vigil against Ku Klux Klan It was a march where theprotesters carried signs that had the inscription Power through Peace Thismarch was an intended peaceful march which was meant to bring peace andunitySubscribe to my ChannelFollow me on Twitter,533.47,https://www.facebook.comNViIIiamsandKaIvin/,4234.0,416.0,03/11/16 12:38:58 AM PST,,,2016-03-11
925,831,Its time for changes in Black Community Stay together brother let us betogether here,0.0,https://www.facebook.comnVilliam sandKaIvin/,47.0,0.0,01/14/16 06:33:15 AM PST,,,2016-01-14
926,834,A lone sniper shotpeople and killedpolice officers in Dallas lateThursday night It was a peaceful protest against the police shootings of AltonSterling in Baton Rouge Louisiana and Philando Castile in Falcon HeightsMinnesota So he turned this peaceful protest into a scene of chaos andcarnage The wounded include seven police officers and two civilians Thesniper Micah X Johnson was a black US military veteran of the Afghan warAs he was captured he claimed he wanted to kill white peopleTheres no evidence that he was a Black Lives Matters activist Theres noproof that he was into the movement anyhow It happened almost a week agoand the police cant show anything to prove there was a link between MicahX Johnson and Black Lives matter But the Main stream media are telling ustime and again that black lives matter terrorists are killing the police officersThe main stream Media are telling us that the protest against police terror isa violent antigovernment riotSubscribe to our channelFollow my FacebookFollow me on Twitter,700.0,https://www.facebook.comnViI Iiam sKalvin-788980617892144/,7773.0,481.0,07/21/16 09:16:45 AM PDT,,,2016-07-21
927,836,Were black and Were proud of it Join to understand how beautiful we are,0.0,https://www.facebook.com/William sandKaIvin/,37.0,0.0,01/14/16 06:32:30 AM PST,,,2016-01-14
928,837,Questions about why police shot and critically wounded a yearold Somalirefugee in Salt Lake City grew Monday as civil rights groups called foranswers and several hundred protesters took the streets holdings signs thatread Stop killer cops Its very insane when those who are to protect ushave turned into serial killers The most annoying part is that they haverefused to release the footage video They need retraining Whateverhappened to Tasers Whatever to rubber bullets Whatever happened toshooting shots in the sky as a warning Why are police wearing body camand we cant see it If theyre right lets see itFollow my FacebookSubscribe to my YouTube ChannelFollow me on Twitter,200.0,https://www.facebook.comnViIIiamsandKaIvin/,2801.0,12.0,03/10/16 01:28:08 AM PST,,,2016-03-10
929,838,Police Officer Robert Rialmos attorney Joel Brodsky says that he will befiling a counterclaim against the estate of Quintonio LeGrier on the grounds ofassault and emotional distress This is how it looks like when A White Policekills a black Civiliian and also feels its his right to sue the dead becausesympathizers gave him a sleepless night If it was lawful to kill QuintonioLeGrier because he was in abnormal state of mind according to the copsthen we ask how about the shooting of Bettie Jones The story is alwaysrewritten and painted when it comes to dealing with race Racial disparity andsegregation cannot be overlooked in America There is too much level ofinhumanity The cops still things it wasnt enough killing a mentallydisordered and an innocent woman He still has the balls to sue even thedead This is what living in America is like if you are black,500.0,https://www.facebook.comnWiiI Iiam sand Kalvin/,1948.0,88.0,02/11/16 12:13:04 AM PST,,,2016-02-11
930,840,Community about black social and racial issues Like to subscribe,0.0,https://www.facebook.comNVilliam sandKaIvin/,30.0,0.0,01/14/16 06:31:05 AM PST,,,2016-01-14
931,842,A young black guy who was mentally disabled decided to end his life but willonly do that by making the cops kill him This is absolutely insane in thehighest order He took a gun and ordered his other two brothers to take avideo of the whole incident Michael Ford at the police vicinity opened fireand got the cops attention The filming was still in process as hecommanded The first cops who appeared fired back and almost immediatelyended up drawing fire He gave the other officer a chance to get into positionwhen he opened fire Its quite not understandable why his own cop shot himand shot the mentality ill man too This is a good example of sick reality too Isthere any explanation why cops have started shooting each otherFollow my FacebookSubscribe to my YouTube ChannelFollow me on Twitter,763.95,https://www.facebook.com/WiIIiamsandKaIvin/,5392.0,438.0,03/17/16 05:33:38 AM PDT,,,2016-03-17
932,847,Why dont american cops realize that being black is not a crime Africanamerican kids are being shot only for playing with toy guns How is itpossible Where is the justice Our Government is blind they simply dontwant to pay attention to this legalized homicide of own people This is crazyWe must speak about it,0.0,https://www.facebook.comNViIliamsKalvin-788980617892144/,0.0,0.0,01/05/16 02:03:13 AM PST,,,2016-01-05
933,848,Why dont american cops realize that being black is not a crime Africanamerican kids are being shot only for playing with toy guns How is itpossible Where is the justice Our Government is blind they simply dontwant to pay attention to this legalized homicide of own people This is crazyWe must speak about it,1000.0,https://www.facebook.comNVilliamsKalvin-788980617892144/,6280.0,231.0,01/05/16 02:06:20 AM PST,,,2016-01-05
934,849,Why dont american cops realize that being black is not a crime Africanamerican kids are being shot only for playing with toy guns How is itpossible Where is the justice Our Government is blind they simply dontwant to pay attention to this legalized homicide of own people This is crazyWe must speak about it,0.0,https://www.facebook.comNVilliamsKalvin-788980617892144/,0.0,0.0,01/19/16 03:45:52 AM PST,,,2016-01-19
935,850,Do you know that the white Milwuakee officer who was fired from his job afterfatally shooting a mentally ill Black man inhas gotten his job back Thisis a real proof that white officers will just kill blacks and still walk withoutprosecution This is the reason why they are not scared of taking a blackpersons life Fortunately he has lost an appeal to get his job backfor thesecond time but what I find really interesting is the reason why he was firedIt is now absolutely clear that Police Chief fired Manney for his actions that ledto the shooting but not for the shooting itselfSubscribe to our channelFollow my FacebookFollow me on Twitter,1500.0,https://www.facebook.comnWiI Iiam sKalvin-788980617892144/,20654.0,2060.0,08/09/16 07:13:07 AM PDT,,,2016-08-09
936,851,Hi my people Many of you write to me asking why most of my videos are sonegative and depressive And thats true I used to talk about really sadthings But today Im gonna have some fun,2000.0,https://www.facebook.comNViIIiamsandKalvin/,12482.0,295.0,02/16/16 01:44:32 AM PST,,,2016-02-16
937,852,All people have to understand that the police service is exactly like a secretgay club the reason being that no one knows what goes on inside there evenif its evident Theres a kind of code of silence even if you saw something orjust know something about other police officer you keep silence about it Butif you are in a member of a club you can be sure that no one will ever let yoursecrets out Statisticallyof cops admit to witnessing misconduct by othercops Alsoof the individuals pressuring officers to keep quiet about themisconduct are leadersof the officers who admitted to intentionallywithholding the information about officer misconduct were upperadministrators Cops will always lie to suit interaction or conversation SadlyenoughSworn officer of the court is most likely to lie than the citizen he iseven accusing So the lie is a norm for the officers who are keeping the codeof silence and its a miracle if a police officer tells the truthSubscribe to our channelFollow my FacebookFollow me on Twitter,1000.0,https://www.facebook.comNVilliamsKalvin-788980617892144/,13716.0,727.0,06/07/16 01:29:37 AM PDT,,,2016-06-07
938,856,Im sure white media wont tell you this,500.0,https://www.facebook.com/WilliamsKalvin-788980617892144/,5018.0,274.0,05/05/16 01:09:33 AM PDT,,,2016-05-05
939,857,For years white supremacists in the Dothan Alabama police departmentallegedly planted drugs and guns on black peopleTheres a lot going on in this story which the Alabama Justice Project is saidto have helped break thanks to anonymous whistleblowers within the DothanPolice DepartmentSubscribe to our channelFollow my FacebookFollow me on InstagramFollow me on TwitterAll Cops areCriminals,801.23,https://www.facebook.comnViIliamsKalvin-788980617892144/,10022.0,766.0,11/01/16 06:06:05 AM PDT,Union,,2016-11-01
940,858,Marshawn McCarrel a prominent Black Lives Matter activist died outsideOhio statehouse He was the founder of Pursuing Our Dreams amentorship program as well as the creator of a homeless outreach Programcalled Feed the Streets,2000.0,https://www.facebook.comnViIIiam sand Kalvin/,12994.0,255.0,02/12/16 06:39:37 AM PST,,,2016-02-12
941,860,Black people have no place in the comingpresidential election becausewe have had our chance and we never profited out of it We had a moment topresent economic or social advancement plans to president Obama yet werefused and let anti blacks trick us into thinking that was not elected tobenefit just black people alone President Obama was elected for a reasonHe was the stepping stone for blacks to rise but it was blown away Now it isthe time of White America to rebuild and advance and make their race greatThe war for power between blacks and whites is very real but the blackcommunity has forgotten Consequently the power of black is fading day byday because those in position are descending from the ladder every day Inno time White Power will be stronger than beforeSubscribe to our channelFollow my FacebookFollow me on Twitter,750.0,https://www.facebook.com/WilliamsKalvin-788980617892144/,9577.0,908.0,08/09/16 07:14:08 AM PDT,,,2016-08-09
942,861,Its strange that all the main stream media you read every day will tells youthat Hillary is an angel and you have no way but vote for her But the fact stillremains the same Hillary Clinton is a criminal and the simple question to theworld and America is why should someone vote for a criminal Americathinks we are painting this presidential aspirant but after watching the movieClinton CashSubscribe to our channelFollow my FacebookFollow me on Twitter,1000.0,https://www.facebook.comNVilliamsKalvin-788980617892144/,11317.0,766.0,08/04/16 06:43:03 AM PDT,,,2016-08-04
943,862,The Civil Rights Movement was fighting for the real equality in general andparticularly the equal rights of voting It started in North Carolina but it canspread all over the country Blacks are being deprived of general voting rightsThe US District Judge Thomas Schroeder on Monday dismissed lawsuitschallenging changes to the states election laws declaring that thechallenges failed to show that it hindered voters of color from exercising theirvoting rights The North Carolina law which eliminated early voting sameday voter registration and outofprecinct voting requires voters who go tothe polls to show an acceptable form of identification such as a driverslicense passport or military ID This is not a good sign as we watch the worldtake the new turn for the worse now while doing nothingSubscribe to our channelFollow my FacebookFollow me on Twitter,500.0,https://www.facebook.com/\/VilliamsKalvin-788980617892144/,3170.0,45.0,05/05/16 01:09:03 AM PDT,,,2016-05-05
944,863,Black America is not into politics This is not our game and we dont want toplay with whitesYou know why Because I dont give a fuck about it I really dont care anddont know why any black American should care anyhowWe have our own life and our own future in this countrySubscribe to our channelFollow my FacebookFollow me on InstagramFollow me on Twitter,0.0,https://www.facebook.comnViI liam sKalvin-788980617892144/,0.0,0.0,11/18/16 08:16:22 AM PST,Union,,2016-11-18
945,864,Never forget to tell Black girls how amazing and beautiful they are,137.99,https://www.facebook.com/WilliamsKalvin-788980617892144/,2635.0,576.0,10/23/16 09:54:21 AM PDT,Union,,2016-10-23
946,867,President Barack Obama signed a bill Friday eliminating the offensive andoutdated descriptors after the legislation passed unanimously in the Houseand Senate earlier this month Rep Grace Meng DNY sponsored the billwhich aimed to modernize two references to Orientals and Negros inthe US Code that date to the s The words will be replaced with AsianAmericans and African Americans respectively The term Oriental hasno place in federal law and at long last this insulting and outdated term will begone for good Meng said in a statement on Friday Obama signed the billshortly before leaving for his trip to Vietnam and Japan where he will becomethe first sitting US president to visit HiroshimaSubscribe to our channelFollow my FacebookFollow me on Twitter,1000.0,https://www.facebook.comnWiI liam sKalvin-788980617892144/,12729.0,808.0,06/07/16 01:29:54 AM PDT,,,2016-06-07
947,869,Dont believe the stereotypes that media created to discredit black dadsTheyre the bestLike if you agree,3.17,https://www.facebook.com/WilliamsKalvin-788980617892144/,5.0,,05/05/16 01 :08:27 AM PDT,,,2016-05-05
948,870,A new report showed that West Virginia andother states have to thehighest percentage of children with a parent who is or was incarcerated Canyou believe these numbersOf course the highest incarceration level is among the black population of thecountry The system is enslaving us with the help of the jails and it affects thewhole community Kids have to grow up not knowing their fathers and nothaving the support they need to make rights choices and schooltoprisonpipeline doesnt leave them much of a choice The kids grow up in extremepoverty without the access to the basic things like healthcare or educationThe system is build to keep as many black people in the jails as possibleBeing black in the US means being in a constant danger You never knowwhen you will be killed or sent to prison because of the color of your skinIve never heard white media talking about it do you,4.4,https://www.facebook.com/WilliamsKalvin-788980617892144/,8.0,0.0,05/05/16 01:07:41 AM PDT,,,2016-05-05
949,871,No wonder white boys dont get shot when theyre arrested,3.47,https://www.facebook.com/WilliamsKalvin-788980617892144/,7.0,2.0,04/21/16 12:09:49 AM PDT,,,2016-04-21
950,872,The statistics show that nationwidepercent of Black students receivesuspensions comparing withpercent of white studentsIn some state the numbers are even more disturbing For exampleWisconsin suspendedpercent of Black students compared to thepercent of white students Also in Minnesota Connecticut Iowa andNebraska black students were six times more likely than white students to besuspended from schoolThe racism in education is the reason why the schooltoprison pipelineexistsOur kids cannot even get a proper education no wonder the success rateamong black students is low Somehow white people still think that educationis only their privilege,100.0,https://www.facebook.com/WilliamsKalvin-788980617892144/,467.0,44.0,04/15/16 01:21:41 AM PDT,,,2016-04-15
951,873,We are proud to be black and stand for our community Join to end the racismin the US,68.22,https://www.facebook.comnVil liam sKalvin-788980617892144/,113.0,0.0,04/13/16 04:42:49 AM PDT,,,2016-04-13
952,879,We are proud to be black and stand for our community Join to end the racismin the US,45.44,https://www.facebook.comnVil liam sKalvin-788980617892144/,89.0,1.0,04/13/16 04:42:40 AM PDT,,,2016-04-13
953,882,Stop hating black people Like to join,583.92,https://www.facebook.com/William sandKaIvin/,1444.0,21.0,01/14/16 06:51:18 AM PST,,,2016-01-14
954,883,Information is your strongest weapon Know the truth and stand against theracism in US,177.5,https://www.facebook.comnVilliam sandKaIvin,438.0,9.0,04/13/16 04:45:58 AM PDT,,,2016-04-13
955,885,We are proud to be black and stand for our community Join to end the racismin the US,13.64,https://www.facebook.comnVil liam sKalvin-788980617892144/,32.0,0.0,04/13/16 04:42:59 AM PDT,,,2016-04-13
956,888,Information is your strongest weapon Know the truth and stand against theracism in US,18.16,https://www.facebook.comnVil liam sKalvin-788980617892144/,33.0,0.0,04/13/16 04:45:52 AM PDT,,,2016-04-13
957,891,Its time to wake up and break our chains Together we will find our way tofreedom,66.41,https://www.facebook.comnVil liam sKalvin-788980617892144/,134.0,2.0,04/13/16 04:44:11 AM PDT,,,2016-04-13
958,893,When will people stop seeing the skin color only Im tired of labels,28.84,https://www.facebook.com/WilliamsKalvin-788980617892144/,20.0,2.0,04/12/16 09:29:53 AM PDT,,,2016-04-12
959,895,Videoblog about racism and black social issues,35.0,https://www.facebook.com/William sandKaIvin/,244.0,1.0,01/14/16 06:46:57 AM PST,,,2016-01-14
960,896,Black Discrimination Awareness Like to join,194.93,https://www.facebook.com/William sandKaIvin/,300.0,3.0,01/14/16 06:53:14 AM PST,,,2016-01-14
961,901,An amount of K was donated to the family of the deceased JamesAnderson Are they fucking kidding us For them its enough and wealth itbut to the family of Anderson its not better than the life taken These guysshould pay a death penalty for taking a life This is a racial act Report saysbetween hits they screamed White power before Dedmon ran him overcausing fatal injuries There is no particular reason for whatever they did soAmerica shouldnt think they have done something much greater Moneycannot buy life that is what Bob Nesta Marley said and he is absolutelyright,0.0,https://www.facebook.com/WiIIiamsandKalvin/,0.0,0.0,03/10/16 01:28:25 AM PST,,,2016-03-10
962,905,Therere a lot of racial discrimination going on in America these days Canyou imagine that a group of armed men took over a federal property and havevowed to kill if they are forced to leave there unless the government changethe law in their favor NonsenseThe ongoing Oregon standoff has taught us is that its never been moreapparent that the US government values white lives above all others Themost stark example is comparing the kidgloves treatment the white gunmenin Oregon are getting with thebombing of the MOVE house inPhiladelphiaGunmeninOregonTheMove Bombing,1000.0,https://www.facebook.com/WiIIiamsandKalvin/,7452.0,554.0,01/21/16 03:53:21 AM PST,,,2016-01-21
963,906,As we celebrate and reflect upon the birth of the great Martin Luther King Jra voice of the people and one who sacrificed his life for the total liberation ofBlack Americans the question is who will keep his dream aliveHe saw the promiseland where blacks and whites live together in harmonyand each of them given equal rights and privileges freedom and justiceToday we do not see this equality among blacks and whites in AmericaThese rights and privileges freedom and justice shouldnt be for someselected few but all,0.0,https://www.facebook.comnViIIiamsandKalvin/,0.0,0.0,01/19/16 07:54:51 AM PST,,,2016-01-19
964,907,As we celebrate and reflect upon the birth of the great Martin Luther King Jra voice of the people and one who sacrificed his life for the total liberation ofBlack Americans the question is who will keep his dream aliveHe saw the promiseland where blacks and whites live together in harmonyand each of them given equal rights and privileges freedom and justiceToday we do not see this equality among blacks and whites in AmericaThese rights and privileges freedom and justice shouldnt be for someselected few but all,614.56,https://www.facebook.comnViIIiamsandKalvin/,2975.0,64.0,01/19/16 07:56:20 AM PST,,,2016-01-19
965,908,As we celebrate and reflect upon the birth of the great Martin Luther King Jra voice of the people and one who sacrificed his life for the total liberation ofBlack Americans the question is who will keep his dream aliveHe saw the promiseland where blacks and whites live together in harmonyand each of them given equal rights and privileges freedom and justiceToday we do not see this equality among blacks and whites in AmericaThese rights and privileges freedom and justice shouldnt be for someselected few but allThanks for watching Id like to hear from youClick like Share and Comment Together we can make America a betterplaceAs we celebrate and reflectupon the birth of the great Martin Luther King Jr a voice of the people andone who sacrificed his life for the total liberatio WHO WILL BE THE NEXTMARTIN LUTHER KING JR WilliamsKalvin,0.0,https://www.facebook.comnViIIiamsandKaIvin/,0.0,0.0,01/19/16 04:43:54 AM PST,,,2016-01-19
966,911,Black Discrimination Awareness Like to join,0.0,https://www.facebook.comNViIIiamsandKaIvin/,47.0,1.0,01/14/16 06:53:13 AM PST,,,2016-01-14
967,912,Society need to see beyond skin color Afroamerican community welcomesyou,0.0,https://www.facebook.comnVilliam sandKaIvin/,71.0,0.0,01/14/16 06:52:43 AM PST,,,2016-01-14
968,913,Black is beautiful News and videos for BlackAmericans,0.0,https://www.facebook.com/William sandKaIvin/,49.0,0.0,01/14/16 06:51:57 AM PST,,,2016-01-14
969,914,Stop hating black people Like to join,0.0,https://www.facebook.com/William sandKaIvin/,65.0,0.0,01/14/16 06:51:17 AM PST,,,2016-01-14
970,915,BlackAmericans deserves equal justice Like to join,0.0,https://www.facebook.comNViIIiamsandKaIvin/,44.0,0.0,01/14/16 06:50:06 AM PST,,,2016-01-14
971,916,Videoblog about racism and black social issues,0.0,https://www.facebook.com/WiIIiamsandKalvin/,60.0,0.0,01/14/16 06:47:04 AM PST,,,2016-01-14
972,917,BlackAmericans deserves equal justice Like to join,35.0,https://www.facebook.com/William sandKaIvin/,188.0,3.0,01/14/16 06:50:08 AM PST,,,2016-01-14
973,918,Society need to see beyond skin color Afroamerican community welcomesyou,39.48,https://www.facebook.comnViIIiamsandKaIvin/,137.0,1.0,01/14/16 06:52:41 AM PST,,,2016-01-14
974,919,Society need to see beyond skin color Afroamerican community welcomesyou,53.52,https://www.facebook.comnVilliam sandKaIvin/,137.0,1.0,01/14/16 06:52:42 AM PST,,,2016-01-14
975,920,BlackAmericans deserves equal justice Like to join,73.26,https://www.facebook.com/William sandKaIvin/,172.0,2.0,01/14/16 06:50:09 AM PST,,,2016-01-14
976,921,Stop hating black people Like to join,78.81,https://www.facebook.com/William sandKaIvin/,145.0,3.0,01/14/16 06:51:15 AM PST,,,2016-01-14
977,922,Black is beautiful News and videos for BlackAmericans,81.44,https://www.facebook.com/WiIIiamsandKaIvin/,170.0,2.0,01/14/16 06:51:56 AM PST,,,2016-01-14
978,923,Videoblog about racism and black social issues,111.75,https://www.facebook.comNViIIiamsandKaIvin/,267.0,3.0,01/14/16 06:46:44 AM PST,,,2016-01-14
979,924,Black is beautiful News and videos for BlackAmericans,131.91,https://www.facebook.com/William sandKaIvin/,172.0,3.0,01/14/16 06:51:57 AM PST,,,2016-01-14
980,925,WilliamsKalvin,0.0,https://www.youtube.com/watch?v=XtOi3XHXsrU,0.0,0.0,11/05/15 07:26:28 AM PST,,,2015-11-05
981,926,Videoblog about social issues of Black America The Reality isblackchurches attacked by white people in the last week But The Media Is DeadSilent About It What is going on in America WilliamsKalvin,200.0,https://www.youtube.com/watch?v=XtOi3XHXsrU,508.0,11.0,11/05/15 07:28:49 AM PST,,,2015-11-05
982,1686,Back when I studied the Holocaust in school I remember thinking How didHitler get overmillion people to follow along blindly and not fight backThen I realised Im watching my fellow Americans take the same path Beamong those who fight for their rights and freedom in this policestate Clickto Learn More Cop Block Us AmericanCops,4254.7,https://www.instagram.com/cop_blockus/,9836.0,53.0,03/11/16 06:07:11 AM PST,,,2016-03-11
983,1742,Tbh I believe in you,88.02,https://www.facebook.com/Memopolis-45047 4615151098/,792.0,122.0,04/20/16 02:45:42 AM PDT,,,2016-04-20
984,1940,Thats the picture the media doesnt want you to see Want the truth FollowSupport The Police Proudblacks,3241.06,https://www.instagram.com/black_america_today,34880.0,477.0,05/12/16 02:50:36 AM PDT,,,2016-05-12
985,3019,No justice no peaceThese words must be remembered as long as we live in a racist policecountryWe must never give up and keep on fighting for the freedom and justiceWe are black and we are proud to be blackWe are not going to change ourselvesWe are going to change this countrySubscribe to our channelFollow my FacebookFollow me on InstagramFollow me on Twitter,200.0,https://www.facebook.comnWilliam sandKaIvin/,730.0,32.0,12/05/16 01:44:46 AM PST,,,2016-12-05
986,3020,No justice no peaceThese words must be remembered as long as we live in a racist policecountryWe must never give up and keep on fighting for the freedom and justiceWe are black and we are proud to be blackWe are not going to change ourselvesWe are going to change this countrySubscribe to our channelFollow my FacebookFollow me on InstagramFollow me on Twitter,0.0,https://www.facebook.com/WilliamsandKalvin/,0.0,0.0,12/08/16 06:10:58 AM PST,,,2016-12-08
987,3021,Black Americans have really different problems to face no white American canever experience in his own lifeWe have the same problems in our communities after the presidentialelections as we had beforeSo give no attention to what you are told by the media Get down to your ownbusinessSubscribe to our channelFollow my FacebookFollow me on InstagramFollow me on Twitter,0.0,https://www.facebook.com/WilliamsandKalvin/,0.0,0.0,11/17/16 11:32:07 PM PST,,,2016-11-17
988,3023,For lastdays America and its allies have killed at leastciviliansin SyriaBut will bombing bring peace Martin Luther King Jr had an answer on thatThe chain reaction of evilhate begetting hate wars producing more warsmust be broken or we shall be plunged into the dark abyss of annihilation,400.0,https://www.facebook.comNVilliam sandKaIvin/,9306.0,714.0,05/20/17 07:53:05 AM PDT,,,2017-05-20
989,3024,You cant keep doing this You cant keep violating us in our owncommunities said Deon Jones after filing a federal civil rights lawsuit againstthe Denver Police Department for nearly killing himSubscribe to our channelFollow my FacebookFollow me on InstagramFollow me on TwitterThe truth about whyamerican police kill blacks,300.0,https://www.facebook.comNViIIiamsandKaIvin/,6021.0,187.0,05/18/17 07:18:16 AM PDT,,,2017-05-18
990,3025,Lets make it clearFlint still doesnt have clean waterAmerica spent millions to bomb Syria,791.37,https://www.facebook.com/WilliamsandKalvin/,36915.0,4374.0,05/22/17 08: 18:43 AM PDT,,,2017-05-22
991,3026,Power to the People We have to grow up we have to wise upWe dont have any other choice this time but boycott the electionThis time we choose between two racists No one represents Black peopleDont go to vote Only this way we can change the way of thingsSubscribe to our channelFollow my FacebookFollow me on InstagramFollow me on Twitter,465.12,https://www.facebook.com/\/ViIIiamsandKaIvin/,8498.0,584.0,11/08/16 10:53:22 AM PST,,,2016-11-08
992,3028,Black Excellence makes perfect,100.0,https://www.facebook.com/WilliamsandKalvin/,28542.0,5308.0,03/17/17 07:17:49 AM PDT,,,2017-03-17
993,3032,She practices her Spanish Looks adorable We love our beautiful and brightafro babies Day mademadewithlove igbabies Welove our beautiful and bright afro babies Day mademadewithlove igbabies We love our beautiful and bright afro babies Daymade carolsdaughter madewithlove igbabies,20.0,,395.0,61.0,04/14/17 02:42:57 AM PDT,,,2017-04-14
994,3045,White is not right Why do you think that Santa is whiteNobody knows the color of his skin nobody has ever seen him but whitesupremacists go crazy if they see a black SantaThats always making me laughI would advice white racists to love the snow for its whiteness and to hate thecoil for its blacknessNo matter that the snow is killing you and the coil gives you the heat tosurviveSubscribe to our channelFollow my FacebookFollow me on InstagramFollow me on Twitter,400.0,https://www.facebook.com/VViIIiamsandKaIvin/,6129.0,362.0,12/08/16 06:11:21 AM PST,,,2016-12-08
995,3046,You have a right to have a gun and you can use it to protect your family andyour countryIf someone wants to take your gun away from you this person wants to takeyour freedom and to take your life afterSo dont let anyone take your gun Your power is your freedomSubscribe to our channelFollow my FacebookFollow me on InstagramFollow me on Twitter,1403.86,https://www.facebook.comnViIIiamsandKaIvin/,33680.0,1841.0,11/11/16 06:33:26 AM PST,,,2016-11-11
996,3049,Repost,100.0,https://www.facebook.com/WilliamsandKalvin/,11925.0,2225.0,03/13/17 03:01 :56 AM PDT,,,2017-03-13
997,3050,This is the story about yearold Juwan Alexander PlummerOn Aprilthe Plummers door had been kicked in by burglarsOn AprilPlummer his mother and his yearold little brother did not seethe police lights because the unit was parked down the roadPlummer calledto report the burglars and then grabbed hisGrandfathers shotgun that was given to his mother for protectionWhen Plummer went to the door the scared kid fired a warning shot to fendoff the wouldbe burglarsHowever the shotgun blast hit one officer in the arm and the other in the faceSubscribe to our channelFollow my FacebookFollow me on InstagramFollow me on TwitterThe Truth abouthome protection,230.0,https://www.facebook.comnVilliam sandKaIvin/,7256.0,571.0,05/05/17 07:48:17 AM PDT,,,2017-05-05
998,3052,Black love fears nothing,400.0,https://www.facebook.com/WilliamsandKalvin/,12571.0,1703.0,12/08/16 06:12:47 AM PST,,,2016-12-08
999,3055,What happened to Eubanks for weaving a web of lies falsifying police reportsthat sparked a statewide manhunt for two nonexistent suspects andtarnishing the name of an innocent man Well naturally he was sent home tohis familySubscribe to our channelFollow my FacebookFollow me on InstagramFollow me on TwitterThe Truth about liarcops,82.27,https://www.facebook.comNViIIiamsandKaIvin/,347.0,10.0,04/24/17 08:27:14 AM PDT,,,2017-04-24
1000,3056,This week he learned his fate as the judge sentenced the former statetrooper for his crimesLuckenbaugh will serve betweenandmonths in county prison for kickingthe helpless manSubscribe to our channelFollow my FacebookFollow me on InstagramFollow me on TwitterThe Truth about thecolor of justice,73.22,https://www.facebook.comNViIIiamsandKaIvin/,1071.0,30.0,04/24/17 08:26:27 AM PDT,,,2017-04-24
1001,3060,White racist cant keep calm when a black man is all fineThey cant keep calm even if black people are treated just like white peopleI mean they are just treated equallyAnd no white racist can stand it WhyI wonder if all the white Americans are sick in their headsSubscribe to our channelFollow my FacebookFollow me on InstagramFollow me on Twitter,200.0,https://www.facebook.comNViIIiamsandKaIvin/,1114.0,85.0,12/03/16 06:50:52 AM PST,Union,,2016-12-03
1002,3062,Sanya Gragg establishes a fivepart mantra in her book Momma Did YouHear The News to help black Americans remember what to do during apolice encounterAAlways use your mannersLListen and complyIIn control of your emotionsVVisible hands alwaysEExplain everythingStay Alive guysSubscribe to our channelFollow my FacebookFollow me on InstagramFollow me on TwitterThe Truth about theTalk,230.0,https://www.facebook.com/William sandKaIvin/,3093.0,73.0,05/05/17 07:47:51 AM PDT,,,2017-05-05
1003,3067,Hillary Clinton is a traitor Hillary Clinton is a liar Hillary Clinton is insane Iknow that many black people support this old dirty bitch I dont know whythey do this still its their personal choice and we are a free country yet Butlisten to my word of truth and dont let them fool youSubscribe to our channelFollow my FacebookFollow me on InstagramFollow me on TwitterThe truth aboutelections,0.0,https://www.facebook.comnViIIiamsandKaIvin/,0.0,0.0,12/08/16 06:10:58 AM PST,,,2016-12-08
1004,3069,Agree,400.0,https://www.facebook.com/WilliamsandKalvin/,7703.0,1484.0,12/08/16 06: 10:58 AM PST,,,2016-12-08
1005,3072,If your black matters click,200.0,https://www.facebook.com/WilliamsandKalvin/,,1071.0,11 /22/16 07:25:56 AM PST,Union,,
1006,3073,If your black matters click,0.0,https://www.facebook.com/WilliamsandKalvin/,,,12/08/16 06: 10:58 AM PST,,,2016-12-08
1007,3076,The I Promise School will open for elementary students in the fall ofwithsupport from James family foundation according to plans revealed onTuesdayIt plans classes for students in third and fourth grades during its first year andwill expand to include gradesthoughbySubscribe to our channelFollow my FacebookFollow me on InstagramFollow me on TwitterThe Truth aboutLeBron James,298.84,https://www.facebook.com/WilliamsandKalvin/,1555.0,57.0,04/19/17 08:14:28 AM PDT,,,2017-04-19
1008,3079,The New York City Police Department now says that state Justice SheilaAbdusSalaams death is suspicious after officials last week told theAssociated Press that AbdusSalaams drowning death was being treated asa suicideSubscribe to our channelFollow my FacebookFollow me on InstagramFollow me on TwitterThe Truth aboutracism and justice,90.41,https://www.facebook.com/\/ViIIiamsandKaIvin/,5174.0,195.0,04/24/17 08:27:44 AM PDT,,,2017-04-24
1009,3080,Videoblog about social issues,481.14,https://www.facebook.com/William sandKaIvin/,1461.0,34.0,11/30/16 04:35:28 AM PST,,,2016-11-30
1010,3083,Its time to wake up and break our chains Together we will find our way tofreedom,1195.25,https://www.facebook.comnViIIiamsandKaIvin/,2744.0,76.0,12/05/16 06:24:36 AM PST,,,2016-12-05
1011,3084,Its time to wake up and break our chains Together we will find our way tofreedom,0.0,https://www.facebook.comnVilliam sandKaIvin/,0.0,0.0,12/06/16 01:02:03 AM PST,,,2016-12-06
1012,3085,Information is your strongest weapon Know the truth and stand against theracism in the US,1.31,https://www.facebook.comnVilliam sandKaIvin/,4.0,0.0,12/06/16 01:08:35 AM PST,,,2016-12-06
1013,3086,Newsblog about social injustice in the US Our goal is to tell the truth,0.0,https://www.facebook.com/William sandKaIvin/,0.0,0.0,12/06/16 01:31:58 AM PST,,,2016-12-06
1014,3087,Newsblog about social injustice in the US Join us and stay informed,4693.33,https://www.facebook.com/William sandKaIvin/,11113.0,321.0,12/06/16 01:36:05 AM PST,,,2016-12-06
1015,3088,Newsblog about social injustice in the US Join us and stay informedWilliamsKalvin,26155.71,https://www.facebook.comnWiIIiamsandKaIvin/,127188.0,3309.0,12/12/16 06:40:45 AM PST,,,2016-12-12
1016,3093,Weeks ago we all witnessed the uniting of Black community at work whensocial media alerts from Washington DCs Metropolitan Police Departmentignited an outcry about the number of missing Black girls in the DistrictBut it is important to say that Black men are missing too At leastmissingteen boys and young men are also on that official missingpersons listIf you care about your brothers and sisters spread that informationThe whole list via,497.13,https://www.facebook.comnVilliam sandKaIvin/,22133.0,2983.0,04/18/17 08:03:06 AM PDT,,,2017-04-18
1017,3095,On the th anniversary of the assassination of the Rev Martin Luther KingJr the FBI took to Twitter Tuesday to honor his life work and commitment tojusticeAlong with a photo of King from the Library of Congress the FBI included agraphic of the following quote from him with its tweetWe shall overcome because the arc of the moral universe is long but itbends toward justiceSubscribe to our channelFollow my FacebookFollow me on InstagramFollow me on TwitterThe Truth about FBIwwwyoutubecom,0.0,https://www.facebook.com/WiIIiamsandKaIvin/,0.0,0.0,04/13/17 04:32:57 AM PDT,,,2017-04-13
1018,3100,In the last four months Maj Toure has raised online more thanforBlack Guns MatterA mission is to educate urban communities on their Second Amendmentrights as citizensThe weapon is the best guaranty of your freedom and safetyVisit it and join itSubscribe to our channelFollow my FacebookFollow me on InstagramFollow me on TwitterThe Truth aboutBlack Guns Matter,400.0,https://www.facebook.comnWilliam sandKaIvin/,5100.0,244.0,12/12/16 06:39:21 AM PST,,,2016-12-12
1019,3101,Black girls rock,0.0,https://www.facebook.com/WilliamsandKalvin/,,0.0,12/08/16 06: 14:44 AM PST,,,2016-12-08
1020,3180,We are African Americans and we support the nd Amendment Join us ifselfdefense is your priority Black Guns Matter,0.0,https://www.facebook.com/ProtectBlackGunOwners/,,,12/07/16 07:19:01 AM PST,,,2016-12-07
1021,3181,We are African Americans and we support the nd Amendment Join us ifselfdefense is your priority,1020.38,https://www.facebook.com/ProtectBlackGunOwners/,505.0,30.0,12/07/16 07:19:36 AM PST,,,2016-12-07
1022,3184,We support the nd Amendment Join us if selfdefense is your top priority,54.78,https://www.facebook.com/ProtectBlackGunOwners/,11.0,3.0,12/09/16 01 :40:40 AM PST,,,2016-12-09
1023,3186,Black American racial experience is real We support the nd ammendmentfor our safety,1050.77,https://www.facebook.com/ProtectBlackGunOwners/,396.0,32.0,11 /14/16 04: 10:27 AM PST,,,
1024,3188,Black American racial experience is real We support the nd ammendmentfor our safety,0.0,https://www.facebook.com/ProtectBlackGunOwners/,0.0,0.0,11 /16/16 01 :15:28 AM PST,,,
1025,3194,Black American racial experience is real We support the nd ammendmentfor our safety,1402.09,https://www.facebook.com/ProtectBlackGunOwners/,22519.0,2.0,11/11/16 07:00:17 AM PST,,,2016-11-11
1026,3271,The day time cool but the nights evilRepost from,200.0,https://www.facebook.com/ProtectBlackGunOwners/,831.0,147.0,02/01 /17 05:25: 15 AM PST,,,
1027,3323,ROLLUP YOUR SLEEVES IT IS A CALL TO SELFDEFENSE,500.0,https://www.facebook.com/Fit-Black-966468950153780/,1406.0,130.0,02/02/17 11 :44:54 PM PST,New York,New York,2017-02-02
1028,3329,Join the event bring your friends feel safe with usDont miss the opportunity to train outdoorsIts free Organized on a donation basis Free Selfdefense class in OrlandoFl,2592.07,https://www.facebook.com/events/1470671329619188/,3612.0,194.0,02/13/17 06: 56:45 AM PST,Orlando Florida,Florida,2017-02-13
1029,3355,Join the event bring your friends feel safe with usIts free Organized on a donation basis Join the event bring your friendsfeel safe with usIts free Organized on a donation basis Free Selfdefense class in NYFree Selfdefense class in NY,1690.0,https://www.facebook.com/events/144838441523561 Of,2002.0,94.0,04/13/17 05:26:20 AM PDT,New York,New York,2017-04-13
1030,3372,The second selfdefense class withJoin the event bringyour friends feel safe with us Selfdefense classes with,2999.12,https://www.facebook.com/events/694209204073106/,4250.0,198.0,02/01 /17 03:29: 15 AM PST,New York,New York,
1031,1,Instgogogo,161.23,https://instagram.com/us_daily/,358.0,6.0,10/25/15 06:28:33 AM PDT,Brea,,2015-10-25
1032,2,You can go to hell or followinstead Texas is where youalways want to be We are Texans and were not like the rest Follow us LoneStar State RebelsInstagram photos and videos,1000.0,https:Hinstagram.com/south_lone_star/,17256.0,38.0,10/20/15 10:36:20 AM PDT,Texas,Texas,2015-10-20
1033,3,Black lives matter because we see whats going on We care and we wontlet it get swept under the rug JoinSee Instagram photos andvideos from Black Union for JusticeBlack Union for JusticeInstagram photos and videos,0.0,https:Hinstagram.com/blackunionus/,0.0,0.0,10/26/15 10:45:51 AM PDT,,,2015-10-26
1034,4,Dont Shoot is a community site where you can find recent videos aboutoutrageous police misconduct really valuable ones but underrepresented bymass media We provide you with firsthand stories and diverse videos Joinus Click Learn more,7575.66,https://www.facebook.com/Blacklivessss-930158090385628/,14311.0,33.0,04/19/16 07:49:45 AM PDT,,,2016-04-19
1035,6,Conservative Christians Prolife gun police military Follow,0.0,https://www.facebook.com/Bat-240131319678646/,0.0,0.0,05/12/16 04:06:17 AM PDT,,,2016-05-12
1036,7,Conservative Christians Prolife gun police military Follow,2868.56,https://www.facebook.com/Bat-240131319678646/,23408.0,54.0,05/13/16 01:18:08 AM PDT,,,2016-05-13
1037,10,Unbelievable amount of the US governments waste Join us to learn moreabout Goverment spending statistics The US Gov Spending Stats Instalol,662.39,https://instagram.com/gov_spending/,1625.0,11.0,11/16/15 05:49:20 AM PST,,,2015-11-16
1038,11,Veterans Day is comingThere are so many ways to show your support and your gratitude Millions ofAmericans change one light to green in a visible location as a symbol ofappreciation Businesses honor veterans with discounts deals and fee mealson Veterans Day Check our page for more information Veterans USAGovSpending,1960.34,https://www.instagram.com/veteransus/,4802.0,31.0,11/10/15 06:19:02 AM PST,,,2015-11-10
1039,14,This military campaign is very ambiguous given that it has cost nearlyAmerican lives and hundreds of billions of dollars The goal was to disruptthe use of Afghanistan as a terrorist base of operations Well theintervention deprived alQaida of a sanctuary But alQaidaeven after itsleader Osama bin Laden was killed by US commandoshas spawned cellselsewhere and inspired other extremists in Syria and Iraq And now ISIS isrising as the most powerful terrorist organisation in the world So the questionis whether its worth to risk the lives of thousands of American soldiers for themission that hardly can be called successful It seems that Obama shouldreview his military strategy without delayJoin us Veterans USAGovSpending,659.54,https:Hinstagram.com/veterans_us/,1598.0,10.0,11/16/15 05:17:56 AM PST,Mission,,2015-11-16
1040,15,And what would you choose if u were a president to createmilitaryrelated jobs or to createjobs in education Join us Learn more TheUS Gov Spending Stats Instalol,596.63,https:Hinstagram.com/gov_spending/,1614.0,12.0,11/17/15 07:07:36 AM PST,,,2015-11-17
1041,17,What do you know about PTSD There is no greater agony PTSD affects apersons memory emotional responses intellectual processes and nervoussystem Nearlyof veterans fight this agony every day Do you want tolearn more Click here Veterans USAGovSpending,366.41,https:Hinstagram.com/veterans_us/,1872.0,2.0,11/18/15 02:43:22 AM PST,,,2015-11-18
1042,18,What do you know about PTSD There is no greater agony PTSD affects apersons memory emotional responses intellectual processes and nervoussystem Nearlyof veterans fight this agony every day Do you want tolearn more Click here Veterans USAGovSpending,0.0,https:Hinstagram.com/veterans_us/,0.0,0.0,11/19/15 05:18:16 AM PST,,,2015-11-19
1043,19,Who will save the children Click Learn more The US Gov Spending StatsInstalol,978.15,https://instagram.com/gov_spending/,2115.0,8.0,11/19/15 05:35:36 AM PST,,,2015-11-19
1044,21,Throughout the history of our nation there have been many wars Thesoldiers have always carried the burden of death or injury while in battlesPoliticians continually act as if the soldiers are their pawns and their soldierpawns are expendable in war Hence we have the saddest statistics ofmilitary injuriesout ofveterans is disabled often by injuries sustained incombat Join us Learn more Veterans USAGovSpending,2948.52,https://instagram.com/veterans_us/,8292.0,73.0,11/13/15 06:27:35 AM PST,,,2015-11-13
1045,22,Click learn more See the latest breaking news photos and videos BlackAmerica Blacklivessss,1550.41,https://www.instagram.com/blackamericatoday/,9555.0,32.0,12/01/15 07:37:28 AM PST,Chicago Illinois,Illinois,2015-12-01
1046,23,TAG YOUR PHOTOS WITH TXagainst Send us the reason why dont youwant illegals in TexasComments photos and videos are welcomed,806.09,https://www.facebook.com/GovSpending-1651761351759857/,10785.0,6.0,04/19/16 08:23:46 AM PDT,,,2016-04-19
1047,26,Home of the Brave Support our Veterans Click Learn More Veterans USAGovSpending,898.36,https://www.instagram.com/veterans_us/,1721.0,6.0,12/01/15 05:51:31 AM PST,Washington Columbia New Mexico,Washington Columbia New Mexico,2015-12-01
1048,27,Why our government wastesMLN per day on ISIL Instead of saving morethanlives of vets Why do we engage in another conflict when we haveso many unsolved problems in the USIt is a shame that our vets are treated so badly They do not receive properhealth care and unemployment benefits They do not receive the respect theydeserve I do not want our government to create new veterans in suchconditionsJoin us for more statistics Click learn more The US Gov Spending StatsInstalol,467.12,https://instagram.com/gov_spending/,2616.0,6.0,11/18/15 03:33:41 AM PST,,,2015-11-18
1049,28,How to know the truth Click learn more Wouldnt it be better to solve theinternal problems first The US Gov Spending Stats Instalol,2070.42,https://www.instagram.com/govSpending/,15398.0,46.0,12/16/15 06:45:58 AM PST,,,2015-12-16
1050,31,Quiz from EBONY magazine AprilWhich is Negro Which is WhitePassing for white is a direct consequence of how race works in AmericaBecause of the One Drop Rule if you look at all part black African you areseen as black by whites and suffer all the racism that goes with thatClick Learn More Black AmericaBlacklivessss,4040.17,https://www.instagram.com/blackamericatoday/,23670.0,235.0,03/11/16 04:54:05 AM PST,,,2016-03-11
1051,33,Unbelievable amount of the US governments waste Click Learn More TheUS Gov Spending Stats GovSpending,950.0,https://instagram.com/gov_spending/,2404.0,6.0,12/01/15 05:57:42 AM PST,Massachusetts,Massachusetts,2015-12-01
1052,34,A Wounded Warrior and his service dog Support our VeteransFollow BlackAmericaInstalol,0.0,https://www.instagram.com/veterans_us/,0.0,0.0,05/12/16 02:31:30 AM PDT,,,2016-05-12
1053,35,There are some people who will always support you And unfortunately theVA is not on the list There are numerous examples of disgusting treatment ofour Veterans by the VA employees And there is little chance the situation willchange in the near future The failure of the Defense Department and VA tocreate a joint electronic health record despite spendingbillion fordevelopment is just another example of it Click Learn More Veterans USAGovSpending,0.0,https://www.instagram.com/veteransus/,0.0,0.0,01/14/16 06:25:20 AM PST,,,2016-01-14
1054,37,Join us to learn more Why arent white hoods and white supremacistpropaganda illegal here in America Why are Germans ashamed of theirbigotry while America is proud of it Black America,4030.81,https://www.instagram.com/blackamericatoday/,56837.0,216.0,12/22/15 03:42:46 AM PST,,,2015-12-22
1055,38,Join us to learn more Why arent white hoods and white supremacistpropaganda illegal here in America Why are Germans ashamed of theirbigotry while America is proud of it Black AmericaBlacklivessss,1796.49,https://www.instagram.com/blackamericatoday/,24866.0,95.0,01/06/16 01:45:12 AM PST,,,2016-01-06
1056,39,Join us to learn more Why arent white hoods and white supremacistpropaganda illegal here in America Why are Germans ashamed of theirbigotry while America is proud of it Black AmericaBlacklivessss,9.16,https://www.instagram.com/black_america_today/,95140.0,300.0,01/14/16 06:07:11 AM PST,,,2016-01-14
1057,41,gather recent videos about outrageous police misconduct really valuableones but underrepresented by mass media,5.27,https://www.facebook.com/B lack I ivessss-9301 58090385628/,7190.0,479.0,06/15/16 02:14:28 AM PDT,Maryland,Maryland,2016-06-15
1058,43,Together we can stop them Join the fight FollowCop blockis a grassroots organization working to make police accountable for theiractions Cop Block Us Instagram photos and videos,0.0,https:Hinstagram.com/cop_block_us,0.0,0.0,10/13/15 02:27:35 AM PDT,,,2015-10-13
1059,44,You can go to hell or followinstead Texas is where youalways want to be We are Texans and were not like the rest Follow us LoneStar State RebelsInstagram photos and videos,0.0,https:Hinstagram.com/south_lone_star,0.0,0.0,10/13/15 01:34:37 AM PDT,Texas,Texas,2015-10-13
1060,45,We always condemn racism and terrorism because they only affect the poorand less privilege in society So dont be fooled into making this mistake Thewar in Syria is just another rich white mans way to profit at the cost ofinnocent lives and yes Flint is stillwithout clean waterwokeblacks PanAfricanism BlackNationalism BlackEmpowermentAfrican Empowerment AfricanAndProud BlackAndProud BlackPrideBlackPower BlackLivesMatter Amerikkka UnapologeticaIlyBlackUnapologeticallyAfrican BlacklnAmerica BlacklsBeautiful KnowThySelfKnowledgeOfSelf KnowledgeOfSelflsANationaIityEconomicEmpowerment Integration Failed WhiteLiesMatter EducationAfrican Unification AfricanUnity BlackLove theblackmancan brotherhoodkings,0.0,https://www.facebook.com/Woke-Blacks-294234600956431/,0.0,0.0,05/25/17 12:25:16 AM PDT,,,2017-05-25
1061,46,Obey the law and everything will be ok they say,0.0,https://www.facebook.com/shootusa,0.0,0.0,07/27/15 12:42:42 AM PDT,,,2015-07-27
1062,47,Obey the law and everything will be ok they say,0.0,https://www.facebook.com/shootusa,0.0,0.0,07/24/15 02:24:10 AM PDT,,,2015-07-24
1063,49,The head of Chicagos IPRA Sharon Fairley has recommended an ondutyofficer to be fired for calling President Obama a nr According to ChicagoSunTimes the racist remark was made during a meeting to decide on whowould cover the presidents detail for a Bulls game The Independ ChicagoCop To Be Fired For Calling Obama NWord I Black Matters Black Matters,782.22,https://www.facebook.com/Black-Matters-1579673598947501/,4405.0,716.0,06/20/16 08:22:58 AM PDT,,,2016-06-20
1064,52,The head of Chicagos IPRA Sharon Fairley has recommended an ondutyofficer to be fired for calling President Obama a nr According to ChicagoSunTimes the racist remark was made during a meeting to decide on whowould cover the presidents detail for a Bulls game The Independ ChicagoCop To Be Fired For Calling Obama NWord I Black Matters Black Matters,847.19,https://www.facebook.com/Black-Matters-1579673598947501/,4544.0,724.0,06/20/16 08:03:12 AM PDT,,,2016-06-20
1065,53,Join us because we care Black Matters,0.0,https://www.facebook.com/blackmattersus/,0.0,0.0,07/13/15 07:13:40 AM PDT,Atlanta Georgia Maryland Missouri Virginia,Georgia Maryland Missouri Virginia,2015-07-13
1066,54,Join us because we care Black Matters,53424.95,https://www.facebook.com/blackmattersus/,201428.0,12127.0,07/13/15 07:20:58 AM PDT,Atlanta Georgia Maryland Missouri Virginia,Georgia Maryland Missouri Virginia,2015-07-13
1067,55,Fastgrowing black community Latest news and everyday updates,214.45,https://www.facebook.com/blackmattersus/,812.0,73.0,10/06/15 08:22:34 AM PDT,,,2015-10-06
1068,56,Fastgrowing black community Latest news and everyday updates,731.77,https://www.facebook.com/blackmattersus/,3251.0,211.0,11/05/15 11:17:06 PM PST,,,2015-11-05
1069,57,Stand up South Carolina Lets stop the propaganda of hate and whitesupremacy Not My Heritage,4670.0,https://www.facebook.com/events/I 730167210590258/,7457.0,304.0,07/21/16 05:32:28 AM PDT,South Carolina,South Carolina,2016-07-21
1070,58,Black Matters Black community,4798.09,https://www.facebook.com/blackmattersus/,16322.0,2446.0,10/06/15 08:25:00 AM PDT,,,2015-10-06
1071,59,Black Matters Black community,58408.48,https://www.facebook.com/blackmattersus/,359345.0,24838.0,11/05/15 11:17:06 PM PST,,,2015-11-05
1072,60,Fastgrowing black community Latest news and everyday updates,317.56,https://www.facebook.com/blackmattersus/,967.0,113.0,10/06/15 08:22:34 AM PDT,,,2015-10-06
1073,61,Fastgrowing black community Latest news and everyday updates,34501.08,https://www.facebook.com/blackmattersus/,115604.0,10292.0,11/05/15 11:17:06 PM PST,,,2015-11-05
1074,62,One year ago nine people were killed by a gunman including the seniorpastor state senat Remember Victims of Charleston Shooting,14398.69,https://www.facebook.com/events/257074994652475/,42890.0,2182.0,06/01/16 06:03:23 AM PDT,Charleston South Carolina,South Carolina,2016-06-01
1075,64,Join us Because we care,340.34,https://www.facebook.com/Black-Matters-1579673598947501/,500.0,25.0,07/10/15 01:03:31 AM PDT,Arkansas Washington Columbia Atlanta Georgia New Orleans Louisiana Baltimore Maryland Missouri Cleveland Ohio Philadelphia Pennsylvania Memphis Tennessee Richmond Virginia Milwaukee Wisconsin,Arkansas Washington Columbia Georgia Louisiana Maryland Missouri Ohio Pennsylvania Tennessee Virginia Wisconsin,2015-07-10
1076,65,Two years have passed since Augustthe date when yearoldEzell Ford was mur Justice For Ezell Ford And Donnell Thompson,14881.75,https://www.facebook.com/events/1702267153358101/,41395.0,1734.0,08/04/16 07:25:31 AM PDT,Los Angeles California,California,2016-08-04
1077,66,A rally in loving memory of Aiyana JonesMaywill mark the sixth anniversary of the br The th Anniversary Of TheAiyana Jones Death,0.82,https://www.facebook.com/events/1727519624184050/,3.0,0.0,05/06/16 01:00:41 AM PDT,Detroit Michigan,Michigan,2016-05-06
1078,67,A rally in loving memory of Aiyana JonesMaywill mark the sixth anniversary of the br The th Anniversary Of TheAiyana Jones Death,1714.83,https://www.facebook.com/events/1727519624184050/,13066.0,804.0,05/06/16 02:21:24 AM PDT,Detroit Michigan,Michigan,2016-05-06
1079,68,A rally in loving memory of Aiyana JonesMaywill mark the sixth anniversary of the br The th Anniversary Of TheAiyana Jones Death,9192.47,https://www.facebook.com/events/1727519624184050/,54836.0,2546.0,05/10/16 01:31:35 AM PDT,Detroit Michigan,Michigan,2016-05-10
1080,69,A rally in loving memory of Aiyana JonesMaywill mark the sixth anniversary of the br The th Anniversary Of TheAiyana Jones Death,1505.34,https://www.facebook.com/events/1 727519624184050/,8376.0,314.0,05/16/16 07:59:50 AM PDT,Detroit Michigan,Michigan,2016-05-16
1081,70,A rally in loving memory of Aiyana JonesMaywill mark the sixth anniversary of the br The th Anniversary Of TheAiyana Jones Death,2570.85,https://www.facebook.com/events/1 727519624184050/,10089.0,442.0,05/17/16 12:21:13 AM PDT,Detroit Michigan,Michigan,2016-05-17
1082,71,Breaking news and analysis on the life of African American community in theUS Independent News For Black Amrican community Black Matters BlackMatters,6691.62,https:Hblackmattersus.com/,77530.0,2317.0,03/10/16 06:26:39 AM PST,,,2016-03-10
1083,72,Black Community We finally made a website News about black racial andsocial issues This happened yesterday Febat a dry cleaning shop in ablack neighborhood when this black guy went for his clothes he had alreadysent for laundry What do you mean by you people The black guy askedThere was a murmur from inside the shop the dry cleaner answered thosewho are arguing m Black Matters The Police should protect not BrutalizeIdeally Black Women S F Police Vow To Eradicate Racism Plans to fightracism in the ranks Black History Month The event grew out of NegroHistory Week the brainchild Black Matters,392.14,https://blackmattersus.com/,2461.0,75.0,02/04/16 12:28:15 AM PST,,,2016-02-04
1084,73,Black Community We finally made a website News about black racial andsocial issues This happened yesterday Febat a dry cleaning shop in ablack neighborhood when this black guy went for his clothes he had alreadysent for laundry What do you mean by you people The black guy askedThere was a murmur from inside the shop the dry cleaner answered thosewho are arguing m Black Matters The Police should protect not BrutalizeIdeally Black Women S F Police Vow To Eradicate Racism Plans to fightracism in the ranks Black History Month The event grew out of NegroHistory Week the brainchild Black Matters,24165.8,https://blackmattersus.com/,141500.0,6282.0,02/04/16 11:54:33 PM PST,,,2016-02-04
1085,74,Black Community We finally made a website News about black racial andsocial issues This happened yesterday Febat a dry cleaning shop in ablack neighborhood when this black guy went for his clothes he had alreadysent for laundry What do you mean by you people The black guy askedThere was a murmur from inside the shop the dry cleaner answered thosewho are arguing m Black Matters The Police should protect not BrutalizeIdeally Black Women S F Police Vow To Eradicate Racism Plans to fightracism in the ranks Black History Month The event grew out of NegroHistory Week the brainchild Black Matters,10676.85,https://blackmattersus.com/,42072.0,1805.0,04/25/16 05:36:07 AM PDT,,,2016-04-25
1086,78,Black Community We finally made a website News about black racial andsocial issues Get breaking news and analysis on the life of African Americancommunity in the US Black Matters Chicago IPRA Finally Gets DashcamVideo Of Darius Pinex Shooting It took over five years for the IPRA to get thekey evidence in the fatal police shooting of a black Chicago man committed inOrlando Nightclub Massacre And The Race Factor Orlando tragedyshed light on how hate and terrorism can destroy innocent lives within amatter of seconds PepperSprayed Victim Donates K Settlement ToSocial Justice A Seattle high school history teacher Jesse Hagopian peppersprayed by police says hell donate the K settlement to help movementfor justice NYPD Cop Pulls A Gun On Black Cyclist In FenderBender Ayearold black cyclist plans to sue a white NYPD police officer forthreatening his life by pointing a gun at him during a fenderbender BlackMatters,5940.92,https:Hblackmattersus.com/,44405.0,1739.0,06/16/16 01:32:37 AM PDT,,,2016-06-16
1088,80,Fastgrowing black community Latest news and everyday updates,3364.59,https://www.facebook.com/blackmattersus/,10825.0,1393.0,10/06/15 08:22:32 AM PDT,,,2015-10-06
1089,81,Fastgrowing black community Latest news and everyday updates,2796.95,https://www.facebook.com/blackmattersus/,7808.0,738.0,11/05/15 11:17:06 PM PST,,,2015-11-05
1090,82,Fastgrowing black community Latest news and everyday updates,257.25,https://www.facebook.com/Black-Matters-1579673598947501/,191.0,6.0,07/10/15 01:02:58 AM PDT,Arkansas Washington Columbia Atlanta Georgia New Orleans Louisiana Baltimore Maryland Missouri Cleveland Ohio Philadelphia Pennsylvania Memphis Tennessee Richmond Virginia Milwaukee Wisconsin,Arkansas Washington Columbia Georgia Louisiana Maryland Missouri Ohio Pennsylvania Tennessee Virginia Wisconsin,2015-07-10
1091,83,Join us Because we care,468.0,https://www.facebook.com/Black-Matters-1579673598947501/,613.0,30.0,07/10/15 01:03:32 AM PDT,Arkansas Washington Columbia Atlanta Georgia New Orleans Louisiana Baltimore Maryland Missouri Cleveland Ohio Philadelphia Pennsylvania Memphis Tennessee Richmond Virginia Milwaukee Wisconsin,Arkansas Washington Columbia Georgia Louisiana Maryland Missouri Ohio Pennsylvania Tennessee Virginia Wisconsin,2015-07-10
1092,84,Black Matters Black community,3760.42,https://www.facebook.com/blackmattersus/,14050.0,1838.0,10/06/15 08:24:58 AM PDT,,,2015-10-06
1093,85,Black Matters Black community,35240.34,https://www.facebook.com/blackmattersus/,105431.0,10547.0,11/05/15 11:17:06 PM PST,,,2015-11-05
1094,86,Two years have passed since Augustthe date when yearoldEzell Ford was mur Justice For Ezell Ford and Donnell Thompson,3529.26,https://www.facebook.com/events/1051176154917933/,2920.0,75.0,08/22/16 07:04:52 AM PDT,Los Angeles California,California,2016-08-22
1095,87,Two years have passed since Augustthe date when yearoldEzell Ford was mur Justice For Ezell Ford and Donnell Thompson,7.11,https://www.facebook.com/events/1051176154917933/,6368.0,180.0,08/23/16 04:11:38 AM PDT,Los Angeles California,California,2016-08-23
1096,88,Two years have passed since Augustthe date when yearoldEzell Ford was mur Justice For Ezell Ford and Donnell Thompson,6003.52,https://www.facebook.com/events/I 051176154917933/,5289.0,236.0,08/26/16 04:19:56 AM PDT,Los Angeles California,California,2016-08-26
1097,89,Two years have passed since Augustthe date when yearoldEzell Ford was mur Justice For Ezell Ford Jesse Romero and DonnellThompson,147.23,https://www.facebook.com/events/1 051176154917933/,172.0,9.0,08/29/16 12:27:53 AM PDT,Los Angeles California,California,2016-08-29
1098,90,Two years have passed since Augustthe date when yearoldEzell Ford was mur Justice For Ezell Ford Jesse Romero and DonnellThompson,3849.25,https://www.facebook.com/events/1 051176154917933/,3477.0,103.0,08/29/16 05:11:27 AM PDT,Los Angeles California,California,2016-08-29
1099,92,Fastgrowing black community Latest news and everyday updates,445.3,https://www.facebook.com/Black-Matters-1579673598947501/,608.0,27.0,07/10/15 01:03:03 AM PDT,Arkansas Washington Columbia Atlanta Georgia New Orleans Louisiana Baltimore Maryland Missouri Cleveland Ohio Philadelphia Pennsylvania Memphis Tennessee Richmond Virginia Milwaukee Wisconsin,Arkansas Washington Columbia Georgia Louisiana Maryland Missouri Ohio Pennsylvania Tennessee Virginia Wisconsin,2015-07-10
1100,93,A Year Without Justice for Tamir Rice Join the meeting A Year WithoutJustice for Tamir Rice,3988.68,https://www.facebook.com/events/1486230091674577/,17231.0,922.0,11/19/15 11:59:53 PM PST,Cleveland Ohio,Ohio,2015-11-19
1101,94,Keeping eye on our brothers cases and much more,0.0,https://www.facebook.com/blackmattersus/,0.0,0.0,07/13/15 07:17:59 AM PDT,Atlanta Georgia Maryland Missouri Virginia,Georgia Maryland Missouri Virginia,2015-07-13
1102,95,Keeping eye on our brothers cases and much more,20446.19,https://www.facebook.com/blackmattersus/,69296.0,4366.0,07/13/15 07:20:58 AM PDT,Atlanta Georgia Maryland Missouri Virginia,Georgia Maryland Missouri Virginia,2015-07-13
1103,96,Counterprotest against White Power Confederate rally at Stone MountainNot My Heritage,14.912,https://www.facebook.com/events/1579032272388106/,54463.0,2813.0,04/06/16 08:41:45 AM PDT,Atlanta Georgia,Georgia,2016-04-06
1104,100,Keeping eye on our brothers cases and much more,0.0,https://www.facebook.com/blackmattersus/,0.0,0.0,07/13/15 07:18:00 AM PDT,Atlanta Georgia Maryland Missouri Virginia,Georgia Maryland Missouri Virginia,2015-07-13
1105,101,Keeping eye on our brothers cases and much more,23298.73,https://www.facebook.com/blackmattersus/,79112.0,5155.0,07/13/15 07:20:58 AM PDT,Atlanta Georgia Maryland Missouri Virginia,Georgia Maryland Missouri Virginia,2015-07-13
1106,102,Almostyears have passed since the death of Eric Garner a father ofwhowas violentl Rally In Memory Of Eric Garner,12.485,https://www.facebook.com/events/1085290071563825/,37821.0,2775.0,07/06/16 03:03:43 AM PDT,New York,New York,2016-07-06
1107,103,Almostyears have passed since the death of Eric Garner a father ofwhowas violentl Rally In Memory Of Eric Garner,0.0,https://www.facebook.com/events/1085290071563825/,0.0,0.0,07/28/16 06:40:03 AM PDT,New York,New York,2016-07-28
1108,104,Almostyears have passed since the death of Eric Garner a father ofwhowas violentl Rally In Memory Of Eric Garner,0.0,https://www.facebook.com/events/1085290071563825/,0.0,0.0,08/04/16 07:24:02 AM PDT,Los Angeles California,California,2016-08-04
1109,105,Black Matters Black community,227.8,https://www.facebook.com/blackmattersus/,917.0,109.0,10/06/15 08:24:59 AM PDT,,,2015-10-06
1110,106,Black Matters Black community,95.01,https://www.facebook.com/blackmattersus/,1002.0,35.0,11/05/15 11:17:06 PM PST,,,2015-11-05
1111,107,Come support an innocent man who is on death row Kevin Cooper has beenin prison sinceFree Kevin Cooper,1.495,https://www.facebook.com/events/983667495074239/,1879.0,64.0,06/10/16 02:08:55 AM PDT,Oakland California,California,2016-06-10
1112,108,We dont want to honor racism slavery and hatred Sand ur groundjoin therally Not My Heritage Rally,2.84,https://www.facebook.com/events/227388350945080/,9306.0,261.0,03/18/16 07:55:46 AM PDT,Jackson Mississippi,Mississippi,2016-03-18
1113,110,Join us because we care Black Matters,0.0,https://www.facebook.com/blackmattersus/,0.0,0.0,07/13/15 07:13:41 AM PDT,Atlanta Georgia Maryland Missouri Virginia,Georgia Maryland Missouri Virginia,2015-07-13
1114,111,Join us because we care Black Matters,31741.49,https://www.facebook.com/blackmattersus/,113435.0,7173.0,07/13/15 07:20:58 AM PDT,Atlanta Georgia Maryland Missouri Virginia,Georgia Maryland Missouri Virginia,2015-07-13
1115,114,Man Dies After Police Use Pepper Spray During Arrest In AlabamaA man in Alabama collapsed and died after officers sprayed him with pepperspray while arresting him after a chase Tuscaloosa police said SaturdayPolice said Ware ran into nearby woods and struggled with officers when theycaught up with him Officers sprayed him with oleoresin capsicum morecommonly known as pepper spray according to police The chemical agentdebilitates a person by causing temporary blindness and irritating a personsnose and throatThe six officers who were involved in Wares case will remain on duty duringan investigation according to police Officials said police car dash cam andbody camera footage of the incident would be released after thatinvestigationThis tragedy happen accidentally and probably the police officers didnt wishdeath upon him because they tried to give him first aid However the man isdead and there is no chance to rewind and bring him back Hes gone foreverbut the cops will remain on duty and get away with this murder Is thisacceptableWe will know about he process of detention after the investigation is overLets wait and keep our eyes open Black Lives Matter,303.3,https://www.facebook.com/Black-Matters-1579673598947501/,1236.0,151.0,07/14/15 06:13:31 AM PDT,Baltimore Maryland Missouri Cleveland Ohio,Maryland Missouri Ohio,2015-07-14
1116,115,Have you ever been mistreated or abused by racist police officersDo you want you story to be read by thousands of peopleWe can make this happen easily We can post your story in ourcommunitylts very important to us because black people should stopstruggling with racism and police brutalityIf we all speak outwe can do it We can obtain justice and equalityYou can send your story to blackmattersuscom or you can messageus via Facebook anonym or notWe are not to judge we are to share experience and support each other Sodont be shy and help the black community United we stand,218.95,https://www.facebook.com/Black-Matters-1579673598947501/,584.0,46.0,07/14/15 06:10:21 AM PDT,Baltimore Maryland Missouri Cleveland Ohio,Maryland Missouri Ohio,2015-07-14
1117,116,Unarmed Black Man On A Horse Allegedly Strangled To Death By White CopIn MississippiOne of the last things that Jonathan Sanders an unarmed black manreportedly said before he died was Let me go I cant breathe OnWednesday night a white police officer in the small town of StonewallMississippi allegedly strangled Sanders a yearold black horseman with aflashlight before killing him in view of his family membersOfficer Kevin Herrington pulled Sanders off a horse and choked him with aflashlight Sanders attorney Stewart Parrish initially told an ABC affiliateParrish later clarified that those allegations came from family members whowitnessed the death Parrish said that Sanders experienced some kind ofasphyxiation during the altercationSanders died on the scene and leaves behind two childrenThe last words of Eric garner were I cant breathe the last words ofJonathan Sanders were I cant breathe let me go Biting irony isnt itSince when is it illegal to train your horse in close propinquity to your houseAmerica was always and it is nowa police state for black people,1615.11,https://www.facebook.com/Black-Matters-1579673598947501/,9042.0,1003.0,07/13/15 07:20:12 AM PDT,Baltimore Maryland Missouri Cleveland Ohio,Maryland Missouri Ohio,2015-07-13
1118,117,I cant breathe symbolize an anger and frustration over the relationshipbetween law enforcement and black people in America,10.31,https://www.facebook.com/Black-Matters-1579673598947501/,45.0,7.0,07/16/15 02:22:00 AM PDT,Baltimore Maryland Missouri Cleveland Ohio,Maryland Missouri Ohio,2015-07-16
1119,118,TaNehisi Coates on growing up in West BaltimoreThe famous AfricanAmerican writer TaNehisi Coates grew up in WestBaltimore with people who lost a child whether to the streets to guns or to jailToday his goal is to protect his son from the different forms of violence thathe experienced in school and on the streetsPeople of color have been dealing with injustice ever since they crossed theNorth American continent For instance in West Baltimore TaNehisi wastrained not to go to the neighborhoods unless you know this place He wastold that you cannot tolerate anybody attempting any physically violent threatto you Moreover his mom was feared that her children would get arrestedWhat does it mean Undoubtedly black Americans were afraid of policeimproper procedure injustice or what is worse being killed by police officerThats why the nationwide furor over the growing number of unarmed blackmen fatally shot by police officers has put the public on a new trend inAmerica In fact this new trend caused disproportionate number of unarmedpeople of color killed by policeHow dangerous is to live in your area today,157.72,https://www.facebook.com/Black-Matters-1 579673598947501/,327.0,18.0,07/15/15 08:23:22 AM PDT,Baltimore Maryland Missouri Cleveland Ohio,Maryland Missouri Ohio,2015-07-15
1120,119,Black church vandalized for the third time in a row on Floridas SpaceCoastWas it a hatecrimeA predominantly Melbourne black church was vandalized for the third time insix months According to the Melbourne Police Department the vandalbought axes to chop through access points to get in Church BishopJacquelyn Gordon said that the church was in the process of developmentsince they moved two years ago intofoot industrial complexMoreover the message SS Charlestonwas found on the car nearby theChurch which raised concerns about church security SS Charlestonindicates the tragedy in Charleston when nine people were shot to death bywhite supremacist Dylann Roof at Emanuel AME church Before the churchmembers found the words We see u that were painted in the radical emblemof the Nazi party swastikaHow many hateful people living in America today What of these people aregetting their hatred and racism from their parents or friends What if it is ahate crime Has the government created a fund to assist this church,262.75,https://www.facebook.com/Black-Matters-1579673598947501/,672.0,45.0,07/15/15 08:22:39 AM PDT,Baltimore Maryland Missouri Cleveland Ohio,Maryland Missouri Ohio,2015-07-15
1121,120,Amandla Stenberg Black Female Bodies Are Treated As Less Than HumanDo black females lives matter tooThats the big question yearold Amandla Stenberg posed on Instagram onSunday The powerful post broke down the cultural double standards thatplague black women every dayBlack features are beautiful black women are not Stenberg wrote Whitewomen are paragons of virtue and desire black women are objects offetishism and brutality This at least seems to be the mentality surroundingblack femininity and beauty in a society built upon eurocentric beautystandardsEverybody knows that racism is alive and prospering in America However allthe news about killing black men and black teenagers police brutality unfairsentences and other issues distract us from the fact that black women arebeing abused in the most violent ways Usually they cant stand up forthemselves unlike men so they endure and sufferIn modern America black women experience more depression than probablyduring slavery when everything was obvious but now racism is hiddenbehind the mask of tolerance,331.57,https://www.facebook.com/Black-Matters-1 579673598947501/,1080.0,113.0,07/15/15 03:35:13 AM PDT,Baltimore Maryland Missouri Cleveland Ohio,Maryland Missouri Ohio,2015-07-15
1122,121,New York City Agrees to Pay Family of Eric GarnerMillionNew York City has agreed to pay the estate of Eric Garnermillion tosettle a lawsuit over his death after he was placed in a chokehold by a NewYork Police Department officerThe city didnt admit fault in the settlement the comptrollers office said inannouncing the accord Monday eveningonathan Moore an attorney for the family said the city made its offer ofmillion Monday and the Garner family in his office agreed unanimously toend the caseThere is no amount of money that would compensate them for their lossMr Moore said Eric Garner is dead He had no reason to die on that dayWhatever you think he was doing he shouldnt have diedYeah right money wont bring Eric back Hes gone forever and his his familyknows that But anyway its some sort of victory Its way better than nothingRest in peace Eric Garner No justice no peace,424.29,https://www.facebook.com/Black-Matters-1579673598947501/,1662.0,181.0,07/15/15 03:34:05 AM PDT,Baltimore Maryland Missouri Cleveland Ohio,Maryland Missouri Ohio,2015-07-15
1123,122,Cleveland judge wont be forced to issue warrants in Rice shootingA divided Ohio appeals court panel on Friday said it would not force amunicipal judge to issue arrest warrants for Cleveland police officers involvedin the fatal shooting of yearold Tamir Rice in a city park last NovemberCleveland Municipal Court Judge Ronald,269.17,https://www.facebook.com/Black-Matters-1 579673598947501/,1514.0,173.0,07/14/15 06:13:13 AM PDT,Baltimore Maryland Missouri Cleveland Ohio,Maryland Missouri Ohio,2015-07-14
1124,123,Teen shot by St Louis police paralyzed mom laments gun violenceA teenager shot by city police is paralyzed below the waist his mother saidSunday as her family copes with another episode of gun violence Not sevenyears ago her teenage daughter was accidentally shot to deathThis time a firearm in the hand of her son Brandon Claxtonprompted anofficer to shoot him three times aboutpm Saturday in a housingcomplex in theblock of Hodiamont Avenue officials said Policeencountered him while responding to a call about someone with a stolenpistolHis mother said that she respected the police and that her son shouldnthave had the gun But from what witnesses have told her she said Theydidnt have to shoot him down like thatOne of three witnesses interviewed Sunday told a reporter that Brandon didhave a gun in his hand But all three said that he did not point a weapon atanyone as he tried to run from officersWhen a white guy walks around with a rifle nobody bats an eye When ablack guy walks with a pistol or even a toy gun hell be immediately shot bythe police Have you ever heard about open carry in the United States Thenhere we go Racial prejudice at its finestOur condolences to the family,252.08,https://www.facebook.com/Black-Matters-1 579673598947501/,1237.0,205.0,07/14/15 06:12:50 AM PDT,Baltimore Maryland Missouri Cleveland Ohio,Maryland Missouri Ohio,2015-07-14
1125,124,Hands up dont shoot was built on pain We dont ask police to hug us weonly ask them to stop killing black men Because we are disproportionallykilled by cops over and over again,4.92,https://www.facebook.com/Black-Matters-1 579673598947501/,15.0,2.0,07/17/15 06:33:37 AM PDT,Baltimore Maryland Missouri Cleveland Ohio,Maryland Missouri Ohio,2015-07-17
1126,125,yearold WWII veteran is evicted on stretcherThe WWII veteran Johnnie H Hodges refused to leave his house after he wasnot able to pay his mortgage while caring for his sick wife Police andambulance workers had to carry him away on a stretcherA yearold Navy veteran lived in his Buffalo home with his wife fordecades But about four years ago he was taking care of his wife who hadAlzheimers disease and spent all his income on her rehabilitation In theprocess he defaulted on his mortgage and amassed a huge debt totalingto MT Bank Unfortunately due to his default on his mortgage loanpayments he was evicted from his house on a stretcherWhy does the US government treat military veterans absolutelydisgracefully Why the WWII veterans are literally being treated like humangarbage by their own government How potentially disabled veteran wasevicted from his house How come homelessness and unemployment amongAmerican veterans is much higher today than for the general population of theUnited States of America,8.85,https://www.facebook.com/Black-Matters-1579673598947501/,28.0,10.0,07/17/15 06:33:04 AM PDT,Baltimore Maryland Missouri Cleveland Ohio,Maryland Missouri Ohio,2015-07-17
1127,126,What differences do you see in the picture below What do you think is thedifference between police attitude towards white citizens and black citizensThink about it,4.45,https://www.facebook.com/Black-Matters-1579673598947501/,18.0,3.0,07/17/15 06:32:46 AM PDT,Baltimore Maryland Missouri Cleveland Ohio,Maryland Missouri Ohio,2015-07-17
1128,127,St Louis police shot teenager Teen is paralyzedLast Saturday the yearold Brandon Claxton prompted an officer to shoothim three times in a housing complex in Hodiamont Avenue According topolice they responded to a call about someone with a stolen caliber pistolBrandon Claxton is in critical conditionsBut according to witnesses Brandon did not point a pistol at anyone but hewas trying to run away from the officersWhere is the video evidence of police shooting Police Chief Sam Dotsonsaid that there is not a clear view on video What if police is trying to cover upthe story Did you know that police did not allow Brandons mother to seeher son because he was in custody Do you believe that police was justifiedto arrest BrandonCameras dont lie We need to know the truth whether the boy posed a threator not,500.0,https://www.facebook.com/Black-Matters-1579673598947501/,5959.0,754.0,07/17/15 12:52:41 AM PDT,Baltimore Maryland Missouri Cleveland Ohio,Maryland Missouri Ohio,2015-07-17
1129,128,Rapper OG Maco walked the red carpet of BET Awards in a shirt donning thenames of police brutality victims Helluva statement indeed,130.63,https://www.facebook.com/Black-Matters-1579673598947501/,1704.0,184.0,07/21/15 07:32:31 AM PDT,Baltimore Maryland Missouri Cleveland Ohio,Maryland Missouri Ohio,2015-07-21
1130,129,This is so sad how slowly this is becoming reality Please America Pleasewake up and realize its time to change Dont hide your head in the sand,125.56,https://www.facebook.com/Black-Matters-1579673598947501/,1536.0,157.0,07/21/15 06:55:01 AM PDT,Baltimore Maryland Missouri Cleveland Ohio,Maryland Missouri Ohio,2015-07-21
1131,130,We want our chief backLast week in a place that bills itself as the Friendliest Town on the EasternShore angry residents marched to City Hall demanding to give back a jobfor Kelvin Sewell the communitys first black police chiefOn Junehe was fired amid allegations leveled against white officers ofdepartmental racism After that the crowd of Sewells supporters moved tovoice their outrage to the Pocomoke City Council with posters that read WeSupport Chief Kelvin SewellAs a nation we have looked the other way for far too long and it is disgracefulThis time were not fighting with police were fighting for justice The system isbroken police doesnt protect us and the government cares only abouttycoons interests So heres a questionwho will care about Americans whocant protect themselves Who will care about usJusticeforChiefSewell,210.75,https://www.facebook.com/Black-Matters-1 579673598947501/,869.0,125.0,07/21/15 06:54:35 AM PDT,Baltimore Maryland Missouri Cleveland Ohio,Maryland Missouri Ohio,2015-07-21
1132,131,Made In The US The Justice Turns Into BusinessFor years inmates with nonviolent felonies and misdemeanor charges inNew York City had to sit in Rikers Island for months awaiting trial cause theycouldnt afford to pay bailUnder the citys new bail initiative announced by Mayor Bill de Blasio lastweek somelowlevel offenders are eligible for release without bail Thesystem needs serious reform According to the New York Police Departmentthe biggest part of arrests are lowlevel offenses like peeing on the street ordisorderly conductThe New York Daily News reports thatpercent of themillion people hitwith summonses betweenandwere black and Hispanic So whatshould we doThe criminal penal system is antiquated It should be changed The worse itis now designed to be for profit which has led to laws being designed to keeppeople in prison rather than rehabilitating More and more it looks like its abusinessThe first rule of any society is development At such rate the US governmentwill start to sell indulgences soonOur system is not only unfair but also corrupt We should explore alternativesolutions and limit the number of people in prison to the most violent andpotentially dangerous offenders Only real criminals should be in jailLemme ask you have you ever seen a one of the tobacco industry executivesgo to jail I guess no We also have never seen the Bush or any otherPresidents administrations were brought to justiceAmerica has a justice system that was supplanted the Jim Crow laws as ameans to keep the minorities from developing real opportunities for keepingthe very rich from ever being brought to justice,364.87,https://www.facebook.com/Black-Matters-1579673598947501/,1426.0,109.0,07/21/15 06:54:01 AM PDT,Baltimore Maryland Missouri Cleveland Ohio,Maryland Missouri Ohio,2015-07-21
1133,132,KKK AfricanAmerican group plan rallies at South Carolina CapitolCould you please just close your eyes for a minute Now imagine yearsafter the Third Reich was down Berlin organizes Nazi military paradeSounds weird inconceivable rightSo tell me why KKK march at South Carolina Capitol draws the ire only oflocal AfricanAmericansA Ku Klux Klan chapter and an AfricanAmerican group plan overlappingdemonstrations on Saturday outside the South Carolina State House wherestate officials removed the Confederate battle flag last weekWe have been fought with slavery Jim Crow laws and etc for REALLy longtime so whats the problem today Nothing good coming out of this mess Sowhat is the purpose of this march Hmmm It feels like this could be billed asthe fight of the century What do you think about it guys,277.98,https://www.facebook.com/Black-Matters-1579673598947501/,1244.0,161.0,07/21/15 06:53:25 AM PDT,Baltimore Maryland Missouri Cleveland Ohio,Maryland Missouri Ohio,2015-07-21
1134,133,Another Woman Commits Suicide In JailA teen committed suicide in a jail cell an hour after being arrested anothersuspicious case of a Black woman dying in police custody in the past weekThe second case over a week huh How retarded andor brainwashed byFox News is one supposed to be to believe this is a coincidence No way weare gonna buy such bullshitThe weirdest thing about this specific case is that the suicide was committedjust an hour after the arrest Moreover the woman was suspected of stealingsomeones phone which is quite not a reason for getting to her accountWeve got to also take into consideration thatinblack men go to prison asopposed to a considerably lower rate with the white menorgstory inblackmengtoprisonthemostdisturbingfactsabout racialinequalityintheuscriminaljusticesystemIt definitely seems like theres more to this since until recently taking intocustody hasnt been a reason for suicide among black women Now for somepeople the only way to deal with police violence at the police stations is simplykilling themselves,0.0,https://www.facebook.com/Black-Matters-1579673598947501/,0.0,0.0,07/21/15 07:32:07 AM PDT,Baltimore Maryland Missouri Cleveland Ohio,Maryland Missouri Ohio,2015-07-21
1135,134,Black white Asian Hispanic it doesnt matter Racism is racism its wrongregardless,34.92,https://www.facebook.com/Black-Matters-1579673598947501/,117.0,18.0,08/04/15 05:32:25 AM PDT,Baltimore Maryland Missouri Cleveland Ohio,Maryland Missouri Ohio,2015-08-04
1136,135,I see racism as a pervasive element of both right and left wing politics in theUS Trust no one,3.44,https://www.facebook.com/Black-Matters-1579673598947501/,14.0,1.0,08/04/15 08:31:29 AM PDT,Baltimore Maryland Missouri Cleveland Ohio,Maryland Missouri Ohio,2015-08-04
1137,136,We do not need to drink the water from the fountain of youth Because blackdont crack,1.0,https://www.facebook.com/Black-Matters-1579673598947501/,12708.0,1347.0,08/06/15 07:38:42 AM PDT,Baltimore Maryland Missouri Cleveland Ohio,Maryland Missouri Ohio,2015-08-06
1138,137,Special prosecutor opened an investigation into death of black womenRaynette TurnerNew York Attorney General Eric Schneiderman will launch an investigationinto to the death of one of the five black women who died in an American jailover a twoweek span Raynette Tumer who was the mother of eight childrendied in jail cell in police custody last week She was arrested for shopliftingsome crab legs from a grocery store Due to her bad health history she wastaken to the hospital and released But she died in jail waiting for someone tohelpAccording to American legislation the courthouse officials are supposed tocheck the cell every fifteen minutes but no one checked Tumers cell formore than two hoursA total of five AfricanAmerican women have been found dead in policecustody in just the last month Most of them were hold for minor charges andstill their deaths are under investigation Sandra Bland from Texas KindraChapman from Alabama Joyce Curnell from South Carolina Ralkina Jonesfrom Ohio and Raynetta Turner from New York were found dead in their cellafter being arrested by police officersOnce again it raises questions about how black people are treated in policecustody What if death in police custody is about excessive police force Doyou realize that dozens of black people were found dead in the US,277.27,https://www.facebook.com/Black-Matters-1 579673598947501/,1294.0,120.0,08/05/15 07:05:06 AM PDT,Baltimore Maryland Missouri Cleveland Ohio,Maryland Missouri Ohio,2015-08-05
1139,138,Black people come together Only together we are stronger Stand up for yourrights Stand up against discrimination Stand up for equalityIt all depends on us not the Congressneither the White House Because itsnot the government who want to end discrimination,1.025,https://www.facebook.com/Black-Matters-1579673598947501/,3595.0,242.0,08/05/15 07:04:05 AM PDT,Baltimore Maryland Missouri Cleveland Ohio,Maryland Missouri Ohio,2015-08-05
1140,139,The Civil Rights Activist Mary McLeod BethuneMary McLeod Bethune was the civil rights activist and an educator who foundthe National Council of Negro Women inBeing one of thechildren offormer slaves she was the first and the only child to go to AfricanAmericanschool She found the Daytona Normal and Industrial Institute for Negro Girlsbecause she believed that education was the key to racial advancement Inaddition Bethune did a lot of work to contribute to American society Forinstance she was the president of the Florida chapter of the NationalAssociation of Colored Women Moreover inMary Bethune became anadvisory to President Roosevelt on minority affairs and later on she startedher civil rights organization the National Council of Negro WomenThe great educator and civil right activist Mary McLeod Bethunedemonstrated the values of education the philosophy of love and the wiseuse of power Sadly at leastyears of data reveals that Congress dont payattention to American civil rights as Mary McLeod Bethune didyears ago,285.12,https://www.facebook.com/Black-Matters-1579673598947501/,902.0,92.0,08/05/15 07:03:32 AM PDT,Baltimore Maryland Missouri Cleveland Ohio,Maryland Missouri Ohio,2015-08-05
1141,140,The drama in Pocomoke A Maryland town several weeks ago fired its firstblack Police Chief now exposing a racial riftThe leaders of small Marylands city in Eastern Shore fired the PocomokeCitys first black police Chief Kelvin Sewell due to his incompetence andrefusal to fire black police officers Franklin Savage and Lynell Green ChiefSewell was hired by Pocomoke City back inafter his retirement from theBaltimore Police Department Earlier before Sewells dismissal he filed acomplaint on unequal employment opportunities claiming he was paid lessthan his white predecessorsThis is circumstantial evidence that America is divided into different partsbased on race and income Racism has gotten so bad black people aretreated unfairly If God created us equally why the unequal treatment ofminorities still exists in our country What if the firing gas stirred a new spiritof AfricanAmerican activism,177.64,https://www.facebook.com/Black-Matters-1579673598947501/,847.0,70.0,08/05/15 07:03:16 AM PDT,Baltimore Maryland Missouri Cleveland Ohio,Maryland Missouri Ohio,2015-08-05
1142,141,Who said that protesting is not effective Yes it isHow many black people were killed and shot by police department for thepast few years How many protests have been held sinceHow usefulwere protestsAccording to analysis by APstates have putnew laws to tackle policeviolence such as use of police officer body cameras racialbias training andsurplus of military equipment However there is more work to be done tosolve racial tensions in AmericaThe public stand against discrimination happens when there is lack of insideconnections with the government People attempt to stop racism thegovernment usually assumes to be problematic but protesters force thegovernment to find compromise Its a well known fact when governments donot deliver people protest,0.0,https://www.facebook.com/Black-Matters-1579673598947501/,0.0,0.0,08/05/15 12:11:58 AM PDT,Baltimore Maryland Missouri Cleveland Ohio,Maryland Missouri Ohio,2015-08-05
1143,142,Three Bronx officers were caught on camera by the passenger in a car as thedriver appears to be repeatedly punched in the head and thrown to thegroundYall is punching me in the face What did I do to deserve this theyearold Timothy Nelson can be heard saying in the recording of the Julytraffic stopDo they really needcops showing up for a traffic stop And thats why Idrather call a crack head for help before I call the cops they dont protect andserve they shoot and kill anybody thats not wearing a police badge And I donot wear it,61.33,https://www.facebook.com/Black-Matters-1579673598947501/,221.0,35.0,08/04/15 08:31:58 AM PDT,Baltimore Maryland Missouri Cleveland Ohio,Maryland Missouri Ohio,2015-08-04
1144,143,So basically cops are detaining folks for no real reason in order to find areason to further detainarrest them Thats a problem,31.88,https://www.facebook.com/Black-Matters-1579673598947501/,105.0,9.0,08/04/15 08:31:45 AM PDT,Baltimore Maryland Missouri Cleveland Ohio,Maryland Missouri Ohio,2015-08-04
1145,144,Man rammed St Louis police carfor the black people Black people are fedup with an age of racist societyThe yearold Kevin Labriado from Bellefontaine Neighbors was chargedfor ramming police car from behind twice screaming for black people Heassaulted two officers and his child who was sitting in his car Two St Louisofficers were on patrol until Labriado and his fiveyearold daughteraccidentally rammed their car When police officer tried to arrest himLabriado yelled several times This is for the black peopleWhat if Labriado sought to revenge for all black lives that officers took awayRacism obviously gave rise to the tensions in society that led to disrespectand hate Moreover black people are fed up with racism and police violencetowards black community What is more racial tensions have gotten worseunder the current government Even after several months of protests over thedeaths of Eric Garner Tamir Rice Michael Brown Sandra Bland and FreddieGray the government inspired more unrest Today black community is indesperate situation seeking for help,85.07,https://www.facebook.com/Black-Matters-1579673598947501/,351.0,63.0,08/04/15 08:30:58 AM PDT,Baltimore Maryland Missouri Cleveland Ohio,Maryland Missouri Ohio,2015-08-04
1146,145,We can start by having community days for the kids its a must to invest inthe youth We underestimate what were capable of doing on our own Wedont have to wait on others to value our lives,65.87,https://www.facebook.com/Black-Matters-1579673598947501/,402.0,49.0,08/04/15 05:31:20 AM PDT,Baltimore Maryland Missouri Cleveland Ohio,Maryland Missouri Ohio,2015-08-04
1147,146,Alabama Police Officer Kept His Job After Proposal to Murder Black Man andHide EvidenceA police officer in Alabama proposed murdering a black resident and creatingbogus evidence to suggest the killing was in selfdefenseOfficer Troy Middlebrooks kept his job and continues to patrol Alexander Cityafter authorities there paid the manto avoid being publicly sued overthe incident Middlebrooks a veteran of the US marines said the man needsa god damn bullet and allegedly referred to him as that nigger afterbecoming frustrated that the man was not punished more harshly over a priorruninThe payment was made to the black resident Vincent Bias after a secretrecording of Middlebrookss remarks was played to the citys police chiefsand the mayor Elected city councillors said they were not consultedDo you know that you can go to prison for murderous intent However if youare a white police officer offering to KILL a BLACK AMERICAN and then hidethe evidence then you dont even get fired Oh yeah its happening in awonderful state called Alabama You know how it works here Do you haveany more questions for American law enforcement system,0.0,https://www.facebook.com/Black-Matters-1579673598947501/,0.0,0.0,08/06/15 07:36:02 AM PDT,Baltimore Maryland Missouri Cleveland Ohio,Maryland Missouri Ohio,2015-08-06
1148,147,Young Unarmed Black Man Killed By Cop Didnt Want ToDie Too YoungAn unarmed black teenager in Texas was shot dead by a cop who had onlyrecently graduated from the police academy Just over a week before hisdeath he posted that he doesnt want to die too young on TwitterOfficers responded to a burglary call aroundam on Friday hearing reportsthat a suspect was damaging vehicles First spotting Taylor moving about thelot officers also noticed Taylors SUV had been smashed into the front of thedealership showroom Finding that Taylor had moved inside the showroomArlington Police Chief Police Will Johnson said Taylor would not comply whentold to lie down on the ground but fled to a back room yearold officerBrad Miller entered the showroom to arrest Taylor and then an altercationbroke out Miller fired four shots including the fatal bullets from the gun ofMiller A second officer fired a taser Johnson saidAnd now there are three main points that you should think ofTaylor was described as a good kid He was a football player at AngeloState University Never was involved in criminal activitiesThe officer graduated from the police academy less thanmonths ago andwas working under the supervision of a training officerTaylor didnt want to die youngBlack teens dont really live they survive And unfortunately there is no oneto save them from death There is no one to stop police brutality We all wantour kids to feel safe we want them to be safe and sound Are our hopesdoomed to disappointment,44.54,https://www.facebook.com/Black-Matters-1579673598947501/,290.0,86.0,08/10/15 07:36:40 AM PDT,Baltimore Maryland Missouri Cleveland Ohio,Maryland Missouri Ohio,2015-08-10
1149,148,Michael we didnt forget you We havent forgotten anyone No justicenopeaceBlackLivesMatter Ferguson,999.99,https://www.facebook.com/Black-Matters-1 579673598947501/,8752.0,1102.0,08/12/15 12:53:51 AM PDT,Baltimore Maryland Missouri Cleveland Ohio,Maryland Missouri Ohio,2015-08-12
1150,149,BREAKING NEWSOakland JoeBartOakland police officers fatally shot a man suspected in alleged carjackingattempt in Downtown Oakland Wednesday night Is it a race warYesterday night a group ofprotesters burned Confederate flag and tried toshutdown a freeway in Downtown Oakland The opposition to police violencewas in response to the police shooting earlier in the dayAccording to Oakland Police Department yesterday atpm in the areaof th Avenue and International Boulevard Oakland police officers spotted avehicle they believe to be connected to a previous robbery on JulyThepursuit started when the driver fled through Oakland streets until the suspectcrashed into another car in the area of th Avenue and Martin Luther KingJr street But when the suspect ran of the car three officers opened fire Thesuspect Joe Bart has died at the hospitalDid you know that it was fifth shooting this year that involved police officersHow quickly it has become so usual Why it has become so legit Where isthe government speaking about the existence of racism in AmericaBlack Lives Matter,0.0,https://www.facebook.com/Black-Matters-1579673598947501/,0.0,0.0,08/13/15 07:18:16 AM PDT,Baltimore Maryland Missouri Cleveland Ohio,Maryland Missouri Ohio,2015-08-13
1151,150,Black people still face discriminationNew data shows that white privilege still dominates in the United States ofAmerica It is painfully obvious that unequal treatment is harmful on a dailybasis For instance poor service plays an important role contributing toalteration in health that is potential harmful realities for many black people,82.95,https://www.facebook.com/Black-Matters-1579673598947501/,294.0,34.0,08/18/15 08:23:09 AM PDT,Baltimore Maryland Missouri Cleveland Ohio,Maryland Missouri Ohio,2015-08-18
1152,151,Why black parents worry about their children How should we talk to ourchildren about how safely interact with police officers in order to protectthemselvesTina CarterShileds has five kids and three of them recently started to driveThe first thought she had when they wanted to drive alone was Wait aminute Im really scared right now What should they do if they get pulledover What if they do something they dont supposed to be doing It is notalways fair when officers arrest African Americans but its a reality What ifpolice officers will automatically assume that your child is criminal because ofhow him or her looksBlack parents should remember that their kids will always be judged by theway they look Thats why its important to instruct our children how to reactwhen you are in trouble with law enforcement Because if a stranger followsyour child after himher buy a bag of Skittles ran back into the storeRemember anything is better than dyingAnyways its hard to believe that inst century black parents have to teachtheir children both survive and thrive But who will take responsibility fortraining police officers,160.23,https://www.facebook.com/Black-Matters-1 579673598947501/,594.0,63.0,08/18/15 08:22:50 AM PDT,Baltimore Maryland Missouri Cleveland Ohio,Maryland Missouri Ohio,2015-08-18
1153,152,What is like to live in America if you are blackWell first of all you have to work much harder to prove that you are worthothers Second of all everybody is judging and stereotyping you by the colorof your skin Third of all you are always being an other even in the countryyou were born Forth of all you are always expected to be load and to dancewell In addition there are lots of people who like to throw race cardsCan we live like that How long should we wait for the governmentcontributions,119.55,https://www.facebook.com/Black-Matters-1579673598947501/,315.0,42.0,08/18/15 08:22:26 AM PDT,Baltimore Maryland Missouri Cleveland Ohio,Maryland Missouri Ohio,2015-08-18
1154,153,Men March begins with mile walk to DC to denounce epidemic of theculture of gun violence and racismmile trek to Washington has started this Sunday evening in order to bringmore attention to widespread violence in different cities across America Thefounder of the group Munir Bahar said that the march will lasthours in amemory of more thanpeople who have been killed in Baltimore this yearTheMen March will highlight the racism and violence across the countryWhats wrong with our society Police kill unarmed citizens we kill eachother What example we will be setting for the future generations How arewe going to break the cycle of violence Are there any chances to overcomedeeply rooted racism and violence in America What if peace comes after thefairness,1414.97,https://www.facebook.com/Black-Matters-1579673598947501/,11736.0,1130.0,08/18/15 08:22:08 AM PDT,Baltimore Maryland Missouri Cleveland Ohio,Maryland Missouri Ohio,2015-08-18
1155,154,Straight Outta Compton is straight realityThe new movie Straight Outta Compton focus on legendary hiphop pioneersNWA and their struggles against racism and police violence The movie iscoming this weekend in the theaters However some of the cinemas refusedto show the movie citing safety and liability concernsDoes it remind you of anything How about Ferguson How about BaltimoreToday you are willing to be detained in the name of defending your rightsToday cops can easily shoot you for a small violation Even having black copsand black mayors doesnt end police brutality Fortunately today you areallowed to record police officers in order to further prevent potentially seriouscases of police wrongdoing fairly,121.04,https://www.facebook.com/Black-Matters-1579673598947501/,553.0,70.0,08/18/15 08:21:46 AM PDT,Baltimore Maryland Missouri Cleveland Ohio,Maryland Missouri Ohio,2015-08-18
1156,155,Police Officers Take Down A Onelegged Homeless Black Man ArmedWith Crutches in San FranciscoWriter Chaedria LaBouvier reported that she had seenSan Franciscopolice officers subduing a homeless black man who had one leg outsideTwitter headquartersWitnesses told LaBouvier that police had been called because the man waswaving sticks which later turned out to be his crutchesNone of the employees at Twitter or other tech companies came out to objectas theofficers took down the onelegged homeless manThe US Justice Department recently filed court documents in an Idaho casewhich declared it unconstitutional to criminalize homelessness According tothe Coalition on Homelessness the city handed outcitations tohomeless people who were sitting on sidewalks betweenam andpminWhat kind of people police usually hire Mentally unstable bloodthirstycowards or We already know the answer Sometimes we all wonder dopolice officers have mercy for anyone Hard to say because what we seeconfuses us,81.42,https://www.facebook.com/Black-Matters-1579673598947501/,199.0,21.0,08/18/15 08:21:25 AM PDT,Baltimore Maryland Missouri Cleveland Ohio,Maryland Missouri Ohio,2015-08-18
1157,156,Handcolored portrait of an unidentified black woman shucking corn ByGeorge Barnard,81.43,https://www.facebook.com/Black-Matters-1579673598947501/,219.0,32.0,08/18/15 08:20:41 AM PDT,Baltimore Maryland Missouri Cleveland Ohio,Maryland Missouri Ohio,2015-08-18
1158,157,Racism doesnt usually look like someone shouting slurs it looks like peopleeagerly looking for a reason why a black kid deserved to die,413.94,https://www.facebook.com/Black-Matters-1579673598947501/,2644.0,251.0,08/18/15 08:20:23 AM PDT,Baltimore Maryland Missouri Cleveland Ohio,Maryland Missouri Ohio,2015-08-18
1159,158,BREAKING NEWS St Louis police fatally shot a black teenager while tryingto issue search warrantOn Wednesday Augracial tensions again sparked in Missouri city afterSt Louis police officers fatally shot black teenager at Walton Avenue andPage Boulevard while trying to issue search warrant According to St LouisPolice Chief San Dotson a young black man pointed a gun at officers andwas trying to escape from a house where officers were carrying out a searchwarrant for him The yearold and yearold officers who shot thesuspect four times were about seven years on the forceThat was followed by crowd ofpeople who gathered by intersection Lateron nine people were arrested on charges of resisting arrest The protesterssaid that the police provoked the situation What do you think about it What ifthis situation makes us want to keep the police out of our neighborhood Whydo you think police shoots first and then asks questions Do you realize thatthe shooting came just ten days after St Louis was flooded with protesterswho were marking the anniversary of Michael Brown What if the city and thegovernment needs to center its attention on racism and discrimination inAmerica instead of suspecting every single black menWe cannot accept the fact that police can easily kill black people in Americathan we must do something about it Protest or accept it You choose This isyour life,100.0,https://www.facebook.com/Black-Matters-1579673598947501/,447.0,99.0,08/21/15 08:05:07 AM PDT,Baltimore Maryland Missouri Cleveland Ohio,Maryland Missouri Ohio,2015-08-21
1160,159,What is like driving while black in AmericaThroughout the twentyfirst century there are thousands of complaints of thepolice profiling black drivers in America Black Americans often complaintabout being pulled over for the phenomenon called driving while black Forexample a rich African American driving new Ferrari can be stoppedhundreds of times for no apparent reason just because the fact that a blackman driving an expensive car attract the attention of the police officersBut what if racial profiling ends with lethal consequences Do you rememberSandra Bland who had runins with the police while driving Do you allremember that she was found dead in police custody Do we all have toavoid traffic stops in order to surviveFor the matter of fact the routine traffic stops are being a big deal for thepeople of color According to the Justice Department statistics black driversare aboutpercent more likely to be subject to police than whites Overallthis number indicates the racial difference in America,100.0,https://www.facebook.com/Black-Matters-1579673598947501/,322.0,47.0,08/21/15 07:46:04 AM PDT,Baltimore Maryland Missouri Cleveland Ohio,Maryland Missouri Ohio,2015-08-21
1161,160,Silenced racism in AmericaTamir Rice Rumain Brisbon Kajieme Powel Dante Parker Michael BrownJohn Crawford III Eric Garner Jonathan Ferrell Kimani Gray Michael Brownand Sandra Bland are one of many examples of excessive police brutalityused on black AmericansYou never know if a simple traffic stop will end up with you in a police custodyor bullets in your chestUnfortunately many of Americans feel very uncomfortable talking about theseissues which seem to confirm the idea that the government remain silentNevertheless one should accept that AfricanAmericans are more likely to betargeted by police officers on the street than whites Therefore it endangersthe rights of black communityDoubtless when the government defends the officers who have killed blackmen it strikes us how unfair the system is and reaffirms our view that Americawould spend billions of dollars on radical extremists than talking about thedomestic terrorism racial inequality and police brutality,483.15,https://www.facebook.com/Black-Matters-1579673598947501/,3218.0,408.0,08/21/15 07:45:31 AM PDT,Baltimore Maryland Missouri Cleveland Ohio,Maryland Missouri Ohio,2015-08-21
1162,161,Black power is greater then you thought You just have to use it right Fight foryour civil rights use your power Civil Rights legislation is the most effectivestep towards eliminating unspoken by the government inequality in AmericaWhat if the civil rights movement generates social change What if the civilrights movement accelerates the process of the same opportunities,584.77,https://www.facebook.com/Black-Matters-1579673598947501/,1720.0,230.0,08/20/15 07:43:42 AM PDT,Baltimore Maryland Missouri Cleveland Ohio,Maryland Missouri Ohio,2015-08-20
1163,162,Confederate flags are permitted to fly at schools in TennesseeParents are worried about their childrens safetyYet here we are Tennessee parents are worried about their childrens safetyat the local school after discovering that anyone is permitted to wearConfederate flag attire and to fly the Confederate flags at school Thisprovoked widespread discontent among black parents of Rutherford CountyOne of the parents said that she witnessed the students wearing theConfederate flag Tshirt and the controversial flags flying in the backstudents carsHow would you feel if your child studies among those who like to fly theConfederate flags on their trucks How would you feel about the safety ofyour child Why children were permitted to openly display the Confederateflag on the school grounds What kind of symbol the Confederate flag is foryou Do you remember Dylann Roof who killed black people at church Doyou remember that he was promoting the Confederate flag What if your childstudies among the same people Is it an appropriate place for your kid tostudyIf Nazi flag was banned than the Confederate flag must be outlawed tooThus if the government continues to accept this flag it will bring more racistand hateful movements because the Confederate flag shows a lack ofempathy for African Americans slavery and for every black American man,0.0,https://www.facebook.com/Black-Matters-1579673598947501/,0.0,0.0,08/20/15 07:42:57 AM PDT,Baltimore Maryland Missouri Cleveland Ohio,Maryland Missouri Ohio,2015-08-20
1164,164,PowerDrunk Pig Threatens To Drag Teens Out Of CarPolice officer Jeff Willis is facing disciplinary action after a video surfaced ofhim violently threatening teenagers because they were smiling at him and nottaking him seriously enough Willis pulled them over because one of thepassengers allegedly flipped him the middle fighter from the windowWhen one of the young men asks the officer What did I do the officerresponds by saying I dont know I just dont like you I just dont like youThe only crime committed by the occupants of the car was shooting the videoWe have a legal right to film and photograph police in every state Peopleshould know their rightsits the first step to stop police brutalityIf another person smiling makes you that upset you should not be permittedto own a gun People who have mental illness or anger issues should nothaving access to guns Guns should be in the hands of responsible adultsPolice went out of the control How much respect do you think Police has forpeopleIn this way if you cant control yourself its time to retire you dontdeserve to carry the badgeAmerica needs better gun control Although its not the type of gun that is theproblem It is the type of gun owner that is the problem America control yourblue pigs,29.39,https://www.facebook.com/Black-Matters-1579673598947501/,149.0,37.0,08/25/15 07:58:45 AM PDT,Baltimore Maryland Missouri Cleveland Ohio,Maryland Missouri Ohio,2015-08-25
1165,165,Love this sign because its true Whether killed or jailed too many Blackchildren lose their fathers because of corrupted system,246.39,https://www.facebook.com/Black-Matters-1579673598947501/,2543.0,309.0,08/24/15 08:27:46 AM PDT,Baltimore Maryland Missouri Cleveland Ohio,Maryland Missouri Ohio,2015-08-24
1166,166,Prominent Black Lives Matter activist Shaun King revealed to be whiteBlack Lives Matter activist Shaun King has claimed for years that he isbiracial being born to a white mother and a black father But recentlyuncovered records claim he misled the public about his race and that he is infact a white man pretending to be blackKings race would not be under scrutiny if it was not an essential componentof his career education and social status In addition to getting a fullridescholarship that is exclusively for black men King has the position of JusticeColumnist at progressive news website Daily Kos and enjoys astrong follower count on Twitter most of whom are a result of hisactivism following the death of Mike Brown in FergusonKings race would not be under scrutiny if it was not an essential componentof his career education and social status In addition to getting a fullridescholarship that is exclusively for black men King has the position of JusticeColumnist at progressive news website Daily Kos and enjoys astrong follower count on Twitter most of whom are a result of hisactivism following the death of Mike Brown in FergusonKing still did not directly answer the simple yes or no question about his ethnicbackground Are you black Instead he said If you have known me fromwhen I was in elementary school at Huntertown Elementary until now youveknown me as black or biracialTurning blackness into a performance is antiblacknessirrespective ofwhether the white person doing it is Rachel Dolezal or Shaun King,78.12,https://www.facebook.com/Black-Matters-1579673598947501/,323.0,47.0,08/24/15 08:27:21 AM PDT,Baltimore Maryland Missouri Cleveland Ohio,Maryland Missouri Ohio,2015-08-24
1167,167,We do not want to fit into racist negative stereotypes that America has placeon us We are so tired of the government and media putting out the falseimages of black Americans Why blacks are portrayed as brutal andaggressive Can we stop it somehow,495.92,https://www.facebook.com/Black-Matters-1579673598947501/,4386.0,468.0,09/01/15 07:38:20 AM PDT,Baltimore Maryland Missouri Cleveland Ohio,Maryland Missouri Ohio,2015-09-01
1168,168,This is enough police officers No more Eric GartnersMore than twenty protesters organized by the Mass Action Against PoliceBrutality group are calling for a further investigation into videotaped incidentthat took place in Washington Street in Roslindale Nearly threeminutevideotape posted to Youtube shows Boston Police officer earlier this monthchoking an yearold Elvin Vargas and attempting to put him in a cruiserafter he was arrested on AugustHave you noticed than excessive force by police is disproportionate on peopleof color When the government law enforcement the criminal justice systemwill treat all communities with dignity How long should we complain aboutthreats against our lives As the ability to record police activity has becomemore widespread can we achieve justice,124.29,https://www.facebook.com/Black-Matters-1579673598947501/,728.0,81.0,09/01/15 07:37:52 AM PDT,Baltimore Maryland Missouri Cleveland Ohio,Maryland Missouri Ohio,2015-09-01
1169,169,Jamycheal Mitchell Mentally III Criminalized and Killed by the SystemStories like the one of Jamycheal Mitchell the yearold young man whowas found dead in his jail cell on Augustare particularly hard to hearWhat the police ruled natural causes turned out to be that he starved todeath The crime Shoplifting Mitchell who had a severe mental illness hadbeen ruled permanently disabled and was unable to work In April he stole azebra cake a Snickers and Mountain Dew from a localin PortsmouthVirginia It would be a month before he ever went before a judgeA judge then ruled him incompetent to stand trial He should have beentransported to a local mental health facility but he wasnt Apparently therewasnt one that had room for him Three months later he was found dead inhis cell No meds had ever been administered He had never made it to amental health facility He had lost nearlypounds because he refused toeat All for less thanworth of snacks he stole while in a mental healthcrisisYes you can die overdollars here in America Nothing new here Justice isjust an empty word in this country Be sure you will never know the truth Weare far away from the truth,269.69,https://www.facebook.com/Black-Matters-1579673598947501/,1209.0,135.0,09/09/15 08:07:30 AM PDT,Baltimore Maryland Missouri Cleveland Ohio,Maryland Missouri Ohio,2015-09-09
1170,170,All lives matter All lives mattered during slavery too All lives mattered duringsegregation too All lives mattered during apartheid too All lives alwaysmatter But there are situations where some lives are focused more on duringthat time Not because they matter MORE but because theyre not put on anequal playing field not treated the same way and are treated like theyrelessmatter less,7.74,https://www.facebook.com/Black-Matters-1579673598947501/,56.0,8.0,09/09/15 08:06:58 AM PDT,Baltimore Maryland Missouri Cleveland Ohio,Maryland Missouri Ohio,2015-09-09
1171,171,The real enemy is around us Watch out,11.01,https://www.facebook.com/Black-Matters-1579673598947501/,53.0,12.0,09/09/15 08:06:26 AM PDT,Baltimore Maryland Missouri Cleveland Ohio,Maryland Missouri Ohio,2015-09-09
1172,172,Because They Lack Crucial Training These Cops Severely Beat a BlindAutistic Teen UnconsciousDuring the incident Abramssuffered two seizures after police used forceagainst him at the Green Lines Lexington Parkway StationThe teen suffers from Aspergers syndrome which causes him to stronglydislike being touched or having people in his person space and is consideredlegally blind wearing extremely magnified glassesOfficers thought the noncompliance of Abrams was reason enough to justifyforcibly taking him down which resulted in him being battered and leftunconsciousAbrams noncompliance wasnt done out of malice but out of not reallyunderstanding the situation and believing he hadnt done anything wrongAbrams autism makes it extremely difficult for him to interpret the intentionsor feelings of others according to his mother Police released the teen to thecustody of his mother rather than take him to the juvenile detention facilityPolice are trained to think like the military in combat which means theyprioritize their own safety and the safety of fellow officers over everythingelse including that of the citizens they allegedly protect and serve,143.57,https://www.facebook.com/Black-Matters-1579673598947501/,766.0,91.0,09/09/15 08:05:55 AM PDT,Baltimore Maryland Missouri Cleveland Ohio,Maryland Missouri Ohio,2015-09-09
1173,173,Think about this for a second My house is on fire with my entire family insideI make it out and scream for help My neighbor grabs the water hose andsprays his house which isnt on fire Then tells me all houses matter,217.15,https://www.facebook.com/Black-Matters-1579673598947501/,929.0,86.0,09/09/15 08:05:34 AM PDT,Baltimore Maryland Missouri Cleveland Ohio,Maryland Missouri Ohio,2015-09-09
1174,174,Innocent Bystanders Could Face Criminal Charges for Not Jumping in to HelpOfficer Make ArrestResidents of Huntsville Alabama who declined to intervene to help a policeofficer subdue a suspect could face criminal prosecution under a state statuterequiring them to assist an officer in trouble Had the situation been reversedhowever police officers would face neither criminal nor civil prosecution fordeclining to aid a citizen under assault by a suspectA man named Devonte Conerly who was suspected in a hit and run incidentallegedly tried to disarm the police officer who stopped him Several officersresponded to a call for assistance and eventually subdued and handcuffedConerly They then rebuked several bystanders who had declined tointerveneBystanders are not liable to prosecution if the failure to render aid wasreasonable under the circumstances but the burden of demonstrating thatthis is the case is placed upon the accusedWhen youll see a bunch of cops beating an unarmed man dont forget thatyou can be in his place just for not helping cops in committing a crime,294.06,https://www.facebook.com/Black-Matters-1 579673598947501/,759.0,91.0,09/09/15 08:05:05 AM PDT,Baltimore Maryland Missouri Cleveland Ohio,Maryland Missouri Ohio,2015-09-09
1175,175,Racism is still a stumbling block between black and white Americans,294.63,https://www.facebook.com/Black-Matters-1579673598947501/,922.0,119.0,09/09/15 08:04:38 AM PDT,Baltimore Maryland Missouri Cleveland Ohio,Maryland Missouri Ohio,2015-09-09
1176,176,We wont apologize for our blackness Its not our duty to do that Black isbeautiful Beautiful is forever and it makes us to be proud We will carry it withus everywhere and forever We dont care if the government doesnt want toaccept the fact that we are stronger than we were before We dont care if thegovernment doesnt see our problems We can build our history on our ownbecause we are stronger by nature,287.16,https://www.facebook.com/Black-Matters-1579673598947501/,89.0,7.0,09/09/15 08:04:12 AM PDT,Baltimore Maryland Missouri Cleveland Ohio,Maryland Missouri Ohio,2015-09-09
1177,177,Know your rights and your freedomThe murders of Michael Brown Tryvon Martin Freddie Gray Eric Gartnerand other black victims have dramatized depth of racism in America societyThey were young and Black that was enough for police officers to decide thatthey looked suspicious The police brutality has sparked the movement andhas emerged to demand justice and political attention However the everydayracism we see was not understood but ignored Moreover the governmentalong with the law enforcement violate our rights through the illegal use offorce and mass arrests in order to obstruct our free expressionYes standing up for your right to protest for the equality and justice ischallenging but its worth discrimination and unfairness black civilians faceeveryday Remember knowing your rights can be the most powerful weaponyou have against police abuse and brutalityThe most famous civil rights activists represent a basic philosophy known fortheir fight against injustice and lasting profound impact in the lives of AfricanAmericans Martin Luther King Jr Malcolm X Mary McLeod Bethune RosaParks changed our lives foreverBut what changes have you made Have you contributed to a greaterequality What are you doing to fight against injustice and racism Have youever protested in civil rights protests or have you ever been part of BlackLives Matter movement How do your protect your right to free expressionPlease comment below what have YOU done to prove BLACK LIVESMATTER,2.59,https://www.facebook.com/Black-Matters-1579673598947501/,17.0,0.0,09/23/15 02:52:24 AM PDT,Baltimore Maryland Missouri Cleveland Ohio,Maryland Missouri Ohio,2015-09-23
1178,178,What progress have we made towards eliminating racial profiling Who istrying to damage the stereotypes of African Americans How many black menhave died for minor crimes at the hands of the police officers,800.0,https://www.facebook.com/Black-Matters-1 579673598947501/,7341.0,541.0,10/09/15 07:01:29 AM PDT,Baltimore Maryland Missouri Cleveland Ohio,Maryland Missouri Ohio,2015-10-09
1179,179,WEAR BLACK FIGHT BACK CHALLENGE FOR OUR SUBSCRIBERSOctober nd is one of the most important days for all of us Fromonward people around the country have mobilized for a National Day ofProtest to stop police brutality repression and the criminalization of agenerationThe powerful National Day of Protest will be brought in cities and towns allacross the country Lets make history together Its time to stand up for ourrights and our freedomOur community has a challenge for you guys All you need to do iswear blacktake a picture of yourself during or right beforeafter this eventsend it to us Simple as thatWe will post all the pictures on our page so that the whole African Americancommunity will know about you and your effortsIts really important for us to know were united Its important for us to knowwe care about our futureBlack Matters will appreciate your efforts tooCheck the official website to find an event in your area,2998.22,https://www.facebook.com/blackmattersus/,11134.0,1016.0,10/21/15 07:59:43 AM PDT,Baltimore Maryland Missouri Cleveland Ohio,Maryland Missouri Ohio,2015-10-21
1180,180,Help us spread their shame Anonymous unhoods the KKK prominentpoliticiansUS Senators Thom Tillis RNC John Cornyn RTx Dan CoatsRInand Johnny Isakson RGaUS mayors Madeline Rogero of Knoxville Tennessee Jim Gray of LexingtonKentucky Paul D Fraim of Norfolk Virginia Kent Guinn of Ocala Floridaand Tom Henry of Fort Wayne IndianaAs long as there are the KKK members in the government racism in thecountry will prosper They should resignIf you want to stop this madness take a minute to sign the petitionaushouseofrepresentativesussenatelistthekukluxklanasanofficialterroristorganizationWe need aroundsigns to reachThe KKK should be labeled asa terrorist groupShare this with your friends and ask them to sign the petitionYour efforts will be appreciated Its time to make a change,3000.0,https://www.facebook.com/blackmattersus/,22670.0,1781.0,11/06/15 06:50:26 AM PST,Baltimore Maryland Missouri Cleveland Ohio,Maryland Missouri Ohio,2015-11-06
1181,182,Theill attract the UNs attention to the long terminjustice and cruelty against people of color in the United States Thegenocide instituted by white supremacists should be stoppedJoin our protest that will be heldAlso join the event for more infoCrimesOfGenocide,1550.0,https://www.facebook.com/blackmattersus/,4529.0,221.0,02/09/16 05:40: 15 AM PST,New York,New York,2016-02-09
1182,184,Officer Liang who fatally shot yearold Akai Gurley was found guilty ofmanslaughter assault and other criminal chargesRead moreandothercharges,1.5,https://www.facebook.com/blackmattersus/,10457.0,1000.0,02/12/16 07:09:39 AM PST,New York,New York,2016-02-12
1183,185,yearold Mario Woods was killed by the San Francisco police onDecember An autopsy released on Thursday shows that Mario was hittimes by officers bullets Sixteen of the wounds were said to have gone fromback to front through Woods body including six in his back and two in theback of his headRead morebulletsrecoveredfrombodyofmariowoodsautopsyreportsshow,1500.0,https://www.facebook.com/blackmattersus/,16684.0,1237.0,02/12/16 07:01:48 AM PST,New York,New York,2016-02-12
1184,186,Formation undoubtedly focuses on black identity as Beyonce justifiesher authority as a proud Black woman and concurrently authenticating herroots and historyRead mored ivabegoespoliticalwithherform ation,461.96,https://www.facebook.com/blackmattersus/,1590.0,180.0,02/12/16 12:36:07 AM PST,New York,New York,2016-02-12
1185,187,ATTENTION NEWYORKWe need your support Well provide you with free food and coffee Come andbring your friendsJoin the FB event for more details,4.3,https://www.facebook.com/blackmattersus/,5.0,0.0,02/18/16 05:46:32 AM PST,New York,New York,2016-02-18
1186,189,ATTENTION NEWYORKWe need your support Well provide you with free food and coffee Come andbring your friendsJoin the FB event for more details,0.0,https://www.facebook.com/blackmattersus/,,,02/18/16 05:09:11 AM PST,New York,New York,2016-02-18
1187,190,ATTENTION NEWYORKWe need your support Well provide you with free food and coffee Come andbring your friendsJoin the FB event for more details,1386.19,https://www.facebook.com/blackmattersus/,3466.0,353.0,02/18/1605:12:00 AM PST,New York,New York,2016-02-18
1188,191,A yearold boy dies after being shot multiple times in West Baltimore ABaltimore teenager died Monday morning shortly afteram after beingshot several times on a street corner less than two miles from his old highschool Baltimore Suns crime reporter Kevin Rector said that an officer in theblock of West Baltimore street s heard multiple gunshots comin TeenFatally Shot In West Baltimore I Black Matters Black Matters,4.18,https://www.facebook.com/Black-Matters-1579673598947501/,5.0,2.0,03/04/16 12:46:32 AM PST,New York,New York,2016-03-04
1189,192,As what happened to India while in police custody remains a major concernmany are wondering why the yearold was denied an appropriate medicalevaluation and proper care The frequent reports of police brutality andextreme use of force leading to death has regrettably become a daily courseConsequently protests and demonstrations overflow in every nook andcranny demanding answers and justice On FebruaryIndia T Cummingswas under the influence of the synth JusticeForindia Yearold DeniedMedical Treatment Dies in Police Custody I Black Matters Black Matters,2.89,https://www.facebook.com/Black-Matters-1579673598947501/,7.0,0.0,03/04/16 12:4&00 AM PST,New York,New York,2016-03-04
1190,193,yearold Lane Durham from Oklahoma is facing up toyears ofconfinement for sexual harassment when he volunteered as a missionary inKenyaAll I wanted was to follow Gods plan for meDurham told before courtpleading for mercy In JuneMatthew Durham came under nationalspotlight when he was accused of raping and molesting several young blackgirls and boys in an orphanage in Kenya Now yearold Lane Durhamfrom Oklahoma is facing up toyears of confinement for sexualharassment when he volunteered as a missiYears For Sexually AbusingKenyan Orphans Isnt Enough I Black Matters Black Matters,20.09,https://www.facebook.com/Black-Matters-1579673598947501/,20.0,1.0,03/10/16 04:13:40 AM PST,New York,New York,2016-03-10
1191,194,Sean Chungwas sent to Rikers Island last month because of a musicvideo he posted in November The last thing you would imagine someone willgo to jail for is their rap lyrics Afterwards this is Americathe Land of theFree and home of the Brave The country where artists like IceT and IceCube can sing about killing cops and win multimillion dollar record dealsIm bout to dust som A Blatant Disregard For The First AmendmentYoung Rapper Jailed For Lyrics I Black Matters Black Matters,383.97,https://www.facebook.com/Black-Matters-1579673598947501/,1818.0,150.0,03/10/16 04:12:29 AM PST,New York,New York,2016-03-10
1192,195,Family members of India Kager will receive the video of India and Angelosshooting today March th On Marchwomen all over the world celebratedheartily the pride in being a woman But in the case of Gina she only wishesthe justice to be served Ginas grieving ever since the death of her daughterIndia Kager along with Angelo Perry Indias boyfriendhas been escalatedby an attorneys de Gina Kager Receives The Video Of Indias DeathBlack Matters Black Matters,199.96,https://www.facebook.com/Black-Matters-1579673598947501/,393.0,32.0,03/11/16 01:52:05 AM PST,New York,New York,2016-03-11
1193,196,A narcotics detective who abused his power in the past was shot in theshoulder by his fellow officer Its time to reap what you sow The day beforeyesterday an unidentified police sergeant accidentally shot Jon Gladstone anarcotics detective while firing at two unarmed drug dealers in Brooklyn Thedrug dealers were surrounded by these two undercover cops It happenedwhile the criminals were sitting in a parked van When the NYPD Cop ShotAnother Cop During A Drug Bust I Black Matters Black Matters,400.0,https://www.facebook.com/Black-Matters-1579673598947501/,1829.0,184.0,03/11/16 01:51:39 AM PST,New York,New York,2016-03-11
1194,197,The VA State Attorney Colon Stolle sees no law violation in Virginia Policeactions The VA State Attorney Colon Stolle on Wednesday gave a verdictconcerning the four Virginia Police Officers who were involved in the shootingof India Kager at a press conference He is sure that they didnt violate thelaw and shouldnt be prosecuted During the press conference a minutevideo of No Charges For VA Beach Police For Killing India Kager I BlackMatters Black Matters,0.68,https://www.facebook.com/Black-Matters-1579673598947501/,5.0,0.0,03/11/16 01:51:03 AM PST,New York,New York,2016-03-11
1195,198,The family of Luis Martinez wants Dist Attorney Jackie Lacey to file chargesagainst the police officers who were involved in the fatal shooting of a yearold man On AprilHollenbeck Division patrol officers were called byMartinezs wife reporting that her husband Luis Martinez had stabbedhimself Luis Martinez was a yearold man with a broken hip from fallingover a railing from the third floor of his apartment Martinezs injuries were sosev Family Seeks Charges Against LAPD Involved in Fatal Shooting Of AMan I Black Matters Black Matters,1.88,https://www.facebook.com/Black-Matters-1579673598947501/,4.0,0.0,03/11/16 01:50 37 AM PST,New York,New York,2016-03-11
1196,199,The mother of Tamir Rice wants to inspire young activists to rally against asystem that is stacked against communities of color Samaria Rice themother of yearold Tamir Rice who was fatally shot by officer TimothyLoehmann inwill address police brutality and other important issues atKalamazoo College in Michigan on Wednesday She wants to speak out atthe college in order to inspire students to stand up against Samaria Rice ToSpeak At Michigan College I Black Matters Black Matters,1000.0,https://www.facebook.com/Black-Matters-1579673598947501/,3484.0,320.0,03/11/16 01:49:33 AM PST,New York,New York,2016-03-11
1197,200,Since history men have developed fetishes on the curve body figures of blackwomen making them feel like sex objects Alessandrai Rhines explains why itis wrong to use black women as experiments Since history men havedeveloped fetishes on the curve body figures of black women making themfeel like sex objects Black women have been made to feel like they are highlysexualized beings since slavery Poet Alessandria Rhines performed atButton Poetry Live in Januaryexplaining in her p Alessandrai RhinesExplains Why It Is Wrong To Use Black Women As Experiments I BlackMatters Black Matters,200.0,https://www.facebook.com/Black-Matters-1579673598947501/,359.0,29.0,03/11/16 01:48:30 AM PST,New York,New York,2016-03-11
1198,201,Marylands Highest Court on Tuesday ordered a Baltimore police officer totestify against his colleagues who were also charged with Freddie Graysdeath Baltimores police officer William Porter is set to testify against hiscolleagues who sort the death of Freddie Gray under the grant of limitedimmunity which means that what he says cant be used against him duringhis own trial as the court ordered The Court of Appeals gave no reason forthe d Second Freddie Gray Trial Said Officer Must Testify Against CoDefendants I Black Matters Black Matters,144.32,https://www.facebook.com/Black-Matters-1579673598947501/,391.0,39.0,03/10/16 04:07 33 AM PST,New York,New York,2016-03-10
1199,202,University of Missouri assistant communications professor is appealing herfiring last month over her role in racism protests last year Melissa Click whowas caught on tape cursing student journalists and also police officers duringprotest last year stated on Tuesday that her dismissal on Febbyuniversity system curators was unprofessional In their decision to terminatemy employment the curators bowed to conservative voi Missouri ProfessorDismissed Over Misconduct Files Appeal I Black Matters Black Matters,7.47,https://www.facebook.com/Black-Matters-1579673598947501/,7.0,0.0,03/10/16 04:07:22 AM PST,New York,New York,2016-03-10
1200,203,A seventhgrade student at a private school in Hopewell Virginia was told byschool administrators he must remove his dreadlocks if he wanted to stay inthe school A seventhgrade student at a private school in Hopewell Virginiawas told by school administrators he must remove his dreadlocks if he wantedto stay in the school Isaiah Freemanhas had dreadlocks at the WestEnd Christian School since third grade It therefore came as a surprise to hisfa SeventhGrader Told To Cut Dreadlocks Or Leave The School I BlackMatters Black Matters,145.67,https://www.facebook.com/Black-Matters-1579673598947501/,432.0,42.0,03/10/16 04:07 06 AM PST,New York,New York,2016-03-10
1201,204,She didnt only win the women champions against Maria Sharapova lastyear but now she is on her way to being the highest paid On the fact of itAmerican sports are dominated by Black Americans Talk of BasketballSoccer American football Athletics and the like we have represented thenation on an international level and almost always brought glory to this nationThis is because Black culture has imbibed into us drive Serena Williams WillBe Worlds Highest Paid Female Athlete I Black Matters Black Matters,3.4,https://www.facebook.com/Black-Matters-1579673598947501/,19.0,2.0,03/14/16 06:11:54 AM PDT,New York,New York,2016-03-14
1202,205,Unrepentant hateful Trump supporter enjoyed sucker punching black man atrallyncrallynexttimewemighthavetokillhim Following statements from hisemperor saying hed like to punch a protester in the face Donald Trumpsupporter John McGrawwas caught on video sucker punching a blackman during a rally Wednesday in Fayetteville North Carolina Videos postedto social media showing several angles of McGraws Trump Supporter WhoPunched Black Man at NC Rally Next Time We Might Have to Kill HimBlack Black Matters,5.46,https://www.facebook.com/Black-Matters-1579673598947501/,10.0,0.0,03/14/16 06:11:31 AM PDT,New York,New York,2016-03-14
1203,206,A St Paul Police sergeant who posted on Facebook run them over aboutBLM protesters wont face any criminal chargesfree The sergeant Jeffrey Rothecker in his Facebook comment referred toprotesters as idiots He wrote about how drivers could even escape charges ifthey ever killed any of the protesters during protests He out smarted thepolice department and resigned before any disciplinary actions were takenThe Police Says Run Them Over And Goes ScotFree I Black MattersBlack Matters,11.77,https://blackmattersus.com/4678-police-says-run-them-over-and-goes-scot-,15.0,0.0,03/14/16 06:11:09 AM PDT,New York,New York,2016-03-14
1204,207,Trump said You know Barack ObamaAfricanAmericanif I were AfricanAmerican I would be so angry at him I will do more for the AfricanAmerican people in one year than Barack Obama has done in his sevenyears soon to be eight years and then by the way hes out and thankgoodness OK The controversial Trump has made so many promisesespecially to AfricanAmericans during his recent campaigns Some of thesepromises include Trump saying Im going to unify the country Trump toldthousands of people at a rally in this suburb of Detroit Im going to unifyblacks and whites A Donald Trumps Promises to AfricanAmericansBlack Matters Black Matters,7.71,https://www.facebook.com/Black-Matters-1579673598947501/,45.0,5.0,03/14/16 06:10:15 AM PDT,New York,New York,2016-03-14
1205,208,Governor of the State of Mississippi has proclaimed the month of Aprilas Confederate Heritage Month We dont want to honor racism slavery andhatred Yet this is what Confederate Heritage is The Confederate flag isAmericas most potent symbol of white supremacy Symbols of hate have noplace in our governmentJoin our Not My Heritage Rally atpm on March thMississipi stJackson MississipiMore info,2.21,https://www.facebook.com/blackmattersus/,21.0,0.0,03/18/16 07:54:09 AM PDT,Jackson Mississippi,Mississippi,2016-03-18
1206,209,Wakiesha Wilsonwas found dead on Easter Weekend at the LAPDsdetention center in jail cell According to ABC report the black womanWakiesha Wilson had a disagreement with officers before she was founddied Wilson spoke to her lovely family that v Black Woman Found Dead InJail Cell After Arguing With Detention Officers I Black Matters Black Matters,3.5,https://blackmattersus.com/6189-black-woman-found-dead-in-jail-cell-after-,18946.0,1276.0,04/06/16 08:48:17 AM PDT,Atlanta Georgia,Georgia,2016-04-06
1207,210,Bill Clinton angrily tells Black Lives Matter protesters that they are defendingthe people who kill the lives you say matter Finally the Clintons are showingtheir true colors On Thursday former President Bill Clinton gave Black LivesMatter protesters another reason to be cautious of Hillary On the campaigntrail for Hillary in Phil Bill Clinton Confronts Black Lives Matter ProtestersBlack Matters Black Matters,1.0,https://www.facebook.com/Black-Matters-1579673598947501/,20386.0,2363.0,04/08/16 08:21:47 AM PDT,,,2016-04-08
1208,211,Atlanta Hawks forward Sefolosha files a civil lawsuit againstNYPD officersfor breaking his leg Atlanta Hawks forward Thabo Sefolosha filed a civillawsuit against five New York Police Department officers and the city onWednesday in relation to an inciden NBA Star Sues NYPD Over False ArrestExcessive Force And Malicious Prosecution I Black Matters Black Matters,900.0,https://www.facebook.com/Black-Matters-1579673598947501/,2441.0,197.0,04/08/16 07:30:09 AM PDT,Atlanta Georgia,Georgia,2016-04-08
1209,212,Jay Z and Beyonce stood with families of police brutality victims donated bailfor Baltimore and Ferguson protesters The neverending cases of policebrutality and statesanctioned violence against Black peoplethe mostprominent being the police slaying of Michael Brown Er Musics BillionDollarCouple Help Raise Awareness Of Race And Police Brutality I Black MattersBlack Matters,300.0,https://www.facebook.com/Black-Matters-1579673598947501/,1112.0,120.0,04/07/16 08:20:46 AM PDT,Atlanta Georgia,Georgia,2016-04-07
1210,213,Daniel Willis a former deputy police officer in Texas has been cleared ofmurder charges in the fatal shooting of a yearold black mom Theunarmed black woman Yvette Smith was shot to death on Februaryat her front door by Officer Daniel Willis who was supposed to calm a disputebetw Texas Police Officer Found Not Guilty For Killing A Black Woman I BlackMatters Black Matters,3500.0,https://blackmattersus.com/6411-texas-police-officer-found-not-guilty-for-,55630.0,6706.0,04/11/16 01:37:15 AM PDT,,,2016-04-11
1211,214,A Texas district police officer Joshua Kehm has been fired for brutalizing asixth grader Janissa Valdez at Rhodes Middle School According to reportstwo preteens were arguing outside the school campus on Tuesday Marchand Officer Kehm was called to calm the situation When the Office PoliceOfficer Fired For BodySlamming YearOld Girl I Black Matters BlackMatters,500.0,https://www.facebook.com/Black-Matters-1579673598947501/,6143.0,1030.0,04/14/16 01:22:25 AM PDT,,,2016-04-14
1212,215,A yearold AfricanAmerican Pierre Loury was fatally shot by a Chicagopatrol officer on Monday AprilIt was aroundpm and Officers wereon their patrol routine hunting down black men for crimes They saw PierreLoury in a vehicle matching a description o Police Officer Fatally Shoots BlackTeenager And Lies About His Death I Black Matters Black Matters,500.0,https://www.facebook.com/Black-Matters-1579673598947501/,7772.0,1145.0,04/14/16 01:22:07 AM PDT,,,2016-04-14
1213,217,A report recently revealed that the jail in which Sandra Bland had been keptwas seriously suffering from consistent violations of inmates rights In Julylast year Sandra Bland a yearold black woman was pulled over by a copfor traffic violation officer brutally arrested her and brought to the jail SeriousProblems Discovered At County Where Sandra Bland Died I Black MattersBlack Matters,1000.0,https://www.facebook.com/Black-Matters-1579673598947501/,13808.0,2097.0,04/14/16 01:21:05 AM PDT,,,2016-04-14
1214,218,The Baton Rouge,3.708,https://blackmattersus.com/6948-officers-violently-beat-and-arrest-teen-just-,37267.0,3856.0,04/21/16 02:03:04 AM PDT,,,2016-04-21
1215,219,Ruffins is filing charges against NYPD cops who responded to a call bysecurity claiming Ruffins kicked a door at New years inThe disabledRuffin was s Blind Black Veteran Humiliatingly Ruffed By Cops Files ChargesBlack Matters Black Matters,4.71,https://www.facebook.com/Black-Matters-1 579673598947501/,13.0,0.0,04/21/16 02:02:45 AM PDT,,,2016-04-21
1216,220,Bernie Sanders has proven himself to be the best candidate in every way Heis fair and strong and he is the only one fighting for the black community Formore thanyears he is advocating against any injustice and stays true tohis moral values Vote for Bernie,2786.36,https://www.facebook.com/Black-Matters-1579673598947501/,46437.0,5607.0,04/21/16 02:02:13 AM PDT,,,2016-04-21
1217,221,The Atlanta police department reported that the driver Ryan Lisabeth was ontop speed to Joseph E Boone Boulevard on Friday when he lost control onhis steer Atlanta Driver On Drugs InjuresBlack Children KillinginAccident I Black Matters Black Matters,8.78,https://www.facebook.com/Black-Matters-1 579673598947501/,14.0,0.0,04/21/16 12:22:59 AM PDT,,,2016-04-21
1218,222,Hunter Park pleaded guilty to making terrorist threats against Black studentsat the University of Missouri A white male form Missouri has pleaded guilty tomaking online threats toward black students at the University of Missouri afteruniversitys president ste Missouri Man Pleads Guilty To Threatening BlacksAt University I Black Matters Black Matters,6.65,https://www.facebook.com/Black-Matters-1579673598947501/,32.0,4.0,04/21/16 02:01:32 AM PDT,,,2016-04-21
1219,223,A white cop slammed Tionne Jonesto the ground and dragged him fromhis home after he rightfully requested a warrant A white police officer inBaltimore was caught on video violently dragging a Black teen out of hishome The incident occurred on Saturday Aprilwhen ye BaltimoreCop Drag Black Teen From Home Without Warrant I Black Matters BlackMatters,1838.25,https://blackmattersus.com/6980-baltimore-cop-drag-black-teen-from-home-,17376.0,2083.0,04/21/16 12:22:05 AM PDT,,,2016-04-21
1220,224,Chicago police testified there was no surveillance camera in the alley wherethey arrested Jermaine Walkerbut there was A Chicago man who spentyears in jail on drug charges has been set free after an investigationproved that police officers and a states attorney investiga Man Set Free AfterYears In Prison Because Police Lied In Court I Black Matters BlackMatters,1804.5,https://blackmattersus.com/6984-man-set-free-after-10-years-in-prison-,20280.0,2034.0,04/21/16 12:21:47 AM PDT,,,2016-04-21
1221,225,The Daily Beast reported that a black veteran Elliot Williamsencountered a painful death in jail cell without help from jail officials as theywatched hi Oklahoma Cops Left Black Army Veteran To Die In Jail CellBlack Matters Black Matters,7.51,https://www.facebook.com/Black-Matters-1579673598947501/,58.0,9.0,04/21/16 12:21:22 AM PDT,,,2016-04-21
1222,226,AfricanAmerican protest groups gathered on Wednesday ApriloutsideMayor Rahm Emanuels City Hall demanding that Officer Dante Servin befired Its been over four years since an offduty Chicago police officer DanteServin fatally shot a yearold black woman in Douglas Park According tosources Protesters Demand Firing Of Officer Who Killed Rekia Boyd I BlackMatters Black Matters,27.79,https://www.facebook.com/Black-Matters-1579673598947501/,139.0,20.0,04/22/16 03:15:27 AM PDT,,,2016-04-22
1223,227,A quiet and nice yearold girl who kept to herself is dead after anassault at Delaware high school A teen girl died after she was assaulted ather Delaware high school authorities said The th grader who has beenidentified as Amy Inita JoynerFrancis wa TRAGIC Teen Girl Beaten ToDeath In High School Bathroom I Black Matters Black Matters,3.308,https://www.facebook.com/Black-Matters-1579673598947501/,29056.0,3293.0,04/25/16 05:37:03 AM PDT,,,2016-04-25
1224,228,Jaden Malones mom has removed him from the NC charter school over hissuspension for pushing bully off him A furious Charlotte NC mother haspulled her son out from the Invest Collegiate Charter School over hissuspension for defending himself against a bully WJ YearOld BoySuspended From School For Standing Up To Bully I Black Matters BlackMatters,45.23,https://www.facebook.com/Black-Matters-1579673598947501/,458.0,56.0,04/25/16 05:25:40 AM PDT,,,2016-04-25
1225,229,Prince Rogers Nelsons contributions to help lowincome black children willbe forever remembered The yearold music legend commonly known asPrince who died on Thursday Aprilis remembered in Silicon Valley as aninnovator and a passionate advocate Music Icon Prince Remembered As,1.782,https://www.facebook.com/Black-Matters-1579673598947501/,11249.0,1590.0,04/26/16 12:10:23 AM PDT,,,2016-04-26
1226,231,Several antiracist organizations including Black Matters stood up againstwhite supremacists who staged the rally at Stone Mountain Park on AprilHundreds of neonazis and klansmen attended an openly White Power rallyat Stone Mountain on Saturday According to SPLC the racist rally wasorganized by Jo White Pride Rally Was Interrupted by Antiracist GroupsBlack Matters Black Matters,1.159,https://www.facebook.com/Black-Matters-1579673598947501/,7122.0,769.0,04/26/16 12:25:13 AM PDT,,,2016-04-26
1227,232,We need our communitys help we arent interested in rumors or gossipwere looking to find the truth said Ken Mascara St Lucie County Sheriff StLucie County police officers are investigating the fatal shooting of a yearold black motorist Demarcus Semer committed by two officers whose namesareWitnesses Of Police Shooting Demarcus Semer Refuse To TalkBlack Matters Black Matters,1150.11,https://www.facebook.com/Black-Matters-1579673598947501/,8239.0,998.0,04/26/16 12:24:45 AM PDT,,,2016-04-26
1228,233,A yearold black mom Jeannetta Maclin was unjustly jailed over a monthago after her two young boys set their apartment on fire According to reportsMaclin left her two boys aged five and two at home alone that day indesperation to make ends meet She works endlessly on a lowpaid jobStruggling Single Mother Jailed Over Accidental Fire Gets Support I BlackMatters Black Matters,3.198,https://www.facebook.com/Black-Matters-1579673598947501/,20905.0,2427.0,04/25/16 05:30:29 AM PDT,,,2016-04-25
1229,234,When the cameras and lights are gone our babies are dead So Im goingto ask you here today to wake up says late Sandra Blands mom ACongressional Caucus on Black Women and Girls held over the week broughttogether dozens of public figures lawmakers and relatives of Sandra Blandwho was k Sandra Blands Mom Gives Devastating Speech ToCongressional Leaders I Black Matters Black Matters,9.31,https://www.facebook.com/Black-Matters-1579673598947501/,9.0,2.0,04/30/16 08:54:35 AM PDT,,,2016-04-30
1230,235,Beaufort County School District is investigating the case of a white schoolteacher asking a black student to go back to Africa According to reportsNicole Whitmores son who is a freshman in Battery Creek High School wassitting with aboutother students when their teacher instruc White TeacherTells Black Teen To Go Back To Africa I Black Matters Black Matters,500.0,https://www.facebook.com/Black-Matters-1579673598947501/,6349.0,598.0,04/30/16 08:53:55 AM PDT,,,2016-04-30
1231,236,Mrs Clara Belle Williams succeeded despite significant obstacles ofdiscrimination placed upon her while pursuing her higher education,0.0,https://www.facebook.com/Black-Matters-1579673598947501/,0.0,0.0,04/30/16 08:53:02 AM PDT,,,2016-04-30
1232,237,I can tell you right now that the gun looked apercent real Apercent real says Major Deron Garrity Alvin Colvins younger brotherDedric was shot in the leg and shoulder by Baltimore police officer Garrity onWednesday Aprilwhile holding a springairpo Black Teen ConfrontsOfficer Who Shot His Younger Brother While Holding A Toy Gun I BlackMatters Black Matters,1000.0,https://www.facebook.com/Black-Matters-1579673598947501/,19255.0,2132.0,04/30/16 08:52:41 AM PDT,,,2016-04-30
1233,238,A federal court in Illinois ruled on Wednesday that police officers need awarrant to search someones cellphone before making arrest An IllinoisFederal Court has finally spelt out this rule clearly to the cops prior to a caseRiley v California where an Illinois officer was involved in a Court Says CopsNeed A Warrant Even Just To Look At The Screen Of Your Phone I BlackMatters Black Matters,500.0,https://www.facebook.com/Black-Matters-1579673598947501/,6765.0,488.0,04/30/16 08:51:49 AM PDT,,,2016-04-30
1234,240,Minnesota poll shows that majority of the black residents do not side with theHennepin County Attorney and want the two officers involved in the shootingof Jamar Clark to be charged After Hennepin County Attorney MikeFreemans decision not to indict Dustin Schwarze and Mark Ringgenberg theofficers involved in the shooting of the black m Jamar Clark Shooting HasShown How Divided The America Society Is I Black Matters Black Matters,1.67,https://www.facebook.com/Black-Matters-1579673598947501/,2.0,1.0,05/06/16 03:34:25 AM PDT,,,2016-05-06
1235,241,A viral Facebook video shows how an innocent black bystander was attackedby a K dog in a crowd of residents due to an incompetent attitude of a policeofficer An innocent bystander Rafer Allen a black Virginia man was attackedby a K police dog on Saturday after officers were trying to apprehend a drugdealer susp Cop Attacks Innocent Bystander With K I Black Matters BlackMatters,100.0,https://www.facebook.com/Black-Matters-1579673598947501/,950.0,52.0,05/06/16 03:33:49 AM PDT,,,2016-05-06
1236,242,ATTENTION DETROITJustice hasnt been served for Aiyana and her grieving familyJoin our upcoming rallyMaywill mark the sixth anniversary of the brutal slaying of yearoldAiyana StanleyJones by Detroit Police Officer Joe WeekleyThe fight is not over,1.46,https://www.facebook.com/Black-Matters-1579673598947501/,3.0,0.0,05/06/16 03:33:18 AM PDT,,,2016-05-06
1237,243,The teacher also had a confederate flag in his class but the school district stillthinks his intent was not to offend A Black woman from Utah is outraged thather teenage son sat through a class in which a teacher used the nword anddefined its meaning and history Foxrepo Utah School Defends WhiteTeachers Use of the NWord In Class I Black Matters Black Matters,100.0,https://blackmattersus.com/7660-utah-school-defends-white-teachers-use-of-,614.0,57.0,05/06/16 03:32:45 AM PDT,,,2016-05-06
1238,245,Smithsonian Rep denies reports that the museum plans to preserve gazebowhere Tamir Rice died but acknowledged they are helping someone elsewho wants to do it The Smithsonian Museum has issued a statement that theinstitute is not looking into preservation of the gazebo where yearoldTamir Rice was gunned down by Smithsonian Museum Is Not Trying To SaveGazebo Where Tamir Rice Was Shot I Black Matters Black Matters,100.0,https://www.facebook.com/Black-Matters-1579673598947501/,1323.0,54.0,05/06/16 03:31:27 AM PDT,,,2016-05-06
1239,246,Officer Van Dyke needs protection because like every murderer he seesrevenge as a possibility The attorney for a white Chicago police officer whois charged with firstdegree murder in the Octoberfatal shooting of ablack teenager has filed a mot Cop Who Murdered Laquan McDonaldRequests Protection I Black Matters Black Matters,100.0,https://www.facebook.com/Black-Matters-1579673598947501/,817.0,94.0,05/06/16 03:31:06 AM PDT,,,2016-05-06
1240,247,After several flipflops Attorney Anita Alvarez has finally decided to step downfrom the case she never wanted to prosecute Cook County States attorneyhas asked the judge on Thursday to appoint a special prosecutor to take overthe case against the white Chicago police officer who Chicago StatesAttorney Withdraws From Laquan McDonald Case I Black Matters BlackMatters,100.0,https://www.facebook.com/Black-Matters-1579673598947501/,732.0,51.0,05/06/16 03:30:39 AM PDT,,,2016-05-06
1241,248,A District Judge ruled that the former Tulsa volunteer sheriffs deputy whofatally shot an unarmed Black man does not have the right to post bail ATulsa County judge ruled on Tuesday that Robert Bates the formerOklahoma volunteer sheriffs deputy convicted of manslaughter in the fatalshooting of an un Convicted ExOklahoma Reserve Deputy Denied BailBlack Matters Black Matters,100.0,https://www.facebook.com/Black-Matters-1579673598947501/,1378.0,115.0,05/06/16 01:01:42 AM PDT,,,2016-05-06
1242,249,Prosecutors in Baltimore are pushing to bring criminal charges against copswho stopped Freddie Gray without probable cause A novel theory whichProsecutors in Baltimore are expected to try in the trial of a police officercharged in the arrest and death of Freddie Gray states that BaltimoreProsecutors Officers Should Be Charged For Making Illegal Arrests I BlackMatters Black Matters,376.7,https://www.facebook.com/Black-Matters-1579673598947501/,2045.0,180.0,05/10/16 07:00:38 AM PDT,,,2016-05-10
1243,250,The officers choked Maurice Marrow causing him to faint despite his criesabout an imminent seizure A video taken by a New York City train ridershows cops brutally beating a Black man into seizure and fainting on Fridaymorning at Halsey St station in Bushwi Watch How Officers Beat BlackBrooklyn Man Into Seizure I Black Matters Black Matters,367.26,https://www.facebook.com/Black-Matters-1579673598947501/,2060.0,147.0,05/10/16 07:00:12 AM PDT,,,2016-05-10
1244,251,American empathy becomes visible when the most vulnerable are whitepeople Americas opiate epidemic has changed the rhetoric on drug abusefrom mass incarceration to therapeutic and rehabilitative approaches but notbecause political White,369.7,https://www.facebook.com/Black-Matters-1579673598947501/,3797.0,292.0,05/10/16 06:59:47 AM PDT,,,2016-05-10
1245,252,Alabama inmates have organized a coordinated prison strike to protestagainst slave labor and deplorable prison conditions Three inmates insolitary confinement organized a statewide prison strike which began onMayat Alabamas Holman Staton and Elmore Correctional Facil AlabamaInmates Organize MultiPrison Strike Against Deplorable Prison ConditionsBlack Matters Black Matters,433.08,https://www.facebook.com/Black-Matters-1579673598947501/,3063.0,250.0,05/10/16 02:25:09 AM PDT,,,2016-05-10
1246,253,While in solitary confinement Candie Hailey was physically and sexuallyabused by prison guards leading to her numerous suicide attempts CandieHailey a Bronx woman who spent more than two years in solitaryconfinement at Rikers Island before being acquitted is preparing amillionlawsuit Woman Suing City After Spending More ThanYears In SolitaryBlack Matters Black Matters,440.58,https://www.facebook.com/Black-Matters-1579673598947501/,3563.0,277.0,05/10/16 02:24:35 AM PDT,,,2016-05-10
1247,255,Life expectancy rate for AfricanAmericans increases but they still die fromAIDS heart diseases cancer and homicides at a higher rate than whitesRecently released federal data brings some good news of gains in lifeexpectancy for black Americans amid controversies of whether black lives areas valued as Life Expectancy For Black Americans Increase I Black MattersBlack Matters,217.98,https://www.facebook.com/Black-Matters-1579673598947501/,1028.0,94.0,05/10/16 02:23:50 AM PDT,,,2016-05-10
1248,256,The system is wrong weve got to be strong Aiyana Jones she has a nameher family is not to blameCome join our rally on Mayin Detroit,11.93,https://www.facebook.com/Black-Matters-1579673598947501/,37.0,10.0,05/10/16 06:58:42 AM PDT,,,2016-05-10
1249,258,Unprecedented news A Michigan police officer has filed a lawsuit againstMundy Township and his own police department claiming that they pressuredhim to portray a former NBA player and Michigan State basketball star guiltyin a sexual assault case Officer Brian Ogle filed the suit against his ownPolice Department on Mayaccording to The Detroit News In his lawsuitOgle claims he was pressured to Black Officer Stands Against His PD toDefend Black Suspect I Black Matters Black Matters,200.0,https://www.facebook.com/Black-Matters-1579673598947501/,1143.0,87.0,05/13/16 06:42:02 AM PDT,,,2016-05-13
1250,259,The federal grand jury brought charges against Michael Slager in Walter Scottshooting This Wednesday the court decided to bring three federal chargesagainst Officer Michael Slager who according to the video recorded by anonlooker shot and Michael Slager Will Not Escape Justice I Black MattersBlack Matters,250.0,https://www.facebook.com/Black-Matters-1579673598947501/,1634.0,167.0,05/13/16 06:40:54 AM PDT,,,2016-05-13
1251,261,Opinions are split depending on the race a poll proves,200.0,https://www.facebook.com/Black-Matters-1579673598947501/,802.0,54.0,05/13/16 06:39:38 AM PDT,,,2016-05-13
1252,262,Second Officers trial in Freddie Gray case starts in Baltimore,200.0,https://www.facebook.com/Black-Matters-1579673598947501/,1063.0,56.0,05/13/16 06:39:10 AM PDT,,,2016-05-13
1253,263,Darrick McDuffie sufferedday in prison for a crime he didnt commit,166.94,https://www.facebook.com/Black-Matters-1579673598947501/,1791.0,159.0,05/13/16 06:38:36 AM PDT,,,2016-05-13
1254,264,Two Black police troopers from Michigan were awardedmillion in a racialdiscrimination lawsuit against their department A string of horrific Fergusonmurders that gained widespread coverage resulted in Police Chief TomJacksons resignation and put Delrish Mossin front Black Chief OfFergusons Police A Step For System Improvement I Black Matters BlackMatters,33.73,https://www.facebook.com/Black-Matters-1579673598947501/,123.0,11.0,05/13/16 06:54:06 AM PDT,,,2016-05-13
1255,265,Six years later and still no justice for Aiyana Stanley JonesOn Maya peaceful rally will be held in Detroit outside the ColemanA Young Municipal Center to remember Aiyana and all victims of policebrutality,1.461,https://www.facebook.com/Black-Matters-1579673598947501/,1264.0,79.0,05/19/16 04:36:50 AM PDT,Detroit Michigan,Michigan,2016-05-19
1256,266,She only allowed her son to drive a golf cart A beautiful family who alwaystake a yearly vacation at the luxury resort on Bald Head Island met a horribleexperience this year as soon as they met with polic Mom Brutalized AndJailed For Presumptuous Child Abuse I Black Matters Black Matters,439.92,https://www.facebook.com/Black-Matters-1579673598947501/,325.0,19.0,05/24/16 07:44:29 AM PDT,Detroit Michigan,Michigan,2016-05-24
1257,268,President Obama signed bill HR modernizing terms relating tominorities into law Friday Over the years the minority have been lookeddown upon illtreated teased by peers and felt inferior due to their historicalbackground In the st century Negro Oriental and Indian To BeAbated From All Federal Laws I Black Matters Black Matters,424.8,https://www.facebook.com/Black-Matters-1579673598947501/,340.0,24.0,05/24/16 07:43:49 AM PDT,Detroit Michigan,Michigan,2016-05-24
1258,269,Thevote would ban the display of the Confederate flag on flagpolesat VA cemeteries Due to the meaning and what the Confederate flag standsfor The House last Thursday voted to ban its display on flagpoles at Veterans,0.0,https://www.facebook.com/Black-Matters-1579673598947501/,0.0,0.0,05/24/16 07:43:26 AM PDT,Detroit Michigan,Michigan,2016-05-24
1259,270,Ummmmm did you just not want ME to sit next to you Former NBA basketball player Etan Thomas writes about a woman who refused to allow him sitnext to her on a train Thomas explains that he politely and softly NBA StarConfronts Racist Woman On A Train I Black Matters Black Matters,568.74,https://www.facebook.com/Black-Matters-1579673598947501/,718.0,89.0,05/23/16 08:19:17 AM PDT,Detroit Michigan,Michigan,2016-05-23
1260,271,Police watch three black Florida teenagers drown in a pond after chasingthem for an alleged stolen car Natasha Winkler who is the mother of LaniyaMiller one of the three teens who drowned in a pond in St Petersburg Flafter a police chase on Marchsaid t Black Moms say Cops Watched TheirDaughters Drown Without Doing Anything I Black Matters Black Matters,152.39,https://www.facebook.com/Black-Matters-1579673598947501/,130.0,10.0,05/23/16 08:17:29 AM PDT,Detroit Michigan,Michigan,2016-05-23
1261,273,A new research shows that blacks are more likely to be diagnosed withdepression and schizophrenia disorders than whites The study which waspublished by the Psychiatric Services journal analyzed medical records ofpatients from the Mental Health Research Network One of the co MoreBlacks Are Diagnosed With Schizophrenia But Few Are Treated I BlackMatters Black Matters,85.33,https://www.facebook.com/Black-Matters-1579673598947501/,57.0,5.0,05/23/16 08:06:15 AM PDT,Detroit Michigan,Michigan,2016-05-23
1262,274,A black man found hanged on a tree still no investigation initiated The bodyof a yearold Atlanta resident was discovered in the territory of the forestnot far from Richmond Road and Park East Drive Beachwood Ohio The blOhio Authorities Keep Their Eyes Shut At KKKstyle Death I Black MattersBlack Matters,65.51,https://blackmattersus.com/8347-ohio-authorities-keep-their-eyes-shut-at-kkk-,74.0,11.0,05/25/16 12:32:02 AM PDT,Detroit Michigan,Michigan,2016-05-25
1263,275,Government and mainstream media have absolutely abandoned citizens inthe Flint Water Crisis Its getting to ages already since the Flint water crisisstarted which was caused by government officials failing to treat domesticand drinking water But it Activists Give Aid To Flint Residents Once AgainBlack Matters Black Matters,236.66,https://www.facebook.com/Black-Matters-1579673598947501/,2389.0,182.0,06/01/16 06:07:32 AM PDT,,,2016-06-01
1264,276,Join us on June th to honor the memory of the Charleston shooting victimsShare this please Help us spread the message,106.18,https://www.facebook.com/Black-Matters-1579673598947501/,1624.0,241.0,06/01/16 06:07:10 AM PDT,,,2016-06-01
1265,277,The Independent Police Review AuthorityIPRA plans soon to releaseevidence of Chicago police shootings and misconducts Many Chicagoresidents are worried that this summer will be full of violence between copsand community members as the IPRA which investigates allegations of pWhat Will Happen If the IPRA Releases Evidence On Police Actions I BlackMatters Black Matters,32.15,https://www.facebook.com/Black-Matters-1579673598947501/,120.0,8.0,06/01/16 06:05:58 AM PDT,,,2016-06-01
1266,278,The instruction on how to start a revolution from the creator of Occupy WallStreet Micah White Micah White is an extraordinary person The onlyAmerican creator of the Occupy Wall Street movement the former editor of,1181.17,https://www.facebook.com/Black-Matters-1579673598947501/,8069.0,396.0,06/17/16 01:23:56 AM PDT,,,2016-06-17
1267,279,Black victims of Orlando massacre need our help as some of them strugglingto raise money for medical treatment gofundme We all know about thehorrible tragedy happened early Sunday Junein Orlando gay nightclubcalled Pulse The whole country mourns and prays for the innocen OrlandoBlack Victims Need Support I Black Matters Black Matters,1300.0,https://blackmattersus.com/9599-orlando-black-victims-need-support/,6540.0,701.0,06/17/16 01:23:01 AM PDT,,,2016-06-17
1268,280,I wish I could have saved more to be honest said a brave exmarine whohad savedpeople during Orlando nightclub shooting Many witnesses ofOrlando shooting said that they mistook the gunfire for the part of the showLuckily Imran Yousuf a yearold Hindu who left the Marine C War VeteranOf Color Saves Dozens During Orlando Shooting Media Remains SilentBlack Matters Black Matters,1000.0,https://www.facebook.com/Black-Matters-1579673598947501/,7803.0,735.0,06/17/16 01:20:58 AM PDT,,,2016-06-17
1269,281,They could have shot him in the arm or leg somewhere where he could dropand still be alive NYPD officers in Bronx were responding to an alert fromshot spotter when they found Rashaun Lloyd around the same area the alertwas coming from They claim th NYPD Shoot Mentally III Black ManTimesBlack Matters Black Matters,349.45,https://www.facebook.com/Black-Matters-1579673598947501/,4293.0,602.0,06/22/16 03:41:13 AM PDT,,,2016-06-22
1270,284,When a Black man is shot dead the world will know about every little secrethe had It is obvious that every time a Black man is killed all his secretes andmistakes will be all over the internet The media goes in search of all hiscriminal rBlacks Sterling and Castile Are Now Subject To Intense ScrutinyBlack Matters Black Matters,0.0,https://www.facebook.com/Black-Matters-1579673598947501/,0.0,0.0,07/17/16 11:01:34 AM PDT,,,2016-07-17
1271,285,White Privilege is everywhere even in auto Insurance A new report publishedby AutolnsuranceQuotecom shows that Black Americans pay hundreds ofdollars more for car insurance than whites According to the resear StudyBlack Car Owners Pay More For Auto Insurance Than Whites I Black MattersBlack Matters,500.0,https://www.facebook.com/Black-Matters-1579673598947501/,4909.0,608.0,07/22/16 02:41:17 AM PDT,,,2016-07-22
1272,286,New video released shows police officer assaulting Black female teacherduring a routine traffic stop in Austin Black schoolteacher Breaion Kingwas stopped by the white police officer Bryan Richter on Junefordrivingmph in amph zone However the Video Officer Hurls BlackWoman During Traffic Stop I Black Matters Black Matters,500.0,https://www.facebook.com/Black-Matters-1579673598947501/,6747.0,694.0,07/22/16 02:40:08 AM PDT,,,2016-07-22
1273,289,The City of Somerville stands against all violence and all injustice which iswhy a Black Lives Matter banner hangs at City Hall Mayor JosephCurtatone of Somerville Massachusetts boldly said he wont remove BlackLives Matter banner from the City Hall after the local police union askedMassachusetts Mayor Refuses To Remove BLM Banner From City HallBlack Matters Black Matters,472.11,https://www.facebook.com/Black-Matters-1579673598947501/,4975.0,618.0,07/25/16 07:19:27 AM PDT,,,2016-07-25
1274,290,Now after eight police officers were killed in Dallas and Baton RougeLouisiana the Ku Klux Klan targets Black activist groups The racist andviolent KKK group was distributing fliers in Georgia County calling onresidents to join them and terrorize Black people in response to the BLM KKKRecruits Supremacists After Recent Killings Of Police Officers I Black MattersBlack Matters,446.85,https://www.facebook.com/Black-Matters-1579673598947501/,6768.0,1098.0,07/25/16 07:19:08 AM PDT,,,2016-07-25
1275,291,All Black rallies meetings and protests are now in one place Search for ameetup in your area to attend Create your own meetup and get it promotedto more thanpeople for free BlackMattersUS has been organizingmeetups all over the USA for some time now Some of our meetups like NotMy Heritage rally against the symbols of racism an NEW OnBlackMattersUS All Black Protest Meetups In One Place I Black MattersBlack Matters,799.28,https://www.facebook.com/Black-Matters-1579673598947501/,9918.0,741.0,08/05/16 07:10:10 AM PDT,,,2016-08-05
1276,292,We take into account every piece of opinion you come up with We believe inyour exquisite views Join us as we share our opinions on segregationBlacks Black voices must be echoed Your opinion matters Discriminationis a hellhound that gnaws at Negroes in every waking moment of their lives toremind them that the lie of their inferiority is accepted as truth Take Part InBlack Segregation Survey I Black Matters Black Matters,827.03,https://www.facebook.com/Black-Matters-1579673598947501/,8946.0,791.0,08/05/16 06:51:21 AM PDT,,,2016-08-05
1277,293,A new BlackMattersUS tool gathers all the Black meetups in one placeNow you can keep track of and organize ALL the Black meetups in one placeWe are glad to be the first and only platform that provides this opportunity Forthose who want to make real changes we offer a convenient search of theupcoming and past events For the organizers we suggest the free promotionof your events to more thanof eventgoers via all the social mediaAll copyrights remain with original ownersNow it is easy to search for a meetup in your area,811.08,https://www.facebook.com/blackmattersus/,11393.0,1591.0,08/05/16 08:12:30 AM PDT,,,2016-08-05
1278,294,Maybe the most talented gymnast Ive ever seen in my life former goldmedalist Mary Lou Retton said A BlackAmerican teenage girl Simone Bilesis making history in the world of gymnastics She istimes reigning worldchampion and hasgold medals at the i Black Teen Wins More WorldChampionship Medals Than Any American Woman I Black Matters BlackMatters,601.0,https://www.facebook.com/Black-Matters-1579673598947501/,9628.0,1890.0,08/10/16 02:29:13 AM PDT,,,2016-08-10
1279,295,MOVE heroes need your supportThose who fought for Black rights were wrongfully sentenced to a maximumofyears in prison for the crime they never committed They sacrificedtheir lives for our chance to have a better future Now they feel forgotten andthink that their lives were spent in vain Dont let them think that we forgotabout their job and deeds Lets unite and send them our message of supportto jail Take part in our flash mobCreate the messagePost it with the hashtag BMOVESend us the link,866.98,https://www.facebook.com/blackmattersus/,8822.0,782.0,08/10/16 12:32:13 AM PDT,,,2016-08-10
1280,296,FLASHMOB BMOVE Send in your words of support to the fighters forBlack lives The Move Organization You are the one who can restore thebelief that their efforts were not useless Back ina whole villageinhabited by members of a Philadelphiabased black liberation group theMOVE was totally destroyed by a bomb attack organized by Take Part InFlashmob BE MOVEBlack Matters Black Matters,1000.0,https://www.facebook.com/Black-Matters-1579673598947501/,12232.0,1298.0,08/09/16 07:38:53 AM PDT,,,2016-08-09
1281,297,Every piece of opinion you give counts in our survey Take part in our Blackbusiness survey todayA mans success in business today turns upon hispower of getting people to believe he has something they want GerlandStanley Powered byTypeform Thank yo Do You Support Black BusinessBlack Matters Black Matters,380.78,https://www.facebook.com/Black-Matters-1579673598947501/,3569.0,322.0,08/10/16 08:30:22 AM PDT,,,2016-08-10
1282,298,Augustmarks a twoyear anniversary of the brutal murder of MichaelBrown anRally In Memory Of Mike Brown,6.105,https://www.facebook.com/events/309180056094025/,29689.0,1969.0,07/28/16 06:40:40 AM PDT,New York,New York,2016-07-28
1283,299,Augustmarks a twoyear anniversary of the brutal murder of MichaelBrown anRally In Memory Of Mike Brown,7.533,https://www.facebook.com/events/309180056094025/,14949.0,1042.0,08/04/16 07:23:59 AM PDT,Los Angeles California,California,2016-08-04
1284,300,A new BlackMattersUS tool gathers all the Black meetups in one placeNow you can keep track of and organize ALL the Black meetups in one placeWe are glad to be the first and only platform that provides this opportunity Forthose who want to make real changes we offer a convenient search of theupcoming and past events For the organizers we suggest the free promotionof your events to more thanof eventgoers via all the social mediaAll copyrights remain with original ownersNow it is easy to search for a meetup in your area,2.05,https://www.facebook.com/blackmattersus/,3.0,0.0,08/05/16 07:25:00 AM PDT,,,2016-08-05
1285,301,A new BlackMattersUS tool gathers all the Black meetups in one placeNow you can keep track of and organize ALL the Black meetups in one placeWe are glad to be the first and only platform that provides this opportunity Forthose who want to make real changes we offer a convenient search of theupcoming and past events For the organizers we suggest the free promotionof your events to more thanof eventgoers via all the social mediaAll copyrights remain with original ownersNow it is easy to search for a meetup in your area,0.0,https://www.facebook.com/blackmattersus/,0.0,0.0,08/05/16 06:52:42 AM PDT,,,2016-08-05
1286,302,Stand up South Carolina Lets stop the propaganda of hate and whitesupremacy Not My Heritage,0.0,https://www.facebook.com/events/I 730167210590258/,0.0,0.0,07/21/16 01:07:46 AM PDT,South Carolina,South Carolina,2016-07-21
1287,303,White supremacists are planning to raise the racist flag again The stateofficials ordere Not My Heritage,822.74,https://www.facebook.com/events/I 730167210590258/,1239.0,58.0,06/29/16 06:11:58 AM PDT,South Carolina,South Carolina,2016-06-29
1288,304,White supremacists are planning to raise the racist flag again The stateofficials ordere Not My Heritage,3626.22,https://www.facebook.com/events/1730167210590258/,12125.0,665.0,06/30/16 01:17:16 AM PDT,South Carolina,South Carolina,2016-06-30
1289,305,White supremacists are planning to raise the racist flag again The stateofficials ordere Not My Heritage,6495.7,https://www.facebook.com/events/I 730167210590258/,30994.0,1367.0,07/05/16 03:40:13 AM PDT,South Carolina,South Carolina,2016-07-05
1290,306,George Zimmerman hopes to fetch at leastfor the gun he used tofatally shot unarmed teen Trayvon Martin inWe cant make up ourminds on how one can arrogantly display the executing of a human being asan act of pride Its disheartening to see when a bloody murder Officer PutsHis Gun He Used In Killing Black Teen On Auction I Black Matters BlackMatters,200.0,https://blackmattersus.com/7868-officer-puts-his-gun-he-used-in-killing-black-,690.0,66.0,05/13/16 06:41:26 AM PDT,,,2016-05-13
1291,307,A rally in loving memory of Aiyana JonesMaymarked the sixth anniversary of the brutal slaying of yearold AiyanaStanleyJones by Detroit Police Officer Joe Weekley She was shot by thecop while she slept on a couch during a botched raid The killer is stillemployed by the Detroit Police Department He was charged with involuntarymanslaughter and two lesser charges in her death but the case was droppedin JanuaryJustice hasnt been served for Aiyana and her grieving familyWere planning a peaceful rally in front of the Coleman A Young MunicipalCenter on Mayto honor the memory of Aiyana and other victims of policeviolence and demand demilitarization of police We should draw as muchattention as possible to the lack of justice for the families of those who losttheir beloved ones at the hands of the policeInvite everyone you know and join us on MayWe should stand up for the better future of our kids The th Anniversary OfThe Aiyana Jones Death,5326.68,https://www.facebook.com/events/17275196241840501,58081.0,4010.0,04/30/16 08:50:57 AM PDT,Detroit Michigan,Michigan,2016-04-30
1292,308,A study by the National Home Education Research Institute shows thatapproximatelyblack students are currently homeschooling in theUS Increasing number of Black families now prefer to teach their children athome rather than to send them to public schools The simple cause for this isracism Black Families Embark On Homeschooling Because Of Racial BiasAnd Safety Concerns I Black Matters Black Matters,1.03,https://blackmattersus.com/7474-black-families-embark-on-homeschooling-,5.0,0.0,04/30/16 08:52:12 AM PDT,,,2016-04-30
1293,309,We finally made it Welcome to the official Black Matters Website,141.81,https://www.facebook.com/blackmattersus/,197.0,15.0,03/10/16 05:50:56 AM PST,New York,New York,2016-03-10
1294,310,As what happened to India while in police custody remains a major concernmany are wondering why the yearold was denied an appropriate medicalevaluation and proper care The frequent reports of police brutality andextreme use of force leading to death has regrettably become a daily courseConsequently protests and demonstrations overflow in every nook andcranny demanding answers and justice On FebruaryIndia T Cummingswas under the influence of the synth JusticeForindia Yearold DeniedMedical Treatment Dies in Police Custody I Black Matters Black Matters,0.0,https://www.facebook.com/Black-Matters-1579673598947501/,0.0,0.0,03/04/16 12:41:08 AM PST,New York,New York,2016-03-04
1295,313,NovemberIs the One year anniversary Death ofyear old TamirRice killed by two Cleveland Police Officers Timothy Loehmann and FrankGarmback You are welcome Join the meeting A Year Without Justice forTamir Rice,0.0,https://www.facebook.com/events/1 486230091674577/,0.0,0.0,11/19/15 11:51:19 PM PST,Cleveland Ohio,Ohio,2015-11-19
1296,314,A Year Without Justice for Tamir Rice Join the meeting A Year WithoutJustice for Tamir Rice,0.0,https://www.facebook.com/events/I 486230091674577/,0.0,0.0,11/19/15 11:27:57 PM PST,Cleveland Ohio,Ohio,2015-11-19
1297,315,NovemberIs the One year anniversary Death ofyear old TamirRice killed by two Cleveland Police Officers Timothy Loehmann and FrankGarmback You are welcome Join the meeting,0.0,,,,11 /19/15 11 :21 :05 PM PST,Cleveland Ohio,Ohio,
1298,316,Why I March JusticeOrElseyears agoyears a million men women and children gathered on theNational Mall in Washington DC answering the call from Minister LouisFarrakhan to come to the nations capital and show our strength in numbersand unity and remind politicians that our voices would be heardyearslater we return to call on our politicians to fix our broken criminal justicesystem once and for allI march to fix a system that houses more black men in our prison system thanthere were black men enslaved inTo fix a system that allows for localprosecutors to investigate their friends at the police department when there isan officerinvolved shooting To fix a system that has drug laws thatdisproportionately arrest black and brown people for using drugs when whitepeople use at the same rate To fix a system that has built a private industryoff the backs of prisoners laboring for pennies To fix a system that doesntvideo record the actions of law enforcement at all times To fix a system thatcriminalizes young women who are pimped and sexually trafficked beforethey even turnTo fix a system that does not collect any national data onincidents when police use excessive force or discharge their firearm To fix asystem that has incarcerated more people than any other nation in the worldTo fix a system that has created a school to prison pipeline by harsher schooldiscipline practices for young students of color To fix a system of policing thattargets communities of color by programs like StopFrisk or BrokenWindowsThis is why I march This is why we all should march in order to build a betterfuture for our kids We should fight the institutional racism in the countryLike and share if you want to help the movement,3.82,https://www.facebook.com/Black-Matters-1 579673598947501/,58.0,2.0,10/06/15 06:44:30 AM PDT,Baltimore Maryland Missouri Cleveland Ohio,Maryland Missouri Ohio,2015-10-06
1299,317,Mass Shooting At Umpqua Community College In OregonReported DeadTen people were killed and seven were wounded Thursday in a shooting at asmall community college in Roseburg Oregon The shooting took place inclassrooms in Snyder HallLaw enforcement officials have identified Chris Harper Mercer as the manresponsible for the mass shootingHe had four weapons on himthreehandguns and one assault weapon Also he was definitely ready to put up afight because he had body armor and stash of ammunitionOne of the witnesses said that the gunman first asked about peoplesreligions before he began firingThe hospital said that all victims were female between the ages ofandand quoted a doctor who said that an army of doctors and nurses hadvolunteered to helpIts the th shooting at a school so far this year Obama said that America isthe only country on Earth that sees these kinds of mass shootings every fewmonths And hes right People already got used to this Isnt it time for somegun control yetSome white supremacists say that the killer was mixed and he supportedBLM This information is not confirmed and is more likely to be fake Thisdude is definitely not black His parents are Caucasian The fact its been afew hours since the shooting and they havent say what race he is means heswhite And honestly word shooting isnt used correctly here Can we call itterror Oh wait White male thoughUCC Oregon shooting,598.82,https://www.facebook.com/Black-Matters-1579673598947501/,4925.0,709.0,10/02/15 07:28:43 AM PDT,Baltimore Maryland Missouri Cleveland Ohio,Maryland Missouri Ohio,2015-10-02
1300,319,Fastgrowing black community Latest news and everyday updates,0.0,https://www.facebook.com/Black-Matters-1579673598947501/,0.0,0.0,07/13/15 07:12:00 AM PDT,Atlanta Georgia Maryland Missouri Virginia,Georgia Maryland Missouri Virginia,2015-07-13
1301,320,Fastgrowing black community Latest news and everyday updates,199.71,https://www.facebook.com/Black-Matters-1579673598947501/,432.0,20.0,07/13/15 07:20:58 AM PDT,Atlanta Georgia Maryland Missouri Virginia,Georgia Maryland Missouri Virginia,2015-07-13
1302,321,Fastgrowing black community Latest news and everyday updates,0.0,https://www.facebook.com/Black-Matters-1579673598947501/,0.0,0.0,07/13/15 07:12:24 AM PDT,Atlanta Georgia Maryland Missouri Virginia,Georgia Maryland Missouri Virginia,2015-07-13
1303,322,Fastgrowing black community Latest news and everyday updates,254.91,https://www.facebook.com/Black-Matters-1579673598947501/,444.0,19.0,07/13/15 07:20:58 AM PDT,Atlanta Georgia Maryland Missouri Virginia,Georgia Maryland Missouri Virginia,2015-07-13
1304,323,Join us because we care Black Matters,0.0,https://www.facebook.com/blackmattersus/,0.0,0.0,07/13/15 07:16:57 AM PDT,Atlanta Georgia Maryland Missouri Virginia,Georgia Maryland Missouri Virginia,2015-07-13
1305,324,Join us because we care Black Matters,0.0,https://www.facebook.com/blackmattersus/,0.0,0.0,07/13/15 07:16:58 AM PDT,Atlanta Georgia Maryland Missouri Virginia,Georgia Maryland Missouri Virginia,2015-07-13
1306,325,Californiaknows how to partyCaliforniaknows how to partyIn the citaaay of LAIn the citaaay of good of WattsIn the citaaay the city of ComptonWe keep it rockin We keep it rockinPacCalifornia Love,45.94,https://www.facebook.com/Black-Matters-1579673598947501/,326.0,4.0,06/10/15 07:34:52 AM PDT,Baltimore Maryland Missouri Cleveland Ohio,Maryland Missouri Ohio,2015-06-10
1307,326,Sinceoverof our lives have been taken at the hands of policeThose lives of which were made to be worthless because of our race Eachtime we die many of your people and those who stand by you justify thetaking of our lives because they believe we are not human and are notworthy of lifeWhy should we be a target for police violence and harassment,99.97,https://www.facebook.com/Black-Matters-1579673598947501/,1478.0,517.0,06/11/15 0113:16 AM PDT,Baltimore Maryland Missouri Cleveland Ohio,Maryland Missouri Ohio,2015-06-11
1308,327,Just like Trayvon Martin race mattered for Amadou Diallo Oscar GrantSean Bell Emmett Till and thousands more we will never know the name ofwho died because of their skin colorAngela DavisRacism is still alive in the USA,34.77,https://www.facebook.com/Black-Matters-1579673598947501/,125.0,7.0,06/11/15 06:51:30 AM PDT,Baltimore Maryland Missouri Cleveland Ohio,Maryland Missouri Ohio,2015-06-11
1309,328,Race war started by Texas teacherA Texas fourthgrade teacher Karen Fitzgibbons published a racial Facebookpost in which she confirmed that Black people are responsible for racialtensions in the USA Moreover she claimed that she is almost to the pointof defending the segregation After her post about the recent pool partyincident drew local attention the teacher deleted her profileThis makes me ANGRY This officer should not have had to resign Imgoing to just go ahead and say itthe blacks are the ones causing theproblems and this racial tension I guess thats what happens when youflunk out of school and have no education Im sure their parents are just asguilty for not knowing what their kids were doing or knew it and didnt careshe wrote She also addedIm almost to the point of wanting them allsegregated on one side of town so they can hurt each other and leave theinnocent people alone Maybe the s and s were really on to somethingNow let the bashing of my true and honest opinion beginGOimnotracistimsickofthemcausingtrouble itwasagatedcommunityAs we see Karen Fitzgibbons is a real racist who approves the humiliation ofblack people This news clearly reflects that American society is close tocollapse if not to say to war As the authorities are doing nothing to resolvethe situation in the near future we may face real race war within our country,31.54,https://www.facebook.com/Black-Matters-1579673598947501/,168.0,17.0,06/11/15 07:03:58 AM PDT,Baltimore Maryland Missouri Cleveland Ohio,Maryland Missouri Ohio,2015-06-11
1310,329,The image ofshows several African American Youths dangling aroundthe stairs leading up to the back entrance of a segregated movie theater inAnniston AlabamaThat day the Tarzan film Call of the Savage was shown,90.65,https://www.facebook.com/Black-Matters-1579673598947501/,482.0,18.0,06/15/15 07:21:33 AM PDT,Baltimore Maryland Missouri Cleveland Ohio,Maryland Missouri Ohio,2015-06-15
1311,330,American Racists On The RoadThe racists group of America Back To The Blue are organizing a hate rallyin response to the public outcry and protests against police officersBikerspatriots want to descend on the McKinney Police HQ in a show ofsolidarity for the police because racebaiters and cophaters They plan tohave the biggest thing to happen in Patriot Movement since the BundyRanch victoryIt seems like we wont get into postracial America this event and theregular murder of innocent Black children by white supremacist police andcitizens makes that clear The modern government has brought racistAmerica to the forefront good or bad This is something that America has aserious issue withRACISMIs it time to call out the national guard,88.45,https://www.facebook.com/Black-Matters-1579673598947501/,524.0,24.0,06/15/15 07:22:00 AM PDT,Baltimore Maryland Missouri Cleveland Ohio,Maryland Missouri Ohio,2015-06-15
1312,331,Free Figures Black Power Rally at VCU,90.86,https://www.facebook.com/Black-Matters-1579673598947501/,764.0,43.0,06/15/15 07:21:47 AM PDT,Baltimore Maryland Missouri Cleveland Ohio,Maryland Missouri Ohio,2015-06-15
1313,332,A woman pretended AfroAmerican to gain control over black communityassociationThe president of a local NAACP chapter in Spokane Washington is underinvestigation after her parents publicly accused her of lying being AfricanAmerican Both parents of Rachel Dolezal are white Rachel Dolezal alsoserves as the chair of Spokanes Office of Police Ombudsman Commissionand is an adjunct professor of Africana Studies at Eastern WashingtonUniversity Dolezal falsely identified herself as AfricanAmerican in order to beappointed as a chair Dolezals parents paid attention to the officialdocuments including a birth certificate confirming that Rachel is partSwedish Czech and German with traces of Native American heritageWe see how whites are trying to gain control over traditionally blackorganization that protects the rights and interests of the black community Inthe Dolezals case it is unlikely it was a mistake or personally motivatedfraud Simply she was given a task to join the association of black communityin order to control it and hold the interests of white majorityWe need a deep inspection of Rachel Dolezals activities while she was apresident of the local branch of the Association of black people In order not torepeat similar cases in future we need a careful control of all appointments byblack community As it is there is a dominance of whites in policedepartments and authorities of cities with a predominantly black population,89.51,https://www.facebook.com/Black-Matters-1579673598947501/,676.0,47.0,06/15/15 07:22:20 AM PDT,Baltimore Maryland Missouri Cleveland Ohio,Maryland Missouri Ohio,2015-06-15
1314,333,Pac believed in FightTupac Shakur was indeed not just one of the greatest rappers of all time but aworldly icon whose status in hiphop culture can never be replaced Hisrevolutionary knowledge mixed with street experience made him powerfulunstoppable force that spoke to the hearts of millions of people His songstouch on a number of engaging topics including religion women oppressionetc Pac was a humanitarian who stood up for those who couldnt stand upfor themselves He believed in Fight and Speaking the TruthNowadays a lot of singers both black and white use their music to sellrecords just for making money American society at all levels became toocorruptive starting from our government and ending with ordinary citizens Onthe contrary Tupac did his music to influence the world Thats why he spoketo issues of poverty oppression and racismToday young AfricanAmericans have fallen under bad influence of moneydrugs and so on Yeah it is all started from the governments attitudetowards Blacks But lets remember Tupac and his ability to question thesocial order Changes one of his popular songs asks everyone to changetheir lifestyles for better society He always asked people to share with eachother and to learn to love each other,174.4,https://www.facebook.com/Black-Matters-1579673598947501/,1075.0,47.0,06/16/15 07:36:57 AM PDT,Baltimore Maryland Missouri Cleveland Ohio,Maryland Missouri Ohio,2015-06-16
1315,334,Today we celebrate the legendary rapper who ever lived Happy BdayTupacThe greatest of all time rapper is known not only for his music but for the wisewords he spoke and his strength in standing up against oppression His realname was Lesane Parish Crooks Shakur was onlyyears old at the timehe was shot and killed inHis killer has never been caught We willnever forget Pac Today we remember him on what wouldve been his thBirthday,90.07,https://www.facebook.com/Black-Matters-1579673598947501/,153.0,10.0,06/16/15 07:37:14 AM PDT,Baltimore Maryland Missouri Cleveland Ohio,Maryland Missouri Ohio,2015-06-16
1316,335,It is an American history AfricanAmerican citizens sat behind signs like theseon city buses,84.15,https://www.facebook.com/Black-Matters-1579673598947501/,476.0,26.0,06/16/15 08:20:31 AM PDT,Baltimore Maryland Missouri Cleveland Ohio,Maryland Missouri Ohio,2015-06-16
1317,336,Americans so much effort to hate each other instead of putting the effort intodoing something useful Stop racism We all belong to ONE HUMAN RACE,175.37,https://www.facebook.com/Black-Matters-1579673598947501/,745.0,42.0,06/17/15 07:41:34 AM PDT,Baltimore Maryland Missouri Cleveland Ohio,Maryland Missouri Ohio,2015-06-17
1318,337,No national outrage for an incident at pool party where a black teen was shotto deathToday the pool party in Georgia is even more shocking than a recent poolparty in Texas A young man from Georgia was shot to death at a pool partyat Fayette It was an advertised on socialteenagers pool party whichended up with shootings of unknown assailant for unknown reasons One ofthe five injured a yearold black teenager Clanton passed away on theway to hospitalIn fact the media has not made a transparent effort to cover up the incidentWhy the pool party in Georgia is a silent story Why the police was not awareof a large party Why this story has no national outrage Is it ok when a blackteenager diesUnfortunately the responding police officers were not able to prevent thetragedy From these facts one might conclude police officers know theeasiest ways to arrest people but they are irresponsible to avoid theshootings at the average pool party,175.31,https://www.facebook.com/Black-Matters-1579673598947501/,746.0,23.0,06/17/15 07:41:07 AM PDT,Baltimore Maryland Missouri Cleveland Ohio,Maryland Missouri Ohio,2015-06-17
1319,338,A yearold child was tasered by cop for skateboardingA San Diego sheriffs deputy was filmed tasering yearold child in thespine for skateboarding Witnesses reported that the cop tried to force them todelete videos from their phones Videos show how the child writhes in agonyfrom being tased Police said that the child ran away from home and wasmissing for a dayandhalf However it doesnt give the reason to taser achildWe see another case of police misconduct when the policeman actuallyattacked the child This case should reach the court because the child hasntdone anything unlawful The policeman exceeded his powers and used forceagainst a child So he should be punished Before the trial nothings gonnachange and cops are about to do whatever they want The task of allAmericans who have witnessed police brutality is to extend all the informationabout it in order to reach out the government and the court,270.36,https://www.facebook.com/Black-Matters-1579673598947501/,1290.0,97.0,06/17/15 07:41:46 AM PDT,Baltimore Maryland Missouri Cleveland Ohio,Maryland Missouri Ohio,2015-06-17
1320,339,Onlydays this year nobody was killed by policeAccording to data from Mapping Police Violence there are onlydays thiscalendar year when nobody was killed by police in the USA Since Januaryat leastpeople have now been killed by policemen Moreoveranalyzing all deaths caused by police AfricanAmerican and Hispanic peopleare more likely to be killed than Whites Figures show that the index of deathsfor black people isper million while for whites it isper million,248.56,https://www.facebook.com/Black-Matters-1579673598947501/,1005.0,55.0,06/17/15 07:42:02 AM PDT,Baltimore Maryland Missouri Cleveland Ohio,Maryland Missouri Ohio,2015-06-17
1321,340,In early s this Black Americana Chocolate Eyes,169.47,https://www.facebook.com/Black-Matters-1579673598947501/,844.0,21.0,06/17/15 07:45:33 AM PDT,Baltimore Maryland Missouri Cleveland Ohio,Maryland Missouri Ohio,2015-06-17
1322,341,Sadness and shocking tragedy at historically black church in CharlestoneCLICK TO GET LIVE UPDATES ON OUR PAGEA white gunman opened a fire at pastor andother church members at blackchurch in Charlestone S on Wednesday night The young cleanshavedshooter walked in during a prayer meeting and started shooting the peopleCharleston Police Chief Greg Mullen said that the incident would beinvestigated as hate crimeEmanuel AME Church is a historically AfricaAmerican church which wasfound by Denmark Vesey in order to organize a slave revolt inDespite the first black American president AfricaAmericans remain the mostcommon victims of hate crimes But what if the hate crime relates toxenophobia American xenophobia is based on the dominant white heritagethat is giving birth to another form of hate and discrimination These formstake another level of hate Unfortunately American tolerance is not what wethink it is US public is swapping patriotism for nationalism tolerance forIslamophobia racism and antiimmigrant sentiment For instance lastFebruary American gunman killed three young Muslims two miles away fromthe University of North Carolina campus Was this gunman motivated by hateand intolerance Should we expect for more hatecrimesWhat if American racial change still occurs through generations What of itracism happens due to unequal opportunities What if America is still adeeply racist country What if the church is not a safe place anymoreCharlestonShooting chsnews,1295.48,https://www.facebook.com/Black-Matters-1579673598947501/,5072.0,274.0,06/18/15 04:36:59 AM PDT,Baltimore Maryland Missouri Cleveland Ohio,Maryland Missouri Ohio,2015-06-18
1323,342,Rachel Dolezal is wearing the other persons shoesRachel Dolezal drew attention to her racial identification A whiteborn formerNAACP leader claimed to be black The criticism towards Dolezal stemscontroversy around her identity and her position as the president of theNAACP in Washington Today Dolezal sees herself as first transracialRachel Dolezal stated that her racial identity was black American Indianwhite and two more races Moreover if she proves that she is black thananyone else will be able to prove that heshe is not even a human beingWhat do you think about her What kind of rights should she have,199.94,https://www.facebook.com/Black-Matters-1579673598947501/,866.0,46.0,06/18/15 02:50:25 AM PDT,Baltimore Maryland Missouri Cleveland Ohio,Maryland Missouri Ohio,2015-06-18
1324,343,The violent pool storyWhite police officer slammed black teen against hiscarThis black family from Ohio will never forget the June th According to thefamilys testimony Krystal Dixon and her sister Maya Dixon took their eightchildren nephews and nieces to Ohio public school in a FairfieldNevertheless the pool employee demanded the family to leave due to one ofthe children did not have swim trunks One of the boys broke the rules andthe staff asked the family to leave As sixmonths pregnant Krystal Dixonwalked to the parking lot the police officer grabbed her arm and asked for anIDcard The witness video shows how the police officer pepper sprayedDixons family and grabbed yearold child by neck But according to theFairfield police department the white police officer did not use excessiveforceDid the pool staff force them to leave because they were black Was it a racefactor Dont you think the police officers attempt to arrest Krystal Dixon wasunlawful How the police officers should be charged What kind of right ofdefense do you have against unlawful arrestsThese days there is far more to being a good cop than choosing not to hurtinnocent people Plus when are we going to stop being stereotypical Eventoday the stereotypes effect black population of the United States of Americatransmitted through music lyrics titles literature movies and folk sayingWhite Americans across the country embrace AfricanAmericans the image ofcriminals and looters How are we going to live with that,91.73,https://www.facebook.com/Black-Matters-1 579673598947501/,441.0,31.0,06/18/15 07:21:41 AM PDT,Baltimore Maryland Missouri Cleveland Ohio,Maryland Missouri Ohio,2015-06-18
1325,344,What else has to happen for you all to realize black lives matter,173.92,https://www.facebook.com/Black-Matters-1579673598947501/,708.0,59.0,06/23/15 07:41:01 AM PDT,Baltimore Maryland Missouri Cleveland Ohio,Maryland Missouri Ohio,2015-06-23
1326,345,Thousands Walk Hand In Hand Across Ravenel Bridge To Show Support ForMother Emanuel ChurchOn Sunday evening hours after Emanuel AME Church opened its doors forthe first service following the killing of nine of its congregants Wednesdaythousands in Charleston took to the streets in a show of support andsolidarityObservers on the bridge and thousands more at the base joined hands tocreate a unity chain then held a moment of silence that lasted five minutesin honor of the fallenPolice estimated thattotook part in Sundays gatheringaccording to the Post and Courier Cars drove slowly past the bridge taking inthe sight and honking horns in solidarity as people chanted CharlestonstrongThroughout history people start to unite only when they face danger or whentheyre in times of great sorrow Modern America is accustomed to meet onlyimaginary dangers however Americans are getting more and more reasonsto sorrow over something day by dayDoes it mean that the key to the unity ofmillion Americans is constantfear and unending sorrow Does it mean that only this can make Americansunite and forget about the infighting and differences Unfortunately yes itdoes,258.89,https://www.facebook.com/Black-Matters-1579673598947501/,759.0,48.0,06/23/15 07:41:21 AM PDT,Baltimore Maryland Missouri Cleveland Ohio,Maryland Missouri Ohio,2015-06-23
1327,346,Whatever the white man has done Black Americans have done and ofteneven betterMiss Black America in,174.35,https://www.facebook.com/Black-Matters-1579673598947501/,757.0,65.0,06/23/15 07:41:58 AM PDT,Baltimore Maryland Missouri Cleveland Ohio,Maryland Missouri Ohio,2015-06-23
1328,347,How many of you believe in Black JesusThere is quite a big number of people arguing about ethnicity of Jesus ChristWas Jesus white oliveskinned or black The Coptic Museum in Cairo Egyptowns the earliest painting of Jesus Christ in the Church of Rome th centurywhere skin color of Jesus was black,174.26,https://www.facebook.com/Black-Matters-1579673598947501/,581.0,57.0,06/23/15 07:42:12 AM PDT,Baltimore Maryland Missouri Cleveland Ohio,Maryland Missouri Ohio,2015-06-23
1329,348,Black is beautiful God knows what he is doing The Black skin is a glorioussymbol of national greatness,174.02,https://www.facebook.com/Black-Matters-1579673598947501/,796.0,74.0,06/23/15 07:42:35 AM PDT,Baltimore Maryland Missouri Cleveland Ohio,Maryland Missouri Ohio,2015-06-23
1330,349,A small group of activists burned two confederate flags in response toshooting in Charleston South CarolinaWhy the symbol of the proslavery rebellion is still flying on the ground ofSouth Carolina Why the symbol of white supremacy is still flying on theSouth Carolina statehouse in Columbia Why the flag that represents themurder of blacks was not removed from the national statehouseThe confederate flag represents terrorism reminding us about the slaverytime racism and people that were murdered in a hatecrime Today we askto remove this symbol of racism that fliesmiles away from the EmanuelAfrican Methodist Episcopal Church in CharlestonYes we must wipe off every single symbol of racism from the United States ofAmerica including the confederate flag KKK and other racist organizationsWe must give new names to the streets which were named after racistpolitical figures and slave traders We must remove monuments dedicated toAndrew Jackson Robert Lee Benjamin Huger James Longstreet who ownedslaves on their farmsHow can we ever expect to get the racist symbols removed until we showourselves to be men the same as any other race of men,174.75,https://www.facebook.com/Black-Matters-1 579673598947501/,412.0,23.0,06/23/15 07:42:57 AM PDT,Baltimore Maryland Missouri Cleveland Ohio,Maryland Missouri Ohio,2015-06-23
1331,350,Whats life of black American today How equal are weHave you ever been hurt by aggressive police officers because of your raceWhats your storyTake an action and tell us your story and we post it on Black Matters Wedont want our community to continue struggling with racism and policeaggression We want to fight back and to show how strong we are,188.85,https://www.facebook.com/Black-Matters-1579673598947501/,504.0,42.0,07/10/15 05:42:38 AM PDT,Baltimore Maryland Missouri Cleveland Ohio,Maryland Missouri Ohio,2015-07-10
1332,351,Even kids realize that black lives matter Why are adults so blind then Racialinequality should be stopped by any means,116.2,https://www.facebook.com/Black-Matters-1579673598947501/,506.0,50.0,07/10/15 05:43:10 AM PDT,Baltimore Maryland Missouri Cleveland Ohio,Maryland Missouri Ohio,2015-07-10
1333,352,Dont tell us race isnt the issueDont tell us the system worksStop being blind people,117.17,https://www.facebook.com/Black-Matters-1579673598947501/,402.0,47.0,07/10/15 05:43:31 AM PDT,Baltimore Maryland Missouri Cleveland Ohio,Maryland Missouri Ohio,2015-07-10
1334,353,Nothing really changes Everything remains the sameBeing black is awesome its being black in America that sucks,90.36,https://www.facebook.com/Black-Matters-1579673598947501/,327.0,46.0,07/10/15 05:43:55 AM PDT,Baltimore Maryland Missouri Cleveland Ohio,Maryland Missouri Ohio,2015-07-10
1335,354,There are people who generally believe racism is over but minorities believethat theres a lot of racial discrimination in the United States of AmericaThousands of African Americans experience discrimination due to inequalitywhich results cultural failure and racial pathology Do you realize that racismsits at the very core of American thinking,146.63,https://www.facebook.com/Black-Matters-1579673598947501/,281.0,24.0,07/10/15 05:44:38 AM PDT,Baltimore Maryland Missouri Cleveland Ohio,Maryland Missouri Ohio,2015-07-10
1336,355,Keep calm and remember your roots Dont let the government to take it awayfrom you,67.76,https://www.facebook.com/Black-Matters-1579673598947501/,345.0,47.0,07/10/15 05:44:21 AM PDT,Baltimore Maryland Missouri Cleveland Ohio,Maryland Missouri Ohio,2015-07-10
1337,356,Such a beautiful day Such a beatiful view,18.1,https://www.facebook.com/pages/L-for-life/994910227187446,162.0,3.0,06/09/15 05:57:56 AM PDT,,,2015-06-09
1338,357,McKinney Police Officer Involved In Pool Party IncidentEric Casebolt the McKinney police officer who was caught on video pinninga teenage girl to the ground and pulling his gun on others at a pool party hasresigned Tuesday eveningThe McKinney Police Department Chief Of Police Greg Conley said thatCasebolts decision to leave was voluntary and that he would continue tocollect a pension and benefitsWhy are the police so aggressive Its in every state around the country Theyoung girl at the pool party was treated horrible Our society needs policegood police people who will solve crimes but unfortunately today we needsomeone who will protect us from the police At the same time it is good thatmillions of regular people got a glimpse of what kind of policing minoritieshave endured for decades,85.25,https://www.facebook.com/Black-Matters-1579673598947501/,559.0,12.0,06/10/15 07:31:35 AM PDT,Baltimore Maryland Missouri Cleveland Ohio,Maryland Missouri Ohio,2015-06-10
1339,358,Say it loudI am Black and Im proud,94.04,https://www.facebook.com/Black-Matters-1579673598947501/,635.0,45.0,06/10/15 07:34:31 AM PDT,Baltimore Maryland Missouri Cleveland Ohio,Maryland Missouri Ohio,2015-06-10
1340,359,Police Charges Black Student For Driving To A Welllit AreaLast time I checked US wasnt involved in any wars or antiterroristoperations at least officially Well then how come Detroit is no lessdangerous then the city ranks third in the list of topUS most dangerouscitiesWhen yearold DaJuawn Wallace saw flashing blue police lights in hisrearview mirror he chose to proceed with caution since some people areknown to be robbed by fake police officers He preferred to find a welllit areato pull over in As a result he was charged with fleeing policePeople are terrified by the police to such a degree that they even prefer tocommunicate with officers only in the welllit areas And get charged for thatSometimes it makes me actually think that when not involved in any militaryoperations in the foreign countries our countrys at war with its own citizenswith the help of police,180.82,https://www.facebook.com/Black-Matters-1579673598947501/,1078.0,139.0,07/10/15 05:45:02 AM PDT,Baltimore Maryland Missouri Cleveland Ohio,Maryland Missouri Ohio,2015-07-10
1341,360,Keeping eye on our brothers cases and much more,0.0,https://www.facebook.com/blackmattersus,0.0,0.0,06/10/15 03:01:20 AM PDT,Baltimore Maryland Missouri,Maryland Missouri,2015-06-10
1342,361,Keeping eye on our brothers cases and much more,34.66,https://www.facebook.com/blackmattersus/,82.0,5.0,06/10/15 03:20:43 AM PDT,Baltimore Maryland Missouri,Maryland Missouri,2015-06-10
1343,362,Keeping eye on our brothers cases and much more,0.0,https://www.facebook.com/blackmattersus/,0.0,0.0,07/02/15 03:10:36 AM PDT,Atlanta Georgia Baltimore Maryland Missouri Richmond Virginia,Georgia Maryland Missouri Virginia,2015-07-02
1344,363,Keeping eye on our brothers cases and much more,0.0,https://www.facebook.com/blackmattersus,0.0,0.0,06/10/15 03:01:20 AM PDT,Baltimore Maryland Missouri,Maryland Missouri,2015-06-10
1345,364,Keeping eye on our brothers cases and much more,12858.46,https://www.facebook.com/blackmattersus/,46447.0,2740.0,06/10/15 03:29:48 AM PDT,Baltimore Maryland Missouri,Maryland Missouri,2015-06-10
1346,365,Keeping eye on our brothers cases and much more,3544.99,https://www.facebook.com/blackmattersus/,13502.0,547.0,07/02/15 03:10:36 AM PDT,Atlanta Georgia Baltimore Maryland Missouri Richmond Virginia,Georgia Maryland Missouri Virginia,2015-07-02
1347,366,Keeping eye on our brothers cases and much more,50.11,https://www.facebook.com/Black-Matters-1579673598947501/,158.0,0.0,06/10/15 03:01:19 AM PDT,Baltimore Maryland Missouri,Maryland Missouri,2015-06-10
1348,367,Keeping eye on our brothers cases and much more,0.0,https://www.facebook.com/Black-Matters-1579673598947501/,0.0,0.0,07/02/15 03:10:36 AM PDT,Atlanta Georgia Baltimore Maryland Missouri Richmond Virginia,Georgia Maryland Missouri Virginia,2015-07-02
1349,368,Join us because we care Black matters,0.0,https://www.facebook.com/blackmattersus,0.0,0.0,06/10/15 02:59:59 AM PDT,Baltimore Maryland Missouri,Maryland Missouri,2015-06-10
1350,369,Join us because we care Black matters,13704.02,https://www.facebook.com/Black-Matters-1579673598947501/,56408.0,3296.0,06/10/15 03:27:28 AM PDT,Baltimore Maryland Missouri,Maryland Missouri,2015-06-10
1351,370,Join us because we care Black matters,1294.75,https://www.facebook.com/Black-Matters-1579673598947501/,3716.0,177.0,07/02/15 03:10:36 AM PDT,Atlanta Georgia Baltimore Maryland Missouri Richmond Virginia,Georgia Maryland Missouri Virginia,2015-07-02
1352,371,Join us because we care Black matters,0.0,https://www.facebook.com/blackmattersus,0.0,0.0,06/10/15 02:59:57 AM PDT,Baltimore Maryland Missouri,Maryland Missouri,2015-06-10
1353,372,Join us because we care Black matters,7018.96,https://www.facebook.com/Black-Matters-1579673598947501/,26442.0,1574.0,06/10/15 03:30:17 AM PDT,Baltimore Maryland Missouri,Maryland Missouri,2015-06-10
1354,373,Join us because we care Black matters,440.12,https://www.facebook.com/Black-Matters-1579673598947501/,1343.0,71.0,07/02/15 03:10:36 AM PDT,Atlanta Georgia Baltimore Maryland Missouri Richmond Virginia,Georgia Maryland Missouri Virginia,2015-07-02
1355,375,Join us because we care Black matters,0.0,https://www.facebook.com/Black-Matters-1579673598947501/,0.0,0.0,07/02/15 03:10:36 AM PDT,Atlanta Georgia Baltimore Maryland Missouri Richmond Virginia,Georgia Maryland Missouri Virginia,2015-07-02
1356,376,Your life matterMy life matter Black matters,0.0,https://www.facebook.com/blackmattersus,0.0,0.0,06/10/15 02:58:57 AM PDT,Baltimore Maryland Missouri,Maryland Missouri,2015-06-10
1357,377,Your life matterMy life matter Black matters,85.63,https://www.facebook.com/Black-Matters-1579673598947501/,249.0,7.0,06/10/15 03:31:26 AM PDT,Baltimore Maryland Missouri,Maryland Missouri,2015-06-10
1358,378,Your life matterMy life matter Black matters,0.0,https://www.facebook.com/Black-Matters-1579673598947501/,0.0,0.0,07/02/15 03:10:36 AM PDT,Atlanta Georgia Baltimore Maryland Missouri Richmond Virginia,Georgia Maryland Missouri Virginia,2015-07-02
1359,379,Your life matterMy life matter Black matters,0.0,https://www.facebook.com/blackmattersus,0.0,0.0,06/10/15 02:58:56 AM PDT,Baltimore Maryland Missouri,Maryland Missouri,2015-06-10
1360,380,Your life matterMy life matter Black matters,69.56,https://www.facebook.com/Black-Matters-1579673598947501/,207.0,7.0,06/10/15 03:30:43 AM PDT,Baltimore Maryland Missouri,Maryland Missouri,2015-06-10
1361,381,Your life matterMy life matter Black matters,0.0,https://www.facebook.com/Black-Matters-1579673598947501/,0.0,0.0,07/02/15 03:10:36 AM PDT,Atlanta Georgia Baltimore Maryland Missouri Richmond Virginia,Georgia Maryland Missouri Virginia,2015-07-02
1362,382,Your life matterMy life matter Black matters,50.16,https://www.facebook.com/Black-Matters-1579673598947501/,157.0,2.0,06/10/15 02:58:54 AM PDT,Baltimore Maryland Missouri,Maryland Missouri,2015-06-10
1363,383,Your life matterMy life matter Black matters,0.0,https://www.facebook.com/Black-Matters-1579673598947501/,0.0,0.0,07/02/15 03:10:36 AM PDT,Atlanta Georgia Baltimore Maryland Missouri Richmond Virginia,Georgia Maryland Missouri Virginia,2015-07-02
1364,384,We really can change the world if we stay united,0.0,https://www.facebook.com/blackmattersus,0.0,0.0,06/10/15 02:58:20 AM PDT,Baltimore Maryland Missouri,Maryland Missouri,2015-06-10
1365,385,We really can change the world if we stay united,25.87,https://www.facebook.com/Black-Matters-1579673598947501/,66.0,3.0,06/10/15 03:28:34 AM PDT,Baltimore Maryland Missouri,Maryland Missouri,2015-06-10
1366,386,We really can change the world if we stay united,0.0,https://www.facebook.com/Black-Matters-1579673598947501/,0.0,0.0,07/02/15 03:10:36 AM PDT,Atlanta Georgia Baltimore Maryland Missouri Richmond Virginia,Georgia Maryland Missouri Virginia,2015-07-02
1367,387,We really can change the world if we stay united,0.0,https://www.facebook.com/blackmattersus,0.0,0.0,06/10/15 02:58:20 AM PDT,Baltimore Maryland Missouri,Maryland Missouri,2015-06-10
1368,388,We really can change the world if we stay united,105.62,https://www.facebook.com/Black-Matters-1579673598947501/,311.0,8.0,06/10/15 03:21:09 AM PDT,Baltimore Maryland Missouri,Maryland Missouri,2015-06-10
1369,389,We really can change the world if we stay united,0.0,https://www.facebook.com/Black-Matters-1579673598947501/,0.0,0.0,07/02/15 03:10:36 AM PDT,Atlanta Georgia Baltimore Maryland Missouri Richmond Virginia,Georgia Maryland Missouri Virginia,2015-07-02
1370,390,We really can change the world if we stay united,65.61,https://www.facebook.com/Black-Matters-1579673598947501/,204.0,4.0,06/10/15 02:58:18 AM PDT,Baltimore Maryland Missouri,Maryland Missouri,2015-06-10
1371,391,We really can change the world if we stay united,0.0,https://www.facebook.com/Black-Matters-1579673598947501/,0.0,0.0,07/02/15 03:10:36 AM PDT,Atlanta Georgia Baltimore Maryland Missouri Richmond Virginia,Georgia Maryland Missouri Virginia,2015-07-02
1372,392,Black matters because everyones life matters,0.0,https://www.facebook.com/blackmattersus,0.0,0.0,06/10/15 02:58:03 AM PDT,Baltimore Maryland Missouri,Maryland Missouri,2015-06-10
1373,393,Black matters because everyones life matters,56.53,https://www.facebook.com/Black-Matters-1579673598947501/,191.0,2.0,06/10/15 03:22:04 AM PDT,Baltimore Maryland Missouri,Maryland Missouri,2015-06-10
1374,394,Black matters because everyones life matters,0.0,https://www.facebook.com/Black-Matters-1579673598947501/,0.0,0.0,07/02/15 03:10:36 AM PDT,Atlanta Georgia Baltimore Maryland Missouri Richmond Virginia,Georgia Maryland Missouri Virginia,2015-07-02
1375,395,Black matters because everyones life matters,0.0,https://www.facebook.com/blackmattersus,0.0,0.0,06/10/15 02:58:01 AM PDT,Baltimore Maryland Missouri,Maryland Missouri,2015-06-10
1376,396,Black matters because everyones life matters,83.22,https://www.facebook.com/Black-Matters-1579673598947501/,250.0,7.0,06/10/15 03:27:56 AM PDT,Baltimore Maryland Missouri,Maryland Missouri,2015-06-10
1377,397,Black matters because everyones life matters,0.0,https://www.facebook.com/Black-Matters-1579673598947501/,0.0,0.0,07/02/15 03:10:36 AM PDT,Atlanta Georgia Baltimore Maryland Missouri Richmond Virginia,Georgia Maryland Missouri Virginia,2015-07-02
1378,398,Black matters because everyones life matters,38.89,https://www.facebook.com/Black-Matters-1579673598947501/,136.0,1.0,06/10/15 02:58:00 AM PDT,Baltimore Maryland Missouri,Maryland Missouri,2015-06-10
1379,399,Black matters because everyones life matters,0.0,https://www.facebook.com/Black-Matters-1579673598947501/,0.0,0.0,07/02/15 03:10:36 AM PDT,Atlanta Georgia Baltimore Maryland Missouri Richmond Virginia,Georgia Maryland Missouri Virginia,2015-07-02
1380,400,We can be heard only when we stand together Black matters,0.0,https://www.facebook.com/blackmattersus,0.0,0.0,06/10/15 02:57:12 AM PDT,Baltimore Maryland Missouri,Maryland Missouri,2015-06-10
1381,401,We can be heard only when we stand together Black matters,74.07,https://www.facebook.com/Black-Matters-1579673598947501/,203.0,4.0,06/10/15 03:26:57 AM PDT,Baltimore Maryland Missouri,Maryland Missouri,2015-06-10
1382,402,We can be heard only when we stand together Black matters,0.0,https://www.facebook.com/Black-Matters-1579673598947501/,0.0,0.0,07/02/15 03:10:36 AM PDT,Atlanta Georgia Baltimore Maryland Missouri Richmond Virginia,Georgia Maryland Missouri Virginia,2015-07-02
1383,403,We can be heard only when we stand together Black matters,0.0,https://www.facebook.com/blackmattersus,0.0,0.0,06/10/15 02:57:12 AM PDT,Baltimore Maryland Missouri,Maryland Missouri,2015-06-10
1384,404,We can be heard only when we stand together Black matters,77.74,https://www.facebook.com/Black-Matters-1579673598947501/,248.0,6.0,06/10/15 03:21:36 AM PDT,Baltimore Maryland Missouri,Maryland Missouri,2015-06-10
1385,405,We can be heard only when we stand together Black matters,0.0,https://www.facebook.com/Black-Matters-1579673598947501/,0.0,0.0,07/02/15 03:10:36 AM PDT,Atlanta Georgia Baltimore Maryland Missouri Richmond Virginia,Georgia Maryland Missouri Virginia,2015-07-02
1386,406,We can be heard only when we stand together Black matters,45.72,https://www.facebook.com/Black-Matters-1579673598947501/,160.0,1.0,06/10/15 02:57:10 AM PDT,Baltimore Maryland Missouri,Maryland Missouri,2015-06-10
1387,407,We can be heard only when we stand together Black matters,0.0,https://www.facebook.com/Black-Matters-1579673598947501/,0.0,0.0,07/02/15 03:10:36 AM PDT,Atlanta Georgia Baltimore Maryland Missouri Richmond Virginia,Georgia Maryland Missouri Virginia,2015-07-02
1388,408,AfricanAmerican soldiers played a decisive role in the US Army on thewestern frontier during the Plains Wars but its not mentioned in our historybooks,189.05,https://www.facebook.com/Black-Matters-1579673598947501/,636.0,60.0,06/24/15 06:12:24 AM PDT,Baltimore Maryland Missouri Cleveland Ohio,Maryland Missouri Ohio,2015-06-24
1389,409,Cornel West on ObamaThe First Black President Has Become The FirstNiggerized Black PresidentReacting to President Obamas use of the nword on Marc Marons podcastCornel West called him the first niggerized president in an appearance onCNN West criticized Obama as a person who is afraid and intimidated whenit comes to putting a spotlight on white supremacyA niggerized black person is a black person who is afraid and scared andintimidated when it comes to putting a spotlight on white supremacy andfighting against white supremacy West explained So when many of us saidwe have to fight against racism what were we toldNo he cant deal withracism because he has other issues political calculations Hes the presidentof all America not just black America We know hes president of all Americabut white supremacy is American as cherry pieWest is right as usual African minorities would choose Mr West inandinstead of Obama But we had no choice Cornel is a good leader heknows what black community is suffering from Obama was promoted by bigcorporations owned by white people Obama never tried to protect blacksfrom police pressure never tried to stop police violence against blacks Justcount how many black lives were destroyed during his presidency Thenumber is horrific,0.0,https://www.facebook.com/Black-Matters-1 579673598947501/,0.0,0.0,06/24/15 06:03:43 AM PDT,Baltimore Maryland Missouri Cleveland Ohio,Maryland Missouri Ohio,2015-06-24
